number,value,params_dino_pipeline.clustering.clusterer.method,params_dino_pipeline.clustering.clusterer.n_neighbors,params_dino_pipeline.clustering.feature_processing.normalizer.method,params_dino_pipeline.clustering.feature_processing.reducer.method,params_dino_pipeline.clustering.feature_processing.reducer.n_components,params_dino_pipeline.clustering.feature_processing.run_normalization,params_dino_pipeline.clustering.feature_processing.run_reduction,params_dino_pipeline.clustering.k_selection.method,params_extractors.clip.layer_name,params_extractors.clip.model_name,params_extractors.dino_v2.layer_name,params_extractors.dino_v2.model_name,params_extractors.resnet.layer_name,params_extractors.resnet.model_name,params_fusion_pipeline.clustering.k_selection.k_source,params_heuristic_settings.filter_params.filter_min_area_perc,params_heuristic_settings.filter_params.nms_iou_threshold,params_heuristic_settings.filter_params.use_nms,params_heuristic_settings.generator_params.min_mask_region_area,params_heuristic_settings.generator_params.points_per_side,params_heuristic_settings.generator_params.pred_iou_thresh,params_heuristic_settings.generator_params.stability_score_thresh,params_heuristic_settings.k_heuristic_formulas.max_k,params_heuristic_settings.k_heuristic_formulas.semantic_base,params_heuristic_settings.k_heuristic_formulas.semantic_scale_factor,params_heuristic_settings.k_heuristic_formulas.structural_multiplier,params_heuristic_settings.sam_model,params_labeler.aggregation_method,params_labeler.aggregation_top_k_perc,params_labeler.top_n_labels,params_resnet_pipeline.clustering.clusterer.method,params_resnet_pipeline.clustering.clusterer.n_neighbors,params_resnet_pipeline.clustering.feature_processing.normalizer.method,params_resnet_pipeline.clustering.feature_processing.reducer.method,params_resnet_pipeline.clustering.feature_processing.reducer.n_components,params_resnet_pipeline.clustering.feature_processing.run_normalization,params_resnet_pipeline.clustering.feature_processing.run_reduction,params_resnet_pipeline.clustering.k_selection.method,params_resnet_pipeline.image_preprocessing.blur_kernel_size,params_resnet_pipeline.image_preprocessing.clahe_clip_limit,params_resnet_pipeline.image_preprocessing.sobel_kernel_size,params_resnet_pipeline.image_preprocessing.use_clahe,params_resnet_pipeline.image_preprocessing.use_gaussian_blur,params_resnet_pipeline.image_preprocessing.use_grayscale,params_resnet_pipeline.image_preprocessing.use_sobel_edges,params_run_dino_pipeline,params_run_fusion_pipeline,params_run_resnet_pipeline,params_validator_settings.final_threshold,params_validator_settings.semantic_threshold,params_validator_settings.structural_threshold,params_validator_settings.weights.clip_confidence,params_validator_settings.weights.dino_iou,params_validator_settings.weights.resnet_iou,state,user_attrs_error,user_attrs_max_clip_confidence,user_attrs_num_correct_segments
38,0.0,graph,32,z-score,svd,42,False,True,silhouette,transformer.resblocks.10,ViT-B/32,blocks.7,dinov2_vitb14,layer2,resnet50,structural,0.006740165214652616,0.8110096440889508,False,200,32,0.8783873928820719,0.9411108923281132,26,4,0.8122628507304996,1.845416370217614,facebook/sam2-hiera-large,mean,0.2773243035046591,5,graph,37,root-norm,umap,16,False,True,silhouette,,2.8168853647945866,5,True,False,True,False,True,True,True,0.7154563762814606,0.5347262670578639,0.525726492525385,0.08602246018106313,0.7533050697224108,0.3795132216607325,COMPLETE,,0.0,0
39,0.0,kmeans,12,l2,umap,37,True,False,heuristic,transformer.resblocks.11,ViT-B/32,blocks.4,dinov2_vitb14,layer3,resnet50,semantic,0.007903845585509845,0.7467520622788627,True,100,16,0.9467746680692769,0.928351039189685,30,3,0.8910400651820983,2.6301739329299942,facebook/sam2-hiera-large,top_k_mean,0.10138714195126258,5,kmeans,32,z-score,svd,31,True,False,heuristic,7.0,1.2758827418428047,3,False,True,True,True,False,True,False,0.5596884247409101,0.634258538004685,0.7163588361762294,0.5267955123600611,0.8411925255385894,0.5018019142004019,COMPLETE,,0.0,0
40,0.0,graph,25,root-norm,pca,18,False,True,silhouette,transformer.resblocks.9,ViT-B/32,blocks.11,dinov2_vitb14,layer1,resnet50,structural,0.003846114634447074,0.6936886137318692,False,50,8,0.9023566742687221,0.9508994270209933,19,2,0.9582793471027613,2.5100600444456793,facebook/sam2-hiera-large,mean,0.21894780345612,3,graph,28,z-score,umap,58,False,True,silhouette,3.0,3.254211511984116,5,True,True,False,False,True,False,True,0.6552524312294348,0.7222820542207334,0.4701928999998981,0.8154630536538481,0.4761113203419438,0.205896931924881,COMPLETE,,0.0,0
41,0.0,kmeans,22,root-norm,pca,29,True,False,silhouette,transformer.resblocks.9,ViT-B/32,blocks.11,dinov2_vitb14,layer3,resnet50,structural,0.00905718592125246,0.8282888182141306,True,200,8,0.9095506186858889,0.9044452270192782,30,4,0.6848361660074981,2.8741959601854337,facebook/sam2-hiera-large,top_k_mean,0.4370971329331813,3,graph,18,z-score,pca,46,True,True,silhouette,,2.209435942356607,3,False,False,False,False,True,False,False,0.5237702487310841,0.6998852395286196,0.4264594416996169,0.23975772342777302,0.9329205519737019,0.990691063949502,COMPLETE,,0.0,0
42,0.0,kmeans,16,root-norm,pca,34,True,False,silhouette,transformer.resblocks.9,ViT-B/32,blocks.11,dinov2_vitb14,layer3,resnet50,structural,0.009570871707701562,0.8376354251367588,True,200,8,0.9318341632039018,0.921834452574356,29,4,0.5500822561502559,2.7737309699669224,facebook/sam2-hiera-large,top_k_mean,0.39346679630565706,3,graph,16,z-score,pca,44,True,True,silhouette,,3.7458916499540478,3,False,False,False,False,True,False,False,0.615541671061349,0.7284542254766473,0.40409962506900343,0.13195000052211503,0.8926790584172869,0.9195245951189669,COMPLETE,,0.0,0
43,0.0,kmeans,20,root-norm,pca,31,True,False,silhouette,transformer.resblocks.9,ViT-B/32,blocks.11,dinov2_vitb14,layer3,resnet50,structural,0.0062539893498082715,0.8114177271000698,True,200,8,0.9722729113250592,0.9140041435083677,28,4,0.581645253824789,2.937998217664987,facebook/sam2-hiera-large,top_k_mean,0.37688770914276426,3,graph,26,z-score,pca,43,True,True,silhouette,,2.9328387160678133,3,False,False,False,False,False,False,False,0.6878545071323937,0.6823040375209916,0.45238844201473194,0.20332681482010548,0.9993567785336858,0.8613310803272922,COMPLETE,,0.0,0
92,0.0,kmeans,22,z-score,umap,19,False,True,silhouette,transformer.resblocks.10,ViT-B/32,blocks.7,dinov2_vitb14,layer1,resnet50,semantic,0.009787382321796781,0.7223888731635811,False,200,32,0.8256057380898886,0.9160347733698739,23,2,0.6845468850521065,2.6385756331640278,facebook/sam2-hiera-large,mean,0.4003967399211117,5,kmeans,23,l2,umap,61,True,True,silhouette,5.0,2.7523349487502875,3,True,True,True,True,True,True,False,0.6841221262702816,0.7436472862382765,0.6797841873791682,0.03670841084348059,0.734832849517141,0.3880012256997265,COMPLETE,,0.0,0
93,0.0,kmeans,23,z-score,umap,26,False,True,silhouette,transformer.resblocks.10,ViT-B/32,blocks.7,dinov2_vitb14,layer1,resnet50,semantic,0.008506833454464945,0.801607361330573,False,200,32,0.8504673401662456,0.9504532914210889,26,2,0.5604553795341498,2.1379327940627486,facebook/sam2-hiera-large,mean,0.4583788648387764,5,kmeans,19,l2,umap,48,True,True,silhouette,5.0,2.2061849635338593,3,True,True,True,True,True,True,False,0.6650437678491976,0.4507170364320294,0.5267324624815003,0.5333590456818178,0.9415861685401743,0.18189957786234762,COMPLETE,,0.0,0
94,0.0,kmeans,26,z-score,svd,20,False,True,silhouette,transformer.resblocks.10,ViT-B/32,blocks.7,dinov2_vitb14,layer1,resnet50,semantic,0.002782381430322023,0.6225162326931648,False,200,32,0.8397856052044672,0.9708243916277092,25,2,0.6208610383592849,2.4652976509924582,facebook/sam2-hiera-large,mean,0.3685054339388152,5,kmeans,21,l2,umap,45,True,True,silhouette,5.0,2.572289097471403,3,True,True,True,True,True,True,False,0.6047168634148405,0.7042401243046625,0.6498949794133082,0.14447813325332115,0.9651163270933482,0.7110223143575304,COMPLETE,,0.0,0
95,0.0,graph,24,z-score,umap,16,False,True,silhouette,transformer.resblocks.11,ViT-B/32,blocks.11,dinov2_vitb14,layer2,resnet50,semantic,0.009011565490584635,0.8436633752733397,True,50,32,0.8571130862460787,0.9352665428051851,24,2,0.5820117497971017,2.8039500804642277,facebook/sam2-hiera-large,mean,0.35416639084986407,5,kmeans,17,z-score,pca,27,True,True,silhouette,3.0,1.9442869224793802,3,True,True,True,True,True,True,True,0.6475494501913315,0.6408698177545556,0.42455904783456033,0.009301815856517986,0.8098842152882393,0.34656690154935493,COMPLETE,,0.0,0
96,0.0,kmeans,27,l2,pca,37,True,False,heuristic,transformer.resblocks.10,ViT-B/32,blocks.7,dinov2_vitb14,layer3,resnet50,semantic,0.006886973928237085,0.8307422659601109,False,200,8,0.8443265021599489,0.923827633492508,16,4,0.7388556385915455,2.3187626400598504,facebook/sam2-hiera-large,top_k_mean,0.33328498927364936,3,kmeans,20,z-score,umap,63,False,False,heuristic,5.0,2.181052353023894,5,False,True,False,False,True,False,False,0.534628192478698,0.6964369983703411,0.7005035286068694,0.11064854726348228,0.9020114854897869,0.42305931631789684,COMPLETE,,0.0,0
97,0.0,graph,24,z-score,svd,51,False,True,silhouette,transformer.resblocks.11,ViT-B/32,blocks.11,dinov2_vitb14,layer1,resnet50,structural,0.0072264452800323495,0.8354513185151998,True,100,32,0.8244063710119323,0.9052817622289842,30,3,0.6466262024253033,2.2127746222611853,facebook/sam2-hiera-large,mean,0.3861374851107823,5,graph,11,l2,svd,37,True,True,silhouette,,2.2972130303202385,3,True,False,False,True,False,True,False,0.7072382226133721,0.5749743097365282,0.5665136386885641,0.18424212208131913,0.26922117833703824,0.5279452438352545,COMPLETE,,0.0,0
98,0.0,graph,40,root-norm,pca,63,True,False,heuristic,transformer.resblocks.9,ViT-B/32,blocks.4,dinov2_vitb14,layer3,resnet50,semantic,0.008104863073761539,0.7404030452181761,True,50,16,0.9127200912948301,0.9482455597952378,24,4,0.6012648892579366,1.8887829303136987,facebook/sam2-hiera-large,median,0.21082168782338095,3,kmeans,24,z-score,pca,31,False,False,heuristic,3.0,2.0491767481985588,5,True,True,True,False,True,False,False,0.6227540911898491,0.49576902858999455,0.4630787185190523,0.6002449775625156,0.7761586722669527,0.8747098589781328,COMPLETE,,0.0,0
99,0.0,kmeans,17,z-score,umap,48,True,True,silhouette,transformer.resblocks.10,ViT-B/32,blocks.7,dinov2_vitb14,layer4,resnet50,semantic,0.004198426255946953,0.815593378297318,False,200,8,0.8992261749310353,0.9298895072556189,27,2,0.8166746926482598,2.957397509098649,facebook/sam2-hiera-large,mean,0.1422820997174468,3,graph,22,z-score,umap,20,False,True,silhouette,7.0,2.972055825670931,3,False,True,False,False,True,True,True,0.5463855727411266,0.5589044692770178,0.6587452858910711,0.06712029054478451,0.8433210012455147,0.12610573426201988,COMPLETE,,0.0,0
84,0.0,graph,32,root-norm,umap,49,False,False,heuristic,transformer.resblocks.10,ViT-B/32,blocks.4,dinov2_vitb14,layer3,resnet50,structural,0.009244649759219304,0.6498579642605591,True,50,32,0.9533057079764022,0.9388123530799959,28,3,0.8474809567708876,2.3239848704270942,facebook/sam2-hiera-large,top_k_mean,0.3153246653563518,3,kmeans,32,l2,svd,35,True,False,heuristic,,1.760909654729402,3,False,False,False,True,False,True,False,0.6430914100246274,0.4312748197731797,0.46031071337837975,0.22608482836993285,0.8265959085482998,0.4845117915971742,COMPLETE,,0.0,0
85,0.0,graph,37,root-norm,svd,18,False,False,heuristic,transformer.resblocks.11,ViT-B/32,blocks.11,dinov2_vitb14,layer3,resnet50,structural,0.009999960723745538,0.6767580957314062,False,50,32,0.9659531918582106,0.9460495613005613,30,4,1.0074839962856563,1.9617329581367653,facebook/sam2-hiera-large,median,0.30329245393681253,5,kmeans,25,z-score,umap,22,True,False,heuristic,,1.6380923360852595,5,False,False,False,True,False,True,True,0.6708718543821435,0.4670332604853851,0.41880799585431455,0.09585080328404103,0.04337704842895915,0.5211812954816305,COMPLETE,,0.0,0
86,0.0,graph,35,l2,pca,53,False,True,silhouette,transformer.resblocks.10,ViT-B/32,blocks.7,dinov2_vitb14,layer1,resnet50,structural,0.008825765570622408,0.6645078458449443,True,200,8,0.9666038262415528,0.9090996709480721,25,3,0.846033934450435,2.7264506290032,facebook/sam2-hiera-large,top_k_mean,0.3697527051024591,3,kmeans,40,z-score,svd,17,False,True,heuristic,3.0,2.896869678537307,3,True,True,False,False,True,False,False,0.5005927585373726,0.4809385099627508,0.4736874985661435,0.7100667875293283,0.6829637001292568,0.09764084645475414,COMPLETE,,0.0,0
87,0.0,kmeans,39,z-score,umap,45,True,False,heuristic,transformer.resblocks.11,ViT-B/32,blocks.11,dinov2_vitb14,conv1,resnet50,semantic,0.009666228876257404,0.818155231388826,True,50,32,0.9402122087946871,0.9755901068687921,27,4,1.1686769057888546,2.4815841319649836,facebook/sam2-hiera-large,mean,0.38143990348744483,3,graph,35,z-score,pca,63,True,False,silhouette,7.0,1.3081789117271967,5,False,True,True,False,False,True,False,0.6315991767143911,0.6013843344985137,0.6731625920241016,0.2667222710994799,0.1417858253106376,0.6089261261836298,COMPLETE,,0.0,0
88,0.0,graph,14,root-norm,svd,21,True,True,silhouette,transformer.resblocks.9,ViT-B/32,blocks.7,dinov2_vitb14,layer3,resnet50,semantic,0.003781678510332607,0.6981712344789232,False,200,16,0.8155271318418718,0.9667750753785131,29,3,0.5959097366782379,1.7906443054329544,facebook/sam2-hiera-large,top_k_mean,0.4169052080218269,5,graph,28,root-norm,umap,38,False,True,heuristic,,1.8792767774848007,3,True,False,False,True,True,False,True,0.6543291593049605,0.6739499434150533,0.4349596002025083,0.35164359770513365,0.37511819452812867,0.9681134013342982,COMPLETE,,0.0,0
89,0.0,graph,29,l2,pca,59,False,False,heuristic,transformer.resblocks.10,ViT-B/32,blocks.11,dinov2_vitb14,layer1,resnet50,structural,0.009348299903810444,0.7086848984377063,True,100,8,0.8373041132373937,0.9198746057481458,28,4,0.7121465788582779,2.5486725537083315,facebook/sam2-hiera-large,mean,0.3423888185903592,3,kmeans,38,l2,svd,45,True,False,silhouette,3.0,1.481555343109063,3,True,True,False,False,False,True,False,0.7991156061086733,0.4252004441535447,0.6362548502660973,0.14992832834320002,0.22301762569990985,0.7855099893449655,COMPLETE,,0.0,0
90,0.0,kmeans,19,z-score,umap,23,True,True,silhouette,transformer.resblocks.11,ViT-B/32,blocks.4,dinov2_vitb14,layer4,resnet50,semantic,0.0018756606803137655,0.6465342557965534,False,200,16,0.8067422762956403,0.9566554071944123,22,2,0.9771657044975095,2.208589131078541,facebook/sam2-hiera-large,median,0.25781146451302417,3,graph,32,z-score,umap,42,False,True,heuristic,7.0,4.776337654353705,5,False,True,False,False,True,False,False,0.7437684150678147,0.7178208145180901,0.40093900479291533,0.6223415212189909,0.922376760847132,0.8443382382721639,COMPLETE,,0.0,0
91,0.0,kmeans,21,z-score,umap,17,False,True,silhouette,transformer.resblocks.10,ViT-B/32,blocks.7,dinov2_vitb14,layer1,resnet50,semantic,0.009541004464881628,0.8273727112920041,False,200,32,0.8334112113330084,0.9423141132030458,24,2,0.6347254247387992,2.402069373413653,facebook/sam2-hiera-large,mean,0.4314506912401856,5,kmeans,21,l2,umap,41,True,True,silhouette,5.0,2.4096306184978724,3,True,True,True,True,True,True,False,0.7743118745103474,0.7346497302261233,0.6659679166584535,0.07074409322966047,0.8761495880984677,0.479596194984707,COMPLETE,,0.0,0
76,0.0,graph,40,z-score,pca,47,True,True,heuristic,transformer.resblocks.9,ViT-B/32,blocks.4,dinov2_vitb14,layer3,resnet50,structural,0.00437746348632987,0.785614018040911,False,100,8,0.9757886789275955,0.9209203050702217,30,4,0.6159687216604839,2.180260558274475,facebook/sam2-hiera-large,mean,0.2238110553315504,5,graph,18,l2,umap,59,True,True,heuristic,5.0,3.8133054654201817,3,False,True,True,True,True,False,True,0.7343069398633729,0.7111188071368969,0.4504175901847373,0.39190275259259943,0.7846840420082146,0.5384617206432989,COMPLETE,,0.0,0
77,0.0,graph,33,root-norm,svd,35,True,False,silhouette,transformer.resblocks.10,ViT-B/32,blocks.7,dinov2_vitb14,layer1,resnet50,semantic,0.00784681767218855,0.7687916188898196,True,200,16,0.8297969822348115,0.9698230783091352,29,4,0.5644470426491746,2.281493904381654,facebook/sam2-hiera-large,median,0.16432631893014055,3,graph,27,root-norm,pca,51,False,False,silhouette,7.0,2.437863010869956,5,True,True,False,False,True,True,False,0.7802640680461281,0.6816737819799231,0.536607151168557,0.4560297527795469,0.517583864577135,0.46469618017587844,COMPLETE,,0.0,0
78,0.0,kmeans,36,l2,pca,41,False,True,heuristic,transformer.resblocks.11,ViT-B/32,blocks.11,dinov2_vitb14,layer2,resnet50,structural,0.0032264621201448613,0.8491776020975008,False,50,32,0.945675337662083,0.9131837044249513,23,4,0.9598915661092989,1.9320641409560773,facebook/sam2-hiera-large,mean,0.13001209139771905,5,kmeans,36,z-score,umap,44,True,True,silhouette,,1.257959849753141,3,False,False,False,False,True,False,True,0.720079414205691,0.5266109279611019,0.6239774591092101,0.19123271569656095,0.12622064670465377,0.23380190819213614,COMPLETE,,0.0,0
79,0.0,graph,31,z-score,svd,32,True,False,silhouette,transformer.resblocks.11,ViT-B/32,blocks.11,dinov2_vitb14,layer3,resnet50,semantic,0.0022517490831594346,0.7176883953161576,True,200,8,0.90324415743252,0.9658258961843295,24,3,0.5172179722682289,1.683659749162773,facebook/sam2-hiera-large,top_k_mean,0.20073429336761694,3,graph,39,z-score,svd,32,False,False,heuristic,3.0,2.067378759720378,5,True,True,True,True,False,True,False,0.6888234357551726,0.7439891894092839,0.7070652601256813,0.13147202840187217,0.5609166193005397,0.30429508439441877,COMPLETE,,0.0,0
80,0.0,kmeans,34,z-score,umap,28,True,True,silhouette,transformer.resblocks.9,ViT-B/32,blocks.7,dinov2_vitb14,layer4,resnet50,semantic,0.008462248060026947,0.8087748862452816,True,100,16,0.919725431071825,0.9494477195241948,27,3,0.6655731917755957,2.917673537887926,facebook/sam2-hiera-large,mean,0.3335256715044922,3,graph,37,z-score,pca,55,True,True,silhouette,5.0,4.344855770582457,3,False,True,False,False,True,False,False,0.6579197815855218,0.6556564095295162,0.48660139745347436,0.667861231207568,0.4074506665286579,0.9152213292896111,COMPLETE,,0.0,0
81,0.0,graph,26,root-norm,umap,55,False,False,heuristic,transformer.resblocks.10,ViT-B/32,blocks.7,dinov2_vitb14,layer3,resnet50,structural,0.009735077343433459,0.6356928709562374,True,50,32,0.9326169902873568,0.9444310799375981,30,3,0.8830713281284993,2.246052809294722,facebook/sam2-hiera-large,top_k_mean,0.3245581556876785,3,kmeans,30,z-score,svd,28,True,False,heuristic,,1.0416678507348802,3,False,False,False,True,False,True,False,0.6927022760840383,0.40735050625938907,0.46796330263650454,0.5128822961031414,0.0043792101012559165,0.4234071114373544,COMPLETE,,0.0,0
82,0.0,graph,31,root-norm,umap,44,False,False,heuristic,transformer.resblocks.10,ViT-B/32,blocks.7,dinov2_vitb14,layer3,resnet50,structural,0.0018508537688730299,0.6897538694948758,True,50,32,0.957032618304656,0.9532175817241849,29,3,0.9356753350771978,2.1726353654276362,facebook/sam2-hiera-large,top_k_mean,0.2885184951458345,3,kmeans,29,z-score,svd,47,True,False,heuristic,,1.0927564203514057,3,False,False,False,True,False,True,False,0.5218343005833253,0.5421531650908376,0.44257794525340494,0.5557815350914305,0.06588023843321532,0.5880019259890215,COMPLETE,,0.0,0
83,0.0,graph,29,root-norm,umap,51,False,False,heuristic,transformer.resblocks.10,ViT-B/32,blocks.7,dinov2_vitb14,layer3,resnet50,structural,0.00498048009533331,0.6570317527645886,True,50,32,0.9473109665264352,0.9605704425826866,18,3,0.9189852454298194,2.039365396318998,facebook/sam2-hiera-large,top_k_mean,0.35487208789975483,3,kmeans,33,z-score,svd,34,True,False,heuristic,,1.2365447060740717,3,False,False,False,True,False,True,False,0.6760215981104788,0.7272352274146912,0.7334019522655931,0.5754682164599186,0.31656252920019756,0.6821198402611341,COMPLETE,,0.0,0
68,0.0,graph,25,l2,svd,57,True,False,silhouette,transformer.resblocks.10,ViT-B/32,blocks.4,dinov2_vitb14,layer1,resnet50,semantic,0.0013893609244402011,0.7277408935117554,True,200,32,0.9061741928194795,0.9583770068661946,24,4,0.899094083625542,1.5044250104430372,facebook/sam2-hiera-large,mean,0.15001061513143096,3,graph,39,z-score,umap,20,False,True,silhouette,5.0,1.5577169601758587,5,True,True,False,False,True,False,False,0.7630015301962787,0.615280979220837,0.4593497826345537,0.21919044062916826,0.7100843681414973,0.33966331919999154,COMPLETE,,0.0,0
69,0.0,kmeans,33,z-score,umap,17,True,True,silhouette,transformer.resblocks.11,ViT-B/32,blocks.7,dinov2_vitb14,layer3,resnet50,semantic,0.005870833099917212,0.6704530518516841,True,50,16,0.8454406779177346,0.9470015626739384,28,3,1.091057007453527,1.7762533624099552,facebook/sam2-hiera-large,top_k_mean,0.11414326670167803,5,graph,19,z-score,svd,38,True,False,heuristic,3.0,1.948011075791715,3,False,True,True,False,True,True,True,0.7924190656315055,0.5586471751529984,0.41054012590520633,0.601187417963587,0.6159110974028488,0.9385647448349793,COMPLETE,,0.0,0
70,0.0,graph,35,root-norm,pca,22,False,False,heuristic,transformer.resblocks.9,ViT-B/32,blocks.11,dinov2_vitb14,layer4,resnet50,structural,0.009145384915828728,0.7485336711599112,False,200,8,0.9141471288714608,0.9630921316391962,27,4,0.8006152809843231,1.5738598982081653,facebook/sam2-hiera-large,mean,0.390510559761544,3,kmeans,34,z-score,pca,41,True,True,silhouette,7.0,2.2820611156645656,3,True,True,False,True,True,False,False,0.6319693252619708,0.5853097308673717,0.43269312549837813,0.5033860020370956,0.8534573872000325,0.9667908272167784,COMPLETE,,0.0,0
