number,value,params_dino_pipeline.clustering.clusterer.method,params_dino_pipeline.clustering.clusterer.n_neighbors,params_dino_pipeline.clustering.feature_processing.normalizer.method,params_dino_pipeline.clustering.feature_processing.reducer.method,params_dino_pipeline.clustering.feature_processing.reducer.n_components,params_dino_pipeline.clustering.feature_processing.run_normalization,params_dino_pipeline.clustering.feature_processing.run_reduction,params_dino_pipeline.clustering.k_selection.method,params_extractors.clip.layer_name,params_extractors.clip.model_name,params_extractors.dino_v2.layer_name,params_extractors.dino_v2.model_name,params_extractors.resnet.layer_name,params_extractors.resnet.model_name,params_fusion_pipeline.clustering.k_selection.k_source,params_heuristic_settings.filter_params.filter_min_area_perc,params_heuristic_settings.filter_params.nms_iou_threshold,params_heuristic_settings.filter_params.use_nms,params_heuristic_settings.generator_params.min_mask_region_area,params_heuristic_settings.generator_params.points_per_side,params_heuristic_settings.generator_params.pred_iou_thresh,params_heuristic_settings.generator_params.stability_score_thresh,params_heuristic_settings.k_heuristic_formulas.max_k,params_heuristic_settings.k_heuristic_formulas.semantic_base,params_heuristic_settings.k_heuristic_formulas.semantic_scale_factor,params_heuristic_settings.k_heuristic_formulas.structural_multiplier,params_heuristic_settings.sam_model,params_labeler.aggregation_method,params_labeler.aggregation_top_k_perc,params_labeler.top_n_labels,params_resnet_pipeline.clustering.clusterer.method,params_resnet_pipeline.clustering.clusterer.n_neighbors,params_resnet_pipeline.clustering.feature_processing.normalizer.method,params_resnet_pipeline.clustering.feature_processing.reducer.method,params_resnet_pipeline.clustering.feature_processing.reducer.n_components,params_resnet_pipeline.clustering.feature_processing.run_normalization,params_resnet_pipeline.clustering.feature_processing.run_reduction,params_resnet_pipeline.clustering.k_selection.method,params_resnet_pipeline.image_preprocessing.blur_kernel_size,params_resnet_pipeline.image_preprocessing.clahe_clip_limit,params_resnet_pipeline.image_preprocessing.sobel_kernel_size,params_resnet_pipeline.image_preprocessing.use_clahe,params_resnet_pipeline.image_preprocessing.use_gaussian_blur,params_resnet_pipeline.image_preprocessing.use_grayscale,params_resnet_pipeline.image_preprocessing.use_sobel_edges,params_run_dino_pipeline,params_run_fusion_pipeline,params_run_resnet_pipeline,params_validator_settings.final_threshold,params_validator_settings.semantic_threshold,params_validator_settings.structural_threshold,params_validator_settings.weights.clip_confidence,params_validator_settings.weights.dino_iou,params_validator_settings.weights.resnet_iou,state,user_attrs_error,user_attrs_max_clip_confidence,user_attrs_num_correct_segments
254,0.0,graph,33,l2,svd,58,False,True,silhouette,transformer.resblocks.11,ViT-B/32,blocks.4,dinov2_vitb14,layer3,resnet50,semantic,0.005168509182473834,0.8153102801903622,True,100,16,0.8616440714312348,0.9160015076395084,29,2,0.6007132260821305,2.364774349321145,facebook/sam2-hiera-large,top_k_mean,0.13279305643471673,3,graph,32,l2,pca,36,False,True,heuristic,,3.1565747514536606,3,True,False,False,False,False,True,True,0.6177508598422393,0.7190537508559336,0.6866853321887992,0.061531792139782895,0.6676553379850603,0.7628775609510376,COMPLETE,,0.0,0
255,0.0,graph,10,root-norm,umap,38,True,False,heuristic,transformer.resblocks.9,ViT-B/32,blocks.7,dinov2_vitb14,layer1,resnet50,semantic,0.004812952601574292,0.7482298481032271,False,50,32,0.8426357417798829,0.9767138811601576,20,3,0.9349340379123502,2.272416456425459,facebook/sam2-hiera-large,median,0.1998383175311929,5,kmeans,36,z-score,umap,51,True,False,silhouette,3.0,1.5562982096599494,5,False,True,True,True,True,False,False,0.7487230960245189,0.7418266288327244,0.5210182411567809,0.4310419223584334,0.7920790280180714,0.4748343796721713,COMPLETE,,0.0,0
256,0.0,kmeans,11,z-score,svd,33,True,True,silhouette,transformer.resblocks.11,ViT-B/32,blocks.11,dinov2_vitb14,conv1,resnet50,structural,0.0010242727795746853,0.6475437520357201,False,200,8,0.8865175315130378,0.9044399317604317,26,3,0.9503138422934319,1.7056291497721958,facebook/sam2-hiera-large,mean,0.35776546155628947,3,graph,11,z-score,umap,48,False,True,heuristic,5.0,4.410341981176638,3,True,True,False,False,True,True,True,0.5089298190835593,0.6333668327980502,0.6013671214869555,0.6353015289417109,0.9075373923653584,0.8334251197951649,COMPLETE,,0.0,0
257,0.0,graph,38,l2,pca,49,False,True,heuristic,transformer.resblocks.10,ViT-B/32,blocks.4,dinov2_vitb14,layer2,resnet50,semantic,0.0013470085985824636,0.8256385268319884,True,100,16,0.9743994702042208,0.9413509685743593,25,4,0.8812118992268803,1.572390787280942,facebook/sam2-hiera-large,mean,0.47936172340489847,5,kmeans,29,z-score,pca,19,True,True,silhouette,3.0,4.625538013230279,5,False,True,True,False,False,True,False,0.7209183016667962,0.5440109447161153,0.5791123875112171,0.30458520727460414,0.4594422472205925,0.13501811837597144,COMPLETE,,0.0,0
258,0.0,graph,13,z-score,svd,43,True,False,heuristic,transformer.resblocks.11,ViT-B/32,blocks.11,dinov2_vitb14,layer3,resnet50,structural,0.009476389435473059,0.723084499049537,False,200,32,0.8389940526085261,0.9644639538595721,28,3,0.7195544475874603,2.5350550459002865,facebook/sam2-hiera-large,mean,0.3783352525696594,3,graph,30,root-norm,umap,63,False,False,heuristic,,1.8863581596563672,3,True,False,False,True,True,False,True,0.681946923450169,0.5558569870018084,0.43916876060060467,0.4578190881587371,0.9822437891810596,0.8789471807053869,COMPLETE,,0.0,0
259,0.0,graph,39,l2,umap,35,False,True,silhouette,transformer.resblocks.11,ViT-B/32,blocks.11,dinov2_vitb14,layer4,resnet50,semantic,0.007153892843481428,0.6567521107296804,False,50,8,0.874966591348774,0.9608925689443971,23,2,0.6200697584621221,1.9715309496456275,facebook/sam2-hiera-large,mean,0.25575475108856177,5,kmeans,16,l2,svd,49,True,True,silhouette,7.0,3.830613485878739,5,False,True,False,False,False,True,False,0.6114076536223968,0.5214863048166566,0.649463041117734,0.3799523943699994,0.19670780750653133,0.21367742587192026,COMPLETE,,0.0,0
244,0.0,graph,35,z-score,pca,63,True,True,heuristic,transformer.resblocks.10,ViT-B/32,blocks.11,dinov2_vitb14,conv1,resnet50,semantic,0.00985384961927962,0.7034239616543358,True,50,16,0.8507010935675118,0.9623775687120716,27,3,0.6372166589709087,2.2208191988947745,facebook/sam2-hiera-large,mean,0.19003688074445782,3,graph,33,z-score,pca,45,False,False,silhouette,5.0,3.1159155451802425,5,True,True,False,True,True,True,False,0.7027650723840957,0.5016888882480964,0.7316080114021793,0.12492115427304878,0.9735742119191161,0.6714716957471856,COMPLETE,,0.0,0
245,0.0,graph,28,root-norm,svd,31,False,True,heuristic,transformer.resblocks.9,ViT-B/32,blocks.11,dinov2_vitb14,layer3,resnet50,semantic,0.003801192858583405,0.6920088559260484,True,100,32,0.8412701789622608,0.9685375341469481,19,4,0.9971210609656502,2.3062510374336243,facebook/sam2-hiera-large,median,0.39980679527267726,5,graph,32,z-score,umap,31,False,True,heuristic,7.0,3.0390056823184777,3,True,True,False,False,False,True,True,0.7223692659022156,0.6956593549172032,0.6984514065486286,0.17268696906858144,0.49832707191109843,0.7997742107953015,COMPLETE,,0.0,0
246,0.0,graph,22,z-score,svd,37,True,False,heuristic,transformer.resblocks.11,ViT-B/32,blocks.4,dinov2_vitb14,layer3,resnet50,semantic,0.007446654685745048,0.6834989184447847,False,50,8,0.8100116601609633,0.9017328133739118,30,3,1.0164965075729882,2.0071187120590324,facebook/sam2-hiera-large,mean,0.1092513014845766,3,kmeans,22,z-score,pca,27,True,False,silhouette,,3.350812436952059,5,False,False,True,True,True,False,False,0.6920736983565191,0.4820791477683028,0.7492784577772438,0.04674560800823438,0.7825522348121822,0.11368642887985807,COMPLETE,,0.0,0
247,0.0,graph,34,z-score,pca,39,False,True,silhouette,transformer.resblocks.10,ViT-B/32,blocks.11,dinov2_vitb14,layer1,resnet50,structural,0.006858352805566047,0.637105081575228,True,200,16,0.9365086159893833,0.9307382022836306,25,2,0.6787878142143218,2.251195433236864,facebook/sam2-hiera-large,mean,0.4887671178786946,3,graph,29,z-score,umap,30,False,True,heuristic,3.0,1.9497276427389783,3,True,True,False,False,False,True,True,0.5284298906865685,0.7437982036526746,0.497179192432417,0.10514749268147155,0.3910220657185318,0.8688289165356972,COMPLETE,,0.0,0
248,0.0,kmeans,15,l2,svd,56,True,False,heuristic,transformer.resblocks.11,ViT-B/32,blocks.4,dinov2_vitb14,conv1,resnet50,semantic,0.009712920856845983,0.7176593533658568,False,100,32,0.8456880762475406,0.9335389941278746,27,4,0.664526209643845,2.6413457554684845,facebook/sam2-hiera-large,mean,0.2652456047469323,5,kmeans,20,root-norm,svd,26,True,True,silhouette,5.0,2.594914213881906,5,True,True,True,False,True,False,False,0.7357219095388526,0.4397058235871486,0.5885221053754528,0.19746172834048548,0.3258971647414525,0.4510490897207713,COMPLETE,,0.0,0
249,0.0,graph,40,z-score,umap,27,True,True,silhouette,transformer.resblocks.10,ViT-B/32,blocks.11,dinov2_vitb14,layer2,resnet50,structural,0.007800987357537075,0.7698723038510425,True,50,8,0.8533279113762662,0.9221737339110047,24,3,1.0705307638122932,2.498936611300802,facebook/sam2-hiera-large,top_k_mean,0.22089366347023995,3,graph,31,l2,umap,43,False,False,heuristic,3.0,3.6101093127680066,3,False,True,False,True,True,True,True,0.6542228839300618,0.6763956267274024,0.5140668346833818,0.5955553992629818,0.835527382189852,0.30894610359644903,COMPLETE,,0.0,0
250,0.0,graph,32,root-norm,svd,17,False,True,heuristic,transformer.resblocks.11,ViT-B/32,blocks.7,dinov2_vitb14,layer3,resnet50,semantic,0.0073851130292646,0.6156780188734141,False,200,32,0.8680628889586884,0.9585032777510402,22,3,0.820555146710134,2.4515051630130693,facebook/sam2-hiera-large,median,0.32445393476330286,5,kmeans,40,z-score,pca,47,False,True,silhouette,,2.712012495294617,5,True,False,True,False,False,True,False,0.6988555073186768,0.5754844084489894,0.5529211068492271,0.34337013060802696,0.8805596207333133,0.9503000810326621,COMPLETE,,0.0,0
251,0.0,graph,27,l2,pca,51,True,False,silhouette,transformer.resblocks.9,ViT-B/32,blocks.4,dinov2_vitb14,layer4,resnet50,structural,0.006402871826344951,0.8335981707975552,False,100,16,0.9194148412638738,0.9204043795824565,28,4,0.7975553707607627,1.6067561232135128,facebook/sam2-hiera-large,mean,0.3701519703984306,3,graph,24,z-score,umap,64,True,True,heuristic,5.0,1.6505259243565003,5,False,True,False,False,True,False,True,0.7115133851680059,0.6033540421355235,0.41310044789780015,0.13947044620954954,0.2558509187199168,0.2569870574897636,COMPLETE,,0.0,0
236,0.0,kmeans,33,root-norm,pca,58,False,True,silhouette,transformer.resblocks.9,ViT-B/32,blocks.4,dinov2_vitb14,conv1,resnet50,semantic,0.004454276882684981,0.6706269640074158,False,200,32,0.8770337599766608,0.9528717069505113,28,3,0.6337192281633048,2.526496959653776,facebook/sam2-hiera-large,median,0.17147670306903845,3,graph,13,z-score,pca,40,True,True,silhouette,3.0,2.083006266270819,5,False,True,False,True,False,True,False,0.705675606866281,0.6370850589485304,0.63902712494006,0.2889197423604147,0.29108557517167927,0.9189045090084452,COMPLETE,,0.0,0
237,0.0,graph,18,z-score,svd,29,True,False,heuristic,transformer.resblocks.11,ViT-B/32,blocks.11,dinov2_vitb14,layer2,resnet50,semantic,0.008062109427752265,0.8209224436543539,False,50,8,0.8708945509686086,0.9750269681860796,22,3,1.199450991914106,2.3983109906041484,facebook/sam2-hiera-large,mean,0.11316762937251397,5,kmeans,38,z-score,umap,63,False,False,heuristic,5.0,3.9715820624380727,3,True,True,True,False,True,False,True,0.6703548137641924,0.6849746043842334,0.5068106947595867,0.36888470651912364,0.7575173832596438,0.7489223915007607,COMPLETE,,0.0,0
238,0.0,graph,37,l2,svd,46,False,True,silhouette,transformer.resblocks.11,ViT-B/32,blocks.4,dinov2_vitb14,layer3,resnet50,structural,0.0041066898870989,0.7594083978374396,True,100,32,0.8314482034230749,0.9359030891197537,16,3,0.5363483645680156,2.5609255266428366,facebook/sam2-hiera-large,mean,0.2791384744664731,3,graph,35,root-norm,svd,42,True,True,silhouette,,1.8516623796738043,5,False,False,False,False,False,True,False,0.5622381077429561,0.7280965158258177,0.7068908920077742,0.5586857747348353,0.8542009895794137,0.9762118300071122,COMPLETE,,0.0,0
239,0.0,graph,39,z-score,umap,25,True,True,heuristic,transformer.resblocks.10,ViT-B/32,blocks.11,dinov2_vitb14,layer4,resnet50,semantic,0.0011431273841314756,0.7973566379605177,False,200,16,0.9464869679105724,0.9084027410576122,18,4,1.043330616779274,2.1204087908908225,facebook/sam2-hiera-large,mean,0.33675543418114756,5,graph,36,l2,umap,54,False,True,heuristic,3.0,1.0303617435594459,3,True,True,True,False,True,True,True,0.7418650589544941,0.6471027298384666,0.6298718785928042,0.23706294336881262,0.8188794574382099,0.2920682621342081,COMPLETE,,0.0,0
240,0.0,kmeans,12,l2,pca,36,True,False,silhouette,transformer.resblocks.11,ViT-B/32,blocks.7,dinov2_vitb14,layer1,resnet50,structural,0.002239502766022807,0.6522817460626901,False,200,8,0.8207315945290584,0.9455141038965814,23,3,1.0236073376987953,2.7694191253076608,facebook/sam2-hiera-large,top_k_mean,0.12337844716276894,3,kmeans,39,z-score,pca,61,True,False,silhouette,3.0,3.437218867822051,5,False,True,False,True,True,False,False,0.7998714814609416,0.5804853746071873,0.6101093081005685,0.7975375568007411,0.9035367567529149,0.06095263592021999,COMPLETE,,0.0,0
241,0.0,graph,31,z-score,pca,38,True,True,heuristic,transformer.resblocks.10,ViT-B/32,blocks.11,dinov2_vitb14,conv1,resnet50,semantic,0.00702284137928409,0.7055290831331648,True,50,16,0.848375203430379,0.9253969077483157,26,2,0.6475885929376582,2.2924244563091176,facebook/sam2-hiera-large,mean,0.14532213069302646,3,graph,31,z-score,pca,30,False,False,silhouette,5.0,3.194279863398393,5,True,True,False,True,True,True,False,0.5536400388667322,0.6194935172957401,0.737390836871724,0.11238442344956794,0.8822843566325094,0.8899983736080792,COMPLETE,,0.0,0
242,0.0,graph,33,z-score,pca,35,True,True,heuristic,transformer.resblocks.10,ViT-B/32,blocks.11,dinov2_vitb14,conv1,resnet50,semantic,0.007239897659548388,0.6982350506839803,True,50,16,0.8462747944872483,0.9273974009856537,26,4,0.6136656952542033,2.3351963992016347,facebook/sam2-hiera-large,mean,0.20491303167003477,3,graph,30,z-score,pca,32,False,False,silhouette,5.0,2.929532274097061,5,True,True,False,True,True,True,False,0.7159192914252709,0.5633111544155583,0.7415089627530786,0.14272393583431042,0.8622622039985465,0.8462198180821996,COMPLETE,,0.0,0
243,0.0,graph,24,z-score,pca,36,True,True,heuristic,transformer.resblocks.10,ViT-B/32,blocks.11,dinov2_vitb14,conv1,resnet50,semantic,0.006738553640393886,0.7113436907230558,True,50,16,0.8566335830131938,0.9294207999270508,26,3,0.5214972623393472,1.7996381885523318,facebook/sam2-hiera-large,mean,0.23799714963700427,3,graph,30,z-score,pca,28,False,False,silhouette,5.0,3.2862766937451027,5,True,True,False,True,True,True,False,0.706164284260579,0.5893945583640716,0.7426368432436601,0.1602251842406575,0.9357248977941015,0.8222215106889167,COMPLETE,,0.0,0
228,0.0,kmeans,39,l2,pca,62,False,True,heuristic,transformer.resblocks.10,ViT-B/32,blocks.11,dinov2_vitb14,layer1,resnet50,semantic,0.0018506161693301244,0.6604276656892872,False,100,16,0.8821744707088967,0.956053623672892,26,4,0.7764157111313711,1.9465734877642904,facebook/sam2-hiera-large,mean,0.41179198940076,5,graph,27,z-score,pca,56,True,True,heuristic,5.0,3.0989960475537415,5,False,True,True,False,False,True,True,0.7877818858357329,0.5110148921821649,0.6950144134563093,0.9660496574151163,0.11821569829589745,0.18718033151067387,COMPLETE,,0.0,0
229,0.0,graph,10,z-score,svd,53,True,False,silhouette,transformer.resblocks.11,ViT-B/32,blocks.4,dinov2_vitb14,layer3,resnet50,structural,0.002505769597492693,0.6774251857275461,True,200,32,0.8502128802526854,0.9212385114746573,25,3,0.5790875181437222,2.836974396391974,facebook/sam2-hiera-large,mean,0.22610473306784631,3,kmeans,37,root-norm,umap,58,False,True,silhouette,,2.3137234128865214,3,True,False,False,False,True,False,False,0.5007511733041684,0.7121790095730498,0.6552566641579008,0.2239356392669327,0.7266052048509996,0.35832662742729854,COMPLETE,,0.0,0
230,0.0,graph,19,l2,svd,40,False,True,heuristic,transformer.resblocks.11,ViT-B/32,blocks.11,dinov2_vitb14,layer3,resnet50,semantic,0.005743208533885506,0.7247524381374154,False,50,8,0.894109397120793,0.9395306529612019,21,3,1.127114354950124,1.6780693196344283,facebook/sam2-hiera-large,mean,0.46421416783856784,5,graph,40,l2,svd,16,True,False,heuristic,3.0,3.5188013346784945,5,False,True,True,True,False,True,True,0.7297430242986803,0.5074070405916734,0.4823211328482495,0.8283192097786147,0.5937336242726073,0.5470686520709171,COMPLETE,,0.0,0
231,0.0,graph,37,z-score,pca,54,True,True,heuristic,transformer.resblocks.10,ViT-B/32,blocks.11,dinov2_vitb14,layer2,resnet50,semantic,0.004727121449299678,0.7622399937272606,True,50,16,0.8605094174929714,0.9432591961097672,29,3,1.0610425695615022,2.4682896908587724,facebook/sam2-hiera-large,mean,0.11513541626073942,3,graph,40,z-score,pca,37,False,False,silhouette,5.0,1.3530833405736773,5,True,True,False,True,True,True,False,0.5746014776732368,0.652740281673231,0.5941292821605536,0.19343580130956378,0.7496884439753325,0.04742738301523214,COMPLETE,,0.0,0
232,0.0,graph,36,z-score,pca,57,True,True,heuristic,transformer.resblocks.10,ViT-B/32,blocks.11,dinov2_vitb14,layer2,resnet50,semantic,0.006029285445077101,0.7537616161972733,True,50,16,0.8629444247193289,0.9511878974934338,30,3,1.0352994270129032,2.435954200805359,facebook/sam2-hiera-large,mean,0.1371845674416488,3,graph,39,z-score,pca,38,False,False,silhouette,5.0,1.3128540091958598,5,True,True,False,True,True,True,False,0.5882548078918821,0.6441036483096214,0.5840509222145642,0.22997875430572387,0.7015129529375397,0.0036785593127642464,COMPLETE,,0.0,0
233,0.0,graph,38,z-score,pca,64,True,True,heuristic,transformer.resblocks.10,ViT-B/32,blocks.11,dinov2_vitb14,layer2,resnet50,semantic,0.008880388395142004,0.7999587718808302,True,50,16,0.9039957689092477,0.9469591391970245,28,3,0.5593752585508361,2.5802883469783793,facebook/sam2-hiera-large,mean,0.2130880843973286,3,graph,39,z-score,pca,35,False,False,silhouette,5.0,1.4789206995522433,5,True,True,False,True,True,True,False,0.6954928735179794,0.6683841902620817,0.617320193292834,0.2571641889923049,0.7742391638035307,0.09257993993058633,COMPLETE,,0.0,0
234,0.0,graph,16,z-score,pca,55,True,True,heuristic,transformer.resblocks.10,ViT-B/32,blocks.11,dinov2_vitb14,layer2,resnet50,semantic,0.004184573849380858,0.8485994542561329,True,50,16,0.8667194360151368,0.941999835938422,30,3,1.059005673348563,2.4861203953415116,facebook/sam2-hiera-large,mean,0.10233291509681489,3,graph,28,z-score,pca,39,False,False,silhouette,5.0,1.2313437745163824,5,True,True,False,True,True,True,False,0.538587263612791,0.6624502402344872,0.603960140074004,0.18403765057689025,0.7983071246474889,0.04410178149293907,COMPLETE,,0.0,0
235,0.0,graph,36,z-score,umap,61,True,False,heuristic,transformer.resblocks.10,ViT-B/32,blocks.7,dinov2_vitb14,layer1,resnet50,structural,0.0045669854911344595,0.6443719408385723,True,100,16,0.8000779232404924,0.948929435608829,29,3,1.078976365410107,2.3748018060644127,facebook/sam2-hiera-large,top_k_mean,0.10074407260332446,3,kmeans,40,z-score,umap,59,False,True,silhouette,7.0,3.7247611222434465,3,True,True,False,False,True,False,False,0.5786178818216445,0.6571104685620136,0.5735410130916869,0.20526236064219175,0.7218079927159291,0.01833767196959305,COMPLETE,,0.0,0
284,0.0,graph,12,z-score,svd,34,True,False,heuristic,transformer.resblocks.11,ViT-B/32,blocks.11,dinov2_vitb14,layer3,resnet50,semantic,0.007836714201727693,0.6887845834256182,True,50,32,0.8360650011825947,0.9618105897803614,25,4,1.0773219808686594,2.7557890058091528,facebook/sam2-hiera-large,mean,0.453712600721082,5,graph,15,z-score,umap,64,True,True,silhouette,,4.6876201695003425,5,False,False,True,False,True,False,False,0.5574332168645093,0.7367937510229401,0.6338576138332306,0.15624259854520334,0.5411927701573974,0.8276612614476292,COMPLETE,,0.0,0
285,0.0,graph,16,l2,pca,21,True,True,silhouette,transformer.resblocks.10,ViT-B/32,blocks.4,dinov2_vitb14,layer1,resnet50,structural,0.002486712579083514,0.6459534744084997,False,100,16,0.9713814113088086,0.9189212535187639,28,3,0.7852373767763615,2.2336536962514946,facebook/sam2-hiera-large,mean,0.11850292686844831,3,graph,40,root-norm,pca,58,False,False,heuristic,3.0,3.0535435731983576,3,True,True,False,True,True,True,True,0.7522349292034585,0.4216848109332998,0.6460776081950029,0.4261100149468425,0.4211245655871575,0.7347025690385476,COMPLETE,,0.0,0
286,0.0,kmeans,28,z-score,svd,55,False,True,heuristic,transformer.resblocks.11,ViT-B/32,blocks.11,dinov2_vitb14,layer2,resnet50,semantic,0.001876907346441564,0.7208230568706258,False,200,32,0.9005518243753101,0.9417537500154298,26,3,0.589991096821995,2.85954314108214,facebook/sam2-hiera-large,mean,0.33886387092312786,5,kmeans,37,l2,svd,33,True,True,silhouette,5.0,1.9557105797504297,5,False,True,True,False,False,True,False,0.7040528554096338,0.5831333964841352,0.5979118627035217,0.5735125322170975,0.6808407774071434,0.4017651084716626,COMPLETE,,0.0,0
287,0.0,graph,21,l2,umap,53,True,False,heuristic,transformer.resblocks.11,ViT-B/32,blocks.7,dinov2_vitb14,conv1,resnet50,structural,0.009315497939714621,0.6217854837599622,True,50,8,0.8433847917515125,0.9492858211098377,24,2,0.8647141729979615,1.7790795745493206,facebook/sam2-hiera-large,top_k_mean,0.19600962282972267,3,graph,39,z-score,umap,44,False,False,heuristic,3.0,1.6816278175011479,3,True,True,False,True,True,False,True,0.5662063568482397,0.6586791784441134,0.49921810154148655,0.18908399150833868,0.887590594420597,0.8990448916457843,COMPLETE,,0.0,0
