number,value,params_dino_pipeline.clustering.clusterer.method,params_dino_pipeline.clustering.clusterer.n_neighbors,params_dino_pipeline.clustering.feature_processing.normalizer.method,params_dino_pipeline.clustering.feature_processing.reducer.method,params_dino_pipeline.clustering.feature_processing.reducer.n_components,params_dino_pipeline.clustering.feature_processing.run_normalization,params_dino_pipeline.clustering.feature_processing.run_reduction,params_dino_pipeline.clustering.k_selection.method,params_extractors.clip.layer_name,params_extractors.clip.model_name,params_extractors.dino_v2.layer_name,params_extractors.dino_v2.model_name,params_extractors.resnet.layer_name,params_extractors.resnet.model_name,params_fusion_pipeline.clustering.k_selection.k_source,params_heuristic_settings.filter_params.filter_min_area_perc,params_heuristic_settings.filter_params.nms_iou_threshold,params_heuristic_settings.filter_params.use_nms,params_heuristic_settings.generator_params.min_mask_region_area,params_heuristic_settings.generator_params.points_per_side,params_heuristic_settings.generator_params.pred_iou_thresh,params_heuristic_settings.generator_params.stability_score_thresh,params_heuristic_settings.k_heuristic_formulas.max_k,params_heuristic_settings.k_heuristic_formulas.semantic_base,params_heuristic_settings.k_heuristic_formulas.semantic_scale_factor,params_heuristic_settings.k_heuristic_formulas.structural_multiplier,params_heuristic_settings.sam_model,params_labeler.aggregation_method,params_labeler.aggregation_top_k_perc,params_labeler.top_n_labels,params_resnet_pipeline.clustering.clusterer.method,params_resnet_pipeline.clustering.clusterer.n_neighbors,params_resnet_pipeline.clustering.feature_processing.normalizer.method,params_resnet_pipeline.clustering.feature_processing.reducer.method,params_resnet_pipeline.clustering.feature_processing.reducer.n_components,params_resnet_pipeline.clustering.feature_processing.run_normalization,params_resnet_pipeline.clustering.feature_processing.run_reduction,params_resnet_pipeline.clustering.k_selection.method,params_resnet_pipeline.image_preprocessing.blur_kernel_size,params_resnet_pipeline.image_preprocessing.clahe_clip_limit,params_resnet_pipeline.image_preprocessing.sobel_kernel_size,params_resnet_pipeline.image_preprocessing.use_clahe,params_resnet_pipeline.image_preprocessing.use_gaussian_blur,params_resnet_pipeline.image_preprocessing.use_grayscale,params_resnet_pipeline.image_preprocessing.use_sobel_edges,params_run_dino_pipeline,params_run_fusion_pipeline,params_run_resnet_pipeline,params_validator_settings.final_threshold,params_validator_settings.semantic_threshold,params_validator_settings.structural_threshold,params_validator_settings.weights.clip_confidence,params_validator_settings.weights.dino_iou,params_validator_settings.weights.resnet_iou,state,user_attrs_error,user_attrs_max_clip_confidence,user_attrs_num_correct_segments
105,0.0,graph,12,z-score,svd,54,True,False,silhouette,transformer.resblocks.9,ViT-B/32,blocks.11,dinov2_vitb14,layer1,resnet50,semantic,0.006572447014117879,0.641628066598331,False,100,16,0.9680513565361721,0.9433156792590793,25,4,0.5414168607310179,2.4402118704155265,facebook/sam2-hiera-large,mean,0.4733534018610758,3,kmeans,38,z-score,umap,57,False,True,silhouette,,3.9698666345096925,5,False,False,True,False,True,True,True,0.5629573099391822,0.5119419783816598,0.40923376122894756,0.20522046790607562,0.5557873150322167,0.4585861526036783,COMPLETE,,0.0,0
106,0.0,kmeans,39,l2,pca,22,True,True,heuristic,transformer.resblocks.11,ViT-B/32,blocks.4,dinov2_vitb14,layer3,resnet50,structural,0.0033762718244860473,0.7144838385972128,True,200,8,0.9277014181208024,0.9644239975034538,23,3,0.8718404228504597,2.744882523524105,facebook/sam2-hiera-large,mean,0.44337130117270207,5,graph,29,l2,pca,61,True,True,heuristic,5.0,3.236003743128895,3,True,True,False,False,False,False,False,0.6944238435502955,0.7164118510224649,0.7127131597363543,0.43687357840064006,0.7577873265837187,0.03307488531394993,COMPLETE,,0.0,0
107,0.0,graph,18,z-score,svd,48,True,False,silhouette,transformer.resblocks.10,ViT-B/32,blocks.7,dinov2_vitb14,conv1,resnet50,semantic,0.009921730633932814,0.6830332192201602,False,50,8,0.9701534167115899,0.9402956669353668,20,4,1.041844816451131,2.595546691089559,facebook/sam2-hiera-large,median,0.4960758763298996,3,kmeans,27,z-score,svd,64,False,False,silhouette,3.0,2.8415619655550857,5,False,True,True,False,True,False,False,0.7484707384001836,0.606619573111926,0.6427264354309339,0.4916267473973239,0.9848150603243576,0.8059562341663289,COMPLETE,,0.0,0
156,0.0,graph,28,l2,pca,42,True,False,heuristic,transformer.resblocks.11,ViT-B/32,blocks.11,dinov2_vitb14,layer1,resnet50,structural,0.0019545152425644073,0.8331427531631463,True,200,16,0.8745642053380721,0.9189681677800666,16,3,1.0174495364694838,2.3367532495007213,facebook/sam2-hiera-large,top_k_mean,0.3107791883514013,3,kmeans,26,l2,svd,54,False,True,heuristic,3.0,1.7314267050018164,3,True,True,True,True,False,True,True,0.6434751297247184,0.4615463481997273,0.4316372671736033,0.11352520936909499,0.5854519755205885,0.9806376384595409,COMPLETE,,0.0,0
157,0.0,kmeans,37,z-score,svd,17,False,True,heuristic,transformer.resblocks.10,ViT-B/32,blocks.7,dinov2_vitb14,layer3,resnet50,semantic,0.001246764413126676,0.6812379887534392,False,100,32,0.8087637744995392,0.9712823694101911,21,3,0.5548779153771678,2.5029917205044185,facebook/sam2-hiera-large,mean,0.4996880345808495,3,graph,11,z-score,umap,56,True,False,silhouette,,4.825199577081321,5,False,False,False,False,True,False,False,0.5673303079039567,0.41680112650670526,0.6361675284321358,0.13923761545650504,0.6867125044919041,0.14634892913651548,COMPLETE,,0.0,0
158,0.0,graph,25,l2,pca,21,True,False,silhouette,transformer.resblocks.9,ViT-B/32,blocks.4,dinov2_vitb14,layer1,resnet50,semantic,0.009348403782858387,0.6239819582972674,True,200,8,0.8181905288387692,0.9130335149728046,27,3,0.6110462987602219,2.368768501443408,facebook/sam2-hiera-large,median,0.440467610091823,5,kmeans,39,z-score,pca,43,False,True,heuristic,7.0,3.289666078376349,3,True,True,True,False,True,True,False,0.6118133390171848,0.7494290010227621,0.7124660359002671,0.4751448814672735,0.7666534221258758,0.0014240257879711282,COMPLETE,,0.0,0
159,0.0,graph,30,root-norm,svd,24,False,True,heuristic,transformer.resblocks.11,ViT-B/32,blocks.11,dinov2_vitb14,layer2,resnet50,structural,0.005225951951683997,0.7433484740634052,False,50,32,0.8007424151269904,0.9640612359507714,19,3,0.6462476481072844,2.011094489431323,facebook/sam2-hiera-large,mean,0.19590667600084552,3,graph,30,root-norm,umap,48,True,False,silhouette,3.0,4.492468655948789,5,False,True,False,True,False,False,True,0.5313062725710358,0.43557861647609536,0.4134396952164695,0.9359841296360555,0.399834989165756,0.9401544729324485,COMPLETE,,0.0,0
160,0.0,kmeans,11,z-score,umap,44,True,False,silhouette,transformer.resblocks.11,ViT-B/32,blocks.4,dinov2_vitb14,layer3,resnet50,semantic,0.0034553370522090896,0.8222359638222134,False,100,8,0.8707716212360492,0.9432654514928719,25,3,0.8176574472691762,2.269370100824701,facebook/sam2-hiera-large,mean,0.41331825695209595,5,kmeans,23,z-score,svd,62,False,True,heuristic,,1.9280237746068905,3,True,False,True,False,True,True,False,0.599674501037228,0.48923476218330386,0.511938646303188,0.2075789217753161,0.2564380588894614,0.19589342875315685,COMPLETE,,0.0,0
161,0.0,graph,34,l2,svd,27,False,True,heuristic,transformer.resblocks.9,ViT-B/32,blocks.11,dinov2_vitb14,conv1,resnet50,structural,0.0021193182268578817,0.7068796613320446,False,100,32,0.8805981202780659,0.9001360990802619,22,4,0.7767295420412821,2.9916031994871988,facebook/sam2-hiera-large,mean,0.14741243090669778,5,graph,35,z-score,pca,34,False,True,heuristic,3.0,2.462696652665347,5,False,True,True,False,True,False,True,0.7492379977043754,0.6759522639117934,0.6924837912296248,0.3513029584089696,0.7907613258253259,0.6585240318975886,COMPLETE,,0.0,0
162,0.0,graph,33,l2,svd,30,False,True,heuristic,transformer.resblocks.9,ViT-B/32,blocks.11,dinov2_vitb14,conv1,resnet50,structural,0.002529358319562548,0.661322159755305,False,100,32,0.8915514922869021,0.9602397214232585,21,4,1.0323584131585157,2.1562643800545636,facebook/sam2-hiera-large,mean,0.18208677286397945,5,graph,28,z-score,pca,36,False,True,heuristic,3.0,1.450170081551998,5,False,True,True,False,True,False,True,0.783814915932204,0.6898665797529675,0.6812958046788988,0.39023700417087576,0.8339596842394171,0.7341690631368384,COMPLETE,,0.0,0
163,0.0,graph,37,l2,svd,64,False,True,heuristic,transformer.resblocks.9,ViT-B/32,blocks.11,dinov2_vitb14,conv1,resnet50,structural,0.001652824969900953,0.6860441928407941,False,100,32,0.9004371303148752,0.9566608098834406,24,4,0.8317644229156428,2.8563594092589892,facebook/sam2-hiera-large,mean,0.2831943393738214,5,graph,36,z-score,pca,32,False,True,heuristic,3.0,2.610998016820849,5,False,True,True,False,True,False,True,0.7406292592549283,0.5162151931352009,0.5833290553321561,0.2822694270839998,0.820377618403007,0.6874150997237003,COMPLETE,,0.0,0
148,0.0,graph,38,z-score,pca,19,True,True,silhouette,transformer.resblocks.11,ViT-B/32,blocks.4,dinov2_vitb14,layer3,resnet50,semantic,0.009966367068318892,0.8152262025032093,False,200,16,0.8125687996182653,0.9736553623647227,27,2,1.0511098435189559,1.8960635742168932,facebook/sam2-hiera-large,top_k_mean,0.2136824584904498,5,kmeans,25,z-score,pca,54,True,True,silhouette,,3.776813304693268,3,True,False,True,False,True,True,True,0.726190744007386,0.6203059758750731,0.5830972828703472,0.15994588308791607,0.8022016495024906,0.3682206756549624,COMPLETE,,0.0,0
149,0.0,graph,40,l2,svd,33,False,False,heuristic,transformer.resblocks.9,ViT-B/32,blocks.11,dinov2_vitb14,conv1,resnet50,structural,0.0036329422021910166,0.6906184226077405,False,100,8,0.9662559466942183,0.9475128643746422,23,4,0.5142874772600026,2.8985503533351205,facebook/sam2-hiera-large,mean,0.34844776319123627,3,graph,31,z-score,svd,26,False,True,heuristic,7.0,4.034699663111218,5,False,True,False,True,False,False,False,0.7392625923589421,0.7222895898053173,0.4786804358287631,0.242426338804774,0.7176753025031364,0.7099862800205813,COMPLETE,,0.0,0
150,0.0,kmeans,21,root-norm,svd,36,True,True,silhouette,transformer.resblocks.10,ViT-B/32,blocks.7,dinov2_vitb14,layer1,resnet50,semantic,0.009590165919720194,0.8060070808618491,True,200,32,0.8217007589256514,0.9023206104734044,22,3,1.1984981469846068,1.86831188020225,facebook/sam2-hiera-large,median,0.1331806628757705,5,kmeans,37,root-norm,umap,64,True,False,silhouette,3.0,3.6569955426825276,3,True,True,True,False,True,True,True,0.7111417514564623,0.652300946383468,0.6168268967589374,0.5407942436147378,0.937056593593445,0.7697057025763343,COMPLETE,,0.0,0
151,0.0,graph,12,z-score,svd,43,False,False,silhouette,transformer.resblocks.11,ViT-B/32,blocks.4,dinov2_vitb14,layer4,resnet50,structural,0.0010689014642665186,0.7796855663510044,False,200,8,0.804098777251604,0.9256187045806481,15,3,0.5648459468447095,2.5049690775113898,facebook/sam2-hiera-large,median,0.27434208973211716,5,kmeans,28,l2,umap,51,False,True,silhouette,3.0,3.167780354128058,5,False,True,True,False,False,True,True,0.5526133152435976,0.404459888565814,0.5465373529268478,0.1953613757460143,0.4882098002363834,0.8154014554918017,COMPLETE,,0.0,0
152,0.0,graph,10,z-score,svd,46,False,False,silhouette,transformer.resblocks.11,ViT-B/32,blocks.4,dinov2_vitb14,layer4,resnet50,structural,0.0014959572846402268,0.7681840583044597,False,200,8,0.9250512621168143,0.9279267657766953,15,3,0.5915552744112746,2.295243899051395,facebook/sam2-hiera-large,median,0.2913750466360501,5,kmeans,29,l2,umap,52,False,True,silhouette,3.0,2.8535404463718628,5,False,True,True,False,False,True,True,0.5741268943214102,0.5660892982263293,0.6718720612957292,0.16796108487467581,0.550532167309279,0.8846578184167618,COMPLETE,,0.0,0
153,0.0,graph,11,z-score,svd,49,False,False,silhouette,transformer.resblocks.11,ViT-B/32,blocks.4,dinov2_vitb14,layer4,resnet50,structural,0.0012309238248179918,0.763402882208365,False,200,8,0.910448556480658,0.9219625002729697,16,3,0.5441344297937364,2.459980395657731,facebook/sam2-hiera-large,median,0.29760816457781153,5,kmeans,27,l2,umap,61,False,True,silhouette,3.0,2.6962016442735264,5,False,True,True,False,False,True,True,0.5945390839993219,0.4444702804730497,0.5963239540205009,0.07914738857923162,0.6202083066412367,0.8395488007760106,COMPLETE,,0.0,0
154,0.0,graph,19,z-score,svd,38,False,False,silhouette,transformer.resblocks.11,ViT-B/32,blocks.4,dinov2_vitb14,layer4,resnet50,structural,0.0016250409551311635,0.7944312285193471,False,200,8,0.8108245067251872,0.9308581164226774,16,3,0.527412157888136,2.5457959187278414,facebook/sam2-hiera-large,median,0.2506416773743888,5,kmeans,38,l2,umap,49,False,True,silhouette,3.0,3.0803800529368583,5,False,True,True,False,False,True,True,0.584577309144951,0.42780986124326476,0.5673680719918203,0.3379972371892658,0.5058440189793678,0.5049041122927712,COMPLETE,,0.0,0
155,0.0,graph,10,z-score,umap,51,False,False,silhouette,transformer.resblocks.11,ViT-B/32,blocks.4,dinov2_vitb14,layer3,resnet50,structural,0.008128644814417742,0.7589190815949594,False,50,8,0.8266533129075164,0.9168950756028597,17,3,0.5743221628442399,2.3951328406265886,facebook/sam2-hiera-large,mean,0.2620678385163564,5,graph,15,z-score,umap,17,False,True,silhouette,5.0,2.1386375911460287,5,False,True,False,False,False,False,False,0.6584924797704578,0.7012451021494903,0.6451594021064926,0.26907151895790066,0.08890471935398511,0.9036003436115335,COMPLETE,,0.0,0
140,0.0,kmeans,18,z-score,svd,31,False,False,heuristic,transformer.resblocks.9,ViT-B/32,blocks.4,dinov2_vitb14,layer3,resnet50,structural,0.0027075472717511214,0.7150623286484808,False,100,32,0.8489976144545677,0.9516197896618119,28,4,0.8881566964690627,2.4319924411805816,facebook/sam2-hiera-large,top_k_mean,0.4858478739233016,3,graph,37,root-norm,pca,63,True,True,heuristic,3.0,2.8993874538918982,5,False,True,False,False,False,True,False,0.76970147654352,0.7426832890016899,0.6504297838559856,0.13240500424407284,0.13837075847783648,0.916743512876797,COMPLETE,,0.0,0
141,0.0,graph,31,root-norm,svd,56,True,True,heuristic,transformer.resblocks.11,ViT-B/32,blocks.11,dinov2_vitb14,layer3,resnet50,semantic,0.003827496329696327,0.6080924431958975,False,100,32,0.9793197290509714,0.9102375672480547,25,4,1.1835317993133154,2.2210677989714784,facebook/sam2-hiera-large,mean,0.479691507800542,3,graph,33,z-score,umap,61,True,True,heuristic,,1.159266440239317,3,True,False,False,False,True,False,True,0.717766182658982,0.6036655752217044,0.610917040727151,0.8412048372713294,0.8943979531553996,0.5780487044160247,COMPLETE,,0.0,0
142,0.0,graph,27,root-norm,svd,54,True,True,heuristic,transformer.resblocks.11,ViT-B/32,blocks.11,dinov2_vitb14,layer3,resnet50,semantic,0.004071388600417867,0.6156316618708356,False,100,32,0.9796413104448816,0.9066035049607812,26,4,1.1473592628650187,2.132078581840982,facebook/sam2-hiera-large,mean,0.46943332454731057,3,graph,19,z-score,umap,55,True,True,heuristic,,4.139500712583865,3,True,False,False,False,True,False,True,0.6790051231779225,0.6459552683153319,0.6634685650183607,0.8731067941801316,0.9488141284265863,0.6592892119092278,COMPLETE,,0.0,0
143,0.0,graph,26,root-norm,svd,55,True,True,heuristic,transformer.resblocks.11,ViT-B/32,blocks.11,dinov2_vitb14,layer3,resnet50,semantic,0.00476732095155493,0.6074797688272825,False,100,32,0.8972465636976602,0.9122498343896845,26,4,1.1758798846756828,2.096926759028539,facebook/sam2-hiera-large,mean,0.4868989186310288,3,graph,27,z-score,umap,42,True,True,heuristic,,4.209213107825201,3,True,False,False,False,True,False,True,0.6975129901228405,0.6152623426161222,0.6298417850757121,0.5711969751266849,0.8594791662398724,0.4725141569620443,COMPLETE,,0.0,0
144,0.0,graph,35,root-norm,svd,50,True,True,heuristic,transformer.resblocks.11,ViT-B/32,blocks.11,dinov2_vitb14,layer3,resnet50,semantic,0.00438636355920549,0.6683428749341411,False,100,32,0.9602636950707449,0.9142437544977677,25,4,1.1153719172339716,2.166063382086246,facebook/sam2-hiera-large,mean,0.44999645288303264,3,graph,32,z-score,umap,60,True,True,heuristic,,3.44284990190246,3,True,False,False,False,True,False,True,0.6897002063027985,0.5429596928194516,0.6041051679144801,0.7911275326422197,0.9702642672743298,0.6222309050403493,COMPLETE,,0.0,0
145,0.0,graph,39,root-norm,pca,57,True,True,heuristic,transformer.resblocks.11,ViT-B/32,blocks.11,dinov2_vitb14,layer1,resnet50,semantic,0.009134647174003436,0.6042489780515031,True,200,16,0.9631964477210182,0.9419344251362862,30,4,1.1591106434588696,2.840562523389247,facebook/sam2-hiera-large,median,0.3631867402034922,5,graph,35,z-score,umap,33,False,False,heuristic,,3.887224731071617,3,True,False,False,False,True,False,False,0.6735955706694676,0.5887745540943407,0.46507686919243163,0.6315453045098277,0.4294644207209013,0.9623919401451059,COMPLETE,,0.0,0
146,0.0,graph,29,l2,svd,47,True,True,silhouette,transformer.resblocks.11,ViT-B/32,blocks.11,dinov2_vitb14,layer2,resnet50,semantic,0.006573473896767584,0.6006195512437671,False,50,8,0.9725332925751216,0.9189741183355105,24,2,0.6275254043955933,2.2459383382177136,facebook/sam2-hiera-large,mean,0.23165759486442383,3,kmeans,34,z-score,svd,63,True,True,silhouette,5.0,4.682617242888908,3,True,True,True,True,True,True,True,0.7040637321443399,0.5730877856308779,0.491136148405525,0.6662897060216189,0.9886754859839603,0.9488032832587404,COMPLETE,,0.0,0
147,0.0,kmeans,33,z-score,umap,16,False,False,heuristic,transformer.resblocks.10,ViT-B/32,blocks.7,dinov2_vitb14,layer4,resnet50,structural,0.0048769126979437295,0.6310635730538828,True,100,32,0.9434402965409702,0.9094325690059839,28,4,0.6958644496775379,1.9627577203836728,facebook/sam2-hiera-large,mean,0.33557373062625634,3,graph,40,l2,umap,58,False,False,heuristic,3.0,4.421851966179206,5,False,True,False,False,False,False,False,0.5424879614386511,0.5955133409119928,0.6559960309067868,0.42950396250530093,0.9124903319092746,0.6784389568303596,COMPLETE,,0.0,0
132,0.0,graph,17,l2,svd,18,False,True,silhouette,transformer.resblocks.11,ViT-B/32,blocks.4,dinov2_vitb14,layer3,resnet50,structural,0.005086111824646276,0.7113196160144755,False,100,8,0.8458458452892081,0.9649182173942332,22,2,1.0358252972758037,2.7227580292888627,facebook/sam2-hiera-large,mean,0.22581909869661415,5,kmeans,38,root-norm,umap,52,True,True,heuristic,3.0,4.443296149525255,5,False,True,True,False,False,False,True,0.5043739421847543,0.6542249853039714,0.42555018628525026,0.9900778728341384,0.6035261104724311,0.8241966217556037,COMPLETE,,0.0,0
133,0.0,graph,14,l2,svd,35,False,True,silhouette,transformer.resblocks.11,ViT-B/32,blocks.4,dinov2_vitb14,layer3,resnet50,structural,0.006744468406986391,0.6754533482505806,False,100,8,0.863070267113757,0.9343840790241025,20,2,0.7349273356890159,2.9646100626927687,facebook/sam2-hiera-large,mean,0.15348400768326279,5,kmeans,39,root-norm,umap,59,True,True,heuristic,3.0,4.715157538713991,5,False,True,True,False,False,False,True,0.5249161136884908,0.6613958414363944,0.5225243505110314,0.5064176904435428,0.52613332076282,0.8511501110828057,COMPLETE,,0.0,0
134,0.0,graph,23,l2,svd,29,False,True,silhouette,transformer.resblocks.11,ViT-B/32,blocks.4,dinov2_vitb14,layer3,resnet50,structural,0.007760214656345219,0.6550528296888347,False,100,8,0.8353769968776751,0.9381130925954302,22,2,1.0611639089409772,2.585931071005621,facebook/sam2-hiera-large,mean,0.14359110382859683,5,kmeans,33,root-norm,umap,55,True,True,heuristic,3.0,1.3684184961637875,5,False,True,True,False,False,False,True,0.7910627746388991,0.7114025981243561,0.4562518195590545,0.1750014606416192,0.6719491226273204,0.44335083049806057,COMPLETE,,0.0,0
135,0.0,graph,16,z-score,umap,26,True,True,silhouette,transformer.resblocks.9,ViT-B/32,blocks.11,dinov2_vitb14,layer4,resnet50,structural,0.007565457712058318,0.6508539493670878,True,50,8,0.8597634662543366,0.9241331296351109,20,2,1.0860373426736076,2.7596398127177517,facebook/sam2-hiera-large,mean,0.2557635784763728,3,graph,36,z-score,pca,22,True,True,silhouette,,1.8952984002195816,3,False,False,True,False,False,False,False,0.7552315298012965,0.6370988521600566,0.44270709692252946,0.30152545992106455,0.5106856441758669,0.7011273108402438,COMPLETE,,0.0,0
136,0.0,graph,22,l2,svd,48,False,False,heuristic,transformer.resblocks.11,ViT-B/32,blocks.7,dinov2_vitb14,conv1,resnet50,semantic,0.007045190968331744,0.8490577943617821,False,100,16,0.839930075986326,0.960268920644143,23,2,0.544581661367418,2.8080783798191526,facebook/sam2-hiera-large,median,0.20506778110167387,5,kmeans,39,root-norm,svd,57,False,False,heuristic,5.0,4.974808569660468,5,False,True,False,True,True,True,False,0.5112154348078951,0.6310307457680168,0.5564145036259398,0.2573347893309105,0.6458693556419705,0.7491116225443611,COMPLETE,,0.0,0
137,0.0,kmeans,20,root-norm,pca,20,True,True,silhouette,transformer.resblocks.10,ViT-B/32,blocks.4,dinov2_vitb14,layer1,resnet50,structural,0.009735314379862699,0.8416645457668368,True,200,8,0.9727580340694482,0.9623598440430019,29,4,0.8378646016786802,2.324985893633066,facebook/sam2-hiera-large,top_k_mean,0.3212438823575845,3,graph,40,z-score,umap,60,True,True,silhouette,3.0,2.0430546250744746,3,True,True,True,False,False,False,True,0.7988971395610431,0.5524094126668433,0.6817156890299978,0.6009906828518219,0.5738598004711173,0.8735376909959826,COMPLETE,,0.0,0
138,0.0,graph,28,z-score,svd,40,False,False,heuristic,transformer.resblocks.11,ViT-B/32,blocks.11,dinov2_vitb14,layer3,resnet50,semantic,0.0031377373509542013,0.725612069056203,False,50,32,0.8871799207882143,0.9682190416879046,20,2,0.861839976512018,2.62002055862597,facebook/sam2-hiera-large,mean,0.16282027370484164,5,kmeans,34,l2,svd,30,True,False,heuristic,7.0,2.2717758625157187,5,False,True,False,False,True,True,False,0.7734787798308429,0.6834700255217789,0.6404538605996912,0.3725834209780604,0.6280024870960843,0.0819957757857278,COMPLETE,,0.0,0
