number,value,params_dino_pipeline.clustering.clusterer.method,params_dino_pipeline.clustering.clusterer.n_neighbors,params_dino_pipeline.clustering.feature_processing.normalizer.method,params_dino_pipeline.clustering.feature_processing.reducer.method,params_dino_pipeline.clustering.feature_processing.reducer.n_components,params_dino_pipeline.clustering.feature_processing.run_normalization,params_dino_pipeline.clustering.feature_processing.run_reduction,params_dino_pipeline.clustering.k_selection.method,params_extractors.clip.layer_name,params_extractors.clip.model_name,params_extractors.dino_v2.layer_name,params_extractors.dino_v2.model_name,params_extractors.resnet.layer_name,params_extractors.resnet.model_name,params_fusion_pipeline.clustering.k_selection.k_source,params_heuristic_settings.filter_params.filter_min_area_perc,params_heuristic_settings.filter_params.nms_iou_threshold,params_heuristic_settings.filter_params.use_nms,params_heuristic_settings.generator_params.min_mask_region_area,params_heuristic_settings.generator_params.points_per_side,params_heuristic_settings.generator_params.pred_iou_thresh,params_heuristic_settings.generator_params.stability_score_thresh,params_heuristic_settings.k_heuristic_formulas.max_k,params_heuristic_settings.k_heuristic_formulas.semantic_base,params_heuristic_settings.k_heuristic_formulas.semantic_scale_factor,params_heuristic_settings.k_heuristic_formulas.structural_multiplier,params_heuristic_settings.sam_model,params_labeler.aggregation_method,params_labeler.aggregation_top_k_perc,params_labeler.top_n_labels,params_resnet_pipeline.clustering.clusterer.method,params_resnet_pipeline.clustering.clusterer.n_neighbors,params_resnet_pipeline.clustering.feature_processing.normalizer.method,params_resnet_pipeline.clustering.feature_processing.reducer.method,params_resnet_pipeline.clustering.feature_processing.reducer.n_components,params_resnet_pipeline.clustering.feature_processing.run_normalization,params_resnet_pipeline.clustering.feature_processing.run_reduction,params_resnet_pipeline.clustering.k_selection.method,params_resnet_pipeline.image_preprocessing.blur_kernel_size,params_resnet_pipeline.image_preprocessing.clahe_clip_limit,params_resnet_pipeline.image_preprocessing.sobel_kernel_size,params_resnet_pipeline.image_preprocessing.use_clahe,params_resnet_pipeline.image_preprocessing.use_gaussian_blur,params_resnet_pipeline.image_preprocessing.use_grayscale,params_resnet_pipeline.image_preprocessing.use_sobel_edges,params_run_dino_pipeline,params_run_fusion_pipeline,params_run_resnet_pipeline,params_validator_settings.final_threshold,params_validator_settings.semantic_threshold,params_validator_settings.structural_threshold,params_validator_settings.weights.clip_confidence,params_validator_settings.weights.dino_iou,params_validator_settings.weights.resnet_iou,state,user_attrs_error,user_attrs_max_clip_confidence,user_attrs_num_correct_segments
614,0.0,graph,24,z-score,umap,53,True,True,silhouette,transformer.resblocks.10,ViT-B/32,blocks.7,dinov2_vitb14,layer4,resnet50,structural,0.005674205443604471,0.7300046062438852,False,100,32,0.8606893300830725,0.947661803220899,21,3,0.9864307260042734,2.258883610622391,facebook/sam2-hiera-large,mean,0.2535860220236526,3,graph,34,z-score,umap,64,False,True,heuristic,7.0,4.162580469763211,3,True,True,False,False,True,True,True,0.6264150474584977,0.6546981110315893,0.6564313439298413,0.19576696112094122,0.9496029288991431,0.3915914032142192,COMPLETE,,0.0,0
615,0.0,kmeans,35,root-norm,pca,49,False,True,heuristic,transformer.resblocks.9,ViT-B/32,blocks.4,dinov2_vitb14,layer3,resnet50,semantic,0.009790686847222115,0.6528669361888744,True,200,16,0.9147556885220108,0.9665222360444448,24,4,0.8052432909200727,2.4625315138988904,facebook/sam2-hiera-large,median,0.23739292242606752,5,kmeans,14,z-score,pca,18,True,False,silhouette,3.0,2.0626191437822117,5,False,True,True,True,False,True,False,0.6131483954193078,0.694830419683309,0.7402667929954684,0.07840344904007054,0.5620783863065147,0.7243948496125406,COMPLETE,,0.0,0
616,0.0,graph,37,z-score,svd,38,True,False,silhouette,transformer.resblocks.11,ViT-B/32,blocks.11,dinov2_vitb14,layer3,resnet50,structural,0.006409854922236602,0.7145792724394122,False,50,8,0.9754487886238093,0.9444994765681596,27,3,0.6753247506571003,1.9351858688443282,facebook/sam2-hiera-large,mean,0.15408685984849085,3,graph,32,z-score,umap,49,False,True,heuristic,5.0,1.7178588124183403,5,True,True,False,False,True,False,True,0.6411226207968476,0.5753249171252175,0.4619803495112722,0.13358787555484314,0.3824716873125401,0.9427848856787072,COMPLETE,,0.0,0
617,0.0,graph,18,l2,svd,55,False,True,heuristic,transformer.resblocks.11,ViT-B/32,blocks.4,dinov2_vitb14,layer1,resnet50,semantic,0.0016630256999964944,0.6468286239586313,False,200,32,0.8074022062431939,0.9644675162352471,23,3,0.8274023028947346,2.227125217180636,facebook/sam2-hiera-large,mean,0.3538875201293258,5,kmeans,40,root-norm,pca,52,False,True,silhouette,,2.3773335461520784,3,True,False,False,False,False,True,False,0.7068973424346785,0.46185798271553796,0.4764144672369532,0.3774011928660699,0.6532947443779374,0.7863687617827213,COMPLETE,,0.0,0
618,0.0,graph,27,z-score,pca,35,True,False,heuristic,transformer.resblocks.10,ViT-B/32,blocks.11,dinov2_vitb14,layer2,resnet50,semantic,0.007643884974493423,0.6140277336238863,True,100,16,0.8915862484414725,0.9425609273798761,28,4,0.9464885668950181,2.380372374214666,facebook/sam2-hiera-large,mean,0.3697481143001713,3,graph,29,z-score,svd,56,True,False,heuristic,3.0,4.845093775057137,5,False,True,True,True,True,False,True,0.7454629934574059,0.749663382371128,0.4911327260325248,0.41302673254311595,0.5365940656367124,0.5930475857360307,COMPLETE,,0.0,0
619,0.0,kmeans,15,z-score,umap,18,False,True,silhouette,transformer.resblocks.11,ViT-B/32,blocks.7,dinov2_vitb14,layer3,resnet50,structural,0.0074389655273621215,0.6999625012078793,False,50,8,0.8207923743175437,0.9612733475252909,30,4,0.8983485864548065,2.812008278527037,facebook/sam2-hiera-large,top_k_mean,0.33732289852850794,3,kmeans,37,l2,umap,58,False,True,silhouette,5.0,3.084587309595215,3,True,True,False,False,False,True,False,0.7835867178491602,0.6736263638222076,0.5685636636929742,0.5504966930312164,0.693343631055469,0.16029378420383428,COMPLETE,,0.0,0
668,0.0,graph,35,z-score,umap,61,False,True,silhouette,transformer.resblocks.11,ViT-B/32,blocks.11,dinov2_vitb14,layer1,resnet50,semantic,0.00646356001727553,0.6864120920909469,False,200,32,0.8271747080188552,0.947876605216212,15,3,0.6884503587279617,2.593729103830797,facebook/sam2-hiera-large,top_k_mean,0.23138481478642298,5,graph,38,l2,pca,35,False,True,heuristic,5.0,1.1684516705901151,3,True,True,False,False,False,True,True,0.7273405938006897,0.4697034373018254,0.6681869805666845,0.12461209036514571,0.8557932227347768,0.9038557475994506,COMPLETE,,0.0,0
669,0.0,graph,23,root-norm,svd,33,True,False,heuristic,transformer.resblocks.9,ViT-B/32,blocks.7,dinov2_vitb14,layer3,resnet50,semantic,0.00409239756561534,0.7520218277523275,True,50,8,0.8531957494783255,0.9174574991438706,21,2,1.0479155026541935,2.8191970417315977,facebook/sam2-hiera-large,mean,0.4160996621079206,3,kmeans,33,z-score,umap,33,True,False,silhouette,,2.787477902000691,5,False,False,True,True,True,False,False,0.7868952464797127,0.7352293564224043,0.5941614945104455,0.24144492439616494,0.8137600476351416,0.04622056786028941,COMPLETE,,0.0,0
670,0.0,graph,28,l2,svd,41,True,True,silhouette,transformer.resblocks.11,ViT-B/32,blocks.11,dinov2_vitb14,layer2,resnet50,structural,0.0018097684139131796,0.6947533231115999,False,100,16,0.9237187205579828,0.9331397481228223,26,3,0.8421024872729576,2.5674680808332537,facebook/sam2-hiera-large,median,0.13228713619934987,3,graph,29,z-score,pca,24,False,True,heuristic,3.0,2.8901412363409484,3,True,True,False,False,True,True,True,0.5426780370181836,0.5428974960326892,0.48282401896486005,0.4107510541712003,0.6290895958596383,0.8246980423522627,COMPLETE,,0.0,0
671,0.0,kmeans,40,z-score,pca,37,False,True,heuristic,transformer.resblocks.10,ViT-B/32,blocks.4,dinov2_vitb14,conv1,resnet50,semantic,0.008191888276495092,0.6207422093059135,True,200,32,0.8155177842090015,0.9202629243290134,30,4,1.131531150620855,1.7173062408219988,facebook/sam2-hiera-large,mean,0.27422267059850286,5,kmeans,40,z-score,umap,51,True,True,silhouette,7.0,1.2914936454828578,5,False,True,True,True,False,True,False,0.6515196148654335,0.6374551631549422,0.6281625643748655,0.560514228659606,0.916468687313221,0.6519028379638896,COMPLETE,,0.0,0
672,0.0,graph,26,z-score,svd,50,True,False,heuristic,transformer.resblocks.11,ViT-B/32,blocks.11,dinov2_vitb14,layer3,resnet50,structural,0.0061389307710113215,0.6125072461157257,False,50,8,0.9737099606370903,0.9627054622777068,25,3,0.6150223384101077,2.3168023819314674,facebook/sam2-hiera-large,mean,0.1672137765090219,3,graph,28,root-norm,svd,19,False,False,heuristic,5.0,1.0091456564343015,5,True,True,False,False,True,False,True,0.6918850798462436,0.6033911091392006,0.614944096952109,0.18843483890678853,0.7873813041965458,0.35947228008993637,COMPLETE,,0.0,0
673,0.0,graph,18,l2,umap,63,False,True,silhouette,transformer.resblocks.10,ViT-B/32,blocks.4,dinov2_vitb14,layer4,resnet50,semantic,0.007122689845098174,0.647552447529049,False,100,32,0.8938974624125318,0.9560966152499,22,4,0.9155768056506963,2.418444963743101,facebook/sam2-hiera-large,top_k_mean,0.3200712259842933,5,kmeans,34,l2,umap,64,False,True,silhouette,,4.005433340884843,3,True,False,False,False,False,True,False,0.7495828424577365,0.6780330162134595,0.4735353085071833,0.21183984718919716,0.6688916681278845,0.1618960509639757,COMPLETE,,0.0,0
674,0.0,graph,33,z-score,pca,20,True,False,heuristic,transformer.resblocks.11,ViT-B/32,blocks.7,dinov2_vitb14,layer1,resnet50,semantic,0.004951475160738005,0.6793994245382016,True,200,16,0.9136587203079921,0.9461621491607417,16,3,0.8854962316094939,2.4736657838219975,facebook/sam2-hiera-large,mean,0.21417881896184604,3,graph,32,z-score,pca,40,True,False,heuristic,3.0,1.4016094102575236,5,False,True,True,True,True,False,True,0.5221003479542999,0.6672006151224831,0.6893405973139644,0.14998251207297608,0.7199173665983548,0.8855643611192164,COMPLETE,,0.0,0
675,0.0,kmeans,12,root-norm,svd,45,False,True,silhouette,transformer.resblocks.9,ViT-B/32,blocks.11,dinov2_vitb14,layer3,resnet50,structural,0.0015204516949085026,0.6561288899048121,False,50,8,0.845233401235076,0.9652190933049399,24,4,1.0304184272378643,1.5265697138864334,facebook/sam2-hiera-large,median,0.46163033686596777,3,kmeans,39,z-score,umap,28,False,True,silhouette,3.0,3.2010045591997316,3,True,True,False,False,False,True,False,0.5006259097380366,0.5627952446149961,0.7228072140241432,0.27865885993890704,0.29252527503127845,0.6753089104286849,COMPLETE,,0.0,0
660,0.0,graph,39,z-score,svd,17,True,False,silhouette,transformer.resblocks.11,ViT-B/32,blocks.11,dinov2_vitb14,layer1,resnet50,structural,0.009556241215820029,0.605039068992805,False,50,32,0.965731383474091,0.943522485216086,26,3,0.512785384050029,2.3912363240408427,facebook/sam2-hiera-large,mean,0.11936836683793264,3,kmeans,39,z-score,umap,50,True,True,silhouette,,1.9132640646418162,5,False,False,False,False,True,False,False,0.6426639886700684,0.7131637995054227,0.7355958051434196,0.3747230251457378,0.8325682878762399,0.7767526518107809,COMPLETE,,0.0,0
661,0.0,graph,11,l2,pca,51,False,True,heuristic,transformer.resblocks.10,ViT-B/32,blocks.4,dinov2_vitb14,layer3,resnet50,semantic,0.0037219964478632443,0.6445515465323993,False,100,16,0.8770089873175808,0.939306982829589,21,3,1.013581151933657,2.5105418945758005,facebook/sam2-hiera-large,mean,0.18001934336705586,5,graph,31,root-norm,pca,63,False,False,heuristic,5.0,3.2580616864632685,3,True,True,False,True,False,True,True,0.6846021925308743,0.7303910331084486,0.6185130917304384,0.30375205006148737,0.5442058879171754,0.6207624980660854,COMPLETE,,0.0,0
662,0.0,kmeans,16,z-score,svd,48,True,False,heuristic,transformer.resblocks.11,ViT-B/32,blocks.11,dinov2_vitb14,layer2,resnet50,structural,0.006845118299391476,0.7252954096435202,True,200,32,0.9485407513140152,0.9608858100743335,25,4,0.896468879750343,2.0622611225671084,facebook/sam2-hiera-large,top_k_mean,0.34394484456352925,3,kmeans,40,l2,svd,43,True,True,silhouette,3.0,3.604958451885006,5,True,True,True,False,True,False,False,0.6069638345833512,0.7499019119801553,0.7116804779088046,0.5247947788563018,0.39532402210479245,0.08523890982255382,COMPLETE,,0.0,0
663,0.0,graph,15,l2,umap,58,False,True,silhouette,transformer.resblocks.11,ViT-B/32,blocks.7,dinov2_vitb14,layer3,resnet50,semantic,0.00979123550486778,0.7703755767134881,False,50,8,0.8488642370443303,0.9083268687500389,29,3,1.1556555984079675,1.9019000804061763,facebook/sam2-hiera-large,mean,0.15874637943305012,3,graph,37,z-score,umap,61,False,False,heuristic,7.0,3.1255417581250255,5,False,True,False,True,False,True,True,0.5336540515094403,0.4311626200747632,0.6500056899159097,0.09115289827735244,0.43604800165514046,0.33393351731856624,COMPLETE,,0.0,0
664,0.0,graph,10,root-norm,svd,27,True,False,heuristic,transformer.resblocks.9,ViT-B/32,blocks.11,dinov2_vitb14,conv1,resnet50,semantic,0.002702714122553977,0.7348848485228154,True,100,16,0.8828087065036221,0.9317313110780666,17,2,0.9355584892942308,1.7587049061715336,facebook/sam2-hiera-large,median,0.3690109824658405,5,kmeans,35,z-score,pca,49,False,True,silhouette,,2.2272623363593635,3,True,False,True,False,True,True,False,0.6220665939028772,0.5813314567889014,0.49124408195918645,0.014656416346298246,0.6504602544901172,0.5749759951547458,COMPLETE,,0.0,0
665,0.0,graph,37,z-score,pca,18,True,True,silhouette,transformer.resblocks.10,ViT-B/32,blocks.4,dinov2_vitb14,layer1,resnet50,structural,0.0034145070575235105,0.815611718826118,False,200,32,0.8077802436540612,0.9221393761355673,28,3,0.9794555691473789,2.7328769826419976,facebook/sam2-hiera-large,mean,0.14298094944807196,3,graph,26,z-score,umap,21,True,True,silhouette,3.0,4.436872688458548,5,False,True,False,False,True,False,True,0.5714193669636647,0.5328644944488395,0.6414695617999833,0.17256895565579342,0.7648535711044584,0.12407969313986934,COMPLETE,,0.0,0
666,0.0,graph,31,z-score,svd,55,False,True,heuristic,transformer.resblocks.11,ViT-B/32,blocks.11,dinov2_vitb14,layer4,resnet50,semantic,0.007525913473434757,0.7197853262395066,False,50,8,0.8638163010174613,0.910097872683253,20,4,0.951919043404864,2.219621580137476,facebook/sam2-hiera-large,mean,0.19128016383207824,5,graph,19,root-norm,umap,62,False,False,heuristic,5.0,1.6923202339513597,3,True,True,True,True,False,True,False,0.7693569693541745,0.45159661735353446,0.4235863039047469,0.8482471109548372,0.8912450588077302,0.9677060407368272,COMPLETE,,0.0,0
667,0.0,kmeans,25,l2,pca,23,True,False,heuristic,transformer.resblocks.10,ViT-B/32,blocks.4,dinov2_vitb14,layer3,resnet50,structural,0.008656603727472295,0.8359326907587558,True,100,16,0.8698060979598933,0.9044683020077854,27,3,0.5816236957970746,1.608859680928061,facebook/sam2-hiera-large,mean,0.11018421734030842,3,kmeans,13,z-score,svd,59,True,True,silhouette,3.0,2.5945090115370446,5,False,True,False,False,True,False,False,0.7593004920636567,0.5202496226831606,0.6033167932145598,0.7916215179086304,0.6023448408176173,0.502603672774202,COMPLETE,,0.0,0
652,0.0,graph,14,z-score,svd,19,True,False,heuristic,transformer.resblocks.11,ViT-B/32,blocks.11,dinov2_vitb14,layer1,resnet50,semantic,0.009332940143366516,0.6585583833008999,True,100,16,0.8000111320840589,0.967040249028649,27,3,1.04950861378387,2.8463885473453376,facebook/sam2-hiera-large,top_k_mean,0.2840777469397381,3,graph,30,l2,pca,62,False,True,heuristic,3.0,1.9813233086920201,3,True,True,True,False,True,False,True,0.7942640634415802,0.5933093903105887,0.7437630984831816,0.44365520875802134,0.7777085544603182,0.7362811554820485,COMPLETE,,0.0,0
653,0.0,graph,29,root-norm,pca,64,False,True,silhouette,transformer.resblocks.9,ViT-B/32,blocks.7,dinov2_vitb14,layer3,resnet50,structural,0.007363972899512357,0.6391168056539284,False,50,8,0.8609186633448634,0.9754951705004642,18,2,0.9048309739783221,2.5427946488922184,facebook/sam2-hiera-large,median,0.2567312618852765,3,kmeans,38,z-score,umap,54,False,False,silhouette,3.0,2.5036499547894944,5,True,True,False,True,False,True,False,0.5104663858922821,0.41091584161254824,0.6918283121675787,0.1925738137029621,0.803235232082982,0.7032112510882406,COMPLETE,,0.0,0
654,0.0,kmeans,32,l2,svd,31,True,True,heuristic,transformer.resblocks.11,ViT-B/32,blocks.11,dinov2_vitb14,layer3,resnet50,semantic,0.003998961713646526,0.7469618295012636,True,200,32,0.8450488927142327,0.9577506290585391,30,4,0.865646770584044,2.292872248998646,facebook/sam2-hiera-large,mean,0.49992704172580255,5,graph,29,z-score,umap,56,True,True,heuristic,5.0,2.976643981209429,5,False,True,True,False,True,True,True,0.6701542163196206,0.6220641314366324,0.7005742806397595,0.4925931461059868,0.9350616642554129,0.02453088707452967,COMPLETE,,0.0,0
655,0.0,graph,40,z-score,pca,56,True,False,silhouette,transformer.resblocks.10,ViT-B/32,blocks.4,dinov2_vitb14,layer2,resnet50,structural,0.004559421137257184,0.8020708108315745,False,100,16,0.8124458048000216,0.9291737218435945,24,3,0.532827784326625,2.7662843418857053,facebook/sam2-hiera-large,mean,0.4836095936273056,3,kmeans,37,z-score,pca,22,False,False,silhouette,3.0,1.09352765475587,3,True,True,False,True,True,False,False,0.7061923487262322,0.650902408779528,0.66346720975246,0.5791612142382967,0.5003713436230915,0.8154163278089634,COMPLETE,,0.0,0
656,0.0,graph,35,z-score,svd,46,False,True,heuristic,transformer.resblocks.11,ViT-B/32,blocks.11,dinov2_vitb14,layer1,resnet50,semantic,0.0019503482845114276,0.8497183953599036,False,200,8,0.9684826287878447,0.9245574598289343,28,4,0.5655879253473111,2.442625466571471,facebook/sam2-hiera-large,mean,0.4063265089867494,5,graph,28,root-norm,svd,52,True,True,silhouette,,3.397173186401487,5,False,False,False,False,False,True,False,0.6613657458244424,0.6957749700145538,0.6811973764814315,0.03844861940479558,0.9760760410179483,0.8460127231562173,COMPLETE,,0.0,0
657,0.0,graph,24,l2,umap,34,True,False,heuristic,transformer.resblocks.11,ViT-B/32,blocks.7,dinov2_vitb14,conv1,resnet50,semantic,0.004322374211133835,0.8247964369246216,True,50,32,0.9798090391012821,0.9406921362134988,19,3,0.7621958589232682,1.8355463855038088,facebook/sam2-hiera-large,top_k_mean,0.3582285920123679,3,graph,17,l2,umap,64,False,True,heuristic,7.0,4.744416785091498,3,True,True,True,False,True,False,True,0.6953575761654294,0.6865995116916607,0.5879449422361176,0.22240911555621362,0.6982914234771553,0.9255759841596911,COMPLETE,,0.0,0
658,0.0,kmeans,38,z-score,svd,44,False,True,silhouette,transformer.resblocks.10,ViT-B/32,blocks.4,dinov2_vitb14,layer4,resnet50,structural,0.005805854434406498,0.7954097650116386,False,100,16,0.9554026934390328,0.950130014862486,22,4,1.19159665607997,1.970110280663687,facebook/sam2-hiera-large,mean,0.23910091429981756,3,kmeans,11,z-score,pca,17,True,False,silhouette,5.0,2.102564078365979,5,False,True,False,True,False,True,False,0.738520069516292,0.5030597422071786,0.41311253132472675,0.6169529477317716,0.738863113215233,0.2763733122963049,COMPLETE,,0.0,0
659,0.0,graph,33,root-norm,pca,53,True,True,heuristic,transformer.resblocks.9,ViT-B/32,blocks.11,dinov2_vitb14,layer3,resnet50,semantic,0.0022003377251212366,0.7103153026048982,True,200,8,0.8399181399866147,0.9545313190217235,23,2,1.0767199771962273,2.1198121304991693,facebook/sam2-hiera-large,median,0.26519727157924006,5,graph,25,z-score,umap,42,False,True,heuristic,3.0,3.930956045302095,3,True,True,True,False,True,True,True,0.556612280950261,0.7433845627089911,0.46832386159276085,0.14783572997250025,0.31080091902555124,0.4023851536970691,COMPLETE,,0.0,0
644,0.0,graph,20,z-score,svd,25,False,True,heuristic,transformer.resblocks.11,ViT-B/32,blocks.11,dinov2_vitb14,layer4,resnet50,semantic,0.004624927757328793,0.7636511927101994,False,50,8,0.8852797871030696,0.9418626009151827,20,3,1.0333679803884226,2.9359698856441323,facebook/sam2-hiera-large,mean,0.1731891571996389,5,kmeans,27,root-norm,umap,23,False,True,silhouette,5.0,1.5380235055570828,5,True,True,False,False,False,True,False,0.750115644036413,0.7315943998867332,0.7181372262205165,0.2813684920686096,0.676340089041091,0.0012354455104003348,COMPLETE,,0.0,0
645,0.0,kmeans,36,l2,svd,36,True,False,heuristic,transformer.resblocks.10,ViT-B/32,blocks.4,dinov2_vitb14,layer3,resnet50,structural,0.0023429238642766,0.8423732112485689,True,200,32,0.8338425130362529,0.9271398262310184,23,4,0.9722254947234771,2.4944390091046356,facebook/sam2-hiera-large,mean,0.14112194794256178,3,graph,18,z-score,svd,45,True,False,heuristic,3.0,4.221587100606026,5,False,True,True,True,True,False,True,0.7103184600257556,0.6803390515980686,0.4373552677954494,0.3929135988421781,0.027297366202334944,0.6059154225593556,COMPLETE,,0.0,0
646,0.0,graph,39,z-score,pca,30,False,True,silhouette,transformer.resblocks.11,ViT-B/32,blocks.11,dinov2_vitb14,layer3,resnet50,semantic,0.001270174035509931,0.6765406951327966,False,100,16,0.8681866068121259,0.9632663517852428,16,3,0.9293510463628735,2.7909545401162106,facebook/sam2-hiera-large,top_k_mean,0.20518174654881174,3,kmeans,22,l2,pca,16,False,True,silhouette,5.0,1.240504044415067,3,True,True,False,False,False,True,False,0.7637403669529352,0.5568841684244451,0.5496298491868545,0.20980994702252997,0.9573152459659783,0.7961155458740318,COMPLETE,,0.0,0
647,0.0,graph,37,l2,umap,43,True,False,heuristic,transformer.resblocks.11,ViT-B/32,blocks.7,dinov2_vitb14,layer1,resnet50,semantic,0.0076952753734788005,0.6272119258925271,True,50,8,0.9758167681688614,0.9208733704926977,24,2,0.9929475152504336,1.5601130351896033,facebook/sam2-hiera-large,mean,0.15577658210692238,5,graph,39,z-score,umap,48,True,False,silhouette,,2.7008285236058613,5,False,False,True,True,True,False,False,0.7013520548258754,0.5702121645086943,0.5355973222368902,0.16458379193246264,0.518668865675525,0.20863687899774977,COMPLETE,,0.0,0
