number,value,params_dino_pipeline.clustering.clusterer.method,params_dino_pipeline.clustering.clusterer.n_neighbors,params_dino_pipeline.clustering.feature_processing.normalizer.method,params_dino_pipeline.clustering.feature_processing.reducer.method,params_dino_pipeline.clustering.feature_processing.reducer.n_components,params_dino_pipeline.clustering.feature_processing.run_normalization,params_dino_pipeline.clustering.feature_processing.run_reduction,params_dino_pipeline.clustering.k_selection.method,params_extractors.clip.layer_name,params_extractors.clip.model_name,params_extractors.dino_v2.layer_name,params_extractors.dino_v2.model_name,params_extractors.resnet.layer_name,params_extractors.resnet.model_name,params_fusion_pipeline.clustering.k_selection.k_source,params_heuristic_settings.filter_params.filter_min_area_perc,params_heuristic_settings.filter_params.nms_iou_threshold,params_heuristic_settings.filter_params.use_nms,params_heuristic_settings.generator_params.min_mask_region_area,params_heuristic_settings.generator_params.points_per_side,params_heuristic_settings.generator_params.pred_iou_thresh,params_heuristic_settings.generator_params.stability_score_thresh,params_heuristic_settings.k_heuristic_formulas.max_k,params_heuristic_settings.k_heuristic_formulas.semantic_base,params_heuristic_settings.k_heuristic_formulas.semantic_scale_factor,params_heuristic_settings.k_heuristic_formulas.structural_multiplier,params_heuristic_settings.sam_model,params_labeler.aggregation_method,params_labeler.aggregation_top_k_perc,params_labeler.top_n_labels,params_resnet_pipeline.clustering.clusterer.method,params_resnet_pipeline.clustering.clusterer.n_neighbors,params_resnet_pipeline.clustering.feature_processing.normalizer.method,params_resnet_pipeline.clustering.feature_processing.reducer.method,params_resnet_pipeline.clustering.feature_processing.reducer.n_components,params_resnet_pipeline.clustering.feature_processing.run_normalization,params_resnet_pipeline.clustering.feature_processing.run_reduction,params_resnet_pipeline.clustering.k_selection.method,params_resnet_pipeline.image_preprocessing.blur_kernel_size,params_resnet_pipeline.image_preprocessing.clahe_clip_limit,params_resnet_pipeline.image_preprocessing.sobel_kernel_size,params_resnet_pipeline.image_preprocessing.use_clahe,params_resnet_pipeline.image_preprocessing.use_gaussian_blur,params_resnet_pipeline.image_preprocessing.use_grayscale,params_resnet_pipeline.image_preprocessing.use_sobel_edges,params_run_dino_pipeline,params_run_fusion_pipeline,params_run_resnet_pipeline,params_validator_settings.final_threshold,params_validator_settings.semantic_threshold,params_validator_settings.structural_threshold,params_validator_settings.weights.clip_confidence,params_validator_settings.weights.dino_iou,params_validator_settings.weights.resnet_iou,state,user_attrs_error,user_attrs_max_clip_confidence,user_attrs_num_correct_segments
71,0.0,graph,37,z-score,pca,21,True,True,heuristic,transformer.resblocks.9,ViT-B/32,blocks.11,dinov2_vitb14,layer1,resnet50,semantic,0.003553553152785699,0.8002308152939566,False,200,16,0.8938057549286562,0.9421377168241561,25,3,0.5701613922866785,1.914029909371217,facebook/sam2-hiera-large,mean,0.24471969074452224,3,graph,37,root-norm,svd,60,False,False,silhouette,3.0,4.095221139093898,5,True,True,True,False,True,False,False,0.7024199712795348,0.6658255229528067,0.5172105003171806,0.1591630568125715,0.29435853992808414,0.00207779847328296,COMPLETE,,0.0,0
72,0.0,graph,39,z-score,pca,19,True,True,heuristic,transformer.resblocks.9,ViT-B/32,blocks.11,dinov2_vitb14,layer1,resnet50,semantic,0.0028540505731319043,0.84079668146725,False,200,16,0.9082794451354947,0.9327498467763,26,4,0.5309073804918711,2.023696939594622,facebook/sam2-hiera-large,mean,0.279964060980886,3,graph,40,root-norm,svd,63,False,False,silhouette,3.0,4.908022105515614,5,True,True,True,False,True,False,False,0.6482506640970757,0.7226259103259495,0.47716446145822716,0.10068376644648239,0.4037455397894076,0.10309360169319923,COMPLETE,,0.0,0
73,0.0,graph,38,z-score,pca,16,True,True,heuristic,transformer.resblocks.9,ViT-B/32,blocks.11,dinov2_vitb14,layer1,resnet50,semantic,0.002424738288358182,0.8195829688046804,False,200,16,0.9159184219384368,0.9392025109119391,28,3,0.5281124178947877,1.7945064594858238,facebook/sam2-hiera-large,mean,0.2636935008467191,3,graph,36,root-norm,svd,58,False,False,silhouette,3.0,4.358673620013672,5,True,True,True,False,True,False,False,0.6647636512135069,0.6884337540726737,0.6856270346156114,0.25165697767536577,0.2312081888495751,0.05514620998833211,COMPLETE,,0.0,0
74,0.0,graph,23,z-score,pca,25,True,True,heuristic,transformer.resblocks.9,ViT-B/32,blocks.11,dinov2_vitb14,conv1,resnet50,semantic,0.00473346672420525,0.8307342510264575,False,200,16,0.9257243832105613,0.9272826298089591,26,4,0.7027513371545513,1.6290252549368078,facebook/sam2-hiera-large,mean,0.28995099893581844,3,graph,38,root-norm,umap,61,False,False,silhouette,,4.593981279834835,5,False,False,True,False,True,False,False,0.7114457546603103,0.7017989460957113,0.49252905996573165,0.17502805457281775,0.3432291256884557,0.03346355437705484,COMPLETE,,0.0,0
75,0.0,kmeans,38,l2,svd,60,True,True,silhouette,transformer.resblocks.11,ViT-B/32,blocks.11,dinov2_vitb14,layer1,resnet50,semantic,0.003952310558043813,0.7851602509295765,True,200,32,0.9362703381369551,0.9309284985353538,25,3,0.7679435927579925,2.082412472701214,facebook/sam2-hiera-large,top_k_mean,0.3104159785730928,3,graph,39,z-score,svd,64,False,False,silhouette,3.0,1.4635277614046531,5,True,True,False,False,False,True,False,0.6760649194519828,0.6262024809428993,0.5059229184353009,0.3137326850014767,0.4481512619404371,0.8331248658408109,COMPLETE,,0.0,0
124,0.0,graph,21,l2,svd,58,False,False,heuristic,transformer.resblocks.11,ViT-B/32,blocks.11,dinov2_vitb14,layer3,resnet50,structural,0.007936886562451456,0.743784447201422,False,100,32,0.8695317420493379,0.922751984334407,18,3,1.0058390823113723,2.516097134502688,facebook/sam2-hiera-large,mean,0.19172979718461364,5,graph,31,z-score,umap,16,False,True,silhouette,3.0,3.0344931144284666,5,True,True,True,False,False,True,True,0.5939172081600802,0.7175742427593239,0.5464870071698434,0.2140538437643917,0.8155652137830427,0.7675401472666695,COMPLETE,,0.0,0
125,0.0,graph,34,z-score,pca,63,False,False,heuristic,transformer.resblocks.11,ViT-B/32,blocks.4,dinov2_vitb14,layer1,resnet50,semantic,0.002484236116070588,0.7241943089212088,True,200,32,0.8283611321153732,0.9356649859554371,22,3,0.9672863225778265,2.35071985776065,facebook/sam2-hiera-large,top_k_mean,0.42848713038917524,5,graph,29,l2,svd,50,True,False,silhouette,7.0,3.631463123432825,5,True,True,False,False,True,True,True,0.7446739756047136,0.6647726477269302,0.7019193732797255,0.33007517462197916,0.6976667218221471,0.7240723038923526,COMPLETE,,0.0,0
126,0.0,graph,32,l2,svd,38,True,True,silhouette,transformer.resblocks.9,ViT-B/32,blocks.11,dinov2_vitb14,layer3,resnet50,structural,0.004598081036968765,0.7737661084891438,False,200,16,0.8586976969814736,0.9681592017180186,23,4,1.078182039896518,2.605988546362043,facebook/sam2-hiera-large,mean,0.46415232676641965,3,kmeans,26,z-score,pca,47,False,True,heuristic,5.0,3.4751263680465367,3,False,True,True,False,False,True,False,0.6157651491033266,0.7390720046486858,0.7410888536158914,0.1904582636022277,0.17887540689250478,0.2922274530585509,COMPLETE,,0.0,0
127,0.0,kmeans,17,z-score,umap,23,False,False,heuristic,transformer.resblocks.10,ViT-B/32,blocks.7,dinov2_vitb14,layer1,resnet50,semantic,0.0019326616382576854,0.6383855118135704,True,50,32,0.8423887355548079,0.9319766324380552,29,3,0.6618102307458934,1.6843060264020158,facebook/sam2-hiera-large,median,0.24582813687861005,3,graph,20,z-score,umap,62,True,False,silhouette,3.0,3.934326027101526,5,True,True,False,True,True,False,False,0.7398333710125347,0.729035079631599,0.7482482228433539,0.05134825972818721,0.7703900525596369,0.9784372644600088,COMPLETE,,0.0,0
128,0.0,graph,30,root-norm,pca,60,True,True,silhouette,transformer.resblocks.11,ViT-B/32,blocks.4,dinov2_vitb14,layer3,resnet50,semantic,0.0029836742925537976,0.7317711452748762,False,100,8,0.8536205207171375,0.9174076644478542,30,4,0.7999361272537694,2.560327984552381,facebook/sam2-hiera-large,mean,0.3807133487466796,5,kmeans,32,root-norm,svd,49,False,True,heuristic,,4.585277087881731,3,True,False,True,False,True,True,True,0.6829258282143545,0.5789412401479923,0.7282457141892855,0.8432729650483732,0.7413533519342862,0.41321991417266213,COMPLETE,,0.0,0
129,0.0,graph,18,l2,svd,45,False,False,heuristic,transformer.resblocks.10,ViT-B/32,blocks.11,dinov2_vitb14,layer1,resnet50,structural,0.00639720047460489,0.6647905984746558,True,200,16,0.8765920376962402,0.920904681712528,21,3,0.5220361771313803,2.479349214464448,facebook/sam2-hiera-large,top_k_mean,0.45627729316496773,3,graph,39,z-score,umap,64,True,False,silhouette,3.0,1.6129318911226531,5,False,True,False,True,False,False,False,0.711523256715444,0.4651159130167196,0.5758184226495029,0.3967371599001692,0.8352818628010504,0.5404960744638605,COMPLETE,,0.0,0
130,0.0,kmeans,40,z-score,pca,28,True,True,silhouette,transformer.resblocks.11,ViT-B/32,blocks.7,dinov2_vitb14,layer2,resnet50,semantic,0.002305062753142394,0.7534778799787222,False,200,32,0.9542742228553908,0.954835709599692,24,4,0.946245344357845,1.6094464425759603,facebook/sam2-hiera-large,mean,0.12230406350846398,5,kmeans,22,l2,umap,44,False,True,heuristic,7.0,3.3301338409982586,3,True,True,False,False,True,True,True,0.7329838384279321,0.5601842006491712,0.4995793773469961,0.1028797766765939,0.037492503276662655,0.1124055052944607,COMPLETE,,0.0,0
131,0.0,graph,15,l2,svd,32,False,True,silhouette,transformer.resblocks.11,ViT-B/32,blocks.4,dinov2_vitb14,layer3,resnet50,structural,0.007302310853509832,0.6977779663877637,False,100,8,0.8520391733840252,0.958741009887507,21,2,0.9906369401993373,2.6638387843421327,facebook/sam2-hiera-large,mean,0.2190265460875648,5,kmeans,40,root-norm,umap,56,True,True,heuristic,3.0,4.559168567328362,5,False,True,True,False,False,False,True,0.785195912610498,0.6687978765774041,0.47347487222841184,0.0006904991411554057,0.3783443353266507,0.7518898456101841,COMPLETE,,0.0,0
116,0.0,graph,36,root-norm,svd,30,True,True,silhouette,transformer.resblocks.11,ViT-B/32,blocks.11,dinov2_vitb14,layer3,resnet50,semantic,0.00833206242594328,0.6240897647640437,False,200,16,0.8781339972160311,0.977164218788427,26,3,0.6813199214083593,2.5704727517239943,facebook/sam2-hiera-large,mean,0.2707933998675529,5,kmeans,37,l2,svd,62,False,True,heuristic,,3.522457400830343,3,True,False,True,False,True,True,False,0.518382594743603,0.6487510603459874,0.667000634101208,0.4091065133689517,0.6379478565738961,0.5082006356571754,COMPLETE,,0.0,0
117,0.0,kmeans,38,z-score,umap,41,False,False,heuristic,transformer.resblocks.10,ViT-B/32,blocks.7,dinov2_vitb14,layer2,resnet50,semantic,0.005320765809684661,0.8347743550196746,True,50,8,0.9060244475822387,0.9707972148433861,20,3,1.1002188280623926,2.663870278762544,facebook/sam2-hiera-large,median,0.10187488681213791,3,graph,40,z-score,umap,24,True,False,heuristic,7.0,2.3712970646482985,5,False,True,False,True,False,False,False,0.7775511722948002,0.6267221802278388,0.6576461630975633,0.7553983383291829,0.6960395833665839,0.6016425656936482,COMPLETE,,0.0,0
118,0.0,graph,11,l2,pca,50,True,True,silhouette,transformer.resblocks.9,ViT-B/32,blocks.11,dinov2_vitb14,layer1,resnet50,structural,0.008647005447144045,0.6879851898673739,False,200,16,0.9171164348370469,0.9263373893009582,30,3,1.1398461828130972,2.271117500190239,facebook/sam2-hiera-large,top_k_mean,0.3609267761407166,3,kmeans,38,root-norm,pca,19,False,True,silhouette,3.0,2.7498568853910514,3,True,True,False,False,True,False,True,0.7905387003528614,0.6865657472894717,0.5886732104807902,0.1509445045681129,0.33665086270177486,0.05643471152445011,COMPLETE,,0.0,0
119,0.0,graph,13,z-score,svd,43,False,False,heuristic,transformer.resblocks.11,ViT-B/32,blocks.4,dinov2_vitb14,layer3,resnet50,semantic,0.006876269948381286,0.6575747027018026,True,100,32,0.8924651824100636,0.9572345085369538,24,3,0.7123570369597914,1.8282948739465514,facebook/sam2-hiera-large,mean,0.35173767773826403,5,graph,28,z-score,svd,56,True,False,heuristic,,2.5895862016892646,5,False,False,True,False,True,True,False,0.6697500498217728,0.7063236235097671,0.6936601975671179,0.5471819673860334,0.5436625750596046,0.821662772587269,COMPLETE,,0.0,0
120,0.0,kmeans,39,root-norm,umap,25,True,True,silhouette,transformer.resblocks.10,ViT-B/32,blocks.7,dinov2_vitb14,layer4,resnet50,structural,0.005627713730061071,0.7352890606496981,False,50,8,0.9326710793759945,0.966795893164145,25,4,0.7622649340456051,2.702966020532494,facebook/sam2-hiera-large,mean,0.2857393379914288,3,kmeans,13,z-score,umap,39,False,True,silhouette,3.0,1.9914157748946124,3,True,True,False,True,False,False,False,0.6540447211590452,0.5324088874841989,0.48407565867529545,0.018404203701327115,0.3144905606217992,0.9289504059122711,COMPLETE,,0.0,0
121,0.0,graph,20,l2,svd,64,False,False,heuristic,transformer.resblocks.11,ViT-B/32,blocks.4,dinov2_vitb14,layer3,resnet50,structural,0.0012021223825750852,0.7474947636931123,False,100,32,0.867969795380828,0.9289976720908362,20,3,1.022198353647445,2.5332175122283256,facebook/sam2-hiera-large,mean,0.41432546599993136,5,graph,33,z-score,umap,53,False,True,silhouette,3.0,1.0044888197963708,5,True,True,True,False,False,True,True,0.7292147731133231,0.7368941334321735,0.7226058988503465,0.3162846899250279,0.7340489543848396,0.862809251098899,COMPLETE,,0.0,0
122,0.0,graph,19,l2,svd,62,False,False,heuristic,transformer.resblocks.11,ViT-B/32,blocks.4,dinov2_vitb14,layer3,resnet50,structural,0.009557266624449508,0.7193796086399656,False,100,32,0.8808848126601422,0.9785408013946428,19,3,1.0511123102385986,2.3885157217897537,facebook/sam2-hiera-large,mean,0.4012449140629266,5,graph,35,z-score,umap,54,False,True,silhouette,3.0,3.367188502758598,5,True,True,True,False,False,True,True,0.7067164601600776,0.7481318323003588,0.7193639563226372,0.36242710148982815,0.6725107497676954,0.22946232011441975,COMPLETE,,0.0,0
123,0.0,graph,16,l2,svd,61,False,False,heuristic,transformer.resblocks.11,ViT-B/32,blocks.4,dinov2_vitb14,layer3,resnet50,structural,0.001704447822914268,0.7621398449356096,False,100,32,0.8325380640045015,0.9743790842998667,21,3,0.8988881936418877,2.457555692638642,facebook/sam2-hiera-large,mean,0.3724987834940491,5,graph,24,z-score,umap,58,False,True,silhouette,3.0,3.1997877730330795,5,True,True,True,False,False,True,True,0.7208640803851184,0.7235057638685857,0.708410951240175,0.26840677824649334,0.7905582824627293,0.7990720592043402,COMPLETE,,0.0,0
108,0.0,graph,15,root-norm,umap,20,False,True,heuristic,transformer.resblocks.11,ViT-B/32,blocks.11,dinov2_vitb14,layer1,resnet50,semantic,0.007448461766013678,0.6141751854620505,True,200,16,0.8859832971868467,0.9614542169165431,15,2,0.9159580884779228,2.0632912977770945,facebook/sam2-hiera-large,top_k_mean,0.1252162778406953,3,graph,15,root-norm,umap,45,True,True,heuristic,,1.8102782029475517,3,True,False,False,True,True,True,True,0.66296584745554,0.5689762017667375,0.4912546150341956,0.2940261719835903,0.24432989740431693,0.6660934447061777,COMPLETE,,0.0,0
109,0.0,kmeans,10,z-score,pca,53,True,False,silhouette,transformer.resblocks.9,ViT-B/32,blocks.11,dinov2_vitb14,layer3,resnet50,structural,0.00894867901250304,0.7903876532723868,False,50,32,0.9744164695566533,0.9741780347168675,21,4,0.9436236238211614,2.3616839926570696,facebook/sam2-hiera-large,mean,0.3030171154767376,5,kmeans,17,z-score,pca,62,False,False,silhouette,7.0,2.493595384530309,5,True,True,False,False,False,False,False,0.765806066838957,0.5486848527065138,0.6757216792734526,0.5730428288957553,0.8781672893621177,0.5598106944148797,COMPLETE,,0.0,0
110,0.0,graph,22,l2,svd,17,True,True,heuristic,transformer.resblocks.10,ViT-B/32,blocks.7,dinov2_vitb14,layer4,resnet50,semantic,0.0014613690546839688,0.7057441771122489,True,200,8,0.9217064625248503,0.9146072759076793,29,3,0.9806462256706558,1.7524334346560944,facebook/sam2-hiera-large,mean,0.2358992106108811,3,graph,37,z-score,svd,18,True,True,heuristic,3.0,4.223653656652497,3,False,True,True,True,True,True,False,0.6382054832062389,0.672006604099781,0.687801445156903,0.5237384467228728,0.2858581501841717,0.9335626564924638,COMPLETE,,0.0,0
111,0.0,graph,14,l2,svd,39,False,False,heuristic,transformer.resblocks.11,ViT-B/32,blocks.4,dinov2_vitb14,conv1,resnet50,structural,0.005976274137771555,0.6287475797287451,False,100,8,0.8645033300409637,0.9029025711443472,22,3,1.1105367834241342,2.639229859439387,facebook/sam2-hiera-large,mean,0.15635651402623454,5,graph,39,z-score,umap,59,False,True,heuristic,3.0,3.12417321603661,5,False,True,True,False,False,False,True,0.7363374954892272,0.6596657508842605,0.7366289771804975,0.03472907901745953,0.5955550739737646,0.9985479739203961,COMPLETE,,0.0,0
112,0.0,graph,16,l2,svd,40,False,False,heuristic,transformer.resblocks.11,ViT-B/32,blocks.4,dinov2_vitb14,conv1,resnet50,structural,0.006162888582145127,0.8234204625228874,False,100,8,0.8019234981492221,0.917344268172451,17,3,1.0278345160235052,2.4175613471835975,facebook/sam2-hiera-large,mean,0.13889139875177917,5,graph,40,z-score,umap,63,False,True,heuristic,3.0,3.674199018315342,5,False,True,True,False,False,False,True,0.7257755685038673,0.6175887004774976,0.7273940769723666,0.0831660049381573,0.6557622612527729,0.953926764852065,COMPLETE,,0.0,0
113,0.0,graph,37,l2,svd,34,False,False,heuristic,transformer.resblocks.11,ViT-B/32,blocks.4,dinov2_vitb14,conv1,resnet50,structural,0.00568669281425254,0.6703921535334719,False,100,8,0.8072532061997995,0.9773633006040958,18,3,1.1964886338023017,2.4960803909664633,facebook/sam2-hiera-large,mean,0.1718728816879496,5,graph,39,z-score,umap,64,False,True,heuristic,3.0,3.3947469295223556,5,False,True,True,False,False,False,True,0.759436681056234,0.693558828840738,0.5075725386995421,0.4616250006844693,0.4284296179460408,0.9766097239075322,COMPLETE,,0.0,0
114,0.0,graph,25,l2,svd,37,False,False,heuristic,transformer.resblocks.11,ViT-B/32,blocks.4,dinov2_vitb14,conv1,resnet50,structural,0.007126517399333978,0.6444798644076912,False,100,8,0.8170997928152354,0.9113272198316427,17,3,1.178377798655508,2.778926909208927,facebook/sam2-hiera-large,mean,0.11873878883398756,5,graph,18,z-score,umap,60,False,True,heuristic,3.0,3.270064834899451,5,False,True,True,False,False,False,True,0.7159694094276469,0.6417815493392656,0.6220290965369736,0.23713813223524594,0.7148591003242245,0.905355881478167,COMPLETE,,0.0,0
115,0.0,graph,12,z-score,pca,52,False,False,heuristic,transformer.resblocks.11,ViT-B/32,blocks.4,dinov2_vitb14,layer1,resnet50,structural,0.0010130589309355596,0.7526865015340389,True,100,32,0.9492575351270043,0.9454986434878883,19,3,1.0692088225146938,2.884255019276316,facebook/sam2-hiera-large,top_k_mean,0.11491927909121187,3,graph,36,z-score,umap,42,False,False,silhouette,5.0,2.124156975874169,5,False,True,False,False,False,False,True,0.7489044520021173,0.6788770116707435,0.74558938649975,0.12589815206396748,0.5822562655806116,0.8917930965972911,COMPLETE,,0.0,0
100,0.0,graph,38,l2,pca,18,False,True,heuristic,transformer.resblocks.11,ViT-B/32,blocks.11,dinov2_vitb14,layer1,resnet50,structural,0.009303930424187206,0.6320406400162837,True,200,32,0.8731177432573933,0.9369027585816101,21,4,0.502324769736916,1.9840656632465976,facebook/sam2-hiera-large,top_k_mean,0.10750443691885511,5,kmeans,34,root-norm,svd,40,True,False,heuristic,3.0,2.675344261945163,3,True,True,False,True,False,False,False,0.7556122725071451,0.7281534233039495,0.6143015916596322,0.6473241333086942,0.6111416125796677,0.4936873455581858,COMPLETE,,0.0,0
101,0.0,kmeans,11,l2,svd,43,True,False,silhouette,transformer.resblocks.11,ViT-B/32,blocks.4,dinov2_vitb14,layer2,resnet50,structural,0.005422299023853396,0.6103923660181584,False,100,8,0.9789522408220499,0.9724603043386782,23,3,1.1283336136988549,2.857984242630358,facebook/sam2-hiera-large,median,0.32130070900987545,5,kmeans,16,root-norm,umap,52,True,True,silhouette,,3.389413940763778,3,False,False,True,False,False,True,True,0.7274930566042126,0.6557584714368179,0.5963150872536298,0.8085971041522435,0.6359226218837973,0.636463285396873,COMPLETE,,0.0,0
102,0.0,kmeans,15,l2,svd,50,True,False,silhouette,transformer.resblocks.11,ViT-B/32,blocks.4,dinov2_vitb14,layer2,resnet50,structural,0.006061650353256008,0.6017189744016768,False,100,8,0.9631291991227466,0.975807368050728,18,2,0.7818228785415531,2.6055722408207362,facebook/sam2-hiera-large,median,0.4953949101096896,5,kmeans,30,root-norm,umap,43,True,True,silhouette,,3.7437276011357463,3,False,False,True,False,False,True,True,0.6810098939975974,0.6250507316394286,0.44983824390430227,0.9602659771675233,0.4892121929968911,0.7324308751052332,COMPLETE,,0.0,0
103,0.0,kmeans,20,l2,svd,56,True,False,silhouette,transformer.resblocks.11,ViT-B/32,blocks.4,dinov2_vitb14,layer2,resnet50,structural,0.006358135793429708,0.7311525340859538,False,100,8,0.9757720262987053,0.953293942167277,19,4,1.148848746984667,2.5325985700383855,facebook/sam2-hiera-large,median,0.18169978183780522,5,kmeans,31,root-norm,umap,50,True,True,silhouette,,3.079512415375421,3,False,False,True,False,False,True,True,0.69917278519111,0.589766043559094,0.605093184622008,0.9085633913848332,0.46873996265723133,0.774023868496228,COMPLETE,,0.0,0
104,0.0,kmeans,13,l2,svd,46,True,False,silhouette,transformer.resblocks.11,ViT-B/32,blocks.4,dinov2_vitb14,layer2,resnet50,structural,0.007685390913762194,0.7788970979178481,False,100,8,0.9586537869257048,0.9795584199942335,19,3,1.0725520398093575,2.68907786224296,facebook/sam2-hiera-large,median,0.3402140419995434,5,graph,26,root-norm,umap,47,True,True,silhouette,,3.552323756512949,3,False,False,True,False,False,True,True,0.5093433480502001,0.6414062322580929,0.6315496580449135,0.9049663106100534,0.20311177188993482,0.15990813241124568,COMPLETE,,0.0,0
