number,value,params_dino_pipeline.clustering.clusterer.method,params_dino_pipeline.clustering.clusterer.n_neighbors,params_dino_pipeline.clustering.feature_processing.normalizer.method,params_dino_pipeline.clustering.feature_processing.reducer.method,params_dino_pipeline.clustering.feature_processing.reducer.n_components,params_dino_pipeline.clustering.feature_processing.run_normalization,params_dino_pipeline.clustering.feature_processing.run_reduction,params_dino_pipeline.clustering.k_selection.method,params_extractors.clip.layer_name,params_extractors.clip.model_name,params_extractors.dino_v2.layer_name,params_extractors.dino_v2.model_name,params_extractors.resnet.layer_name,params_extractors.resnet.model_name,params_fusion_pipeline.clustering.k_selection.k_source,params_heuristic_settings.filter_params.filter_min_area_perc,params_heuristic_settings.filter_params.nms_iou_threshold,params_heuristic_settings.filter_params.use_nms,params_heuristic_settings.generator_params.min_mask_region_area,params_heuristic_settings.generator_params.points_per_side,params_heuristic_settings.generator_params.pred_iou_thresh,params_heuristic_settings.generator_params.stability_score_thresh,params_heuristic_settings.k_heuristic_formulas.max_k,params_heuristic_settings.k_heuristic_formulas.semantic_base,params_heuristic_settings.k_heuristic_formulas.semantic_scale_factor,params_heuristic_settings.k_heuristic_formulas.structural_multiplier,params_heuristic_settings.sam_model,params_labeler.aggregation_method,params_labeler.aggregation_top_k_perc,params_labeler.top_n_labels,params_resnet_pipeline.clustering.clusterer.method,params_resnet_pipeline.clustering.clusterer.n_neighbors,params_resnet_pipeline.clustering.feature_processing.normalizer.method,params_resnet_pipeline.clustering.feature_processing.reducer.method,params_resnet_pipeline.clustering.feature_processing.reducer.n_components,params_resnet_pipeline.clustering.feature_processing.run_normalization,params_resnet_pipeline.clustering.feature_processing.run_reduction,params_resnet_pipeline.clustering.k_selection.method,params_resnet_pipeline.image_preprocessing.blur_kernel_size,params_resnet_pipeline.image_preprocessing.clahe_clip_limit,params_resnet_pipeline.image_preprocessing.sobel_kernel_size,params_resnet_pipeline.image_preprocessing.use_clahe,params_resnet_pipeline.image_preprocessing.use_gaussian_blur,params_resnet_pipeline.image_preprocessing.use_grayscale,params_resnet_pipeline.image_preprocessing.use_sobel_edges,params_run_dino_pipeline,params_run_fusion_pipeline,params_run_resnet_pipeline,params_validator_settings.final_threshold,params_validator_settings.semantic_threshold,params_validator_settings.structural_threshold,params_validator_settings.weights.clip_confidence,params_validator_settings.weights.dino_iou,params_validator_settings.weights.resnet_iou,state,user_attrs_error,user_attrs_max_clip_confidence,user_attrs_num_correct_segments
648,0.0,graph,30,root-norm,svd,60,True,True,silhouette,transformer.resblocks.9,ViT-B/32,blocks.11,dinov2_vitb14,layer2,resnet50,structural,0.005304284486344993,0.7550378762905604,False,200,32,0.8733417674868176,0.9140295156432491,29,4,0.8149069205084105,2.5785181754547444,facebook/sam2-hiera-large,median,0.2974219837919557,3,graph,33,z-score,umap,58,False,True,heuristic,3.0,3.0720942569153857,3,True,True,False,False,True,True,True,0.6294749788133328,0.5482681709183783,0.6341907026139928,0.12387878697040722,0.4719810671387924,0.9990843027905787,COMPLETE,,0.0,0
649,0.0,kmeans,38,z-score,pca,16,False,True,heuristic,transformer.resblocks.10,ViT-B/32,blocks.4,dinov2_vitb14,conv1,resnet50,semantic,0.007989247768544188,0.6709346878206376,False,100,16,0.8506486036564508,0.9708710947862621,15,3,1.0696499519991012,2.9997010581593773,facebook/sam2-hiera-large,mean,0.384686537651994,5,kmeans,35,z-score,pca,63,True,True,silhouette,7.0,3.539796842332307,5,False,True,True,False,False,True,False,0.7311489924489567,0.6592535757334754,0.519002407387606,0.26028858051026116,0.36170812538347197,0.9599722518396661,COMPLETE,,0.0,0
650,0.0,graph,18,z-score,svd,52,True,False,heuristic,transformer.resblocks.11,ViT-B/32,blocks.11,dinov2_vitb14,layer3,resnet50,structural,0.006053161579775455,0.7294225731414725,True,50,8,0.9203398736060581,0.9346770825514409,26,3,0.5463641157484324,2.1886997540391944,facebook/sam2-hiera-large,mean,0.4515231326069097,3,graph,10,root-norm,umap,44,False,False,heuristic,5.0,4.086002090442317,3,True,True,False,True,True,False,True,0.7173396805633929,0.5113186284589428,0.5597694694813432,0.32699762178532327,0.5728824323256787,0.8803159960762635,COMPLETE,,0.0,0
651,0.0,graph,17,l2,umap,62,False,True,silhouette,transformer.resblocks.10,ViT-B/32,blocks.4,dinov2_vitb14,layer4,resnet50,semantic,0.0048393556630791515,0.8093973973804643,False,200,32,0.9338527212210492,0.9466855351293686,25,4,0.6643334901753005,2.033088830418479,facebook/sam2-hiera-large,mean,0.4368654418183424,5,kmeans,36,z-score,svd,18,True,True,silhouette,,3.712167315490706,5,False,False,False,False,False,True,False,0.5814895043799638,0.7204476954518854,0.5733201534197099,0.07307438706429842,0.05540211312072285,0.5363701522343148,COMPLETE,,0.0,0
700,0.0,graph,22,z-score,svd,47,False,True,heuristic,transformer.resblocks.11,ViT-B/32,blocks.11,dinov2_vitb14,layer2,resnet50,semantic,0.0016703535008062453,0.652996815843854,False,50,8,0.9426433956887604,0.9708422291489919,17,3,1.0162253968714414,1.6535311771261871,facebook/sam2-hiera-large,mean,0.16919619000616268,5,kmeans,33,z-score,svd,41,False,True,silhouette,7.0,2.535945492219597,5,True,True,False,False,False,True,False,0.662872793058674,0.5394950539018725,0.48935499019963463,0.25183319642647206,0.8912132513136098,0.10279049622177845,COMPLETE,,0.0,0
701,0.0,kmeans,35,l2,umap,32,True,False,heuristic,transformer.resblocks.10,ViT-B/32,blocks.7,dinov2_vitb14,conv1,resnet50,structural,0.006961504002423558,0.7488066178887917,True,100,32,0.8540486687822371,0.913123779160852,30,3,0.7310897676471024,1.819786007325587,facebook/sam2-hiera-large,top_k_mean,0.17844027696131548,3,graph,40,l2,umap,63,True,False,heuristic,3.0,4.928680643312986,5,False,True,True,True,True,False,True,0.6946650217796954,0.6190002754933824,0.6942688651815014,0.21653608508845693,0.4611254067198021,0.7826465468079344,COMPLETE,,0.0,0
702,0.0,graph,18,root-norm,pca,41,False,True,silhouette,transformer.resblocks.9,ViT-B/32,blocks.4,dinov2_vitb14,layer4,resnet50,semantic,0.007473147443910352,0.7341685591891114,False,200,16,0.8405764405610243,0.9164054966409898,26,3,0.8883521596629329,2.4896193072047383,facebook/sam2-hiera-large,median,0.27052212661390224,3,kmeans,38,z-score,pca,20,False,True,silhouette,5.0,3.4025147967155855,3,True,True,False,False,False,True,False,0.7482390585772569,0.6637253838975209,0.6482028415897741,0.06008472395293953,0.6423872166977399,0.8323508430186225,COMPLETE,,0.0,0
703,0.0,graph,11,z-score,svd,27,True,False,heuristic,transformer.resblocks.11,ViT-B/32,blocks.11,dinov2_vitb14,layer3,resnet50,semantic,0.00500015215461352,0.6167283892049849,True,50,8,0.9656718874834457,0.9349581404491918,25,4,0.8721276461762598,2.3890469751019014,facebook/sam2-hiera-large,mean,0.150019818830632,5,graph,11,z-score,umap,23,True,True,silhouette,,3.2536353532924083,5,False,False,True,False,True,False,False,0.5764237703153285,0.5873160084961099,0.666378575122877,0.15268089435468454,0.6004327513529994,0.1951347504765031,COMPLETE,,0.0,0
704,0.0,graph,40,l2,svd,51,True,True,silhouette,transformer.resblocks.11,ViT-B/32,blocks.4,dinov2_vitb14,layer1,resnet50,structural,0.007820054440905668,0.7081720913486977,False,200,32,0.9509186050826308,0.9211548027348976,22,2,0.9645970431006917,2.22592973128805,facebook/sam2-hiera-large,mean,0.11463625848973144,3,graph,39,root-norm,pca,17,False,False,heuristic,3.0,1.73980229786314,3,True,True,False,True,True,True,True,0.6759966861493394,0.5174941298271083,0.7350600575411452,0.3383117834636376,0.9579311768645479,0.9058284103580589,COMPLETE,,0.0,0
705,0.0,kmeans,33,z-score,pca,39,False,True,heuristic,transformer.resblocks.10,ViT-B/32,blocks.11,dinov2_vitb14,layer3,resnet50,semantic,0.0022681234198057357,0.8121975829146842,False,100,16,0.8898503213901053,0.9547074596221753,29,4,1.1123755941717672,2.5451066119295374,facebook/sam2-hiera-large,mean,0.23494833879265248,5,kmeans,36,z-score,svd,34,True,True,silhouette,3.0,3.634886610009083,5,False,True,True,False,False,True,False,0.5169094219718556,0.7331884557285756,0.6194345460652065,0.3932941708744404,0.8389594621498827,0.6034168480055976,COMPLETE,,0.0,0
706,0.0,graph,39,z-score,umap,56,True,False,heuristic,transformer.resblocks.11,ViT-B/32,blocks.11,dinov2_vitb14,layer2,resnet50,structural,0.009998259404866457,0.6706207991256539,True,50,8,0.8674099545619743,0.9223064259348244,20,3,1.0816003930201248,2.475073910429999,facebook/sam2-hiera-large,top_k_mean,0.2581345087589885,3,graph,20,l2,umap,47,False,False,heuristic,5.0,3.1400609765936256,3,True,True,False,True,True,False,True,0.7681235859900483,0.7170052842791538,0.6336542746357198,0.6839123054219726,0.6856923882920596,0.8123871157779435,COMPLETE,,0.0,0
707,0.0,graph,14,l2,svd,48,False,True,silhouette,transformer.resblocks.10,ViT-B/32,blocks.7,dinov2_vitb14,layer1,resnet50,semantic,0.005444226127873007,0.7762805933773146,False,200,32,0.8097904570744692,0.9252828499664523,27,3,1.0545785865432977,2.596516613514677,facebook/sam2-hiera-large,mean,0.3003229860886659,5,kmeans,31,z-score,umap,62,True,True,silhouette,,1.3525238920237248,5,False,False,False,False,False,True,False,0.7166578403085627,0.6535747820280029,0.5527049947606091,0.18674048233280668,0.9119298525659115,0.6517920814300155,COMPLETE,,0.0,0
692,0.0,kmeans,32,l2,svd,24,False,True,silhouette,transformer.resblocks.10,ViT-B/32,blocks.4,dinov2_vitb14,layer2,resnet50,structural,0.00358285523983589,0.8394044813170835,False,100,16,0.9303967850062724,0.9591320749716792,28,3,0.5413707331808395,1.5021344560327121,facebook/sam2-hiera-large,mean,0.32888871386088203,3,graph,39,z-score,pca,48,True,True,heuristic,3.0,4.269050359547833,5,False,True,False,False,False,True,True,0.795535667579909,0.687121651992086,0.6096690057394595,0.1932834539897998,0.9973229882920894,0.9296911199672102,COMPLETE,,0.0,0
693,0.0,graph,37,z-score,pca,52,True,True,heuristic,transformer.resblocks.11,ViT-B/32,blocks.11,dinov2_vitb14,conv1,resnet50,semantic,0.006301336201135045,0.6000497927204027,True,200,32,0.8475684770356144,0.9672868170464607,24,2,0.7744661115612221,2.868119925480801,facebook/sam2-hiera-large,mean,0.22302708224924978,5,kmeans,34,root-norm,umap,45,False,False,silhouette,7.0,1.4847352116486567,3,True,True,True,True,True,True,False,0.7030583107989902,0.43644919550144223,0.6768228196148194,0.13557066511606913,0.6182334511336354,0.41823165206351065,COMPLETE,,0.0,0
694,0.0,graph,30,l2,svd,19,True,False,silhouette,transformer.resblocks.11,ViT-B/32,blocks.11,dinov2_vitb14,layer3,resnet50,structural,0.0013156821538762486,0.6069660921743616,False,50,8,0.8296011144048734,0.9641641696442573,27,4,0.7859169312535145,2.6796708859768987,facebook/sam2-hiera-large,mean,0.3887961691010335,3,graph,40,z-score,svd,43,True,True,silhouette,3.0,2.2908296563767525,5,False,True,False,False,True,False,False,0.5841785801652265,0.5582090544723524,0.6848520046391802,0.8944364890206598,0.5790616124714343,0.9838419267456193,COMPLETE,,0.0,0
695,0.0,graph,27,z-score,umap,18,False,True,heuristic,transformer.resblocks.10,ViT-B/32,blocks.4,dinov2_vitb14,layer1,resnet50,semantic,0.0084419726214828,0.7617856901731573,False,100,16,0.9031494044754934,0.9072515919513382,29,3,0.8101186618366552,2.5645311949366763,facebook/sam2-hiera-large,top_k_mean,0.12589237533095093,5,graph,29,l2,umap,18,False,True,heuristic,,3.0034745892636083,3,True,False,False,False,False,True,True,0.6302414142534438,0.5080178176242468,0.6392407480583499,0.16435425588065877,0.3800311472737328,0.14747208109374899,COMPLETE,,0.0,0
696,0.0,graph,17,root-norm,pca,43,True,False,heuristic,transformer.resblocks.11,ViT-B/32,blocks.7,dinov2_vitb14,layer4,resnet50,semantic,0.005785461620996435,0.7577891003839917,True,200,32,0.8419830846814172,0.9767881587174707,26,3,0.7042040360235182,2.1722533670247426,facebook/sam2-hiera-large,mean,0.16064926427681153,3,kmeans,35,z-score,pca,27,True,False,silhouette,5.0,1.6512681324488645,5,False,True,True,True,True,False,False,0.756927181111172,0.7431456450429852,0.5741521116745825,0.23354019112134516,0.4142387713581055,0.31471585730250656,COMPLETE,,0.0,0
697,0.0,kmeans,38,z-score,svd,40,False,True,silhouette,transformer.resblocks.9,ViT-B/32,blocks.11,dinov2_vitb14,layer3,resnet50,structural,0.0010097795839539541,0.6408616623205541,False,50,8,0.8326720566903097,0.9280136196089419,15,4,0.9071909506432257,2.0878925563340065,facebook/sam2-hiera-large,median,0.1983386358811424,3,graph,23,z-score,umap,21,False,True,heuristic,3.0,2.017422904443595,3,True,True,False,False,False,True,True,0.6560356975649017,0.5270000600859285,0.7135369829691907,0.024520160389129003,0.8053817479331186,0.5438501581916975,COMPLETE,,0.0,0
698,0.0,graph,31,l2,svd,16,True,True,heuristic,transformer.resblocks.11,ViT-B/32,blocks.4,dinov2_vitb14,layer1,resnet50,semantic,0.004209142042001202,0.7244703818818203,True,100,16,0.8808494648370878,0.9491610447499873,18,4,0.522464758850996,1.6837708925473924,facebook/sam2-hiera-large,mean,0.3739971411606233,5,kmeans,21,z-score,pca,49,True,False,silhouette,5.0,2.7511083484773615,5,False,True,True,True,True,True,False,0.5989997563345143,0.6809044708043405,0.6576189157543519,0.5683687454327785,0.7272492876084283,0.02099845990400199,COMPLETE,,0.0,0
699,0.0,graph,19,z-score,pca,38,True,False,silhouette,transformer.resblocks.10,ViT-B/32,blocks.11,dinov2_vitb14,layer3,resnet50,structural,0.00958707712154821,0.6971297043239417,False,200,32,0.8714736792118039,0.9194846545702684,23,2,1.1458636739821921,2.7458407086476293,facebook/sam2-hiera-large,mean,0.27887085540045553,3,graph,30,root-norm,umap,30,False,True,heuristic,,3.823085503435317,3,True,False,False,False,True,False,True,0.5072945607516729,0.6410775890299677,0.4982312023018495,0.2955563750587181,0.7667127193315897,0.9635850504232477,COMPLETE,,0.0,0
684,0.0,kmeans,36,z-score,svd,50,True,False,heuristic,transformer.resblocks.11,ViT-B/32,blocks.11,dinov2_vitb14,layer2,resnet50,structural,0.006626549036246718,0.7049559698807227,True,50,8,0.8973905945127003,0.9182032140395338,27,3,0.5006124338740005,2.5037173866767723,facebook/sam2-hiera-large,top_k_mean,0.2902653517626609,3,kmeans,22,l2,svd,64,False,True,silhouette,5.0,3.746618307794943,3,True,True,True,False,True,False,False,0.614201192505297,0.7014549984669103,0.6446708152541099,0.5031444446950226,0.5568266786331242,0.5163093944448499,COMPLETE,,0.0,0
685,0.0,graph,14,l2,umap,59,False,True,silhouette,transformer.resblocks.9,ViT-B/32,blocks.7,dinov2_vitb14,layer3,resnet50,semantic,0.007362282179442945,0.7293385965145203,False,200,32,0.8743645646504618,0.9607387912606036,19,3,0.9301335293747867,2.450412391005946,facebook/sam2-hiera-large,mean,0.11873017999261172,3,graph,24,z-score,umap,61,True,False,silhouette,7.0,4.517292170077016,5,False,True,False,True,False,True,False,0.7147372750669644,0.5957188817416362,0.7305986678818268,0.6376102414459286,0.5247775539595476,0.633126179292614,COMPLETE,,0.0,0
686,0.0,graph,20,root-norm,svd,57,True,False,heuristic,transformer.resblocks.10,ViT-B/32,blocks.4,dinov2_vitb14,layer1,resnet50,semantic,0.0043288582275311455,0.7405292352432231,True,100,16,0.9092321951983996,0.9744439424072933,18,4,1.173404588557536,2.698726153415707,facebook/sam2-hiera-large,median,0.47442223455245686,5,graph,36,z-score,pca,36,False,True,heuristic,,1.8869010078535176,3,True,False,True,False,True,False,True,0.6368957264002016,0.7374441104004453,0.5666723517531101,0.11236562988302688,0.21521306176389404,0.798359250226223,COMPLETE,,0.0,0
687,0.0,graph,21,z-score,pca,55,True,True,silhouette,transformer.resblocks.11,ViT-B/32,blocks.11,dinov2_vitb14,conv1,resnet50,structural,0.0038482654608644005,0.7917748128629797,False,200,8,0.86649022568677,0.9363851181718202,21,2,0.6303811886924267,2.011115725658286,facebook/sam2-hiera-large,mean,0.13551864609299416,3,kmeans,32,z-score,umap,55,True,True,silhouette,3.0,3.079658020955516,5,False,True,False,False,True,True,False,0.7419836401429907,0.7271145118557847,0.4471256660749783,0.046789718449753596,0.17878975861260946,0.4435200461509795,COMPLETE,,0.0,0
688,0.0,kmeans,40,l2,svd,35,False,True,heuristic,transformer.resblocks.11,ViT-B/32,blocks.11,dinov2_vitb14,layer4,resnet50,semantic,0.0026281671929014737,0.8314443061937605,False,50,32,0.878241771648679,0.9237713547040947,16,3,1.0025624587654651,2.2756242454761297,facebook/sam2-hiera-large,mean,0.36306634252563913,5,graph,10,root-norm,svd,29,False,False,heuristic,5.0,1.557966466801261,3,True,True,True,True,False,True,True,0.7228312045779101,0.6293493488604724,0.5293253038957941,0.9639708078598639,0.25714690233086074,0.6933954955130448,COMPLETE,,0.0,0
689,0.0,graph,28,z-score,pca,46,True,False,heuristic,transformer.resblocks.10,ViT-B/32,blocks.4,dinov2_vitb14,layer3,resnet50,structural,0.0021162319621389836,0.807918632905123,True,100,16,0.9765608016774234,0.9528372149285939,28,3,1.0945883392676947,2.7893432216353427,facebook/sam2-hiera-large,mean,0.49244423966731216,3,kmeans,27,z-score,umap,39,True,True,silhouette,3.0,2.9411533737437066,5,False,True,False,False,True,False,False,0.7802229274717077,0.7077077837557599,0.7425462819213311,0.32254558959019225,0.7834244507812287,0.7237917281691401,COMPLETE,,0.0,0
690,0.0,graph,39,z-score,umap,49,False,True,silhouette,transformer.resblocks.11,ViT-B/32,blocks.7,dinov2_vitb14,layer1,resnet50,semantic,0.004469152061087479,0.629486140233964,False,200,32,0.9600463745383455,0.9302679725696806,22,3,1.0363984881374155,2.1387471496358597,facebook/sam2-hiera-large,top_k_mean,0.10753431011301504,5,graph,37,l2,pca,60,False,False,heuristic,,2.4300346012875673,3,True,False,False,True,False,True,True,0.5630173954494235,0.4974200457530043,0.5982482842270734,0.4288878623518893,0.34649638818161815,0.25351470629392286,COMPLETE,,0.0,0
691,0.0,graph,16,root-norm,svd,25,True,False,heuristic,transformer.resblocks.9,ViT-B/32,blocks.11,dinov2_vitb14,layer3,resnet50,semantic,0.009885000679111862,0.6900180838793415,True,50,8,0.9180502283713672,0.9444465862220633,30,4,0.7496771003560261,1.5504218947192214,facebook/sam2-hiera-large,median,0.31017967243250744,3,kmeans,31,z-score,umap,32,False,True,silhouette,5.0,1.9569306758146396,5,True,True,True,False,True,False,False,0.6460406218208136,0.6722922655360126,0.5149553957737454,0.3650073486796793,0.6983327358168814,0.8492106417951516,COMPLETE,,0.0,0
676,0.0,graph,38,l2,svd,26,True,True,heuristic,transformer.resblocks.11,ViT-B/32,blocks.11,dinov2_vitb14,layer1,resnet50,semantic,0.0011690947936357228,0.7840444287305253,True,200,32,0.8365118057067611,0.9690629718626621,28,2,0.642824059446578,2.2527908719217504,facebook/sam2-hiera-large,mean,0.24524442057743,5,graph,30,z-score,pca,58,True,True,silhouette,5.0,2.009573703556878,5,False,True,True,False,True,True,False,0.7747039771874642,0.5528325236150226,0.45767873964812844,0.3469203493738592,0.14759215257861513,0.9483903508095466,COMPLETE,,0.0,0
677,0.0,graph,17,z-score,pca,53,True,False,silhouette,transformer.resblocks.10,ViT-B/32,blocks.4,dinov2_vitb14,layer3,resnet50,structural,0.0024481730542385708,0.7658055013745696,False,100,16,0.9392644642277572,0.9375444648887858,23,3,0.823191423933357,1.9423100977221301,facebook/sam2-hiera-large,mean,0.35213396589494034,3,graph,40,root-norm,umap,57,False,False,heuristic,,2.3511702193733637,3,True,False,False,True,True,False,True,0.6785893016930621,0.7199976998019761,0.5421008077320069,0.9412833866820012,0.9737199625776564,0.7619764461241793,COMPLETE,,0.0,0
678,0.0,graph,37,z-score,svd,29,False,True,heuristic,transformer.resblocks.11,ViT-B/32,blocks.11,dinov2_vitb14,layer2,resnet50,semantic,0.005198439904686696,0.8204912716145051,False,50,8,0.860242193735011,0.9150499789508905,26,4,0.5587899707064324,2.644427937198852,facebook/sam2-hiera-large,mean,0.3377372488310666,5,kmeans,16,z-score,svd,37,True,True,silhouette,7.0,3.490134137907987,5,False,True,False,False,False,True,False,0.5922349805898989,0.6567632163078774,0.505898086868852,0.5955481301474722,0.7494777883214244,0.9828882260775343,COMPLETE,,0.0,0
679,0.0,graph,36,l2,umap,39,True,False,heuristic,transformer.resblocks.10,ViT-B/32,blocks.7,dinov2_vitb14,conv1,resnet50,structural,0.00472683193874897,0.7788617865471105,True,200,32,0.8219133667295689,0.9025282418023215,29,3,0.8001026518201158,2.903448276918232,facebook/sam2-hiera-large,top_k_mean,0.40126899391966725,3,graph,36,l2,umap,31,False,True,heuristic,3.0,2.1480779990685384,3,True,True,True,False,True,False,True,0.7092418060331264,0.6458033045462978,0.7017761735897365,0.7564106135222766,0.8487802896154913,0.064396312890838,COMPLETE,,0.0,0
680,0.0,kmeans,10,root-norm,svd,38,False,True,silhouette,transformer.resblocks.11,ViT-B/32,blocks.4,dinov2_vitb14,layer4,resnet50,semantic,0.005590815056716702,0.6349360884960871,False,100,16,0.803546308907407,0.9430468370447369,25,2,0.6566963447433004,2.345011638348367,facebook/sam2-hiera-large,median,0.1480136459418398,3,kmeans,39,z-score,pca,63,True,False,silhouette,5.0,3.3398619261684876,5,False,True,False,True,False,True,False,0.687722099455917,0.5666994921670512,0.7062323179370187,0.45718966209764195,0.9450534850161258,0.181915763620665,COMPLETE,,0.0,0
681,0.0,graph,15,z-score,pca,21,True,False,heuristic,transformer.resblocks.9,ViT-B/32,blocks.11,dinov2_vitb14,layer3,resnet50,semantic,0.009755833690116813,0.7147364832445285,True,50,8,0.8868781391885745,0.951581729209989,23,4,0.721180317976921,2.5306939278849554,facebook/sam2-hiera-large,mean,0.25099171210248855,5,graph,12,z-score,umap,16,False,True,heuristic,3.0,1.7902215651873263,5,True,True,True,False,True,True,True,0.5097841266843541,0.6110487782514057,0.6570503847628781,0.39626695205131346,0.8678622141682535,0.8677482148438203,COMPLETE,,0.0,0
