number,value,params_dino_pipeline.clustering.clusterer.method,params_dino_pipeline.clustering.clusterer.n_neighbors,params_dino_pipeline.clustering.feature_processing.normalizer.method,params_dino_pipeline.clustering.feature_processing.reducer.method,params_dino_pipeline.clustering.feature_processing.reducer.n_components,params_dino_pipeline.clustering.feature_processing.run_normalization,params_dino_pipeline.clustering.feature_processing.run_reduction,params_dino_pipeline.clustering.k_selection.method,params_extractors.clip.layer_name,params_extractors.clip.model_name,params_extractors.dino_v2.layer_name,params_extractors.dino_v2.model_name,params_extractors.resnet.layer_name,params_extractors.resnet.model_name,params_fusion_pipeline.clustering.k_selection.k_source,params_heuristic_settings.filter_params.filter_min_area_perc,params_heuristic_settings.filter_params.nms_iou_threshold,params_heuristic_settings.filter_params.use_nms,params_heuristic_settings.generator_params.min_mask_region_area,params_heuristic_settings.generator_params.points_per_side,params_heuristic_settings.generator_params.pred_iou_thresh,params_heuristic_settings.generator_params.stability_score_thresh,params_heuristic_settings.k_heuristic_formulas.max_k,params_heuristic_settings.k_heuristic_formulas.semantic_base,params_heuristic_settings.k_heuristic_formulas.semantic_scale_factor,params_heuristic_settings.k_heuristic_formulas.structural_multiplier,params_heuristic_settings.sam_model,params_labeler.aggregation_method,params_labeler.aggregation_top_k_perc,params_labeler.top_n_labels,params_resnet_pipeline.clustering.clusterer.method,params_resnet_pipeline.clustering.clusterer.n_neighbors,params_resnet_pipeline.clustering.feature_processing.normalizer.method,params_resnet_pipeline.clustering.feature_processing.reducer.method,params_resnet_pipeline.clustering.feature_processing.reducer.n_components,params_resnet_pipeline.clustering.feature_processing.run_normalization,params_resnet_pipeline.clustering.feature_processing.run_reduction,params_resnet_pipeline.clustering.k_selection.method,params_resnet_pipeline.image_preprocessing.blur_kernel_size,params_resnet_pipeline.image_preprocessing.clahe_clip_limit,params_resnet_pipeline.image_preprocessing.sobel_kernel_size,params_resnet_pipeline.image_preprocessing.use_clahe,params_resnet_pipeline.image_preprocessing.use_gaussian_blur,params_resnet_pipeline.image_preprocessing.use_grayscale,params_resnet_pipeline.image_preprocessing.use_sobel_edges,params_run_dino_pipeline,params_run_fusion_pipeline,params_run_resnet_pipeline,params_validator_settings.final_threshold,params_validator_settings.semantic_threshold,params_validator_settings.structural_threshold,params_validator_settings.weights.clip_confidence,params_validator_settings.weights.dino_iou,params_validator_settings.weights.resnet_iou,state,user_attrs_error,user_attrs_max_clip_confidence,user_attrs_num_correct_segments
563,0.0,kmeans,38,z-score,svd,49,False,True,silhouette,transformer.resblocks.11,ViT-B/32,blocks.11,dinov2_vitb14,layer4,resnet50,structural,0.0024003440415534746,0.7100016785520111,False,50,8,0.8563575576237066,0.9034583444895706,27,4,0.7392088842385228,2.5099295059445677,facebook/sam2-hiera-large,mean,0.3710240564506093,3,kmeans,30,root-norm,svd,62,False,True,silhouette,3.0,2.101020545551379,3,True,True,False,False,False,True,False,0.5060224357215475,0.6769429623530034,0.6707374457405956,0.13276663296319452,0.3029954347875426,0.7588043457112318,COMPLETE,,0.0,0
548,0.0,graph,35,l2,umap,16,True,False,silhouette,transformer.resblocks.11,ViT-B/32,blocks.7,dinov2_vitb14,layer3,resnet50,structural,0.0069024635840420736,0.8115531727699322,False,50,8,0.8750762332833263,0.9016207583151826,27,3,0.6506680059617695,2.6096012732667644,facebook/sam2-hiera-large,top_k_mean,0.24711143024428747,3,kmeans,36,l2,umap,25,True,True,silhouette,,3.243641517852408,5,False,False,False,False,True,False,False,0.7062896490650423,0.49943070062522094,0.4956272540161779,0.18117971527540452,0.807720197735614,0.02376568972084971,COMPLETE,,0.0,0
549,0.0,graph,24,z-score,svd,57,False,True,heuristic,transformer.resblocks.10,ViT-B/32,blocks.11,dinov2_vitb14,layer1,resnet50,semantic,0.006218796828742962,0.778590778122417,False,100,16,0.8676436376470131,0.9551286295736447,24,4,1.0425293818309331,1.6565074430035855,facebook/sam2-hiera-large,mean,0.35129324275755786,5,graph,21,z-score,pca,16,False,False,heuristic,3.0,2.2480026385004876,3,True,True,False,True,False,True,True,0.6358312466056302,0.5437785728983078,0.41581690542517036,0.5694095706289264,0.6609237560135853,0.4793623737315479,COMPLETE,,0.0,0
550,0.0,kmeans,32,root-norm,pca,20,True,False,heuristic,transformer.resblocks.9,ViT-B/32,blocks.4,dinov2_vitb14,layer3,resnet50,structural,0.005214759621691788,0.8202923545254641,True,200,32,0.888727243024709,0.9413998432160331,25,2,0.5745116387413703,2.918972713298808,facebook/sam2-hiera-large,median,0.268129396583077,3,kmeans,39,z-score,umap,20,True,True,silhouette,5.0,3.4541163221563664,5,True,True,True,False,True,False,False,0.5350298951976767,0.6923429641837656,0.6432179468957459,0.706007506813741,0.16936373701822535,0.2959886164567174,COMPLETE,,0.0,0
551,0.0,graph,23,z-score,svd,26,False,True,silhouette,transformer.resblocks.11,ViT-B/32,blocks.11,dinov2_vitb14,layer2,resnet50,semantic,0.007352637798377035,0.7963412061046555,False,50,8,0.9278686465106807,0.9224791166100949,22,3,0.6124808156964463,1.7390741618004335,facebook/sam2-hiera-large,mean,0.22969569443159105,3,graph,39,z-score,umap,63,False,False,heuristic,3.0,2.477712612334171,5,False,True,False,True,False,True,True,0.6042510047005168,0.40129114430379503,0.44897131881262253,0.7536632566514337,0.4173416085097311,0.8202492053531908,COMPLETE,,0.0,0
552,0.0,graph,31,l2,svd,22,True,False,heuristic,transformer.resblocks.10,ViT-B/32,blocks.4,dinov2_vitb14,layer1,resnet50,semantic,0.009990613078557094,0.6902803311892023,True,100,16,0.8387884873690451,0.9436436514382399,16,3,0.9686419286556578,2.7171294347283377,facebook/sam2-hiera-large,mean,0.38521504100184506,5,kmeans,31,root-norm,pca,46,False,True,silhouette,,3.0096912776034226,3,True,False,True,False,True,False,False,0.7712930842455819,0.5641377793686482,0.6968041599464013,0.14802682646602647,0.8674616427225629,0.9002301219806872,COMPLETE,,0.0,0
553,0.0,graph,39,z-score,pca,47,True,True,silhouette,transformer.resblocks.11,ViT-B/32,blocks.11,dinov2_vitb14,layer3,resnet50,structural,0.003215445706170028,0.6258597477558404,False,200,32,0.8145439046053995,0.9275254120343178,18,3,0.9262255976408883,2.8585987056887747,facebook/sam2-hiera-large,mean,0.4219719100749348,3,graph,30,z-score,svd,60,True,True,heuristic,5.0,1.6342714224813144,5,False,True,False,False,True,True,True,0.7136982198112412,0.7323840835153468,0.6772341262534949,0.35391436534033216,0.9991594895739947,0.6816567890814734,COMPLETE,,0.0,0
554,0.0,kmeans,37,l2,umap,48,False,True,heuristic,transformer.resblocks.11,ViT-B/32,blocks.7,dinov2_vitb14,conv1,resnet50,semantic,0.00709259393769956,0.847844679381897,False,50,8,0.8784167482512434,0.9323437148323171,29,4,0.8127300584339305,2.4181791013712024,facebook/sam2-hiera-large,top_k_mean,0.15874705211508422,5,kmeans,40,l2,umap,63,False,False,silhouette,3.0,1.8830061416509996,3,True,True,True,True,False,True,False,0.7252489359663461,0.6848976317724361,0.744218758654859,0.2249725301517269,0.35202804838021695,0.06464537771256551,COMPLETE,,0.0,0
555,0.0,graph,16,root-norm,svd,36,True,False,heuristic,transformer.resblocks.9,ViT-B/32,blocks.11,dinov2_vitb14,layer4,resnet50,structural,0.005986042729074871,0.6594690459432525,True,100,16,0.9055073754999033,0.9384434523963887,23,3,0.9058069812753264,1.8728031173076534,facebook/sam2-hiera-large,median,0.49420021235514666,3,graph,14,z-score,umap,50,True,True,silhouette,7.0,3.7540491893125774,5,False,True,False,False,True,False,False,0.6277282828514384,0.6531567141948739,0.5225069145454374,0.27009698667243603,0.623633298070742,0.4311365636541629,COMPLETE,,0.0,0
604,0.0,graph,37,root-norm,svd,46,True,False,silhouette,transformer.resblocks.9,ViT-B/32,blocks.11,dinov2_vitb14,layer1,resnet50,structural,0.009998101086563039,0.6040878077226353,False,50,8,0.919163098914916,0.92360646253086,18,3,0.5551513068707942,2.848190455807304,facebook/sam2-hiera-large,median,0.3030949332473677,3,kmeans,30,z-score,umap,54,True,True,silhouette,,4.6575293144937016,5,False,False,False,False,True,False,False,0.5392372389581869,0.6650371250079097,0.7186865541834055,0.15917199751112965,0.8644402658398004,0.8668074924724432,COMPLETE,,0.0,0
605,0.0,graph,13,l2,svd,48,False,True,heuristic,transformer.resblocks.10,ViT-B/32,blocks.4,dinov2_vitb14,conv1,resnet50,semantic,0.0060263365074113805,0.7815456020140191,False,100,16,0.865691164229464,0.9336794839545952,29,3,1.150527765691177,2.6904208260130407,facebook/sam2-hiera-large,mean,0.3782261275879693,5,graph,29,z-score,pca,24,False,False,heuristic,5.0,1.6022979291891049,3,True,True,False,True,False,True,True,0.7033270634164643,0.4429228449004506,0.6914731372826709,0.39979495693769945,0.11280467380515921,0.8410232643003682,COMPLETE,,0.0,0
606,0.0,kmeans,38,z-score,pca,51,True,False,heuristic,transformer.resblocks.11,ViT-B/32,blocks.11,dinov2_vitb14,layer3,resnet50,structural,0.0018659422486763987,0.6381310450269899,True,200,32,0.8869075098168195,0.9581966002975743,23,4,1.0536651948737523,2.6056286260418036,facebook/sam2-hiera-large,mean,0.479179749279824,3,kmeans,33,root-norm,umap,50,True,True,silhouette,7.0,1.4795303869149588,5,True,True,True,False,True,False,False,0.7201281223152672,0.6302389648269843,0.5540710935340182,0.5387372874612862,0.6701314618066359,0.07779673729637554,COMPLETE,,0.0,0
607,0.0,graph,34,l2,svd,37,False,True,silhouette,transformer.resblocks.11,ViT-B/32,blocks.11,dinov2_vitb14,layer4,resnet50,semantic,0.0030090474042279705,0.7988650628665996,False,50,8,0.9372116369926642,0.9219948646878283,26,3,1.1038202270988449,1.6341979336958676,facebook/sam2-hiera-large,mean,0.13004985811514383,3,graph,40,z-score,svd,17,False,False,heuristic,3.0,3.377300542053735,5,False,True,False,True,False,True,True,0.7308736872046089,0.7261677491024316,0.4850262514945182,0.26841879206282376,0.8307423211952071,0.02484301729757339,COMPLETE,,0.0,0
608,0.0,graph,17,z-score,umap,26,True,False,heuristic,transformer.resblocks.10,ViT-B/32,blocks.4,dinov2_vitb14,layer3,resnet50,semantic,0.00627635968146132,0.6739039310414303,True,100,16,0.9726563944180542,0.9162017095089354,20,2,0.8839467586945525,2.965312907821566,facebook/sam2-hiera-large,top_k_mean,0.20818527343961782,5,kmeans,39,l2,umap,39,False,True,silhouette,,3.5572811815799685,3,True,False,True,False,True,False,False,0.5781396656854015,0.5006962412632852,0.5311111266340355,0.6448786583696738,0.7168335347148452,0.8865737462209742,COMPLETE,,0.0,0
609,0.0,graph,14,root-norm,pca,28,True,True,silhouette,transformer.resblocks.11,ViT-B/32,blocks.7,dinov2_vitb14,layer1,resnet50,structural,0.0024465911562937576,0.624250980187474,False,200,32,0.8118528958834229,0.9085189672485755,28,4,0.9261936640807704,1.550796013101192,facebook/sam2-hiera-large,mean,0.17646591478478074,3,graph,26,z-score,pca,45,True,True,heuristic,5.0,1.9463682194079672,5,False,True,False,False,True,True,True,0.6725617748579354,0.5445295491009388,0.5783988794688523,0.18139027109235653,0.4899870733430257,0.9757783512067413,COMPLETE,,0.0,0
610,0.0,kmeans,26,z-score,svd,19,False,True,heuristic,transformer.resblocks.9,ViT-B/32,blocks.11,dinov2_vitb14,layer3,resnet50,semantic,0.004503722266289114,0.6670020956858291,False,50,8,0.8032501912204882,0.9305556387181689,22,4,0.7920706044806574,1.7362766691307052,facebook/sam2-hiera-large,median,0.34649050655191926,5,kmeans,37,z-score,umap,57,False,False,silhouette,3.0,2.541711513596564,3,True,True,True,True,False,True,False,0.7753609752681276,0.5557773237185585,0.6045281555550454,0.10909805715650808,0.7643784739951822,0.30989925361074855,COMPLETE,,0.0,0
611,0.0,graph,22,l2,svd,62,True,False,heuristic,transformer.resblocks.10,ViT-B/32,blocks.4,dinov2_vitb14,layer2,resnet50,structural,0.004248609957263363,0.7107296922056292,True,100,16,0.8395232408764567,0.9783520627878753,26,3,0.5347461943720874,2.3055289191079917,facebook/sam2-hiera-large,mean,0.14102963266760188,3,graph,22,z-score,pca,63,True,True,silhouette,3.0,3.2847691469461107,5,False,True,False,False,True,False,False,0.7004061097420612,0.6390382801727789,0.6713187898594503,0.4818119346323592,0.8018571082545736,0.8106011483845003,COMPLETE,,0.0,0
596,0.0,graph,33,z-score,pca,47,True,False,heuristic,transformer.resblocks.10,ViT-B/32,blocks.4,dinov2_vitb14,layer2,resnet50,semantic,0.0037290990338102025,0.6188741710629061,True,100,16,0.9799773955314853,0.9453018385006893,22,3,1.0720634634499977,1.8083278007501313,facebook/sam2-hiera-large,mean,0.1225507727583175,3,graph,38,z-score,umap,22,False,True,heuristic,3.0,1.362147356793222,3,True,True,True,False,True,False,True,0.7146600355571272,0.7196255314712183,0.6999552894141984,0.6143388220363308,0.3166490183088482,0.9560822009532879,COMPLETE,,0.0,0
597,0.0,graph,35,z-score,umap,33,False,True,silhouette,transformer.resblocks.11,ViT-B/32,blocks.11,dinov2_vitb14,layer3,resnet50,structural,0.006993781682421077,0.6430314532859815,False,50,8,0.9036762945458753,0.9525750588463333,26,4,0.9647132452843015,2.4872107830745445,facebook/sam2-hiera-large,top_k_mean,0.224831279236509,3,kmeans,21,l2,svd,33,False,False,silhouette,5.0,2.134547164735083,5,True,True,False,True,False,True,False,0.6960934421422271,0.6789020164292364,0.44384610314847267,0.8327574966722215,0.9868703627921992,0.4434217650313002,COMPLETE,,0.0,0
598,0.0,kmeans,10,l2,svd,35,True,True,heuristic,transformer.resblocks.9,ViT-B/32,blocks.7,dinov2_vitb14,conv1,resnet50,semantic,0.008102581294406906,0.7062284705354712,True,200,32,0.9490221022832872,0.9264991761081076,21,3,0.7229809824889324,2.9094793709263103,facebook/sam2-hiera-large,mean,0.3169066034169503,5,graph,36,z-score,umap,64,True,True,heuristic,3.0,2.731853178763613,5,False,True,True,False,True,True,True,0.7621199168305723,0.587350934708135,0.7103935015590547,0.21849640454862107,0.9285576797261492,0.9984914630184984,COMPLETE,,0.0,0
599,0.0,graph,30,root-norm,svd,16,True,False,silhouette,transformer.resblocks.10,ViT-B/32,blocks.4,dinov2_vitb14,layer1,resnet50,structural,0.007235348288579821,0.8238648170800026,False,100,16,0.8567272156993984,0.9397875866927323,25,4,1.1738766106103735,2.6289567109917127,facebook/sam2-hiera-large,median,0.44567464032909326,3,kmeans,39,z-score,pca,20,False,False,silhouette,7.0,2.234529204831159,3,True,True,False,True,True,False,False,0.5006472656016632,0.7453449725422968,0.653841049825649,0.0004310897931401655,0.7364269254375908,0.5261370148826117,COMPLETE,,0.0,0
600,0.0,graph,38,z-score,pca,50,False,True,heuristic,transformer.resblocks.11,ViT-B/32,blocks.11,dinov2_vitb14,layer4,resnet50,semantic,0.0022159284997696226,0.7190470083001452,False,200,8,0.8468100021662865,0.9182404581428868,17,3,0.7674249342235148,2.7319665550386216,facebook/sam2-hiera-large,mean,0.2708799064376989,5,graph,40,z-score,umap,29,True,True,silhouette,,3.7894000258632445,5,False,False,False,False,False,True,True,0.6808345051164659,0.5691124656513511,0.5036197318601229,0.17168374007962955,0.6166149940995623,0.3488548066348446,COMPLETE,,0.0,0
601,0.0,graph,12,l2,svd,31,True,False,heuristic,transformer.resblocks.11,ViT-B/32,blocks.11,dinov2_vitb14,layer3,resnet50,semantic,0.003965772112158226,0.8136465060083683,True,50,32,0.8821721445563154,0.9599618534792903,15,3,0.9987394772594701,2.4363710330341,facebook/sam2-hiera-large,mean,0.11406571931189956,3,graph,20,root-norm,svd,51,False,True,heuristic,3.0,2.451405611554692,3,True,True,True,False,True,False,False,0.5729547758797626,0.6455377389506638,0.6790480006327924,0.3093575030213112,0.5889639769478506,0.4981250043328488,COMPLETE,,0.0,0
602,0.0,kmeans,39,z-score,pca,54,False,True,silhouette,transformer.resblocks.10,ViT-B/32,blocks.4,dinov2_vitb14,layer3,resnet50,structural,0.00345677599689335,0.8311021945219559,False,100,16,0.9303056798331704,0.9682332636773034,27,2,0.6233790797547344,2.201442632559945,facebook/sam2-hiera-large,mean,0.19326531022985624,3,kmeans,16,z-score,umap,26,True,False,silhouette,5.0,1.2009879313220453,5,False,True,False,True,False,True,False,0.5096404298750844,0.41744608994163135,0.6344115755031963,0.4430970186528105,0.8838250578982411,0.6203291652044313,COMPLETE,,0.0,0
603,0.0,graph,40,z-score,umap,59,True,True,heuristic,transformer.resblocks.11,ViT-B/32,blocks.7,dinov2_vitb14,layer2,resnet50,semantic,0.008585644037146966,0.6580398931120676,True,200,32,0.8774782628138297,0.9413912036840638,24,4,0.5720590383412621,2.561575574993304,facebook/sam2-hiera-large,top_k_mean,0.23130785853213207,5,graph,35,l2,pca,27,False,True,heuristic,3.0,1.845672271210437,3,True,True,True,False,True,True,True,0.5952965950033712,0.7374173644792448,0.5435916694853993,0.039108817957480516,0.5118100676452232,0.6998703974030078,COMPLETE,,0.0,0
588,0.0,graph,18,root-norm,svd,39,False,True,heuristic,transformer.resblocks.9,ViT-B/32,blocks.11,dinov2_vitb14,layer3,resnet50,semantic,0.006600130254210685,0.680229187442142,False,50,8,0.8760271550934962,0.9657924114209756,30,3,0.752493202052226,2.1116197572464963,facebook/sam2-hiera-large,median,0.26170580904573215,5,kmeans,40,z-score,umap,21,False,True,silhouette,3.0,3.1393568653516124,5,True,True,False,False,False,True,False,0.7508804363545012,0.5143611788494762,0.4708663880585477,0.4225742786881393,0.6438835412046393,0.41428987043067794,COMPLETE,,0.0,0
589,0.0,kmeans,22,l2,svd,17,True,False,heuristic,transformer.resblocks.11,ViT-B/32,blocks.11,dinov2_vitb14,layer2,resnet50,structural,0.005328323253361489,0.7927287148159773,True,200,32,0.9407177909879976,0.9436972650859712,18,4,0.8988989953957979,2.285393793161257,facebook/sam2-hiera-large,mean,0.1397395877781757,3,graph,29,z-score,pca,59,True,False,heuristic,3.0,4.755362596451834,5,False,True,True,True,True,False,True,0.6906948072094976,0.6195148068849134,0.5164344407326069,0.20685897901840283,0.4757409721992323,0.27759859927873254,COMPLETE,,0.0,0
590,0.0,graph,32,z-score,pca,50,False,True,silhouette,transformer.resblocks.10,ViT-B/32,blocks.4,dinov2_vitb14,conv1,resnet50,semantic,0.0033096695829864563,0.7234900585794065,False,100,16,0.8536812321161825,0.9198098674256545,27,2,0.9423388797773784,1.580562961256692,facebook/sam2-hiera-large,mean,0.4274843466580896,3,kmeans,36,root-norm,umap,62,False,True,silhouette,5.0,3.429626316785998,3,True,True,False,False,False,True,False,0.6463161549619798,0.6069778657733781,0.4251222462783393,0.8062295815482242,0.3664495696768577,0.5701998733952272,COMPLETE,,0.0,0
591,0.0,graph,19,z-score,svd,57,True,False,heuristic,transformer.resblocks.11,ViT-B/32,blocks.11,dinov2_vitb14,layer1,resnet50,semantic,0.009828572675713841,0.7393464684875776,True,50,8,0.8421850569244826,0.9463359608401865,23,3,1.02198504937562,2.662598012942119,facebook/sam2-hiera-large,mean,0.36532110075775487,5,graph,39,z-score,svd,43,True,False,silhouette,,3.9297606540396437,5,False,False,True,True,True,False,False,0.6206646938449767,0.5616076990688945,0.6432677892226075,0.5077177284634896,0.9619052021705196,0.8073466271764328,COMPLETE,,0.0,0
592,0.0,graph,23,l2,umap,23,True,True,silhouette,transformer.resblocks.10,ViT-B/32,blocks.7,dinov2_vitb14,layer4,resnet50,structural,0.004929899447015039,0.6957519919170584,False,200,32,0.9777634497190882,0.9067374830306171,16,4,1.0447124500471334,2.3995522107026277,facebook/sam2-hiera-large,top_k_mean,0.1701693736393475,3,graph,23,l2,umap,48,False,True,heuristic,7.0,4.465535788618071,3,True,True,False,False,True,True,True,0.7717554727089754,0.5065168174201992,0.562249718338946,0.12188494864279942,0.8487421238785167,0.7470514417587122,COMPLETE,,0.0,0
593,0.0,kmeans,17,root-norm,pca,55,False,True,heuristic,transformer.resblocks.11,ViT-B/32,blocks.4,dinov2_vitb14,layer3,resnet50,semantic,0.004634960109858869,0.6879091763884365,False,100,16,0.8290977223441938,0.9118497770932715,19,3,0.6562791768254679,2.0300974402139453,facebook/sam2-hiera-large,median,0.14849084537311455,5,kmeans,28,z-score,pca,60,True,True,silhouette,3.0,2.0314225417975837,5,False,True,True,False,False,True,False,0.7267131566659535,0.6908746325845159,0.4954393884192909,0.2531556376121157,0.8016613596449365,0.4711958781754417,COMPLETE,,0.0,0
594,0.0,graph,36,z-score,svd,38,True,False,heuristic,transformer.resblocks.9,ViT-B/32,blocks.11,dinov2_vitb14,layer3,resnet50,structural,0.004207520390324423,0.7644525036231917,True,50,8,0.8720154002778062,0.9501699219578063,25,3,0.5222871788239487,2.534640206183246,facebook/sam2-hiera-large,mean,0.16120171512965617,3,graph,33,z-score,umap,63,False,False,heuristic,5.0,4.953048578309301,3,True,True,False,True,True,False,True,0.5221325340258366,0.5497498143424266,0.6199181078850123,0.15088234581982457,0.6885546152572463,0.9090744632459825,COMPLETE,,0.0,0
595,0.0,graph,28,l2,svd,17,False,True,silhouette,transformer.resblocks.11,ViT-B/32,blocks.11,dinov2_vitb14,layer1,resnet50,semantic,0.007535836134825675,0.7545355988770728,False,200,32,0.899540710488524,0.963206182675942,29,2,0.9106246655335752,2.8064636387160196,facebook/sam2-hiera-large,mean,0.38308850131134814,5,kmeans,32,root-norm,pca,61,True,True,silhouette,,3.008419097573087,5,False,False,False,False,False,True,False,0.6332321626499987,0.7111183278924285,0.5926298403802001,0.35624648703430967,0.7797350630391858,0.9325864820780365,COMPLETE,,0.0,0
