number,value,params_dino_pipeline.clustering.clusterer.method,params_dino_pipeline.clustering.clusterer.n_neighbors,params_dino_pipeline.clustering.feature_processing.normalizer.method,params_dino_pipeline.clustering.feature_processing.reducer.method,params_dino_pipeline.clustering.feature_processing.reducer.n_components,params_dino_pipeline.clustering.feature_processing.run_normalization,params_dino_pipeline.clustering.feature_processing.run_reduction,params_dino_pipeline.clustering.k_selection.method,params_extractors.clip.layer_name,params_extractors.clip.model_name,params_extractors.dino_v2.layer_name,params_extractors.dino_v2.model_name,params_extractors.resnet.layer_name,params_extractors.resnet.model_name,params_fusion_pipeline.clustering.k_selection.k_source,params_heuristic_settings.filter_params.filter_min_area_perc,params_heuristic_settings.filter_params.nms_iou_threshold,params_heuristic_settings.filter_params.use_nms,params_heuristic_settings.generator_params.min_mask_region_area,params_heuristic_settings.generator_params.points_per_side,params_heuristic_settings.generator_params.pred_iou_thresh,params_heuristic_settings.generator_params.stability_score_thresh,params_heuristic_settings.k_heuristic_formulas.max_k,params_heuristic_settings.k_heuristic_formulas.semantic_base,params_heuristic_settings.k_heuristic_formulas.semantic_scale_factor,params_heuristic_settings.k_heuristic_formulas.structural_multiplier,params_heuristic_settings.sam_model,params_labeler.aggregation_method,params_labeler.aggregation_top_k_perc,params_labeler.top_n_labels,params_resnet_pipeline.clustering.clusterer.method,params_resnet_pipeline.clustering.clusterer.n_neighbors,params_resnet_pipeline.clustering.feature_processing.normalizer.method,params_resnet_pipeline.clustering.feature_processing.reducer.method,params_resnet_pipeline.clustering.feature_processing.reducer.n_components,params_resnet_pipeline.clustering.feature_processing.run_normalization,params_resnet_pipeline.clustering.feature_processing.run_reduction,params_resnet_pipeline.clustering.k_selection.method,params_resnet_pipeline.image_preprocessing.blur_kernel_size,params_resnet_pipeline.image_preprocessing.clahe_clip_limit,params_resnet_pipeline.image_preprocessing.sobel_kernel_size,params_resnet_pipeline.image_preprocessing.use_clahe,params_resnet_pipeline.image_preprocessing.use_gaussian_blur,params_resnet_pipeline.image_preprocessing.use_grayscale,params_resnet_pipeline.image_preprocessing.use_sobel_edges,params_run_dino_pipeline,params_run_fusion_pipeline,params_run_resnet_pipeline,params_validator_settings.final_threshold,params_validator_settings.semantic_threshold,params_validator_settings.structural_threshold,params_validator_settings.weights.clip_confidence,params_validator_settings.weights.dino_iou,params_validator_settings.weights.resnet_iou,state,user_attrs_error,user_attrs_max_clip_confidence,user_attrs_num_correct_segments
375,0.0,graph,37,root-norm,svd,45,True,False,silhouette,transformer.resblocks.10,ViT-B/32,blocks.11,dinov2_vitb14,conv1,resnet50,structural,0.001544583744372894,0.7560910314355883,False,100,16,0.8894940912125036,0.9773075557161652,24,4,0.8320689174475894,2.0092378365791506,facebook/sam2-hiera-large,median,0.223593890315331,3,kmeans,30,z-score,pca,42,False,False,silhouette,,3.0889267853209232,3,True,False,False,True,True,False,False,0.7747882887771794,0.555429003148254,0.42665531129001105,0.032569533773248234,0.7934454468431116,0.8379264769849506,COMPLETE,,0.0,0
376,0.0,graph,38,z-score,pca,29,False,True,heuristic,transformer.resblocks.9,ViT-B/32,blocks.4,dinov2_vitb14,layer3,resnet50,semantic,0.004718631985819572,0.6003523703656719,False,200,32,0.9551695213128727,0.9586284910627554,29,3,0.5456908068839225,2.9179730722265385,facebook/sam2-hiera-large,mean,0.13604249331249588,5,graph,36,z-score,umap,32,True,True,heuristic,3.0,1.26113352004137,5,False,True,False,False,False,True,True,0.5900690817962935,0.721762413212534,0.7278682390085858,0.9970645810590592,0.9842902148907392,0.8643056705395328,COMPLETE,,0.0,0
377,0.0,kmeans,39,z-score,svd,37,True,False,heuristic,transformer.resblocks.11,ViT-B/32,blocks.11,dinov2_vitb14,layer1,resnet50,structural,0.005925037673251006,0.7505694342626907,True,50,8,0.9708624898089314,0.9315853679666886,20,4,0.7995552323590326,2.3273267357892458,facebook/sam2-hiera-large,mean,0.11438922670263843,3,kmeans,33,z-score,umap,63,False,True,silhouette,5.0,1.769162186788861,3,True,True,True,False,True,False,False,0.6295935120315832,0.7496900012719432,0.6651018253196921,0.20883398217846316,0.829222287560198,0.3774630312187296,COMPLETE,,0.0,0
378,0.0,graph,17,l2,pca,58,False,True,silhouette,transformer.resblocks.10,ViT-B/32,blocks.4,dinov2_vitb14,layer4,resnet50,semantic,0.006532083219944485,0.8323389744364108,False,100,16,0.8761349658795446,0.9431097672675138,22,3,1.1525932572009359,2.584236071465263,facebook/sam2-hiera-large,mean,0.2845062789818416,3,graph,39,root-norm,svd,46,True,False,silhouette,3.0,3.2118086808499258,5,False,True,False,True,False,True,False,0.7022332600738954,0.7353030336929062,0.5875733089605356,0.3638869846784782,0.11123668488225388,0.4589157034688971,COMPLETE,,0.0,0
379,0.0,graph,22,z-score,svd,30,True,False,heuristic,transformer.resblocks.11,ViT-B/32,blocks.11,dinov2_vitb14,layer3,resnet50,semantic,0.0028086928678943968,0.7015552296240191,True,200,32,0.86294954772237,0.9233414907358286,26,3,0.8872840878042801,1.8606160598395538,facebook/sam2-hiera-large,top_k_mean,0.19098507145913168,5,graph,40,l2,pca,48,False,True,heuristic,,1.8608416072640726,3,True,False,True,False,True,True,True,0.5137414214378306,0.6877388411047113,0.6757294756337169,0.45158239117209265,0.6318659723205511,0.88259950609367,COMPLETE,,0.0,0
364,0.0,kmeans,26,root-norm,pca,54,False,True,heuristic,transformer.resblocks.9,ViT-B/32,blocks.7,dinov2_vitb14,layer1,resnet50,semantic,0.004527164555183344,0.7293081050108299,False,50,8,0.9608938677037129,0.9617710453627298,18,4,0.6537732894173848,2.6613058660615194,facebook/sam2-hiera-large,median,0.15049078441469524,5,kmeans,37,z-score,umap,54,True,True,silhouette,3.0,3.6745566193846675,5,True,True,True,False,False,True,False,0.5653672392122521,0.7243429640433913,0.5673902444923483,0.13925245851634835,0.6484575021381126,0.28596485843948904,COMPLETE,,0.0,0
365,0.0,graph,27,z-score,svd,56,True,False,heuristic,transformer.resblocks.11,ViT-B/32,blocks.11,dinov2_vitb14,layer3,resnet50,structural,0.007708044023175676,0.6058487255648191,True,200,32,0.8553717522444811,0.9406423405104192,24,3,1.0194022389227764,1.6130505534661677,facebook/sam2-hiera-large,mean,0.39264644717648506,3,graph,29,z-score,umap,17,False,False,heuristic,5.0,2.5621966414157327,5,False,True,False,True,True,False,True,0.6074920308871351,0.5465516894995833,0.6146476518023012,0.30119334212987225,0.6890121812266415,0.43537661664146854,COMPLETE,,0.0,0
366,0.0,graph,39,l2,pca,23,False,True,silhouette,transformer.resblocks.10,ViT-B/32,blocks.4,dinov2_vitb14,layer1,resnet50,semantic,0.008206516286556024,0.7232948144066667,False,100,16,0.9297126416511119,0.9559077488267447,28,3,1.0698094606329154,1.7184798349437254,facebook/sam2-hiera-large,mean,0.3127163724909428,5,kmeans,39,z-score,pca,51,False,True,silhouette,,3.3046121554422574,3,True,False,False,False,False,True,False,0.6210119842101207,0.5314801111668069,0.6045315449808517,0.4297312878162246,0.27591515625626684,0.10042647347833039,COMPLETE,,0.0,0
367,0.0,graph,25,z-score,svd,16,True,False,heuristic,transformer.resblocks.11,ViT-B/32,blocks.11,dinov2_vitb14,layer2,resnet50,semantic,0.004993046975459585,0.6966258525961806,True,200,8,0.8789325204900624,0.9214116897229486,15,4,1.0434081325920446,2.418522122704904,facebook/sam2-hiera-large,mean,0.27566850707762386,3,graph,27,root-norm,svd,46,True,False,silhouette,3.0,2.7684236693697293,5,False,True,True,True,True,False,True,0.6952018380558231,0.6740976904390972,0.4798855976016808,0.24391070463408454,0.21134805681590418,0.6866414483139661,COMPLETE,,0.0,0
368,0.0,graph,18,l2,umap,18,False,True,silhouette,transformer.resblocks.11,ViT-B/32,blocks.7,dinov2_vitb14,layer3,resnet50,structural,0.005392575522109179,0.7069591411258117,False,50,32,0.8348438508958267,0.9483154785758209,30,2,0.7297476899024928,2.464513096926524,facebook/sam2-hiera-large,top_k_mean,0.14273319873529816,3,graph,24,l2,umap,58,False,True,heuristic,7.0,3.974121354462244,3,True,True,False,False,False,True,False,0.6469883772865769,0.6571740601773651,0.6569639998951752,0.19008288228913084,0.9361414417210826,0.7679689886393956,COMPLETE,,0.0,0
369,0.0,kmeans,19,z-score,svd,59,True,True,heuristic,transformer.resblocks.10,ViT-B/32,blocks.11,dinov2_vitb14,conv1,resnet50,semantic,0.0043316786159520535,0.7397192340153117,True,100,16,0.800430759684481,0.9502919390987132,23,4,0.5023395851123841,2.787421871737589,facebook/sam2-hiera-large,mean,0.4113377953482511,5,kmeans,28,z-score,pca,21,True,True,silhouette,5.0,1.9563025484886638,5,False,True,True,False,True,True,False,0.7934499828623527,0.694610329012004,0.438670488675945,0.6166576547885888,0.7616996518684059,0.06976976985646514,COMPLETE,,0.0,0
370,0.0,graph,38,root-norm,pca,52,True,False,silhouette,transformer.resblocks.9,ViT-B/32,blocks.4,dinov2_vitb14,layer4,resnet50,structural,0.009997309190847103,0.6601803728951807,False,200,8,0.9487800893614602,0.929005334139376,26,3,0.9290529361238904,2.559518277106448,facebook/sam2-hiera-large,median,0.3553427044417994,3,graph,40,z-score,umap,61,False,False,heuristic,3.0,2.131882615344591,3,True,True,False,True,True,False,True,0.6829136693702194,0.5660079147355221,0.6330926045276231,0.3393349064033975,0.4176227257753932,0.6403919395395433,COMPLETE,,0.0,0
371,0.0,graph,33,z-score,svd,35,False,True,heuristic,transformer.resblocks.11,ViT-B/32,blocks.11,dinov2_vitb14,layer3,resnet50,semantic,0.001887844714035216,0.7624466168133205,False,50,32,0.9354590617165499,0.9125513768994298,27,2,0.5226392017344592,2.278787102649108,facebook/sam2-hiera-large,mean,0.10073900364707916,5,kmeans,12,z-score,umap,24,True,True,silhouette,,4.552904471147421,5,False,False,False,False,False,True,False,0.5753177139736305,0.6196607252932722,0.4725037125772045,0.16807108982381716,0.5884704234364581,0.9440625826905744,COMPLETE,,0.0,0
356,0.0,kmeans,28,l2,svd,27,False,True,silhouette,transformer.resblocks.10,ViT-B/32,blocks.4,dinov2_vitb14,layer1,resnet50,structural,0.004067195606235356,0.8366590995023442,False,100,32,0.9237170357792094,0.9098349397656399,16,2,1.0552693572664817,2.2315690671336292,facebook/sam2-hiera-large,mean,0.173074696445461,3,graph,39,root-norm,svd,37,True,True,heuristic,3.0,4.343432661032143,5,False,True,False,False,False,True,True,0.7337225334928383,0.5035594853315803,0.5127382848145905,0.34769743003961057,0.9701816672069387,0.6096990326703093,COMPLETE,,0.0,0
357,0.0,graph,34,z-score,pca,63,True,True,heuristic,transformer.resblocks.11,ViT-B/32,blocks.11,dinov2_vitb14,layer3,resnet50,semantic,0.009784446720057457,0.6133053552532653,True,200,16,0.8838913054407912,0.9450793693668211,21,3,1.140362406588696,2.384572825966588,facebook/sam2-hiera-large,mean,0.2536150634236613,5,kmeans,35,l2,pca,34,False,False,silhouette,5.0,1.9008955655105764,3,True,True,True,True,True,True,False,0.7197257390349724,0.7444672280036423,0.6445729397634619,0.20325750687076943,0.9028939949473506,0.9601580219063005,COMPLETE,,0.0,0
358,0.0,graph,38,root-norm,umap,24,True,False,silhouette,transformer.resblocks.11,ViT-B/32,blocks.7,dinov2_vitb14,layer1,resnet50,structural,0.0070681438931308625,0.8455683882286159,False,50,8,0.8156088928353957,0.938622566132874,29,4,1.1650011165430831,1.761692229349192,facebook/sam2-hiera-large,top_k_mean,0.10691182538318408,3,graph,33,z-score,umap,30,True,True,silhouette,,1.4743084237863564,5,False,False,False,False,True,False,False,0.5978845662371399,0.7035009477083857,0.6180946272999616,0.11839281988942676,0.8236349794756248,0.9995293106468276,COMPLETE,,0.0,0
359,0.0,graph,36,l2,svd,40,False,True,heuristic,transformer.resblocks.9,ViT-B/32,blocks.11,dinov2_vitb14,layer3,resnet50,semantic,0.006393212388622856,0.8112681318828101,False,200,32,0.8441062083481461,0.9465391364485504,26,3,0.6376036402158368,2.092962589562941,facebook/sam2-hiera-large,mean,0.12028305319246939,5,graph,38,z-score,umap,39,False,False,heuristic,3.0,2.0326268028350216,3,True,True,False,True,False,True,True,0.7461711876800446,0.6805328705565907,0.5576929103038767,0.5736006338981926,0.7450799447323468,0.1768545370396057,COMPLETE,,0.0,0
360,0.0,kmeans,16,z-score,pca,51,True,False,heuristic,transformer.resblocks.10,ViT-B/32,blocks.4,dinov2_vitb14,layer2,resnet50,structural,0.007212397617475244,0.6730643115974424,True,100,16,0.9743898790720351,0.9524520792517249,20,4,0.9662668472627982,1.5308835674869286,facebook/sam2-hiera-large,median,0.2098149992214094,3,kmeans,40,z-score,pca,64,True,True,silhouette,7.0,3.867437554973125,5,False,True,True,False,True,False,False,0.756322901443215,0.7143865109128094,0.6260174066412918,0.39894242016716286,0.7979431137707225,0.04030050162104418,COMPLETE,,0.0,0
361,0.0,graph,12,z-score,svd,37,False,True,silhouette,transformer.resblocks.11,ViT-B/32,blocks.11,dinov2_vitb14,conv1,resnet50,semantic,0.002126926076731801,0.788941289395632,False,50,8,0.8927558309567677,0.9182409079132479,19,2,0.9164982413867211,2.864095336532487,facebook/sam2-hiera-large,mean,0.20031711679587122,3,graph,25,root-norm,umap,52,False,True,heuristic,3.0,2.36628858202546,3,True,True,False,False,False,True,True,0.7046895134682449,0.4888682570984225,0.7001729757074402,0.2800523089222451,0.5129336684847591,0.8485811339781865,COMPLETE,,0.0,0
362,0.0,graph,10,l2,svd,39,True,False,heuristic,transformer.resblocks.11,ViT-B/32,blocks.4,dinov2_vitb14,layer4,resnet50,semantic,0.003884804408601439,0.7783893799373416,True,200,32,0.8183924073029899,0.9243400753384391,22,3,0.6189201970097366,2.03931707476895,facebook/sam2-hiera-large,mean,0.48495751011935523,5,kmeans,17,z-score,svd,55,True,False,silhouette,,2.9902396705246477,5,False,False,True,True,True,False,False,0.7364479167742013,0.6023429017306791,0.46147832537684486,0.16279260969629264,0.48294364420172575,0.5422248691577373,COMPLETE,,0.0,0
363,0.0,graph,30,z-score,umap,47,True,True,silhouette,transformer.resblocks.10,ViT-B/32,blocks.11,dinov2_vitb14,layer3,resnet50,structural,0.006752850747983381,0.6511398111820986,False,100,16,0.8684741526912948,0.9651616709556157,17,3,0.7846457296896266,2.1466715788029354,facebook/sam2-hiera-large,top_k_mean,0.1306629475161818,3,graph,20,l2,pca,63,False,True,heuristic,5.0,3.452805061476929,3,True,True,False,False,True,True,True,0.5255825527293113,0.6315730203980847,0.5200690091381472,0.5262762244957068,0.8729981369521667,0.9056573934935418,COMPLETE,,0.0,0
412,0.0,kmeans,33,l2,umap,48,False,True,silhouette,transformer.resblocks.10,ViT-B/32,blocks.4,dinov2_vitb14,layer3,resnet50,structural,0.0060903226599367125,0.8278593051718822,False,100,32,0.9528976506922735,0.9608800923887649,26,2,0.6229986677960574,2.433214032088583,facebook/sam2-hiera-large,top_k_mean,0.22691898504557573,3,graph,28,l2,umap,47,True,True,heuristic,3.0,2.992162189372264,5,False,True,False,False,False,True,True,0.7711161589129114,0.7423041882130343,0.4964854962682554,0.7358709772008251,0.726328493192579,0.7476350195505892,COMPLETE,,0.0,0
413,0.0,graph,35,root-norm,pca,64,True,True,heuristic,transformer.resblocks.11,ViT-B/32,blocks.7,dinov2_vitb14,conv1,resnet50,semantic,0.00705307146621298,0.7480548053445978,True,200,16,0.9764906814033066,0.9306172129894218,30,4,1.0559830545628583,2.663456666894838,facebook/sam2-hiera-large,mean,0.35918509763707557,5,kmeans,19,z-score,pca,35,False,False,silhouette,3.0,3.134350887021833,3,True,True,True,True,True,True,False,0.6852010416105373,0.6484418477221209,0.5097417213276838,0.41339264414608234,0.47575721549796557,0.9330603285082097,COMPLETE,,0.0,0
414,0.0,graph,11,z-score,svd,17,True,False,silhouette,transformer.resblocks.9,ViT-B/32,blocks.11,dinov2_vitb14,layer4,resnet50,structural,0.0027077629234829917,0.7248110931284436,False,50,8,0.9046891198203766,0.9503713188139216,24,3,0.7439242321954904,2.7118060980228083,facebook/sam2-hiera-large,median,0.3187242953354648,3,graph,36,z-score,umap,30,True,True,silhouette,,2.3678520776739607,5,False,False,False,False,True,False,False,0.5707528944948628,0.49557463144809444,0.6081084588942118,0.843074286201948,0.8363484621563357,0.4689291078086524,COMPLETE,,0.0,0
415,0.0,graph,20,l2,svd,43,False,True,heuristic,transformer.resblocks.11,ViT-B/32,blocks.11,dinov2_vitb14,layer3,resnet50,semantic,0.007648197146910032,0.6416860191606037,False,200,32,0.9395335522366494,0.944013176288091,21,4,0.9373801111144049,2.7721551953225836,facebook/sam2-hiera-large,mean,0.18470218095891336,5,graph,29,z-score,pca,18,False,False,heuristic,5.0,1.698333603945513,3,True,True,False,True,False,True,True,0.5172097555089429,0.7078898779350592,0.4504029011446022,0.2842104681231991,0.753254766920663,0.29885309710339686,COMPLETE,,0.0,0
416,0.0,kmeans,40,z-score,pca,46,True,False,heuristic,transformer.resblocks.10,ViT-B/32,blocks.4,dinov2_vitb14,layer1,resnet50,structural,0.004743548984052613,0.7146955700019487,True,100,16,0.8738896184435406,0.9216272476126353,28,2,1.0852419488074188,2.8057940687042198,facebook/sam2-hiera-large,mean,0.12614504567052753,3,kmeans,30,root-norm,umap,61,True,True,silhouette,3.0,1.9449526310399154,5,False,True,True,False,True,False,False,0.7451932387918174,0.689820589094579,0.7100943097514762,0.2455687859300186,0.9465117008549436,0.7151786110795445,COMPLETE,,0.0,0
417,0.0,graph,18,z-score,svd,60,False,True,silhouette,transformer.resblocks.11,ViT-B/32,blocks.11,dinov2_vitb14,layer3,resnet50,semantic,0.0035906616806697447,0.7559101271487794,False,50,8,0.8799153898493708,0.9271032456048213,24,3,0.8955391160177272,2.24437157441059,facebook/sam2-hiera-large,top_k_mean,0.4670422523358435,3,graph,39,l2,svd,16,False,True,heuristic,5.0,3.575802261717146,3,True,True,False,False,False,True,True,0.7515286345764562,0.7220398657173268,0.5531543702303794,0.12892703568579875,0.7983180931643459,0.6500488973737355,COMPLETE,,0.0,0
418,0.0,graph,25,l2,umap,27,True,False,heuristic,transformer.resblocks.10,ViT-B/32,blocks.7,dinov2_vitb14,layer1,resnet50,semantic,0.008098448452350086,0.6354198249673862,True,200,32,0.8402769796352835,0.9524960694744498,25,3,0.8085017814156812,1.7025615233778226,facebook/sam2-hiera-large,mean,0.3888868421980333,5,kmeans,32,z-score,umap,64,True,False,silhouette,,2.676042206739471,5,False,False,True,True,True,False,False,0.7128454625843943,0.6377036340204771,0.5886473711133404,0.5478706210831633,0.5116378488146838,0.5276301474105187,COMPLETE,,0.0,0
419,0.0,graph,22,root-norm,pca,49,True,True,silhouette,transformer.resblocks.9,ViT-B/32,blocks.4,dinov2_vitb14,layer2,resnet50,structural,0.009677093661163223,0.8197263443165282,False,100,16,0.8660952854564328,0.9398634543233861,20,4,1.1044762188271136,2.5621145006125916,facebook/sam2-hiera-large,median,0.49002899606773453,3,graph,40,z-score,pca,51,False,True,heuristic,7.0,3.3512133601635212,3,True,True,False,False,True,True,True,0.7963284146884126,0.5263252749675265,0.518746530397476,0.44423650219131816,0.2841813617955681,0.36564529620101277,COMPLETE,,0.0,0
404,0.0,graph,32,z-score,pca,38,True,False,heuristic,transformer.resblocks.10,ViT-B/32,blocks.11,dinov2_vitb14,layer2,resnet50,structural,0.003833273870347269,0.8044515237766153,True,200,32,0.8615559277907004,0.9227177705559491,15,3,0.8400467296587233,2.5219894515443766,facebook/sam2-hiera-large,mean,0.2518606963056199,3,kmeans,35,z-score,umap,54,False,True,silhouette,7.0,1.1875491602635457,3,True,True,False,False,True,False,False,0.6955835369925937,0.5032914034276798,0.7321493390725848,0.05603990641401631,0.3429747291976465,0.8668271849596251,COMPLETE,,0.0,0
405,0.0,graph,23,z-score,svd,52,False,True,silhouette,transformer.resblocks.11,ViT-B/32,blocks.11,dinov2_vitb14,conv1,resnet50,semantic,0.005065770360478043,0.8112037267355606,False,50,8,0.8504859253604123,0.9290400010791406,25,3,0.5156810791215004,2.301590411411997,facebook/sam2-hiera-large,mean,0.3975372818660231,5,graph,31,root-norm,svd,40,True,False,silhouette,,4.7897877178136525,5,False,False,False,True,False,True,False,0.787953082585511,0.474019250704717,0.7215377509933306,0.6444863326280245,0.8877458687949794,0.14896699291504514,COMPLETE,,0.0,0
406,0.0,graph,37,l2,umap,36,True,False,heuristic,transformer.resblocks.10,ViT-B/32,blocks.4,dinov2_vitb14,layer1,resnet50,semantic,0.005808806747527993,0.7053363440558614,True,100,16,0.8091121648543919,0.9596806852204091,19,4,1.0348123715503794,2.4816073069949183,facebook/sam2-hiera-large,mean,0.27044065393375816,3,graph,40,l2,umap,28,False,True,heuristic,3.0,2.607799397905365,3,True,True,True,False,True,False,True,0.7562054235558097,0.5983137908051244,0.6555341303402016,0.16175199266694076,0.8132215800356587,0.962719137052131,COMPLETE,,0.0,0
407,0.0,graph,39,z-score,pca,25,False,True,silhouette,transformer.resblocks.11,ViT-B/32,blocks.7,dinov2_vitb14,layer4,resnet50,structural,0.002241110019486273,0.6828758882584094,False,200,32,0.8994433384615171,0.9378811988836806,27,3,0.7022831864860679,2.9828113093385276,facebook/sam2-hiera-large,top_k_mean,0.21182263978598553,3,kmeans,13,z-score,pca,63,True,False,silhouette,5.0,1.810176162055863,5,False,True,False,True,False,True,False,0.7375450048036643,0.7300021233770355,0.5959499750335904,0.5214054859680173,0.9946142998034831,0.6116403385147896,COMPLETE,,0.0,0
408,0.0,kmeans,34,root-norm,svd,51,True,True,heuristic,transformer.resblocks.9,ViT-B/32,blocks.11,dinov2_vitb14,layer3,resnet50,semantic,0.004889963446751705,0.7856373266089536,True,50,8,0.9589504019192917,0.9630814768998269,22,4,1.1638111906898398,1.987951331701791,facebook/sam2-hiera-large,median,0.37112030091762593,5,graph,38,z-score,umap,58,False,True,heuristic,3.0,2.2085591885895397,3,True,True,True,False,True,True,True,0.6431770356334608,0.5568008829656071,0.4788279116929529,0.38194441159039794,0.6289249653345258,0.3359504965241286,COMPLETE,,0.0,0
