number,value,params_dino_pipeline.clustering.clusterer.method,params_dino_pipeline.clustering.clusterer.n_neighbors,params_dino_pipeline.clustering.feature_processing.normalizer.method,params_dino_pipeline.clustering.feature_processing.reducer.method,params_dino_pipeline.clustering.feature_processing.reducer.n_components,params_dino_pipeline.clustering.feature_processing.run_normalization,params_dino_pipeline.clustering.feature_processing.run_reduction,params_dino_pipeline.clustering.k_selection.method,params_extractors.clip.layer_name,params_extractors.clip.model_name,params_extractors.dino_v2.layer_name,params_extractors.dino_v2.model_name,params_extractors.resnet.layer_name,params_extractors.resnet.model_name,params_fusion_pipeline.clustering.k_selection.k_source,params_heuristic_settings.filter_params.filter_min_area_perc,params_heuristic_settings.filter_params.nms_iou_threshold,params_heuristic_settings.filter_params.use_nms,params_heuristic_settings.generator_params.min_mask_region_area,params_heuristic_settings.generator_params.points_per_side,params_heuristic_settings.generator_params.pred_iou_thresh,params_heuristic_settings.generator_params.stability_score_thresh,params_heuristic_settings.k_heuristic_formulas.max_k,params_heuristic_settings.k_heuristic_formulas.semantic_base,params_heuristic_settings.k_heuristic_formulas.semantic_scale_factor,params_heuristic_settings.k_heuristic_formulas.structural_multiplier,params_heuristic_settings.sam_model,params_labeler.aggregation_method,params_labeler.aggregation_top_k_perc,params_labeler.top_n_labels,params_resnet_pipeline.clustering.clusterer.method,params_resnet_pipeline.clustering.clusterer.n_neighbors,params_resnet_pipeline.clustering.feature_processing.normalizer.method,params_resnet_pipeline.clustering.feature_processing.reducer.method,params_resnet_pipeline.clustering.feature_processing.reducer.n_components,params_resnet_pipeline.clustering.feature_processing.run_normalization,params_resnet_pipeline.clustering.feature_processing.run_reduction,params_resnet_pipeline.clustering.k_selection.method,params_resnet_pipeline.image_preprocessing.blur_kernel_size,params_resnet_pipeline.image_preprocessing.clahe_clip_limit,params_resnet_pipeline.image_preprocessing.sobel_kernel_size,params_resnet_pipeline.image_preprocessing.use_clahe,params_resnet_pipeline.image_preprocessing.use_gaussian_blur,params_resnet_pipeline.image_preprocessing.use_grayscale,params_resnet_pipeline.image_preprocessing.use_sobel_edges,params_run_dino_pipeline,params_run_fusion_pipeline,params_run_resnet_pipeline,params_validator_settings.final_threshold,params_validator_settings.semantic_threshold,params_validator_settings.structural_threshold,params_validator_settings.weights.clip_confidence,params_validator_settings.weights.dino_iou,params_validator_settings.weights.resnet_iou,state,user_attrs_error,user_attrs_max_clip_confidence,user_attrs_num_correct_segments
899,0.0,graph,16,z-score,svd,25,False,True,silhouette,transformer.resblocks.11,ViT-B/32,blocks.11,dinov2_vitb14,layer2,resnet50,structural,0.006155519881242175,0.7885207478421961,False,50,8,0.9164904899766997,0.9187251683805431,15,3,0.8677543890302872,2.7263576779521213,facebook/sam2-hiera-large,mean,0.1256248165690366,3,graph,15,z-score,umap,61,False,True,heuristic,3.0,3.5261752602134098,3,True,True,False,False,False,True,False,0.6801465689604517,0.631577413176752,0.6188543355851763,0.6060991714712953,0.5496336816244521,0.8981182745551491,COMPLETE,,0.0,0
0,0.0,graph,16,z-score,svd,51,True,False,silhouette,transformer.resblocks.11,ViT-B/32,blocks.11,dinov2_vitb14,layer3,resnet50,structural,0.007430582629721761,0.7274989471334391,False,200,8,0.966347777159921,0.9665608877603562,22,4,0.5202224531145824,2.524958558335176,facebook/sam2-hiera-large,mean,0.13743068161389524,5,kmeans,40,z-score,umap,63,True,True,silhouette,3.0,3.140513278275465,3,False,True,False,False,True,True,True,0.6931307125438411,0.6507223379406845,0.6399268460342241,0.16072525951402583,0.6197936839028574,0.7952149524781346,COMPLETE,,0.0,0
1,0.0,graph,37,l2,svd,20,False,True,heuristic,transformer.resblocks.11,ViT-B/32,blocks.4,dinov2_vitb14,layer3,resnet50,semantic,0.00200327607108876,0.6434517846111415,False,100,32,0.841474740332003,0.9172481308311702,25,3,1.0354490156645406,2.5289728538766663,facebook/sam2-hiera-large,mean,0.3693493340878188,3,graph,38,z-score,umap,64,False,True,heuristic,3.0,2.030747217266073,5,True,True,True,False,False,False,False,0.7441478483063448,0.7294699291016741,0.6947039813731117,0.1864091546292136,0.8205212259698448,0.9282046997635007,COMPLETE,,0.0,0
2,0.0,graph,40,z-score,pca,38,True,True,heuristic,transformer.resblocks.10,ViT-B/32,blocks.11,dinov2_vitb14,layer1,resnet50,semantic,0.004335211357399364,0.8394499974555174,True,50,16,0.8779089859444991,0.9426864590416095,28,3,0.9052862833799218,1.655459572189288,facebook/sam2-hiera-large,mean,0.1491360315469671,3,graph,33,z-score,pca,17,False,False,silhouette,5.0,1.9074645868904856,5,True,True,False,True,True,True,False,0.5038121843572397,0.5445857436563615,0.48362035814415627,0.3982454464945421,0.7768405744117846,0.1564090806288626,COMPLETE,,0.0,0
860,0.0,graph,33,root-norm,svd,54,True,True,silhouette,transformer.resblocks.11,ViT-B/32,blocks.4,dinov2_vitb14,layer3,resnet50,structural,0.007848584052157378,0.762427172986456,False,100,16,0.9472865808886883,0.9709838596112638,30,2,0.926048159996651,2.777912261861894,facebook/sam2-hiera-large,median,0.36613200662261824,3,graph,35,z-score,pca,54,True,True,heuristic,5.0,2.0296443999047495,5,False,True,False,False,True,True,True,0.6118920225859507,0.5269343452423796,0.7070439907405486,0.2610682490335713,0.8677164601075302,0.8391053878826048,COMPLETE,,0.0,0
861,0.0,kmeans,20,z-score,pca,49,False,True,heuristic,transformer.resblocks.9,ViT-B/32,blocks.11,dinov2_vitb14,layer2,resnet50,semantic,0.009998862418292533,0.6690876769862595,True,200,8,0.9754085806262064,0.9609651545440034,21,4,1.1245765544967157,2.2696372187913108,facebook/sam2-hiera-large,mean,0.21290038754253807,5,kmeans,40,z-score,umap,49,False,False,silhouette,3.0,3.587568618021688,3,True,True,True,True,False,True,False,0.7484251510532279,0.7380729427278993,0.47368091264719886,0.5561701078884936,0.7862329198253978,0.04423276095851825,COMPLETE,,0.0,0
862,0.0,graph,39,l2,svd,38,True,False,silhouette,transformer.resblocks.11,ViT-B/32,blocks.11,dinov2_vitb14,layer1,resnet50,structural,0.0022794877446660074,0.6326695386035962,False,50,32,0.8353935653877615,0.9249902958999681,27,3,0.5526731476577064,2.707951068700628,facebook/sam2-hiera-large,mean,0.27076345664394674,3,graph,34,root-norm,umap,46,True,True,silhouette,3.0,2.3788756715017234,5,False,True,False,False,True,False,False,0.5001010066317854,0.4804800449686213,0.5119617190373218,0.19006918654936353,0.6000017970564312,0.5606850495806068,COMPLETE,,0.0,0
863,0.0,graph,16,z-score,pca,32,False,True,heuristic,transformer.resblocks.10,ViT-B/32,blocks.4,dinov2_vitb14,layer3,resnet50,semantic,0.006033683955499029,0.7960092003790926,False,100,16,0.907050181771846,0.9214135925237992,24,3,0.8352612235610786,2.481160726569447,facebook/sam2-hiera-large,mean,0.3804276768757047,5,graph,37,z-score,svd,55,False,True,heuristic,,2.1142207743396844,3,True,False,False,False,False,True,True,0.6979919323825069,0.627110705400892,0.7418609125464288,0.3085256413888109,0.9607473995817315,0.011421333780634995,COMPLETE,,0.0,0
864,0.0,graph,14,z-score,umap,56,True,False,heuristic,transformer.resblocks.11,ViT-B/32,blocks.11,dinov2_vitb14,conv1,resnet50,semantic,0.00751608660777273,0.6228849428252843,True,200,32,0.8818182042972575,0.9466556389946047,17,4,1.090316443680087,2.6817538277603497,facebook/sam2-hiera-large,top_k_mean,0.2868407647754596,3,kmeans,29,l2,pca,39,True,False,silhouette,5.0,4.783242199461296,5,False,True,True,True,True,False,False,0.669393727087894,0.5986932032341489,0.7169347474523527,0.1396004040875828,0.8975574099022986,0.9442922449181669,COMPLETE,,0.0,0
865,0.0,kmeans,13,root-norm,svd,22,False,True,silhouette,transformer.resblocks.9,ViT-B/32,blocks.7,dinov2_vitb14,layer4,resnet50,structural,0.004777450470308642,0.640532815333987,False,50,8,0.8006448871333888,0.9552983165838057,29,2,0.7181608019626254,2.413077520121601,facebook/sam2-hiera-large,mean,0.10739007705924392,3,graph,12,z-score,umap,52,False,True,heuristic,3.0,1.408275403216518,3,True,True,False,False,False,True,True,0.7786712407559354,0.6069388800430394,0.6220253837990243,0.81628199396374,0.18655273370060224,0.49782867116242796,COMPLETE,,0.0,0
866,0.0,graph,37,l2,svd,48,True,True,heuristic,transformer.resblocks.10,ViT-B/32,blocks.4,dinov2_vitb14,layer3,resnet50,semantic,0.005442392497484028,0.6522464918750862,True,100,16,0.9216830865436588,0.9434965573997047,22,3,1.0624286497339022,2.912573722762176,facebook/sam2-hiera-large,median,0.12347543831150012,5,kmeans,27,z-score,pca,58,True,False,silhouette,7.0,2.8875345390448692,5,False,True,True,True,True,True,False,0.7153237690931759,0.654298490482574,0.7494417784480539,0.8491345627431374,0.25191337087415344,0.4248745032153285,COMPLETE,,0.0,0
867,0.0,graph,32,z-score,pca,16,True,False,silhouette,transformer.resblocks.11,ViT-B/32,blocks.11,dinov2_vitb14,layer1,resnet50,structural,0.005801394276894845,0.8327753651289347,False,200,32,0.8697604306809235,0.9274872428425432,23,3,0.9494613573325025,1.5881935644557312,facebook/sam2-hiera-large,mean,0.4822644583358158,3,graph,38,z-score,umap,63,False,True,heuristic,,3.7604421853805197,3,True,False,False,False,True,False,True,0.5576087894232007,0.7176278167955162,0.6383961263503051,0.36292813835157245,0.6386818934570111,0.861603104074462,COMPLETE,,0.0,0
852,0.0,kmeans,17,z-score,svd,43,True,False,heuristic,transformer.resblocks.11,ViT-B/32,blocks.11,dinov2_vitb14,layer3,resnet50,structural,0.0028641484645554023,0.8194426872780212,True,50,8,0.8560071320814536,0.9778586035677003,16,4,1.0176596687149122,2.5031020051069977,facebook/sam2-hiera-large,mean,0.23852723294940031,3,kmeans,31,z-score,svd,51,False,True,silhouette,3.0,2.6275030634791703,3,True,True,True,False,True,False,False,0.7019150052456099,0.6916005293274549,0.6272185581795421,0.290086049778905,0.5365082322247768,0.759908226326048,COMPLETE,,0.0,0
853,0.0,graph,40,l2,umap,58,False,True,silhouette,transformer.resblocks.10,ViT-B/32,blocks.7,dinov2_vitb14,layer1,resnet50,semantic,0.0018486743652270001,0.6821957915004009,False,200,32,0.9662923893160869,0.9230196897672572,26,2,1.0543476247679546,2.3756212159619947,facebook/sam2-hiera-large,top_k_mean,0.11583394000646777,3,graph,39,l2,umap,41,True,False,silhouette,5.0,1.2351150204177759,5,False,True,False,True,False,True,False,0.5102981972730349,0.613787928440329,0.4860482775330383,0.45882418235329553,0.9447337278499685,0.9995361286177908,COMPLETE,,0.0,0
854,0.0,graph,37,root-norm,svd,39,True,False,heuristic,transformer.resblocks.11,ViT-B/32,blocks.4,dinov2_vitb14,layer3,resnet50,semantic,0.0025524812829222825,0.6613856227765822,True,100,16,0.9122329195127526,0.9289551270378246,28,4,0.5277599767962985,1.501857492851669,facebook/sam2-hiera-large,mean,0.14073395660847565,5,graph,33,z-score,pca,61,False,True,heuristic,,1.8250036582188327,3,True,False,True,False,True,False,True,0.6328739255774588,0.6419204410357913,0.7339696908114474,0.4074858436849951,0.2135085543807228,0.6449572420587647,COMPLETE,,0.0,0
855,0.0,graph,38,z-score,pca,45,True,True,silhouette,transformer.resblocks.9,ViT-B/32,blocks.11,dinov2_vitb14,layer2,resnet50,structural,0.003912759524173362,0.6160669744606366,False,50,8,0.8311654662144039,0.9363648574554075,26,3,0.6308112224315054,2.962086482890153,facebook/sam2-hiera-large,median,0.16736166688219797,3,kmeans,32,z-score,umap,16,True,True,silhouette,3.0,1.9825037717901726,5,False,True,False,False,True,True,False,0.5470493572472465,0.4334825535451368,0.5817249186979007,0.6054358777173353,0.7288818196870455,0.245595384502232,COMPLETE,,0.0,0
856,0.0,kmeans,32,l2,svd,26,False,True,heuristic,transformer.resblocks.11,ViT-B/32,blocks.11,dinov2_vitb14,conv1,resnet50,semantic,0.0011402160187067997,0.8051437263478236,False,200,32,0.8481279810902883,0.918504919324241,19,3,0.8610433216680934,2.840602433558256,facebook/sam2-hiera-large,mean,0.15977298130099157,5,graph,30,z-score,umap,22,False,False,heuristic,5.0,3.0228181472633384,3,True,True,True,True,False,True,True,0.7260298197108898,0.7306419775603019,0.6932908792929444,0.20684852138965462,0.8184477124016173,0.4663865820418837,COMPLETE,,0.0,0
857,0.0,graph,30,z-score,pca,27,True,False,heuristic,transformer.resblocks.10,ViT-B/32,blocks.4,dinov2_vitb14,layer3,resnet50,structural,0.007181852305652584,0.8496740752684243,True,100,16,0.9348303424552294,0.9576024231606974,25,4,1.1652879743478135,2.3091950494874083,facebook/sam2-hiera-large,mean,0.4099144349056921,3,kmeans,39,root-norm,pca,62,True,True,silhouette,3.0,2.5361437222089496,5,False,True,False,False,True,False,False,0.593982042942523,0.7251036631685656,0.6080974715203671,0.43242017471079314,0.5677910484334396,0.7788045159202871,COMPLETE,,0.0,0
858,0.0,graph,35,z-score,svd,59,False,True,silhouette,transformer.resblocks.11,ViT-B/32,blocks.11,dinov2_vitb14,layer4,resnet50,semantic,0.00153909940950913,0.7183110365697603,False,50,8,0.8941029338476622,0.9652937009501394,22,3,0.8199974654480748,2.5331610859586466,facebook/sam2-hiera-large,top_k_mean,0.3454816234903744,5,graph,36,l2,svd,17,False,False,heuristic,,3.9585686638376787,3,True,False,False,True,False,True,True,0.7880624852759921,0.5118240126550548,0.5394803980399057,0.03925802528184493,0.5188003077286617,0.5826933158388121,COMPLETE,,0.0,0
859,0.0,graph,26,l2,umap,18,True,False,heuristic,transformer.resblocks.10,ViT-B/32,blocks.7,dinov2_vitb14,layer1,resnet50,semantic,0.005114500831124778,0.8290236701905898,True,200,32,0.9628612958532587,0.9017624202888482,24,3,1.0372922365465775,2.627572784787035,facebook/sam2-hiera-large,mean,0.4204480252350734,3,kmeans,28,z-score,umap,64,False,True,silhouette,7.0,3.3658721823352518,5,True,True,True,False,True,False,False,0.5229670981803406,0.6632357201503529,0.6787500658713134,0.0639397278847727,0.6875961659458015,0.8956674008315364,COMPLETE,,0.0,0
844,0.0,graph,19,l2,svd,32,True,True,heuristic,transformer.resblocks.11,ViT-B/32,blocks.11,dinov2_vitb14,layer3,resnet50,semantic,0.008940403727904238,0.708269830244442,True,100,16,0.8114330970311613,0.9330754124699617,24,3,0.8059267663112508,2.554562472473115,facebook/sam2-hiera-large,median,0.23182444465893068,5,graph,40,z-score,pca,20,True,True,silhouette,7.0,1.9380950479835568,5,False,True,True,False,True,True,False,0.5868412813230324,0.6771943406654799,0.6585196240348172,0.38531663477804307,0.7491681296351816,0.959860838092839,COMPLETE,,0.0,0
845,0.0,graph,31,z-score,pca,29,True,False,silhouette,transformer.resblocks.10,ViT-B/32,blocks.4,dinov2_vitb14,layer1,resnet50,structural,0.0012894577643420048,0.6288810295801197,False,200,32,0.8882772048498659,0.9383775930189642,29,4,0.8974914803452797,2.595535655922464,facebook/sam2-hiera-large,mean,0.20177314626698137,3,graph,27,z-score,umap,60,False,False,heuristic,5.0,1.5619061405799897,3,True,True,False,True,True,False,True,0.6802332855155687,0.7138175587870665,0.5722148836415336,0.3337363996934626,0.4863374611619962,0.13970629228723347,COMPLETE,,0.0,0
846,0.0,graph,37,z-score,svd,53,False,True,heuristic,transformer.resblocks.11,ViT-B/32,blocks.11,dinov2_vitb14,layer3,resnet50,semantic,0.004700489949214797,0.6003765206030005,False,50,8,0.9524197177486545,0.9452445832800642,25,3,0.6934848792575292,1.9078715196870326,facebook/sam2-hiera-large,mean,0.2617911385878203,5,kmeans,29,root-norm,svd,50,True,True,silhouette,,1.0908359629575883,5,False,False,False,False,False,True,False,0.6466411180615099,0.5716457497120178,0.7029675591038287,0.13315362394729852,0.8044056430690791,0.3814455904663127,COMPLETE,,0.0,0
847,0.0,graph,36,l2,umap,37,True,False,heuristic,transformer.resblocks.10,ViT-B/32,blocks.4,dinov2_vitb14,layer2,resnet50,semantic,0.005683527608002243,0.7734868878675918,True,100,32,0.8651166523964788,0.9203768974647952,27,2,1.199772285861567,2.7425953545993553,facebook/sam2-hiera-large,top_k_mean,0.3715646145598352,3,graph,37,z-score,umap,30,False,True,heuristic,3.0,2.165119046295307,3,True,True,True,False,True,False,True,0.689812674593881,0.5853415938960247,0.4652815129919596,0.6703152597906405,0.9808933558610988,0.9254807758828206,COMPLETE,,0.0,0
848,0.0,kmeans,18,z-score,pca,40,False,True,silhouette,transformer.resblocks.11,ViT-B/32,blocks.7,dinov2_vitb14,layer3,resnet50,structural,0.007633732043932996,0.6559714672742917,False,200,16,0.9023345985930857,0.915861790070901,30,3,0.9146767410696691,2.447997412185905,facebook/sam2-hiera-large,mean,0.13075678459283452,3,kmeans,32,l2,pca,36,True,False,silhouette,5.0,3.1279761683556813,5,False,True,False,True,False,True,False,0.5325215100311469,0.46647310448233803,0.6504425841049571,0.5302390013860668,0.6161963194996593,0.8724544150222384,COMPLETE,,0.0,0
849,0.0,graph,10,root-norm,svd,36,True,True,heuristic,transformer.resblocks.9,ViT-B/32,blocks.11,dinov2_vitb14,conv1,resnet50,semantic,0.004145690879070862,0.7561442233047689,True,50,8,0.8793419769072741,0.9406849589730005,29,4,0.6027717751213839,1.5493730519431863,facebook/sam2-hiera-large,median,0.10015421735468663,5,graph,35,z-score,umap,27,False,True,heuristic,3.0,3.2371893536809653,5,True,True,True,False,True,True,True,0.74026928077944,0.6493958775624252,0.44128609721655854,0.35319833319498606,0.7049991173227447,0.07045547493807067,COMPLETE,,0.0,0
850,0.0,graph,14,l2,svd,62,True,False,silhouette,transformer.resblocks.11,ViT-B/32,blocks.11,dinov2_vitb14,layer1,resnet50,structural,0.00701224036944151,0.733954996963074,False,200,32,0.8423750938997253,0.907044753870337,23,3,0.6533751570127828,1.6585357669097935,facebook/sam2-hiera-large,mean,0.17489916371229672,3,kmeans,38,z-score,pca,47,False,False,silhouette,,4.173719975768483,3,True,False,False,True,True,False,False,0.6051630980913607,0.6682093859330416,0.4162671559936712,0.5077037970108987,0.8320790198528873,0.29055567551473716,COMPLETE,,0.0,0
851,0.0,graph,31,z-score,pca,20,False,True,heuristic,transformer.resblocks.10,ViT-B/32,blocks.4,dinov2_vitb14,layer4,resnet50,semantic,0.006664722504783459,0.7252425173458066,False,100,16,0.8197436651219754,0.9481669749359041,15,3,0.939456565279398,2.164800389466303,facebook/sam2-hiera-large,mean,0.3057147598225982,5,graph,40,root-norm,umap,63,True,True,heuristic,7.0,3.6888706832658396,5,False,True,False,False,False,True,True,0.7117617312857575,0.741954314124066,0.42688540626291294,0.1688044897585438,0.45458596433637316,0.8188531260133531,COMPLETE,,0.0,0
