number,value,params_dino_pipeline.clustering.clusterer.method,params_dino_pipeline.clustering.clusterer.n_neighbors,params_dino_pipeline.clustering.feature_processing.normalizer.method,params_dino_pipeline.clustering.feature_processing.reducer.method,params_dino_pipeline.clustering.feature_processing.reducer.n_components,params_dino_pipeline.clustering.feature_processing.run_normalization,params_dino_pipeline.clustering.feature_processing.run_reduction,params_dino_pipeline.clustering.k_selection.method,params_extractors.clip.layer_name,params_extractors.clip.model_name,params_extractors.dino_v2.layer_name,params_extractors.dino_v2.model_name,params_extractors.resnet.layer_name,params_extractors.resnet.model_name,params_fusion_pipeline.clustering.k_selection.k_source,params_heuristic_settings.filter_params.filter_min_area_perc,params_heuristic_settings.filter_params.nms_iou_threshold,params_heuristic_settings.filter_params.use_nms,params_heuristic_settings.generator_params.min_mask_region_area,params_heuristic_settings.generator_params.points_per_side,params_heuristic_settings.generator_params.pred_iou_thresh,params_heuristic_settings.generator_params.stability_score_thresh,params_heuristic_settings.k_heuristic_formulas.max_k,params_heuristic_settings.k_heuristic_formulas.semantic_base,params_heuristic_settings.k_heuristic_formulas.semantic_scale_factor,params_heuristic_settings.k_heuristic_formulas.structural_multiplier,params_heuristic_settings.sam_model,params_labeler.aggregation_method,params_labeler.aggregation_top_k_perc,params_labeler.top_n_labels,params_resnet_pipeline.clustering.clusterer.method,params_resnet_pipeline.clustering.clusterer.n_neighbors,params_resnet_pipeline.clustering.feature_processing.normalizer.method,params_resnet_pipeline.clustering.feature_processing.reducer.method,params_resnet_pipeline.clustering.feature_processing.reducer.n_components,params_resnet_pipeline.clustering.feature_processing.run_normalization,params_resnet_pipeline.clustering.feature_processing.run_reduction,params_resnet_pipeline.clustering.k_selection.method,params_resnet_pipeline.image_preprocessing.blur_kernel_size,params_resnet_pipeline.image_preprocessing.clahe_clip_limit,params_resnet_pipeline.image_preprocessing.sobel_kernel_size,params_resnet_pipeline.image_preprocessing.use_clahe,params_resnet_pipeline.image_preprocessing.use_gaussian_blur,params_resnet_pipeline.image_preprocessing.use_grayscale,params_resnet_pipeline.image_preprocessing.use_sobel_edges,params_run_dino_pipeline,params_run_fusion_pipeline,params_run_resnet_pipeline,params_validator_settings.final_threshold,params_validator_settings.semantic_threshold,params_validator_settings.structural_threshold,params_validator_settings.weights.clip_confidence,params_validator_settings.weights.dino_iou,params_validator_settings.weights.resnet_iou,state,user_attrs_error,user_attrs_max_clip_confidence,user_attrs_num_correct_segments
898,0.0,graph,36,root-norm,pca,63,True,False,heuristic,transformer.resblocks.9,ViT-B/32,blocks.4,dinov2_vitb14,layer3,resnet50,semantic,0.009716273824298505,0.7439852211554572,True,200,32,0.8657424965505989,0.9599319957551201,26,2,0.5290166347501448,2.5131205084872135,facebook/sam2-hiera-large,median,0.4146745478851206,3,graph,21,z-score,pca,45,True,False,silhouette,5.0,2.3256349707791046,5,False,True,True,True,True,False,True,0.7589702844410564,0.726960238654129,0.6943858363102539,0.32116413532725296,0.6349492518002471,0.5448664699121162,COMPLETE,,0.0,0
3,0.0,kmeans,28,l2,svd,25,True,True,silhouette,transformer.resblocks.11,ViT-B/32,blocks.7,dinov2_vitb14,layer4,resnet50,semantic,0.002592918714916732,0.7278415173428137,True,200,32,0.9308687099177957,0.9621350444406672,28,4,0.7337558976755763,2.9673693608073863,facebook/sam2-hiera-large,top_k_mean,0.228342844760817,5,graph,36,z-score,umap,45,True,False,heuristic,7.0,2.00495289054192,3,False,True,False,True,True,True,True,0.7999943553359765,0.5617278502458254,0.6560309814036709,0.6149326020656722,0.4930352104990634,0.5007383903773341,COMPLETE,,0.0,0
884,0.0,graph,33,l2,svd,18,True,False,silhouette,transformer.resblocks.11,ViT-B/32,blocks.11,dinov2_vitb14,layer2,resnet50,structural,0.002204854598096383,0.7233135187192216,False,200,32,0.868256202498932,0.9530006561438258,16,4,1.0427842428025924,2.7465525040337977,facebook/sam2-hiera-large,mean,0.30092060538746424,3,kmeans,10,root-norm,svd,21,True,True,silhouette,,1.5101912960304917,5,False,False,False,False,True,False,False,0.7639290383483738,0.7086356075008353,0.6731556860606146,0.3966891204628075,0.8347185951115299,0.7001615317897075,COMPLETE,,0.0,0
885,0.0,graph,40,z-score,pca,38,False,True,heuristic,transformer.resblocks.10,ViT-B/32,blocks.4,dinov2_vitb14,layer3,resnet50,semantic,0.008622910691308123,0.7754968267672357,False,100,16,0.8886588690503113,0.9621249369324755,25,3,0.539515331614664,2.3361455567247265,facebook/sam2-hiera-large,mean,0.40296213158005856,5,graph,38,z-score,pca,63,False,False,heuristic,3.0,1.3142348262893988,3,True,True,False,True,False,True,True,0.5067084108919003,0.6598515139157931,0.7094525401516452,0.1533352608686122,0.587794138051932,0.789687832423448,COMPLETE,,0.0,0
886,0.0,graph,35,z-score,umap,19,True,False,heuristic,transformer.resblocks.11,ViT-B/32,blocks.7,dinov2_vitb14,conv1,resnet50,semantic,0.009494836357568311,0.8434292246163151,True,50,8,0.9681327228644765,0.9143747153919217,20,2,1.1668685621141843,2.4945408391061004,facebook/sam2-hiera-large,top_k_mean,0.36164738062243723,3,kmeans,20,l2,umap,53,False,True,silhouette,5.0,3.8354622428106326,5,True,True,True,False,True,False,False,0.5722821052691182,0.6136110550598689,0.7379280835882194,0.4898713726339472,0.27938442442866274,0.8250054455484791,COMPLETE,,0.0,0
887,0.0,kmeans,27,root-norm,svd,44,False,True,silhouette,transformer.resblocks.9,ViT-B/32,blocks.11,dinov2_vitb14,layer4,resnet50,structural,0.001986084237137292,0.7131339388005827,False,200,32,0.8304703704402989,0.9040495388719313,27,4,0.5079845890064212,1.8758545858857318,facebook/sam2-hiera-large,median,0.2633667794896523,3,graph,33,z-score,umap,30,True,True,heuristic,7.0,2.0371407067141205,5,False,True,False,False,False,True,True,0.6234821185068925,0.6936101804335798,0.6058284303969147,0.18709537998292708,0.9433318227606747,0.01809397552159705,COMPLETE,,0.0,0
888,0.0,graph,36,l2,pca,47,True,True,heuristic,transformer.resblocks.10,ViT-B/32,blocks.4,dinov2_vitb14,layer3,resnet50,semantic,0.007390804280169341,0.7015414069835216,True,100,16,0.9578181836300272,0.9090158012178193,21,3,1.0052641160889464,2.3997575490558893,facebook/sam2-hiera-large,mean,0.11481473634303624,5,kmeans,40,z-score,pca,46,False,False,silhouette,3.0,4.5377815980516765,3,True,True,True,True,True,True,False,0.7042506616216726,0.5050443423234608,0.520978652422495,0.7760416853652371,0.6152336263529764,0.854895386453101,COMPLETE,,0.0,0
889,0.0,graph,37,z-score,svd,49,True,False,silhouette,transformer.resblocks.11,ViT-B/32,blocks.11,dinov2_vitb14,layer1,resnet50,structural,0.004925488363695068,0.6631282096139353,False,200,8,0.8914031203211012,0.916880644764611,23,3,1.0664346742145374,1.618985730966003,facebook/sam2-hiera-large,mean,0.1591911369896383,3,graph,26,root-norm,umap,37,True,True,silhouette,,2.6674610039675906,5,False,False,False,False,True,False,False,0.7351713602918779,0.4214454385583754,0.6538784148613352,0.10759078282140484,0.6910708767026125,0.6008197892603923,COMPLETE,,0.0,0
890,0.0,graph,17,l2,svd,23,False,True,heuristic,transformer.resblocks.11,ViT-B/32,blocks.11,dinov2_vitb14,layer3,resnet50,semantic,0.0024133857994441802,0.8015205214549924,False,50,32,0.8427940069909732,0.9653407083259291,30,4,0.9370276617668473,1.9433750991780911,facebook/sam2-hiera-large,mean,0.3392579446051547,5,graph,29,z-score,svd,62,False,False,heuristic,5.0,3.6404187696072077,3,True,True,False,True,False,True,True,0.5977234905892626,0.6375969289871063,0.5704935951642783,0.25559277523635204,0.47383434620392106,0.3595289025031384,COMPLETE,,0.0,0
891,0.0,kmeans,39,z-score,umap,39,True,False,heuristic,transformer.resblocks.10,ViT-B/32,blocks.4,dinov2_vitb14,layer2,resnet50,structural,0.006872390366532401,0.7604732128087991,True,100,16,0.8791701389809133,0.9299575072925222,22,3,1.078007442562211,2.7900151341473025,facebook/sam2-hiera-large,top_k_mean,0.29175723094289013,3,kmeans,37,l2,pca,57,True,True,silhouette,3.0,3.0662353981784016,5,False,True,True,False,True,False,False,0.6904546085612051,0.6682851395443006,0.4215674307442338,0.2883489212638531,0.16064135188680598,0.9998031537435266,COMPLETE,,0.0,0
876,0.0,graph,38,root-norm,pca,25,True,False,heuristic,transformer.resblocks.11,ViT-B/32,blocks.4,dinov2_vitb14,layer3,resnet50,semantic,0.009214527756216704,0.7400168696802496,True,200,16,0.8507529390945381,0.9128740561725458,29,4,1.0238487649630963,2.1189277551366246,facebook/sam2-hiera-large,median,0.2482431736981283,5,graph,28,z-score,pca,28,False,True,heuristic,,2.2649636969252587,3,True,False,True,False,True,False,True,0.7912182999010912,0.45675886400334553,0.5616826310226273,0.5671067682627545,0.7704830482227089,0.9783851767811079,COMPLETE,,0.0,0
877,0.0,graph,25,z-score,svd,33,True,True,silhouette,transformer.resblocks.9,ViT-B/32,blocks.11,dinov2_vitb14,layer2,resnet50,structural,0.007757253047595527,0.8235365277881517,False,50,8,0.9727292606618073,0.9694194458759806,30,3,0.565084453719259,1.8147159689554295,facebook/sam2-hiera-large,mean,0.20479951991164966,3,kmeans,21,z-score,umap,33,False,False,silhouette,3.0,3.473128099488433,5,True,True,False,True,True,True,False,0.5630022211776942,0.5804787687832529,0.49773969221289616,0.5848030883034754,0.41775141467515137,0.19334503052488514,COMPLETE,,0.0,0
878,0.0,kmeans,28,l2,svd,17,False,True,heuristic,transformer.resblocks.11,ViT-B/32,blocks.11,dinov2_vitb14,conv1,resnet50,semantic,0.007257613263348521,0.6738329460361852,False,200,32,0.8466224456507543,0.9345887668689362,27,3,0.8484392593567259,2.59819175567681,facebook/sam2-hiera-large,mean,0.15278020862504962,5,graph,35,root-norm,pca,17,True,True,heuristic,5.0,1.154664678163952,5,False,True,True,False,False,True,True,0.6741432545751544,0.7440757911159492,0.6122990411617035,0.3347289777091683,0.9989249886142001,0.9162403325853752,COMPLETE,,0.0,0
879,0.0,graph,39,z-score,pca,28,True,False,heuristic,transformer.resblocks.10,ViT-B/32,blocks.4,dinov2_vitb14,layer3,resnet50,structural,0.004081995378689183,0.6901185375572929,True,100,16,0.8574871904238052,0.9445061758697996,19,4,0.735261662955626,1.5467953586670982,facebook/sam2-hiera-large,mean,0.3898812700945681,3,kmeans,18,z-score,umap,25,False,True,silhouette,3.0,2.4688214804477697,3,True,True,False,False,True,False,False,0.5156530022396584,0.6741889912557364,0.6470170313422386,0.744387922230759,0.7114331073413468,0.743648050326324,COMPLETE,,0.0,0
880,0.0,graph,19,z-score,umap,64,False,True,silhouette,transformer.resblocks.11,ViT-B/32,blocks.11,dinov2_vitb14,layer4,resnet50,semantic,0.0043161920021168275,0.7687596517789138,False,50,8,0.8403650311817958,0.9495867265441466,28,3,0.7704540594735102,2.2911304596949176,facebook/sam2-hiera-large,top_k_mean,0.33178848154168894,5,graph,39,l2,svd,38,True,False,silhouette,,4.012510610020758,5,False,False,False,True,False,True,False,0.7204418472992399,0.7301203080912909,0.5504822845289463,0.07459554265448082,0.3815571116718241,0.880042682973395,COMPLETE,,0.0,0
881,0.0,graph,15,l2,svd,50,True,False,heuristic,transformer.resblocks.10,ViT-B/32,blocks.7,dinov2_vitb14,layer1,resnet50,semantic,0.008393636844389993,0.7521849484117902,True,200,32,0.9767062749407878,0.9220959110148538,26,4,0.9156088305511213,2.2308456000545815,facebook/sam2-hiera-large,mean,0.4580818260243009,3,graph,12,z-score,umap,61,False,True,heuristic,7.0,1.9561887561417386,3,True,True,True,False,True,False,True,0.6938885651987725,0.5914734245511425,0.4815463163683445,0.0008903175086060339,0.7372013664693413,0.9571894429452362,COMPLETE,,0.0,0
882,0.0,kmeans,23,root-norm,pca,41,False,True,silhouette,transformer.resblocks.9,ViT-B/32,blocks.4,dinov2_vitb14,layer3,resnet50,structural,0.0038233959516511275,0.708291787823159,False,100,16,0.9379738599749597,0.9197111254949341,24,2,0.6187765842403437,2.463214386439677,facebook/sam2-hiera-large,median,0.1331412717993759,3,kmeans,30,z-score,pca,59,True,False,silhouette,3.0,1.752993430758909,5,False,True,False,True,False,True,False,0.636801758393655,0.5450971155273756,0.5770289468860423,0.1986257963671957,0.880308415266611,0.331959843012464,COMPLETE,,0.0,0
883,0.0,graph,10,z-score,svd,52,True,True,heuristic,transformer.resblocks.11,ViT-B/32,blocks.11,dinov2_vitb14,layer1,resnet50,semantic,0.0016861491532086095,0.6109515760093643,True,50,8,0.8772815823759318,0.9379861071125545,22,3,1.1449361392853756,1.7398667962458834,facebook/sam2-hiera-large,mean,0.1810224462535037,5,graph,34,z-score,umap,43,False,True,heuristic,5.0,2.9632138740951133,3,True,True,True,False,True,True,True,0.6561356100006798,0.5187751015499285,0.6292145891709989,0.53610599769646,0.8147909500848011,0.0904896647452994,COMPLETE,,0.0,0
868,0.0,graph,23,l2,svd,34,False,True,heuristic,transformer.resblocks.11,ViT-B/32,blocks.11,dinov2_vitb14,layer3,resnet50,semantic,0.009587314013724462,0.8151129106518614,False,50,8,0.8166458319381281,0.9515758797661151,21,4,0.8805686980526579,2.572937868930546,facebook/sam2-hiera-large,mean,0.35444646211242026,5,kmeans,24,root-norm,umap,26,False,True,silhouette,5.0,1.691579196908929,5,True,True,False,False,False,True,False,0.7077603441554094,0.5518320795893824,0.6661505797368253,0.11719543099821957,0.7555543010646811,0.6192940777263782,COMPLETE,,0.0,0
869,0.0,kmeans,29,z-score,umap,51,True,False,heuristic,transformer.resblocks.10,ViT-B/32,blocks.4,dinov2_vitb14,layer2,resnet50,structural,0.00805649008312188,0.6063877340443622,True,100,16,0.8736181241488918,0.9634315913390744,28,2,0.6800557428882008,2.200966511676856,facebook/sam2-hiera-large,top_k_mean,0.22560575584861514,3,graph,25,l2,svd,42,True,False,heuristic,3.0,2.7757445308802784,5,False,True,True,True,True,False,True,0.6486514879262559,0.6840215873848919,0.6576189229089071,0.09192682100037686,0.8503406616321123,0.12268938130995524,COMPLETE,,0.0,0
870,0.0,graph,11,z-score,pca,53,False,True,silhouette,transformer.resblocks.11,ViT-B/32,blocks.7,dinov2_vitb14,conv1,resnet50,semantic,0.0010148063861783034,0.7802878807235223,False,200,32,0.9278243820339267,0.9318607496133264,26,3,0.7544180833419956,2.808204059204032,facebook/sam2-hiera-large,mean,0.4275945613894213,3,kmeans,31,z-score,pca,56,False,True,silhouette,3.0,1.8639056717424614,3,True,True,False,False,False,True,False,0.7305113440425118,0.6463380509708945,0.5312637592090841,0.01952305169397793,0.34770263234400983,0.1691047611304994,COMPLETE,,0.0,0
871,0.0,graph,18,root-norm,svd,36,True,False,heuristic,transformer.resblocks.9,ViT-B/32,blocks.11,dinov2_vitb14,layer3,resnet50,semantic,0.00978695163302508,0.6957479679362307,True,50,8,0.8234849598350261,0.9672617441556541,20,3,0.7932011055108024,2.439225091243002,facebook/sam2-hiera-large,median,0.43950545345680847,5,graph,39,z-score,umap,19,True,True,silhouette,,1.5920957347900562,5,False,False,True,False,True,True,False,0.5386314361610492,0.49032640122794424,0.723774637963374,0.15679759470593757,0.9846438397575242,0.6586412137570538,COMPLETE,,0.0,0
872,0.0,graph,36,l2,svd,30,True,True,silhouette,transformer.resblocks.11,ViT-B/32,blocks.4,dinov2_vitb14,layer1,resnet50,structural,0.004435642507270847,0.7155945981628227,False,100,16,0.8981302386868616,0.9759773422214794,15,4,0.9892567675264324,2.5400181575726375,facebook/sam2-hiera-large,mean,0.4920554373193461,3,graph,36,z-score,pca,64,False,False,heuristic,5.0,4.654152401594832,3,True,True,False,True,True,False,True,0.7435686321125339,0.568312013548671,0.5963907164015875,0.23303080120833125,0.5026745759583788,0.27720287428981694,COMPLETE,,0.0,0
873,0.0,graph,34,z-score,pca,55,False,True,heuristic,transformer.resblocks.10,ViT-B/32,blocks.11,dinov2_vitb14,layer4,resnet50,semantic,0.003539145190467413,0.7320909953519457,False,200,32,0.9416084652084888,0.9742570922215094,18,4,0.5826989128678542,1.9973021159554494,facebook/sam2-hiera-large,mean,0.27636418138902186,5,kmeans,33,root-norm,umap,48,True,True,silhouette,7.0,3.2945585673407853,5,False,True,False,False,False,True,False,0.7549140798676319,0.7001107614921459,0.5856176653222342,0.1752535556884944,0.8021484854068235,0.725277425172358,COMPLETE,,0.0,0
874,0.0,kmeans,24,z-score,svd,46,True,False,heuristic,transformer.resblocks.11,ViT-B/32,blocks.11,dinov2_vitb14,layer3,resnet50,structural,0.004563868057719914,0.837526627570165,True,50,8,0.8082339070468325,0.9414849883745283,25,3,0.966320398806177,2.5172123663021515,facebook/sam2-hiera-large,mean,0.14240857611652696,3,graph,17,z-score,svd,31,False,False,heuristic,3.0,3.0993499374926934,3,True,True,True,True,True,False,True,0.7681274449756911,0.5350836755720598,0.6979245251714931,0.6306931415449112,0.9222643969424615,0.8029072550154135,COMPLETE,,0.0,0
875,0.0,graph,40,l2,umap,40,False,True,silhouette,transformer.resblocks.10,ViT-B/32,blocks.7,dinov2_vitb14,layer1,resnet50,semantic,0.006290452225225943,0.6445715158262414,False,100,32,0.8631432364330978,0.9590800994713001,23,2,0.8967868763683579,2.645940082874566,facebook/sam2-hiera-large,top_k_mean,0.3199022828839124,3,kmeans,40,l2,umap,60,True,True,silhouette,5.0,4.436872816529395,5,False,True,False,False,False,True,False,0.6850534337085318,0.5583541542988874,0.6862827227916994,0.2155738582314804,0.6665728159406954,0.6860690625781841,COMPLETE,,0.0,0
28,0.0,graph,40,root-norm,umap,60,False,False,silhouette,transformer.resblocks.9,ViT-B/32,blocks.7,dinov2_vitb14,layer1,resnet50,structural,0.004645942119163662,0.6800072001857651,True,200,32,0.8312358021498784,0.9682892832352329,24,3,0.9197837601743722,1.85276783184419,facebook/sam2-hiera-large,top_k_mean,0.1987892696838705,5,kmeans,25,l2,svd,41,True,False,heuristic,5.0,1.7090407708707978,3,False,True,True,True,False,False,True,0.5373291339814704,0.6625137188015678,0.40166336872509,0.06996753197223686,0.9156498210341345,0.924367636810804,COMPLETE,,0.0,0
29,0.0,kmeans,26,l2,pca,28,True,True,silhouette,transformer.resblocks.10,ViT-B/32,blocks.4,dinov2_vitb14,layer4,resnet50,semantic,0.00315521544555763,0.653489711263138,True,100,16,0.9422444859022939,0.9589480966028564,28,4,0.7232300781302251,2.8728567761606967,facebook/sam2-hiera-large,median,0.2344693359819126,5,graph,34,root-norm,pca,46,True,False,heuristic,7.0,1.021392172785124,3,False,True,False,True,True,True,True,0.7883984151928546,0.5608129868734807,0.49161157447396014,0.6934028311187974,0.4337159993853035,0.5624485170074789,COMPLETE,,0.0,0
30,0.0,graph,30,l2,svd,21,True,True,heuristic,transformer.resblocks.11,ViT-B/32,blocks.7,dinov2_vitb14,conv1,resnet50,semantic,0.0016596271596593295,0.734895667840953,False,200,32,0.9185757895807286,0.9480938374051896,21,4,0.7861577880085513,2.9951396234977645,facebook/sam2-hiera-large,top_k_mean,0.13325057012812275,3,graph,35,z-score,umap,27,False,True,silhouette,3.0,1.9695004251241865,5,True,True,False,False,True,True,False,0.600542989079486,0.7097638699907236,0.6914058518398845,0.33675472414044055,0.6929015917123378,0.5130986617868992,COMPLETE,,0.0,0
31,0.0,kmeans,34,l2,svd,24,True,True,silhouette,transformer.resblocks.11,ViT-B/32,blocks.7,dinov2_vitb14,layer4,resnet50,semantic,0.002679147988946345,0.7084082668272728,True,200,32,0.9688479367439097,0.9661407117508861,29,4,0.5853087012593726,2.7896144941118655,facebook/sam2-hiera-large,top_k_mean,0.22588923889917265,5,graph,38,z-score,umap,46,True,False,heuristic,7.0,1.4033202976794463,3,False,True,False,True,True,True,True,0.7975975739118849,0.538835797249941,0.6513522194164898,0.6416490509499742,0.5763232411714778,0.2790805690440805,COMPLETE,,0.0,0
32,0.0,kmeans,21,l2,svd,33,True,True,silhouette,transformer.resblocks.11,ViT-B/32,blocks.7,dinov2_vitb14,layer4,resnet50,semantic,0.00411431873172404,0.7200291899741651,True,200,32,0.9367819669814914,0.9766946844835156,30,4,0.7224633592978507,2.95318711906668,facebook/sam2-hiera-large,top_k_mean,0.2953787737062668,5,graph,14,z-score,umap,53,True,False,heuristic,7.0,2.650560379897123,3,False,True,False,True,True,True,True,0.7658906751097602,0.5513232087176227,0.5981759399841978,0.5128478093743861,0.4086240183805764,0.7060205436356461,COMPLETE,,0.0,0
33,0.0,kmeans,30,l2,svd,27,True,True,silhouette,transformer.resblocks.11,ViT-B/32,blocks.7,dinov2_vitb14,layer4,resnet50,semantic,0.009127069278543117,0.7718667534225274,True,200,32,0.9352826165685918,0.9728109345558172,27,4,0.6705393416110137,2.3774399390142147,facebook/sam2-hiera-large,top_k_mean,0.17691681200574733,5,graph,31,z-score,umap,60,True,False,heuristic,7.0,2.234266993196158,3,False,True,False,True,True,False,True,0.7539502752052348,0.48779048727966934,0.7194877554739885,0.6334987879676037,0.16987804180503635,0.8087086979573941,COMPLETE,,0.0,0
34,0.0,kmeans,35,z-score,pca,16,True,True,silhouette,transformer.resblocks.11,ViT-B/32,blocks.11,dinov2_vitb14,layer1,resnet50,semantic,0.002686085644519844,0.6894980480774691,True,200,8,0.9111072662168728,0.9562293388327358,27,4,0.5044868587793404,2.693495953888286,facebook/sam2-hiera-large,top_k_mean,0.15719952351975666,3,graph,38,z-score,svd,40,True,False,heuristic,,2.067601913345483,3,False,False,False,False,True,True,False,0.7308464944618338,0.6327286224558193,0.6388044224277271,0.8225689936585778,0.5654816149898437,0.07660330114181998,COMPLETE,,0.0,0
35,0.0,kmeans,38,root-norm,umap,20,True,False,silhouette,transformer.resblocks.9,ViT-B/32,blocks.7,dinov2_vitb14,layer3,resnet50,semantic,0.005458620262516011,0.8261924872095653,True,200,16,0.96170215423626,0.9638395779591753,25,3,0.7762102918290563,2.18345357862406,facebook/sam2-hiera-large,top_k_mean,0.31438911500205025,5,kmeans,40,z-score,pca,62,True,False,heuristic,7.0,1.5115598497488136,3,False,True,False,True,True,False,True,0.6822634781254517,0.594538719006064,0.6832384625235315,0.1689592887610964,0.3033686856428367,0.44542555322007543,COMPLETE,,0.0,0
