number,value,params_dino_pipeline.clustering.clusterer.method,params_dino_pipeline.clustering.clusterer.n_neighbors,params_dino_pipeline.clustering.feature_processing.normalizer.method,params_dino_pipeline.clustering.feature_processing.reducer.method,params_dino_pipeline.clustering.feature_processing.reducer.n_components,params_dino_pipeline.clustering.feature_processing.run_normalization,params_dino_pipeline.clustering.feature_processing.run_reduction,params_dino_pipeline.clustering.k_selection.method,params_extractors.clip.layer_name,params_extractors.clip.model_name,params_extractors.dino_v2.layer_name,params_extractors.dino_v2.model_name,params_extractors.resnet.layer_name,params_extractors.resnet.model_name,params_fusion_pipeline.clustering.k_selection.k_source,params_heuristic_settings.filter_params.filter_min_area_perc,params_heuristic_settings.filter_params.nms_iou_threshold,params_heuristic_settings.filter_params.use_nms,params_heuristic_settings.generator_params.min_mask_region_area,params_heuristic_settings.generator_params.points_per_side,params_heuristic_settings.generator_params.pred_iou_thresh,params_heuristic_settings.generator_params.stability_score_thresh,params_heuristic_settings.k_heuristic_formulas.max_k,params_heuristic_settings.k_heuristic_formulas.semantic_base,params_heuristic_settings.k_heuristic_formulas.semantic_scale_factor,params_heuristic_settings.k_heuristic_formulas.structural_multiplier,params_heuristic_settings.sam_model,params_labeler.aggregation_method,params_labeler.aggregation_top_k_perc,params_labeler.top_n_labels,params_resnet_pipeline.clustering.clusterer.method,params_resnet_pipeline.clustering.clusterer.n_neighbors,params_resnet_pipeline.clustering.feature_processing.normalizer.method,params_resnet_pipeline.clustering.feature_processing.reducer.method,params_resnet_pipeline.clustering.feature_processing.reducer.n_components,params_resnet_pipeline.clustering.feature_processing.run_normalization,params_resnet_pipeline.clustering.feature_processing.run_reduction,params_resnet_pipeline.clustering.k_selection.method,params_resnet_pipeline.image_preprocessing.blur_kernel_size,params_resnet_pipeline.image_preprocessing.clahe_clip_limit,params_resnet_pipeline.image_preprocessing.sobel_kernel_size,params_resnet_pipeline.image_preprocessing.use_clahe,params_resnet_pipeline.image_preprocessing.use_gaussian_blur,params_resnet_pipeline.image_preprocessing.use_grayscale,params_resnet_pipeline.image_preprocessing.use_sobel_edges,params_run_dino_pipeline,params_run_fusion_pipeline,params_run_resnet_pipeline,params_validator_settings.final_threshold,params_validator_settings.semantic_threshold,params_validator_settings.structural_threshold,params_validator_settings.weights.clip_confidence,params_validator_settings.weights.dino_iou,params_validator_settings.weights.resnet_iou,state,user_attrs_error,user_attrs_max_clip_confidence,user_attrs_num_correct_segments
20,0.0,graph,14,z-score,svd,24,True,True,heuristic,transformer.resblocks.11,ViT-B/32,blocks.11,dinov2_vitb14,layer3,resnet50,semantic,0.0051643555223500805,0.6416303230774049,False,200,32,0.8891351382106544,0.9204735979253506,27,4,0.9800676733003619,1.5242936089151062,facebook/sam2-hiera-large,mean,0.25638118808877025,3,kmeans,11,z-score,umap,24,True,True,heuristic,5.0,3.0681242563002473,3,False,True,False,False,True,True,True,0.6355237489347646,0.7492554679680088,0.7044820846393886,0.4531635784705877,0.7099926018201643,0.6328211667051751,COMPLETE,,0.0,0
21,0.0,graph,40,z-score,pca,38,True,True,heuristic,transformer.resblocks.10,ViT-B/32,blocks.11,dinov2_vitb14,layer1,resnet50,semantic,0.004014494754846206,0.849428658154438,True,50,16,0.8732189817943946,0.9440406122794377,28,3,0.87430765573321,1.5476663442579,facebook/sam2-hiera-large,mean,0.16654903574432695,3,graph,33,z-score,pca,20,False,False,silhouette,5.0,1.8038586979995497,5,True,True,False,True,True,True,False,0.508751025395327,0.5189954142685885,0.5124181016235456,0.4101765394948439,0.7751582533219408,0.27567169117661317,COMPLETE,,0.0,0
22,0.0,graph,36,z-score,pca,51,True,True,heuristic,transformer.resblocks.10,ViT-B/32,blocks.11,dinov2_vitb14,layer4,resnet50,semantic,0.00248028717778424,0.8057363340703407,True,50,16,0.8785749747986803,0.9592026178692836,24,3,0.9069994406926833,1.7261001464549148,facebook/sam2-hiera-large,mean,0.14946648928123624,3,graph,36,z-score,pca,16,False,False,silhouette,5.0,2.3319128502220683,5,True,True,False,True,True,True,False,0.5930469331966013,0.5120974797276896,0.6585658760113621,0.28526330452003895,0.9971145376543209,0.20796675062917058,COMPLETE,,0.0,0
23,0.0,graph,37,z-score,pca,58,True,True,heuristic,transformer.resblocks.10,ViT-B/32,blocks.11,dinov2_vitb14,layer2,resnet50,semantic,0.004518935204242037,0.7573351638650143,True,50,16,0.8625068967456864,0.9450740531308199,29,3,1.0605240289034386,2.46394656229246,facebook/sam2-hiera-large,mean,0.1001955483923078,3,graph,40,z-score,pca,38,False,False,silhouette,5.0,1.3598665535620393,5,True,True,False,True,True,True,False,0.5680392432434371,0.654589475106823,0.592266201667365,0.2315154257782322,0.7502697097607858,0.03227586465972769,COMPLETE,,0.0,0
24,0.0,graph,32,z-score,pca,36,True,True,heuristic,transformer.resblocks.10,ViT-B/32,blocks.11,dinov2_vitb14,conv1,resnet50,semantic,0.006920017043551458,0.7006061006270718,True,50,16,0.8482482595279994,0.9283557048931808,26,3,0.6381341681485457,2.2943267602770585,facebook/sam2-hiera-large,mean,0.20510627752514368,3,graph,31,z-score,pca,28,False,False,silhouette,5.0,3.1477387815747444,5,True,True,False,True,True,True,False,0.7114956671350086,0.5789226161084206,0.7431842207136352,0.11804786072749068,0.8819059141655143,0.8584568658300907,COMPLETE,,0.0,0
25,0.0,graph,30,l2,pca,42,True,True,heuristic,transformer.resblocks.10,ViT-B/32,blocks.4,dinov2_vitb14,layer1,resnet50,semantic,0.0018559540520324798,0.8458767257415517,False,50,16,0.8987875981321182,0.9135648234643757,22,2,1.09198254899529,1.6635196302220265,facebook/sam2-hiera-large,mean,0.1481701250596453,3,graph,37,z-score,pca,56,False,False,silhouette,3.0,2.6855672770723684,5,True,True,False,True,True,True,False,0.6687477053155115,0.4754512872485324,0.6327503262865344,0.47255586578081743,0.6290182534402247,0.7508184196833032,COMPLETE,,0.0,0
26,0.0,kmeans,24,z-score,svd,20,False,False,silhouette,transformer.resblocks.11,ViT-B/32,blocks.11,dinov2_vitb14,layer3,resnet50,structural,0.0030732152162455707,0.7433474876719278,True,100,8,0.9274094873231411,0.9011755694754368,25,4,0.8701735545408148,2.1265528199268404,facebook/sam2-hiera-large,mean,0.45954211168429515,5,graph,33,z-score,umap,34,False,False,silhouette,,1.991151692163272,5,True,False,True,True,False,False,False,0.7394886360145143,0.6194035376120849,0.6724376874510651,0.3763627880652959,0.5378650396915724,0.15262121624556702,COMPLETE,,0.0,0
27,0.0,graph,21,z-score,svd,31,True,True,heuristic,transformer.resblocks.11,ViT-B/32,blocks.11,dinov2_vitb14,layer3,resnet50,semantic,0.008725137334506954,0.7867574923581138,False,50,8,0.958149932046833,0.9362921027871598,28,3,0.9910563280322913,2.5549120549602207,facebook/sam2-hiera-large,mean,0.3227544834293477,3,graph,38,z-score,umap,64,False,True,silhouette,3.0,2.2084834253613743,5,True,True,False,False,True,True,False,0.6242081524266948,0.5825191906609862,0.5516646040380536,0.25572004787887015,0.7961430394109872,0.36627933488169306,COMPLETE,,0.0,0
12,0.0,graph,19,l2,svd,63,False,False,heuristic,transformer.resblocks.11,ViT-B/32,blocks.4,dinov2_vitb14,layer3,resnet50,structural,0.0010207994286899492,0.7508928806974952,False,100,32,0.8669231621267324,0.928607092896162,20,3,1.0326103560439606,2.470680595985372,facebook/sam2-hiera-large,mean,0.4122993840204393,5,graph,33,z-score,umap,55,False,True,silhouette,3.0,3.4037521407002576,5,True,True,True,False,False,True,True,0.7259028979173717,0.7411658064586142,0.7211681101308445,0.32083888382033743,0.7155476103885327,0.7874708544282898,COMPLETE,,0.0,0
13,0.0,graph,17,l2,svd,30,False,True,silhouette,transformer.resblocks.11,ViT-B/32,blocks.4,dinov2_vitb14,layer3,resnet50,structural,0.007242128038378968,0.6696225635100026,False,100,8,0.8553116160216988,0.9625019972958108,21,2,1.0217798267800953,2.712918212396798,facebook/sam2-hiera-large,mean,0.20314804109756895,5,kmeans,40,root-norm,umap,56,True,True,heuristic,3.0,4.565947836872589,5,False,True,True,False,False,False,True,0.7841926872026906,0.6756452442918167,0.5739856058825483,0.31116133778271304,0.5080825972666068,0.8126487605121371,COMPLETE,,0.0,0
14,0.0,graph,28,root-norm,svd,54,True,True,heuristic,transformer.resblocks.11,ViT-B/32,blocks.11,dinov2_vitb14,layer3,resnet50,semantic,0.004839710905132695,0.6007815250035877,False,100,32,0.9789320969270101,0.9094066977025637,25,4,1.1559887781297702,2.118221761157074,facebook/sam2-hiera-large,mean,0.4813259201575047,3,graph,33,z-score,umap,59,True,True,heuristic,,4.030900252463725,3,True,False,False,False,True,False,True,0.7029377932167824,0.6044526455538853,0.6445377876169991,0.819525176689631,0.9594879276468604,0.6552113421321133,COMPLETE,,0.0,0
15,0.0,graph,10,z-score,svd,43,False,False,silhouette,transformer.resblocks.11,ViT-B/32,blocks.4,dinov2_vitb14,layer4,resnet50,structural,0.0010282611291359358,0.76325239906734,False,200,8,0.8113971454805634,0.9226365830784173,16,3,0.544301965378916,2.436741339873081,facebook/sam2-hiera-large,median,0.2724477035665204,5,kmeans,27,l2,umap,50,False,True,silhouette,3.0,2.8667584751224218,5,False,True,True,False,False,True,True,0.5957563113031672,0.41380527843146453,0.5669382373230539,0.2034823361265544,0.5224434583704214,0.888614970708177,COMPLETE,,0.0,0
16,0.0,graph,34,l2,svd,25,False,True,heuristic,transformer.resblocks.9,ViT-B/32,blocks.11,dinov2_vitb14,conv1,resnet50,structural,0.0021176092328545294,0.6841671969002283,False,100,32,0.8908646915940954,0.9543531830812912,22,4,0.8299290882873864,2.8625690543788744,facebook/sam2-hiera-large,mean,0.18060249126600053,5,graph,36,z-score,pca,36,False,True,heuristic,3.0,2.502905069431769,5,False,True,True,False,True,False,True,0.7579453348469835,0.6846410900671317,0.6962953013901371,0.3721139194365354,0.8133342762138915,0.6641695746282797,COMPLETE,,0.0,0
17,0.0,graph,27,l2,svd,56,True,False,silhouette,transformer.resblocks.11,ViT-B/32,blocks.4,dinov2_vitb14,layer2,resnet50,semantic,0.005832706590595607,0.6274556584078712,False,100,8,0.8447206108660037,0.968335810227351,26,2,0.9562589270565606,2.580349030040281,facebook/sam2-hiera-large,mean,0.42004869024200103,3,kmeans,36,z-score,umap,60,True,True,silhouette,3.0,1.5956216478699892,3,True,True,False,False,False,True,False,0.7033367417599704,0.6056515469791333,0.6156682807560224,0.024171467938541635,0.6170151132506968,0.3408009641179697,COMPLETE,,0.0,0
18,0.0,kmeans,18,z-score,svd,34,True,True,silhouette,transformer.resblocks.11,ViT-B/32,blocks.11,dinov2_vitb14,layer3,resnet50,semantic,0.007722149162139986,0.7933953820819722,False,200,32,0.9520506499010206,0.9512755021280787,17,3,1.1286039578022797,2.0164357980371657,facebook/sam2-hiera-large,median,0.11771980700347134,3,kmeans,30,root-norm,umap,49,False,True,silhouette,,3.8844000969794887,5,True,False,True,True,True,True,True,0.7717508142969433,0.5159557831537414,0.5397451188313003,0.7161463761961391,0.40624885432253244,0.8736284147694688,COMPLETE,,0.0,0
19,0.0,graph,36,root-norm,umap,45,False,False,heuristic,transformer.resblocks.9,ViT-B/32,blocks.4,dinov2_vitb14,layer3,resnet50,structural,0.0036703625185790416,0.7305114239634217,False,50,16,0.8239928151755131,0.9360424128683104,23,3,0.7771609438877876,2.7623150666176413,facebook/sam2-hiera-large,top_k_mean,0.3672139381909045,5,graph,23,l2,pca,60,True,True,heuristic,7.0,4.990108534656785,3,False,True,False,False,False,False,False,0.6906581847424864,0.7053486794425486,0.6197695348451627,0.1528619526765742,0.8560392111809441,0.9924337566828199,COMPLETE,,0.0,0
4,0.0,kmeans,22,root-norm,pca,31,True,False,silhouette,transformer.resblocks.9,ViT-B/32,blocks.11,dinov2_vitb14,layer3,resnet50,structural,0.009800220413538452,0.8175455724677392,True,200,8,0.9238231198763567,0.9120759406464977,30,4,0.6537076150795555,2.8183322849735575,facebook/sam2-hiera-large,top_k_mean,0.41407618473607644,3,graph,12,z-score,pca,45,True,True,silhouette,,2.0884965097900605,3,False,False,False,False,True,False,False,0.6220150662833983,0.7215458670920092,0.4195333849894368,0.1932191874566871,0.9501502754946288,0.9760318654122335,COMPLETE,,0.0,0
5,0.0,graph,39,z-score,umap,49,False,True,silhouette,transformer.resblocks.11,ViT-B/32,blocks.11,dinov2_vitb14,layer1,resnet50,semantic,0.00870355986130758,0.7005221574075187,True,50,16,0.8278946587098976,0.9211971721864862,15,2,0.7214683223682248,2.358369530279872,facebook/sam2-hiera-large,median,0.2877994748525867,3,kmeans,19,l2,svd,30,False,False,heuristic,3.0,2.8007629833292116,5,True,True,False,False,False,False,False,0.522694205458979,0.5582452472202507,0.515751485922892,0.5445134232231578,0.3046301262065557,0.13587178520845689,COMPLETE,,0.0,0
6,0.0,graph,33,z-score,pca,63,True,False,heuristic,transformer.resblocks.10,ViT-B/32,blocks.7,dinov2_vitb14,layer1,resnet50,semantic,0.007931979986889992,0.7106288898150084,True,200,8,0.9064676502090578,0.9027873474592358,23,4,0.8183238845667477,1.8384379462184683,facebook/sam2-hiera-large,mean,0.34637584234603414,3,kmeans,17,z-score,svd,20,False,True,heuristic,7.0,1.3647039831983725,3,True,True,False,False,True,False,False,0.5535567267402577,0.6501661787737387,0.4329139873999307,0.5674956108269325,0.22276100103209096,0.4196935676451776,COMPLETE,,0.0,0
7,0.0,graph,38,z-score,pca,18,True,True,heuristic,transformer.resblocks.9,ViT-B/32,blocks.11,dinov2_vitb14,layer1,resnet50,semantic,0.0035317631186907784,0.7785043039605682,False,200,16,0.9080710212056753,0.9331146056682562,26,4,0.5402346636977875,1.9605379295794538,facebook/sam2-hiera-large,mean,0.2402464694221012,3,graph,39,root-norm,svd,64,False,False,silhouette,3.0,4.548308063111502,5,True,True,True,False,True,False,False,0.6738049123291271,0.6908386162357776,0.4777834914342757,0.1756256865304644,0.32655287931156485,0.02092583502241052,COMPLETE,,0.0,0
8,0.0,graph,32,root-norm,umap,54,False,False,heuristic,transformer.resblocks.10,ViT-B/32,blocks.7,dinov2_vitb14,layer3,resnet50,structural,0.009964963189887887,0.661627556915716,True,50,32,0.9514960286836465,0.9517180339943553,30,3,0.9279066278198292,2.2086087715238487,facebook/sam2-hiera-large,top_k_mean,0.3215195871143367,3,kmeans,29,z-score,svd,32,True,False,heuristic,,1.023854689591266,3,False,False,False,True,False,True,False,0.6684373105868914,0.4649825668023808,0.4650441617530897,0.573682562884779,0.0036779364633042766,0.5714671429031812,COMPLETE,,0.0,0
9,0.0,kmeans,23,z-score,umap,17,False,True,silhouette,transformer.resblocks.10,ViT-B/32,blocks.7,dinov2_vitb14,layer1,resnet50,semantic,0.009840871088475044,0.8274566571532855,False,200,32,0.8390904089343622,0.9428526033280127,24,2,0.6264863984241988,2.2714427225098084,facebook/sam2-hiera-large,mean,0.37147773745740575,5,kmeans,22,l2,umap,43,True,True,silhouette,5.0,2.458101667784664,3,True,True,True,True,True,True,False,0.6464093197402805,0.72934059215085,0.677826615518335,0.0861343953522129,0.8691691023525283,0.47105065966875903,COMPLETE,,0.0,0
10,0.0,kmeans,11,l2,svd,47,True,False,silhouette,transformer.resblocks.11,ViT-B/32,blocks.4,dinov2_vitb14,layer2,resnet50,structural,0.006368861748630202,0.6004332874322968,False,100,8,0.9771639375332846,0.9736350191399051,19,3,1.1910733134503602,2.645686196371043,facebook/sam2-hiera-large,median,0.49437576883711254,5,kmeans,28,root-norm,umap,52,True,True,silhouette,,3.6193133510627002,3,False,False,True,False,False,True,True,0.7285948245191745,0.6211907681354403,0.6085274909164383,0.9855273822655328,0.6383572763116796,0.7281634095144274,COMPLETE,,0.0,0
11,0.0,graph,14,l2,svd,39,False,False,heuristic,transformer.resblocks.11,ViT-B/32,blocks.4,dinov2_vitb14,conv1,resnet50,structural,0.006149808754596195,0.6417660371133196,False,100,8,0.8005358141719267,0.97959572794316,19,3,1.0637607851397468,2.56892982278768,facebook/sam2-hiera-large,mean,0.11793360802296965,5,graph,39,z-score,umap,64,False,True,heuristic,3.0,3.457013312713126,5,False,True,True,False,False,False,True,0.7469607741108126,0.6477893782707903,0.7485186515358853,0.010481149889257801,0.6474262933063619,0.9657852888680611,COMPLETE,,0.0,0
267,-1.0,graph,40,z-score,pca,28,True,False,heuristic,transformer.resblocks.10,ViT-B/32,blocks.4,dinov2_vitb14,layer4,resnet50,semantic,0.004048876962369516,0.604996621275311,True,200,16,0.866687249319013,0.92343165010444,27,3,1.0293948394769414,2.4658710960614894,facebook/sam2-hiera-large,mean,0.18610494362546037,5,graph,35,z-score,pca,64,False,True,heuristic,,4.534723712343068,3,True,False,True,False,True,False,True,0.7289591278643622,0.6910414772476607,0.678313975945054,0.003738394083141996,0.37139280786999673,0.7840911229556998,COMPLETE,"ValueError: n_components=64 must be between 0 and min(n_samples, n_features)=49 with svd_solver='full'",0.0,0
