number,value,params_dino_pipeline.clustering.clusterer.method,params_dino_pipeline.clustering.clusterer.n_neighbors,params_dino_pipeline.clustering.feature_processing.normalizer.method,params_dino_pipeline.clustering.feature_processing.reducer.method,params_dino_pipeline.clustering.feature_processing.reducer.n_components,params_dino_pipeline.clustering.feature_processing.run_normalization,params_dino_pipeline.clustering.feature_processing.run_reduction,params_dino_pipeline.clustering.k_selection.method,params_extractors.clip.layer_name,params_extractors.clip.model_name,params_extractors.dino_v2.layer_name,params_extractors.dino_v2.model_name,params_extractors.resnet.layer_name,params_extractors.resnet.model_name,params_fusion_pipeline.clustering.k_selection.k_source,params_heuristic_settings.filter_params.filter_min_area_perc,params_heuristic_settings.filter_params.nms_iou_threshold,params_heuristic_settings.filter_params.use_nms,params_heuristic_settings.generator_params.min_mask_region_area,params_heuristic_settings.generator_params.points_per_side,params_heuristic_settings.generator_params.pred_iou_thresh,params_heuristic_settings.generator_params.stability_score_thresh,params_heuristic_settings.k_heuristic_formulas.max_k,params_heuristic_settings.k_heuristic_formulas.semantic_base,params_heuristic_settings.k_heuristic_formulas.semantic_scale_factor,params_heuristic_settings.k_heuristic_formulas.structural_multiplier,params_heuristic_settings.sam_model,params_labeler.aggregation_method,params_labeler.aggregation_top_k_perc,params_labeler.top_n_labels,params_resnet_pipeline.clustering.clusterer.method,params_resnet_pipeline.clustering.clusterer.n_neighbors,params_resnet_pipeline.clustering.feature_processing.normalizer.method,params_resnet_pipeline.clustering.feature_processing.reducer.method,params_resnet_pipeline.clustering.feature_processing.reducer.n_components,params_resnet_pipeline.clustering.feature_processing.run_normalization,params_resnet_pipeline.clustering.feature_processing.run_reduction,params_resnet_pipeline.clustering.k_selection.method,params_resnet_pipeline.image_preprocessing.blur_kernel_size,params_resnet_pipeline.image_preprocessing.clahe_clip_limit,params_resnet_pipeline.image_preprocessing.sobel_kernel_size,params_resnet_pipeline.image_preprocessing.use_clahe,params_resnet_pipeline.image_preprocessing.use_gaussian_blur,params_resnet_pipeline.image_preprocessing.use_grayscale,params_resnet_pipeline.image_preprocessing.use_sobel_edges,params_run_dino_pipeline,params_run_fusion_pipeline,params_run_resnet_pipeline,params_validator_settings.final_threshold,params_validator_settings.semantic_threshold,params_validator_settings.structural_threshold,params_validator_settings.weights.clip_confidence,params_validator_settings.weights.dino_iou,params_validator_settings.weights.resnet_iou,state,user_attrs_error,user_attrs_max_clip_confidence,user_attrs_num_correct_segments
580,0.0,kmeans,16,l2,pca,54,False,True,silhouette,transformer.resblocks.10,ViT-B/32,blocks.4,dinov2_vitb14,layer3,resnet50,structural,0.006158525320891837,0.6322843509482071,False,100,16,0.849920410924658,0.9698778321790806,27,2,0.9185512873249932,2.8792174676858147,facebook/sam2-hiera-large,mean,0.40356238832556457,3,graph,32,z-score,svd,19,True,True,heuristic,3.0,1.1300836589536218,5,False,True,False,False,False,True,True,0.7411641790813901,0.7282538907850944,0.6606325342468227,0.234367735725552,0.2467459013756509,0.00677538526004394,COMPLETE,,0.0,0
581,0.0,graph,25,z-score,umap,29,True,True,heuristic,transformer.resblocks.11,ViT-B/32,blocks.11,dinov2_vitb14,layer2,resnet50,semantic,0.002662654602044484,0.8369143048305632,True,200,32,0.9242610062360027,0.953852621188323,23,3,1.1979605490885938,2.512070604792418,facebook/sam2-hiera-large,top_k_mean,0.39120629517889477,5,kmeans,12,l2,pca,58,False,False,silhouette,3.0,1.541736761201369,3,True,True,True,True,True,True,False,0.7935693811196856,0.6577095128637234,0.6251935683928884,0.19312475776881646,0.6645139643492641,0.14657320547732738,COMPLETE,,0.0,0
582,0.0,graph,27,root-norm,svd,18,True,False,silhouette,transformer.resblocks.9,ViT-B/32,blocks.7,dinov2_vitb14,layer1,resnet50,structural,0.0020212112860694864,0.8094362221963682,False,50,8,0.8172968147941219,0.974389928535786,22,4,0.8548014217874118,2.065370511753909,facebook/sam2-hiera-large,median,0.18741659350128423,3,graph,38,z-score,umap,62,True,True,silhouette,,2.157577686806623,5,False,False,False,False,True,False,False,0.5557258600262336,0.7334497766800964,0.6022842807881834,0.2887299400393831,0.8237577722073457,0.8544099288263831,COMPLETE,,0.0,0
583,0.0,graph,15,l2,svd,25,False,True,heuristic,transformer.resblocks.11,ViT-B/32,blocks.11,dinov2_vitb14,conv1,resnet50,semantic,0.00916795650687929,0.6492979968819229,False,100,16,0.8102091390696845,0.9375238844283147,24,3,0.6390145834922636,2.4628914565866653,facebook/sam2-hiera-large,mean,0.3314207340111743,5,graph,27,z-score,pca,17,False,False,heuristic,5.0,3.665280667067319,3,True,True,False,True,False,True,True,0.5302318046806226,0.745074851768134,0.45654257999145753,0.172088292263086,0.5530300687975823,0.6716806787183579,COMPLETE,,0.0,0
584,0.0,graph,34,z-score,pca,64,True,False,heuristic,transformer.resblocks.10,ViT-B/32,blocks.4,dinov2_vitb14,layer3,resnet50,semantic,0.007842111635362723,0.6084586225468179,True,200,32,0.8961330687255697,0.9761614899765825,30,4,0.824504390319873,1.5015939501378646,facebook/sam2-hiera-large,mean,0.11125829529311262,3,kmeans,35,z-score,umap,64,True,True,silhouette,7.0,2.6380965403543972,5,False,True,True,False,True,False,False,0.6068034950720498,0.4269452258494,0.7356426447502246,0.7355944948286888,0.2863970032715916,0.0440959078989984,COMPLETE,,0.0,0
585,0.0,kmeans,39,z-score,svd,41,False,True,silhouette,transformer.resblocks.11,ViT-B/32,blocks.11,dinov2_vitb14,layer4,resnet50,structural,0.0010147186781120266,0.8496794127432908,False,50,8,0.9662861925721453,0.9141981970346894,25,3,1.0860308740672777,2.243195491907337,facebook/sam2-hiera-large,mean,0.20098431199206035,3,graph,34,root-norm,svd,31,False,True,heuristic,3.0,4.3112256254375,3,True,True,False,False,False,True,True,0.6591313607670394,0.702741852929302,0.43332022576122825,0.09817237881060575,0.43747278351347335,0.20549701259234937,COMPLETE,,0.0,0
586,0.0,graph,20,l2,umap,45,True,True,heuristic,transformer.resblocks.10,ViT-B/32,blocks.4,dinov2_vitb14,layer3,resnet50,semantic,0.009615679556343642,0.84261442102588,True,100,32,0.8688648866579074,0.9002966718519394,28,2,0.871080675238249,2.3402141798072296,facebook/sam2-hiera-large,top_k_mean,0.27837116890959246,5,kmeans,25,l2,umap,42,True,False,silhouette,5.0,1.9462021045339464,5,False,True,True,True,True,True,False,0.5462010168184328,0.6852507674403542,0.6934760426498209,0.32855699774729386,0.7575607309586457,0.7742410776665368,COMPLETE,,0.0,0
587,0.0,graph,38,z-score,pca,52,True,False,silhouette,transformer.resblocks.11,ViT-B/32,blocks.7,dinov2_vitb14,layer1,resnet50,structural,0.00939740360146835,0.7492695616121214,False,200,16,0.8364438310716523,0.9798436234475478,28,4,0.6872182016085832,1.6812600278631584,facebook/sam2-hiera-large,mean,0.24602833315437772,3,graph,30,z-score,pca,44,False,True,heuristic,,2.799386565832974,3,True,False,False,False,True,False,True,0.7829477811050901,0.6516220161396633,0.6667061957411824,0.5963367722032948,0.9001616849455255,0.3249915452559287,COMPLETE,,0.0,0
636,0.0,kmeans,31,z-score,svd,39,False,True,silhouette,transformer.resblocks.10,ViT-B/32,blocks.7,dinov2_vitb14,layer4,resnet50,structural,0.008336302504393997,0.7203043043585631,False,100,16,0.853732554917393,0.9127051980977431,26,3,0.525257154909104,1.7012118072773792,facebook/sam2-hiera-large,mean,0.1494068414290818,3,graph,31,z-score,pca,29,True,True,heuristic,5.0,2.291639724558596,5,False,True,False,False,False,True,True,0.504614901501854,0.7126303981354484,0.48116523716341825,0.5968840371949816,0.7920068466597092,0.7559461123858617,COMPLETE,,0.0,0
637,0.0,graph,12,root-norm,pca,56,True,True,heuristic,transformer.resblocks.9,ViT-B/32,blocks.4,dinov2_vitb14,layer3,resnet50,semantic,0.009692051130758793,0.6000328348587027,True,200,32,0.9018369633470382,0.9226312666816124,17,3,1.1171719399514426,1.8698228309870717,facebook/sam2-hiera-large,median,0.13367530385826057,5,kmeans,36,z-score,umap,55,False,False,silhouette,3.0,1.8803268336399173,3,True,True,True,True,True,True,False,0.7224221783818916,0.616194585416787,0.6513419352688984,0.18313583546300766,0.713044013644651,0.8559114037733186,COMPLETE,,0.0,0
638,0.0,graph,19,z-score,svd,54,True,False,silhouette,transformer.resblocks.11,ViT-B/32,blocks.11,dinov2_vitb14,layer1,resnet50,structural,0.009997224756853515,0.7047004785798664,False,50,8,0.8439225157681979,0.9170640699299442,23,3,0.6294924178459107,1.6625255253426672,facebook/sam2-hiera-large,mean,0.3088113609585793,3,graph,39,z-score,umap,38,True,True,silhouette,,4.565205868733159,5,False,False,False,False,True,False,False,0.6486839371147413,0.669836302973167,0.6608538533223031,0.14125511446967365,0.9007282074005396,0.4846765951515871,COMPLETE,,0.0,0
639,0.0,graph,39,l2,svd,47,False,True,heuristic,transformer.resblocks.10,ViT-B/32,blocks.4,dinov2_vitb14,layer3,resnet50,semantic,0.0054909517922323604,0.6985651441087538,False,100,16,0.9271729608819697,0.9651325070579521,30,4,0.7458449758254337,2.88178873030133,facebook/sam2-hiera-large,mean,0.3747933479143082,5,graph,34,root-norm,pca,59,False,False,heuristic,5.0,3.190571239552461,3,True,True,False,True,False,True,True,0.5181278603948806,0.6509158432044213,0.6754629799928558,0.36163014621497275,0.8282188919521425,0.29323155627141445,COMPLETE,,0.0,0
640,0.0,graph,28,z-score,pca,37,True,False,heuristic,transformer.resblocks.11,ViT-B/32,blocks.11,dinov2_vitb14,layer2,resnet50,semantic,0.001025112927843048,0.7879265454602081,True,200,32,0.8897039974417147,0.944586697996161,22,4,0.8768863211579891,2.699123490286344,facebook/sam2-hiera-large,mean,0.3926853518209732,3,kmeans,30,z-score,svd,36,True,True,silhouette,3.0,2.072423176762147,5,False,True,True,False,True,False,False,0.7784287538906497,0.5832747082859943,0.580610872147669,0.7244928606648591,0.8779260173886727,0.6659312120340718,COMPLETE,,0.0,0
641,0.0,kmeans,34,l2,umap,42,False,True,silhouette,transformer.resblocks.11,ViT-B/32,blocks.7,dinov2_vitb14,layer3,resnet50,structural,0.003177581763554677,0.8343436356817098,False,50,8,0.9064879238182824,0.977311869519895,19,2,0.9553661914728759,2.358891832344154,facebook/sam2-hiera-large,top_k_mean,0.11219716342692827,3,graph,40,l2,umap,25,False,True,heuristic,7.0,1.7770641917964471,3,True,True,False,False,False,True,True,0.5497599457724012,0.6356975284548713,0.5006474564414133,0.6700129252658488,0.6140192235286679,0.4308334993051515,COMPLETE,,0.0,0
642,0.0,graph,27,root-norm,svd,49,True,True,heuristic,transformer.resblocks.9,ViT-B/32,blocks.11,dinov2_vitb14,conv1,resnet50,semantic,0.009074925045876179,0.6502110105203969,True,100,16,0.8798042132126215,0.9532663341038704,27,3,1.1649311813636312,2.455831168424218,facebook/sam2-hiera-large,median,0.12672719024637177,5,kmeans,21,z-score,umap,30,True,False,silhouette,3.0,2.8191129795866576,5,False,True,True,True,True,True,False,0.7433403722737385,0.7411678750855202,0.5101170707581401,0.560336971378531,0.642965389895737,0.22277513920582734,COMPLETE,,0.0,0
643,0.0,graph,13,z-score,pca,22,True,False,silhouette,transformer.resblocks.10,ViT-B/32,blocks.4,dinov2_vitb14,layer1,resnet50,structural,0.006978022124562745,0.7406781001274686,False,200,32,0.8384226847979473,0.9590131893183044,21,3,1.0087150926271393,2.6626192075660517,facebook/sam2-hiera-large,mean,0.2239412625853965,3,graph,23,z-score,pca,60,False,True,heuristic,,2.433840604874969,3,True,False,False,False,True,False,True,0.6565202968069053,0.5281801094805596,0.6086957477953698,0.9117250198078215,0.7597832226725586,0.945351632663921,COMPLETE,,0.0,0
628,0.0,kmeans,19,z-score,svd,51,True,False,heuristic,transformer.resblocks.11,ViT-B/32,blocks.11,dinov2_vitb14,layer3,resnet50,structural,0.0043751945165779555,0.7593887463769865,True,200,8,0.8307405287336226,0.9623247176068965,27,3,1.0168483279683889,1.5224223263796235,facebook/sam2-hiera-large,mean,0.47117341038598015,3,kmeans,12,root-norm,umap,20,False,True,silhouette,5.0,1.6473683048248335,3,True,True,True,False,True,False,False,0.7671234619249281,0.5629906866003351,0.4045762060650655,0.05535764809141647,0.23603064671942575,0.10678738115207503,COMPLETE,,0.0,0
629,0.0,graph,38,l2,svd,24,False,True,silhouette,transformer.resblocks.11,ViT-B/32,blocks.11,dinov2_vitb14,layer4,resnet50,semantic,0.0020698259026364217,0.6630983070718838,False,50,32,0.8246059441929967,0.9691430241181715,28,4,0.7336117120553503,2.483793104488616,facebook/sam2-hiera-large,mean,0.12122248251693628,3,graph,38,z-score,svd,31,True,False,silhouette,3.0,1.8224090769657626,5,False,True,False,True,False,True,False,0.5270572622803071,0.5365886551755298,0.6850820309592667,0.15941168393276173,0.8586195486290757,0.6821631705810095,COMPLETE,,0.0,0
630,0.0,graph,21,z-score,umap,32,True,False,heuristic,transformer.resblocks.10,ViT-B/32,blocks.4,dinov2_vitb14,layer1,resnet50,semantic,0.007872469810004345,0.8050230719807361,True,100,16,0.9621856371464489,0.9723342325656363,22,2,0.8385159448516187,2.2687705891385703,facebook/sam2-hiera-large,top_k_mean,0.4219523586685945,5,graph,32,l2,pca,41,False,True,heuristic,,2.1819343064038774,3,True,False,True,False,True,False,True,0.6787288201596546,0.6618478685799519,0.7497621573905052,0.021631099546791033,0.9990998823609598,0.6383767802291767,COMPLETE,,0.0,0
631,0.0,graph,37,root-norm,pca,40,True,True,silhouette,transformer.resblocks.9,ViT-B/32,blocks.7,dinov2_vitb14,layer3,resnet50,structural,0.0059077297617872795,0.6918517069224862,False,200,32,0.8736714867340074,0.9734049889391796,28,3,0.9168551587056051,1.7896140737842565,facebook/sam2-hiera-large,median,0.2457246310904038,3,kmeans,38,z-score,umap,53,True,False,silhouette,3.0,4.375331219416976,5,False,True,False,True,True,True,False,0.7571803349856472,0.6276092937576596,0.5246720460472377,0.20168011729616042,0.7334436248067839,0.5603794363465286,COMPLETE,,0.0,0
632,0.0,kmeans,40,z-score,svd,28,False,True,heuristic,transformer.resblocks.11,ViT-B/32,blocks.11,dinov2_vitb14,layer3,resnet50,semantic,0.0035826771794765025,0.6417761020553556,False,50,8,0.8176856520634505,0.9186605780276555,19,3,0.7106985453322027,2.744313646896385,facebook/sam2-hiera-large,mean,0.26372966747794563,5,graph,40,z-score,umap,32,False,True,heuristic,5.0,3.308562139248483,3,True,True,True,False,False,True,True,0.6977661899287029,0.7232069033689936,0.45186637436202254,0.4294144496348979,0.2703364966300908,0.8670817185828774,COMPLETE,,0.0,0
633,0.0,graph,16,l2,pca,38,True,False,heuristic,transformer.resblocks.10,ViT-B/32,blocks.4,dinov2_vitb14,layer2,resnet50,structural,0.002801667699069456,0.6088002787442888,True,100,16,0.8957284872281113,0.9370406486720471,25,4,0.6477756014666766,2.528229471723227,facebook/sam2-hiera-large,mean,0.1637292629325898,3,kmeans,20,z-score,pca,47,True,True,silhouette,3.0,1.4410843055336604,5,False,True,False,False,True,False,False,0.5643961892940902,0.6033394358193994,0.5987210132126649,0.34271373167018443,0.5937059065566511,0.9851151769482395,COMPLETE,,0.0,0
634,0.0,graph,36,z-score,svd,26,False,True,silhouette,transformer.resblocks.11,ViT-B/32,blocks.11,dinov2_vitb14,layer1,resnet50,semantic,0.003856425124039324,0.8275409869449301,False,200,32,0.8572687204822881,0.9058920403777424,25,4,0.59080196121717,2.6360717214855844,facebook/sam2-hiera-large,mean,0.19801380698123378,5,graph,24,root-norm,svd,19,False,False,heuristic,,3.8535913098342203,3,True,False,False,True,False,True,True,0.7902062614601211,0.7007453091674058,0.7265317224863206,0.4655493027755183,0.4185937587695198,0.46133218618470917,COMPLETE,,0.0,0
635,0.0,graph,10,l2,umap,45,True,False,heuristic,transformer.resblocks.11,ViT-B/32,blocks.11,dinov2_vitb14,conv1,resnet50,semantic,0.007141130730608526,0.6347757937124092,True,50,8,0.8653148819869256,0.9514169000593358,29,2,0.7794409938618164,2.3272371588846283,facebook/sam2-hiera-large,top_k_mean,0.1859230316985612,3,kmeans,34,l2,umap,64,False,True,silhouette,7.0,3.4620969916649216,5,True,True,True,False,True,False,False,0.6358326597128526,0.6450644301829315,0.4288214000530821,0.09956553348767284,0.3328356310177021,0.8988806479769633,COMPLETE,,0.0,0
620,0.0,graph,16,l2,svd,63,True,True,heuristic,transformer.resblocks.9,ViT-B/32,blocks.11,dinov2_vitb14,conv1,resnet50,semantic,0.004793915934487748,0.8458500238810397,True,200,32,0.8481671221135766,0.9286625692185488,22,2,1.1349300031659917,2.5284055365261806,facebook/sam2-hiera-large,mean,0.2784040875274674,5,graph,27,z-score,umap,60,True,True,silhouette,7.0,4.99709061525157,5,False,True,True,False,True,True,False,0.6916670796707998,0.47922436513185057,0.5890338591011545,0.7701033611215992,0.7466620625647282,0.18456509315691355,COMPLETE,,0.0,0
621,0.0,graph,25,root-norm,pca,48,True,False,silhouette,transformer.resblocks.10,ViT-B/32,blocks.4,dinov2_vitb14,layer4,resnet50,structural,0.004097348635046074,0.7767579876735581,False,100,16,0.9526997700953362,0.9250758761835141,20,3,0.8544427809018427,2.090934017429754,facebook/sam2-hiera-large,median,0.1060668461894324,3,graph,15,z-score,pca,46,False,False,heuristic,,1.3331394767804785,3,True,False,False,True,True,False,True,0.5890324551631247,0.6099569925197682,0.7075538928262333,0.987957926663142,0.9202881533947478,0.369813019243276,COMPLETE,,0.0,0
622,0.0,graph,33,z-score,svd,20,False,True,heuristic,transformer.resblocks.11,ViT-B/32,blocks.11,dinov2_vitb14,layer1,resnet50,semantic,0.008863948843827256,0.8390668669221681,False,50,8,0.9576914675107948,0.9563062935292811,15,2,0.5105880328129072,2.1539675143882198,facebook/sam2-hiera-large,mean,0.3264547390777023,5,kmeans,31,z-score,umap,63,True,True,silhouette,3.0,1.049668212138862,5,False,True,False,False,False,True,False,0.6660738913814931,0.7389483854902195,0.612398164179321,0.31912300328639814,0.9749112460861485,0.1361910441001115,COMPLETE,,0.0,0
623,0.0,kmeans,36,l2,svd,33,True,False,heuristic,transformer.resblocks.11,ViT-B/32,blocks.11,dinov2_vitb14,layer3,resnet50,structural,0.005068382740050397,0.8176990671484423,True,200,32,0.9437313394434862,0.9107272245183607,29,4,1.1838203286023687,1.9926991679863117,facebook/sam2-hiera-large,mean,0.48974976919439106,3,graph,36,root-norm,svd,40,False,False,heuristic,3.0,3.6654267481408414,3,True,True,True,True,True,False,True,0.5144286985910272,0.5176172125723187,0.6209729525238663,0.24115566839858626,0.45599389400804413,0.23837898333266966,COMPLETE,,0.0,0
624,0.0,graph,17,z-score,pca,57,False,True,silhouette,transformer.resblocks.10,ViT-B/32,blocks.4,dinov2_vitb14,layer3,resnet50,semantic,0.009496278088181922,0.6839020190616865,False,100,16,0.910727741903723,0.9200011733145459,16,3,1.0391712806994762,2.418071005552511,facebook/sam2-hiera-large,top_k_mean,0.4113314867028705,3,kmeans,28,l2,pca,62,True,True,silhouette,5.0,1.9793762818844813,5,False,True,False,False,False,True,False,0.7368178488673399,0.705590723521751,0.6987893460554777,0.29402471845622036,0.7797847818608079,0.2567264876263442,COMPLETE,,0.0,0
625,0.0,graph,32,root-norm,umap,21,True,False,heuristic,transformer.resblocks.11,ViT-B/32,blocks.7,dinov2_vitb14,layer1,resnet50,semantic,0.0025311745626644417,0.6312792647966987,True,50,8,0.8790689958171425,0.9392842429786183,26,3,0.607926558841012,2.5939209338101623,facebook/sam2-hiera-large,mean,0.21515819735301778,5,graph,39,z-score,umap,34,False,True,heuristic,,2.6337388930313956,3,True,False,True,False,True,True,True,0.713532881696157,0.4920540205058429,0.6290086987395421,0.5213323478942233,0.8141927562552601,0.9694957999464031,COMPLETE,,0.0,0
626,0.0,graph,11,z-score,svd,52,True,True,silhouette,transformer.resblocks.9,ViT-B/32,blocks.11,dinov2_vitb14,layer2,resnet50,structural,0.006722369296182949,0.734891373315921,False,200,32,0.8702551542100894,0.9322740422280833,24,4,1.092144410093278,2.5580845929220337,facebook/sam2-hiera-large,median,0.10001837506031257,3,kmeans,33,z-score,umap,28,False,False,silhouette,3.0,3.0062177577524003,5,True,True,False,True,True,False,False,0.6868537857497778,0.6872562769078453,0.6398133985882332,0.6975163407008514,0.6285633871810214,0.8290568514011095,COMPLETE,,0.0,0
627,0.0,graph,39,l2,pca,36,False,True,heuristic,transformer.resblocks.10,ViT-B/32,blocks.4,dinov2_vitb14,conv1,resnet50,semantic,0.001436849186259981,0.7247800936787475,False,100,16,0.9695458501368387,0.9490854834765394,23,3,1.0637846953292451,1.594847132857217,facebook/sam2-hiera-large,mean,0.36195180310386565,5,graph,35,z-score,pca,61,True,True,heuristic,7.0,2.8779120696858365,5,False,True,False,False,False,True,True,0.6000880104278352,0.7309780297583163,0.4176065985850547,0.8797583917512548,0.8423336632195744,0.9147912981118814,COMPLETE,,0.0,0
612,0.0,graph,40,z-score,pca,24,False,True,silhouette,transformer.resblocks.11,ViT-B/32,blocks.11,dinov2_vitb14,conv1,resnet50,semantic,0.001232962883194091,0.7705383786349873,False,200,32,0.8354860367423991,0.9547368693354481,30,2,1.0263593761285443,2.77221435672643,facebook/sam2-hiera-large,mean,0.3976783816253237,5,graph,11,root-norm,umap,37,False,True,heuristic,5.0,3.161983948298114,3,True,True,False,False,False,True,True,0.7998926527186884,0.5968940553577463,0.731226560794679,0.5788691024420406,0.2006166751037033,0.6553916260650525,COMPLETE,,0.0,0
613,0.0,graph,29,l2,svd,40,True,False,heuristic,transformer.resblocks.11,ViT-B/32,blocks.11,dinov2_vitb14,layer1,resnet50,semantic,0.007320962355776288,0.7452724370180401,True,50,8,0.8433926238387981,0.9356536954266921,25,3,0.6972911976572622,2.50397546042866,facebook/sam2-hiera-large,top_k_mean,0.2900252170232296,3,kmeans,18,l2,svd,16,True,False,silhouette,,2.922726363942432,5,False,False,True,True,True,False,False,0.7541979544547255,0.5236541539688493,0.6458116599015934,0.22787698004222132,0.07785770328172423,0.05494585034742035,COMPLETE,,0.0,0
