number,value,params_dino_pipeline.clustering.clusterer.method,params_dino_pipeline.clustering.clusterer.n_neighbors,params_dino_pipeline.clustering.feature_processing.normalizer.method,params_dino_pipeline.clustering.feature_processing.reducer.method,params_dino_pipeline.clustering.feature_processing.reducer.n_components,params_dino_pipeline.clustering.feature_processing.run_normalization,params_dino_pipeline.clustering.feature_processing.run_reduction,params_dino_pipeline.clustering.k_selection.method,params_extractors.clip.layer_name,params_extractors.clip.model_name,params_extractors.dino_v2.layer_name,params_extractors.dino_v2.model_name,params_extractors.resnet.layer_name,params_extractors.resnet.model_name,params_fusion_pipeline.clustering.k_selection.k_source,params_heuristic_settings.filter_params.filter_min_area_perc,params_heuristic_settings.filter_params.nms_iou_threshold,params_heuristic_settings.filter_params.use_nms,params_heuristic_settings.generator_params.min_mask_region_area,params_heuristic_settings.generator_params.points_per_side,params_heuristic_settings.generator_params.pred_iou_thresh,params_heuristic_settings.generator_params.stability_score_thresh,params_heuristic_settings.k_heuristic_formulas.max_k,params_heuristic_settings.k_heuristic_formulas.semantic_base,params_heuristic_settings.k_heuristic_formulas.semantic_scale_factor,params_heuristic_settings.k_heuristic_formulas.structural_multiplier,params_heuristic_settings.sam_model,params_labeler.aggregation_method,params_labeler.aggregation_top_k_perc,params_labeler.top_n_labels,params_resnet_pipeline.clustering.clusterer.method,params_resnet_pipeline.clustering.clusterer.n_neighbors,params_resnet_pipeline.clustering.feature_processing.normalizer.method,params_resnet_pipeline.clustering.feature_processing.reducer.method,params_resnet_pipeline.clustering.feature_processing.reducer.n_components,params_resnet_pipeline.clustering.feature_processing.run_normalization,params_resnet_pipeline.clustering.feature_processing.run_reduction,params_resnet_pipeline.clustering.k_selection.method,params_resnet_pipeline.image_preprocessing.blur_kernel_size,params_resnet_pipeline.image_preprocessing.clahe_clip_limit,params_resnet_pipeline.image_preprocessing.sobel_kernel_size,params_resnet_pipeline.image_preprocessing.use_clahe,params_resnet_pipeline.image_preprocessing.use_gaussian_blur,params_resnet_pipeline.image_preprocessing.use_grayscale,params_resnet_pipeline.image_preprocessing.use_sobel_edges,params_run_dino_pipeline,params_run_fusion_pipeline,params_run_resnet_pipeline,params_validator_settings.final_threshold,params_validator_settings.semantic_threshold,params_validator_settings.structural_threshold,params_validator_settings.weights.clip_confidence,params_validator_settings.weights.dino_iou,params_validator_settings.weights.resnet_iou,state,user_attrs_error,user_attrs_max_clip_confidence,user_attrs_num_correct_segments
220,0.0,kmeans,28,z-score,svd,23,True,False,heuristic,transformer.resblocks.10,ViT-B/32,blocks.11,dinov2_vitb14,conv1,resnet50,structural,0.004324575544565601,0.7836500840493049,True,200,8,0.899299539102049,0.9664216581716745,28,4,0.6948096774115666,2.2691287588267945,facebook/sam2-hiera-large,mean,0.38609458046167433,3,graph,19,root-norm,pca,62,False,False,heuristic,3.0,1.8187814854315958,3,True,True,True,True,True,False,True,0.7119005174374734,0.496703560865451,0.7165273292073503,0.08372059925262632,0.6741068827831426,0.7837740639514623,COMPLETE,,0.0,0
221,0.0,graph,32,z-score,pca,17,True,True,heuristic,transformer.resblocks.10,ViT-B/32,blocks.11,dinov2_vitb14,layer4,resnet50,semantic,0.0026166367669506812,0.8158666088611863,True,50,16,0.8734972291938747,0.9609314330371796,24,3,0.927537882283297,1.8575553616310243,facebook/sam2-hiera-large,mean,0.15922267276758909,3,graph,34,z-score,pca,18,False,False,silhouette,5.0,2.3804115743969185,5,True,True,False,True,True,True,False,0.595303513446593,0.5377074421884032,0.6485442538075747,0.3125331231425113,0.6376907506976349,0.20438196915589218,COMPLETE,,0.0,0
222,0.0,graph,35,z-score,pca,49,True,True,heuristic,transformer.resblocks.10,ViT-B/32,blocks.11,dinov2_vitb14,layer4,resnet50,semantic,0.0023231905695331005,0.806166321782396,True,50,16,0.8856473691391034,0.954880749390132,25,3,0.8844311122870667,1.5400269262797428,facebook/sam2-hiera-large,mean,0.13871280497251562,3,graph,35,z-score,pca,17,False,False,silhouette,5.0,1.0922914396285122,5,True,True,False,True,True,True,False,0.6088085529985061,0.7332829422038186,0.6594384106224351,0.3004754546624497,0.9989867164570697,0.2241210990955058,COMPLETE,,0.0,0
223,0.0,graph,36,z-score,pca,50,True,True,heuristic,transformer.resblocks.10,ViT-B/32,blocks.11,dinov2_vitb14,layer4,resnet50,semantic,0.0034332471044632765,0.7732724327275288,True,50,16,0.8792271700823688,0.9653988509798637,24,3,0.7448034896991259,2.734463522224884,facebook/sam2-hiera-large,mean,0.12018808074808991,3,graph,39,z-score,pca,46,False,False,silhouette,5.0,2.550187538242989,5,True,True,False,True,True,True,False,0.7547273094585195,0.5220266937409141,0.7245413101487874,0.279732304417308,0.9648395921343674,0.26975963592010266,COMPLETE,,0.0,0
224,0.0,graph,38,z-score,pca,26,True,True,heuristic,transformer.resblocks.10,ViT-B/32,blocks.11,dinov2_vitb14,layer4,resnet50,semantic,0.0020665226797623964,0.7882026861545836,True,50,16,0.9082937889130221,0.959456401322528,22,3,0.9423103337795538,1.7541808128700018,facebook/sam2-hiera-large,mean,0.1525593518910592,3,graph,36,z-score,pca,17,False,False,silhouette,5.0,2.47837867435754,5,True,True,False,True,True,True,False,0.5850234289487594,0.528934734796117,0.6634053269424375,0.579236135570723,0.9781197618734877,0.17418929740821215,COMPLETE,,0.0,0
225,0.0,graph,36,l2,pca,56,False,True,silhouette,transformer.resblocks.11,ViT-B/32,blocks.4,dinov2_vitb14,layer2,resnet50,semantic,0.0027932532570953696,0.803319170868132,False,100,16,0.8707516352513542,0.9632385832108996,23,3,0.909593705253007,1.8985420973393539,facebook/sam2-hiera-large,mean,0.1281564097153097,3,kmeans,32,l2,svd,64,False,True,silhouette,7.0,4.495308936940598,5,True,True,False,False,False,True,False,0.5666537909310168,0.5968844334297854,0.6765072600980909,0.33138484579616806,0.9427531134268723,0.8525284645334709,COMPLETE,,0.0,0
226,0.0,graph,17,z-score,umap,20,True,True,heuristic,transformer.resblocks.11,ViT-B/32,blocks.11,dinov2_vitb14,layer3,resnet50,semantic,0.0099743990915838,0.8109591597210707,True,50,32,0.9746428257326797,0.9184050561860664,20,3,0.8647119687555652,2.1965165813599987,facebook/sam2-hiera-large,median,0.3650673196649373,5,graph,25,z-score,umap,16,True,True,heuristic,,2.245803226307703,5,False,False,True,True,True,True,True,0.5469457007521198,0.7482068219886917,0.607909164538363,0.1576762075514314,0.5474940892800162,0.14581718362440577,COMPLETE,,0.0,0
227,0.0,graph,37,root-norm,svd,51,True,False,silhouette,transformer.resblocks.9,ViT-B/32,blocks.7,dinov2_vitb14,layer4,resnet50,structural,0.007573298946649478,0.6059499234377663,False,200,8,0.9584357888034578,0.9237092844330236,30,2,1.1739629294654117,1.815324550426555,facebook/sam2-hiera-large,top_k_mean,0.2934623868740173,3,kmeans,37,z-score,umap,22,False,False,silhouette,3.0,2.3820978022466153,3,True,True,False,False,True,False,False,0.6402151696860564,0.5678652060022285,0.46560330580520987,0.01789238511587858,0.04684239274198436,0.6920913765136252,COMPLETE,,0.0,0
212,0.0,graph,39,z-score,pca,38,True,True,heuristic,transformer.resblocks.10,ViT-B/32,blocks.11,dinov2_vitb14,layer1,resnet50,semantic,0.004240986203303009,0.8449965031301803,True,50,16,0.8734104078923005,0.9150706101238536,28,3,0.8756277464328917,1.6340932527915173,facebook/sam2-hiera-large,mean,0.1403530834321216,3,graph,33,z-score,pca,23,False,False,silhouette,5.0,1.755796026533319,5,True,True,False,True,True,True,False,0.5059887995229088,0.5144115861306879,0.7498390276673261,0.43790155621314863,0.472473000039324,0.3139833331501073,COMPLETE,,0.0,0
213,0.0,graph,40,z-score,pca,39,True,True,heuristic,transformer.resblocks.10,ViT-B/32,blocks.11,dinov2_vitb14,layer1,resnet50,semantic,0.003626927130612863,0.8365333537491029,True,50,16,0.9145503664786198,0.9699622330354938,27,3,0.8524459231215905,2.8669869010500504,facebook/sam2-hiera-large,mean,0.1826523447137605,3,graph,40,z-score,pca,24,False,False,silhouette,5.0,1.9103003054979537,5,True,True,False,True,True,True,False,0.5147197488138788,0.6905752940052672,0.5277146995764714,0.4118303175931384,0.8421817520849856,0.6389451443854772,COMPLETE,,0.0,0
214,0.0,graph,39,z-score,pca,37,True,True,heuristic,transformer.resblocks.10,ViT-B/32,blocks.11,dinov2_vitb14,layer1,resnet50,semantic,0.003116182515188611,0.7474360563930678,True,50,16,0.9796735884815971,0.9445875522685474,26,3,0.9080050953773988,2.604550563898411,facebook/sam2-hiera-large,mean,0.14951817460931754,3,graph,29,z-score,pca,29,False,False,silhouette,5.0,2.0899327601630624,5,True,True,False,True,True,True,False,0.7431996967178309,0.6733739965613397,0.6877843613462408,0.3899718567868634,0.7892359322081235,0.2523162752464912,COMPLETE,,0.0,0
215,0.0,graph,40,z-score,svd,33,True,True,silhouette,transformer.resblocks.11,ViT-B/32,blocks.11,dinov2_vitb14,layer1,resnet50,semantic,0.00492283310202471,0.8409575935990831,True,50,8,0.8896288747591283,0.9439427304090138,29,3,0.6575172834002933,1.5653969074582772,facebook/sam2-hiera-large,mean,0.1644825506270318,5,graph,31,l2,pca,17,False,False,silhouette,3.0,2.0237503575948095,5,True,True,False,True,True,True,False,0.6248349000102964,0.547952485190992,0.4905306256310431,0.775818084885056,0.8186668550850117,0.2834960593123865,COMPLETE,,0.0,0
216,0.0,kmeans,26,l2,umap,41,True,False,heuristic,transformer.resblocks.10,ViT-B/32,blocks.4,dinov2_vitb14,layer4,resnet50,structural,0.005864237307221133,0.8460377101864761,False,100,16,0.8802451971491707,0.9410966778058337,24,3,0.8935808094600513,1.5818677819294829,facebook/sam2-hiera-large,mean,0.15625481152713083,3,graph,36,root-norm,umap,19,False,True,heuristic,3.0,1.5922234264197617,3,True,True,True,False,True,False,True,0.5235745447566333,0.7043187292909552,0.4345804081383565,0.35011967923169673,0.7589693655725887,0.5103852348821531,COMPLETE,,0.0,0
217,0.0,graph,34,z-score,svd,30,False,True,silhouette,transformer.resblocks.11,ViT-B/32,blocks.11,dinov2_vitb14,layer3,resnet50,semantic,0.006290499542137926,0.7313264140067879,True,200,32,0.8642999044715991,0.9457123748158288,29,2,0.9221288315927945,2.538899130790002,facebook/sam2-hiera-large,median,0.1957723503191875,5,kmeans,34,z-score,svd,60,True,False,silhouette,5.0,4.825936873303306,5,False,True,False,True,False,True,False,0.646053243002078,0.47185832487853513,0.4236588220858229,0.5170473945366563,0.9582886130906009,0.7248159640944595,COMPLETE,,0.0,0
218,0.0,graph,29,root-norm,pca,59,True,False,heuristic,transformer.resblocks.9,ViT-B/32,blocks.7,dinov2_vitb14,layer1,resnet50,structural,0.003909638138356978,0.8243280478241277,False,100,8,0.8771862464675613,0.9498208601133901,27,4,0.8295748818671599,2.495636901584713,facebook/sam2-hiera-large,top_k_mean,0.42678258033933,3,graph,38,z-score,umap,52,False,True,heuristic,,1.9801075547213207,3,True,False,True,False,True,False,True,0.6850910700162669,0.5189057344370938,0.6692281285690189,0.48914027049474185,0.5184667500490301,0.9998621647059531,COMPLETE,,0.0,0
219,0.0,graph,20,l2,svd,53,False,True,silhouette,transformer.resblocks.11,ViT-B/32,blocks.4,dinov2_vitb14,layer3,resnet50,semantic,0.004630303519727485,0.6871496716579812,False,50,32,0.8060271900241843,0.9100675274055541,23,3,1.1546088063844269,2.158683109766755,facebook/sam2-hiera-large,mean,0.17652766372681875,5,kmeans,16,z-score,umap,50,True,True,silhouette,3.0,2.775430901668809,5,False,True,False,False,False,True,False,0.6023485306317211,0.40027984398739946,0.5353686516827897,0.9092940516657362,0.4241482488567303,0.5944652469227996,COMPLETE,,0.0,0
204,0.0,graph,14,z-score,svd,18,True,True,heuristic,transformer.resblocks.11,ViT-B/32,blocks.11,dinov2_vitb14,layer3,resnet50,semantic,0.005304294660311966,0.6639805322404007,False,200,32,0.9534200159751233,0.9781192219544412,26,4,0.9342208751975677,1.7031564084692996,facebook/sam2-hiera-large,mean,0.26607849735944145,3,kmeans,21,z-score,umap,16,True,True,heuristic,5.0,2.1438519029821497,3,False,True,False,False,True,True,True,0.6173766032821214,0.7301638433961682,0.6942628587601399,0.388953549246219,0.6893328523267812,0.9537025780415832,COMPLETE,,0.0,0
205,0.0,graph,13,z-score,pca,55,True,False,heuristic,transformer.resblocks.10,ViT-B/32,blocks.7,dinov2_vitb14,layer3,resnet50,structural,0.0045146207498511755,0.7208865597907596,True,200,32,0.8443064742281104,0.9175862172341677,27,4,0.9900441436948225,2.8107932423475175,facebook/sam2-hiera-large,mean,0.24459052969339362,3,kmeans,37,z-score,umap,18,True,True,heuristic,3.0,2.8725138771968433,5,False,True,True,False,True,False,True,0.6516883314329281,0.5706358971190815,0.7017741357035384,0.5379065113042684,0.6195258740725946,0.16118805841288117,COMPLETE,,0.0,0
206,0.0,graph,32,z-score,svd,23,False,True,heuristic,transformer.resblocks.11,ViT-B/32,blocks.4,dinov2_vitb14,conv1,resnet50,semantic,0.0012863276546843838,0.710188518004952,False,50,8,0.8123332045460854,0.9543409898291427,21,3,1.0339127719888093,1.7313366665999408,facebook/sam2-hiera-large,mean,0.2830387691586621,5,kmeans,39,l2,umap,40,True,True,silhouette,,3.3146019513608445,3,False,False,False,False,False,True,False,0.6317024967024597,0.6502817236542869,0.6272249090811465,0.6157812865423963,0.7194247061259795,0.6261507467197697,COMPLETE,,0.0,0
207,0.0,graph,18,l2,umap,44,True,False,silhouette,transformer.resblocks.11,ViT-B/32,blocks.11,dinov2_vitb14,layer1,resnet50,structural,0.008256597825618467,0.8303495671643186,False,100,32,0.9309182547218227,0.963346718143598,16,4,1.0501329869128424,1.6284704173775657,facebook/sam2-hiera-large,mean,0.39512613800863206,3,graph,10,root-norm,pca,33,False,True,heuristic,5.0,1.9555345551201948,5,True,True,True,True,True,False,True,0.7967599272977903,0.6814637713990191,0.6502481800916483,0.36484026063305863,0.8142492060422482,0.6538975007823181,COMPLETE,,0.0,0
208,0.0,graph,21,root-norm,svd,47,False,True,heuristic,transformer.resblocks.9,ViT-B/32,blocks.4,dinov2_vitb14,layer3,resnet50,semantic,0.009766799281179813,0.6966796498216907,True,200,16,0.8383514250956119,0.9207464053941021,28,2,0.8053244596064963,2.088291807953923,facebook/sam2-hiera-large,top_k_mean,0.4929193240007255,5,kmeans,23,z-score,svd,64,True,False,silhouette,3.0,4.033029973258589,3,False,True,False,False,False,True,False,0.5337065531672628,0.7418480129688015,0.5626107278720834,0.17127881477747808,0.9231577070650748,0.5704317558990275,COMPLETE,,0.0,0
209,0.0,kmeans,38,z-score,svd,26,True,False,silhouette,transformer.resblocks.10,ViT-B/32,blocks.11,dinov2_vitb14,layer2,resnet50,semantic,0.0015128944527782674,0.7414519507584644,False,100,8,0.9656756861490384,0.9119346173856367,25,3,1.0852085362556763,2.4179759296093852,facebook/sam2-hiera-large,mean,0.24888837007099038,3,graph,28,z-score,umap,27,False,True,heuristic,7.0,4.260333591235053,3,True,True,True,False,True,True,True,0.6642986831527988,0.6119766129765113,0.4772577963121683,0.20388841873053778,0.6093845929045323,0.8062758286980228,COMPLETE,,0.0,0
210,0.0,graph,16,l2,pca,50,False,True,heuristic,transformer.resblocks.11,ViT-B/32,blocks.7,dinov2_vitb14,layer3,resnet50,structural,0.0071644622881473705,0.6206571671564682,False,200,32,0.8178835251760643,0.9329559861259861,18,4,0.9504914727600212,1.502663162120681,facebook/sam2-hiera-large,median,0.4493263687269694,3,kmeans,11,z-score,umap,21,True,True,silhouette,,2.965942447936844,5,False,False,False,False,False,False,False,0.5206631649035885,0.6280287671718314,0.45859975587827395,0.6530181466125344,0.7477287984228632,0.3731946526417101,COMPLETE,,0.0,0
211,0.0,graph,40,z-score,pca,37,True,True,heuristic,transformer.resblocks.10,ViT-B/32,blocks.11,dinov2_vitb14,layer1,resnet50,semantic,0.0039649473369049336,0.6301193395380862,True,50,16,0.8688264965446283,0.9426814098610903,28,3,1.1098556055369657,1.5432216957566935,facebook/sam2-hiera-large,mean,0.16859063648196404,3,graph,33,z-score,pca,20,False,False,silhouette,5.0,1.6751083720957491,5,True,True,False,True,True,True,False,0.5108459524303963,0.5563657974363637,0.5115433814410244,0.40236395485995835,0.7760000107644973,0.40847131260278,COMPLETE,,0.0,0
196,0.0,graph,22,z-score,svd,57,False,True,silhouette,transformer.resblocks.10,ViT-B/32,blocks.4,dinov2_vitb14,conv1,resnet50,semantic,0.00401695963109536,0.6357495990720148,False,50,32,0.834609090561706,0.9408883412704988,23,3,0.7592201798966487,2.687262126479855,facebook/sam2-hiera-large,mean,0.373606529251949,5,graph,10,z-score,svd,44,False,True,heuristic,5.0,2.841780049501833,3,True,True,False,False,True,True,True,0.7042697066431857,0.7186147742051738,0.622629322330266,0.21243697832274866,0.23342753312762574,0.9117756369734644,COMPLETE,,0.0,0
197,0.0,kmeans,10,l2,pca,63,True,False,heuristic,transformer.resblocks.11,ViT-B/32,blocks.7,dinov2_vitb14,layer1,resnet50,structural,0.002011666728863052,0.7654894533224537,False,200,8,0.8520742580402277,0.9286811115560082,28,4,0.5305788502603398,2.236325694188508,facebook/sam2-hiera-large,mean,0.1461167647242793,3,kmeans,32,l2,umap,62,True,False,silhouette,3.0,3.2335686351940303,5,False,True,True,False,False,False,False,0.5001771055481741,0.7398651267145838,0.6402662700736168,0.4975388537258726,0.8895681531509035,0.9334912857556121,COMPLETE,,0.0,0
198,0.0,graph,35,z-score,umap,36,False,True,silhouette,transformer.resblocks.11,ViT-B/32,blocks.11,dinov2_vitb14,layer3,resnet50,semantic,0.005028518786738927,0.7569541142667379,True,100,32,0.9710926249701982,0.9390511655546493,27,3,0.726647294573663,2.516204540709143,facebook/sam2-hiera-large,top_k_mean,0.3159574618329689,5,graph,33,root-norm,pca,63,False,True,heuristic,,1.4184253472442638,3,True,False,False,False,True,True,True,0.7704751688370705,0.5323834185700642,0.6354529560092056,0.17619937655757514,0.5776216668118099,0.20942305238808653,COMPLETE,,0.0,0
199,0.0,graph,30,root-norm,svd,34,True,False,heuristic,transformer.resblocks.9,ViT-B/32,blocks.4,dinov2_vitb14,layer1,resnet50,structural,0.009599748755401427,0.6004473742158903,False,200,16,0.9117793661949389,0.9300370106925832,19,2,0.8941678790741393,2.0306413746795666,facebook/sam2-hiera-large,mean,0.35770001315766903,3,kmeans,35,z-score,umap,48,True,True,silhouette,7.0,4.978979761049597,5,False,True,True,True,True,False,False,0.7797101499446704,0.48810769527882425,0.5026699244574949,0.13690257668128744,0.9959939350732575,0.34211434851744355,COMPLETE,,0.0,0
200,0.0,kmeans,11,l2,svd,40,False,True,silhouette,transformer.resblocks.11,ViT-B/32,blocks.11,dinov2_vitb14,layer4,resnet50,semantic,0.0023523533349382206,0.7375090729456041,False,100,8,0.8568733839354933,0.9481285329509976,15,4,0.5115829513577683,2.307331594895163,facebook/sam2-hiera-large,median,0.47824030828204855,5,graph,26,z-score,svd,51,False,False,heuristic,3.0,4.175314626625053,3,True,True,False,False,False,True,True,0.6956499392364662,0.5436043853258413,0.5992339449879968,0.2476066331606554,0.8000572573224388,0.08376372649538419,COMPLETE,,0.0,0
201,0.0,graph,14,z-score,svd,21,True,True,heuristic,transformer.resblocks.11,ViT-B/32,blocks.11,dinov2_vitb14,layer3,resnet50,semantic,0.005442286731923182,0.6426011032188472,False,200,32,0.8756493417183816,0.9193177820224001,26,4,0.9750866550789699,1.6681107641322332,facebook/sam2-hiera-large,mean,0.25402348827891535,3,kmeans,11,z-score,umap,23,True,True,heuristic,5.0,3.026202725995077,3,False,True,False,False,True,True,True,0.643389373263463,0.7387480157034073,0.6839926665555478,0.4670901809040033,0.7362758379329628,0.6064464265464996,COMPLETE,,0.0,0
202,0.0,graph,17,z-score,svd,25,True,True,heuristic,transformer.resblocks.11,ViT-B/32,blocks.11,dinov2_vitb14,layer3,resnet50,semantic,0.005110859955048389,0.637215306974968,False,200,32,0.892039422738653,0.923188112715525,27,4,0.9616749493237223,1.6022512476059663,facebook/sam2-hiera-large,mean,0.25917372111382425,3,kmeans,12,z-score,umap,25,True,True,heuristic,5.0,3.1762900445854565,3,False,True,False,False,True,True,True,0.6365701971754568,0.7485432377563775,0.7118644018424188,0.45072822361806963,0.2753833950169649,0.6743455308507673,COMPLETE,,0.0,0
203,0.0,graph,37,z-score,svd,48,True,True,heuristic,transformer.resblocks.11,ViT-B/32,blocks.11,dinov2_vitb14,layer3,resnet50,semantic,0.004831632899573615,0.6497271894905169,False,200,32,0.8830660845414433,0.9576041177014947,28,4,1.0115423398152688,1.529036313683065,facebook/sam2-hiera-large,mean,0.2730340712871058,3,kmeans,12,z-score,umap,20,True,True,heuristic,5.0,3.0786159053649333,3,False,True,False,False,True,True,True,0.6595010214473477,0.7241727754665748,0.7069210602417751,0.42081964777540415,0.6565616535303743,0.9781405593177557,COMPLETE,,0.0,0
252,0.0,kmeans,37,z-score,svd,19,False,True,heuristic,transformer.resblocks.11,ViT-B/32,blocks.11,dinov2_vitb14,layer1,resnet50,semantic,0.004406064303111991,0.7341467460696096,True,50,8,0.9261082950840231,0.9137077614245629,15,3,0.8441340217724206,1.5046516835980568,facebook/sam2-hiera-large,mean,0.34776710813979705,5,kmeans,38,z-score,umap,18,False,False,silhouette,7.0,1.7559185251418892,3,True,True,False,True,False,True,False,0.766674617026777,0.551950217480949,0.44592063625953365,0.5381019117956573,0.010946344387569116,0.16279411915998449,COMPLETE,,0.0,0
253,0.0,graph,23,z-score,pca,54,True,False,heuristic,transformer.resblocks.10,ViT-B/32,blocks.11,dinov2_vitb14,layer3,resnet50,structural,0.005565284727577694,0.6003857588374986,False,200,32,0.9699303064153452,0.9442453831764421,21,4,0.9049933285616072,2.794143461854231,facebook/sam2-hiera-large,mean,0.16159740809458056,3,graph,34,root-norm,svd,25,True,True,silhouette,3.0,2.1734246293927537,5,False,True,True,False,True,False,False,0.7782940315308619,0.7355407132653247,0.618792529489721,0.17067677275491466,0.7368647762255307,0.9035663210170984,COMPLETE,,0.0,0
