number,value,params_dino_pipeline.clustering.clusterer.method,params_dino_pipeline.clustering.clusterer.n_neighbors,params_dino_pipeline.clustering.feature_processing.normalizer.method,params_dino_pipeline.clustering.feature_processing.reducer.method,params_dino_pipeline.clustering.feature_processing.reducer.n_components,params_dino_pipeline.clustering.feature_processing.run_normalization,params_dino_pipeline.clustering.feature_processing.run_reduction,params_dino_pipeline.clustering.k_selection.method,params_extractors.clip.layer_name,params_extractors.clip.model_name,params_extractors.dino_v2.layer_name,params_extractors.dino_v2.model_name,params_extractors.resnet.layer_name,params_extractors.resnet.model_name,params_fusion_pipeline.clustering.k_selection.k_source,params_heuristic_settings.filter_params.filter_min_area_perc,params_heuristic_settings.filter_params.nms_iou_threshold,params_heuristic_settings.filter_params.use_nms,params_heuristic_settings.generator_params.min_mask_region_area,params_heuristic_settings.generator_params.points_per_side,params_heuristic_settings.generator_params.pred_iou_thresh,params_heuristic_settings.generator_params.stability_score_thresh,params_heuristic_settings.k_heuristic_formulas.max_k,params_heuristic_settings.k_heuristic_formulas.semantic_base,params_heuristic_settings.k_heuristic_formulas.semantic_scale_factor,params_heuristic_settings.k_heuristic_formulas.structural_multiplier,params_heuristic_settings.sam_model,params_labeler.aggregation_method,params_labeler.aggregation_top_k_perc,params_labeler.top_n_labels,params_resnet_pipeline.clustering.clusterer.method,params_resnet_pipeline.clustering.clusterer.n_neighbors,params_resnet_pipeline.clustering.feature_processing.normalizer.method,params_resnet_pipeline.clustering.feature_processing.reducer.method,params_resnet_pipeline.clustering.feature_processing.reducer.n_components,params_resnet_pipeline.clustering.feature_processing.run_normalization,params_resnet_pipeline.clustering.feature_processing.run_reduction,params_resnet_pipeline.clustering.k_selection.method,params_resnet_pipeline.image_preprocessing.blur_kernel_size,params_resnet_pipeline.image_preprocessing.clahe_clip_limit,params_resnet_pipeline.image_preprocessing.sobel_kernel_size,params_resnet_pipeline.image_preprocessing.use_clahe,params_resnet_pipeline.image_preprocessing.use_gaussian_blur,params_resnet_pipeline.image_preprocessing.use_grayscale,params_resnet_pipeline.image_preprocessing.use_sobel_edges,params_run_dino_pipeline,params_run_fusion_pipeline,params_run_resnet_pipeline,params_validator_settings.final_threshold,params_validator_settings.semantic_threshold,params_validator_settings.structural_threshold,params_validator_settings.weights.clip_confidence,params_validator_settings.weights.dino_iou,params_validator_settings.weights.resnet_iou,state,user_attrs_error,user_attrs_max_clip_confidence,user_attrs_num_correct_segments
341,0.0,graph,39,z-score,umap,45,True,True,silhouette,transformer.resblocks.10,ViT-B/32,blocks.4,dinov2_vitb14,layer3,resnet50,structural,0.009638002433855824,0.6007482279987961,False,100,16,0.8804082656109072,0.9490969990030236,23,3,0.9855071943914013,2.345243057520248,facebook/sam2-hiera-large,top_k_mean,0.12912118968002853,3,graph,33,l2,pca,61,False,False,heuristic,3.0,2.076856749909197,3,True,True,False,True,True,False,True,0.6256565037705293,0.6712416965601531,0.41797270461693925,0.41017558276954846,0.7834030177699634,0.7647339900984726,COMPLETE,,0.0,0
342,0.0,graph,34,root-norm,pca,26,False,True,heuristic,transformer.resblocks.11,ViT-B/32,blocks.7,dinov2_vitb14,layer1,resnet50,semantic,0.0022911490588574126,0.6897169856662734,False,200,32,0.8382120833338309,0.9305032448172744,21,4,0.8645501627052169,2.4520914728716305,facebook/sam2-hiera-large,mean,0.2175624595615984,5,kmeans,21,z-score,umap,57,True,True,silhouette,3.0,2.2476509096006283,5,False,True,False,False,False,True,False,0.7407777219808068,0.6934693976667995,0.681670343403428,0.9281461371045812,0.73974627022181,0.2556838232182076,COMPLETE,,0.0,0
343,0.0,kmeans,31,z-score,svd,48,True,False,heuristic,transformer.resblocks.9,ViT-B/32,blocks.11,dinov2_vitb14,layer3,resnet50,structural,0.006924009505004806,0.7253156374866802,True,50,8,0.8537175210058844,0.9268922205968003,26,3,0.8173560966506855,1.9659259671030611,facebook/sam2-hiera-large,median,0.28857369750259354,3,graph,40,z-score,umap,22,False,False,heuristic,5.0,1.358919256960747,3,True,True,True,True,True,False,True,0.5831864116547669,0.6508263848216373,0.7085175301001753,0.8879452681577888,0.8309873671040614,0.8228444193510023,COMPLETE,,0.0,0
344,0.0,graph,29,l2,svd,25,False,True,silhouette,transformer.resblocks.10,ViT-B/32,blocks.4,dinov2_vitb14,layer2,resnet50,semantic,0.00923281708529988,0.8152082215660623,False,100,16,0.9166586084187267,0.914105891956863,22,4,1.1994879400171943,2.6227619459590055,facebook/sam2-hiera-large,mean,0.4733558239947386,3,kmeans,16,z-score,pca,63,True,True,silhouette,3.0,2.1846413966753024,5,False,True,False,False,False,True,False,0.7493201370229997,0.7352079785806704,0.729697652857427,0.06704602479496025,0.620361539070597,0.7890038629874504,COMPLETE,,0.0,0
345,0.0,graph,40,z-score,pca,53,True,False,heuristic,transformer.resblocks.11,ViT-B/32,blocks.11,dinov2_vitb14,layer3,resnet50,semantic,0.004616538044058269,0.7961719579707945,True,200,32,0.9798618687205033,0.9413817501986779,25,2,1.0352687349616598,2.5347218382418615,facebook/sam2-hiera-large,mean,0.24907320915702974,5,graph,39,root-norm,umap,49,False,True,heuristic,,4.730296924584201,3,True,False,True,False,True,False,True,0.7171135480391926,0.7411499095235827,0.44466273521871563,0.5501229405185653,0.954720137430033,0.9311187136811967,COMPLETE,,0.0,0
346,0.0,graph,11,l2,svd,17,True,True,silhouette,transformer.resblocks.11,ViT-B/32,blocks.11,dinov2_vitb14,layer1,resnet50,structural,0.008484655469722253,0.8411447541572047,False,50,8,0.8734692105084406,0.9542388064967787,27,3,0.7143592935100265,2.1895690463830464,facebook/sam2-hiera-large,mean,0.26866891294196515,3,kmeans,26,l2,svd,43,False,False,silhouette,7.0,1.8381549510891475,5,True,True,False,True,True,True,False,0.6438307058352379,0.6636651310836871,0.5733216899296116,0.10183985134065773,0.4626539216003345,0.8824270177038722,COMPLETE,,0.0,0
347,0.0,kmeans,14,z-score,umap,20,False,True,heuristic,transformer.resblocks.10,ViT-B/32,blocks.7,dinov2_vitb14,conv1,resnet50,semantic,0.006116028827680474,0.6570701536017843,False,100,16,0.9679706018957994,0.96297493494002,24,3,0.9413406195987575,2.5774136247627815,facebook/sam2-hiera-large,top_k_mean,0.16462533001798998,5,graph,30,z-score,umap,19,True,True,heuristic,5.0,3.541557449215889,5,False,True,True,False,False,True,True,0.789626131360364,0.5786081735128573,0.48474713966474003,0.04462922584314855,0.36348777674711014,0.12789812864621836,COMPLETE,,0.0,0
332,0.0,graph,35,root-norm,pca,44,False,True,heuristic,transformer.resblocks.9,ViT-B/32,blocks.4,dinov2_vitb14,layer3,resnet50,semantic,0.002670429872168828,0.6400303010633627,False,100,16,0.8024336437083435,0.9330116108963445,23,3,0.5839350710654446,2.2517303555559325,facebook/sam2-hiera-large,median,0.10900854521771558,5,graph,40,z-score,pca,51,False,True,heuristic,,1.7532920032108066,3,True,False,False,False,False,True,True,0.5712633237223441,0.7240657232509549,0.6190017358663624,0.18635488212935772,0.8127015875137035,0.5821115939560154,COMPLETE,,0.0,0
333,0.0,graph,10,z-score,svd,37,True,False,heuristic,transformer.resblocks.11,ViT-B/32,blocks.11,dinov2_vitb14,layer4,resnet50,semantic,0.0012962197173075015,0.625462918657846,True,50,8,0.8066078284749695,0.9070724471079261,29,4,1.1087738585750728,2.6045054787425794,facebook/sam2-hiera-large,mean,0.49834820732769225,3,kmeans,31,z-score,umap,62,True,False,silhouette,5.0,2.926834558443724,5,False,True,True,True,True,False,False,0.5172048168533298,0.6138049983952355,0.7483919095891952,0.6899784382392802,0.03482476867810682,0.41803825711512865,COMPLETE,,0.0,0
334,0.0,kmeans,15,l2,svd,34,False,True,silhouette,transformer.resblocks.11,ViT-B/32,blocks.11,dinov2_vitb14,layer1,resnet50,structural,0.003902608693908989,0.8489394347677925,False,200,32,0.875154992285736,0.9251719514709902,26,2,0.9136280451889532,2.8998771987880687,facebook/sam2-hiera-large,mean,0.4008036452894476,3,graph,35,root-norm,svd,31,False,True,heuristic,3.0,1.5446565027290167,3,True,True,False,False,False,True,True,0.5574628822623183,0.4580112236895788,0.6391411915826295,0.08703377463534628,0.7592663618806287,0.9099917070367638,COMPLETE,,0.0,0
335,0.0,graph,38,z-score,pca,18,True,True,heuristic,transformer.resblocks.10,ViT-B/32,blocks.4,dinov2_vitb14,layer3,resnet50,semantic,0.007272263246583293,0.830505923321029,True,100,16,0.97728591285147,0.970101579453767,22,3,1.128437706885377,1.7387258045399263,facebook/sam2-hiera-large,mean,0.1777624731293131,5,kmeans,13,l2,pca,18,True,False,silhouette,5.0,2.8074906844995375,5,False,True,True,True,True,True,False,0.6844529708568772,0.540995184757821,0.46956210489537714,0.1358291056521083,0.9989401399451194,0.6449596296428627,COMPLETE,,0.0,0
336,0.0,graph,16,z-score,umap,49,True,False,silhouette,transformer.resblocks.11,ViT-B/32,blocks.7,dinov2_vitb14,layer3,resnet50,structural,0.0016763075215611742,0.7653127279569006,False,50,8,0.8239715933558003,0.9195000856482811,16,4,0.8488338815813624,1.8359290676857898,facebook/sam2-hiera-large,top_k_mean,0.3231931910754683,3,graph,19,z-score,umap,40,False,True,heuristic,,2.016678563103134,3,True,False,False,False,True,False,True,0.6702085470460376,0.5509450759222908,0.533994114550704,0.25118577057925506,0.13272685581950946,0.8538734513635073,COMPLETE,,0.0,0
337,0.0,graph,18,root-norm,svd,62,False,True,heuristic,transformer.resblocks.9,ViT-B/32,blocks.11,dinov2_vitb14,layer1,resnet50,semantic,0.007929409327416908,0.7004093716946217,False,200,32,0.8874825423388792,0.9229313927156394,18,3,0.7679599425083773,2.6888001493168305,facebook/sam2-hiera-large,median,0.2963176262928518,5,kmeans,15,z-score,umap,25,False,True,silhouette,3.0,1.1688776868096196,5,True,True,False,False,False,True,False,0.7750759035812103,0.5948487544374466,0.6723039113080391,0.7609044068897404,0.927363135009439,0.5240423223661449,COMPLETE,,0.0,0
338,0.0,kmeans,37,l2,pca,31,True,False,heuristic,transformer.resblocks.10,ViT-B/32,blocks.4,dinov2_vitb14,layer2,resnet50,structural,0.0059176953100375865,0.712140697425336,True,100,16,0.868935200799848,0.9798887791264396,28,3,0.544747088843313,2.8303051082625292,facebook/sam2-hiera-large,mean,0.3681070441145532,3,graph,14,z-score,pca,64,True,False,heuristic,7.0,3.236187485594971,5,False,True,True,True,True,False,True,0.7994941310404935,0.44148237713809196,0.650628530176205,0.024493631134414044,0.67745294523219,0.7111924539407176,COMPLETE,,0.0,0
339,0.0,graph,35,z-score,svd,58,False,True,silhouette,transformer.resblocks.11,ViT-B/32,blocks.11,dinov2_vitb14,conv1,resnet50,semantic,0.003554246819643106,0.7532935989198594,False,200,8,0.8473720711906564,0.9008497352780677,19,4,0.6906833492971816,1.5021162142875246,facebook/sam2-hiera-large,mean,0.2280980201870116,3,kmeans,36,z-score,umap,44,False,True,silhouette,5.0,1.9436940202744504,3,True,True,False,False,False,True,False,0.7283942165241624,0.5168416756563324,0.5410007275845344,0.18268256046413733,0.5779893308949199,0.5031425391720474,COMPLETE,,0.0,0
324,0.0,graph,25,z-score,svd,22,True,True,silhouette,transformer.resblocks.11,ViT-B/32,blocks.11,dinov2_vitb14,conv1,resnet50,structural,0.00980338162698597,0.6694303119302306,False,50,8,0.8525639161549463,0.9439610084872951,29,4,1.1845326861362493,2.1642621767849857,facebook/sam2-hiera-large,mean,0.46089911539549594,3,kmeans,30,z-score,svd,64,True,True,silhouette,7.0,2.3612601048678066,5,False,True,False,False,True,True,False,0.6391520633707861,0.6089413086581108,0.7204753145054631,0.3862951939628074,0.8038964476202229,0.7915051401185121,COMPLETE,,0.0,0
325,0.0,kmeans,19,l2,umap,43,False,True,heuristic,transformer.resblocks.10,ViT-B/32,blocks.7,dinov2_vitb14,layer1,resnet50,semantic,0.007687934110444454,0.8077420046818934,False,100,32,0.8431367360826665,0.9602917407100926,21,3,0.6310180079860187,2.7593080476584757,facebook/sam2-hiera-large,top_k_mean,0.2341600043113881,5,graph,28,l2,umap,52,False,False,heuristic,5.0,4.777551853401957,3,True,True,True,True,False,True,True,0.6122091952391862,0.736408503093944,0.6650355141357782,0.5590790320340867,0.38514627488815245,0.8923513712993967,COMPLETE,,0.0,0
326,0.0,graph,23,root-norm,pca,16,True,False,heuristic,transformer.resblocks.11,ViT-B/32,blocks.4,dinov2_vitb14,layer4,resnet50,structural,0.001994163138114864,0.719783700225356,True,200,16,0.9421361481890331,0.94765856285787,15,3,0.8280323103636656,2.5470253101179785,facebook/sam2-hiera-large,median,0.3545030022478118,3,kmeans,37,z-score,pca,59,True,True,silhouette,3.0,1.2603067115087134,5,False,True,False,False,True,False,False,0.6772429583068723,0.4974716220951297,0.7013251906071641,0.2205121176438654,0.5250335004742147,0.1985758394580754,COMPLETE,,0.0,0
327,0.0,graph,33,z-score,svd,51,False,True,silhouette,transformer.resblocks.9,ViT-B/32,blocks.11,dinov2_vitb14,layer3,resnet50,semantic,0.005528728776074637,0.743258410820697,False,50,8,0.9074804014713475,0.9376774011984674,20,4,1.0279545988367433,2.4109732053337734,facebook/sam2-hiera-large,mean,0.11833043297990538,5,graph,23,z-score,umap,17,False,False,heuristic,,4.596854588139091,3,True,False,False,True,False,True,True,0.7238313648428932,0.5098536667166514,0.43354016315816,0.1539663306819893,0.18298068876318815,0.9398149061573992,COMPLETE,,0.0,0
328,0.0,graph,26,l2,svd,60,True,False,heuristic,transformer.resblocks.11,ViT-B/32,blocks.11,dinov2_vitb14,layer1,resnet50,semantic,0.004383800094734796,0.758948590612573,True,200,32,0.9529293972117049,0.9647116614013366,28,3,0.891544144845595,2.294629205211744,facebook/sam2-hiera-large,mean,0.2653586050119213,3,kmeans,39,z-score,pca,42,False,True,silhouette,5.0,4.096155097668823,5,True,True,True,False,True,False,False,0.7059797837752287,0.714475803922952,0.6908414184689552,0.6234822240291705,0.49459636623630626,0.9844179855794092,COMPLETE,,0.0,0
329,0.0,graph,36,z-score,pca,56,True,True,silhouette,transformer.resblocks.10,ViT-B/32,blocks.4,dinov2_vitb14,layer3,resnet50,structural,0.009458332115671413,0.6934170397632479,False,100,16,0.9580756329788767,0.9778234732112802,17,2,0.5125789103784741,1.5457998273708613,facebook/sam2-hiera-large,mean,0.38631090609311364,3,graph,34,root-norm,umap,45,True,True,heuristic,3.0,3.1031635251471243,5,False,True,False,False,True,True,True,0.7602882975930522,0.6555058268887992,0.6300141169181676,0.8505889205991215,0.6425781484315809,0.0860992692231662,COMPLETE,,0.0,0
330,0.0,kmeans,30,z-score,umap,39,False,True,heuristic,transformer.resblocks.11,ViT-B/32,blocks.11,dinov2_vitb14,layer2,resnet50,semantic,0.0014297223605905685,0.6644797621646839,True,50,8,0.8661498351005964,0.9517914974376414,25,4,1.062436789206038,2.8006865251004527,facebook/sam2-hiera-large,top_k_mean,0.19201278597144558,5,kmeans,22,l2,svd,56,False,False,silhouette,7.0,3.3283797093189267,3,True,True,True,True,False,True,False,0.5357063642631259,0.6346631011173236,0.7356363455872568,0.4324412565721417,0.30004190346259696,0.32689918597620476,COMPLETE,,0.0,0
331,0.0,graph,20,l2,svd,41,True,False,silhouette,transformer.resblocks.10,ViT-B/32,blocks.7,dinov2_vitb14,conv1,resnet50,structural,0.009989171596284718,0.6088740676427273,False,200,32,0.9011134645420712,0.9161822610487323,26,3,0.9529372411018547,2.971357092736744,facebook/sam2-hiera-large,mean,0.1421192924259958,3,graph,32,z-score,umap,35,True,True,silhouette,3.0,3.6252769027257825,5,False,True,False,False,True,False,False,0.5112113522410479,0.7486596621469721,0.6046992669972199,0.001208878162588866,0.5563689171070904,0.9646793015801962,COMPLETE,,0.0,0
380,0.0,graph,36,root-norm,umap,41,True,True,silhouette,transformer.resblocks.11,ViT-B/32,blocks.7,dinov2_vitb14,layer1,resnet50,structural,0.009696001381880783,0.6678664549512554,False,50,8,0.8444338116136101,0.9196683821377748,23,2,0.9457934382801984,2.692342181519348,facebook/sam2-hiera-large,mean,0.30465025460940026,3,kmeans,32,z-score,umap,64,True,True,silhouette,5.0,2.719567733874517,5,False,True,False,False,True,False,False,0.7260396202867592,0.6639825824538744,0.7493517826454823,0.17822670239695285,0.060465931721580504,0.7981722144058992,COMPLETE,,0.0,0
381,0.0,graph,28,l2,svd,47,False,True,heuristic,transformer.resblocks.9,ViT-B/32,blocks.11,dinov2_vitb14,layer3,resnet50,semantic,0.009514079504407046,0.7992766078763134,False,100,16,0.8583500504649836,0.9640387501477077,25,3,0.9029521247206924,2.8145620585545994,facebook/sam2-hiera-large,median,0.36151516162875397,5,graph,34,z-score,pca,56,False,False,heuristic,3.0,3.5925791812073635,3,True,True,True,True,False,True,True,0.5519910255884599,0.5932103202724666,0.706092952477043,0.275595284505776,0.6714923671794881,0.5668734411120891,COMPLETE,,0.0,0
382,0.0,kmeans,18,z-score,pca,61,True,False,heuristic,transformer.resblocks.10,ViT-B/32,blocks.4,dinov2_vitb14,layer2,resnet50,structural,0.007554609123175918,0.6220199426600515,True,200,32,0.9140209543835743,0.9262331994751944,27,4,0.853695531988647,2.879185021051638,facebook/sam2-hiera-large,mean,0.42270621487571264,3,kmeans,21,z-score,umap,18,True,True,silhouette,7.0,2.299887622652034,5,False,True,False,False,True,False,False,0.7500744325914114,0.46688990038700534,0.40535252397664234,0.14074368249715122,0.7031377691141826,0.7242379019112696,COMPLETE,,0.0,0
383,0.0,graph,10,z-score,svd,26,False,True,silhouette,transformer.resblocks.11,ViT-B/32,blocks.11,dinov2_vitb14,conv1,resnet50,semantic,0.0062206047425444845,0.6362443592159013,False,50,8,0.9773582442524746,0.9448900093923909,19,3,1.0801769288368999,2.6199207690006703,facebook/sam2-hiera-large,mean,0.404150847816213,5,graph,26,root-norm,umap,45,False,False,heuristic,3.0,4.670025647268555,5,True,True,False,True,False,True,True,0.6719983071972229,0.5218367177460189,0.599682806406433,0.39118985069212,0.24261820682540955,0.9693955978878167,COMPLETE,,0.0,0
384,0.0,graph,31,l2,umap,46,True,False,heuristic,transformer.resblocks.10,ViT-B/32,blocks.4,dinov2_vitb14,layer4,resnet50,semantic,0.0025514569024775143,0.6476900931038662,True,100,32,0.9425599432033136,0.9083540456647745,28,4,1.0270759182658036,2.437618595057831,facebook/sam2-hiera-large,mean,0.1822183210167509,3,kmeans,31,z-score,svd,62,False,True,silhouette,,4.433481985663981,3,True,False,True,False,True,False,False,0.7155355995511835,0.6078591796802046,0.546584548771773,0.7793074071969383,0.3739823245662275,0.511441691628503,COMPLETE,,0.0,0
385,0.0,graph,21,z-score,svd,38,True,True,silhouette,transformer.resblocks.11,ViT-B/32,blocks.11,dinov2_vitb14,layer3,resnet50,structural,0.0020297834050898313,0.7108406901576703,False,200,16,0.8723137740803799,0.9674060853254159,30,3,0.9813611768341033,2.753130623711764,facebook/sam2-hiera-large,top_k_mean,0.153995395177519,3,graph,34,l2,pca,60,True,True,heuristic,5.0,2.955111481234418,5,False,True,False,False,True,True,True,0.6889438483967518,0.7094001904907791,0.5793601326602683,0.07514851481143642,0.4019504733987238,0.631396817272744,COMPLETE,,0.0,0
386,0.0,kmeans,11,root-norm,pca,31,False,True,heuristic,transformer.resblocks.9,ViT-B/32,blocks.7,dinov2_vitb14,layer1,resnet50,semantic,0.0023399759054764024,0.7175314623821609,True,50,8,0.839184211842411,0.9734007164473808,20,2,0.7096518819076736,2.4714194208548967,facebook/sam2-hiera-large,median,0.3832919309776556,5,kmeans,18,z-score,umap,50,False,False,silhouette,3.0,1.6403389801962085,3,True,True,True,True,False,True,False,0.7623859556580215,0.4458909539775641,0.7385439975096848,0.8089337792031559,0.9048905484966604,0.485191162085919,COMPLETE,,0.0,0
387,0.0,graph,13,l2,svd,63,True,False,heuristic,transformer.resblocks.11,ViT-B/32,blocks.11,dinov2_vitb14,layer3,resnet50,structural,0.0088187279463668,0.7338823258109239,False,200,32,0.8125629228860823,0.9402625306491578,26,3,1.1124973255533845,2.357417980258579,facebook/sam2-hiera-large,mean,0.12297173105283594,3,graph,22,z-score,umap,20,True,True,silhouette,5.0,2.0188949736782287,5,False,True,False,False,True,False,False,0.6385591517090445,0.5399257982170488,0.5041617155257058,0.4761626085544299,0.4439734323609747,0.1900387093552367,COMPLETE,,0.0,0
372,0.0,graph,40,l2,pca,21,True,False,heuristic,transformer.resblocks.10,ViT-B/32,blocks.4,dinov2_vitb14,layer1,resnet50,semantic,0.0010090049610282687,0.6853481240259263,True,100,16,0.9032448596332459,0.9690329957321534,25,3,1.1784379231487678,1.9216807254085682,facebook/sam2-hiera-large,mean,0.2617613448313555,3,graph,23,root-norm,pca,29,False,True,heuristic,3.0,1.106726783913218,3,True,True,True,False,True,False,True,0.5210493719556597,0.6482591913625577,0.527905014542885,0.2248598727367863,0.3142866828912453,0.9240888048258986,COMPLETE,,0.0,0
373,0.0,kmeans,32,z-score,svd,49,False,True,silhouette,transformer.resblocks.11,ViT-B/32,blocks.11,dinov2_vitb14,layer3,resnet50,structural,0.007385295061371786,0.8188190812428288,False,200,32,0.9095013781206718,0.9360956984495119,22,4,0.6010879985872257,2.5333757484402044,facebook/sam2-hiera-large,mean,0.492837650078994,3,kmeans,38,z-score,svd,38,True,False,silhouette,5.0,2.43732809769476,5,False,True,False,True,False,True,False,0.6620389311617181,0.637805038864763,0.6852018625374787,0.948347396347371,0.8537800235712458,0.016619471139006536,COMPLETE,,0.0,0
374,0.0,graph,14,l2,umap,32,True,True,heuristic,transformer.resblocks.11,ViT-B/32,blocks.7,dinov2_vitb14,layer2,resnet50,semantic,0.0036709020014781264,0.6312669770262118,True,50,8,0.8504056977530805,0.9046039799795184,28,3,0.7554042758605781,2.5057575661377522,facebook/sam2-hiera-large,top_k_mean,0.3733672942556387,5,graph,35,l2,umap,25,False,True,heuristic,7.0,4.153609316378849,5,True,True,True,False,True,True,True,0.500367454894695,0.5115668973101161,0.6476982653320024,0.5422438981773463,0.7217633850789585,0.15528992074200662,COMPLETE,,0.0,0
