number,value,params_dino_pipeline.clustering.clusterer.method,params_dino_pipeline.clustering.clusterer.n_neighbors,params_dino_pipeline.clustering.feature_processing.normalizer.method,params_dino_pipeline.clustering.feature_processing.reducer.method,params_dino_pipeline.clustering.feature_processing.reducer.n_components,params_dino_pipeline.clustering.feature_processing.run_normalization,params_dino_pipeline.clustering.feature_processing.run_reduction,params_dino_pipeline.clustering.k_selection.method,params_extractors.clip.layer_name,params_extractors.clip.model_name,params_extractors.dino_v2.layer_name,params_extractors.dino_v2.model_name,params_extractors.resnet.layer_name,params_extractors.resnet.model_name,params_fusion_pipeline.clustering.k_selection.k_source,params_heuristic_settings.filter_params.filter_min_area_perc,params_heuristic_settings.filter_params.nms_iou_threshold,params_heuristic_settings.filter_params.use_nms,params_heuristic_settings.generator_params.min_mask_region_area,params_heuristic_settings.generator_params.points_per_side,params_heuristic_settings.generator_params.pred_iou_thresh,params_heuristic_settings.generator_params.stability_score_thresh,params_heuristic_settings.k_heuristic_formulas.max_k,params_heuristic_settings.k_heuristic_formulas.semantic_base,params_heuristic_settings.k_heuristic_formulas.semantic_scale_factor,params_heuristic_settings.k_heuristic_formulas.structural_multiplier,params_heuristic_settings.sam_model,params_labeler.aggregation_method,params_labeler.aggregation_top_k_perc,params_labeler.top_n_labels,params_resnet_pipeline.clustering.clusterer.method,params_resnet_pipeline.clustering.clusterer.n_neighbors,params_resnet_pipeline.clustering.feature_processing.normalizer.method,params_resnet_pipeline.clustering.feature_processing.reducer.method,params_resnet_pipeline.clustering.feature_processing.reducer.n_components,params_resnet_pipeline.clustering.feature_processing.run_normalization,params_resnet_pipeline.clustering.feature_processing.run_reduction,params_resnet_pipeline.clustering.k_selection.method,params_resnet_pipeline.image_preprocessing.blur_kernel_size,params_resnet_pipeline.image_preprocessing.clahe_clip_limit,params_resnet_pipeline.image_preprocessing.sobel_kernel_size,params_resnet_pipeline.image_preprocessing.use_clahe,params_resnet_pipeline.image_preprocessing.use_gaussian_blur,params_resnet_pipeline.image_preprocessing.use_grayscale,params_resnet_pipeline.image_preprocessing.use_sobel_edges,params_run_dino_pipeline,params_run_fusion_pipeline,params_run_resnet_pipeline,params_validator_settings.final_threshold,params_validator_settings.semantic_threshold,params_validator_settings.structural_threshold,params_validator_settings.weights.clip_confidence,params_validator_settings.weights.dino_iou,params_validator_settings.weights.resnet_iou,state,user_attrs_error,user_attrs_max_clip_confidence,user_attrs_num_correct_segments
798,0.0,graph,36,z-score,pca,30,True,False,heuristic,transformer.resblocks.10,ViT-B/32,blocks.4,dinov2_vitb14,layer1,resnet50,semantic,0.002980625557921614,0.6973167164219641,True,100,16,0.8388393375666667,0.9056970755611052,26,3,1.0538813929977118,2.36524240594972,facebook/sam2-hiera-large,top_k_mean,0.3844964037129094,5,graph,30,z-score,pca,52,False,True,heuristic,,3.951136122548044,3,True,False,True,False,True,False,True,0.6973013213714923,0.5339372923317867,0.5483670173303933,0.5490976466486513,0.8399172446650017,0.872733331924265,COMPLETE,,0.0,0
799,0.0,graph,27,z-score,umap,40,True,True,silhouette,transformer.resblocks.11,ViT-B/32,blocks.7,dinov2_vitb14,layer4,resnet50,structural,0.005274954007005759,0.8138987023031377,False,50,8,0.8070387597198854,0.9746879008484514,25,3,0.9112424006831316,2.7297087454984936,facebook/sam2-hiera-large,mean,0.24190956985550788,3,kmeans,19,l2,umap,42,True,True,silhouette,3.0,1.3717960939403868,5,False,True,False,False,True,True,False,0.7130711138787837,0.6396382957112049,0.49744300353709514,0.6897998712373405,0.4013441769394535,0.9104317474415151,COMPLETE,,0.0,0
800,0.0,kmeans,33,root-norm,svd,38,False,True,heuristic,transformer.resblocks.9,ViT-B/32,blocks.11,dinov2_vitb14,layer3,resnet50,semantic,0.0023641306179953774,0.7792172056548093,False,200,32,0.898861248252797,0.9355188911023095,25,4,0.9968536379689018,2.575161961017796,facebook/sam2-hiera-large,median,0.3958563404938378,5,graph,39,z-score,umap,17,False,False,heuristic,5.0,1.0155940042330371,3,True,True,True,True,False,True,True,0.535736697927088,0.6975094555303262,0.6257806469128202,0.6254897708317826,0.7420637004732509,0.42261092637229014,COMPLETE,,0.0,0
801,0.0,graph,40,l2,pca,19,True,False,heuristic,transformer.resblocks.10,ViT-B/32,blocks.4,dinov2_vitb14,layer3,resnet50,structural,0.0040036098748388845,0.6769532654122241,True,100,16,0.9360076975549836,0.9166131348519124,17,3,0.683632873830813,2.673916381141943,facebook/sam2-hiera-large,mean,0.4858855909314711,3,kmeans,27,z-score,pca,61,True,True,silhouette,7.0,4.683861443756955,5,False,True,False,False,True,False,False,0.7420312792590236,0.6824905624557096,0.5958805958502,0.9730995877072324,0.4985720934514997,0.13351904274711288,COMPLETE,,0.0,0
802,0.0,graph,12,z-score,svd,33,False,True,silhouette,transformer.resblocks.11,ViT-B/32,blocks.11,dinov2_vitb14,layer1,resnet50,semantic,0.0046897821356479425,0.6628559136617101,False,200,8,0.9470774874304827,0.9518700044174973,15,2,0.7734822877163252,1.9896094025465563,facebook/sam2-hiera-large,mean,0.12604224394458807,5,graph,13,root-norm,umap,49,False,False,heuristic,,2.482906976098722,3,True,False,False,True,False,True,True,0.5742592126229936,0.7488739724835035,0.4064172965766909,0.140302154856037,0.3028814719133429,0.792879003951055,COMPLETE,,0.0,0
803,0.0,graph,18,l2,svd,62,True,False,heuristic,transformer.resblocks.11,ViT-B/32,blocks.11,dinov2_vitb14,layer2,resnet50,semantic,0.004993654573668157,0.8060272097831453,True,50,32,0.8724111383317673,0.9282071923479267,30,4,1.0262256532779876,2.9996051001228956,facebook/sam2-hiera-large,mean,0.3132996164834374,3,kmeans,35,z-score,svd,57,False,True,silhouette,3.0,1.7068095273195638,5,True,True,True,False,True,False,False,0.5913119441976593,0.4276136890127633,0.5740369563488896,0.1960842251909772,0.44547362023891124,0.9450601693337368,COMPLETE,,0.0,0
788,0.0,graph,33,l2,umap,24,True,True,heuristic,transformer.resblocks.10,ViT-B/32,blocks.7,dinov2_vitb14,layer2,resnet50,semantic,0.001179632227455612,0.7947305358994299,True,100,32,0.8210767851549465,0.9580506500451473,26,3,1.0169547747683194,2.6102847180412962,facebook/sam2-hiera-large,top_k_mean,0.2824768398754924,5,graph,22,l2,umap,63,True,True,silhouette,3.0,2.6035783373855454,5,False,True,True,False,True,True,False,0.5444310682181909,0.6269403548135607,0.7495351045025512,0.37753682300476166,0.770953937416926,0.7416675741022397,COMPLETE,,0.0,0
789,0.0,graph,20,root-norm,pca,28,True,False,silhouette,transformer.resblocks.11,ViT-B/32,blocks.4,dinov2_vitb14,layer1,resnet50,structural,0.005628404541469625,0.8444385956494975,False,200,16,0.9752087067164263,0.9638157924252982,24,2,1.1507318524493388,1.7249969532753755,facebook/sam2-hiera-large,median,0.499534986301846,3,graph,38,z-score,pca,16,False,False,heuristic,,2.1490349625608447,3,True,False,False,True,True,False,True,0.688314074436451,0.7023642100800312,0.5881697016488368,0.4429243381047425,0.3649128421313331,0.7120024197761586,COMPLETE,,0.0,0
790,0.0,graph,17,z-score,svd,63,False,True,heuristic,transformer.resblocks.9,ViT-B/32,blocks.11,dinov2_vitb14,conv1,resnet50,semantic,0.004441242404613159,0.7280414623432803,False,50,8,0.8840327921817321,0.9028533623567835,21,3,0.5416676250007534,1.5580582193157275,facebook/sam2-hiera-large,mean,0.3652488280165106,5,kmeans,34,z-score,umap,55,True,True,silhouette,5.0,3.1318906963039566,5,False,True,False,False,False,True,False,0.5201908436377856,0.7445510459289144,0.5084194083452753,0.5076462998985105,0.5180848028382192,0.9815870485773472,COMPLETE,,0.0,0
791,0.0,graph,23,l2,svd,48,True,False,heuristic,transformer.resblocks.11,ViT-B/32,blocks.11,dinov2_vitb14,layer3,resnet50,semantic,0.004264784737334239,0.648538591908128,True,200,32,0.8013394742181652,0.9698384840509126,16,4,0.937216014332109,2.839768203555237,facebook/sam2-hiera-large,mean,0.1556548659571115,3,graph,29,root-norm,pca,62,False,True,heuristic,3.0,1.9009100254017626,3,True,True,True,False,True,False,True,0.5620503845236864,0.6897527192288198,0.6967724854008024,0.2338924668811102,0.8615575588554003,0.859513525915,COMPLETE,,0.0,0
792,0.0,kmeans,29,z-score,pca,46,False,True,silhouette,transformer.resblocks.10,ViT-B/32,blocks.4,dinov2_vitb14,layer4,resnet50,structural,0.005998177321737198,0.7696029999805799,False,100,16,0.8528862137316195,0.9372850543883402,19,3,1.1972682563106274,2.7973523754553113,facebook/sam2-hiera-large,mean,0.22550553506991441,3,kmeans,35,z-score,umap,20,True,False,silhouette,5.0,2.384189630807609,5,False,True,False,True,False,True,False,0.6416131874338276,0.5608901521881982,0.6118062384596139,0.4134275494495148,0.5751650413460222,0.9567964444618785,COMPLETE,,0.0,0
793,0.0,graph,31,z-score,umap,17,True,True,heuristic,transformer.resblocks.11,ViT-B/32,blocks.11,dinov2_vitb14,layer3,resnet50,semantic,0.003528294098120792,0.8494699188154733,True,50,8,0.9159357172669649,0.921240522368942,22,3,0.795065423782095,2.4806884642438622,facebook/sam2-hiera-large,top_k_mean,0.14636791769387814,5,graph,31,l2,svd,53,False,True,heuristic,7.0,3.70705720133162,5,True,True,True,False,True,True,True,0.7656216514177183,0.5848984936594896,0.4318303682951615,0.35484780062156945,0.6819737592576299,0.8277327008750265,COMPLETE,,0.0,0
794,0.0,graph,21,l2,svd,54,True,False,silhouette,transformer.resblocks.10,ViT-B/32,blocks.7,dinov2_vitb14,layer1,resnet50,structural,0.009970711286098471,0.7637228609132893,False,200,32,0.8604330183176914,0.9556713948954778,23,4,0.8416599516987183,2.3012647476564387,facebook/sam2-hiera-large,mean,0.2140882269747026,3,kmeans,24,z-score,umap,30,False,False,silhouette,,3.193694588468392,3,True,False,False,True,True,False,False,0.7069705245215782,0.6489359008068427,0.673813985493425,0.03517576995493491,0.8946717305279147,0.5127652096120862,COMPLETE,,0.0,0
795,0.0,graph,14,root-norm,pca,49,False,True,heuristic,transformer.resblocks.9,ViT-B/32,blocks.4,dinov2_vitb14,layer2,resnet50,semantic,0.00948233937793205,0.6527543994684916,False,100,16,0.844686682747541,0.9613188988153033,29,2,0.6367054117526543,2.4122666521159246,facebook/sam2-hiera-large,median,0.2932750339987362,5,graph,21,z-score,pca,34,True,True,heuristic,3.0,3.4138086702278225,5,False,True,False,False,False,True,True,0.7503801662386993,0.5670122885792547,0.7126287723233353,0.6582698175309296,0.6618667128332753,0.26993353776655543,COMPLETE,,0.0,0
780,0.0,graph,27,z-score,pca,25,False,True,silhouette,transformer.resblocks.11,ViT-B/32,blocks.11,dinov2_vitb14,layer1,resnet50,semantic,0.008510031980491817,0.6432601996456301,False,200,32,0.841053721896723,0.9255788281207291,24,3,0.9783395967242018,1.653390197313722,facebook/sam2-hiera-large,mean,0.4262275831521826,3,graph,17,z-score,umap,57,False,True,heuristic,3.0,2.0778474396607978,3,True,True,False,False,False,True,True,0.7554998290175942,0.7251109569807271,0.6898501832558498,0.01922533820731115,0.7376973841636798,0.3101802143154849,COMPLETE,,0.0,0
781,0.0,graph,36,l2,svd,57,True,False,heuristic,transformer.resblocks.11,ViT-B/32,blocks.11,dinov2_vitb14,layer2,resnet50,semantic,0.0032909363672654155,0.7512379175724809,True,50,8,0.9035424650772332,0.9526416694474853,29,4,0.8926311217401754,1.8919847651438468,facebook/sam2-hiera-large,mean,0.41442708503194825,5,kmeans,18,root-norm,svd,22,True,False,silhouette,,3.561907049828838,5,False,False,True,True,True,False,False,0.6999261514226516,0.7360931856789557,0.6389755784502836,0.20240619295279513,0.7878587014389452,0.8081979445566408,COMPLETE,,0.0,0
782,0.0,graph,16,z-score,umap,20,True,True,silhouette,transformer.resblocks.10,ViT-B/32,blocks.4,dinov2_vitb14,conv1,resnet50,structural,0.001820867038109643,0.8239276672971327,False,100,16,0.9709698099666747,0.9664866993521256,25,3,0.8062706230459584,2.4518468506159907,facebook/sam2-hiera-large,top_k_mean,0.19723385003975255,3,graph,37,l2,umap,47,False,True,heuristic,5.0,4.05081780820932,3,True,True,False,False,True,True,True,0.6681105422958549,0.5058197911418154,0.736556916870112,0.1525228579376627,0.9493671502275146,0.9295557478518014,COMPLETE,,0.0,0
783,0.0,kmeans,39,root-norm,pca,39,False,True,heuristic,transformer.resblocks.11,ViT-B/32,blocks.7,dinov2_vitb14,layer3,resnet50,semantic,0.0015085435738290062,0.7442403510467809,False,200,32,0.8770407655973955,0.9101638213575712,28,4,1.1688796351209474,2.533421980095542,facebook/sam2-hiera-large,mean,0.1319080710309892,5,kmeans,40,z-score,pca,45,True,True,silhouette,3.0,1.4708389201594287,5,True,True,True,False,False,True,False,0.6782799376486356,0.41559088256654936,0.46197755907042104,0.5937257353301222,0.4194731572515999,0.04008892412954211,COMPLETE,,0.0,0
784,0.0,graph,40,z-score,svd,51,True,False,heuristic,transformer.resblocks.9,ViT-B/32,blocks.11,dinov2_vitb14,layer4,resnet50,structural,0.0072025162631736295,0.6352562635566231,True,50,8,0.8660885268311029,0.9297454151348535,27,2,0.5247420687556501,2.946229082550615,facebook/sam2-hiera-large,median,0.2637669413109963,3,graph,29,z-score,umap,27,False,False,heuristic,5.0,2.9688278256811667,5,False,True,False,True,True,False,True,0.6115221234416728,0.7181819069590151,0.5404338166272421,0.06998448329705875,0.6391731558624737,0.6378926548922321,COMPLETE,,0.0,0
785,0.0,graph,32,l2,svd,29,False,True,silhouette,transformer.resblocks.11,ViT-B/32,blocks.4,dinov2_vitb14,layer1,resnet50,semantic,0.0068171875133926805,0.706561135941028,False,100,16,0.8493085478278509,0.9470662700061228,30,3,1.0432544785657831,2.3341541311430496,facebook/sam2-hiera-large,mean,0.11357444086020553,5,kmeans,39,z-score,pca,25,False,True,silhouette,,2.0037485053934607,3,True,False,False,False,False,True,False,0.6200609719248485,0.5438585883570798,0.4892906590859978,0.24966826528120278,0.9762722376147073,0.1694093246677195,COMPLETE,,0.0,0
786,0.0,graph,28,z-score,pca,37,True,False,heuristic,transformer.resblocks.10,ViT-B/32,blocks.11,dinov2_vitb14,layer3,resnet50,semantic,0.004836230495103514,0.7375697309848567,True,200,32,0.9798333269351698,0.9196019644923965,20,4,0.6123883619258652,2.5054886183905736,facebook/sam2-hiera-large,mean,0.17906902488983645,3,graph,36,root-norm,umap,64,True,False,heuristic,3.0,4.875528710876187,5,False,True,True,True,True,False,True,0.6517259053680262,0.5918237623431989,0.5637139045593608,0.17748579486011135,0.25324439679762967,0.7682614416612247,COMPLETE,,0.0,0
787,0.0,kmeans,37,z-score,svd,53,False,True,silhouette,transformer.resblocks.11,ViT-B/32,blocks.11,dinov2_vitb14,layer3,resnet50,structural,0.009109523629760637,0.6144816508118359,False,50,8,0.8283533942661213,0.9415605659930714,28,3,1.0704009161285457,2.9074086168050983,facebook/sam2-hiera-large,mean,0.3359854157436947,3,kmeans,33,z-score,svd,59,False,True,silhouette,7.0,2.307094094303782,3,True,True,False,False,False,True,False,0.718561335160468,0.6550277625555014,0.5214894527730726,0.8348549688446718,0.6107278444349283,0.5940132549726547,COMPLETE,,0.0,0
772,0.0,graph,10,l2,umap,18,True,False,silhouette,transformer.resblocks.10,ViT-B/32,blocks.7,dinov2_vitb14,layer1,resnet50,structural,0.004571740381265316,0.600298756429902,False,200,32,0.8898909853061001,0.942878062218703,27,3,0.7093601025132925,2.8074838534972573,facebook/sam2-hiera-large,mean,0.30518309614322664,3,kmeans,38,z-score,umap,32,True,True,silhouette,,1.091015595506469,5,False,False,False,False,True,False,False,0.6826147460842719,0.644994835837973,0.6816746312334796,0.5292291274293603,0.8501954838305219,0.48799052188251085,COMPLETE,,0.0,0
773,0.0,graph,30,root-norm,svd,52,False,True,heuristic,transformer.resblocks.9,ViT-B/32,blocks.4,dinov2_vitb14,layer2,resnet50,semantic,0.00616897279895473,0.7326002207189718,False,100,16,0.8140567366821014,0.940311614660946,30,2,0.6491225941715365,2.280710914068851,facebook/sam2-hiera-large,median,0.4415124115628999,5,graph,39,z-score,pca,37,False,False,heuristic,3.0,4.99706413580142,3,True,True,False,True,False,True,True,0.7382940771701977,0.4787977052608075,0.5988059454240056,0.08483475858536003,0.6743917138454804,0.2364636152643927,COMPLETE,,0.0,0
774,0.0,kmeans,14,z-score,pca,22,True,False,heuristic,transformer.resblocks.11,ViT-B/32,blocks.11,dinov2_vitb14,layer3,resnet50,structural,0.007015634087218814,0.7225210792019603,True,200,8,0.8464478196069454,0.9456322057614591,23,4,0.9087640526395849,2.2146669125500686,facebook/sam2-hiera-large,mean,0.3725992107189947,3,kmeans,28,z-score,umap,43,False,True,silhouette,5.0,3.047016755481717,5,True,True,True,False,True,False,False,0.7071058245438251,0.7288149343508401,0.7079770074667888,0.22433937745883598,0.5527939570704328,0.8397241288526872,COMPLETE,,0.0,0
775,0.0,graph,25,l2,svd,47,False,True,silhouette,transformer.resblocks.11,ViT-B/32,blocks.11,dinov2_vitb14,conv1,resnet50,semantic,0.0027169309014720548,0.7583605573218569,False,50,32,0.8723482436032789,0.9135548696294021,26,3,0.5711072844743666,2.760160106854633,facebook/sam2-hiera-large,mean,0.13939118991959928,3,graph,34,root-norm,svd,52,True,True,heuristic,3.0,4.40179622296435,5,False,True,False,False,False,True,True,0.7847152371210655,0.6742011346939792,0.7228681986171545,0.17095863011781384,0.7576531826124274,0.8968105305712779,COMPLETE,,0.0,0
776,0.0,graph,38,z-score,pca,64,True,False,heuristic,transformer.resblocks.10,ViT-B/32,blocks.4,dinov2_vitb14,layer4,resnet50,semantic,0.009850259444352924,0.7125504058846895,True,100,16,0.9447756327554981,0.9646876636601555,23,3,0.9927761538907387,2.865967730837406,facebook/sam2-hiera-large,mean,0.25102361729262324,5,kmeans,26,z-score,umap,49,False,False,silhouette,3.0,3.2342558572777307,3,True,True,True,True,True,True,False,0.5042128632070284,0.5559125927027893,0.6632487973647297,0.10603545913717805,0.32863124676422495,0.07124729703899471,COMPLETE,,0.0,0
777,0.0,graph,34,z-score,umap,61,True,True,silhouette,transformer.resblocks.11,ViT-B/32,blocks.7,dinov2_vitb14,layer1,resnet50,structural,0.007666352123632568,0.6879210490887787,False,200,32,0.9216743055537965,0.9777663360996394,28,4,0.6684128125341215,2.6496840035118474,facebook/sam2-hiera-large,top_k_mean,0.1635823792148972,3,graph,11,l2,pca,61,True,True,silhouette,,1.2448286286327694,5,False,False,False,False,True,False,True,0.726028193414583,0.6127082307664174,0.4741482513744235,0.5652138763356206,0.46619489688403126,0.5491513280097157,COMPLETE,,0.0,0
778,0.0,graph,17,root-norm,svd,37,False,True,heuristic,transformer.resblocks.9,ViT-B/32,blocks.11,dinov2_vitb14,layer3,resnet50,semantic,0.006385886711446294,0.7743408735092767,False,50,8,0.9675198641419246,0.9080151278826359,21,3,0.7336543866676812,1.7770726443152165,facebook/sam2-hiera-large,mean,0.10011403029554106,5,graph,10,z-score,umap,60,False,False,heuristic,5.0,1.8098027878170773,3,True,True,False,True,False,True,False,0.791618140942483,0.5154646738819885,0.5571048437451144,0.12768361605106998,0.9227451813924288,0.38850873157472005,COMPLETE,,0.0,0
779,0.0,kmeans,35,l2,svd,45,True,False,heuristic,transformer.resblocks.10,ViT-B/32,blocks.4,dinov2_vitb14,layer3,resnet50,structural,0.003852052905535714,0.6664412132827957,True,100,16,0.8336569318775106,0.922879604447672,22,2,1.089025539329994,2.563180589968632,facebook/sam2-hiera-large,median,0.47775382299104663,3,kmeans,32,z-score,pca,19,True,True,silhouette,7.0,2.829604203186172,5,False,True,True,False,True,False,False,0.5843490622400647,0.5776797119241437,0.5804028282666195,0.3170796818914453,0.8207980772784064,0.6809111018236743,COMPLETE,,0.0,0
828,0.0,graph,34,z-score,svd,46,True,False,silhouette,transformer.resblocks.11,ViT-B/32,blocks.11,dinov2_vitb14,layer4,resnet50,structural,0.00452652048610693,0.6921232202980206,False,200,32,0.8678407350449034,0.9446530616430545,28,4,0.5239542685255066,2.426596085765786,facebook/sam2-hiera-large,median,0.13258143891156562,3,kmeans,25,z-score,umap,63,True,True,silhouette,,4.322890374560779,5,False,False,False,False,True,False,False,0.6836190148181172,0.6614983977816945,0.49263955208292687,0.19969985522659534,0.28508866293984325,0.7309400864786318,COMPLETE,,0.0,0
829,0.0,graph,29,l2,pca,21,False,True,heuristic,transformer.resblocks.10,ViT-B/32,blocks.4,dinov2_vitb14,layer1,resnet50,semantic,0.0027071900873082044,0.6090423339388857,False,100,16,0.8617371755864934,0.904798540428205,25,3,0.744991462262275,2.7808311742309306,facebook/sam2-hiera-large,mean,0.43359727052944297,5,graph,40,root-norm,pca,16,False,False,heuristic,7.0,4.46109650662063,3,True,True,False,True,False,True,True,0.7995352536467417,0.5203723620177986,0.7144656419780312,0.5572120919869439,0.680048915134593,0.48704643533536585,COMPLETE,,0.0,0
830,0.0,graph,17,z-score,svd,19,True,False,heuristic,transformer.resblocks.11,ViT-B/32,blocks.11,dinov2_vitb14,layer3,resnet50,structural,0.007329259669705591,0.7667445474372,True,200,8,0.8266171402520458,0.91129577471873,17,2,0.7044816061043654,1.5779395341046711,facebook/sam2-hiera-large,mean,0.10841770153184022,3,kmeans,29,z-score,svd,62,False,True,silhouette,3.0,2.5716391879861686,5,True,True,True,False,True,False,False,0.5155597323703832,0.6234473842310204,0.6454691135648392,0.41398538247540123,0.7249268555106438,0.6017731242668738,COMPLETE,,0.0,0
831,0.0,kmeans,39,l2,umap,63,False,True,silhouette,transformer.resblocks.11,ViT-B/32,blocks.7,dinov2_vitb14,layer3,resnet50,semantic,0.0049155714248390525,0.7278816376389555,False,50,32,0.8445228469048706,0.9236881688211454,24,4,1.1583745041497564,1.6335633192005499,facebook/sam2-hiera-large,top_k_mean,0.3613626623421726,3,graph,22,l2,umap,64,True,True,heuristic,5.0,4.914213365705824,5,False,True,False,False,False,True,True,0.6404808999128282,0.5648105197579081,0.6674518809400106,0.7098937659950244,0.768584756872974,0.187157588198121,COMPLETE,,0.0,0
