number,value,params_dino_pipeline.clustering.clusterer.method,params_dino_pipeline.clustering.clusterer.n_neighbors,params_dino_pipeline.clustering.feature_processing.normalizer.method,params_dino_pipeline.clustering.feature_processing.reducer.method,params_dino_pipeline.clustering.feature_processing.reducer.n_components,params_dino_pipeline.clustering.feature_processing.run_normalization,params_dino_pipeline.clustering.feature_processing.run_reduction,params_dino_pipeline.clustering.k_selection.method,params_extractors.clip.layer_name,params_extractors.clip.model_name,params_extractors.dino_v2.layer_name,params_extractors.dino_v2.model_name,params_extractors.resnet.layer_name,params_extractors.resnet.model_name,params_fusion_pipeline.clustering.k_selection.k_source,params_heuristic_settings.filter_params.filter_min_area_perc,params_heuristic_settings.filter_params.nms_iou_threshold,params_heuristic_settings.filter_params.use_nms,params_heuristic_settings.generator_params.min_mask_region_area,params_heuristic_settings.generator_params.points_per_side,params_heuristic_settings.generator_params.pred_iou_thresh,params_heuristic_settings.generator_params.stability_score_thresh,params_heuristic_settings.k_heuristic_formulas.max_k,params_heuristic_settings.k_heuristic_formulas.semantic_base,params_heuristic_settings.k_heuristic_formulas.semantic_scale_factor,params_heuristic_settings.k_heuristic_formulas.structural_multiplier,params_heuristic_settings.sam_model,params_labeler.aggregation_method,params_labeler.aggregation_top_k_perc,params_labeler.top_n_labels,params_resnet_pipeline.clustering.clusterer.method,params_resnet_pipeline.clustering.clusterer.n_neighbors,params_resnet_pipeline.clustering.feature_processing.normalizer.method,params_resnet_pipeline.clustering.feature_processing.reducer.method,params_resnet_pipeline.clustering.feature_processing.reducer.n_components,params_resnet_pipeline.clustering.feature_processing.run_normalization,params_resnet_pipeline.clustering.feature_processing.run_reduction,params_resnet_pipeline.clustering.k_selection.method,params_resnet_pipeline.image_preprocessing.blur_kernel_size,params_resnet_pipeline.image_preprocessing.clahe_clip_limit,params_resnet_pipeline.image_preprocessing.sobel_kernel_size,params_resnet_pipeline.image_preprocessing.use_clahe,params_resnet_pipeline.image_preprocessing.use_gaussian_blur,params_resnet_pipeline.image_preprocessing.use_grayscale,params_resnet_pipeline.image_preprocessing.use_sobel_edges,params_run_dino_pipeline,params_run_fusion_pipeline,params_run_resnet_pipeline,params_validator_settings.final_threshold,params_validator_settings.semantic_threshold,params_validator_settings.structural_threshold,params_validator_settings.weights.clip_confidence,params_validator_settings.weights.dino_iou,params_validator_settings.weights.resnet_iou,state,user_attrs_error,user_attrs_max_clip_confidence,user_attrs_num_correct_segments
529,0.0,graph,14,z-score,svd,31,False,True,silhouette,transformer.resblocks.11,ViT-B/32,blocks.11,dinov2_vitb14,layer2,resnet50,semantic,0.004700733861841622,0.7314250009392927,False,50,8,0.8511599993191097,0.9693120990691996,25,4,0.6978041021850349,2.3954988429456305,facebook/sam2-hiera-large,mean,0.4843940741050182,3,graph,19,z-score,umap,34,False,True,heuristic,3.0,4.383620431669463,3,True,True,False,False,False,True,True,0.6496480549481409,0.65789667293768,0.4883075751491337,0.5901429228867263,0.6469527300091418,0.19873261204478238,COMPLETE,,0.0,0
530,0.0,graph,33,l2,svd,51,True,False,heuristic,transformer.resblocks.11,ViT-B/32,blocks.4,dinov2_vitb14,layer3,resnet50,semantic,0.005686968361711624,0.6415383456098447,True,200,32,0.800021699905199,0.9441249851667028,28,3,0.5406752866840207,2.2957389326535584,facebook/sam2-hiera-large,mean,0.15216589791002139,5,kmeans,28,root-norm,pca,57,True,False,silhouette,5.0,4.704899095758836,5,False,True,True,True,True,True,False,0.5607046922096852,0.7011973510776047,0.7248123551695907,0.13685474784154322,0.44669382044439854,0.6385548461449047,COMPLETE,,0.0,0
531,0.0,graph,38,z-score,pca,64,True,True,silhouette,transformer.resblocks.10,ViT-B/32,blocks.11,dinov2_vitb14,layer1,resnet50,structural,0.006700166297764999,0.719106644682405,False,100,16,0.8612092799133969,0.960965978566908,23,4,1.1879498143295464,2.5197541984963703,facebook/sam2-hiera-large,mean,0.35985701339476805,3,graph,40,z-score,svd,63,False,True,heuristic,,1.5811503816496522,3,True,False,False,False,True,False,True,0.7600817036703152,0.5165271323116968,0.6332549115990475,0.23526432288290564,0.37631549034167205,0.037378446938761786,COMPLETE,,0.0,0
516,0.0,graph,13,z-score,pca,48,True,False,heuristic,transformer.resblocks.11,ViT-B/32,blocks.7,dinov2_vitb14,conv1,resnet50,structural,0.006110778450675298,0.6885463840191293,True,200,32,0.8780074638833164,0.954751147080567,20,3,0.9971141865313474,2.2537897181566207,facebook/sam2-hiera-large,mean,0.16992147648531183,3,kmeans,30,z-score,pca,47,False,True,silhouette,3.0,3.6181601213155643,3,True,True,False,False,True,False,False,0.7999074775228068,0.7345079143322139,0.6650819031915296,0.4727775340071947,0.9152071502805331,0.9183583326958874,COMPLETE,,0.0,0
517,0.0,graph,23,root-norm,svd,52,False,True,silhouette,transformer.resblocks.9,ViT-B/32,blocks.11,dinov2_vitb14,layer3,resnet50,semantic,0.0054399960552744975,0.6468183967076887,False,50,8,0.9649076983765812,0.9331307330048062,25,4,1.060627174374002,2.0936872719044715,facebook/sam2-hiera-large,median,0.3802301870242356,5,graph,40,z-score,umap,61,True,False,silhouette,3.0,2.010521637405571,5,False,True,False,True,False,True,False,0.7667507012819785,0.5703241259039162,0.6560602030245504,0.335894935627373,0.296417152670173,0.176558487175699,COMPLETE,,0.0,0
518,0.0,graph,37,l2,svd,37,True,False,heuristic,transformer.resblocks.10,ViT-B/32,blocks.4,dinov2_vitb14,layer4,resnet50,semantic,0.008619365368536365,0.6614186115843549,True,100,16,0.8680869045939728,0.91982707085193,15,3,0.6397306772914567,1.8267965844407588,facebook/sam2-hiera-large,mean,0.41520553609799327,3,graph,33,z-score,pca,22,False,True,heuristic,,3.820131754762863,3,True,False,True,False,True,False,True,0.7248917181840283,0.7175066827594333,0.569893030011766,0.5218357054629499,0.8606721324712707,0.614694762719972,COMPLETE,,0.0,0
519,0.0,graph,18,z-score,pca,44,True,True,silhouette,transformer.resblocks.11,ViT-B/32,blocks.11,dinov2_vitb14,layer1,resnet50,structural,0.0012595711384520236,0.815096994417816,False,200,32,0.8861446262149592,0.9638909649389854,19,4,0.9351774662727043,2.9392389738228193,facebook/sam2-hiera-large,mean,0.43016611763558277,3,kmeans,38,root-norm,umap,60,True,False,silhouette,5.0,4.03352989835991,5,False,True,False,True,True,True,False,0.709324385323369,0.555418823038037,0.4631931386691929,0.2758644084071817,0.7895787674907564,0.23046183617243657,COMPLETE,,0.0,0
520,0.0,kmeans,10,l2,svd,35,False,True,heuristic,transformer.resblocks.11,ViT-B/32,blocks.11,dinov2_vitb14,layer3,resnet50,semantic,0.008216045442342862,0.7906256344039964,True,50,8,0.8745083910614246,0.949471175853433,18,2,0.5846600959984231,2.016787415474883,facebook/sam2-hiera-large,mean,0.3414305450775857,5,graph,29,z-score,svd,62,False,True,heuristic,7.0,3.1050545708059425,3,True,True,True,False,False,True,True,0.7763628111028478,0.6305682407674672,0.5004458604159612,0.03296906893844187,0.732714889204455,0.836765323316211,COMPLETE,,0.0,0
521,0.0,graph,40,z-score,umap,49,True,False,silhouette,transformer.resblocks.10,ViT-B/32,blocks.4,dinov2_vitb14,layer1,resnet50,structural,0.0021222094472332594,0.7063859636861602,False,100,16,0.938965325210259,0.9361756400358868,22,3,0.8885593189199532,2.3299116736663072,facebook/sam2-hiera-large,top_k_mean,0.25340289862244475,3,kmeans,15,l2,umap,19,True,True,silhouette,3.0,3.5180811778013856,5,False,True,False,False,True,False,False,0.5695339749865012,0.4475687081291083,0.6746737769030346,0.684460985017872,0.5602176787838711,0.4101243108572562,COMPLETE,,0.0,0
522,0.0,graph,25,root-norm,pca,27,False,True,heuristic,transformer.resblocks.11,ViT-B/32,blocks.7,dinov2_vitb14,layer3,resnet50,semantic,0.007999610683875304,0.769870054927465,False,200,32,0.8936009116406383,0.9220882779676356,30,3,0.5612119134116935,2.835655132362618,facebook/sam2-hiera-large,mean,0.18276170511083295,5,graph,24,z-score,pca,64,False,False,heuristic,,1.2603200395123588,3,True,False,False,True,False,True,True,0.6853828210360179,0.5459205263994446,0.7096160008078803,0.38472517495631,0.590891760646259,0.751231172209083,COMPLETE,,0.0,0
523,0.0,graph,36,z-score,svd,59,True,False,heuristic,transformer.resblocks.9,ViT-B/32,blocks.11,dinov2_vitb14,layer2,resnet50,semantic,0.0039930821392535586,0.8453187305482532,True,50,8,0.8648247825629325,0.9521121554820171,29,4,1.148202981220153,1.5775005437737981,facebook/sam2-hiera-large,median,0.16420015622742726,3,kmeans,36,z-score,umap,24,False,True,silhouette,5.0,2.8295961697790233,5,True,True,True,False,True,False,False,0.5155472095024929,0.6397005575862891,0.6828843459649451,0.6259404088531434,0.3938857111734943,0.14785233506394402,COMPLETE,,0.0,0
572,0.0,kmeans,18,z-score,pca,56,True,False,heuristic,transformer.resblocks.9,ViT-B/32,blocks.11,dinov2_vitb14,layer3,resnet50,structural,0.004429382533110544,0.6008179211601897,True,200,8,0.8921391873082738,0.9566295955172336,16,2,1.0376275100846448,1.6166509051563502,facebook/sam2-hiera-large,median,0.2549536157358524,3,kmeans,38,z-score,umap,46,False,True,silhouette,5.0,3.5107583734987475,3,True,True,True,False,True,False,False,0.5654526570175514,0.7383461988100523,0.6497870718616354,0.339506022227304,0.8514372716127123,0.9854984595639813,COMPLETE,,0.0,0
573,0.0,graph,39,z-score,svd,30,False,True,silhouette,transformer.resblocks.11,ViT-B/32,blocks.11,dinov2_vitb14,layer1,resnet50,semantic,0.0015589238016482244,0.7276301984211269,False,50,32,0.8731115604303094,0.931030080225783,24,3,1.0050938702660013,1.8435064966520578,facebook/sam2-hiera-large,mean,0.3566901539508764,5,graph,34,z-score,umap,52,True,False,silhouette,3.0,4.0999315266632435,5,False,True,False,True,False,True,False,0.584597354223888,0.6320427899764072,0.7136939210522899,0.5772665271382174,0.7276971913363127,0.919027818065159,COMPLETE,,0.0,0
574,0.0,graph,14,l2,pca,43,True,False,heuristic,transformer.resblocks.10,ViT-B/32,blocks.4,dinov2_vitb14,layer2,resnet50,semantic,0.005102165964015426,0.7169155247405394,True,100,16,0.8258600331773202,0.9615851760340756,20,4,0.8445152571588588,1.8980731758506462,facebook/sam2-hiera-large,mean,0.34441629568032783,3,graph,40,l2,pca,51,False,True,heuristic,,2.940553707872791,3,True,False,True,False,True,False,True,0.6521707313440424,0.5675034456902901,0.7037878833269476,0.03228340559926398,0.9409526932766048,0.09555750137605917,COMPLETE,,0.0,0
575,0.0,graph,31,z-score,svd,36,True,True,silhouette,transformer.resblocks.11,ViT-B/32,blocks.11,dinov2_vitb14,layer3,resnet50,structural,0.006818322718702368,0.7735526685919917,False,200,32,0.8457115927372709,0.915633082977786,26,3,0.5985728794061193,1.5291399746703245,facebook/sam2-hiera-large,top_k_mean,0.43683242872274824,3,kmeans,31,root-norm,svd,37,True,False,silhouette,5.0,2.2963527315120045,5,False,True,False,True,True,True,False,0.735171757334327,0.6450470528425494,0.7409549543891644,0.05858403313934896,0.8780634985191118,0.8304731706209957,COMPLETE,,0.0,0
576,0.0,kmeans,37,l2,umap,58,False,True,heuristic,transformer.resblocks.11,ViT-B/32,blocks.7,dinov2_vitb14,conv1,resnet50,semantic,0.008344434946203728,0.7323155242572302,False,50,8,0.9097889930132863,0.9427838425891993,21,4,0.8006472166023082,2.569525327558495,facebook/sam2-hiera-large,mean,0.4622050267475124,5,graph,11,z-score,umap,53,False,True,heuristic,3.0,1.2808961736234679,3,True,True,True,False,False,True,True,0.5151218727724381,0.5787675221758429,0.631097580838027,0.37378256423551653,0.705779285727237,0.6490867497726898,COMPLETE,,0.0,0
577,0.0,graph,37,root-norm,svd,37,True,False,heuristic,transformer.resblocks.9,ViT-B/32,blocks.4,dinov2_vitb14,layer4,resnet50,structural,0.007206107189783388,0.8186098676639699,True,100,16,0.8643216843111374,0.9405603197132251,15,3,1.1415535260026943,1.9723850383120047,facebook/sam2-hiera-large,median,0.1325557131039859,3,kmeans,39,z-score,pca,47,True,True,silhouette,7.0,1.8147522135058145,5,False,True,False,False,True,False,False,0.6836636167042824,0.5935604927934768,0.6846151013594314,0.9529361836258076,0.7956325852035748,0.8875380885650813,COMPLETE,,0.0,0
578,0.0,graph,11,z-score,pca,61,False,True,silhouette,transformer.resblocks.10,ViT-B/32,blocks.11,dinov2_vitb14,layer3,resnet50,semantic,0.005744841827349557,0.7032564319614215,False,200,32,0.9738868043385406,0.9235731045518704,29,3,0.9361047582899692,2.757970456182421,facebook/sam2-hiera-large,mean,0.4883124447695966,5,graph,37,z-score,umap,55,False,False,heuristic,,3.2281204472158223,3,True,False,False,True,False,True,True,0.7081546777342963,0.6706257287405355,0.6152158803926869,0.5593833898528636,0.4016758514723244,0.7118201541906826,COMPLETE,,0.0,0
579,0.0,graph,40,z-score,svd,62,True,False,heuristic,transformer.resblocks.11,ViT-B/32,blocks.11,dinov2_vitb14,layer1,resnet50,semantic,0.001374808498127877,0.7596505651761036,True,50,8,0.8832324842009238,0.9213297913994088,26,3,0.5410720284836207,2.7096593257080404,facebook/sam2-hiera-large,mean,0.4158831925796234,3,kmeans,10,root-norm,umap,35,False,True,silhouette,5.0,1.7142778516619168,5,True,True,True,False,True,False,False,0.7037762948538876,0.7168046735170843,0.5740824459125843,0.14130792248461888,0.6073323418079825,0.24065650795840088,COMPLETE,,0.0,0
564,0.0,graph,34,l2,umap,42,True,True,heuristic,transformer.resblocks.10,ViT-B/32,blocks.4,dinov2_vitb14,layer3,resnet50,semantic,0.006481699883805107,0.7674200579280043,True,200,32,0.9340636961843899,0.96002585766368,29,3,1.159183262580358,2.784020246505009,facebook/sam2-hiera-large,top_k_mean,0.23792183119533683,5,graph,19,l2,umap,30,True,True,silhouette,5.0,2.860543837199192,5,False,True,True,False,True,True,False,0.7562112566864803,0.724093382255368,0.5838975550940848,0.16243738397879084,0.4979933625069774,0.969403463503666,COMPLETE,,0.0,0
565,0.0,graph,17,z-score,svd,27,True,False,silhouette,transformer.resblocks.11,ViT-B/32,blocks.7,dinov2_vitb14,layer1,resnet50,structural,0.007494928537147132,0.7365758369445535,False,100,16,0.8412693937508112,0.9517495646727467,24,4,0.9790204974105126,1.7799409001246116,facebook/sam2-hiera-large,mean,0.49956801662842126,3,graph,23,z-score,pca,57,False,False,heuristic,,1.91485618385321,3,True,False,False,True,True,False,True,0.6756323297596981,0.6407303454130009,0.5396922227080208,0.01662085972040957,0.6345253007260068,0.5403779316100688,COMPLETE,,0.0,0
566,0.0,graph,11,root-norm,pca,46,False,True,heuristic,transformer.resblocks.9,ViT-B/32,blocks.11,dinov2_vitb14,layer3,resnet50,semantic,0.0038939444159144803,0.6642870406830447,False,50,8,0.8321973930746278,0.963570431539419,28,3,0.5006738644782895,1.9306201037903539,facebook/sam2-hiera-large,median,0.10066491066701708,5,kmeans,33,z-score,umap,61,True,True,silhouette,3.0,4.597853606063862,5,False,True,False,False,False,True,False,0.74696505247392,0.6153274182482352,0.6084091480998648,0.4488218799334732,0.04569844039889692,0.11939998428921972,COMPLETE,,0.0,0
567,0.0,kmeans,33,l2,svd,19,True,False,heuristic,transformer.resblocks.11,ViT-B/32,blocks.11,dinov2_vitb14,layer2,resnet50,structural,0.0011617992054615113,0.6379913080864301,True,200,32,0.8509911663288349,0.9354491922481134,30,2,0.9570009785490944,2.4324462515739556,facebook/sam2-hiera-large,mean,0.12117268817544395,3,graph,40,z-score,umap,64,False,False,heuristic,5.0,3.996113368453847,3,True,True,True,True,True,False,True,0.6962267886254507,0.5228765565161385,0.6388477548258533,0.6324745092034498,0.749261843894382,0.7886825306862354,COMPLETE,,0.0,0
568,0.0,graph,35,z-score,pca,34,False,True,silhouette,transformer.resblocks.10,ViT-B/32,blocks.4,dinov2_vitb14,conv1,resnet50,semantic,0.0055202095160579055,0.8026829490393019,False,100,16,0.945516433600965,0.9093283386979836,22,3,0.7111349576094974,2.629988300631936,facebook/sam2-hiera-large,mean,0.18069220978573175,3,kmeans,39,root-norm,pca,16,True,True,silhouette,3.0,2.525736666039712,5,False,True,False,False,False,True,False,0.6407657163968079,0.6952142004219245,0.46642028473105407,0.07829093445796749,0.33715970757735125,0.9554991587661319,COMPLETE,,0.0,0
569,0.0,graph,29,z-score,svd,44,True,False,heuristic,transformer.resblocks.11,ViT-B/32,blocks.11,dinov2_vitb14,layer4,resnet50,semantic,0.002249239021182307,0.8279972370708424,True,200,8,0.9633940046332315,0.9486479722771112,17,4,0.7860824655086782,2.5874859341784786,facebook/sam2-hiera-large,mean,0.21733860767123828,5,graph,17,z-score,svd,28,False,True,heuristic,,3.331502727660018,3,True,False,True,False,True,True,True,0.788331227441299,0.5380339362752234,0.4082746493522811,0.4065935882083943,0.8204586122824511,0.5102843281289068,COMPLETE,,0.0,0
570,0.0,graph,36,l2,umap,53,True,True,silhouette,transformer.resblocks.11,ViT-B/32,blocks.7,dinov2_vitb14,layer3,resnet50,structural,0.0036080052312120253,0.7884013843369881,False,50,32,0.8628078905410588,0.9047146653420737,19,4,1.1800757998182527,2.189900081383997,facebook/sam2-hiera-large,top_k_mean,0.16572310989295802,3,kmeans,24,l2,umap,56,False,False,silhouette,7.0,3.0794207153066533,5,True,True,False,True,True,False,False,0.7210740373605043,0.5307409578605061,0.5112479559123003,0.5418165707938726,0.577022232899776,0.6065432366900446,COMPLETE,,0.0,0
571,0.0,graph,32,root-norm,svd,40,False,True,heuristic,transformer.resblocks.10,ViT-B/32,blocks.4,dinov2_vitb14,layer1,resnet50,semantic,0.0076736526919056625,0.6539697499053461,False,100,16,0.9697510300481479,0.928962609078731,23,3,1.0578471963909524,2.3681048280762718,facebook/sam2-hiera-large,mean,0.15309616688358543,5,graph,28,z-score,pca,18,True,True,heuristic,3.0,2.3775289518689213,5,False,True,False,False,False,True,True,0.5056023034523015,0.6639523015766322,0.7496613884827179,0.18954070654637223,0.5271950360790374,0.1821195496771479,COMPLETE,,0.0,0
556,0.0,graph,19,z-score,pca,32,False,True,silhouette,transformer.resblocks.10,ViT-B/32,blocks.4,dinov2_vitb14,layer3,resnet50,semantic,0.00487504840367284,0.8406905443583247,False,200,32,0.8597603801563605,0.9708298295006283,26,4,0.5291410268392799,1.5524552535712122,facebook/sam2-hiera-large,mean,0.4087990697971109,5,graph,34,z-score,pca,39,False,True,heuristic,,3.171622363605576,3,True,False,False,False,False,True,True,0.70030675606166,0.6233563974692099,0.6891656306600709,0.11093796017827023,0.8365015268724799,0.5857737949567802,COMPLETE,,0.0,0
557,0.0,graph,10,z-score,svd,38,True,False,heuristic,transformer.resblocks.11,ViT-B/32,blocks.11,dinov2_vitb14,layer1,resnet50,semantic,0.00408574192467247,0.695541559768275,True,50,8,0.9577786665687251,0.9458302158704239,22,2,0.5536669862943701,2.2752039836080002,facebook/sam2-hiera-large,mean,0.13116041615529342,3,kmeans,35,root-norm,umap,26,True,False,silhouette,5.0,3.876130161804315,5,False,True,True,True,True,False,False,0.76391302457537,0.5564742857085533,0.7206145885108758,0.17640952613949007,0.7631438058644081,0.3805101251664948,COMPLETE,,0.0,0
558,0.0,graph,40,l2,svd,60,False,True,silhouette,transformer.resblocks.10,ViT-B/32,blocks.4,dinov2_vitb14,layer3,resnet50,structural,0.007923378413317408,0.7515111352036932,False,100,32,0.9792729306947721,0.9122992918056605,28,4,0.8354735771496111,2.4839991673902433,facebook/sam2-hiera-large,mean,0.10572666356514981,3,graph,32,z-score,svd,38,False,True,heuristic,3.0,1.7912709011777164,3,True,True,False,False,True,True,True,0.7394088323719578,0.7431891843873571,0.4759566819484792,0.3909465359317651,0.9659920709708831,0.8422684306053295,COMPLETE,,0.0,0
559,0.0,kmeans,21,z-score,pca,51,True,True,heuristic,transformer.resblocks.11,ViT-B/32,blocks.11,dinov2_vitb14,layer2,resnet50,semantic,0.002850753957852218,0.6453153445106465,True,200,16,0.8220589672793867,0.9673927891456444,26,3,1.0661321491648077,2.153900579021646,facebook/sam2-hiera-large,top_k_mean,0.2098948675450512,5,kmeans,29,l2,pca,54,True,False,silhouette,3.0,4.892140098666883,5,False,True,True,True,False,True,False,0.664217876912663,0.5998374568551813,0.5938177260948918,0.4861631113308755,0.6850017949549493,0.6298570982482089,COMPLETE,,0.0,0
560,0.0,graph,36,root-norm,umap,63,True,False,silhouette,transformer.resblocks.9,ViT-B/32,blocks.7,dinov2_vitb14,conv1,resnet50,structural,0.0018180938201392393,0.7442587204374153,False,50,8,0.9520218673674812,0.9182049878683691,25,3,0.8852672247765504,2.8216956395980084,facebook/sam2-hiera-large,mean,0.14419985155169546,3,graph,37,z-score,umap,23,False,True,heuristic,5.0,2.0353874924481143,5,True,True,False,False,True,False,True,0.6889959086332335,0.5101917160722887,0.7292189092634483,0.21150664888348986,0.4594365462723576,0.93400435374055,COMPLETE,,0.0,0
561,0.0,graph,28,l2,svd,23,False,True,heuristic,transformer.resblocks.11,ViT-B/32,blocks.11,dinov2_vitb14,layer1,resnet50,semantic,0.004689597833935356,0.6137979748790996,False,200,32,0.8038969902562754,0.9255924492938636,21,3,1.0218961111858187,2.3148191090382113,facebook/sam2-hiera-large,median,0.288675304138565,5,kmeans,36,z-score,umap,49,False,True,silhouette,,1.3955896951405877,3,True,False,False,False,False,True,False,0.6164609160761346,0.706805902383373,0.4841651054830284,0.2531951559332818,0.7835718676356423,0.1659210647629499,COMPLETE,,0.0,0
562,0.0,graph,26,z-score,pca,39,True,False,heuristic,transformer.resblocks.10,ViT-B/32,blocks.4,dinov2_vitb14,layer3,resnet50,semantic,0.009744530928054362,0.6722391629555912,True,100,16,0.91647915197436,0.9724593279462378,20,2,1.1232396802371982,2.545455185170302,facebook/sam2-hiera-large,mean,0.2972734523512052,3,graph,13,z-score,pca,59,True,False,heuristic,7.0,3.6024485200626137,5,False,True,True,True,True,False,True,0.7114118861979599,0.5517046525455646,0.5669441280518428,0.3101463411225666,0.9107454376621239,0.8700679021805845,COMPLETE,,0.0,0
