number,value,params_dino_pipeline.clustering.clusterer.method,params_dino_pipeline.clustering.clusterer.n_neighbors,params_dino_pipeline.clustering.feature_processing.normalizer.method,params_dino_pipeline.clustering.feature_processing.reducer.method,params_dino_pipeline.clustering.feature_processing.reducer.n_components,params_dino_pipeline.clustering.feature_processing.run_normalization,params_dino_pipeline.clustering.feature_processing.run_reduction,params_dino_pipeline.clustering.k_selection.method,params_extractors.clip.layer_name,params_extractors.clip.model_name,params_extractors.dino_v2.layer_name,params_extractors.dino_v2.model_name,params_extractors.resnet.layer_name,params_extractors.resnet.model_name,params_fusion_pipeline.clustering.k_selection.k_source,params_heuristic_settings.filter_params.filter_min_area_perc,params_heuristic_settings.filter_params.nms_iou_threshold,params_heuristic_settings.filter_params.use_nms,params_heuristic_settings.generator_params.min_mask_region_area,params_heuristic_settings.generator_params.points_per_side,params_heuristic_settings.generator_params.pred_iou_thresh,params_heuristic_settings.generator_params.stability_score_thresh,params_heuristic_settings.k_heuristic_formulas.max_k,params_heuristic_settings.k_heuristic_formulas.semantic_base,params_heuristic_settings.k_heuristic_formulas.semantic_scale_factor,params_heuristic_settings.k_heuristic_formulas.structural_multiplier,params_heuristic_settings.sam_model,params_labeler.aggregation_method,params_labeler.aggregation_top_k_perc,params_labeler.top_n_labels,params_resnet_pipeline.clustering.clusterer.method,params_resnet_pipeline.clustering.clusterer.n_neighbors,params_resnet_pipeline.clustering.feature_processing.normalizer.method,params_resnet_pipeline.clustering.feature_processing.reducer.method,params_resnet_pipeline.clustering.feature_processing.reducer.n_components,params_resnet_pipeline.clustering.feature_processing.run_normalization,params_resnet_pipeline.clustering.feature_processing.run_reduction,params_resnet_pipeline.clustering.k_selection.method,params_resnet_pipeline.image_preprocessing.blur_kernel_size,params_resnet_pipeline.image_preprocessing.clahe_clip_limit,params_resnet_pipeline.image_preprocessing.sobel_kernel_size,params_resnet_pipeline.image_preprocessing.use_clahe,params_resnet_pipeline.image_preprocessing.use_gaussian_blur,params_resnet_pipeline.image_preprocessing.use_grayscale,params_resnet_pipeline.image_preprocessing.use_sobel_edges,params_run_dino_pipeline,params_run_fusion_pipeline,params_run_resnet_pipeline,params_validator_settings.final_threshold,params_validator_settings.semantic_threshold,params_validator_settings.structural_threshold,params_validator_settings.weights.clip_confidence,params_validator_settings.weights.dino_iou,params_validator_settings.weights.resnet_iou,state,user_attrs_error,user_attrs_max_clip_confidence,user_attrs_num_correct_segments
139,0.0,graph,24,l2,umap,52,True,True,silhouette,transformer.resblocks.10,ViT-B/32,blocks.7,dinov2_vitb14,layer1,resnet50,semantic,0.001389778676748424,0.7009402717767697,True,200,8,0.9393936978354398,0.9070212763785358,19,4,1.008389848403142,1.5601366887465067,facebook/sam2-hiera-large,mean,0.39269387669670297,3,kmeans,38,z-score,umap,46,False,True,silhouette,,2.98958424021911,3,True,False,True,True,True,False,True,0.6290750455488833,0.7317768030172611,0.56634090058668,0.2252236470964697,0.4605817672498175,0.7902608905956706,COMPLETE,,0.0,0
188,0.0,graph,16,l2,svd,16,False,True,heuristic,transformer.resblocks.10,ViT-B/32,blocks.7,dinov2_vitb14,layer1,resnet50,structural,0.007367970850192364,0.6528735228429638,True,100,8,0.9222000090246008,0.9379920406234978,16,3,1.164658518169681,2.8297903265519655,facebook/sam2-hiera-large,mean,0.23026450062138248,3,kmeans,28,root-norm,svd,28,False,True,heuristic,3.0,4.642151874542734,3,False,True,True,False,False,False,False,0.7527805646632045,0.6376763343593465,0.5832478938087878,0.7178331427968937,0.846142885239963,0.820402662166715,COMPLETE,,0.0,0
189,0.0,kmeans,39,z-score,pca,52,True,False,silhouette,transformer.resblocks.11,ViT-B/32,blocks.11,dinov2_vitb14,layer4,resnet50,semantic,0.0010239079951061458,0.6094620629865164,False,50,32,0.9343936569966742,0.9614989699121097,25,3,1.0228777617819516,2.559264839425659,facebook/sam2-hiera-large,mean,0.34372647408777324,5,graph,31,z-score,umap,53,True,True,silhouette,,2.682325974569383,5,True,False,False,False,True,True,True,0.6794023860261131,0.7244578576280484,0.40765629327342257,0.5838597929340537,0.4438760894526852,0.7099314859223527,COMPLETE,,0.0,0
190,0.0,graph,25,l2,svd,19,False,True,heuristic,transformer.resblocks.11,ViT-B/32,blocks.4,dinov2_vitb14,layer3,resnet50,structural,0.009954262469159309,0.8107675926802097,False,200,8,0.822226741852701,0.9730008307348941,30,4,0.8584141116871569,2.9692039984366976,facebook/sam2-hiera-large,median,0.11213218258842846,3,kmeans,38,l2,umap,31,False,False,heuristic,7.0,2.5050761406914135,3,False,True,True,False,False,False,False,0.7166266990248893,0.41530137353052937,0.5762983042075356,0.6830875008352129,0.6382114736239091,0.8690888131791316,COMPLETE,,0.0,0
191,0.0,graph,36,root-norm,umap,45,False,False,heuristic,transformer.resblocks.9,ViT-B/32,blocks.4,dinov2_vitb14,layer3,resnet50,structural,0.0026422774087910086,0.7317162401963455,False,50,16,0.9626659895924956,0.9349400431836105,23,3,0.7675728247691994,2.717322631458397,facebook/sam2-hiera-large,top_k_mean,0.3615514036465839,5,graph,22,l2,pca,60,True,True,heuristic,7.0,4.88438429459513,3,False,True,False,False,False,False,False,0.6906861062600509,0.7149167028433663,0.6750195711983845,0.14939754706227754,0.8647587987147478,0.9886390486765575,COMPLETE,,0.0,0
192,0.0,graph,37,root-norm,umap,48,False,False,heuristic,transformer.resblocks.9,ViT-B/32,blocks.4,dinov2_vitb14,layer3,resnet50,structural,0.0037979644785650314,0.7152677773270841,False,50,16,0.8248298523785762,0.9342106030285467,23,4,0.839959664046645,2.7591244228379974,facebook/sam2-hiera-large,top_k_mean,0.35108645582769926,5,graph,23,l2,pca,61,True,True,heuristic,7.0,3.8333091110496267,3,False,True,False,False,False,False,False,0.7001151609624731,0.6890104848054642,0.5351671363501946,0.16143081502376172,0.7784675746290588,0.9445459698677172,COMPLETE,,0.0,0
193,0.0,graph,38,root-norm,umap,45,False,False,heuristic,transformer.resblocks.9,ViT-B/32,blocks.4,dinov2_vitb14,layer3,resnet50,structural,0.0017533820319806186,0.7018750918155096,False,50,16,0.8291084470049084,0.9368747917578784,24,3,0.8207220700935612,2.661591651939086,facebook/sam2-hiera-large,top_k_mean,0.37628933905884465,5,graph,24,l2,pca,59,True,True,heuristic,7.0,4.039066393508699,3,False,True,False,False,False,False,False,0.5786744967639832,0.45342584597079116,0.6133198000653319,0.18961347678818957,0.35838971000326425,0.8975128494456298,COMPLETE,,0.0,0
194,0.0,graph,33,root-norm,umap,46,False,False,heuristic,transformer.resblocks.9,ViT-B/32,blocks.4,dinov2_vitb14,layer3,resnet50,structural,0.00327019711988089,0.7272098879488211,False,50,16,0.8661553352451807,0.9221287435340071,22,4,0.7080119660797258,1.7685331251101621,facebook/sam2-hiera-large,top_k_mean,0.40666613295255977,5,graph,14,l2,pca,57,True,True,heuristic,7.0,4.337692538045812,3,False,True,False,False,False,False,False,0.6872248099392553,0.7060134960972023,0.47134915585432474,0.12054333154593436,0.5303327394283021,0.12188262278837989,COMPLETE,,0.0,0
195,0.0,graph,12,root-norm,umap,42,True,False,heuristic,transformer.resblocks.9,ViT-B/32,blocks.11,dinov2_vitb14,layer2,resnet50,structural,0.0036326734274338595,0.8450892507498983,True,100,16,0.8374684749855574,0.9321509616719892,22,2,0.7873904995523361,2.7845187401006024,facebook/sam2-hiera-large,top_k_mean,0.2192855759609626,5,graph,40,z-score,pca,55,True,True,silhouette,3.0,4.755052301766501,5,False,True,False,True,False,False,False,0.6747375886514706,0.6968005615970517,0.6161971427048281,0.4415680003406036,0.8348973578682852,0.9668107897129624,COMPLETE,,0.0,0
180,0.0,graph,27,z-score,svd,22,False,False,silhouette,transformer.resblocks.10,ViT-B/32,blocks.4,dinov2_vitb14,layer1,resnet50,semantic,0.006107442760554036,0.7521900229213705,False,50,32,0.8481202863028318,0.9267529906396976,21,2,0.9984929118760761,2.747450235162956,facebook/sam2-hiera-large,mean,0.2408261450741576,5,kmeans,33,l2,umap,63,False,True,heuristic,,2.197490626315842,3,True,False,False,False,True,True,True,0.6360693295183583,0.7348869584015155,0.7361230595279179,0.22679200133836303,0.9517555366910595,0.42407140886610245,COMPLETE,,0.0,0
181,0.0,kmeans,19,z-score,svd,32,True,True,silhouette,transformer.resblocks.11,ViT-B/32,blocks.11,dinov2_vitb14,layer3,resnet50,semantic,0.00770343691360588,0.7823090228992191,False,200,32,0.944387920501883,0.9527455072476909,16,3,1.1431021439426814,1.9368718454736604,facebook/sam2-hiera-large,median,0.11830642018954177,3,kmeans,30,root-norm,umap,53,False,True,silhouette,,3.473720243577759,5,True,False,True,True,True,True,True,0.7872654162522923,0.5374246446371007,0.5482223998561013,0.5578901207903938,0.47833439390861837,0.8619361753783342,COMPLETE,,0.0,0
182,0.0,kmeans,18,z-score,svd,28,True,True,silhouette,transformer.resblocks.11,ViT-B/32,blocks.11,dinov2_vitb14,layer3,resnet50,semantic,0.0075903671992560385,0.7759949784222339,False,200,32,0.9284797615992804,0.9520452292327988,18,3,1.1314775443320668,1.9885289256204661,facebook/sam2-hiera-large,median,0.10301916417416371,3,kmeans,29,root-norm,umap,51,False,True,silhouette,,3.6631307911783995,5,True,False,True,True,True,True,True,0.774268647583117,0.5251624055722257,0.5584063446463843,0.054042461370778457,0.35970655554555503,0.9265167287108153,COMPLETE,,0.0,0
183,0.0,kmeans,38,z-score,svd,35,True,True,silhouette,transformer.resblocks.11,ViT-B/32,blocks.11,dinov2_vitb14,layer3,resnet50,semantic,0.006950668168798427,0.7274154884859959,False,200,32,0.9036112640535479,0.9503660775355596,17,3,1.097146890550832,2.067291928208732,facebook/sam2-hiera-large,median,0.30391151753085155,3,kmeans,30,root-norm,umap,50,False,True,silhouette,,3.881549167127844,5,True,False,True,True,True,True,True,0.7600305630744371,0.5003825493144681,0.5416856249991263,0.7697839304300743,0.41335436987005914,0.8392097632083806,COMPLETE,,0.0,0
184,0.0,kmeans,18,z-score,svd,34,True,True,silhouette,transformer.resblocks.11,ViT-B/32,blocks.11,dinov2_vitb14,layer3,resnet50,semantic,0.007957470996614703,0.8019448669450193,False,200,32,0.8422982172113076,0.9466593268234313,15,3,1.1865291440649155,2.112023559037005,facebook/sam2-hiera-large,median,0.127709719433208,3,kmeans,39,root-norm,umap,47,False,True,silhouette,,3.7379090917447853,5,True,False,True,True,True,True,True,0.5161623122820773,0.5088760545858855,0.4978002845772628,0.0013688287845826375,0.8092618284309294,0.8858720638535231,COMPLETE,,0.0,0
185,0.0,kmeans,17,l2,umap,61,True,True,silhouette,transformer.resblocks.11,ViT-B/32,blocks.7,dinov2_vitb14,conv1,resnet50,semantic,0.004214132747786049,0.7689738678911033,False,200,8,0.9383033156676859,0.9589309367347779,17,3,0.8064896632253455,2.8902821099302884,facebook/sam2-hiera-large,median,0.1350518679971842,3,graph,17,root-norm,umap,49,True,True,silhouette,5.0,3.58714529465971,5,True,True,True,True,True,True,True,0.5579022160409266,0.5864392037075099,0.5192011581440976,0.7349287849231709,0.5003428550174395,0.7775297050047706,COMPLETE,,0.0,0
186,0.0,graph,15,z-score,pca,38,False,True,heuristic,transformer.resblocks.9,ViT-B/32,blocks.11,dinov2_vitb14,layer3,resnet50,structural,0.0029140733922943893,0.7935427883283644,True,100,16,0.8956155643747288,0.9056414903892752,29,3,1.0438202669545065,2.928505868154676,facebook/sam2-hiera-large,mean,0.1879781176756251,3,kmeans,29,z-score,pca,19,False,False,heuristic,,3.399833287257775,3,False,False,True,False,False,False,False,0.7635814494828107,0.5574039316049881,0.4855318019144461,0.8722538150848813,0.32000465019085983,0.4631949958749994,COMPLETE,,0.0,0
187,0.0,graph,24,root-norm,svd,31,True,False,silhouette,transformer.resblocks.11,ViT-B/32,blocks.4,dinov2_vitb14,layer3,resnet50,semantic,0.007756597476442166,0.7905493718910876,False,200,32,0.9772415786628551,0.9247558173645366,20,3,0.5424723536520267,2.4604641297985683,facebook/sam2-hiera-large,top_k_mean,0.4225243109320823,5,graph,27,z-score,umap,64,True,True,silhouette,3.0,1.8918883289903496,5,True,True,False,True,True,True,True,0.5071977203751523,0.47749652767126577,0.7191526093047936,0.02726875310672591,0.38898043658191994,0.9623879965778678,COMPLETE,,0.0,0
172,0.0,graph,15,l2,svd,53,True,False,silhouette,transformer.resblocks.11,ViT-B/32,blocks.4,dinov2_vitb14,layer2,resnet50,semantic,0.005822277145417511,0.6133464084974841,False,100,8,0.840742180150985,0.9626443494217543,25,2,0.6775563913642704,2.7024569084897467,facebook/sam2-hiera-large,mean,0.16277199872013615,3,kmeans,37,z-score,umap,37,True,True,silhouette,3.0,3.5493329834291996,3,True,True,False,False,False,True,False,0.7001765602957233,0.6073027912939069,0.5576616806605095,0.02419616570616687,0.6223835116621166,0.5319407911701327,COMPLETE,,0.0,0
173,0.0,graph,28,l2,svd,59,True,False,silhouette,transformer.resblocks.11,ViT-B/32,blocks.4,dinov2_vitb14,layer2,resnet50,semantic,0.006187109040718034,0.8272481596816713,False,100,8,0.8358827858867789,0.965086624718148,27,2,0.9519293744730005,2.792926790589358,facebook/sam2-hiera-large,mean,0.3985634753073286,3,kmeans,13,z-score,umap,63,True,True,silhouette,3.0,1.3271607428554715,3,True,True,False,False,False,True,False,0.6932023913482075,0.6106374398733325,0.6032954203229838,0.6993966616652489,0.6532443495116329,0.44385127535242896,COMPLETE,,0.0,0
174,0.0,graph,29,l2,svd,54,True,False,silhouette,transformer.resblocks.11,ViT-B/32,blocks.4,dinov2_vitb14,layer2,resnet50,semantic,0.006355825848916243,0.6439089642152299,False,100,8,0.9562311663502008,0.9156964514626934,26,2,0.914667314638839,2.482917656137322,facebook/sam2-hiera-large,mean,0.4354329647959784,3,kmeans,34,z-score,umap,62,True,True,silhouette,5.0,1.6938718641182293,3,True,True,False,False,False,True,False,0.7237746820395531,0.5788837646487344,0.6641297630405175,0.5221371002651565,0.5988785092628174,0.5577773171237727,COMPLETE,,0.0,0
175,0.0,kmeans,34,z-score,svd,29,True,False,heuristic,transformer.resblocks.11,ViT-B/32,blocks.4,dinov2_vitb14,layer3,resnet50,semantic,0.008374116651466056,0.6333786783278459,False,50,32,0.8317479919346406,0.9758519971563738,30,2,0.963670568539146,2.6594822674384755,facebook/sam2-hiera-large,mean,0.40842935118442303,3,kmeans,40,z-score,svd,61,True,True,silhouette,3.0,1.134900399753767,3,True,True,False,False,False,False,False,0.709501937022394,0.5625404161491636,0.7284867321696569,0.06457323698990125,0.6688618912205327,0.487431336301257,COMPLETE,,0.0,0
176,0.0,graph,26,l2,umap,52,False,False,silhouette,transformer.resblocks.9,ViT-B/32,blocks.7,dinov2_vitb14,layer1,resnet50,semantic,0.005695028647415634,0.6266293547545787,True,100,8,0.8546814277493942,0.9082614096422816,25,2,1.0633687853632547,2.615667087414756,facebook/sam2-hiera-large,mean,0.38849454887787155,5,kmeans,32,root-norm,pca,21,False,False,heuristic,,1.2212384012714197,3,True,False,False,False,True,True,True,0.625775737612021,0.6000094848189244,0.6548377709498717,0.3724976659503646,0.5649712223543165,0.23283221850573727,COMPLETE,,0.0,0
177,0.0,graph,35,root-norm,svd,27,True,True,heuristic,transformer.resblocks.10,ViT-B/32,blocks.11,dinov2_vitb14,layer4,resnet50,structural,0.006679247368201069,0.7201113927059665,False,200,16,0.918288631885728,0.9714919164042668,24,4,0.9082240387404729,2.582853776866108,facebook/sam2-hiera-large,top_k_mean,0.36959979715070274,3,graph,36,z-score,umap,58,True,True,silhouette,3.0,2.0098557760349554,5,False,True,True,False,False,False,False,0.747886929557185,0.5513568749606165,0.6315885163404628,0.3275297020427166,0.9170938392023811,0.024998131931276937,COMPLETE,,0.0,0
178,0.0,graph,40,z-score,pca,41,False,False,silhouette,transformer.resblocks.11,ViT-B/32,blocks.4,dinov2_vitb14,layer2,resnet50,semantic,0.008701627550902515,0.8389662692970333,False,100,32,0.888529734932653,0.9678737652319919,22,2,0.7452692825926927,2.5220928856492932,facebook/sam2-hiera-large,mean,0.12628939873470485,5,kmeans,18,z-score,umap,46,False,True,heuristic,7.0,1.5099402787559295,3,True,True,False,True,True,True,True,0.7671886291928519,0.6643651448478736,0.5912890225983566,0.4086243412371298,0.30245428126579127,0.27460827515681685,COMPLETE,,0.0,0
179,0.0,kmeans,17,l2,svd,25,True,True,heuristic,transformer.resblocks.11,ViT-B/32,blocks.11,dinov2_vitb14,layer3,resnet50,structural,0.009474054313980856,0.6577663583083887,True,200,8,0.9501883871581668,0.9799642772323377,19,4,0.7227767616654819,2.2007715210067484,facebook/sam2-hiera-large,median,0.3818315564707577,3,graph,20,z-score,svd,44,True,False,silhouette,3.0,1.8236516862654493,5,False,True,True,False,False,False,False,0.7347438964143913,0.643520669654842,0.6443028701893914,0.09279042067869703,0.7056845412671956,0.9967816326050256,COMPLETE,,0.0,0
164,0.0,graph,32,l2,svd,24,False,True,heuristic,transformer.resblocks.9,ViT-B/32,blocks.11,dinov2_vitb14,conv1,resnet50,structural,0.007933731779696692,0.693734633576589,False,100,32,0.906779522644133,0.949484681626784,15,4,0.7909498272402178,2.9176845521551447,facebook/sam2-hiera-large,mean,0.2044551509596685,5,graph,40,z-score,pca,39,False,True,heuristic,3.0,4.293289470952317,5,False,True,True,False,True,False,True,0.7614474763273954,0.6324794452057667,0.7019435398234931,0.3136537698408529,0.8792211215726783,0.3273335119328955,COMPLETE,,0.0,0
165,0.0,graph,16,l2,svd,62,False,True,heuristic,transformer.resblocks.10,ViT-B/32,blocks.11,dinov2_vitb14,layer4,resnet50,structural,0.0021620827438136522,0.6794379463447218,True,200,16,0.9756944073778263,0.9449815144260468,20,4,0.9882989314691919,2.573804749020559,facebook/sam2-hiera-large,top_k_mean,0.17533071704316602,5,graph,34,l2,umap,45,True,True,silhouette,5.0,2.780069938965377,5,False,True,False,False,False,False,True,0.6670586753227964,0.7097538753318572,0.6977082985490101,0.5586473582211609,0.861774126834019,0.6214552472658726,COMPLETE,,0.0,0
166,0.0,graph,39,z-score,pca,47,True,False,silhouette,transformer.resblocks.11,ViT-B/32,blocks.7,dinov2_vitb14,conv1,resnet50,structural,0.009788229219932791,0.6731192691442822,False,100,32,0.8145360688759082,0.940348895050258,22,4,0.5033550742258182,2.052603668721666,facebook/sam2-hiera-large,mean,0.2705490573310462,3,graph,38,z-score,pca,57,False,False,heuristic,3.0,2.2380203133756105,5,False,True,True,False,True,True,False,0.755669460697968,0.6703510554847862,0.6888392060709826,0.5892302682781883,0.20776972255358414,0.6423432889972184,COMPLETE,,0.0,0
167,0.0,graph,23,l2,svd,51,False,True,heuristic,transformer.resblocks.9,ViT-B/32,blocks.11,dinov2_vitb14,layer1,resnet50,semantic,0.0045547613060187165,0.6184012416251359,True,50,8,0.883164376243577,0.9205745954542931,23,3,0.9233032188349066,1.821353781456124,facebook/sam2-hiera-large,mean,0.10990855246190703,5,kmeans,36,z-score,umap,29,True,True,silhouette,3.0,1.8008261597135506,3,True,True,False,True,False,False,True,0.7324310766451843,0.659086076364052,0.6233600183238999,0.6147515889793786,0.5328521127461254,0.05839126204553936,COMPLETE,,0.0,0
168,0.0,kmeans,36,z-score,umap,49,True,False,silhouette,transformer.resblocks.11,ViT-B/32,blocks.4,dinov2_vitb14,layer3,resnet50,structural,0.005546355372345451,0.7365272369203286,False,200,32,0.8042079218553404,0.9039550225745437,29,3,1.1620165735394283,2.6370689082066088,facebook/sam2-hiera-large,median,0.32932353879493736,3,graph,39,root-norm,svd,41,False,True,heuristic,7.0,2.950217879277621,5,False,True,True,False,True,True,False,0.7941270112720459,0.7319074970113172,0.4194669454152609,0.9940741061138164,0.34250645970897303,0.5874185041173204,COMPLETE,,0.0,0
169,0.0,graph,13,root-norm,svd,18,False,True,heuristic,transformer.resblocks.10,ViT-B/32,blocks.7,dinov2_vitb14,layer3,resnet50,semantic,0.007479431685166526,0.6678540730232059,False,100,16,0.9699782528882371,0.9663060940420906,26,4,0.8746651893062527,1.5214956512504805,facebook/sam2-hiera-large,top_k_mean,0.23592593070883086,5,kmeans,21,z-score,umap,35,True,False,silhouette,,2.0760442705093634,3,True,False,False,False,False,False,True,0.6499466929965741,0.6984067159151791,0.5284444475368202,0.18328548510906922,0.7545270959460698,0.7527092913049868,COMPLETE,,0.0,0
170,0.0,graph,31,l2,pca,39,True,True,silhouette,transformer.resblocks.11,ViT-B/32,blocks.11,dinov2_vitb14,layer1,resnet50,structural,0.007230768681199966,0.640360621609532,True,200,8,0.8609261436311791,0.9548003541167858,23,4,0.9738789829036179,2.43812532422183,facebook/sam2-hiera-large,mean,0.4865523365585402,3,graph,25,l2,umap,64,False,True,heuristic,3.0,2.329200689610461,5,False,True,True,True,True,True,False,0.7803518517718113,0.6809332414188256,0.45020063989971965,0.746753108454164,0.1589522654124763,0.7954274775640648,COMPLETE,,0.0,0
171,0.0,graph,27,l2,svd,55,True,False,silhouette,transformer.resblocks.11,ViT-B/32,blocks.4,dinov2_vitb14,layer2,resnet50,semantic,0.0059449180292338024,0.6473692140807411,False,100,8,0.8460574102297626,0.9693431551473136,26,2,0.9338319323642135,2.544069555276585,facebook/sam2-hiera-large,mean,0.4211707814832558,3,kmeans,35,z-score,umap,59,True,True,silhouette,3.0,1.5805843563669608,3,True,True,False,False,False,True,False,0.6860484372514631,0.6228386232430805,0.5706905061200864,0.040637218764685776,0.44805334366877847,0.3951596882816597,COMPLETE,,0.0,0
