number,value,params_dino_pipeline.clustering.clusterer.method,params_dino_pipeline.clustering.clusterer.n_neighbors,params_dino_pipeline.clustering.feature_processing.normalizer.method,params_dino_pipeline.clustering.feature_processing.reducer.method,params_dino_pipeline.clustering.feature_processing.reducer.n_components,params_dino_pipeline.clustering.feature_processing.run_normalization,params_dino_pipeline.clustering.feature_processing.run_reduction,params_dino_pipeline.clustering.k_selection.method,params_extractors.clip.layer_name,params_extractors.clip.model_name,params_extractors.dino_v2.layer_name,params_extractors.dino_v2.model_name,params_extractors.resnet.layer_name,params_extractors.resnet.model_name,params_fusion_pipeline.clustering.k_selection.k_source,params_heuristic_settings.filter_params.filter_min_area_perc,params_heuristic_settings.filter_params.nms_iou_threshold,params_heuristic_settings.filter_params.use_nms,params_heuristic_settings.generator_params.min_mask_region_area,params_heuristic_settings.generator_params.points_per_side,params_heuristic_settings.generator_params.pred_iou_thresh,params_heuristic_settings.generator_params.stability_score_thresh,params_heuristic_settings.k_heuristic_formulas.max_k,params_heuristic_settings.k_heuristic_formulas.semantic_base,params_heuristic_settings.k_heuristic_formulas.semantic_scale_factor,params_heuristic_settings.k_heuristic_formulas.structural_multiplier,params_heuristic_settings.sam_model,params_labeler.aggregation_method,params_labeler.aggregation_top_k_perc,params_labeler.top_n_labels,params_resnet_pipeline.clustering.clusterer.method,params_resnet_pipeline.clustering.clusterer.n_neighbors,params_resnet_pipeline.clustering.feature_processing.normalizer.method,params_resnet_pipeline.clustering.feature_processing.reducer.method,params_resnet_pipeline.clustering.feature_processing.reducer.n_components,params_resnet_pipeline.clustering.feature_processing.run_normalization,params_resnet_pipeline.clustering.feature_processing.run_reduction,params_resnet_pipeline.clustering.k_selection.method,params_resnet_pipeline.image_preprocessing.blur_kernel_size,params_resnet_pipeline.image_preprocessing.clahe_clip_limit,params_resnet_pipeline.image_preprocessing.sobel_kernel_size,params_resnet_pipeline.image_preprocessing.use_clahe,params_resnet_pipeline.image_preprocessing.use_gaussian_blur,params_resnet_pipeline.image_preprocessing.use_grayscale,params_resnet_pipeline.image_preprocessing.use_sobel_edges,params_run_dino_pipeline,params_run_fusion_pipeline,params_run_resnet_pipeline,params_validator_settings.final_threshold,params_validator_settings.semantic_threshold,params_validator_settings.structural_threshold,params_validator_settings.weights.clip_confidence,params_validator_settings.weights.dino_iou,params_validator_settings.weights.resnet_iou,state,user_attrs_error,user_attrs_max_clip_confidence,user_attrs_num_correct_segments
461,0.0,graph,10,l2,umap,32,False,True,silhouette,transformer.resblocks.11,ViT-B/32,blocks.7,dinov2_vitb14,layer3,resnet50,semantic,0.007690184848186903,0.616696252229266,False,50,8,0.961836986444047,0.9503841326442324,21,4,1.0445308148232972,2.3759148270225534,facebook/sam2-hiera-large,top_k_mean,0.2674250113102021,5,graph,20,l2,umap,31,True,False,silhouette,,3.785950981521511,5,False,False,False,True,False,True,False,0.7316307714351041,0.6999942910242039,0.506470179129915,0.18449316520557546,0.603658055393556,0.19145459831630493,COMPLETE,,0.0,0
462,0.0,graph,37,z-score,svd,45,True,False,heuristic,transformer.resblocks.10,ViT-B/32,blocks.11,dinov2_vitb14,layer1,resnet50,semantic,0.004462508443962339,0.7747690056921525,True,100,16,0.8680842942824534,0.9301972196112851,30,3,1.1997107381685792,2.614206722072697,facebook/sam2-hiera-large,mean,0.2367713972506292,3,graph,13,z-score,pca,60,False,True,heuristic,7.0,2.6969043833845063,3,True,True,True,False,True,False,True,0.6436384147609643,0.7419198852536418,0.6965029785485546,0.28894454763367716,0.7726008650426068,0.34309925168302136,COMPLETE,,0.0,0
463,0.0,graph,22,root-norm,pca,50,False,True,silhouette,transformer.resblocks.9,ViT-B/32,blocks.4,dinov2_vitb14,layer2,resnet50,structural,0.002080225681195434,0.7571192084670316,False,200,32,0.9799789416516431,0.9419728577243635,25,2,0.7333276754105219,1.5349162052816308,facebook/sam2-hiera-large,median,0.14537389155895258,3,kmeans,32,z-score,umap,40,True,False,silhouette,5.0,3.1511516417215506,5,False,True,False,True,True,True,False,0.7606151881419517,0.6691465092544034,0.4582762389824887,0.12652347283550894,0.3747993485866565,0.021286859226794654,COMPLETE,,0.0,0
464,0.0,kmeans,37,z-score,svd,52,True,True,heuristic,transformer.resblocks.11,ViT-B/32,blocks.11,dinov2_vitb14,layer3,resnet50,semantic,0.0037594794918128322,0.6445305720432508,True,50,8,0.9444503250421943,0.957445756285828,24,4,0.9913152259178053,2.8679996284351583,facebook/sam2-hiera-large,mean,0.2848621881631218,5,graph,40,z-score,umap,17,False,True,heuristic,3.0,2.6053532441261362,3,True,True,True,False,False,True,True,0.5555681209586282,0.7315306806950244,0.6322165966509409,0.15597735165395799,0.835024693814823,0.7041802238510816,COMPLETE,,0.0,0
465,0.0,graph,36,l2,pca,39,True,False,silhouette,transformer.resblocks.10,ViT-B/32,blocks.4,dinov2_vitb14,conv1,resnet50,structural,0.0011381166408737553,0.8296967391758088,False,100,16,0.8400986322858657,0.9081821975744684,22,3,1.0232189177385038,2.2318873023210655,facebook/sam2-hiera-large,mean,0.371594577975939,3,kmeans,31,root-norm,pca,35,True,True,silhouette,3.0,3.979495992575506,5,False,True,False,False,True,False,False,0.7992124769044875,0.4278924787451758,0.5990918057529144,0.2047005667384833,0.7264390585317051,0.5430299484888017,COMPLETE,,0.0,0
466,0.0,graph,18,z-score,svd,30,False,True,heuristic,transformer.resblocks.11,ViT-B/32,blocks.11,dinov2_vitb14,layer4,resnet50,semantic,0.009394957104736845,0.6326769791266088,False,200,32,0.8138771961868291,0.9445481735484405,26,3,0.6209254597585835,2.5319423899647475,facebook/sam2-hiera-large,top_k_mean,0.21443385699109108,5,graph,38,z-score,svd,21,False,False,heuristic,,3.0405509771478045,3,True,False,False,True,False,True,True,0.6283055904503158,0.6242463173569622,0.5553607296599021,0.61307110248891,0.8067083937022328,0.8939900748096099,COMPLETE,,0.0,0
467,0.0,graph,16,l2,umap,36,True,False,heuristic,transformer.resblocks.11,ViT-B/32,blocks.7,dinov2_vitb14,layer1,resnet50,semantic,0.007480553525952548,0.6603974556663764,True,50,8,0.8322099243045962,0.9694555203980506,28,3,0.8703285808727208,2.5020409449831766,facebook/sam2-hiera-large,mean,0.2969428263515081,3,kmeans,33,l2,umap,55,False,True,silhouette,5.0,4.995600847350755,5,True,True,True,False,True,False,False,0.6086397620741058,0.7145173852597614,0.445358578815735,0.022566594509319776,0.8607267911992669,0.4587481100849251,COMPLETE,,0.0,0
452,0.0,graph,16,z-score,svd,20,True,True,heuristic,transformer.resblocks.9,ViT-B/32,blocks.11,dinov2_vitb14,layer4,resnet50,semantic,0.002859949778442931,0.6653007577366213,True,200,32,0.937007946647475,0.9188168025207243,29,2,0.8231722218944199,2.437536491248311,facebook/sam2-hiera-large,median,0.35741302303637085,5,graph,25,z-score,umap,49,True,True,silhouette,3.0,3.0826266772316258,5,False,True,True,False,True,True,False,0.725281174486119,0.749752468188264,0.7313132321716841,0.31240388777367045,0.9685811113689878,0.9513210924888671,COMPLETE,,0.0,0
453,0.0,graph,40,l2,pca,54,True,False,silhouette,transformer.resblocks.10,ViT-B/32,blocks.4,dinov2_vitb14,layer3,resnet50,structural,0.0017796145199499179,0.8091639127210216,False,100,16,0.8238792649260619,0.9557568552194526,23,4,0.7762169897665582,2.5887198063134926,facebook/sam2-hiera-large,mean,0.16492693200727312,3,graph,36,z-score,pca,26,False,False,heuristic,,2.3239306206328014,3,True,False,False,True,True,False,True,0.5617350603789147,0.5981011413304044,0.7047196020663224,0.41865533962620505,0.2232220933083815,0.8383946429554903,COMPLETE,,0.0,0
454,0.0,graph,11,z-score,svd,49,False,True,heuristic,transformer.resblocks.11,ViT-B/32,blocks.11,dinov2_vitb14,layer1,resnet50,semantic,0.009762392912996853,0.8389309572574997,False,200,8,0.9674376325924327,0.9626796151712093,20,4,0.9688003724826287,2.141683425949669,facebook/sam2-hiera-large,mean,0.1902865662558588,5,kmeans,10,root-norm,umap,42,True,True,silhouette,7.0,4.0706120484867645,5,False,True,False,False,False,True,False,0.5350076451751151,0.5585730653335205,0.7437019667011249,0.10251589812075462,0.6587898948253806,0.5656617247277569,COMPLETE,,0.0,0
455,0.0,kmeans,13,l2,umap,22,True,False,heuristic,transformer.resblocks.11,ViT-B/32,blocks.11,dinov2_vitb14,layer2,resnet50,structural,0.00786683644367631,0.7520920913539882,True,50,32,0.9493148523533902,0.9280463534523465,26,3,0.5526092237270945,2.950987513232556,facebook/sam2-hiera-large,mean,0.11978822806060449,3,graph,16,l2,svd,61,False,False,heuristic,3.0,3.24984889032862,3,True,True,True,True,True,False,True,0.7710099771461445,0.6570275182533494,0.687374770675927,0.534480089076508,0.7846554334511211,0.6414678807853924,COMPLETE,,0.0,0
456,0.0,graph,25,z-score,svd,63,False,True,silhouette,transformer.resblocks.10,ViT-B/32,blocks.4,dinov2_vitb14,layer3,resnet50,semantic,0.006755086374103671,0.7219010129541726,False,100,16,0.8974564272650198,0.9129152867711509,27,3,0.9062239701961456,1.9719219374169874,facebook/sam2-hiera-large,top_k_mean,0.3806316938874077,3,kmeans,18,z-score,pca,64,True,True,silhouette,5.0,2.193475745879751,5,False,True,False,False,False,True,False,0.7072956030725909,0.7236696450101523,0.6761536405570094,0.2242524765977201,0.7464935631314911,0.8761770305441028,COMPLETE,,0.0,0
457,0.0,graph,32,root-norm,pca,25,True,False,heuristic,transformer.resblocks.9,ViT-B/32,blocks.7,dinov2_vitb14,conv1,resnet50,semantic,0.007224182210393315,0.6490714831373389,True,200,32,0.85873547237581,0.9353743499626653,18,4,0.6677554265770292,2.471010751736178,facebook/sam2-hiera-large,median,0.25458615992613265,5,graph,27,z-score,umap,18,False,True,heuristic,,3.5342094463599296,3,True,False,True,False,True,False,True,0.5112587637449083,0.6878216918205873,0.6647224358129615,0.03970055640265392,0.8756651720054909,0.14421320744689506,COMPLETE,,0.0,0
458,0.0,graph,14,z-score,svd,59,True,True,silhouette,transformer.resblocks.11,ViT-B/32,blocks.11,dinov2_vitb14,layer1,resnet50,structural,0.004951631622109505,0.7451664491593555,False,50,8,0.8724342074497968,0.9720400439298965,21,3,1.0071980979691795,1.7356290644269632,facebook/sam2-hiera-large,mean,0.10663335919283665,3,kmeans,35,z-score,umap,52,False,False,silhouette,3.0,2.065951312958856,5,True,True,False,True,True,True,False,0.6875290998704162,0.5362387091331678,0.4883770241678388,0.5712953387716395,0.8158971004563133,0.24798379428115191,COMPLETE,,0.0,0
459,0.0,kmeans,39,l2,pca,27,False,True,heuristic,transformer.resblocks.10,ViT-B/32,blocks.4,dinov2_vitb14,layer4,resnet50,semantic,0.006115806166621762,0.6993327362664434,False,100,16,0.8005496771349269,0.9660891083319703,23,3,0.7003711485157784,2.1795040986537546,facebook/sam2-hiera-large,mean,0.40529738077418814,5,graph,29,root-norm,pca,27,True,True,heuristic,5.0,1.9162294849740884,5,False,True,True,False,False,True,True,0.6983121972844496,0.5672243440972007,0.6453834049063361,0.3808160828238023,0.9402507376602226,0.47636469441722423,COMPLETE,,0.0,0
508,0.0,graph,19,l2,svd,47,True,True,heuristic,transformer.resblocks.11,ViT-B/32,blocks.11,dinov2_vitb14,layer3,resnet50,semantic,0.0010004757120590725,0.6078217226680992,True,200,32,0.8103082330426228,0.9024044486643674,27,4,0.6719841860167418,2.4903997608655035,facebook/sam2-hiera-large,mean,0.12875127623794297,5,graph,22,root-norm,pca,55,True,True,silhouette,5.0,4.562452343619855,5,False,True,True,False,True,True,False,0.5455955366928815,0.6902147944439329,0.5478292926034589,0.9282363828766591,0.7498763691770421,0.7148721452268232,COMPLETE,,0.0,0
509,0.0,graph,32,z-score,pca,63,True,False,silhouette,transformer.resblocks.10,ViT-B/32,blocks.4,dinov2_vitb14,conv1,resnet50,structural,0.0029380385652035467,0.6128900367869995,False,100,16,0.9020236022194823,0.9177948533942549,19,3,0.8012794755798165,2.6968702789427543,facebook/sam2-hiera-large,mean,0.4975869970681854,3,graph,40,z-score,umap,49,False,False,heuristic,,2.9871404484041633,3,True,False,False,True,True,False,True,0.6414682037865211,0.5282608468872967,0.4725169589211061,0.5458123774672448,0.7734418862973659,0.5920804686789355,COMPLETE,,0.0,0
510,0.0,graph,31,z-score,umap,54,False,True,heuristic,transformer.resblocks.11,ViT-B/32,blocks.11,dinov2_vitb14,layer1,resnet50,semantic,0.00780717719125027,0.656512588698238,False,50,8,0.8052735188907254,0.9528548706229659,23,3,1.1371047107874004,2.3772062216506575,facebook/sam2-hiera-large,top_k_mean,0.3156350970235715,5,kmeans,34,l2,svd,33,True,True,silhouette,3.0,1.7728402830285452,5,False,True,False,False,False,True,False,0.6931990645023794,0.6990668212549762,0.5264031627678508,0.19325222212337367,0.8257757576197704,0.4562050586982383,COMPLETE,,0.0,0
511,0.0,kmeans,38,l2,svd,33,True,False,heuristic,transformer.resblocks.9,ViT-B/32,blocks.7,dinov2_vitb14,layer4,resnet50,structural,0.0038184175630848727,0.6381573540830795,True,200,32,0.9318810616855584,0.9452093240227,21,2,1.118098452831732,1.6315157384411663,facebook/sam2-hiera-large,mean,0.2306567852213547,3,graph,18,z-score,umap,42,False,False,heuristic,5.0,2.772406166784483,3,True,True,True,True,True,False,True,0.6234920884335067,0.6510537047012466,0.5917024703906122,0.7907723293821451,0.9786625008277822,0.8648291135124135,COMPLETE,,0.0,0
512,0.0,graph,22,root-norm,svd,22,False,True,silhouette,transformer.resblocks.10,ViT-B/32,blocks.4,dinov2_vitb14,layer3,resnet50,semantic,0.007135774539083194,0.7002406819663919,False,100,16,0.8567305802781745,0.9134524291913487,29,4,0.9519714668761158,2.876695989092504,facebook/sam2-hiera-large,median,0.11564704944326436,3,kmeans,37,z-score,pca,39,True,True,silhouette,7.0,3.374724898093734,5,False,True,False,False,False,True,False,0.5824561670432307,0.5086331195045902,0.6123123669278165,0.22244467241573004,0.6296929963978277,0.9543937563643823,COMPLETE,,0.0,0
513,0.0,graph,35,z-score,pca,55,True,False,heuristic,transformer.resblocks.11,ViT-B/32,blocks.11,dinov2_vitb14,layer1,resnet50,semantic,0.00957026682277037,0.7120118097941351,True,200,8,0.8470651848215488,0.95826849351521,24,3,0.8394084388811403,2.7311628775989347,facebook/sam2-hiera-large,mean,0.4463545585962303,5,graph,33,z-score,umap,58,False,True,heuristic,,4.146144783811679,3,True,False,True,False,True,False,True,0.6752999996248635,0.4757731514964804,0.624384308531955,0.43437116412937105,0.8851255697194207,0.12781315450580294,COMPLETE,,0.0,0
514,0.0,graph,28,l2,svd,62,True,True,silhouette,transformer.resblocks.11,ViT-B/32,blocks.11,dinov2_vitb14,layer3,resnet50,structural,0.004553875247430996,0.7641650464291321,False,50,32,0.9739717033919445,0.9258977963663129,26,3,0.9801621287236718,2.519538554825474,facebook/sam2-hiera-large,mean,0.13769133912779344,3,kmeans,11,root-norm,svd,52,False,False,silhouette,3.0,2.6612651051023133,5,True,True,False,True,True,True,False,0.702381770879274,0.7263412145054913,0.7147226153600158,0.06420224039974637,0.3276506043979244,0.6687146075887664,COMPLETE,,0.0,0
515,0.0,kmeans,17,z-score,umap,30,False,True,heuristic,transformer.resblocks.10,ViT-B/32,blocks.4,dinov2_vitb14,layer2,resnet50,semantic,0.0031274298631207057,0.735748352890828,False,100,16,0.8306704221515108,0.9677418920509592,28,2,0.5094531270086919,2.606028292693259,facebook/sam2-hiera-large,top_k_mean,0.2104525781160004,5,graph,37,l2,umap,30,True,True,heuristic,5.0,1.3683791129206433,5,False,True,True,False,False,True,True,0.739728508672805,0.4093542687462606,0.6902455785538121,0.1553598234534609,0.23315606457250732,0.4884117594419098,COMPLETE,,0.0,0
500,0.0,graph,17,root-norm,pca,49,False,True,silhouette,transformer.resblocks.11,ViT-B/32,blocks.7,dinov2_vitb14,layer2,resnet50,semantic,0.006904380840146505,0.8079736568018254,False,200,16,0.9176636789547168,0.9610669065006732,26,2,0.967781800325002,2.219776214664743,facebook/sam2-hiera-large,mean,0.10086652519669217,5,graph,33,z-score,pca,62,False,True,heuristic,,2.509950002256542,3,True,False,False,False,False,True,True,0.7173299267486044,0.5202395705084562,0.5773094549260954,0.09644170865857286,0.9974714529547322,0.8799498041489049,COMPLETE,,0.0,0
501,0.0,graph,27,z-score,svd,46,True,False,heuristic,transformer.resblocks.9,ViT-B/32,blocks.11,dinov2_vitb14,layer1,resnet50,semantic,0.00480802271262392,0.6231141337086414,True,50,8,0.8502984542778294,0.9233048000913056,25,4,1.0283556499911246,2.2849108839345416,facebook/sam2-hiera-large,median,0.21916838887969545,3,kmeans,36,z-score,umap,37,True,False,silhouette,5.0,1.7016789082539456,5,False,True,True,True,True,False,False,0.5244753155836721,0.6582330682397984,0.5132054190069494,0.5779343147787521,0.5987360330052247,0.004103959855773987,COMPLETE,,0.0,0
502,0.0,graph,40,l2,svd,60,False,True,silhouette,transformer.resblocks.11,ViT-B/32,blocks.11,dinov2_vitb14,conv1,resnet50,structural,0.0041574721015809404,0.6776616896358569,False,200,32,0.8969714606548979,0.9711647139992085,28,3,0.5303586893461647,1.5492618271994936,facebook/sam2-hiera-large,mean,0.46741441538695944,3,graph,32,z-score,pca,28,False,True,heuristic,3.0,2.912468086538463,3,True,True,False,False,False,True,True,0.5288366284540164,0.43807371216316576,0.7050903921437085,0.17403038474556898,0.7112973279704776,0.937593938722,COMPLETE,,0.0,0
503,0.0,kmeans,36,z-score,pca,38,True,True,heuristic,transformer.resblocks.10,ViT-B/32,blocks.4,dinov2_vitb14,layer4,resnet50,semantic,0.007413427113092618,0.7982893225525778,True,100,16,0.8153657875111513,0.9388500344365889,30,2,0.6054365293846953,2.5671672065291666,facebook/sam2-hiera-large,mean,0.2721912325644594,5,kmeans,35,root-norm,umap,59,True,False,silhouette,5.0,2.097684259913586,5,False,True,True,True,True,True,False,0.6549715612381692,0.6838647755045183,0.6439880498512792,0.12442666612376704,0.6576259606742781,0.3144408600127255,COMPLETE,,0.0,0
504,0.0,graph,34,z-score,svd,18,True,False,silhouette,transformer.resblocks.11,ViT-B/32,blocks.11,dinov2_vitb14,layer3,resnet50,structural,0.005200253998192299,0.7477835382736612,False,50,8,0.8416298669107631,0.9052631871525592,22,3,0.7831970253617719,1.680959144148758,facebook/sam2-hiera-large,mean,0.2922930519858379,3,graph,39,l2,svd,18,False,True,heuristic,7.0,2.212072334517695,5,True,True,False,False,True,False,True,0.7508823725107467,0.562644258459912,0.5390220836355273,0.3070597272401215,0.9545536252994838,0.07461088384535669,COMPLETE,,0.0,0
505,0.0,graph,39,l2,umap,32,False,True,heuristic,transformer.resblocks.10,ViT-B/32,blocks.7,dinov2_vitb14,layer1,resnet50,semantic,0.002723915610250143,0.6954398098752097,False,200,32,0.882030916756472,0.9727529016669962,16,4,0.8587101733422262,2.7835415933019045,facebook/sam2-hiera-large,top_k_mean,0.15801278748130146,5,kmeans,17,z-score,umap,50,False,True,silhouette,,1.9233216008959262,3,True,False,False,False,False,True,False,0.6654797398612391,0.6237663761077681,0.7493624770248974,0.2545861594739194,0.5191873045517826,0.774660078328691,COMPLETE,,0.0,0
506,0.0,graph,20,root-norm,pca,20,True,False,heuristic,transformer.resblocks.9,ViT-B/32,blocks.4,dinov2_vitb14,layer3,resnet50,semantic,0.00981229163777905,0.8405881656415292,True,100,16,0.8703694626205045,0.927684055947262,26,4,1.0745191753585455,2.4409051631030465,facebook/sam2-hiera-large,median,0.4027601437818045,3,graph,31,z-score,pca,16,True,False,heuristic,3.0,3.147427897441882,5,False,True,True,True,True,False,True,0.6324667597358606,0.6686710709863694,0.7340644757091432,0.016366784831092645,0.0961056921222232,0.26720722986293166,COMPLETE,,0.0,0
507,0.0,kmeans,26,z-score,svd,29,False,True,silhouette,transformer.resblocks.11,ViT-B/32,blocks.11,dinov2_vitb14,layer2,resnet50,structural,0.002476723339145763,0.7284884621973206,False,50,8,0.8231990056538068,0.9416131418195648,17,3,0.7412581002469498,2.1684850028580334,facebook/sam2-hiera-large,mean,0.14903646927812975,3,kmeans,30,z-score,umap,64,False,True,silhouette,3.0,1.0824745195968901,3,True,True,False,False,False,True,False,0.7298637325935688,0.5793902477513773,0.6369272191758718,0.35527734143316214,0.495208484041419,0.9827172400210674,COMPLETE,,0.0,0
492,0.0,graph,33,z-score,svd,44,True,False,silhouette,transformer.resblocks.11,ViT-B/32,blocks.11,dinov2_vitb14,layer1,resnet50,structural,0.0022125853929678943,0.6500547227004477,False,50,8,0.8764822704355617,0.9317173411262571,25,3,0.8281169643131769,2.814488064012833,facebook/sam2-hiera-large,mean,0.3650557251435099,3,kmeans,32,root-norm,svd,46,True,True,silhouette,,3.9204362093636425,5,False,False,False,False,True,False,False,0.5053721412944967,0.7498519314991547,0.6991039552122723,0.16638335036706903,0.2720138014079791,0.32715703499352544,COMPLETE,,0.0,0
493,0.0,graph,38,l2,umap,17,False,True,heuristic,transformer.resblocks.10,ViT-B/32,blocks.4,dinov2_vitb14,layer2,resnet50,semantic,0.004375036568914622,0.6850336580816012,False,100,16,0.864502385535731,0.9370211513502145,23,2,0.6262786836400402,1.9108394414812508,facebook/sam2-hiera-large,mean,0.2813002026399901,5,graph,39,z-score,umap,44,False,False,heuristic,5.0,4.3445721489106655,3,True,True,False,True,False,True,True,0.7358848295087349,0.4964445045341053,0.5968683323959871,0.10889400080463794,0.935680553985692,0.9461381269857219,COMPLETE,,0.0,0
494,0.0,kmeans,16,z-score,pca,40,True,False,heuristic,transformer.resblocks.11,ViT-B/32,blocks.7,dinov2_vitb14,conv1,resnet50,structural,0.007616868600366411,0.8213888978678724,True,200,32,0.9769560452419578,0.9292146813406281,29,4,1.0513818852510226,2.415206438740505,facebook/sam2-hiera-large,top_k_mean,0.2588071874327354,3,kmeans,27,l2,pca,20,True,True,silhouette,3.0,3.0428818049290207,5,False,True,True,False,True,False,False,0.7125487992906189,0.5401421691948848,0.6175277748986266,0.2924892614574533,0.8487967000532324,0.39174339644263445,COMPLETE,,0.0,0
