number,value,params_dino_pipeline.clustering.clusterer.method,params_dino_pipeline.clustering.clusterer.n_neighbors,params_dino_pipeline.clustering.feature_processing.normalizer.method,params_dino_pipeline.clustering.feature_processing.reducer.method,params_dino_pipeline.clustering.feature_processing.reducer.n_components,params_dino_pipeline.clustering.feature_processing.run_normalization,params_dino_pipeline.clustering.feature_processing.run_reduction,params_dino_pipeline.clustering.k_selection.method,params_extractors.clip.layer_name,params_extractors.clip.model_name,params_extractors.dino_v2.layer_name,params_extractors.dino_v2.model_name,params_extractors.resnet.layer_name,params_extractors.resnet.model_name,params_fusion_pipeline.clustering.k_selection.k_source,params_heuristic_settings.filter_params.filter_min_area_perc,params_heuristic_settings.filter_params.nms_iou_threshold,params_heuristic_settings.filter_params.use_nms,params_heuristic_settings.generator_params.min_mask_region_area,params_heuristic_settings.generator_params.points_per_side,params_heuristic_settings.generator_params.pred_iou_thresh,params_heuristic_settings.generator_params.stability_score_thresh,params_heuristic_settings.k_heuristic_formulas.max_k,params_heuristic_settings.k_heuristic_formulas.semantic_base,params_heuristic_settings.k_heuristic_formulas.semantic_scale_factor,params_heuristic_settings.k_heuristic_formulas.structural_multiplier,params_heuristic_settings.sam_model,params_labeler.aggregation_method,params_labeler.aggregation_top_k_perc,params_labeler.top_n_labels,params_resnet_pipeline.clustering.clusterer.method,params_resnet_pipeline.clustering.clusterer.n_neighbors,params_resnet_pipeline.clustering.feature_processing.normalizer.method,params_resnet_pipeline.clustering.feature_processing.reducer.method,params_resnet_pipeline.clustering.feature_processing.reducer.n_components,params_resnet_pipeline.clustering.feature_processing.run_normalization,params_resnet_pipeline.clustering.feature_processing.run_reduction,params_resnet_pipeline.clustering.k_selection.method,params_resnet_pipeline.image_preprocessing.blur_kernel_size,params_resnet_pipeline.image_preprocessing.clahe_clip_limit,params_resnet_pipeline.image_preprocessing.sobel_kernel_size,params_resnet_pipeline.image_preprocessing.use_clahe,params_resnet_pipeline.image_preprocessing.use_gaussian_blur,params_resnet_pipeline.image_preprocessing.use_grayscale,params_resnet_pipeline.image_preprocessing.use_sobel_edges,params_run_dino_pipeline,params_run_fusion_pipeline,params_run_resnet_pipeline,params_validator_settings.final_threshold,params_validator_settings.semantic_threshold,params_validator_settings.structural_threshold,params_validator_settings.weights.clip_confidence,params_validator_settings.weights.dino_iou,params_validator_settings.weights.resnet_iou,state,user_attrs_error,user_attrs_max_clip_confidence,user_attrs_num_correct_segments
764,0.0,graph,11,z-score,pca,34,True,False,heuristic,transformer.resblocks.10,ViT-B/32,blocks.4,dinov2_vitb14,layer1,resnet50,semantic,0.001003823072622805,0.8123112583057612,True,100,16,0.9389332528791212,0.9737251149570403,19,4,0.5939894777138507,2.468032368264225,facebook/sam2-hiera-large,mean,0.1166091854777316,3,graph,30,root-norm,umap,23,False,True,heuristic,,2.0119779423979374,3,True,False,True,False,True,False,True,0.7336378833966389,0.4048157223818058,0.5170486136067781,0.33686211278875083,0.7794688985333301,0.4336918376989405,COMPLETE,,0.0,0
765,0.0,graph,37,z-score,svd,36,True,True,silhouette,transformer.resblocks.11,ViT-B/32,blocks.11,dinov2_vitb14,layer3,resnet50,structural,0.004349492923724605,0.6110374687770576,False,50,8,0.8779624091759797,0.9313253128086854,15,3,1.1404935575140964,2.7158015866066454,facebook/sam2-hiera-large,mean,0.14682123928818802,3,kmeans,35,z-score,svd,48,False,False,silhouette,7.0,3.873302522436196,5,True,True,False,True,True,True,False,0.7479034505278748,0.6385511796409602,0.6719489458365877,0.4898529680103658,0.721133300792613,0.025934564256543932,COMPLETE,,0.0,0
766,0.0,kmeans,13,l2,umap,39,False,True,heuristic,transformer.resblocks.10,ViT-B/32,blocks.7,dinov2_vitb14,layer2,resnet50,semantic,0.002071549243841029,0.6996395834691925,True,200,32,0.950302207288797,0.9217285959913624,29,3,0.9274564641944838,2.5584689987298734,facebook/sam2-hiera-large,top_k_mean,0.386959657413073,5,graph,21,l2,umap,17,True,True,heuristic,5.0,1.886068192468875,5,False,True,True,False,False,True,True,0.7165671587238096,0.664942998699043,0.7017117729541295,0.6381401774553064,0.6275312110999524,0.7537554406650522,COMPLETE,,0.0,0
767,0.0,graph,23,root-norm,svd,49,True,False,silhouette,transformer.resblocks.11,ViT-B/32,blocks.4,dinov2_vitb14,conv1,resnet50,structural,0.005854665234062683,0.8287175455527103,False,100,16,0.9757713369948474,0.9147976562214705,16,4,0.8245643453842632,2.171270575753608,facebook/sam2-hiera-large,mean,0.12599067444083295,3,kmeans,39,z-score,pca,29,False,True,silhouette,3.0,2.1882075341636025,3,True,True,False,False,True,False,False,0.658104284802083,0.7413809549178999,0.6317927638103115,0.04267999415203112,0.9646058668286785,0.1926557407248426,COMPLETE,,0.0,0
768,0.0,graph,37,z-score,pca,32,False,True,heuristic,transformer.resblocks.9,ViT-B/32,blocks.11,dinov2_vitb14,layer1,resnet50,semantic,0.0013322618141190146,0.7992159615969395,False,50,8,0.8696001897515495,0.9493792257673463,25,2,1.1249228229985173,1.5017946928144492,facebook/sam2-hiera-large,median,0.23367455741263468,5,graph,25,z-score,umap,40,True,False,silhouette,,2.443169200218794,5,False,False,False,True,False,True,False,0.5701670581616213,0.6942389506526896,0.6239006200387325,0.1447587911707376,0.7052783662697648,0.3620967794619109,COMPLETE,,0.0,0
769,0.0,graph,32,l2,svd,55,True,False,heuristic,transformer.resblocks.11,ViT-B/32,blocks.11,dinov2_vitb14,layer3,resnet50,semantic,0.0023389902307849124,0.6054385747677807,True,200,32,0.8376763588955835,0.9618491152261658,17,4,0.5344675252204865,2.4258731668632683,facebook/sam2-hiera-large,mean,0.17089145007626383,3,graph,31,z-score,umap,62,False,True,heuristic,3.0,2.6932463382208933,3,True,True,True,False,True,False,True,0.7739139455365072,0.5736326479098867,0.650227036705112,0.4291898404391191,0.5885251595201639,0.6546508859274482,COMPLETE,,0.0,0
770,0.0,kmeans,22,z-score,pca,27,False,True,silhouette,transformer.resblocks.10,ViT-B/32,blocks.4,dinov2_vitb14,layer4,resnet50,structural,0.009661179736704828,0.8418842841996902,False,100,16,0.8546289777915338,0.9171883858101326,26,3,0.754163635225995,2.0653151033385324,facebook/sam2-hiera-large,mean,0.402668707028098,3,kmeans,40,root-norm,pca,26,True,False,silhouette,5.0,4.603314931730966,5,False,True,False,True,False,True,False,0.6458156222333541,0.5236662791626929,0.4147864339654014,0.39968689333378793,0.5095309255675188,0.9649958031759496,COMPLETE,,0.0,0
771,0.0,graph,39,z-score,svd,44,True,True,heuristic,transformer.resblocks.11,ViT-B/32,blocks.11,dinov2_vitb14,layer3,resnet50,semantic,0.00750531961907135,0.6242032675981113,True,50,8,0.8813196599642685,0.9335100618532065,18,4,1.031174615434144,1.6015096313438104,facebook/sam2-hiera-large,top_k_mean,0.35088793012842334,5,graph,36,l2,svd,18,False,True,heuristic,7.0,3.3418802046398244,3,True,True,True,False,True,True,True,0.6261333643615589,0.7073125534988124,0.7291650162549985,0.19265020698131838,0.8048009730191215,0.9975239597244061,COMPLETE,,0.0,0
756,0.0,graph,35,root-norm,umap,31,False,True,heuristic,transformer.resblocks.9,ViT-B/32,blocks.7,dinov2_vitb14,layer1,resnet50,semantic,0.0025059198989777908,0.6716104667716915,False,50,8,0.9085264928435074,0.9604481244368479,26,3,0.9441360350612786,1.6938900651514681,facebook/sam2-hiera-large,mean,0.3448360689491482,5,kmeans,34,z-score,umap,20,False,True,silhouette,3.0,1.6077783326575912,5,True,True,False,False,False,True,False,0.6630276766283986,0.6866916776372692,0.5283307788272327,0.5475340137531293,0.9335631254668508,0.576326467261817,COMPLETE,,0.0,0
757,0.0,kmeans,24,l2,svd,54,True,False,heuristic,transformer.resblocks.11,ViT-B/32,blocks.11,dinov2_vitb14,layer3,resnet50,structural,0.009844663397746934,0.7472302223422821,True,100,16,0.8305503863955944,0.953857246758032,24,2,0.8492089146609478,2.524489718891877,facebook/sam2-hiera-large,median,0.15541670592085186,3,graph,37,z-score,pca,56,True,False,heuristic,7.0,1.9666734435603161,5,False,True,True,True,True,False,True,0.6734186505035975,0.7349342883570442,0.5024841895491873,0.12124144894319293,0.6457841367564816,0.9026361257310228,COMPLETE,,0.0,0
758,0.0,graph,12,z-score,pca,59,False,True,silhouette,transformer.resblocks.10,ViT-B/32,blocks.4,dinov2_vitb14,layer2,resnet50,semantic,0.009360041163738553,0.6556750781959179,False,200,32,0.8958772112654684,0.9585473367718464,25,4,0.8789742975681492,2.355160880202653,facebook/sam2-hiera-large,mean,0.18715925931389737,3,kmeans,39,z-score,umap,54,False,True,silhouette,3.0,2.77130137568743,3,True,True,False,False,False,True,False,0.7629701000691262,0.5988629831556054,0.44276577460531824,0.18159571371886785,0.2699346101582811,0.47204070096318973,COMPLETE,,0.0,0
759,0.0,graph,40,z-score,svd,17,True,False,heuristic,transformer.resblocks.11,ViT-B/32,blocks.11,dinov2_vitb14,layer1,resnet50,semantic,0.007973033271210269,0.8202749395635528,True,50,8,0.9196442011362335,0.9440984553974865,27,4,1.060063759084713,2.2471339477074737,facebook/sam2-hiera-large,mean,0.10598413365440662,5,graph,38,root-norm,svd,60,True,True,silhouette,,1.3440598674066713,5,False,False,True,False,True,False,False,0.6067926633985247,0.5642340620444626,0.6572358831136305,0.36965428299159075,0.4873814676157685,0.7828699885838587,COMPLETE,,0.0,0
760,0.0,graph,15,l2,umap,38,True,True,silhouette,transformer.resblocks.10,ViT-B/32,blocks.4,dinov2_vitb14,conv1,resnet50,structural,0.007239555490410803,0.8068028051962224,False,100,32,0.932295621444,0.9362565081837024,23,3,0.7765129929704602,2.6816930108413564,facebook/sam2-hiera-large,top_k_mean,0.3256355477151084,3,graph,28,l2,umap,64,False,False,heuristic,5.0,2.883178577742599,3,True,True,False,True,True,True,True,0.637331815604187,0.678345983575301,0.6915046492804139,0.2997284201454612,0.830693658800643,0.21893146203625274,COMPLETE,,0.0,0
761,0.0,graph,18,z-score,pca,50,False,True,heuristic,transformer.resblocks.11,ViT-B/32,blocks.7,dinov2_vitb14,layer3,resnet50,semantic,0.0036615861648132235,0.6382589304546881,False,200,16,0.8090157280348287,0.927745384432077,20,3,1.0129093576429107,1.8424695322916655,facebook/sam2-hiera-large,mean,0.2201146084034408,5,kmeans,20,z-score,pca,38,True,True,silhouette,3.0,3.4672770830887067,5,False,True,True,False,False,True,False,0.7109960740243222,0.6300961481113653,0.6184264906131518,0.5801307386963243,0.8715931681484282,0.944482786121606,COMPLETE,,0.0,0
762,0.0,kmeans,16,root-norm,svd,23,True,False,heuristic,transformer.resblocks.11,ViT-B/32,blocks.11,dinov2_vitb14,layer4,resnet50,structural,0.0050813373299006875,0.6484098155809243,True,50,8,0.8591201036798928,0.9198968737487001,22,3,1.1814907115500015,1.5292498239147878,facebook/sam2-hiera-large,median,0.4945646616435593,3,graph,33,z-score,umap,58,False,False,heuristic,5.0,3.6113030235351076,3,True,True,False,True,True,False,True,0.5124848229649153,0.7139659676086395,0.7414410033603085,0.21953327903069839,0.8941327521201411,0.6138978859987574,COMPLETE,,0.0,0
763,0.0,graph,26,l2,svd,42,False,True,silhouette,transformer.resblocks.9,ViT-B/32,blocks.11,dinov2_vitb14,layer3,resnet50,semantic,0.002177569632170422,0.7168201430153663,False,200,32,0.9121220767207461,0.968025309951451,21,2,0.9567511914366282,2.605382489949912,facebook/sam2-hiera-large,mean,0.26967146803753334,5,kmeans,40,z-score,pca,63,True,True,silhouette,3.0,2.545856541768727,5,False,True,False,False,False,True,False,0.6951258582983035,0.6058113051426274,0.6106753170684136,0.27463182488067633,0.16401553339089558,0.8701260602197018,COMPLETE,,0.0,0
748,0.0,graph,10,l2,pca,38,False,True,silhouette,transformer.resblocks.10,ViT-B/32,blocks.4,dinov2_vitb14,layer4,resnet50,structural,0.001648603675309139,0.6596131569437428,False,100,16,0.8032012476989043,0.92423646983882,15,4,1.0382542667215195,2.0132762273728755,facebook/sam2-hiera-large,mean,0.27877913643811203,3,graph,16,root-norm,pca,36,True,True,heuristic,5.0,2.075331259101805,5,False,True,False,False,False,True,True,0.7297033756706972,0.6496554227566184,0.45366716181888733,0.20052585855360394,0.9804572756092216,0.8256797822611274,COMPLETE,,0.0,0
749,0.0,kmeans,37,z-score,svd,51,True,True,heuristic,transformer.resblocks.11,ViT-B/32,blocks.11,dinov2_vitb14,layer3,resnet50,semantic,0.005628209832302913,0.6189377116562587,True,200,32,0.9270290936574818,0.9700608744264417,24,3,0.8683557550576365,2.5927572765746834,facebook/sam2-hiera-large,mean,0.3931612689941919,5,kmeans,23,z-score,svd,35,False,False,silhouette,3.0,3.775062935963221,3,True,True,True,True,True,True,False,0.6882302128147465,0.46393373827594847,0.5652381463378955,0.46101872037587904,0.9071682796208399,0.14598040114255392,COMPLETE,,0.0,0
750,0.0,graph,34,l2,umap,16,True,False,silhouette,transformer.resblocks.11,ViT-B/32,blocks.7,dinov2_vitb14,layer1,resnet50,structural,0.008210376519376898,0.6298763595569695,False,50,8,0.8755813560734487,0.9656971840727033,28,4,0.9121793136783338,2.1492049775347493,facebook/sam2-hiera-large,top_k_mean,0.29239018295256886,3,graph,13,l2,umap,21,True,True,silhouette,7.0,2.259783212344744,5,False,True,False,False,True,False,False,0.7220180027453834,0.7231107712160736,0.6403108844375351,0.25239030612553404,0.6145087089976561,0.05549871341122859,COMPLETE,,0.0,0
751,0.0,graph,39,root-norm,svd,33,False,True,heuristic,transformer.resblocks.10,ViT-B/32,blocks.11,dinov2_vitb14,layer2,resnet50,semantic,0.00895085409062363,0.6921322300812571,False,100,16,0.9008702549388647,0.9410049716592487,27,2,1.1054626947187223,2.637560111651207,facebook/sam2-hiera-large,median,0.2395768129003762,5,graph,31,z-score,pca,53,False,True,heuristic,,4.291212585535454,3,True,False,False,False,False,True,True,0.7444821443293057,0.618377741171832,0.4254957965830075,0.39038133173525824,0.19622678743784894,0.11495036320028384,COMPLETE,,0.0,0
752,0.0,graph,19,z-score,pca,48,True,False,heuristic,transformer.resblocks.9,ViT-B/32,blocks.4,dinov2_vitb14,layer3,resnet50,semantic,0.003952803879080275,0.7642930875931336,True,200,32,0.8850311912381308,0.9716998546863436,28,3,0.7176473487118968,2.111080340916899,facebook/sam2-hiera-large,mean,0.35856983811460147,3,kmeans,40,z-score,umap,16,True,False,silhouette,5.0,3.296276030322742,5,False,True,True,True,True,False,False,0.7015250986826005,0.5015724659152598,0.6051750826252373,0.999087533395175,0.12987622115000566,0.8547823296553994,COMPLETE,,0.0,0
753,0.0,kmeans,20,z-score,svd,35,False,True,silhouette,transformer.resblocks.11,ViT-B/32,blocks.11,dinov2_vitb14,conv1,resnet50,structural,0.004218146532431902,0.7275293986893766,False,50,8,0.8641569053447913,0.9507662298864171,29,4,1.0816784978679923,1.5645948867968527,facebook/sam2-hiera-large,mean,0.20740626658249703,3,graph,27,root-norm,umap,50,False,True,heuristic,3.0,3.1301597303560564,3,True,True,False,False,False,True,True,0.5793610345284083,0.5355242108879166,0.5772890573210508,0.052167865033199,0.8047280011468262,0.975487622822084,COMPLETE,,0.0,0
754,0.0,graph,17,l2,pca,21,True,True,heuristic,transformer.resblocks.10,ViT-B/32,blocks.4,dinov2_vitb14,layer4,resnet50,semantic,0.006674025035395015,0.7822212607511942,True,100,16,0.9576555620902194,0.9555046183709839,30,3,0.6270366574725597,2.4960455550818286,facebook/sam2-hiera-large,mean,0.13586887543284176,5,kmeans,11,z-score,svd,51,True,False,silhouette,5.0,4.735961321312395,5,False,True,True,True,True,True,False,0.5952898409371719,0.6606781166042759,0.6464701993629793,0.15967573286683634,0.7607857510755437,0.8067981546439802,COMPLETE,,0.0,0
755,0.0,graph,28,z-score,svd,41,True,False,silhouette,transformer.resblocks.11,ViT-B/32,blocks.11,dinov2_vitb14,layer3,resnet50,structural,0.004763084466875805,0.6796082822136118,False,200,32,0.8517964734857484,0.9180650021565253,22,3,0.5105211184208519,2.391298953035608,facebook/sam2-hiera-large,top_k_mean,0.3760439266839927,3,graph,24,l2,pca,44,False,True,heuristic,,1.7322071617883454,3,True,False,False,False,True,False,True,0.5496542490824476,0.5491120192775881,0.48034530983430224,0.7421185282111462,0.38202963188408334,0.6981849258688869,COMPLETE,,0.0,0
740,0.0,kmeans,13,root-norm,pca,29,True,False,heuristic,transformer.resblocks.9,ViT-B/32,blocks.7,dinov2_vitb14,layer4,resnet50,structural,0.0030971397766253943,0.6509030697896792,True,50,8,0.8624367905703746,0.9292099470894701,22,3,0.6584291551586864,2.5517081868220806,facebook/sam2-hiera-large,median,0.14987999470234237,3,kmeans,35,z-score,umap,45,False,True,silhouette,5.0,4.1860259710263765,3,True,True,True,False,True,False,False,0.6463292217308092,0.7312980531900573,0.4852740433144175,0.4131943275464845,0.597669312579408,0.9559341155177891,COMPLETE,,0.0,0
741,0.0,graph,18,l2,svd,53,False,True,silhouette,transformer.resblocks.11,ViT-B/32,blocks.11,dinov2_vitb14,layer3,resnet50,semantic,0.007847381944055664,0.6856928087051456,False,200,32,0.8193793538744043,0.9260964287521035,30,3,1.0272325727082559,2.327061678961325,facebook/sam2-hiera-large,mean,0.17214588982436713,3,graph,33,z-score,umap,33,True,False,silhouette,3.0,2.1603697321872746,5,False,True,False,True,False,True,False,0.5585869584052403,0.6681911473230103,0.6786779754146239,0.0006822426522348074,0.30892792809013014,0.6378236320970302,COMPLETE,,0.0,0
742,0.0,graph,40,z-score,pca,40,True,False,heuristic,transformer.resblocks.10,ViT-B/32,blocks.4,dinov2_vitb14,layer1,resnet50,semantic,0.007020895806115143,0.8491556810730506,True,100,16,0.9736463006681297,0.9631162231738915,23,4,1.156237850592676,2.887022878131965,facebook/sam2-hiera-large,mean,0.4686431648740823,5,graph,39,root-norm,pca,31,False,True,heuristic,,4.0183139555329666,3,True,False,True,False,True,False,True,0.7694420674635044,0.5690345770485633,0.5457548103427463,0.7826890463393732,0.8343407951693338,0.6653792216583049,COMPLETE,,0.0,0
743,0.0,graph,38,z-score,svd,62,True,True,silhouette,transformer.resblocks.11,ViT-B/32,blocks.11,dinov2_vitb14,layer3,resnet50,structural,0.007402924567322657,0.6434100245176835,False,200,8,0.8447037446469785,0.9799797746263142,16,3,0.8902157013039714,2.780355913106358,facebook/sam2-hiera-large,mean,0.43346957746999715,3,kmeans,36,z-score,svd,28,True,True,silhouette,7.0,4.5014679390607375,5,False,True,False,False,True,True,False,0.7917103920735313,0.6539066860022914,0.4943438755229868,0.34769344457411744,0.6962342356700142,0.402984014920797,COMPLETE,,0.0,0
744,0.0,kmeans,33,l2,umap,55,False,True,heuristic,transformer.resblocks.11,ViT-B/32,blocks.7,dinov2_vitb14,layer2,resnet50,semantic,0.005945532367672003,0.7533610725125521,False,50,32,0.8562629345636907,0.9758058572369749,21,2,0.9868923194305351,1.949920345626796,facebook/sam2-hiera-large,top_k_mean,0.4825308376238163,5,graph,29,l2,umap,41,False,False,heuristic,5.0,3.6948403789285402,3,True,True,True,True,False,True,True,0.7817727114492711,0.5410232897770152,0.47090804524135005,0.3211101757670629,0.6548963373162696,0.8773412409736315,COMPLETE,,0.0,0
745,0.0,graph,31,z-score,svd,45,True,False,heuristic,transformer.resblocks.10,ViT-B/32,blocks.4,dinov2_vitb14,conv1,resnet50,structural,0.0062985039807796905,0.7074411903424106,True,100,16,0.9690703039093206,0.9384594582244773,25,3,0.6805631937870946,2.741017173488837,facebook/sam2-hiera-large,mean,0.11917998375450041,3,kmeans,37,z-score,pca,42,True,True,silhouette,3.0,2.999848148077095,5,False,True,False,False,True,False,False,0.5062129432184694,0.7018903789935353,0.7148127502355653,0.14012123020659673,0.8603896043761631,0.29698002133260987,COMPLETE,,0.0,0
746,0.0,graph,38,root-norm,pca,20,False,True,silhouette,transformer.resblocks.9,ViT-B/32,blocks.11,dinov2_vitb14,layer1,resnet50,semantic,0.005335410954223991,0.7911477576181558,False,200,32,0.9636327971100246,0.9109152731251047,26,4,1.0509293353366997,2.8318811282002705,facebook/sam2-hiera-large,median,0.3658033905092914,5,graph,22,z-score,umap,63,False,False,heuristic,,1.834752690310637,3,True,False,False,True,False,True,True,0.5299562197187824,0.5200540399063469,0.6970793605082455,0.09657246436918437,0.7270929541438449,0.9181532723012983,COMPLETE,,0.0,0
747,0.0,graph,27,z-score,svd,43,True,False,heuristic,transformer.resblocks.11,ViT-B/32,blocks.11,dinov2_vitb14,layer3,resnet50,semantic,0.002870223415311006,0.8328698360381379,True,50,8,0.8409009057700055,0.934342572788651,20,3,0.5554905633601913,2.2993914177797903,facebook/sam2-hiera-large,mean,0.25795662568678185,3,kmeans,32,z-score,umap,64,False,True,silhouette,3.0,2.342363852459103,5,True,True,True,False,True,False,False,0.7549494042768188,0.7434904054602126,0.5925198413965697,0.6080398349216829,0.5297091861501523,0.5259685803479702,COMPLETE,,0.0,0
796,0.0,kmeans,38,z-score,svd,56,True,False,heuristic,transformer.resblocks.11,ViT-B/32,blocks.11,dinov2_vitb14,layer3,resnet50,structural,0.007305613156224736,0.8363537933320863,True,50,8,0.9293105404507129,0.9442453506217753,27,3,0.8685135394325412,2.0977483237957206,facebook/sam2-hiera-large,mean,0.20591735528820493,3,kmeans,33,z-score,umap,63,False,True,silhouette,5.0,3.512878433438293,3,True,True,True,False,True,False,False,0.5001652313935133,0.6672569766627113,0.653695294683348,0.46764707271757955,0.9999100443482629,0.4605557580415151,COMPLETE,,0.0,0
797,0.0,graph,15,l2,svd,58,False,True,silhouette,transformer.resblocks.11,ViT-B/32,blocks.11,dinov2_vitb14,conv1,resnet50,semantic,0.006550889013445657,0.6275003653573383,False,200,32,0.9539413879748957,0.939624820633556,19,4,0.5539221108716855,2.23922733978546,facebook/sam2-hiera-large,mean,0.3567532509744574,3,graph,40,root-norm,svd,50,True,False,silhouette,3.0,1.589090281567925,5,False,True,False,True,False,True,False,0.6916035995366173,0.5518698062380443,0.6450769246218432,0.29560056736601,0.8086511473038306,0.00024754205346376804,COMPLETE,,0.0,0
