number,value,params_dino_pipeline.clustering.clusterer.method,params_dino_pipeline.clustering.clusterer.n_neighbors,params_dino_pipeline.clustering.feature_processing.normalizer.method,params_dino_pipeline.clustering.feature_processing.reducer.method,params_dino_pipeline.clustering.feature_processing.reducer.n_components,params_dino_pipeline.clustering.feature_processing.run_normalization,params_dino_pipeline.clustering.feature_processing.run_reduction,params_dino_pipeline.clustering.k_selection.method,params_extractors.clip.layer_name,params_extractors.clip.model_name,params_extractors.dino_v2.layer_name,params_extractors.dino_v2.model_name,params_extractors.resnet.layer_name,params_extractors.resnet.model_name,params_fusion_pipeline.clustering.k_selection.k_source,params_heuristic_settings.filter_params.filter_min_area_perc,params_heuristic_settings.filter_params.nms_iou_threshold,params_heuristic_settings.filter_params.use_nms,params_heuristic_settings.generator_params.min_mask_region_area,params_heuristic_settings.generator_params.points_per_side,params_heuristic_settings.generator_params.pred_iou_thresh,params_heuristic_settings.generator_params.stability_score_thresh,params_heuristic_settings.k_heuristic_formulas.max_k,params_heuristic_settings.k_heuristic_formulas.semantic_base,params_heuristic_settings.k_heuristic_formulas.semantic_scale_factor,params_heuristic_settings.k_heuristic_formulas.structural_multiplier,params_heuristic_settings.sam_model,params_labeler.aggregation_method,params_labeler.aggregation_top_k_perc,params_labeler.top_n_labels,params_resnet_pipeline.clustering.clusterer.method,params_resnet_pipeline.clustering.clusterer.n_neighbors,params_resnet_pipeline.clustering.feature_processing.normalizer.method,params_resnet_pipeline.clustering.feature_processing.reducer.method,params_resnet_pipeline.clustering.feature_processing.reducer.n_components,params_resnet_pipeline.clustering.feature_processing.run_normalization,params_resnet_pipeline.clustering.feature_processing.run_reduction,params_resnet_pipeline.clustering.k_selection.method,params_resnet_pipeline.image_preprocessing.blur_kernel_size,params_resnet_pipeline.image_preprocessing.clahe_clip_limit,params_resnet_pipeline.image_preprocessing.sobel_kernel_size,params_resnet_pipeline.image_preprocessing.use_clahe,params_resnet_pipeline.image_preprocessing.use_gaussian_blur,params_resnet_pipeline.image_preprocessing.use_grayscale,params_resnet_pipeline.image_preprocessing.use_sobel_edges,params_run_dino_pipeline,params_run_fusion_pipeline,params_run_resnet_pipeline,params_validator_settings.final_threshold,params_validator_settings.semantic_threshold,params_validator_settings.structural_threshold,params_validator_settings.weights.clip_confidence,params_validator_settings.weights.dino_iou,params_validator_settings.weights.resnet_iou,state,user_attrs_error,user_attrs_max_clip_confidence,user_attrs_num_correct_segments
836,0.0,graph,37,z-score,svd,64,False,True,silhouette,transformer.resblocks.11,ViT-B/32,blocks.11,dinov2_vitb14,layer4,resnet50,semantic,0.006541769237796101,0.7027384067448581,False,200,32,0.8389268049832549,0.9511334300105577,21,2,1.0767979061360236,2.8936432690973155,facebook/sam2-hiera-large,mean,0.3918530487649788,3,graph,14,root-norm,svd,35,False,True,heuristic,7.0,2.3308707704767864,3,True,True,False,False,False,True,True,0.6651138489321667,0.7358256132778798,0.6898670476582327,0.02576195614387898,0.4335343477321477,0.7119718415512446,COMPLETE,,0.0,0
837,0.0,graph,12,l2,umap,55,True,False,heuristic,transformer.resblocks.11,ViT-B/32,blocks.7,dinov2_vitb14,layer1,resnet50,semantic,0.0033924406241006393,0.8106404426303422,True,50,8,0.8760569809380425,0.9799793267351207,27,4,0.8765793420952022,2.655031120274565,facebook/sam2-hiera-large,top_k_mean,0.2849478937772295,5,kmeans,26,l2,umap,55,True,False,silhouette,,3.5023641478370235,5,False,False,True,True,True,False,False,0.7356692695543808,0.505000285418432,0.5246918083546165,0.16260779808655446,0.3877494124884153,0.9105742524057987,COMPLETE,,0.0,0
838,0.0,graph,40,root-norm,svd,50,True,True,silhouette,transformer.resblocks.10,ViT-B/32,blocks.11,dinov2_vitb14,layer3,resnet50,structural,0.0024073097827483963,0.7851337638550546,False,100,16,0.9562169777979594,0.9267276682127815,30,3,0.9600269267003502,1.757553091415308,facebook/sam2-hiera-large,median,0.451452360025752,3,graph,23,z-score,pca,59,False,True,heuristic,5.0,2.4405434340446845,3,True,True,False,False,True,True,True,0.579503801835685,0.5398456186016787,0.7264093299788609,0.5833116214730142,0.6323076090174357,0.8006743900254621,COMPLETE,,0.0,0
839,0.0,kmeans,38,z-score,pca,24,False,True,heuristic,transformer.resblocks.9,ViT-B/32,blocks.4,dinov2_vitb14,layer2,resnet50,semantic,0.004396063910154265,0.7493683793395324,False,200,32,0.9701443703232973,0.9535363902700069,23,4,1.1391953994993382,2.279047372800389,facebook/sam2-hiera-large,mean,0.12191602128312036,5,kmeans,38,z-score,umap,23,True,True,silhouette,3.0,2.2231848458560832,5,True,True,True,False,False,True,False,0.617855651984216,0.7046566686044516,0.5922135761934988,0.9307574422257499,0.9118631123565801,0.6755060890703409,COMPLETE,,0.0,0
840,0.0,graph,21,z-score,svd,57,True,False,heuristic,transformer.resblocks.11,ViT-B/32,blocks.11,dinov2_vitb14,layer3,resnet50,structural,0.007466711159083057,0.6978832791222129,True,50,8,0.8719915395818244,0.9621753334705069,22,3,0.8411096352826377,2.0381510695277774,facebook/sam2-hiera-large,mean,0.4737499916509216,3,graph,10,root-norm,umap,44,False,False,heuristic,3.0,3.188093720019201,5,False,True,False,True,True,False,True,0.6969830867231188,0.5533000749254432,0.5545407963812099,0.4817695112688474,0.7801183899307687,0.22324441465629186,COMPLETE,,0.0,0
841,0.0,graph,16,l2,pca,17,False,True,silhouette,transformer.resblocks.10,ViT-B/32,blocks.4,dinov2_vitb14,layer1,resnet50,semantic,0.0036426326469299504,0.6445647142562309,False,100,16,0.9309845466487046,0.9428635991116325,28,2,1.186478774483698,1.7125667320477138,facebook/sam2-hiera-large,mean,0.3998806293773004,5,kmeans,19,z-score,svd,57,False,True,silhouette,,2.9430204702409695,3,True,False,False,False,False,True,False,0.5676844940859348,0.635578352315855,0.4565196869921307,0.24625353599872157,0.35739308045783513,0.30557446273750194,COMPLETE,,0.0,0
842,0.0,graph,22,z-score,svd,47,True,False,heuristic,transformer.resblocks.11,ViT-B/32,blocks.11,dinov2_vitb14,conv1,resnet50,semantic,0.009703979507354132,0.8459877284753244,True,200,32,0.9798429791865498,0.9688549903626187,20,4,1.001241664942496,2.34724930282127,facebook/sam2-hiera-large,top_k_mean,0.2516271070899651,3,graph,30,l2,pca,18,True,False,heuristic,5.0,2.8311464318496355,5,False,True,True,True,True,False,True,0.771187215411732,0.5604851655791016,0.6133843187079189,0.21912960762997713,0.3177812168767523,0.9817683105662773,COMPLETE,,0.0,0
843,0.0,kmeans,25,root-norm,umap,61,False,True,silhouette,transformer.resblocks.9,ViT-B/32,blocks.7,dinov2_vitb14,layer4,resnet50,structural,0.002111699443090833,0.7915310243825121,False,50,8,0.8524224345348688,0.9092987462354181,26,3,0.9752612846442605,2.2203314289471066,facebook/sam2-hiera-large,mean,0.15233971367271992,3,kmeans,36,z-score,umap,45,False,True,silhouette,3.0,1.7523454557235376,3,True,True,False,False,False,True,False,0.7593547531630952,0.4000421215081046,0.6341625180417478,0.18648430179377745,0.6583469748145547,0.516810850493899,COMPLETE,,0.0,0
60,0.0,kmeans,10,l2,pca,19,True,True,heuristic,transformer.resblocks.9,ViT-B/32,blocks.7,dinov2_vitb14,layer1,resnet50,semantic,0.0035049103150451262,0.730573858332928,False,200,8,0.8552939065254351,0.9328812715797955,22,4,0.7546930688334681,2.5697472560568904,facebook/sam2-hiera-large,median,0.1868094012472737,3,kmeans,38,l2,umap,29,True,False,heuristic,3.0,3.5806756463776748,3,False,True,False,True,True,True,False,0.575601562342206,0.6910136897554623,0.6572369130070548,0.17002599738453755,0.9029256596934618,0.7365523190447523,COMPLETE,,0.0,0
61,0.0,graph,31,z-score,pca,58,True,False,heuristic,transformer.resblocks.10,ViT-B/32,blocks.7,dinov2_vitb14,layer1,resnet50,semantic,0.008072448372785182,0.6047178124076065,True,200,8,0.902299940137275,0.9015922586631063,20,4,1.04902527486063,1.5883747194293139,facebook/sam2-hiera-large,mean,0.31024071734227704,3,kmeans,17,z-score,svd,21,False,True,heuristic,7.0,1.6811917935460206,3,True,True,False,False,True,False,False,0.527687139892313,0.6465981362427715,0.4285302959285699,0.6170789661475761,0.1682504738386271,0.13850707245884428,COMPLETE,,0.0,0
62,0.0,graph,34,z-score,pca,62,True,False,heuristic,transformer.resblocks.10,ViT-B/32,blocks.7,dinov2_vitb14,layer1,resnet50,semantic,0.009457458731061378,0.6831230182620713,True,200,8,0.9292702814337432,0.9035131363959521,24,4,0.9363395399706375,1.7254894545909267,facebook/sam2-hiera-large,mean,0.3770973530976792,3,kmeans,24,z-score,svd,64,False,True,heuristic,7.0,1.141119913902605,3,True,True,False,False,True,False,False,0.6202044813358963,0.7372745506620378,0.41475734981094803,0.5897688114807487,0.27213761987796115,0.4405492807742901,COMPLETE,,0.0,0
63,0.0,graph,38,z-score,pca,53,True,False,heuristic,transformer.resblocks.10,ViT-B/32,blocks.7,dinov2_vitb14,layer1,resnet50,semantic,0.0065425712143441376,0.7606105703171298,True,200,8,0.8953151693601763,0.915390524203939,22,4,0.8270518009325851,2.9965544206077666,facebook/sam2-hiera-large,mean,0.40665975017474626,3,kmeans,10,z-score,svd,25,False,True,heuristic,7.0,1.3801858363628512,3,True,True,False,False,True,False,False,0.5391757854762099,0.5515366632889283,0.46802002671421145,0.6544333085077069,0.18787644426195285,0.8882747045796798,COMPLETE,,0.0,0
64,0.0,graph,27,z-score,svd,33,True,False,heuristic,transformer.resblocks.10,ViT-B/32,blocks.7,dinov2_vitb14,layer3,resnet50,semantic,0.008657106348345298,0.7115647565215303,True,200,8,0.9411342736329019,0.910533423230876,23,4,0.9997543997514022,1.7219515646221242,facebook/sam2-hiera-large,mean,0.17037156245091314,5,kmeans,14,z-score,svd,18,False,True,heuristic,5.0,3.1696996766330807,3,True,True,False,False,True,False,True,0.6074215361848182,0.5707155746406903,0.440284792908722,0.4777247299633842,0.3633359745366043,0.24885700737204275,COMPLETE,,0.0,0
65,0.0,graph,36,z-score,pca,30,True,False,heuristic,transformer.resblocks.10,ViT-B/32,blocks.11,dinov2_vitb14,layer1,resnet50,semantic,0.002979335657872004,0.7394687883762261,True,200,32,0.8664806246991746,0.9188310287894448,21,4,0.6553886501781137,1.651158949572403,facebook/sam2-hiera-large,top_k_mean,0.3437301420933628,3,graph,15,z-score,umap,48,False,False,heuristic,7.0,2.118299271263226,3,True,True,False,True,True,True,False,0.5532993511182094,0.5950912746724817,0.5786786022970581,0.5533055289543202,0.6525986183738972,0.1735054921545372,COMPLETE,,0.0,0
66,0.0,graph,29,l2,svd,39,True,True,silhouette,transformer.resblocks.11,ViT-B/32,blocks.7,dinov2_vitb14,layer4,resnet50,semantic,0.0073779610069947205,0.7023954089295643,True,50,16,0.9231452539635409,0.9000569129522329,29,3,0.864270529891555,1.8405966879303006,facebook/sam2-hiera-large,mean,0.23793271125539744,3,graph,36,root-norm,svd,16,True,True,silhouette,3.0,2.553926876237367,5,True,True,True,False,True,False,False,0.5169421521135802,0.7104665675667169,0.6939701791189511,0.04659665289114706,0.1054469055561651,0.6446207200788587,COMPLETE,,0.0,0
67,0.0,kmeans,40,z-score,pca,24,False,True,heuristic,transformer.resblocks.11,ViT-B/32,blocks.11,dinov2_vitb14,layer3,resnet50,structural,0.002123548682132723,0.651134059518192,False,100,8,0.883859746918095,0.907382792117845,26,4,0.7361667475430808,2.4150527817374923,facebook/sam2-hiera-large,top_k_mean,0.3590263494864873,5,kmeans,12,z-score,pca,24,False,False,heuristic,,1.7305227183596459,3,False,False,False,True,False,True,True,0.5830613110676766,0.6494860525068026,0.6464197836618468,0.7290029028300271,0.9704450057957761,0.5529351475467001,COMPLETE,,0.0,0
52,0.0,graph,40,z-score,umap,50,False,True,silhouette,transformer.resblocks.11,ViT-B/32,blocks.11,dinov2_vitb14,layer1,resnet50,semantic,0.009406333419668393,0.6372237365815312,True,50,16,0.8199312117972526,0.925256561750857,16,2,0.6096122576969644,2.523545892853631,facebook/sam2-hiera-large,median,0.32753477630978567,3,kmeans,16,l2,svd,19,False,False,heuristic,3.0,1.825150155110718,5,True,True,False,False,False,False,False,0.530233274603622,0.5687797625389077,0.5154865829834049,0.48518347271701334,0.36569844112324357,0.1967574185188814,COMPLETE,,0.0,0
53,0.0,graph,39,z-score,umap,54,False,True,silhouette,transformer.resblocks.11,ViT-B/32,blocks.11,dinov2_vitb14,layer1,resnet50,semantic,0.008201075370759673,0.7242597139080006,True,50,16,0.8724525877170148,0.9124671618474209,18,2,0.8532771973860312,2.2987880332936474,facebook/sam2-hiera-large,median,0.26310359283985324,3,kmeans,22,l2,svd,33,False,False,heuristic,3.0,3.4643811624747003,5,True,True,False,False,False,False,False,0.5158682183325548,0.5469056885000092,0.43897529214081665,0.43306353640528106,0.2571523943022872,0.13630817119856414,COMPLETE,,0.0,0
54,0.0,graph,36,z-score,umap,49,False,True,heuristic,transformer.resblocks.11,ViT-B/32,blocks.11,dinov2_vitb14,layer3,resnet50,semantic,0.008891905503736997,0.7540036313475655,False,50,16,0.8018843662890538,0.9053236307297635,28,2,1.1212215835565953,2.3807155145209293,facebook/sam2-hiera-large,median,0.29769718787451716,3,kmeans,39,root-norm,pca,26,False,False,heuristic,3.0,2.1393636535708844,5,True,True,True,False,False,False,False,0.5485772557628503,0.5821715590670967,0.5366750313107306,0.946231133909339,0.08706120830687553,0.01515642428004653,COMPLETE,,0.0,0
55,0.0,graph,37,z-score,svd,47,True,True,silhouette,transformer.resblocks.11,ViT-B/32,blocks.11,dinov2_vitb14,layer1,resnet50,semantic,0.009948617701391917,0.7372901652896617,True,100,16,0.898623659904573,0.9369776367024376,30,4,0.644344633537293,2.108362074346722,facebook/sam2-hiera-large,mean,0.3637204893114376,3,kmeans,12,l2,svd,39,False,True,silhouette,3.0,2.322681372412498,5,True,True,False,False,False,True,False,0.6749975450950249,0.6104631770808112,0.6723217792991655,0.3775507556824815,0.7999340988320505,0.259212331832739,COMPLETE,,0.0,0
56,0.0,graph,35,z-score,svd,64,False,True,heuristic,transformer.resblocks.10,ViT-B/32,blocks.4,dinov2_vitb14,layer3,resnet50,structural,0.007553999065174526,0.8390059824447911,False,50,32,0.8361488021224562,0.9622727464116329,27,2,0.5502319934892653,2.686456436982983,facebook/sam2-hiera-large,median,0.4251951042681312,5,graph,40,z-score,umap,36,False,False,heuristic,3.0,1.550112602103101,5,True,True,False,True,False,False,True,0.5887591397101118,0.6337306253075733,0.5012377206345201,0.6835160489303326,0.8654015652857371,0.9973208746473158,COMPLETE,,0.0,0
57,0.0,graph,33,l2,pca,36,True,True,silhouette,transformer.resblocks.11,ViT-B/32,blocks.11,dinov2_vitb14,layer2,resnet50,semantic,0.00431275194875676,0.694971724565972,True,200,8,0.820006000325257,0.9544165463118096,25,4,0.7977421330658672,1.929967264387145,facebook/sam2-hiera-large,mean,0.21238187880572393,3,kmeans,34,z-score,pca,23,False,True,silhouette,,2.7781759095008276,3,True,False,False,False,True,True,False,0.7489302462648879,0.5236126594195469,0.7053888220484114,0.5393123466976012,0.48633849928318884,0.07264678933031987,COMPLETE,,0.0,0
58,0.0,graph,28,z-score,umap,56,True,False,heuristic,transformer.resblocks.10,ViT-B/32,blocks.11,dinov2_vitb14,conv1,resnet50,semantic,0.00708550667198621,0.7141631115713543,False,50,16,0.8850150831192111,0.9690564367880413,15,4,0.7547381577061976,2.8243104955255007,facebook/sam2-hiera-large,mean,0.13368170319804717,5,graph,21,z-score,umap,43,True,False,heuristic,7.0,3.035393646012037,5,False,True,True,True,True,True,True,0.5052875946859391,0.6757532127335413,0.6077164780579162,0.12121961879014773,0.756983598281562,0.6060443127080656,COMPLETE,,0.0,0
59,0.0,graph,39,root-norm,svd,61,False,True,silhouette,transformer.resblocks.11,ViT-B/32,blocks.4,dinov2_vitb14,layer4,resnet50,structural,0.0024628657596972503,0.6616710726234284,True,100,32,0.915241764338344,0.9234117960255739,15,2,0.6997799973059721,2.4999209824095745,facebook/sam2-hiera-large,mean,0.33486525724722077,3,graph,30,z-score,pca,18,False,True,silhouette,5.0,1.8860282250731029,5,True,True,False,False,False,False,False,0.5128058150341184,0.504815082766603,0.4815383230118335,0.28312692194288047,0.5339185343031734,0.400302590421311,COMPLETE,,0.0,0
44,0.0,kmeans,23,l2,svd,27,True,False,silhouette,transformer.resblocks.11,ViT-B/32,blocks.4,dinov2_vitb14,layer3,resnet50,structural,0.008297288504488229,0.7963301849676052,False,100,8,0.9203701574302083,0.9723523951742498,27,3,0.7498565469195575,2.6599976338991254,facebook/sam2-hiera-large,mean,0.4465304230832433,3,kmeans,10,z-score,pca,53,True,True,silhouette,,1.1799085483160383,3,False,False,True,False,True,False,False,0.738608117967745,0.6679582738115974,0.4976090461715243,0.05466957039184672,0.3327247077641518,0.7904888706960932,COMPLETE,,0.0,0
45,0.0,graph,28,root-norm,svd,26,False,False,heuristic,transformer.resblocks.9,ViT-B/32,blocks.11,dinov2_vitb14,layer3,resnet50,structural,0.002150807228095805,0.7689122565439886,True,200,32,0.8592849397977587,0.9074162959850149,24,4,0.5047777405075758,2.834823712356796,facebook/sam2-hiera-large,median,0.3471535223722098,5,graph,23,l2,umap,36,True,True,heuristic,,1.683764943350368,3,False,False,False,False,True,False,True,0.5710387631521203,0.7163548352044359,0.41955753016247826,0.28524795764536415,0.8268408283082089,0.8356821110966572,COMPLETE,,0.0,0
46,0.0,graph,18,z-score,pca,23,True,False,silhouette,transformer.resblocks.11,ViT-B/32,blocks.4,dinov2_vitb14,layer1,resnet50,structural,0.0012142656193704035,0.6741562559039582,False,100,8,0.8110011322649802,0.9185955476870385,21,3,0.6297980293465244,2.353262907223599,facebook/sam2-hiera-large,mean,0.13129694094566668,3,kmeans,39,root-norm,umap,62,True,True,silhouette,7.0,2.5321794424650292,5,True,True,True,False,False,True,False,0.7218804856560959,0.7336579328946696,0.6281331506868283,0.6187987586843942,0.5934444488237285,0.9006077155617047,COMPLETE,,0.0,0
47,0.0,kmeans,13,l2,svd,46,True,True,heuristic,transformer.resblocks.11,ViT-B/32,blocks.11,dinov2_vitb14,conv1,resnet50,semantic,0.008497193018119416,0.6604243492031897,False,200,32,0.9610323959367609,0.9251810821517682,29,4,0.6880722544949651,2.734921482309694,facebook/sam2-hiera-large,top_k_mean,0.24891800367967498,5,graph,14,z-score,umap,50,False,True,heuristic,,4.1123495376874475,3,False,False,False,False,True,False,True,0.5390573446055453,0.6972774251948477,0.5886110445325751,0.012051990119123668,0.6615627465129781,0.76269242986549,COMPLETE,,0.0,0
48,0.0,graph,17,z-score,umap,41,False,False,silhouette,transformer.resblocks.10,ViT-B/32,blocks.7,dinov2_vitb14,layer2,resnet50,semantic,0.0075412082328516015,0.8212205347321561,True,200,8,0.8301467571711106,0.9332662339919718,20,3,1.1917522886087988,2.6054316239076103,facebook/sam2-hiera-large,mean,0.39159564227976323,3,graph,35,z-score,pca,57,True,True,silhouette,3.0,3.3128915218425923,5,False,True,True,False,False,True,False,0.7822078378793413,0.749411075002641,0.7363192489517189,0.3425171952319447,0.015923580931019754,0.6895846826843065,COMPLETE,,0.0,0
49,0.0,graph,39,root-norm,svd,39,True,True,heuristic,transformer.resblocks.9,ViT-B/32,blocks.11,dinov2_vitb14,layer3,resnet50,structural,0.005812167859495131,0.7783331820449824,False,100,32,0.9522006091579329,0.9111362706461242,26,4,0.8277516713125206,2.916927238177674,facebook/sam2-hiera-large,mean,0.47826141123626476,5,kmeans,20,z-score,svd,62,False,True,heuristic,5.0,2.0051245920415877,3,True,True,False,True,True,False,True,0.6400452785502555,0.5002711369951965,0.4567917840028834,0.20341942692480547,0.9488162034414428,0.9557099178789019,COMPLETE,,0.0,0
50,0.0,kmeans,19,l2,pca,44,False,False,silhouette,transformer.resblocks.11,ViT-B/32,blocks.4,dinov2_vitb14,layer4,resnet50,semantic,0.005186071859248004,0.6188022819709298,True,50,16,0.8505172949090404,0.979555297526234,23,3,1.0212351743661634,2.246928453793968,facebook/sam2-hiera-large,top_k_mean,0.19051724746483653,3,graph,37,l2,umap,54,True,False,silhouette,3.0,2.3782605390503053,5,False,True,False,False,True,True,False,0.6983602620448877,0.5955485530670259,0.4807105449134842,0.7636540548740396,0.725476344778711,0.3114527852514074,COMPLETE,,0.0,0
51,0.0,graph,37,z-score,umap,52,False,True,silhouette,transformer.resblocks.11,ViT-B/32,blocks.11,dinov2_vitb14,layer1,resnet50,semantic,0.009804459869099225,0.7046316657114354,True,50,16,0.8398296606728287,0.9174533019195958,17,2,0.7244516624480956,2.4385002706577352,facebook/sam2-hiera-large,median,0.27933560906241683,3,kmeans,13,l2,svd,30,False,False,heuristic,3.0,2.646375873838227,5,True,True,False,False,False,False,False,0.5002208179788824,0.5342515958103222,0.5565819249522646,0.5815624936952999,0.21849460127486692,0.09781798446414905,COMPLETE,,0.0,0
36,0.0,graph,38,z-score,pca,49,False,True,silhouette,transformer.resblocks.10,ViT-B/32,blocks.11,dinov2_vitb14,layer1,resnet50,structural,0.003328883808600679,0.6195825565091558,True,200,32,0.9236706642089498,0.9081635805021239,29,4,0.6694735931177737,1.9992062076375876,facebook/sam2-hiera-large,mean,0.3492113925351955,3,graph,19,l2,svd,49,False,True,heuristic,5.0,1.8487185506909047,3,True,True,False,False,True,True,False,0.6605560025148048,0.5622174290172228,0.6637474659271468,0.4228560217069212,0.4530538721328963,0.5737667393006538,COMPLETE,,0.0,0
37,0.0,kmeans,15,l2,svd,22,True,False,heuristic,transformer.resblocks.11,ViT-B/32,blocks.7,dinov2_vitb14,layer4,resnet50,semantic,0.001643394217181591,0.7186391093163069,True,50,8,0.8898443688583347,0.916095889347716,23,2,0.5983869620855974,2.356397506459279,facebook/sam2-hiera-large,median,0.40696318025417805,3,kmeans,35,z-score,umap,22,True,False,silhouette,3.0,2.4526168961466834,3,False,True,False,True,False,False,False,0.7719726662052768,0.4437229026344098,0.4462495466917379,0.5623386541840698,0.678159316151865,0.9458362806705917,COMPLETE,,0.0,0
