number,value,params_dino_pipeline.clustering.clusterer.method,params_dino_pipeline.clustering.clusterer.n_neighbors,params_dino_pipeline.clustering.feature_processing.normalizer.method,params_dino_pipeline.clustering.feature_processing.reducer.method,params_dino_pipeline.clustering.feature_processing.reducer.n_components,params_dino_pipeline.clustering.feature_processing.run_normalization,params_dino_pipeline.clustering.feature_processing.run_reduction,params_dino_pipeline.clustering.k_selection.method,params_extractors.clip.layer_name,params_extractors.clip.model_name,params_extractors.dino_v2.layer_name,params_extractors.dino_v2.model_name,params_extractors.resnet.layer_name,params_extractors.resnet.model_name,params_fusion_pipeline.clustering.k_selection.k_source,params_heuristic_settings.filter_params.filter_min_area_perc,params_heuristic_settings.filter_params.nms_iou_threshold,params_heuristic_settings.filter_params.use_nms,params_heuristic_settings.generator_params.min_mask_region_area,params_heuristic_settings.generator_params.points_per_side,params_heuristic_settings.generator_params.pred_iou_thresh,params_heuristic_settings.generator_params.stability_score_thresh,params_heuristic_settings.k_heuristic_formulas.max_k,params_heuristic_settings.k_heuristic_formulas.semantic_base,params_heuristic_settings.k_heuristic_formulas.semantic_scale_factor,params_heuristic_settings.k_heuristic_formulas.structural_multiplier,params_heuristic_settings.sam_model,params_labeler.aggregation_method,params_labeler.aggregation_top_k_perc,params_labeler.top_n_labels,params_resnet_pipeline.clustering.clusterer.method,params_resnet_pipeline.clustering.clusterer.n_neighbors,params_resnet_pipeline.clustering.feature_processing.normalizer.method,params_resnet_pipeline.clustering.feature_processing.reducer.method,params_resnet_pipeline.clustering.feature_processing.reducer.n_components,params_resnet_pipeline.clustering.feature_processing.run_normalization,params_resnet_pipeline.clustering.feature_processing.run_reduction,params_resnet_pipeline.clustering.k_selection.method,params_resnet_pipeline.image_preprocessing.blur_kernel_size,params_resnet_pipeline.image_preprocessing.clahe_clip_limit,params_resnet_pipeline.image_preprocessing.sobel_kernel_size,params_resnet_pipeline.image_preprocessing.use_clahe,params_resnet_pipeline.image_preprocessing.use_gaussian_blur,params_resnet_pipeline.image_preprocessing.use_grayscale,params_resnet_pipeline.image_preprocessing.use_sobel_edges,params_run_dino_pipeline,params_run_fusion_pipeline,params_run_resnet_pipeline,params_validator_settings.final_threshold,params_validator_settings.semantic_threshold,params_validator_settings.structural_threshold,params_validator_settings.weights.clip_confidence,params_validator_settings.weights.dino_iou,params_validator_settings.weights.resnet_iou,state,user_attrs_error,user_attrs_max_clip_confidence,user_attrs_num_correct_segments
682,0.0,graph,34,l2,svd,36,True,True,silhouette,transformer.resblocks.11,ViT-B/32,blocks.11,dinov2_vitb14,layer1,resnet50,structural,0.0030147336581114134,0.6651355423767543,False,200,32,0.8570918765491612,0.9265016373757501,20,3,1.0599385188491175,1.5830384751430853,facebook/sam2-hiera-large,mean,0.3814669883782202,3,kmeans,33,z-score,umap,53,False,False,silhouette,,4.802933802642758,3,True,False,False,True,True,False,False,0.6990158155527884,0.575629452611801,0.5831700098480698,0.17289869547813452,0.488564953562447,0.9193872266011293,COMPLETE,,0.0,0
683,0.0,graph,13,z-score,pca,54,False,True,heuristic,transformer.resblocks.10,ViT-B/32,blocks.4,dinov2_vitb14,layer3,resnet50,semantic,0.007727451030778914,0.8449377553622105,False,100,16,0.9711489209020674,0.9412741873240273,24,4,0.8544864408357435,2.6201526236067463,facebook/sam2-hiera-large,mean,0.42988526626335327,5,graph,38,root-norm,pca,46,True,True,heuristic,3.0,4.675461066591832,5,False,True,False,False,False,True,True,0.7346507346488097,0.6925314032557742,0.6249118668231134,0.5462223784245774,0.8252222769163942,0.4643651309188898,COMPLETE,,0.0,0
732,0.0,graph,22,l2,svd,26,True,True,heuristic,transformer.resblocks.10,ViT-B/32,blocks.4,dinov2_vitb14,layer4,resnet50,semantic,0.009642883769693694,0.6944554248402058,True,200,32,0.9796425098298576,0.9062229858314599,26,4,0.6412761190721357,1.6334504947803703,facebook/sam2-hiera-large,mean,0.3362683688016842,5,graph,39,root-norm,svd,17,True,True,silhouette,5.0,2.929934146755445,5,False,True,True,False,True,True,False,0.7132451026161352,0.5897821385764904,0.5717028222395465,0.2114486303735462,0.7517377627040445,0.9361092589977766,COMPLETE,,0.0,0
733,0.0,graph,19,z-score,pca,25,True,False,silhouette,transformer.resblocks.11,ViT-B/32,blocks.11,dinov2_vitb14,layer3,resnet50,structural,0.002279363825542239,0.6656026611742528,False,100,16,0.8499405554046423,0.9482253780372949,19,2,0.5179107277237287,1.9796460159095524,facebook/sam2-hiera-large,top_k_mean,0.1830504657656949,3,graph,28,l2,pca,62,False,False,heuristic,,1.9542591639708573,3,True,False,False,True,True,False,True,0.5890303597585185,0.5297735327347343,0.625927603693228,0.024563949522072876,0.9552755341482139,0.44736571532082753,COMPLETE,,0.0,0
734,0.0,graph,21,root-norm,umap,56,False,True,heuristic,transformer.resblocks.11,ViT-B/32,blocks.7,dinov2_vitb14,layer1,resnet50,semantic,0.001984087842326483,0.7725342182025943,False,50,8,0.8926517664241869,0.9206921077713576,27,3,0.7924031699716714,2.049116035410086,facebook/sam2-hiera-large,mean,0.16318390668372873,5,kmeans,36,z-score,umap,39,True,True,silhouette,3.0,3.092206114682127,5,False,True,False,False,False,True,False,0.5392225771009965,0.6829774204130636,0.5999122419409416,0.15004810742463864,0.5696165061626833,0.5015636804739814,COMPLETE,,0.0,0
735,0.0,graph,11,l2,svd,50,True,False,heuristic,transformer.resblocks.9,ViT-B/32,blocks.11,dinov2_vitb14,layer3,resnet50,semantic,0.004129237637303676,0.701935911848707,True,200,32,0.8345534710994648,0.9614392452653105,24,3,0.9594681809884239,1.5352526025350837,facebook/sam2-hiera-large,median,0.3157095052480364,3,graph,30,z-score,umap,47,False,True,heuristic,7.0,1.533463096126951,3,True,True,True,False,True,False,True,0.7050680761367534,0.4925671006827125,0.509558510623044,0.5692837023527957,0.007497496443236098,0.17322201679753124,COMPLETE,,0.0,0
736,0.0,kmeans,32,z-score,pca,47,False,True,silhouette,transformer.resblocks.10,ViT-B/32,blocks.4,dinov2_vitb14,layer2,resnet50,structural,0.0012165286115254127,0.6045112141741401,False,100,16,0.826266213353922,0.952806309112692,25,4,0.6942022419218563,2.5046513133043486,facebook/sam2-hiera-large,mean,0.2517539679357136,3,kmeans,27,z-score,pca,61,True,False,silhouette,3.0,4.850538288714595,5,False,True,False,True,False,True,False,0.6317058140281264,0.5117729686294401,0.6622798128303996,0.17228826179170864,0.4046778072334061,0.2630466986140433,COMPLETE,,0.0,0
737,0.0,graph,37,z-score,svd,18,True,True,heuristic,transformer.resblocks.11,ViT-B/32,blocks.11,dinov2_vitb14,layer1,resnet50,semantic,0.007644215028952101,0.7245413634344492,True,50,8,0.8874437511022444,0.9156198345734657,29,2,0.9217419336881892,1.7333407411677304,facebook/sam2-hiera-large,mean,0.2005090502256737,5,graph,17,root-norm,umap,59,False,True,heuristic,5.0,2.492293846526312,5,True,True,True,False,True,True,True,0.5186991526862038,0.5558371052363239,0.6350977988811018,0.28420234616239093,0.7862509271989756,0.342160587029785,COMPLETE,,0.0,0
738,0.0,graph,36,l2,umap,60,True,False,silhouette,transformer.resblocks.10,ViT-B/32,blocks.4,dinov2_vitb14,conv1,resnet50,structural,0.0034556990105459075,0.8403635917235284,False,200,32,0.8676099852566483,0.9568591790214307,28,3,0.8141477249118344,2.432539275092462,facebook/sam2-hiera-large,mean,0.4188404713633075,3,kmeans,32,z-score,svd,24,False,False,silhouette,,1.2791016109102458,3,True,False,False,True,True,False,False,0.7996463025208027,0.6400171580495958,0.738236477700732,0.5094843581035711,0.35621467999409656,0.7350032871064401,COMPLETE,,0.0,0
739,0.0,graph,29,z-score,svd,52,False,True,heuristic,transformer.resblocks.11,ViT-B/32,blocks.11,dinov2_vitb14,layer3,resnet50,semantic,0.004555786787721217,0.7363466038362214,False,100,16,0.8733397340026261,0.9457257816312425,18,4,0.741967630824361,2.473661467543325,facebook/sam2-hiera-large,top_k_mean,0.4554073598675718,5,graph,38,l2,pca,56,True,True,heuristic,3.0,3.184561320533912,5,False,True,False,False,False,True,True,0.6157751126285547,0.44526600494246715,0.7044953692343395,0.9274744331045245,0.9999553818376332,0.08595332329681561,COMPLETE,,0.0,0
724,0.0,graph,15,root-norm,pca,57,False,True,silhouette,transformer.resblocks.9,ViT-B/32,blocks.4,dinov2_vitb14,layer4,resnet50,semantic,0.0014442327201036494,0.8029316550070809,False,200,32,0.8370307525322769,0.9091605248591424,20,3,0.6128564292508849,2.7125193878453744,facebook/sam2-hiera-large,median,0.24429887833539035,3,graph,37,z-score,umap,54,False,True,heuristic,3.0,3.3328952583460816,3,True,True,False,False,False,True,True,0.7238382440290333,0.624239914485033,0.6521830239391773,0.3081798631690749,0.8451305125883932,0.680065402541062,COMPLETE,,0.0,0
725,0.0,graph,24,z-score,svd,54,True,False,heuristic,transformer.resblocks.11,ViT-B/32,blocks.11,dinov2_vitb14,layer3,resnet50,semantic,0.005144066829612376,0.6100194828255809,True,50,8,0.843232306050013,0.9040034599663644,25,3,0.534470585892888,2.278692679363589,facebook/sam2-hiera-large,mean,0.12429214821272867,5,kmeans,12,z-score,umap,63,True,False,silhouette,,1.1320289756562223,5,False,False,True,True,True,False,False,0.5008623260483057,0.457552952597676,0.6858620381833357,0.5413587530112453,0.43390012262595823,0.8358639728394294,COMPLETE,,0.0,0
726,0.0,graph,16,l2,svd,64,True,True,silhouette,transformer.resblocks.10,ViT-B/32,blocks.4,dinov2_vitb14,layer1,resnet50,structural,0.006787204772632861,0.7420138580954692,False,100,16,0.9552861237923139,0.9643311810894704,23,4,0.5767998681444869,2.577311316000169,facebook/sam2-hiera-large,mean,0.2171915880595233,3,graph,40,root-norm,pca,58,False,True,heuristic,5.0,3.565577707627915,3,True,True,False,False,True,True,True,0.697275972149451,0.6742506180683668,0.5834701279227908,0.06970212074489672,0.7380214068889902,0.5565718006708277,COMPLETE,,0.0,0
727,0.0,kmeans,40,z-score,pca,24,False,True,heuristic,transformer.resblocks.11,ViT-B/32,blocks.11,dinov2_vitb14,layer3,resnet50,semantic,0.004444761307358035,0.8165076756622829,False,200,32,0.870439369225339,0.9188357220922284,17,2,0.7622271275251287,2.203670751623027,facebook/sam2-hiera-large,mean,0.37880335835078044,5,kmeans,30,z-score,svd,30,True,True,silhouette,3.0,2.610171468279799,5,True,True,True,False,False,True,False,0.7373290967719902,0.7370519481266845,0.7277570414472759,0.4439977590282953,0.8803664842728602,0.9812742279399127,COMPLETE,,0.0,0
728,0.0,graph,39,l2,umap,31,True,False,heuristic,transformer.resblocks.11,ViT-B/32,blocks.7,dinov2_vitb14,layer1,resnet50,structural,0.006466886479835742,0.7121996943482092,True,50,8,0.9148482084584713,0.9437516708127858,29,3,1.0670428601765083,1.5777430687673366,facebook/sam2-hiera-large,top_k_mean,0.13890856160775922,3,graph,15,l2,umap,26,False,False,heuristic,7.0,1.772487833763906,5,False,True,False,True,True,False,True,0.6923412364090981,0.691701503237002,0.7495431312006027,0.23173030283530327,0.6753131561828837,0.8945987883189642,COMPLETE,,0.0,0
729,0.0,graph,36,z-score,svd,23,False,True,silhouette,transformer.resblocks.10,ViT-B/32,blocks.11,dinov2_vitb14,layer2,resnet50,semantic,0.009802402003216451,0.6395114799250008,False,100,16,0.8139991174632997,0.9684499514242924,28,3,0.8384470887647584,1.7964351627516448,facebook/sam2-hiera-large,median,0.22765441861408964,5,kmeans,35,z-score,umap,46,False,True,silhouette,,1.6437876681718018,3,True,False,False,False,False,True,False,0.6023363722281554,0.610690394403274,0.6148645858754099,0.3597072546642127,0.8153460940394613,0.7939269641121067,COMPLETE,,0.0,0
730,0.0,graph,28,root-norm,pca,35,True,False,heuristic,transformer.resblocks.9,ViT-B/32,blocks.4,dinov2_vitb14,layer3,resnet50,semantic,0.003885419132922027,0.7311298159726334,True,200,32,0.8797872649593962,0.9421887435707483,30,4,1.0055303610817878,2.534552081092017,facebook/sam2-hiera-large,mean,0.2862521451917032,3,graph,40,z-score,pca,22,True,False,heuristic,5.0,3.428131866218131,5,False,True,True,True,True,False,True,0.6827817983312392,0.5816961582023538,0.4615247805221144,0.11105388159970203,0.23117572230393316,0.20907346546673874,COMPLETE,,0.0,0
731,0.0,kmeans,17,z-score,svd,37,False,True,silhouette,transformer.resblocks.11,ViT-B/32,blocks.11,dinov2_vitb14,conv1,resnet50,structural,0.004870959970230017,0.7577490162646069,False,50,8,0.9614960373306399,0.9229764868856468,23,3,1.131325917662907,2.2504650664311048,facebook/sam2-hiera-large,mean,0.10973702279738876,3,kmeans,34,z-score,umap,64,False,True,silhouette,3.0,1.4303799667549024,3,True,True,False,False,False,True,False,0.51165342345406,0.7150384872825655,0.5360067068003763,0.18561281792378817,0.4505252975449121,0.0030182132424938363,COMPLETE,,0.0,0
716,0.0,graph,25,l2,svd,58,True,False,silhouette,transformer.resblocks.11,ViT-B/32,blocks.11,dinov2_vitb14,layer3,resnet50,structural,0.0087752454900619,0.6755867141391503,False,50,32,0.8754657482010659,0.9506228268483795,30,2,0.5992227443256664,1.7551328098890717,facebook/sam2-hiera-large,mean,0.4870512144931565,3,kmeans,37,z-score,svd,44,True,True,silhouette,,3.031167490813318,5,False,False,False,False,True,False,False,0.6219555951924857,0.723888233809136,0.5591567360165514,0.12941123792024842,0.7904954791651092,0.2835566531113245,COMPLETE,,0.0,0
717,0.0,graph,39,z-score,umap,49,False,True,heuristic,transformer.resblocks.10,ViT-B/32,blocks.4,dinov2_vitb14,layer1,resnet50,semantic,0.009221958759652635,0.827907823153092,False,100,16,0.8175584062453581,0.9401804315486404,15,4,0.9374219988916924,2.812570447721572,facebook/sam2-hiera-large,top_k_mean,0.19073496712400784,5,graph,33,l2,pca,60,False,False,heuristic,3.0,4.117866228015491,3,True,True,False,True,False,True,True,0.7619873725625449,0.6008125736236809,0.6074074362486565,0.4777577759155564,0.7128142807330228,0.9986076569395813,COMPLETE,,0.0,0
718,0.0,kmeans,34,root-norm,pca,46,True,False,heuristic,transformer.resblocks.11,ViT-B/32,blocks.7,dinov2_vitb14,layer4,resnet50,structural,0.0061592360576166625,0.844425019273204,True,200,32,0.8058642992857225,0.9471082645391912,21,3,0.5483658614933731,2.840725641504314,facebook/sam2-hiera-large,mean,0.15679665010989924,3,kmeans,39,z-score,umap,62,False,True,silhouette,5.0,2.03998622980637,5,True,True,True,False,True,False,False,0.6689846496523058,0.6468909142236438,0.7460837417146668,0.8162158540571625,0.2833311715806881,0.9600784394078646,COMPLETE,,0.0,0
719,0.0,graph,37,z-score,svd,63,False,True,silhouette,transformer.resblocks.9,ViT-B/32,blocks.11,dinov2_vitb14,layer3,resnet50,semantic,0.0018569125783498182,0.8354130149277693,False,50,8,0.9453140621872558,0.9665448693178953,16,3,1.0437042503098133,1.912132899939256,facebook/sam2-hiera-large,median,0.367338110130878,3,graph,38,z-score,umap,25,True,True,heuristic,3.0,4.367075955370353,5,False,True,False,False,False,True,True,0.5689407870793334,0.7079017490894453,0.5894049790103556,0.20434213204758273,0.6309395703526635,0.6227031127071568,COMPLETE,,0.0,0
720,0.0,graph,35,l2,pca,28,True,False,heuristic,transformer.resblocks.10,ViT-B/32,blocks.4,dinov2_vitb14,layer1,resnet50,semantic,0.0037198010387775845,0.6340257188498452,True,100,16,0.8470563377541737,0.9597249186599899,27,4,0.973056700319505,2.448670525825745,facebook/sam2-hiera-large,mean,0.35625377838413,5,kmeans,29,z-score,pca,16,False,False,silhouette,,1.8616452753830488,3,True,False,True,True,True,True,False,0.7427338385545731,0.7498245776977536,0.7203104366390357,0.42169357332635915,0.5408757815339252,0.13049455351285108,COMPLETE,,0.0,0
721,0.0,graph,18,z-score,svd,36,True,True,silhouette,transformer.resblocks.11,ViT-B/32,blocks.11,dinov2_vitb14,layer3,resnet50,structural,0.002533835330303213,0.7858890291624329,False,200,32,0.8583197392275,0.9121029114264969,26,3,1.1817730789457717,2.365242678790582,facebook/sam2-hiera-large,mean,0.13056740114615006,3,graph,25,root-norm,umap,50,True,True,silhouette,7.0,3.2203679296913426,5,False,True,False,False,True,False,True,0.6526826683901166,0.6584318700994238,0.7077995122492976,0.2644703625004748,0.4810271965293962,0.8574037830437864,COMPLETE,,0.0,0
722,0.0,graph,33,l2,umap,39,False,True,heuristic,transformer.resblocks.11,ViT-B/32,blocks.11,dinov2_vitb14,layer2,resnet50,semantic,0.009461971968061606,0.7681542285667634,False,50,8,0.90626746920167,0.9326710587660038,22,2,0.85693773541889,2.6258856759662006,facebook/sam2-hiera-large,top_k_mean,0.40683066833285775,5,graph,26,l2,svd,18,False,False,heuristic,5.0,2.3835389424366675,3,True,True,False,True,False,True,False,0.6401776022734175,0.6333975082986465,0.400652681609065,0.37889512997678537,0.7708004004925163,0.7695050394869702,COMPLETE,,0.0,0
723,0.0,kmeans,38,z-score,svd,19,True,False,heuristic,transformer.resblocks.10,ViT-B/32,blocks.7,dinov2_vitb14,conv1,resnet50,structural,0.007150600760070023,0.7207725004820456,True,100,16,0.976685824550376,0.9309377599350298,24,4,0.902136918672182,2.6659014963847607,facebook/sam2-hiera-large,mean,0.2667798024276442,3,kmeans,29,z-score,pca,57,True,True,silhouette,3.0,3.909562111736321,5,False,True,True,False,True,False,False,0.7768411888573343,0.5606733193966741,0.41020167969429017,0.1689165816498782,0.9341614122322306,0.7142855864201885,COMPLETE,,0.0,0
708,0.0,graph,12,root-norm,pca,17,True,False,heuristic,transformer.resblocks.9,ViT-B/32,blocks.4,dinov2_vitb14,layer3,resnet50,semantic,0.005973160547655734,0.7015533998430459,True,100,16,0.8991827848256466,0.9786124379318789,24,3,0.6722107583046144,2.310993432016048,facebook/sam2-hiera-large,median,0.39749486199437806,3,graph,28,z-score,pca,55,False,True,heuristic,7.0,2.682068821858981,3,True,True,True,False,True,False,True,0.7304925727939217,0.697824369079784,0.46688089018645207,0.09054344772227647,0.7464895654191064,0.23287949615572262,COMPLETE,,0.0,0
709,0.0,graph,26,z-score,svd,37,True,True,silhouette,transformer.resblocks.11,ViT-B/32,blocks.11,dinov2_vitb14,conv1,resnet50,structural,0.0028285307784740076,0.6240654820301823,False,50,8,0.8511407715434209,0.9423383350093008,23,4,0.9468118984438102,2.9727970463128943,facebook/sam2-hiera-large,mean,0.42486045304263403,3,kmeans,18,z-score,umap,64,False,False,silhouette,3.0,2.1038730130187933,5,True,True,False,True,True,True,False,0.7861173411785072,0.4218103317278691,0.5226265271685636,0.5293850878001913,0.3293360187150885,0.4808641106451356,COMPLETE,,0.0,0
710,0.0,kmeans,38,l2,svd,61,False,True,heuristic,transformer.resblocks.11,ViT-B/32,blocks.11,dinov2_vitb14,layer4,resnet50,semantic,0.007264319793588108,0.6829161605171333,True,200,32,0.8838117765813165,0.9624939944557059,28,2,0.9217947864819892,2.766493542690883,facebook/sam2-hiera-large,mean,0.34783804287026715,5,graph,34,root-norm,svd,38,True,True,heuristic,5.0,1.9016084223677683,5,False,True,True,False,False,True,True,0.7024417929237942,0.727100620550809,0.41866379859905084,0.5883675202016133,0.5065498621964196,0.8800989285310343,COMPLETE,,0.0,0
711,0.0,graph,29,z-score,pca,30,True,False,silhouette,transformer.resblocks.10,ViT-B/32,blocks.4,dinov2_vitb14,layer3,resnet50,structural,0.008048028863663818,0.8230954869593953,False,100,16,0.823515653122002,0.9573762157166484,19,3,0.8294909330812578,1.6172929006748764,facebook/sam2-hiera-large,top_k_mean,0.20920461946015767,3,kmeans,35,l2,pca,59,False,True,silhouette,3.0,2.211973285882265,3,True,True,False,False,True,False,False,0.7089130972803196,0.5492648843891331,0.47813219869891926,0.7127586238448763,0.8139584734403935,0.9395911528146239,COMPLETE,,0.0,0
712,0.0,graph,23,root-norm,umap,44,False,True,heuristic,transformer.resblocks.11,ViT-B/32,blocks.7,dinov2_vitb14,layer1,resnet50,semantic,0.004665081362636954,0.7978837165581274,False,50,8,0.935766929860459,0.9451551828416836,25,4,1.0258704369746656,2.51857960543897,facebook/sam2-hiera-large,mean,0.14299988045418918,5,graph,32,z-score,umap,52,True,False,silhouette,,3.5033743115345697,5,False,False,False,True,False,True,False,0.5257674967223082,0.48639329763078154,0.4374142278458147,0.004361417672875231,0.8680593083718909,0.7499021575483626,COMPLETE,,0.0,0
713,0.0,graph,32,z-score,svd,22,True,False,heuristic,transformer.resblocks.9,ViT-B/32,blocks.11,dinov2_vitb14,layer3,resnet50,semantic,0.007558548588503974,0.7167086176169762,True,200,32,0.8625563833633514,0.9382698696084335,26,3,0.9903566907674005,2.928459063528158,facebook/sam2-hiera-large,median,0.4130837728421517,3,graph,19,z-score,umap,51,False,True,heuristic,5.0,2.848789908870091,3,True,True,True,False,True,False,True,0.552964115451477,0.5721744663304451,0.6954961539649949,0.6573684900977796,0.6618975604887954,0.37937601052153097,COMPLETE,,0.0,0
714,0.0,kmeans,10,l2,pca,53,False,True,silhouette,transformer.resblocks.10,ViT-B/32,blocks.4,dinov2_vitb14,layer2,resnet50,structural,0.004062206535005637,0.6459678561575894,False,100,16,0.9246150647209708,0.9013180599609166,21,3,1.1642036136228988,2.4164551807207384,facebook/sam2-hiera-large,mean,0.44477468813121157,3,kmeans,14,z-score,pca,19,True,False,silhouette,3.0,1.2019361297444067,5,False,True,False,True,False,True,False,0.687322022311152,0.4738594227107883,0.4306023677506488,0.8610381509261741,0.09361873985068728,0.5872847398388449,COMPLETE,,0.0,0
715,0.0,graph,36,z-score,svd,34,True,True,heuristic,transformer.resblocks.11,ViT-B/32,blocks.11,dinov2_vitb14,conv1,resnet50,semantic,0.003293538641789661,0.6609227980947087,True,200,8,0.9716561231155177,0.97288987339293,22,4,1.1986479001450838,1.8659122375988277,facebook/sam2-hiera-large,mean,0.1000232406568817,5,graph,40,root-norm,umap,61,False,True,heuristic,7.0,4.628167089864,3,True,True,True,False,True,True,True,0.7522232574793671,0.7415722535165081,0.6707463164763601,0.6161680484148352,0.976071837391319,0.03832442550885837,COMPLETE,,0.0,0
