number,value,params_dino_pipeline.clustering.clusterer.method,params_dino_pipeline.clustering.clusterer.n_neighbors,params_dino_pipeline.clustering.feature_processing.normalizer.method,params_dino_pipeline.clustering.feature_processing.reducer.method,params_dino_pipeline.clustering.feature_processing.reducer.n_components,params_dino_pipeline.clustering.feature_processing.run_normalization,params_dino_pipeline.clustering.feature_processing.run_reduction,params_dino_pipeline.clustering.k_selection.method,params_extractors.clip.layer_name,params_extractors.clip.model_name,params_extractors.dino_v2.layer_name,params_extractors.dino_v2.model_name,params_extractors.resnet.layer_name,params_extractors.resnet.model_name,params_fusion_pipeline.clustering.k_selection.k_source,params_heuristic_settings.filter_params.filter_min_area_perc,params_heuristic_settings.filter_params.nms_iou_threshold,params_heuristic_settings.filter_params.use_nms,params_heuristic_settings.generator_params.min_mask_region_area,params_heuristic_settings.generator_params.points_per_side,params_heuristic_settings.generator_params.pred_iou_thresh,params_heuristic_settings.generator_params.stability_score_thresh,params_heuristic_settings.k_heuristic_formulas.max_k,params_heuristic_settings.k_heuristic_formulas.semantic_base,params_heuristic_settings.k_heuristic_formulas.semantic_scale_factor,params_heuristic_settings.k_heuristic_formulas.structural_multiplier,params_heuristic_settings.sam_model,params_labeler.aggregation_method,params_labeler.aggregation_top_k_perc,params_labeler.top_n_labels,params_resnet_pipeline.clustering.clusterer.method,params_resnet_pipeline.clustering.clusterer.n_neighbors,params_resnet_pipeline.clustering.feature_processing.normalizer.method,params_resnet_pipeline.clustering.feature_processing.reducer.method,params_resnet_pipeline.clustering.feature_processing.reducer.n_components,params_resnet_pipeline.clustering.feature_processing.run_normalization,params_resnet_pipeline.clustering.feature_processing.run_reduction,params_resnet_pipeline.clustering.k_selection.method,params_resnet_pipeline.image_preprocessing.blur_kernel_size,params_resnet_pipeline.image_preprocessing.clahe_clip_limit,params_resnet_pipeline.image_preprocessing.sobel_kernel_size,params_resnet_pipeline.image_preprocessing.use_clahe,params_resnet_pipeline.image_preprocessing.use_gaussian_blur,params_resnet_pipeline.image_preprocessing.use_grayscale,params_resnet_pipeline.image_preprocessing.use_sobel_edges,params_run_dino_pipeline,params_run_fusion_pipeline,params_run_resnet_pipeline,params_validator_settings.final_threshold,params_validator_settings.semantic_threshold,params_validator_settings.structural_threshold,params_validator_settings.weights.clip_confidence,params_validator_settings.weights.dino_iou,params_validator_settings.weights.resnet_iou,state,user_attrs_error,user_attrs_max_clip_confidence,user_attrs_num_correct_segments
495,0.0,graph,24,root-norm,svd,51,False,True,silhouette,transformer.resblocks.9,ViT-B/32,blocks.11,dinov2_vitb14,layer3,resnet50,semantic,0.0019172028675325575,0.6427310241203724,False,50,8,0.9673749237280604,0.9656827111765821,20,3,0.9135972549496815,1.5004920037565403,facebook/sam2-hiera-large,median,0.4226353443819679,3,graph,28,z-score,umap,56,False,False,heuristic,3.0,3.56420390924906,5,True,True,False,True,False,True,True,0.513761453491649,0.7330632289812015,0.6687544512670627,0.39270601627090224,0.6873700602113996,0.6852239657366046,COMPLETE,,0.0,0
496,0.0,graph,37,l2,svd,26,True,False,heuristic,transformer.resblocks.11,ViT-B/32,blocks.11,dinov2_vitb14,layer4,resnet50,semantic,0.005944746286548958,0.7736806176418979,True,100,16,0.9262379366353931,0.956213880660421,27,4,0.9280135461655242,2.472162795526432,facebook/sam2-hiera-large,mean,0.3741561193109333,5,kmeans,40,z-score,pca,64,False,True,silhouette,,2.3501702313225734,3,True,False,True,False,True,False,False,0.7453354611583577,0.7426470585055084,0.6038308673763251,0.14594385392288708,0.1454916020017465,0.7898336303377579,COMPLETE,,0.0,0
497,0.0,graph,39,z-score,pca,53,True,True,silhouette,transformer.resblocks.10,ViT-B/32,blocks.4,dinov2_vitb14,layer1,resnet50,structural,0.0064824381523961175,0.6674761907053782,False,200,32,0.9418838077867798,0.9206507442291781,28,3,1.094925580849344,1.95711878558715,facebook/sam2-hiera-large,mean,0.12069491125648857,3,graph,29,root-norm,umap,17,True,True,heuristic,5.0,3.196499062164332,5,False,True,False,False,True,True,True,0.7579265801572872,0.7113646308740316,0.5629121377434908,0.1995238182761715,0.8741743815539536,0.5255777795713948,COMPLETE,,0.0,0
498,0.0,kmeans,12,z-score,svd,24,False,True,heuristic,transformer.resblocks.11,ViT-B/32,blocks.11,dinov2_vitb14,layer3,resnet50,semantic,0.0011469018302195794,0.7529946450079243,False,50,8,0.8445115493594259,0.9431650534126754,15,3,1.167883788523726,2.553400969236459,facebook/sam2-hiera-large,mean,0.35368419943852974,5,kmeans,37,z-score,svd,54,False,False,silhouette,7.0,3.4429161541640436,3,True,True,True,True,False,True,False,0.588199418110487,0.6036039405421223,0.7439516661269806,0.8844786602388164,0.4319186862385525,0.5719215281808198,COMPLETE,,0.0,0
499,0.0,graph,14,l2,umap,36,True,False,heuristic,transformer.resblocks.10,ViT-B/32,blocks.4,dinov2_vitb14,layer3,resnet50,structural,0.003593450646240714,0.7810347866365134,True,100,32,0.8350789730255117,0.9797498033693876,24,3,0.7635648549160249,2.627534655447398,facebook/sam2-hiera-large,top_k_mean,0.3873031922601383,3,graph,39,l2,umap,23,True,True,silhouette,3.0,1.559877909356636,5,False,True,False,False,True,False,False,0.7039167481139632,0.6435937895996103,0.4552345462105709,0.8278145251063287,0.7968259693269499,0.8194799470967412,COMPLETE,,0.0,0
484,0.0,graph,19,root-norm,svd,42,True,False,heuristic,transformer.resblocks.11,ViT-B/32,blocks.4,dinov2_vitb14,layer3,resnet50,semantic,0.004608718102098896,0.7086111743533638,True,100,16,0.8376015112332015,0.9745143897026398,24,3,1.0389123184207194,2.5098626742418317,facebook/sam2-hiera-large,median,0.32616596331929687,3,graph,40,z-score,pca,19,False,True,heuristic,7.0,2.124693550382321,3,True,True,True,False,True,False,True,0.7071793988057825,0.7272296364512004,0.6281875140942925,0.18900192929980394,0.35145407595971934,0.3724262380148682,COMPLETE,,0.0,0
485,0.0,kmeans,35,z-score,pca,16,False,True,silhouette,transformer.resblocks.9,ViT-B/32,blocks.11,dinov2_vitb14,layer2,resnet50,structural,0.007036979583733353,0.6357748810416008,False,200,8,0.934725556652452,0.9455239430671977,16,4,0.9860610024514779,1.7161867230188395,facebook/sam2-hiera-large,mean,0.17602623480510607,3,kmeans,31,z-score,umap,63,True,False,silhouette,5.0,1.4273975705086743,5,True,True,False,True,False,True,False,0.6839316996773397,0.7053549319881548,0.48420273621772364,0.6530033600766298,0.6479049784447023,0.49915789047063197,COMPLETE,,0.0,0
486,0.0,graph,28,l2,svd,57,True,True,heuristic,transformer.resblocks.11,ViT-B/32,blocks.11,dinov2_vitb14,layer3,resnet50,semantic,0.006626606523654618,0.6925599933472979,True,50,32,0.8921504302708001,0.9488419159174308,19,3,0.6503193670635843,1.593074231498096,facebook/sam2-hiera-large,mean,0.18498218343771533,5,graph,12,z-score,umap,61,False,True,heuristic,3.0,1.4954253486332107,5,False,True,True,False,True,True,True,0.7926378417346375,0.5726839045655939,0.6603907118079162,0.23840178065272763,0.7329915337265113,0.9980207740527307,COMPLETE,,0.0,0
487,0.0,graph,11,z-score,pca,37,True,False,silhouette,transformer.resblocks.10,ViT-B/32,blocks.4,dinov2_vitb14,conv1,resnet50,structural,0.003968697976914637,0.7210105761526633,False,100,16,0.9113291301768399,0.9638602026832883,26,2,0.8920427612599885,2.5457363661725267,facebook/sam2-hiera-large,mean,0.20175672207085468,3,kmeans,26,root-norm,pca,38,False,False,silhouette,,3.234142686697099,3,True,False,False,True,True,False,False,0.651867247858841,0.7209518236140492,0.6500196059203277,0.26675621064542326,0.6131128177387198,0.6318319488623314,COMPLETE,,0.0,0
488,0.0,graph,15,z-score,svd,21,False,True,heuristic,transformer.resblocks.11,ViT-B/32,blocks.11,dinov2_vitb14,layer4,resnet50,semantic,0.007306942782661376,0.8272887255495125,False,200,32,0.8712123030724515,0.9771569878861431,30,4,0.7158518377962283,2.3150415891028504,facebook/sam2-hiera-large,top_k_mean,0.24839360720068615,5,graph,34,l2,svd,41,True,True,silhouette,3.0,2.018791954257726,5,False,True,False,False,False,True,True,0.6896251118064348,0.6632524407207696,0.5162308326389785,0.2163544563932986,0.8341515137500373,0.6579117714369828,COMPLETE,,0.0,0
489,0.0,graph,18,l2,umap,61,True,False,heuristic,transformer.resblocks.9,ViT-B/32,blocks.7,dinov2_vitb14,layer1,resnet50,semantic,0.009033509629140997,0.7033863839145995,True,50,8,0.959767407841933,0.9592031055711245,17,3,0.8756272509302612,1.8675474405380195,facebook/sam2-hiera-large,mean,0.30254268427222186,3,graph,16,z-score,umap,25,False,True,heuristic,5.0,4.8838571632070185,3,True,True,True,False,True,False,False,0.7738988666163805,0.6754603710392181,0.46783513044634556,0.7709626216830326,0.7679658189526577,0.8436473350825978,COMPLETE,,0.0,0
490,0.0,kmeans,37,root-norm,svd,41,False,True,silhouette,transformer.resblocks.11,ViT-B/32,blocks.4,dinov2_vitb14,layer3,resnet50,structural,0.009989330159812751,0.8359524973048458,False,100,16,0.8592127719766093,0.9622980018781202,22,3,1.0120728302896411,2.754843445806505,facebook/sam2-hiera-large,median,0.47995419802821687,3,kmeans,23,z-score,pca,53,True,False,silhouette,7.0,1.8537417589274223,5,False,True,False,True,False,True,False,0.7853732728098323,0.615840658498095,0.6884151378406924,0.3692840424365516,0.5407241897046684,0.9027297948821873,COMPLETE,,0.0,0
491,0.0,graph,32,z-score,pca,56,True,True,heuristic,transformer.resblocks.10,ViT-B/32,blocks.11,dinov2_vitb14,layer3,resnet50,semantic,0.0017237774672201017,0.7603804336099543,True,200,32,0.9523344725889745,0.9091961210104642,21,4,0.5472059303524763,2.655964650554636,facebook/sam2-hiera-large,mean,0.10952539777131232,5,graph,38,z-score,umap,63,False,True,heuristic,3.0,3.306750824677712,3,True,True,True,False,True,True,True,0.6947808023989721,0.5524349568588984,0.4097996306660343,0.42163183845065555,0.8144098829282025,0.03724109171958643,COMPLETE,,0.0,0
540,0.0,graph,39,l2,pca,18,True,False,heuristic,transformer.resblocks.10,ViT-B/32,blocks.4,dinov2_vitb14,layer4,resnet50,semantic,0.0037380399208920053,0.6010815267369862,True,100,16,0.9219701649772328,0.9245021702304805,17,4,1.0283665277522707,1.6013293485685014,facebook/sam2-hiera-large,mean,0.17489503707744158,3,graph,26,z-score,pca,21,False,True,heuristic,3.0,2.7205988254840405,3,True,True,True,False,True,False,True,0.5202946142437955,0.6638304437967798,0.7364147022411976,0.15765232091517137,0.742543697638951,0.9994681343707275,COMPLETE,,0.0,0
541,0.0,kmeans,36,z-score,svd,34,False,True,silhouette,transformer.resblocks.11,ViT-B/32,blocks.11,dinov2_vitb14,layer1,resnet50,structural,0.005865986065093325,0.6681952620489201,False,200,8,0.9728839409052148,0.9209277858588024,24,3,1.1680101712771245,1.9948453630306076,facebook/sam2-hiera-large,mean,0.3650257981844016,3,kmeans,35,root-norm,umap,59,False,False,silhouette,7.0,4.499010679421157,5,True,True,False,True,False,True,False,0.6815249821323084,0.7109654260466808,0.6008148155660805,0.20736245619187785,0.1283702412278336,0.7323182253819959,COMPLETE,,0.0,0
542,0.0,graph,15,l2,svd,21,True,True,heuristic,transformer.resblocks.11,ViT-B/32,blocks.11,dinov2_vitb14,layer3,resnet50,semantic,0.0016655107453315589,0.8339620297257455,True,50,32,0.8471483080610711,0.9622903983335166,19,2,0.6788230221389241,2.5396407131325516,facebook/sam2-hiera-large,mean,0.4555686415805538,5,graph,29,z-score,svd,64,True,True,heuristic,5.0,2.916073517520992,5,False,True,True,False,True,True,True,0.5766783229615717,0.7193920506658631,0.5315270664352694,0.04685513181765094,0.5829678770366823,0.2561853095624664,COMPLETE,,0.0,0
543,0.0,graph,38,z-score,umap,25,True,False,silhouette,transformer.resblocks.10,ViT-B/32,blocks.4,dinov2_vitb14,layer1,resnet50,structural,0.009427064510902342,0.7011162172847207,False,100,16,0.8434403345143296,0.947564539072848,15,4,1.0815898808063376,2.353870297060195,facebook/sam2-hiera-large,top_k_mean,0.32203223860723473,3,kmeans,38,l2,pca,29,False,False,silhouette,,2.339216608148561,3,True,False,False,True,True,False,False,0.6932460703569387,0.5859547212252543,0.627911107760489,0.5309442412557009,0.9794917649198253,0.7734891015102474,COMPLETE,,0.0,0
544,0.0,graph,27,root-norm,pca,55,False,True,heuristic,transformer.resblocks.9,ViT-B/32,blocks.7,dinov2_vitb14,layer3,resnet50,semantic,0.001997169207880281,0.7147870736683828,False,200,32,0.8845602300189581,0.9647952773538474,23,3,1.1051712699713763,1.7031094401650229,facebook/sam2-hiera-large,median,0.20014282811188774,5,graph,40,z-score,umap,41,True,True,silhouette,3.0,4.226370235903097,5,False,True,False,False,False,True,True,0.7324814421140683,0.7499936649446765,0.5511244854841979,0.3743879084174096,0.7773722525346971,0.9743950980491931,COMPLETE,,0.0,0
545,0.0,graph,12,z-score,svd,45,True,False,heuristic,transformer.resblocks.11,ViT-B/32,blocks.11,dinov2_vitb14,layer2,resnet50,semantic,0.004209632657543257,0.6062075312628146,True,50,8,0.8075303937434606,0.9506083794970632,25,3,0.8625218740145058,2.2397962220344905,facebook/sam2-hiera-large,mean,0.2839352913854825,3,graph,33,z-score,umap,32,False,True,heuristic,5.0,3.063273328268959,3,True,True,True,False,True,False,False,0.5924564331811328,0.49083073611898337,0.5784858169718858,0.46161563802266464,0.2125143211454485,0.9489462160278571,COMPLETE,,0.0,0
546,0.0,kmeans,33,l2,pca,52,False,True,silhouette,transformer.resblocks.10,ViT-B/32,blocks.4,dinov2_vitb14,conv1,resnet50,structural,0.0025941493888928693,0.7261883908443306,False,100,16,0.8703624204250684,0.9193640912779851,28,4,0.77270737179285,2.464018791357062,facebook/sam2-hiera-large,mean,0.375340312959549,3,kmeans,37,root-norm,pca,61,True,False,silhouette,3.0,1.462050751625668,5,False,True,False,True,False,True,False,0.6454208000932227,0.6068002926885249,0.614343324426863,0.6662215028295667,0.7192209793607557,0.7998626786753708,COMPLETE,,0.0,0
547,0.0,graph,13,z-score,svd,28,True,True,heuristic,transformer.resblocks.11,ViT-B/32,blocks.11,dinov2_vitb14,layer4,resnet50,semantic,0.0044596140925413814,0.6828791368895997,True,200,32,0.9605126572263756,0.9591416309600472,30,3,0.9447765949777844,2.049455288763439,facebook/sam2-hiera-large,mean,0.11631127607183671,5,graph,28,z-score,svd,40,False,True,heuristic,7.0,2.005323469388857,3,True,True,True,False,True,True,True,0.7799176537769729,0.5750061399890344,0.6610756518199253,0.4275403699590543,0.5398587821137294,0.2175172259587607,COMPLETE,,0.0,0
532,0.0,graph,34,z-score,umap,19,False,True,heuristic,transformer.resblocks.11,ViT-B/32,blocks.7,dinov2_vitb14,conv1,resnet50,semantic,0.007284781893764381,0.6185585466730008,False,50,8,0.8271213652369118,0.9107003916041139,22,3,0.8984313957382727,2.1315471832530863,facebook/sam2-hiera-large,top_k_mean,0.33297471991606964,5,kmeans,20,l2,umap,43,False,True,silhouette,3.0,1.8533325483744902,5,True,True,False,False,False,True,False,0.7451655441848712,0.6475366027652601,0.5868483631511883,0.40846193487402743,0.8226728522060629,0.35102744386380114,COMPLETE,,0.0,0
533,0.0,kmeans,17,l2,svd,56,True,False,heuristic,transformer.resblocks.9,ViT-B/32,blocks.11,dinov2_vitb14,layer4,resnet50,structural,0.00500201194909701,0.7598980529476361,True,200,32,0.9552540779515314,0.9168104563751818,16,2,0.6618727790659028,2.7940936262964735,facebook/sam2-hiera-large,median,0.2747259346225536,3,graph,32,z-score,umap,18,True,False,heuristic,7.0,2.17665609340507,5,False,True,True,True,True,False,True,0.5099553932640645,0.6723013690898068,0.6539176994004308,0.08434796197838401,0.4802348737386249,0.8827757777208621,COMPLETE,,0.0,0
534,0.0,graph,30,root-norm,pca,24,False,True,silhouette,transformer.resblocks.10,ViT-B/32,blocks.4,dinov2_vitb14,layer3,resnet50,semantic,0.008895447468921711,0.8055931377918573,False,100,16,0.8545451139592701,0.9151017307137002,26,3,0.8765238767098912,2.752725427552924,facebook/sam2-hiera-large,mean,0.3963074186267002,3,kmeans,25,z-score,pca,27,False,True,silhouette,5.0,2.086940719591503,3,True,True,False,False,False,True,False,0.6584636734256285,0.7277301506839414,0.6207912676003801,0.1977864345315889,0.8894065602259501,0.9271574534397152,COMPLETE,,0.0,0
535,0.0,graph,37,z-score,svd,35,True,False,heuristic,transformer.resblocks.11,ViT-B/32,blocks.11,dinov2_vitb14,layer1,resnet50,semantic,0.0014246097606853932,0.651634675722479,True,50,8,0.9135413567406023,0.9779690990669565,30,4,1.051956214077602,2.653972495280845,facebook/sam2-hiera-large,mean,0.2219432841492583,5,graph,38,z-score,umap,48,True,False,silhouette,,1.1770962892431143,5,False,False,True,True,True,False,False,0.7931640673751179,0.48393236492017466,0.4218146668779058,0.5056406928664938,0.9519490442670536,0.9003892691364319,COMPLETE,,0.0,0
536,0.0,graph,40,l2,svd,39,True,True,silhouette,transformer.resblocks.11,ViT-B/32,blocks.4,dinov2_vitb14,layer3,resnet50,structural,0.007541930643535371,0.6341542728107423,False,200,32,0.8343269287538283,0.9423510157974757,27,3,0.757102662233858,2.9673915458319073,facebook/sam2-hiera-large,mean,0.13646745793881826,3,graph,31,root-norm,svd,56,False,True,heuristic,3.0,3.372865159593551,3,True,True,False,False,True,True,True,0.5994949328495919,0.7378486172662713,0.506100088310916,0.11811852460608678,0.8472693508428362,0.6951658604581017,COMPLETE,,0.0,0
537,0.0,kmeans,16,z-score,pca,54,False,True,heuristic,transformer.resblocks.10,ViT-B/32,blocks.11,dinov2_vitb14,layer2,resnet50,semantic,0.009881236138777318,0.7842813964679107,False,100,16,0.977227812665957,0.9344031822767879,21,3,0.5165300384258222,2.488341460057691,facebook/sam2-hiera-large,top_k_mean,0.30746117915643956,5,kmeans,22,l2,pca,62,True,True,silhouette,5.0,2.58917332860998,5,False,True,True,False,False,True,False,0.6707299285394639,0.45536897848673663,0.6488562012942427,0.9081935583334344,0.26141951682907894,0.5531616098915954,COMPLETE,,0.0,0
538,0.0,graph,29,root-norm,umap,37,True,False,heuristic,transformer.resblocks.11,ViT-B/32,blocks.7,dinov2_vitb14,conv1,resnet50,structural,0.007712484453940511,0.6758112979348445,True,50,8,0.8808326605561515,0.9660903811250469,20,4,0.6290586205651242,2.5834732004262357,facebook/sam2-hiera-large,mean,0.1449766877949163,3,graph,34,z-score,umap,45,False,False,heuristic,3.0,1.0150238013234554,3,True,True,False,True,True,False,True,0.7177272180465462,0.46878341604024637,0.7044796922124814,0.29504669344206047,0.9281885024213187,0.8556934068817005,COMPLETE,,0.0,0
539,0.0,graph,18,z-score,svd,17,False,True,silhouette,transformer.resblocks.9,ViT-B/32,blocks.11,dinov2_vitb14,layer3,resnet50,semantic,0.009645439854943594,0.7556235823169779,False,200,32,0.8995477336393671,0.9575695044537071,29,2,1.0028742088998837,2.679714531248995,facebook/sam2-hiera-large,median,0.12547674585781193,5,kmeans,27,z-score,umap,53,True,True,silhouette,,1.705937119440573,5,False,False,False,False,False,True,False,0.7530929976816564,0.6354736310637946,0.5582454420561649,0.60463741301094,0.5122244937602078,0.6534297847921012,COMPLETE,,0.0,0
524,0.0,kmeans,39,l2,svd,58,False,True,silhouette,transformer.resblocks.10,ViT-B/32,blocks.4,dinov2_vitb14,conv1,resnet50,structural,0.009240185313206828,0.7414196890937258,False,100,16,0.9475719832947594,0.9465756183257567,23,3,1.037395216496809,1.525215450171826,facebook/sam2-hiera-large,mean,0.26261359911007404,3,graph,12,z-score,pca,36,True,True,heuristic,3.0,3.292406902283117,5,False,True,False,False,False,True,True,0.50039950624329,0.6796580530245674,0.696771220441551,0.177383912365973,0.6149874383264217,0.09363623318400764,COMPLETE,,0.0,0
525,0.0,graph,15,z-score,pca,38,True,True,heuristic,transformer.resblocks.11,ViT-B/32,blocks.11,dinov2_vitb14,layer4,resnet50,semantic,0.0034498946102984587,0.8317399226189913,True,200,32,0.8195916057631569,0.9073597818916365,27,4,1.0156440212665356,2.199624509204902,facebook/sam2-hiera-large,mean,0.2403642704423059,5,kmeans,39,root-norm,umap,51,False,False,silhouette,7.0,3.700710018565628,3,True,True,True,True,True,True,False,0.7877570733988727,0.7428412588320387,0.47881632796873125,0.5585335773863324,0.6777032256224751,0.514512987490301,COMPLETE,,0.0,0
526,0.0,graph,21,l2,umap,53,True,False,silhouette,transformer.resblocks.11,ViT-B/32,blocks.11,dinov2_vitb14,layer3,resnet50,structural,0.0023207942450275266,0.7228808876309996,False,50,8,0.9076253039373676,0.9399821218879999,21,3,0.7251234650210203,2.447480705136392,facebook/sam2-hiera-large,top_k_mean,0.19177834799473498,3,graph,35,l2,svd,44,True,True,silhouette,,2.4249037254568613,5,False,False,False,False,True,False,False,0.6107418905333716,0.6129033666562366,0.4402132663328726,0.8579367618604001,0.7643671366617543,0.44439235778736785,COMPLETE,,0.0,0
527,0.0,graph,11,z-score,svd,50,False,True,heuristic,transformer.resblocks.10,ViT-B/32,blocks.7,dinov2_vitb14,layer1,resnet50,semantic,0.004349305943643138,0.8247977508594374,False,100,32,0.9694319914967284,0.9302591410673963,24,2,0.9150012391424621,1.763052492003564,facebook/sam2-hiera-large,mean,0.4747034432673511,5,graph,39,z-score,umap,31,False,False,heuristic,5.0,4.80451705258952,3,True,True,False,True,False,True,True,0.5523734298206502,0.5923836176225015,0.6071488358969526,0.32444142070037946,0.8034752005976328,0.9723503730984508,COMPLETE,,0.0,0
528,0.0,kmeans,20,root-norm,pca,40,True,False,heuristic,transformer.resblocks.9,ViT-B/32,blocks.4,dinov2_vitb14,layer3,resnet50,structural,0.006338512137789188,0.6292299294458847,True,200,16,0.8391076327435856,0.975280515534294,26,3,0.8193162450958537,2.565452109692293,facebook/sam2-hiera-large,median,0.10780873361065207,3,kmeans,10,z-score,pca,17,True,True,silhouette,3.0,1.9546609027509556,5,False,True,True,False,True,False,False,0.6980638814552792,0.5337437442362997,0.4329213159440082,0.0011224831059779422,0.7047522298613337,0.8084913359161414,COMPLETE,,0.0,0
