number,value,params_dino_pipeline_clustering_clusterer_method,params_dino_pipeline_clustering_feature_processing_normalizer_method,params_dino_pipeline_clustering_k_selection_method,params_extractors_dino_v2_layer_name,params_extractors_resnet_layer_name,params_heuristic_settings_filter_params_filter_min_area_perc,params_heuristic_settings_generator_params_points_per_side,params_heuristic_settings_generator_params_pred_iou_thresh,params_heuristic_settings_generator_params_stability_score_thresh,params_heuristic_settings_k_heuristic_formulas_semantic_scale_factor,params_heuristic_settings_k_heuristic_formulas_structural_multiplier,params_resnet_pipeline_clustering_clusterer_method,params_resnet_pipeline_clustering_feature_processing_normalizer_method,params_resnet_pipeline_clustering_k_selection_method,params_resnet_pipeline_image_preprocessing_use_gaussian_blur,params_run_dino_pipeline,params_run_resnet_pipeline,params_validator_settings_semantic_threshold,params_validator_settings_structural_threshold,params_validator_settings_weights_clip_confidence,params_validator_settings_weights_dino_iou,params_validator_settings_weights_resnet_iou,state,user_attrs_avg_dino_iou,user_attrs_avg_resnet_iou,user_attrs_best_clip_confidence_any,user_attrs_best_dino_iou,user_attrs_best_resnet_iou,user_attrs_error,user_attrs_k_semantic_used,user_attrs_k_structural_used,user_attrs_max_clip_confidence,user_attrs_num_correct_segments,user_attrs_num_sam_masks,user_attrs_value
189,0.0,graph,l2,heuristic,blocks.11,layer1,0.008011760624955521,8,0.8702748619478885,0.9594403307842149,0.7411065654410198,2.3573282200132413,kmeans,l2,silhouette,True,False,False,0.6390775445633694,0.6211999623564867,0.7693847211589873,0.28026250480081233,0.5669134601311863,COMPLETE,0.0,0.0,0.0,0.0,0.0,,3,2,0.0,0,2,0.0
190,0.0,kmeans,l2,silhouette,blocks.7,layer3,0.00929785319150378,32,0.9423225491011107,0.9202625079588707,0.6909263794344882,2.0630697832498495,graph,root-norm,silhouette,False,True,True,0.471622109728082,0.5812682582909037,0.6852250086639513,0.534291072858572,0.757549641159945,COMPLETE,0.0,0.0,0.0,0.0,0.0,,3,2,0.0,0,2,0.0
191,0.0,kmeans,l2,heuristic,blocks.11,layer2,0.004861667888818379,16,0.8887798392717566,0.9183887281865807,0.6553743663959907,2.3214191797670525,kmeans,root-norm,silhouette,False,False,True,0.40868395489512954,0.41049937511106654,0.4720415372501894,0.43691702162585927,0.83050879945323,COMPLETE,0.0,0.0,0.0,0.0,0.0,,3,2,0.0,0,2,0.0
192,0.0,kmeans,l2,heuristic,blocks.11,layer1,0.004474818211630284,16,0.8930736753990611,0.9374784545473724,0.6302797971593077,2.287756447466298,kmeans,root-norm,silhouette,False,False,True,0.4218344835169649,0.4266494515851838,0.9268400615016088,0.3774457926939906,0.9183645337180516,COMPLETE,0.0,0.0,0.0,0.0,0.0,,3,2,0.0,0,2,0.0
193,0.0,kmeans,l2,heuristic,blocks.11,layer2,0.00409549483662171,16,0.8825085315427837,0.915006428386069,0.7078646200645464,2.428176469117082,kmeans,root-norm,silhouette,False,False,True,0.4006722968902544,0.4155044322358967,0.8930773909494265,0.4006571252061889,0.7249718759052975,COMPLETE,0.0,0.0,0.0,0.0,0.0,,3,2,0.0,0,2,0.0
194,0.0,kmeans,l2,heuristic,blocks.11,layer2,0.0038193907779977545,16,0.8791862078338218,0.9621618087578471,0.5840032312379501,2.4565751426312077,kmeans,root-norm,silhouette,False,False,True,0.4005261009294342,0.4821441829904798,0.831216689508805,0.3380290089192806,0.8953485799020272,COMPLETE,0.0,0.0,0.0,0.0,0.0,,3,2,0.0,0,2,0.0
195,0.0,kmeans,root-norm,heuristic,blocks.11,layer2,0.005240974429707391,8,0.8859745142887031,0.9232278152364902,0.6010088271012533,2.5006261630770275,kmeans,root-norm,heuristic,False,False,True,0.4186691818415681,0.6470894496952511,0.39075865729574577,0.3667370507871609,0.3668236709608475,COMPLETE,0.0,0.0,0.0,0.0,0.0,,3,2,0.0,0,2,0.0
180,0.0,graph,l2,heuristic,blocks.11,layer1,0.007684747745063976,8,0.8804728853108597,0.9784628908433054,0.5557910327960873,2.956967680128977,graph,root-norm,heuristic,False,True,True,0.5219056729207673,0.44469678359285963,0.7064449971019411,0.47698480856302733,0.07133643407442168,COMPLETE,0.0,0.0,0.0,0.0,0.0,,3,2,0.0,0,2,0.0
181,0.0,graph,l2,silhouette,blocks.7,layer3,0.006611649928626754,32,0.8735844725531663,0.9417085366805552,0.8305174447790727,2.4790222650933176,graph,l2,silhouette,True,True,False,0.493021072257574,0.6012795614783285,0.6035279460238318,0.613611320355737,0.7106213069902698,COMPLETE,0.0,0.0,0.0,0.0,0.0,,3,2,0.0,0,2,0.0
182,0.0,graph,l2,silhouette,blocks.7,layer3,0.006109783383048781,32,0.869679022363565,0.9359560915785202,0.8751514571616101,2.443221994676835,graph,l2,silhouette,True,True,False,0.5022711978292711,0.6612773780386138,0.9741450504357504,0.7411970777474081,0.5047599807384556,COMPLETE,0.0,0.0,0.0,0.0,0.0,,3,2,0.0,0,2,0.0
183,0.0,graph,l2,silhouette,blocks.7,layer3,0.005961963840940267,32,0.9662657707761614,0.9348974643848414,0.8587012106354628,2.55916888680511,graph,l2,silhouette,True,True,False,0.6531581609826409,0.6127749018499702,0.5848814376129289,0.5553545872391563,0.6509390346804969,COMPLETE,0.0,0.0,0.0,0.0,0.0,,3,2,0.0,0,2,0.0
184,0.0,graph,l2,silhouette,blocks.7,layer3,0.006847204813444571,32,0.9289015393691672,0.9400815812356922,0.7290114652875735,1.5085635034948026,graph,l2,silhouette,True,True,False,0.5308140934424214,0.5752802768396652,0.6428083269908269,0.5921004182277925,0.5942716934613496,COMPLETE,0.0,0.0,0.0,0.0,0.0,,3,2,0.0,0,2,0.0
185,0.0,kmeans,l2,silhouette,blocks.7,layer1,0.006307687990392897,32,0.8904987763200737,0.9643052224057552,0.7991346526904438,2.826263267971411,kmeans,l2,silhouette,True,False,False,0.5947680974386782,0.6317390349876375,0.8179815438663898,0.670232422814429,0.6817488203269637,COMPLETE,0.0,0.0,0.0,0.0,0.0,,3,2,0.0,0,2,0.0
186,0.0,graph,root-norm,heuristic,blocks.7,layer3,0.003040586040204169,32,0.8631383334053717,0.9389230593490333,0.7187443833841635,2.595911990339613,graph,root-norm,silhouette,False,True,True,0.45950410189385066,0.4002650325085456,0.5269660272004002,0.6303635056532512,0.6323228420630465,COMPLETE,0.0,0.0,0.0,0.0,0.0,,3,2,0.0,0,2,0.0
187,0.0,kmeans,l2,silhouette,blocks.11,layer2,0.004655045625864188,8,0.8655121170711771,0.9094378891488303,0.8140836211326584,2.3980815855219135,kmeans,root-norm,heuristic,False,False,True,0.48325693525950125,0.43304203783464684,0.8712040197655515,0.4118772589784414,0.4659122209491963,COMPLETE,0.0,0.0,0.0,0.0,0.0,,3,2,0.0,0,2,0.0
172,0.0,kmeans,l2,heuristic,blocks.11,layer1,0.0019431774626121002,8,0.9026366235367402,0.9034812690768094,0.9599616566129109,2.696689847593424,graph,root-norm,silhouette,False,False,True,0.7443263061966442,0.552668709796539,0.4921218147197683,0.31904724164720416,0.99620064940346,COMPLETE,0.0,0.0,0.0,0.0,0.0,,3,2,0.0,0,2,0.0
173,0.0,kmeans,l2,heuristic,blocks.11,layer1,0.0054945784677931505,8,0.8999815761137554,0.9050002831878369,0.9770638803158435,2.853527371688116,graph,root-norm,silhouette,False,False,True,0.7375567812911625,0.543912736668577,0.41633585190642663,0.37092389709184226,0.22882142121248486,COMPLETE,0.0,0.0,0.0,0.0,0.0,,3,2,0.0,0,2,0.0
174,0.0,kmeans,l2,heuristic,blocks.11,layer3,0.009456540460581865,8,0.9203669450944694,0.9073181345095856,0.9965639354545768,2.801490670061934,graph,root-norm,silhouette,False,False,True,0.7272539299887041,0.5647630526570802,0.09653916891067621,0.1092925646780239,0.2552152554076893,COMPLETE,0.0,0.0,0.0,0.0,0.0,,3,2,0.0,0,2,0.0
175,0.0,kmeans,l2,heuristic,blocks.11,layer1,0.00751478612492529,8,0.9092926565571041,0.901662842903622,0.7672734530280352,2.7635070574293246,graph,l2,silhouette,True,False,False,0.42891496598877477,0.5364584817716279,0.06394406860589184,0.23601143850561618,0.16747530416972634,COMPLETE,0.0,0.0,0.0,0.0,0.0,,3,2,0.0,0,2,0.0
176,0.0,graph,root-norm,heuristic,blocks.11,layer1,0.009761709251476233,16,0.8557518014867178,0.9318164078236276,0.9241597572157785,2.250558676809973,graph,root-norm,silhouette,False,False,True,0.4887443953653843,0.5088296519045241,0.38065101311469307,0.8409391784980962,0.7413820721323795,COMPLETE,0.0,0.0,0.0,0.0,0.0,,3,2,0.0,0,2,0.0
177,0.0,kmeans,l2,silhouette,blocks.7,layer1,0.009020618768953177,8,0.9151238970752996,0.9669500678020694,1.1406735321423322,2.5424068283878904,kmeans,root-norm,heuristic,False,True,True,0.7470149706259883,0.522663119130646,0.6316908738657351,0.07291871502032916,0.13874685130938078,COMPLETE,0.0,0.0,0.0,0.0,0.0,,3,2,0.0,0,2,0.0
178,0.0,kmeans,l2,heuristic,blocks.11,layer2,0.007231531189555646,32,0.8971118706620285,0.9001062537722694,0.888663275058116,1.9878814008312808,graph,root-norm,silhouette,False,True,True,0.5749216646357671,0.45529897751492565,0.5571481490836139,0.19925282641181352,0.20018437764216326,COMPLETE,0.0,0.0,0.0,0.0,0.0,,3,2,0.0,0,2,0.0
179,0.0,kmeans,root-norm,heuristic,blocks.7,layer3,0.009969094099082181,16,0.8675020168399111,0.9159109728672093,1.0143174876176058,2.8852873516530195,kmeans,l2,silhouette,True,False,False,0.4133066834174885,0.4720432552374496,0.13237169557155573,0.9620976727673998,0.86947238860239,COMPLETE,0.0,0.0,0.0,0.0,0.0,,3,2,0.0,0,2,0.0
228,0.0,kmeans,l2,heuristic,blocks.11,layer1,0.004604672545437337,32,0.8986032676894539,0.9412192644622718,0.7442388261012638,1.9108915470325853,graph,l2,heuristic,True,False,False,0.7223735810657436,0.5390591579163355,0.11249808380219026,0.11093459842255535,0.21297205530465552,COMPLETE,0.0,0.0,0.0,0.0,0.0,,3,2,0.0,0,2,0.0
229,0.0,graph,root-norm,heuristic,blocks.7,layer1,0.003834714065087757,16,0.8651370627839247,0.9249755472184567,0.716481117705387,2.27275875135343,kmeans,root-norm,silhouette,False,True,True,0.6237667318510027,0.5070832851346985,0.6885417630466854,0.9546880554570637,0.9745137967908905,COMPLETE,0.0,0.0,0.0,0.0,0.0,,3,2,0.0,0,2,0.0
230,0.0,kmeans,l2,silhouette,blocks.11,layer1,0.002159543136850451,8,0.88137511846889,0.9595159245303571,0.8245281344178734,2.8374228125004164,graph,root-norm,silhouette,False,False,True,0.41893180243034445,0.5197350893500209,0.632506867680257,0.9786949863763786,0.30122139173220763,COMPLETE,0.0,0.0,0.0,0.0,0.0,,3,2,0.0,0,2,0.0
231,0.0,kmeans,root-norm,heuristic,blocks.11,layer1,0.00332160326481308,8,0.8854719251671569,0.9609492087967655,0.9164120872825458,2.7537932088976764,graph,root-norm,heuristic,False,True,True,0.4885652395312144,0.555518884436299,0.8582839855009049,0.46899822287827164,0.15336232896425708,COMPLETE,0.0,0.0,0.0,0.0,0.0,,3,2,0.0,0,2,0.0
232,0.0,kmeans,root-norm,heuristic,blocks.11,layer1,0.00675503412722509,8,0.8758263294285741,0.9563941520619755,0.9007691498155965,2.65582100040736,graph,root-norm,heuristic,False,True,True,0.4811293627642136,0.5457062931622451,0.8872429870348278,0.48862845384195963,0.8685130531237917,COMPLETE,0.0,0.0,0.0,0.0,0.0,,3,2,0.0,0,2,0.0
233,0.0,kmeans,root-norm,heuristic,blocks.11,layer1,0.0035899283706281476,8,0.8805868318436217,0.9529366115756658,0.8723061284584731,2.678659042003416,graph,root-norm,heuristic,False,True,True,0.47223324144590456,0.6049993394508583,0.9148822544950217,0.1997975636886869,0.14784820309790897,COMPLETE,0.0,0.0,0.0,0.0,0.0,,3,2,0.0,0,2,0.0
234,0.0,kmeans,root-norm,heuristic,blocks.11,layer1,0.0028062950624301404,8,0.8881478415314874,0.9519292537980851,0.8846395873305931,2.7167255696928403,graph,root-norm,heuristic,False,True,True,0.49898071532979155,0.7275923029944512,0.9344399643720611,0.5042536255379265,0.36840755827203925,COMPLETE,0.0,0.0,0.0,0.0,0.0,,3,2,0.0,0,2,0.0
235,0.0,kmeans,root-norm,heuristic,blocks.7,layer3,0.004096489169170401,32,0.8790901955042394,0.9587527315344143,0.9885480456425726,2.07631584987812,kmeans,root-norm,heuristic,False,True,True,0.48500020903951846,0.7398472087290945,0.03358646311579071,0.4481075349899346,0.1906886339256934,COMPLETE,0.0,0.0,0.0,0.0,0.0,,3,2,0.0,0,2,0.0
220,0.0,kmeans,root-norm,heuristic,blocks.7,layer1,0.005057867112579402,16,0.8686766931949995,0.9063214553767812,0.7344255964277387,2.6176250294317263,kmeans,l2,silhouette,True,True,False,0.5988878028325262,0.421939992422048,0.5883977362932096,0.052164399230931066,0.12603472941030813,COMPLETE,0.0,0.0,0.0,0.0,0.0,,3,2,0.0,0,2,0.0
221,0.0,kmeans,root-norm,heuristic,blocks.11,layer1,0.005352639788370833,8,0.8545406891267546,0.9696709411673851,0.80122384317082,2.8707565179140806,graph,root-norm,heuristic,False,True,True,0.43028290991534296,0.4914910057184271,0.7556980351461169,0.2240916742075144,0.26469517326761877,COMPLETE,0.0,0.0,0.0,0.0,0.0,,3,2,0.0,0,2,0.0
222,0.0,kmeans,root-norm,heuristic,blocks.11,layer1,0.004523413858858013,8,0.8500624533464318,0.9680044884507637,0.8149053298809236,2.810922427214651,graph,root-norm,heuristic,False,True,True,0.4252652952802165,0.47452370953437634,0.7020803560887808,0.13762194793199126,0.20324090627674374,COMPLETE,0.0,0.0,0.0,0.0,0.0,,3,2,0.0,0,2,0.0
223,0.0,kmeans,root-norm,heuristic,blocks.11,layer1,0.004997831886943026,8,0.970254573843068,0.9638600584426358,0.8516092748584322,2.6998309943582277,graph,root-norm,heuristic,False,True,True,0.44389563466975107,0.48685170399827105,0.667548775200517,0.17084728810982275,0.233319465210445,COMPLETE,0.0,0.0,0.0,0.0,0.0,,3,2,0.0,0,2,0.0
224,0.0,kmeans,root-norm,heuristic,blocks.11,layer1,0.005530626519143078,8,0.8909318512431958,0.9621587109885602,0.974493005251893,2.9205726099473135,graph,root-norm,heuristic,False,True,True,0.43752027150710543,0.5106206509307801,0.6116308819631517,0.7574367304055436,0.28209323967657746,COMPLETE,0.0,0.0,0.0,0.0,0.0,,3,2,0.0,0,2,0.0
225,0.0,graph,l2,heuristic,blocks.11,layer1,0.007577861187998351,8,0.8526752484875012,0.9103343648343806,0.956295240533409,2.581916716869739,graph,root-norm,heuristic,False,True,True,0.412054564866719,0.4971355969048441,0.3774690644323015,0.7956027939909571,0.1735280318676125,COMPLETE,0.0,0.0,0.0,0.0,0.0,,3,2,0.0,0,2,0.0
226,0.0,kmeans,root-norm,heuristic,blocks.11,layer3,0.00477777921359444,32,0.9493862827877027,0.9662792734422202,0.7740880632890079,2.895087400280626,kmeans,root-norm,silhouette,False,False,True,0.45209616701418054,0.5840753702631721,0.7694162765945036,0.3848411805642491,0.39761715348410787,COMPLETE,0.0,0.0,0.0,0.0,0.0,,3,2,0.0,0,2,0.0
227,0.0,kmeans,l2,silhouette,blocks.7,layer2,0.007333029517906347,8,0.8574753372444855,0.9019314220425786,0.8886970086481065,2.4737289493548285,graph,root-norm,silhouette,False,True,True,0.7035089700524347,0.6579519028993647,0.7370453253501523,0.24164430419296867,0.268594979674896,COMPLETE,0.0,0.0,0.0,0.0,0.0,,3,2,0.0,0,2,0.0
212,0.0,kmeans,root-norm,heuristic,blocks.11,layer1,0.006429750037487804,8,0.877963320593005,0.958241353300739,0.8685755372627223,2.643699535182008,graph,root-norm,heuristic,False,True,True,0.44715787617675085,0.491229228256523,0.5730387935488903,0.8589201636330848,0.28998454950965974,COMPLETE,0.0,0.0,0.0,0.0,0.0,,3,2,0.0,0,2,0.0
213,0.0,kmeans,root-norm,heuristic,blocks.11,layer1,0.0010122560127653925,8,0.87309766287293,0.9541727358681887,0.8213160446322599,2.8373867664665604,graph,root-norm,heuristic,False,True,True,0.4339605187065634,0.5008198031677802,0.5985959937933324,0.31998998458578204,0.32509915024267005,COMPLETE,0.0,0.0,0.0,0.0,0.0,,3,2,0.0,0,2,0.0
214,0.0,kmeans,root-norm,heuristic,blocks.11,layer1,0.00525662920465817,8,0.9233895078729049,0.9037871043776595,0.7889934087312105,1.9696643743394056,graph,root-norm,heuristic,False,True,True,0.4561822959404092,0.4006232319725165,0.149750986421189,0.2672240477445174,0.8417051119833572,COMPLETE,0.0,0.0,0.0,0.0,0.0,,3,2,0.0,0,2,0.0
215,0.0,kmeans,root-norm,silhouette,blocks.11,layer1,0.004746138034278974,16,0.8753612760799999,0.9505113467613496,0.8055746584459972,2.995760461510671,graph,root-norm,heuristic,False,False,True,0.6712774732773178,0.6690481865985293,0.6291606956034472,0.3462016426885903,0.24158373598421123,COMPLETE,0.0,0.0,0.0,0.0,0.0,,3,2,0.0,0,2,0.0
216,0.0,kmeans,l2,heuristic,blocks.7,layer1,0.0024076529525949323,8,0.8835821155199868,0.9467498377480309,0.7609263405230473,2.5362817350399833,kmeans,l2,silhouette,False,True,False,0.5701252827694748,0.44165035136712494,0.7207339338365558,0.2991801529808533,0.34863752757503147,COMPLETE,0.0,0.0,0.0,0.0,0.0,,3,2,0.0,0,2,0.0
217,0.0,graph,root-norm,heuristic,blocks.11,layer1,0.008861439747373617,32,0.8556414842414894,0.9658562889676838,0.6808024150744802,2.7963764662263895,graph,root-norm,silhouette,True,False,True,0.6137332775194335,0.4819385609049142,0.5334535128426554,0.6977264188921074,0.7409094569576418,COMPLETE,0.0,0.0,0.0,0.0,0.0,,3,2,0.0,0,2,0.0
218,0.0,kmeans,l2,heuristic,blocks.7,layer2,0.007206305863450498,8,0.878182949797269,0.900061242674625,1.035680839288792,2.8595946206863823,kmeans,root-norm,heuristic,False,True,True,0.4672084686245786,0.6141371952423321,0.3272763062557567,0.25361876887531914,0.6689279418366084,COMPLETE,0.0,0.0,0.0,0.0,0.0,,3,2,0.0,0,2,0.0
219,0.0,kmeans,l2,silhouette,blocks.11,layer3,0.00142646181803545,32,0.8513416349278982,0.9311874523920237,0.8299599336473348,2.7688944696182904,graph,root-norm,silhouette,False,False,True,0.7379412162605266,0.7003164984009759,0.24120896908163442,0.20643620391219414,0.6912156889579126,COMPLETE,0.0,0.0,0.0,0.0,0.0,,3,2,0.0,0,2,0.0
204,0.0,kmeans,l2,heuristic,blocks.7,layer1,0.006895578512453629,32,0.8673853175788077,0.971213528531739,0.5089557936393528,2.2248429145792157,graph,root-norm,silhouette,False,False,True,0.4657676417636923,0.4949340470091635,0.45115205098209304,0.26948008506057686,0.013917220056667703,COMPLETE,0.0,0.0,0.0,0.0,0.0,,3,2,0.0,0,2,0.0
205,0.0,kmeans,root-norm,heuristic,blocks.11,layer3,0.007003118867572757,32,0.8956409165659973,0.9657579389904423,0.6523151184002505,2.1431768823870176,kmeans,root-norm,heuristic,True,False,True,0.4958180806738477,0.5571358731290569,0.6148110455956225,0.8992509656438804,0.026051537150285478,COMPLETE,0.0,0.0,0.0,0.0,0.0,,3,2,0.0,0,2,0.0
206,0.0,graph,l2,heuristic,blocks.7,layer1,0.005071503209716489,16,0.8592678885484698,0.9720729114235235,0.5681506195946826,2.0941075841127965,graph,root-norm,silhouette,False,True,True,0.47747070189901114,0.46491154724425365,0.7886924445538103,0.15783430954529148,0.03400752459224285,COMPLETE,0.0,0.0,0.0,0.0,0.0,,3,2,0.0,0,2,0.0
207,0.0,kmeans,l2,silhouette,blocks.11,layer1,0.007743313932952753,32,0.8607351867173384,0.9677285912068014,1.0870400073378432,2.242363391382507,kmeans,root-norm,silhouette,False,False,True,0.7338841759728635,0.7155909273019029,0.5045842583737705,0.8159404391700693,0.534687425306239,COMPLETE,0.0,0.0,0.0,0.0,0.0,,3,2,0.0,0,2,0.0
208,0.0,kmeans,root-norm,heuristic,blocks.7,layer2,0.00430688877997976,8,0.9015157480181903,0.9633175928551656,0.8442711938556182,1.6574789288142333,graph,root-norm,silhouette,False,True,True,0.5852027469765387,0.5050846940152177,0.4120198870601926,0.08533631673488261,0.04511649585569037,COMPLETE,0.0,0.0,0.0,0.0,0.0,,3,2,0.0,0,2,0.0
209,0.0,graph,l2,heuristic,blocks.11,layer1,0.009560891487530584,32,0.9110341419312039,0.9732420568879323,1.0654569640731681,2.2963246488746885,kmeans,l2,heuristic,True,False,False,0.40828517285550636,0.449580341422967,0.8534925128378481,0.927416272399618,0.003747857018637733,COMPLETE,0.0,0.0,0.0,0.0,0.0,,3,2,0.0,0,2,0.0
210,0.0,kmeans,l2,heuristic,blocks.7,layer3,0.0017367804105184947,8,0.9383183291971299,0.9753114733125102,0.5285219153641164,1.589676656990488,graph,root-norm,silhouette,False,True,True,0.5407387701621988,0.47671164373395025,0.2805780684348189,0.7273780521375984,0.5146948053472463,COMPLETE,0.0,0.0,0.0,0.0,0.0,,3,2,0.0,0,2,0.0
211,0.0,kmeans,root-norm,heuristic,blocks.11,layer1,0.004934006869820768,8,0.8716921257568004,0.9608770975120304,0.8372824906611965,2.7295681852298053,graph,root-norm,heuristic,False,True,True,0.4596927362456074,0.5974694068439405,0.6612909707339325,0.22457154844943503,0.330725587622439,COMPLETE,0.0,0.0,0.0,0.0,0.0,,3,2,0.0,0,2,0.0
292,0.0,graph,l2,heuristic,blocks.7,layer1,0.006256234525412038,32,0.9167190562267298,0.9674855637190499,0.8884320271466729,2.5338416037074722,kmeans,root-norm,silhouette,True,True,True,0.44545982257064753,0.6194175744676456,0.9866977716828045,0.4554221896870464,0.8543528712750339,COMPLETE,0.0,0.0,0.0,0.0,0.0,,3,2,0.0,0,2,0.0
293,0.0,kmeans,l2,heuristic,blocks.11,layer2,0.008944906184092712,8,0.869986417367871,0.9115403022612935,0.7611935400698857,2.9105398237933593,graph,root-norm,heuristic,False,False,True,0.461353093109371,0.5050187854364441,0.6130663723207229,0.858708910998481,0.09100782961331383,COMPLETE,0.0,0.0,0.0,0.0,0.0,,3,2,0.0,0,2,0.0
294,0.0,kmeans,root-norm,silhouette,blocks.7,layer3,0.005420359672390062,32,0.8731071149243858,0.9230917565294725,0.8708739942352822,1.7502140140901243,kmeans,root-norm,silhouette,False,True,True,0.43440021634183323,0.6983807015484806,0.5668683382894182,0.4128969695375609,0.13626267943737125,COMPLETE,0.0,0.0,0.0,0.0,0.0,,3,2,0.0,0,2,0.0
295,0.0,kmeans,l2,heuristic,blocks.11,layer1,0.0037058154460782237,8,0.8634763871751455,0.900085385329951,0.7342389676213312,2.1478641147801065,graph,l2,silhouette,False,True,False,0.7151021157040194,0.6016528792895104,0.4410761010141832,0.893974782038453,0.9259210334798135,COMPLETE,0.0,0.0,0.0,0.0,0.0,,3,2,0.0,0,2,0.0
296,0.0,graph,root-norm,heuristic,blocks.7,layer1,0.007023233393010476,16,0.8553228079422034,0.9655766870928238,0.7996376150387009,2.228605687523188,kmeans,root-norm,heuristic,True,False,True,0.6092861563966043,0.5760674503627172,0.7670871897510045,0.3770652811961297,0.18420753468016363,COMPLETE,0.0,0.0,0.0,0.0,0.0,,3,2,0.0,0,2,0.0
297,0.0,kmeans,l2,heuristic,blocks.11,layer1,0.009830701503767926,32,0.9539383934373139,0.9627109932635457,0.9283038658941676,2.9637342826627293,graph,root-norm,silhouette,False,True,True,0.6328361714623904,0.4678255064438242,0.3700419688799281,0.7107881939275627,0.7004714890788999,COMPLETE,0.0,0.0,0.0,0.0,0.0,,3,2,0.0,0,2,0.0
298,0.0,kmeans,l2,silhouette,blocks.7,layer2,0.004751158267715332,8,0.8833412358436795,0.9715156647135599,0.9123872798882984,2.836058964961924,graph,root-norm,silhouette,False,False,True,0.543076292234554,0.45671714657943996,0.9176888491223022,0.1686263085808529,0.0003794669770238804,COMPLETE,0.0,0.0,0.0,0.0,0.0,,3,2,0.0,0,2,0.0
