number,value,params_dino_pipeline_clustering_clusterer_method,params_dino_pipeline_clustering_feature_processing_normalizer_method,params_dino_pipeline_clustering_k_selection_method,params_extractors_dino_v2_layer_name,params_extractors_resnet_layer_name,params_heuristic_settings_filter_params_filter_min_area_perc,params_heuristic_settings_generator_params_points_per_side,params_heuristic_settings_generator_params_pred_iou_thresh,params_heuristic_settings_generator_params_stability_score_thresh,params_heuristic_settings_k_heuristic_formulas_semantic_scale_factor,params_heuristic_settings_k_heuristic_formulas_structural_multiplier,params_resnet_pipeline_clustering_clusterer_method,params_resnet_pipeline_clustering_feature_processing_normalizer_method,params_resnet_pipeline_clustering_k_selection_method,params_resnet_pipeline_image_preprocessing_use_gaussian_blur,params_run_dino_pipeline,params_run_resnet_pipeline,params_validator_settings_semantic_threshold,params_validator_settings_structural_threshold,params_validator_settings_weights_clip_confidence,params_validator_settings_weights_dino_iou,params_validator_settings_weights_resnet_iou,state,user_attrs_avg_dino_iou,user_attrs_avg_resnet_iou,user_attrs_best_clip_confidence_any,user_attrs_best_dino_iou,user_attrs_best_resnet_iou,user_attrs_error,user_attrs_k_semantic_used,user_attrs_k_structural_used,user_attrs_max_clip_confidence,user_attrs_num_correct_segments,user_attrs_num_sam_masks,user_attrs_value
11,0.0,kmeans,l2,heuristic,blocks.11,layer1,0.005936803302386552,32,0.9008907297294289,0.9109370273975307,0.9748137016560534,2.548269062898904,kmeans,root-norm,silhouette,False,False,True,0.49390575823475635,0.5806275412438862,0.8946652538395055,0.6244117338859851,0.7080108698426711,COMPLETE,0.0,0.0,0.0,0.0,0.0,,3,2,0.0,0,2,0.0
284,0.0,kmeans,root-norm,heuristic,blocks.11,layer1,0.005713994308103256,8,0.8822003716682382,0.9731119104056478,0.8993508078013327,2.1277989803275315,kmeans,root-norm,silhouette,False,False,True,0.45255457527315057,0.41517626133146085,0.6398849647940699,0.9965830259911082,0.15785243559480983,COMPLETE,0.0,0.0,0.0,0.0,0.0,,3,2,0.0,0,2,0.0
285,0.0,kmeans,l2,silhouette,blocks.7,layer1,0.006681301040114516,16,0.9699040406817914,0.9041483358136375,0.9731662890748836,1.6783270135103103,graph,root-norm,heuristic,False,True,True,0.42885182508309966,0.4536580196656484,0.5154019929764619,0.7420131852255791,0.7761791234384601,COMPLETE,0.0,0.0,0.0,0.0,0.0,,3,2,0.0,0,2,0.0
286,0.0,kmeans,l2,heuristic,blocks.11,layer1,0.0077054890482480196,32,0.893533578466536,0.9440395306715869,0.6843708579101014,2.287703945547148,graph,root-norm,silhouette,False,True,False,0.46878385113946586,0.4269903296546728,0.9580570272207648,0.10002958636328896,0.2826606424009424,COMPLETE,0.0,0.0,0.0,0.0,0.0,,3,2,0.0,0,2,0.0
287,0.0,kmeans,root-norm,heuristic,blocks.7,layer2,0.005107921298666401,8,0.9366054893539925,0.9280821115421871,0.8216986221988033,2.0508970631677186,kmeans,l2,silhouette,True,False,True,0.4906938157101539,0.40012523162366226,0.8115702599102915,0.03715879893182644,0.2147847443506358,COMPLETE,0.0,0.0,0.0,0.0,0.0,,3,2,0.0,0,2,0.0
288,0.0,graph,l2,heuristic,blocks.11,layer3,0.004205794396153785,8,0.8871342472941964,0.9365641238000014,0.517823356301756,1.878092455930124,graph,root-norm,heuristic,False,True,True,0.6829441930841461,0.49683481010341174,0.11337956953106414,0.8043605749878482,0.44552275401187785,COMPLETE,0.0,0.0,0.0,0.0,0.0,,3,2,0.0,0,2,0.0
289,0.0,kmeans,root-norm,heuristic,blocks.7,layer1,0.006540297530856081,32,0.9276158370047506,0.9706207272076813,0.9881979881464882,2.6278967200967758,kmeans,root-norm,silhouette,False,False,True,0.700061996744237,0.7099461198561657,0.8532479315670296,0.9738813137563604,0.7536885583174894,COMPLETE,0.0,0.0,0.0,0.0,0.0,,3,2,0.0,0,2,0.0
290,0.0,kmeans,l2,silhouette,blocks.11,layer1,0.006018572009298824,16,0.9035439951335954,0.9394550046418669,0.9441070827264351,2.4411284862580227,graph,root-norm,silhouette,False,True,True,0.5271926790310623,0.5384570019437069,0.20590366214123917,0.34656501073702256,0.6569179865819413,COMPLETE,0.0,0.0,0.0,0.0,0.0,,3,2,0.0,0,2,0.0
291,0.0,kmeans,root-norm,heuristic,blocks.11,layer1,0.007288305404145026,8,0.877076126392401,0.9188331652085571,0.8479309925399162,2.7403381468395476,graph,l2,heuristic,False,False,False,0.47554644787876166,0.5934940102685737,0.38712295182038303,0.19225831710487595,0.9553144197970744,COMPLETE,0.0,0.0,0.0,0.0,0.0,,3,2,0.0,0,2,0.0
276,0.0,kmeans,l2,heuristic,blocks.7,layer2,0.005529441258674674,8,0.879987518945154,0.9743152062569904,0.8601979281916112,2.8729617845639517,graph,root-norm,silhouette,False,True,True,0.6654128222650797,0.6322484583327767,0.5454872884718555,0.605553054799225,0.8303737700604199,COMPLETE,0.0,0.0,0.0,0.0,0.0,,3,2,0.0,0,2,0.0
277,0.0,kmeans,root-norm,silhouette,blocks.11,layer3,0.004976364026452665,32,0.9130073689416451,0.9076839108585766,0.6467865572889634,1.536454559681396,kmeans,root-norm,heuristic,False,True,True,0.7202636646225467,0.6778527099789292,0.6654216509363506,0.2591422254047559,0.8781255492047766,COMPLETE,0.0,0.0,0.0,0.0,0.0,,3,2,0.0,0,2,0.0
278,0.0,kmeans,l2,heuristic,blocks.7,layer1,0.004597500877741384,8,0.8757797007818433,0.901886951674019,0.5368598068514989,2.0843425256514156,graph,l2,silhouette,False,False,False,0.5775024044504664,0.5433524417826501,0.1600279595059637,0.9178606836070526,0.10242889111790507,COMPLETE,0.0,0.0,0.0,0.0,0.0,,3,2,0.0,0,2,0.0
279,0.0,graph,root-norm,heuristic,blocks.11,layer1,0.006092225398077283,16,0.9070528030510954,0.9614837454178704,0.7184268821993044,1.97953114229715,kmeans,root-norm,silhouette,True,True,True,0.7062064049441841,0.5532468013575738,0.8999684323995993,0.36123225072167686,0.7151554899112125,COMPLETE,0.0,0.0,0.0,0.0,0.0,,3,2,0.0,0,2,0.0
280,0.0,kmeans,l2,heuristic,blocks.7,layer1,0.009324486955021114,8,0.8579156821547108,0.976964377191809,0.7401734469732123,2.7958020982812672,graph,root-norm,heuristic,False,False,True,0.7499219642730598,0.4335495139442214,0.34771424142829355,0.7730714988010832,0.372635177363363,COMPLETE,0.0,0.0,0.0,0.0,0.0,,3,2,0.0,0,2,0.0
281,0.0,kmeans,l2,silhouette,blocks.11,layer1,0.003992311931829605,32,0.8617932757725748,0.9304944460611617,1.0732864026166382,2.832215030398525,graph,root-norm,silhouette,False,True,True,0.5102548311817732,0.4819253140139891,0.4251490635385547,0.5368554959375358,0.6818148350656965,COMPLETE,0.0,0.0,0.0,0.0,0.0,,3,2,0.0,0,2,0.0
282,0.0,kmeans,root-norm,heuristic,blocks.11,layer2,0.008463328603970257,8,0.9474203019277203,0.9562775360611954,0.7889734164704967,2.936999771589899,kmeans,l2,silhouette,False,False,False,0.4829017529522453,0.5200296238242561,0.4870052129946769,0.2788195197431287,0.2537042324573292,COMPLETE,0.0,0.0,0.0,0.0,0.0,,3,2,0.0,0,2,0.0
283,0.0,graph,l2,heuristic,blocks.7,layer3,0.007185990882935288,32,0.8662704092267673,0.9261320523270593,0.703437567313125,2.999050563311422,graph,root-norm,heuristic,True,True,True,0.7368590888543084,0.5690354350831563,0.4530111002778652,0.21769492709598565,0.5758949169131948,COMPLETE,0.0,0.0,0.0,0.0,0.0,,3,2,0.0,0,2,0.0
268,0.0,kmeans,l2,silhouette,blocks.11,layer1,0.00808436214508658,16,0.869078151122659,0.9539010149064636,0.6686747037036134,2.468495144208869,graph,root-norm,silhouette,False,True,True,0.5040333340257726,0.6203218934881567,0.403025578907074,0.12157315867525703,0.6176172036921256,COMPLETE,0.0,0.0,0.0,0.0,0.0,,3,2,0.0,0,2,0.0
269,0.0,kmeans,l2,heuristic,blocks.7,layer1,0.0058751985376724845,32,0.8863832893748592,0.9799541799842107,0.5672192119802264,2.6071486767311094,graph,l2,heuristic,False,False,False,0.44702978586429887,0.5303571308270154,0.13651778570105955,0.3896610236515084,0.735642252730599,COMPLETE,0.0,0.0,0.0,0.0,0.0,,3,2,0.0,0,2,0.0
270,0.0,graph,root-norm,heuristic,blocks.11,layer1,0.006856710699405194,8,0.9423289406804848,0.9693876496435414,1.0083202523763808,2.9013160500620154,kmeans,root-norm,silhouette,True,True,True,0.5898448582328452,0.6062143202941882,0.8726032309905356,0.6817465852832963,0.19823491533442927,COMPLETE,0.0,0.0,0.0,0.0,0.0,,3,2,0.0,0,2,0.0
271,0.0,kmeans,l2,heuristic,blocks.7,layer2,0.005307460741198921,8,0.8733856729217266,0.9667175548965523,1.109812101765022,1.918190447673303,graph,root-norm,silhouette,False,False,True,0.41534306429043355,0.6099481858506006,0.5998547992835435,0.05685217089866489,0.12927455582192948,COMPLETE,0.0,0.0,0.0,0.0,0.0,,3,2,0.0,0,2,0.0
272,0.0,kmeans,root-norm,silhouette,blocks.11,layer3,0.003333258355171387,32,0.8891458866860996,0.9154856167308586,0.9621412499794327,1.611018850358302,kmeans,root-norm,heuristic,False,True,True,0.5567317234721657,0.5847610241503087,0.7862981606066307,0.6583208406071157,0.33416073224414133,COMPLETE,0.0,0.0,0.0,0.0,0.0,,3,2,0.0,0,2,0.0
273,0.0,kmeans,l2,heuristic,blocks.11,layer1,0.008775349761793318,8,0.8983918210138965,0.9590461658150543,0.8130988605086661,2.5113846960610577,graph,root-norm,silhouette,False,False,False,0.7288525547459194,0.44701316478175185,0.30947270251425857,0.2385194666850918,0.029193850686945765,COMPLETE,0.0,0.0,0.0,0.0,0.0,,3,2,0.0,0,2,0.0
274,0.0,kmeans,root-norm,heuristic,blocks.7,layer1,0.006366858333187086,16,0.8711853921381504,0.9508287035954058,0.7753293781796254,1.811895397390729,kmeans,l2,silhouette,True,True,True,0.4966143327832397,0.4089616386325918,0.7600501428981649,0.4269239986097527,0.06857692541220217,COMPLETE,0.0,0.0,0.0,0.0,0.0,,3,2,0.0,0,2,0.0
275,0.0,graph,l2,heuristic,blocks.11,layer1,0.007415914647983567,32,0.8543341781541924,0.9242811732036796,0.6230394208804237,1.9457601314425887,graph,root-norm,heuristic,False,False,True,0.6164478795872713,0.651822697610749,0.7024977984256404,0.3072547453471133,0.9878780329555151,COMPLETE,0.0,0.0,0.0,0.0,0.0,,3,2,0.0,0,2,0.0
36,0.0,kmeans,root-norm,silhouette,blocks.7,layer1,0.005496988168193949,8,0.9252471128403151,0.9052463561931642,0.8804775422230134,1.6344072139048789,graph,root-norm,heuristic,False,True,True,0.7300875318564887,0.45781529544003025,0.08790693806848876,0.16451127767416546,0.7507804816087773,COMPLETE,0.0,0.0,0.0,0.0,0.0,,3,2,0.0,0,2,0.0
37,0.0,graph,root-norm,heuristic,blocks.11,layer2,0.0016227244679185278,32,0.8948071640334145,0.9240122179333672,0.783375979165384,2.8962942026440226,graph,root-norm,silhouette,True,False,False,0.6612802786952815,0.6366359815849945,0.8311833684848193,0.3527535947670421,0.6269639337404004,COMPLETE,0.0,0.0,0.0,0.0,0.0,,3,2,0.0,0,2,0.0
38,0.0,kmeans,l2,silhouette,blocks.7,layer3,0.0077039861403332514,16,0.9397567172768794,0.9744001442629272,0.7410529785495853,2.7875307928059865,kmeans,l2,silhouette,False,True,True,0.624891288220853,0.6986016849515361,0.41763799555913395,0.009041223329884995,0.4010900207442335,COMPLETE,0.0,0.0,0.0,0.0,0.0,,3,2,0.0,0,2,0.0
39,0.0,kmeans,root-norm,heuristic,blocks.11,layer1,0.00820694020602757,8,0.9494557781040367,0.9710689374976554,0.9908835919532668,2.4277096087350825,graph,root-norm,heuristic,False,False,False,0.6746148743554959,0.6060365158697913,0.5927657482748789,0.8427329274490911,0.05907599376100367,COMPLETE,0.0,0.0,0.0,0.0,0.0,,3,2,0.0,0,2,0.0
40,0.0,graph,l2,heuristic,blocks.7,layer1,0.004810560688836533,8,0.918977524779581,0.94993186384437,0.9353000677656622,2.035685784345062,kmeans,root-norm,silhouette,True,True,True,0.7186228637280623,0.42327969608057964,0.21381105675300294,0.28382795699495234,0.18587220205770694,COMPLETE,0.0,0.0,0.0,0.0,0.0,,3,2,0.0,0,2,0.0
41,0.0,kmeans,root-norm,heuristic,blocks.11,layer2,0.00377634065072827,32,0.8585765959318904,0.9796697453551827,0.8099239648160802,2.2054767446554324,kmeans,l2,heuristic,False,True,False,0.7332688747486985,0.46095270629385193,0.3506753895932203,0.971208920219237,0.8806567113980437,COMPLETE,0.0,0.0,0.0,0.0,0.0,,3,2,0.0,0,2,0.0
42,0.0,kmeans,root-norm,heuristic,blocks.11,layer2,0.002952746541056472,32,0.8554486826326401,0.9610740054334937,0.607808092874628,1.8778069916014908,kmeans,l2,heuristic,False,True,False,0.699801425413089,0.4487868847179738,0.2710717661111089,0.9286838347173142,0.7797148481104522,COMPLETE,0.0,0.0,0.0,0.0,0.0,,3,2,0.0,0,2,0.0
43,0.0,kmeans,root-norm,heuristic,blocks.11,layer2,0.008971140730769418,32,0.8734354551658984,0.9550287177879032,0.7086749727937572,2.2055148875144908,kmeans,l2,heuristic,False,False,False,0.6722666131010587,0.47461208149794043,0.36940697608992434,0.7018390386017164,0.689153984445114,COMPLETE,0.0,0.0,0.0,0.0,0.0,,3,2,0.0,0,2,0.0
28,0.0,kmeans,root-norm,heuristic,blocks.7,layer3,0.006599942272295801,16,0.8607741031583555,0.9443911951419375,0.8516444405475755,1.7704212048458752,kmeans,root-norm,heuristic,False,False,True,0.5215490986665934,0.6820842660848951,0.9891567414301259,0.6548317894412822,0.6023609251203453,COMPLETE,0.0,0.0,0.0,0.0,0.0,,3,2,0.0,0,2,0.0
29,0.0,graph,root-norm,heuristic,blocks.7,layer2,0.0024628000969478133,32,0.8798970521573484,0.9148229302089178,0.6918818465800372,2.8462920210351994,graph,root-norm,heuristic,False,True,False,0.6549174092262715,0.7454129491458132,0.006363100396957866,0.31127367436593417,0.4803573485808381,COMPLETE,0.0,0.0,0.0,0.0,0.0,,3,2,0.0,0,2,0.0
30,0.0,kmeans,l2,heuristic,blocks.11,layer3,0.009296166172229017,8,0.9043944629244485,0.9335838156119758,0.7974806012495531,1.6600816180236448,graph,root-norm,silhouette,False,True,True,0.5781466071658394,0.5668912575314144,0.5513001245742112,0.8545192477296657,0.3985359146634507,COMPLETE,0.0,0.0,0.0,0.0,0.0,,3,2,0.0,0,2,0.0
31,0.0,graph,root-norm,heuristic,blocks.7,layer3,0.003608633554921877,8,0.8772211030235925,0.9063672938620567,0.714149060009235,1.5047568941284357,graph,root-norm,heuristic,False,True,False,0.6951648110131841,0.6606340430017548,0.15580437165030375,0.3411749889858823,0.5319683089736991,COMPLETE,0.0,0.0,0.0,0.0,0.0,,3,2,0.0,0,2,0.0
32,0.0,graph,root-norm,heuristic,blocks.7,layer3,0.0028491455414392857,8,0.8578988498636755,0.9192163008944833,0.7565749096833665,1.507235694106609,graph,l2,heuristic,False,True,False,0.7485678332517139,0.5977656912339827,0.03967410455585438,0.23167538440784607,0.7979242799883028,COMPLETE,0.0,0.0,0.0,0.0,0.0,,3,2,0.0,0,2,0.0
33,0.0,graph,root-norm,heuristic,blocks.7,layer3,0.007225965958010374,32,0.869629406347832,0.9080561500010875,0.6226793413072176,1.84315971633184,kmeans,root-norm,heuristic,False,True,False,0.7061242358066342,0.6408635545195746,0.18645898601676897,0.4792297621307686,0.6418982353986592,COMPLETE,0.0,0.0,0.0,0.0,0.0,,3,2,0.0,0,2,0.0
34,0.0,graph,root-norm,heuristic,blocks.7,layer2,0.00372460742998013,8,0.9388644725883439,0.9238930167542043,0.7342712086901644,1.9593462997306006,graph,l2,heuristic,False,True,False,0.6857418702487472,0.6743126104162839,0.34032251536273544,0.41992485569193905,0.5300046001648105,COMPLETE,0.0,0.0,0.0,0.0,0.0,,3,2,0.0,0,2,0.0
35,0.0,graph,root-norm,heuristic,blocks.7,layer3,0.0012159532060278854,16,0.8822821027887155,0.9119412049350694,0.6955847171330258,2.61593016671325,kmeans,root-norm,heuristic,True,True,False,0.6085954360494015,0.4347234015223147,0.4491668556696693,0.11037887970433324,0.3108810124326771,COMPLETE,0.0,0.0,0.0,0.0,0.0,,3,2,0.0,0,2,0.0
20,0.0,kmeans,l2,heuristic,blocks.7,layer1,0.007208889488388656,32,0.8612280745336368,0.9699279603585516,0.5142965382638818,2.118759396402681,graph,root-norm,silhouette,False,False,True,0.46278888840418647,0.4955598249147677,0.49672523035590604,0.2015998652534839,0.018711006744020993,COMPLETE,0.0,0.0,0.0,0.0,0.0,,3,2,0.0,0,2,0.0
21,0.0,kmeans,root-norm,heuristic,blocks.11,layer1,0.00511518695581194,8,0.8742724829713872,0.9584065941291356,0.8286601195515317,2.7129568997896487,graph,root-norm,heuristic,False,True,True,0.44326231633834606,0.493582842805647,0.6059935653267745,0.27788550664820616,0.31392683615291944,COMPLETE,0.0,0.0,0.0,0.0,0.0,,3,2,0.0,0,2,0.0
22,0.0,kmeans,root-norm,heuristic,blocks.11,layer1,0.004964460927786367,8,0.8502340785393826,0.9676242007271135,0.812498577898938,2.8371748100890826,graph,root-norm,heuristic,False,True,True,0.42943817865454986,0.49493657920700174,0.7061946680491862,0.17845783545231997,0.24723954960082428,COMPLETE,0.0,0.0,0.0,0.0,0.0,,3,2,0.0,0,2,0.0
23,0.0,kmeans,root-norm,heuristic,blocks.11,layer1,0.003182733161429638,8,0.8810962245117715,0.9545953515789143,0.8964703899621206,2.6953358463757042,graph,root-norm,heuristic,False,True,True,0.48095819139679785,0.5500134174522425,0.9084408773102126,0.4701118269263002,0.1539478244076304,COMPLETE,0.0,0.0,0.0,0.0,0.0,,3,2,0.0,0,2,0.0
24,0.0,kmeans,root-norm,heuristic,blocks.11,layer1,0.005807706386634641,8,0.8649553460290031,0.9764283357120875,0.6717860422561127,2.9973328059418964,graph,root-norm,heuristic,False,True,True,0.5253475448698244,0.6109807824080105,0.45693274312800514,0.3238732529339937,0.10862628609073399,COMPLETE,0.0,0.0,0.0,0.0,0.0,,3,2,0.0,0,2,0.0
25,0.0,kmeans,l2,heuristic,blocks.11,layer1,0.002022153474602809,8,0.8926294258772584,0.9653968961269972,0.7690371329312985,2.635326095920588,graph,root-norm,heuristic,False,True,True,0.5597745077112133,0.42479064805039657,0.294486519281819,0.13044259614671158,0.4512655385439438,COMPLETE,0.0,0.0,0.0,0.0,0.0,,3,2,0.0,0,2,0.0
26,0.0,graph,root-norm,silhouette,blocks.11,layer1,0.0043883687511062815,8,0.9128747114690864,0.9796914005753384,0.9351523959770425,2.1282648723639506,kmeans,l2,heuristic,True,True,False,0.42865922442644805,0.4766178158461022,0.840812641012544,0.40173240737352406,0.27455236450595405,COMPLETE,0.0,0.0,0.0,0.0,0.0,,3,2,0.0,0,2,0.0
27,0.0,kmeans,l2,heuristic,blocks.11,layer1,0.007979606720820856,8,0.8738165015671753,0.9509867270056257,1.0359668075193191,2.3768890032373164,graph,root-norm,silhouette,False,True,True,0.4699524822024009,0.5135761501892891,0.6659442248122694,0.5277088250575694,0.08302297071341055,COMPLETE,0.0,0.0,0.0,0.0,0.0,,3,2,0.0,0,2,0.0
12,0.0,kmeans,l2,heuristic,blocks.11,layer1,0.0098979896776434,32,0.8971773669857286,0.9635667821446141,0.9267018636398794,2.013763743351312,graph,root-norm,silhouette,False,False,True,0.6359354678666557,0.5811579895477821,0.7641836709445551,0.42178592698823464,0.7129568146776626,COMPLETE,0.0,0.0,0.0,0.0,0.0,,3,2,0.0,0,2,0.0
13,0.0,kmeans,l2,heuristic,blocks.11,layer1,0.005268758440483759,8,0.8524741839504743,0.9273039254627816,0.5718765676974251,2.2652629333444216,kmeans,root-norm,silhouette,False,False,True,0.40782009689903564,0.6269353576620286,0.2406864537971463,0.7004958592756598,0.3684090571582534,COMPLETE,0.0,0.0,0.0,0.0,0.0,,3,2,0.0,0,2,0.0
14,0.0,kmeans,l2,silhouette,blocks.7,layer3,0.006524636102118252,32,0.9035828905235649,0.9022660962139628,1.0923649999792022,2.539585158075674,graph,root-norm,silhouette,False,True,True,0.5560371505275044,0.5317898908762848,0.5322353915412144,0.4710003996534047,0.9164919362114682,COMPLETE,0.0,0.0,0.0,0.0,0.0,,3,2,0.0,0,2,0.0
15,0.0,kmeans,l2,heuristic,blocks.11,layer1,0.00413913463791253,8,0.8686239175153864,0.9602814858408437,0.8823184602307137,1.7310074201495012,kmeans,root-norm,silhouette,False,False,True,0.7171390705108236,0.4003035894953869,0.7734859775057993,0.9884329581263971,0.5789713752435948,COMPLETE,0.0,0.0,0.0,0.0,0.0,,3,2,0.0,0,2,0.0
16,0.0,kmeans,l2,heuristic,blocks.7,layer1,0.008389312589569924,32,0.8879458379952413,0.9386429205720247,0.6322055059255979,2.1193726937721,kmeans,root-norm,silhouette,False,True,True,0.6439812605618733,0.7169915126725986,0.2843952799655328,0.7596171350007037,0.43854098697473,COMPLETE,0.0,0.0,0.0,0.0,0.0,,3,2,0.0,0,2,0.0
17,0.0,kmeans,l2,heuristic,blocks.11,layer1,0.009947139406443605,8,0.9113140347799595,0.9003821630193763,1.0231413648451089,2.7200949442999707,graph,root-norm,silhouette,False,False,True,0.747829263845965,0.5488551306015972,0.4925544804667506,0.24592435457442258,0.20939760585198375,COMPLETE,0.0,0.0,0.0,0.0,0.0,,3,2,0.0,0,2,0.0
18,0.0,graph,l2,silhouette,blocks.7,layer3,0.006217747959373211,32,0.8685969124322103,0.9353920839778216,0.8536036191228596,2.4566528557847445,graph,l2,silhouette,True,True,False,0.49917184527575953,0.6168270569670987,0.6440718029104617,0.5851675948493297,0.6838782835093717,COMPLETE,0.0,0.0,0.0,0.0,0.0,,3,2,0.0,0,2,0.0
19,0.0,kmeans,l2,heuristic,blocks.11,layer2,0.004483864466417565,16,0.8891251792116132,0.9177592370191965,0.6537484982141587,2.3629778125117693,kmeans,root-norm,silhouette,False,False,True,0.4011726452760921,0.4019608745232214,0.8959748160403221,0.3767084741255522,0.8317401882393741,COMPLETE,0.0,0.0,0.0,0.0,0.0,,3,2,0.0,0,2,0.0
