number,value,params_dino_pipeline_clustering_clusterer_method,params_dino_pipeline_clustering_feature_processing_normalizer_method,params_dino_pipeline_clustering_k_selection_method,params_extractors_dino_v2_layer_name,params_extractors_resnet_layer_name,params_heuristic_settings_filter_params_filter_min_area_perc,params_heuristic_settings_generator_params_points_per_side,params_heuristic_settings_generator_params_pred_iou_thresh,params_heuristic_settings_generator_params_stability_score_thresh,params_heuristic_settings_k_heuristic_formulas_semantic_scale_factor,params_heuristic_settings_k_heuristic_formulas_structural_multiplier,params_resnet_pipeline_clustering_clusterer_method,params_resnet_pipeline_clustering_feature_processing_normalizer_method,params_resnet_pipeline_clustering_k_selection_method,params_resnet_pipeline_image_preprocessing_use_gaussian_blur,params_run_dino_pipeline,params_run_resnet_pipeline,params_validator_settings_semantic_threshold,params_validator_settings_structural_threshold,params_validator_settings_weights_clip_confidence,params_validator_settings_weights_dino_iou,params_validator_settings_weights_resnet_iou,state,user_attrs_avg_dino_iou,user_attrs_avg_resnet_iou,user_attrs_best_clip_confidence_any,user_attrs_best_dino_iou,user_attrs_best_resnet_iou,user_attrs_error,user_attrs_k_semantic_used,user_attrs_k_structural_used,user_attrs_max_clip_confidence,user_attrs_num_correct_segments,user_attrs_num_sam_masks,user_attrs_value
127,0.0,kmeans,root-norm,heuristic,blocks.7,layer1,0.009727266841290619,16,0.8911600976733608,0.9502953160765286,0.8672021819778537,2.182528180031019,graph,l2,silhouette,True,True,False,0.6540344986334021,0.45149318980159636,0.8128338616298418,0.8473794313296878,0.6254794356999407,COMPLETE,0.0,0.0,0.0,0.0,0.0,,3,2,0.0,0,2,0.0
128,0.0,graph,l2,heuristic,blocks.7,layer2,0.0023380836733960493,8,0.9148129536358527,0.9077941188968004,0.8421714842730927,2.8661538158723525,kmeans,root-norm,heuristic,False,False,True,0.720757983153037,0.5087401591153734,0.008943794943856775,0.01582639623290532,0.5203891016265678,COMPLETE,0.0,0.0,0.0,0.0,0.0,,3,2,0.0,0,2,0.0
129,0.0,kmeans,root-norm,silhouette,blocks.11,layer1,0.007975622857757122,32,0.9385862803909255,0.9670822664313398,0.8024152912963898,2.734245155523578,graph,root-norm,silhouette,False,True,True,0.6735566027863298,0.4452312861431605,0.35299076398785256,0.5106152587058661,0.4837617418385386,COMPLETE,0.0,0.0,0.0,0.0,0.0,,3,2,0.0,0,2,0.0
130,0.0,graph,l2,heuristic,blocks.7,layer3,0.005905264660361873,16,0.8878502207995237,0.9332805071717379,0.9835385660006931,1.7348484976284593,kmeans,l2,heuristic,True,True,False,0.6627135177187172,0.6659714321231149,0.7547904294348066,0.09426721995077822,0.7387033496420191,COMPLETE,0.0,0.0,0.0,0.0,0.0,,3,2,0.0,0,2,0.0
131,0.0,kmeans,l2,heuristic,blocks.11,layer1,0.005715050976542867,8,0.8527667050026531,0.922635713357733,0.5945551274421552,2.527005199080666,kmeans,root-norm,silhouette,False,False,True,0.4154453830160762,0.6149301071223596,0.3050744338315806,0.7200989472070051,0.3351832187217387,COMPLETE,0.0,0.0,0.0,0.0,0.0,,3,2,0.0,0,2,0.0
116,0.0,kmeans,l2,heuristic,blocks.11,layer1,0.007126412930247624,8,0.9792842326462761,0.9257545557113321,0.7494431253037133,1.8884731389887621,kmeans,root-norm,silhouette,True,True,True,0.48136526812444697,0.6201038357963294,0.17123354867017276,0.7474613859576933,0.7649778605123096,COMPLETE,0.0,0.0,0.0,0.0,0.0,,3,2,0.0,0,2,0.0
117,0.0,graph,root-norm,silhouette,blocks.7,layer3,0.0051906737736872755,32,0.9046695076921898,0.9442093157211437,0.9861478751563907,2.1307735701696164,graph,l2,silhouette,False,False,False,0.6951003023640849,0.457162618627014,0.7260985871871213,0.9170533169328621,0.8596551339875222,COMPLETE,0.0,0.0,0.0,0.0,0.0,,3,2,0.0,0,2,0.0
118,0.0,kmeans,l2,heuristic,blocks.11,layer2,0.006082367994061787,16,0.8961434978418106,0.9685315957921276,0.5452723265222184,2.3415358794852494,kmeans,root-norm,heuristic,False,True,True,0.5879214060332247,0.6053880841036152,0.4448172635268193,0.285333334159114,0.7028296757354239,COMPLETE,0.0,0.0,0.0,0.0,0.0,,3,2,0.0,0,2,0.0
119,0.0,kmeans,root-norm,heuristic,blocks.7,layer1,0.006868741381387075,8,0.8815381077808456,0.9165799025664059,0.8986687488549767,2.233136781640757,graph,l2,silhouette,True,False,True,0.5315555212457704,0.6482446341099286,0.7521446413830131,0.3972822132283055,0.43932103976079656,COMPLETE,0.0,0.0,0.0,0.0,0.0,,3,2,0.0,0,2,0.0
120,0.0,graph,l2,silhouette,blocks.11,layer1,0.003111108658380699,32,0.8917603018380479,0.9799187395486089,1.0924131398581451,2.9479444581544105,kmeans,root-norm,heuristic,False,True,False,0.4949816206738131,0.5702420821875183,0.9623355232162574,0.6824301253694585,0.08906419398793508,COMPLETE,0.0,0.0,0.0,0.0,0.0,,3,2,0.0,0,2,0.0
121,0.0,kmeans,l2,heuristic,blocks.11,layer1,0.009250472915975333,32,0.8753937597277737,0.9656481362860296,0.9247272317250539,1.9650931226748252,graph,root-norm,silhouette,False,False,True,0.6343690595658383,0.4338528466985202,0.9153218879483472,0.32857432126746045,0.6474751902440316,COMPLETE,0.0,0.0,0.0,0.0,0.0,,3,2,0.0,0,2,0.0
122,0.0,kmeans,l2,heuristic,blocks.11,layer1,0.008645351654330922,32,0.8868942406012663,0.9644426509860569,0.9459070622436969,1.8141911768010024,graph,root-norm,silhouette,False,False,True,0.6049432387210517,0.5500009377589837,0.7951683133287532,0.4482802732886032,0.6800248992918704,COMPLETE,0.0,0.0,0.0,0.0,0.0,,3,2,0.0,0,2,0.0
123,0.0,kmeans,l2,heuristic,blocks.11,layer1,0.008794252859060363,32,0.9114887754443821,0.9724641878162382,0.8904120423206826,1.9357915847884497,graph,root-norm,silhouette,False,False,True,0.6177045504695721,0.5890488521935612,0.5734424595687229,0.729742703954455,0.7211312146766771,COMPLETE,0.0,0.0,0.0,0.0,0.0,,3,2,0.0,0,2,0.0
108,0.0,kmeans,root-norm,heuristic,blocks.11,layer1,0.008324334942019822,16,0.956421743868413,0.9027787111509081,0.7163037662399907,2.6810730505377833,graph,root-norm,silhouette,True,False,True,0.45261460449176955,0.5434837417796758,0.8849339951883416,0.4318053329163617,0.5893293003982221,COMPLETE,0.0,0.0,0.0,0.0,0.0,,3,2,0.0,0,2,0.0
109,0.0,kmeans,l2,heuristic,blocks.7,layer3,0.006709722524060862,8,0.9417637740023798,0.9385854336952208,0.5571323167215044,2.8957957456325323,kmeans,l2,heuristic,False,True,False,0.4620980606963854,0.5829534115805975,0.6741457286962781,0.9399646657662226,0.29430606203139664,COMPLETE,0.0,0.0,0.0,0.0,0.0,,3,2,0.0,0,2,0.0
110,0.0,graph,root-norm,heuristic,blocks.11,layer2,0.003952364893091497,32,0.916968211526052,0.919171120746213,0.7836617465736269,2.8085458818962756,graph,root-norm,silhouette,False,True,True,0.7132186152747074,0.5951826690601909,0.4265959614397916,0.47242096940271466,0.17349315603636284,COMPLETE,0.0,0.0,0.0,0.0,0.0,,3,2,0.0,0,2,0.0
111,0.0,kmeans,l2,heuristic,blocks.11,layer1,0.0056678463664758,32,0.9003563862742734,0.9108351486400202,0.9456032180940372,2.3719198807532633,kmeans,root-norm,silhouette,False,False,True,0.490495889993629,0.5612529418100094,0.8885995226795727,0.5313486866957662,0.7265287786074875,COMPLETE,0.0,0.0,0.0,0.0,0.0,,3,2,0.0,0,2,0.0
112,0.0,kmeans,l2,heuristic,blocks.11,layer1,0.005360357823489241,32,0.8569462396149083,0.9061206477511546,0.913357143806307,2.5892641924111355,kmeans,root-norm,silhouette,False,False,True,0.7489701999993631,0.5799138705537902,0.816639233584197,0.6160662175803105,0.8091364051917672,COMPLETE,0.0,0.0,0.0,0.0,0.0,,3,2,0.0,0,2,0.0
113,0.0,kmeans,l2,heuristic,blocks.11,layer1,0.006436588959200731,32,0.8843589203617527,0.9145865134057944,0.9700141030035246,2.4923605775888595,kmeans,root-norm,silhouette,False,False,True,0.5187439220275846,0.7185248268114423,0.7056693989638354,0.5788453643402083,0.12177555276583936,COMPLETE,0.0,0.0,0.0,0.0,0.0,,3,2,0.0,0,2,0.0
114,0.0,kmeans,l2,heuristic,blocks.11,layer1,0.004926153300519724,32,0.9271405069638315,0.9464579747325029,1.0470547796865166,2.848216611388658,kmeans,root-norm,silhouette,False,False,True,0.5040389094917576,0.5247567346855101,0.6461649511847011,0.04993040936738537,0.3786818013008903,COMPLETE,0.0,0.0,0.0,0.0,0.0,,3,2,0.0,0,2,0.0
115,0.0,kmeans,root-norm,heuristic,blocks.7,layer1,0.001876238163979551,16,0.8726618317125038,0.9011108751205383,1.0149341516521462,2.4014266560171786,kmeans,root-norm,heuristic,False,False,True,0.46636274555304114,0.6311491063206139,0.7866347125566371,0.7993005700427578,0.056771187057904994,COMPLETE,0.0,0.0,0.0,0.0,0.0,,3,2,0.0,0,2,0.0
164,0.0,kmeans,l2,heuristic,blocks.7,layer1,0.0013381466315268863,32,0.9354273372832806,0.9551172998734336,0.5342348529074802,2.58814797268058,kmeans,root-norm,silhouette,False,True,True,0.6177085511985051,0.7371660151503003,0.24814454701141805,0.8051890199113342,0.32653541477148773,COMPLETE,0.0,0.0,0.0,0.0,0.0,,3,2,0.0,0,2,0.0
165,0.0,graph,root-norm,heuristic,blocks.7,layer1,0.004425087834209546,32,0.8940306865807602,0.9133390318252702,0.5955097193831892,2.8806165693969312,kmeans,root-norm,silhouette,False,True,True,0.5556468636567479,0.7136741498437328,0.802335733009193,0.1403853968230959,0.3873761351668618,COMPLETE,0.0,0.0,0.0,0.0,0.0,,3,2,0.0,0,2,0.0
166,0.0,kmeans,l2,silhouette,blocks.11,layer3,0.008780232536776844,8,0.8841006413123829,0.9438084580754444,0.6382644389400254,2.790632500123788,kmeans,root-norm,silhouette,False,True,True,0.6592790123420782,0.5329066162060889,0.9063818434836823,0.6030896357044971,0.402283639536585,COMPLETE,0.0,0.0,0.0,0.0,0.0,,3,2,0.0,0,2,0.0
167,0.0,kmeans,root-norm,heuristic,blocks.7,layer1,0.005828010005890207,16,0.8816384575893725,0.9400797565997773,0.698944322664404,2.6598852113601157,graph,root-norm,heuristic,False,False,True,0.6670552030227829,0.6087615299714079,0.29267845801705533,0.7634958874689597,0.5478426389859387,COMPLETE,0.0,0.0,0.0,0.0,0.0,,3,2,0.0,0,2,0.0
168,0.0,graph,l2,heuristic,blocks.7,layer1,0.00860956649386182,32,0.9177161234174648,0.9737363376537581,0.7442750509676024,2.095972601777063,kmeans,l2,silhouette,True,True,False,0.6267526668590525,0.7238093340659392,0.19650588820634002,0.7157520193956942,0.3541852760190226,COMPLETE,0.0,0.0,0.0,0.0,0.0,,3,2,0.0,0,2,0.0
169,0.0,kmeans,l2,silhouette,blocks.11,layer2,0.008279699431767611,8,0.8864485523279574,0.9568012361622579,0.8503110795818742,2.030830027520964,graph,root-norm,silhouette,False,False,True,0.6955139813155696,0.5766677027183138,0.34194055871350626,0.5012364571273196,0.6816752291391587,COMPLETE,0.0,0.0,0.0,0.0,0.0,,3,2,0.0,0,2,0.0
170,0.0,kmeans,root-norm,heuristic,blocks.7,layer1,0.003228084595948488,32,0.8711467608233873,0.9489934044254486,1.0022385966277032,2.9337090751006207,kmeans,root-norm,heuristic,False,True,True,0.5037224933894082,0.49910657978618755,0.5398354795165323,0.3450732270163076,0.4377113518141565,COMPLETE,0.0,0.0,0.0,0.0,0.0,,3,2,0.0,0,2,0.0
171,0.0,kmeans,l2,heuristic,blocks.11,layer1,0.009725103926845148,8,0.9067378009158842,0.9016167172713926,1.0368696845581031,2.7292505846187103,graph,root-norm,silhouette,False,False,True,0.7330099195087777,0.5480486604831251,0.4577567010797991,0.2585693661615479,0.2959343127013454,COMPLETE,0.0,0.0,0.0,0.0,0.0,,3,2,0.0,0,2,0.0
156,0.0,kmeans,root-norm,heuristic,blocks.11,layer1,0.008503544199290424,32,0.9451818990092073,0.9477933068814157,0.8598554853947188,1.9421358797099162,graph,root-norm,silhouette,False,False,True,0.545907364988026,0.423345211388166,0.6523969452207937,0.059687704066254024,0.18845803585000426,COMPLETE,0.0,0.0,0.0,0.0,0.0,,3,2,0.0,0,2,0.0
157,0.0,kmeans,l2,silhouette,blocks.7,layer2,0.005173180833055183,8,0.9259635122826658,0.9424265168631245,0.7556545417906202,1.6212762442454285,kmeans,l2,silhouette,True,True,False,0.7430406941788037,0.44929773263459977,0.1611679524726804,0.999697613080237,0.1187470185649049,COMPLETE,0.0,0.0,0.0,0.0,0.0,,3,2,0.0,0,2,0.0
158,0.0,graph,root-norm,heuristic,blocks.11,layer1,0.0035580209469246436,16,0.9127950162364162,0.9621240443096696,0.9515744171584263,1.7799591408830595,graph,root-norm,heuristic,False,False,True,0.5132893743347134,0.4043090036101523,0.39905536458697205,0.39765743811570686,0.0025066756159492086,COMPLETE,0.0,0.0,0.0,0.0,0.0,,3,2,0.0,0,2,0.0
159,0.0,kmeans,l2,heuristic,blocks.7,layer1,0.009144621097390681,32,0.9513177929339647,0.9274445959817773,0.9027788724686265,1.6851811248978137,kmeans,root-norm,silhouette,False,True,True,0.7166406400412406,0.5181766489284308,0.4395623996708599,0.743839264273693,0.0958279198109952,COMPLETE,0.0,0.0,0.0,0.0,0.0,,3,2,0.0,0,2,0.0
160,0.0,kmeans,l2,heuristic,blocks.11,layer2,0.004930469902986812,8,0.8761501364521852,0.9455640141483935,0.7234862269755755,2.010623903940355,graph,l2,heuristic,True,False,False,0.4777698027463226,0.6221776394100764,0.271297342504831,0.9138377796248383,0.6556710856996439,COMPLETE,0.0,0.0,0.0,0.0,0.0,,3,2,0.0,0,2,0.0
161,0.0,kmeans,l2,heuristic,blocks.7,layer1,0.008128824764216978,32,0.8597825485523798,0.9294140465021307,0.6228678863718533,2.1833836794534505,kmeans,root-norm,silhouette,False,True,True,0.6096085108012869,0.7296622792886941,0.36228529935231374,0.7680988813167,0.43905695149597923,COMPLETE,0.0,0.0,0.0,0.0,0.0,,3,2,0.0,0,2,0.0
162,0.0,kmeans,l2,heuristic,blocks.7,layer1,0.0026414377707291714,32,0.8782145678965296,0.9515155766232117,0.5774181183709362,2.1219754899041114,kmeans,root-norm,silhouette,False,True,True,0.6773764781838427,0.7490342479919919,0.9389166608025743,0.17770563340870488,0.4889247298634113,COMPLETE,0.0,0.0,0.0,0.0,0.0,,3,2,0.0,0,2,0.0
163,0.0,kmeans,l2,heuristic,blocks.7,layer1,0.007902638345633413,32,0.8885901362051303,0.9333833399592664,0.6651580518732496,1.9016916970324156,kmeans,root-norm,silhouette,False,True,True,0.6467967533134228,0.7027935706341614,0.3149156377155804,0.03847355702487109,0.6199616020394153,COMPLETE,0.0,0.0,0.0,0.0,0.0,,3,2,0.0,0,2,0.0
148,0.0,kmeans,l2,heuristic,blocks.11,layer2,0.006261598080011073,8,0.8745639072682552,0.9028314515462238,1.0538237315974357,2.8339611045710185,graph,root-norm,heuristic,False,False,True,0.700165026681744,0.4074792651797937,0.11858390611138536,0.45872308050190347,0.7926301522898309,COMPLETE,0.0,0.0,0.0,0.0,0.0,,3,2,0.0,0,2,0.0
149,0.0,kmeans,l2,silhouette,blocks.7,layer1,0.00768306385423579,32,0.8541266232813401,0.9237656789399122,1.0206764881066057,2.903811660925647,kmeans,root-norm,silhouette,True,True,True,0.5815656614493808,0.6919999909073552,0.5698915464973382,2.977065273993256e-05,0.668143900877969,COMPLETE,0.0,0.0,0.0,0.0,0.0,,3,2,0.0,0,2,0.0
150,0.0,graph,root-norm,heuristic,blocks.11,layer1,0.008334430961023325,16,0.8839250755686088,0.9089996269023727,0.5606420970441944,2.217747629071128,graph,l2,silhouette,False,False,False,0.46860609574712225,0.6364604140183524,0.6147703868549871,0.963158029609527,0.8459836152415744,COMPLETE,0.0,0.0,0.0,0.0,0.0,,3,2,0.0,0,2,0.0
151,0.0,kmeans,l2,heuristic,blocks.11,layer1,0.005376392482716398,8,0.8731216152523599,0.9610032930215423,1.1829231676734342,1.8277400403392816,kmeans,root-norm,silhouette,False,False,True,0.7093412852248165,0.46079069836517034,0.7403755590417416,0.9374959105348445,0.5246826548435785,COMPLETE,0.0,0.0,0.0,0.0,0.0,,3,2,0.0,0,2,0.0
152,0.0,kmeans,l2,heuristic,blocks.11,layer1,0.0042070328661055235,8,0.9091586194299507,0.964390324751303,0.8829364138337497,1.7278188815021178,kmeans,root-norm,silhouette,False,False,True,0.7362413058941099,0.4357472952862031,0.7178492093758294,0.9870655582921277,0.574896073431211,COMPLETE,0.0,0.0,0.0,0.0,0.0,,3,2,0.0,0,2,0.0
153,0.0,kmeans,l2,heuristic,blocks.11,layer1,0.003978506838475923,8,0.8648604154245503,0.960116742231692,1.1984374161727567,1.5727253492259254,kmeans,root-norm,silhouette,False,False,True,0.7260476079305377,0.5903899524023524,0.6789554187522109,0.42952343897669193,0.044539967942902964,COMPLETE,0.0,0.0,0.0,0.0,0.0,,3,2,0.0,0,2,0.0
154,0.0,kmeans,l2,heuristic,blocks.11,layer1,0.005678597126390291,8,0.9751398411659742,0.9583449861737268,0.9106193145165604,1.858206092614492,kmeans,root-norm,silhouette,False,False,True,0.7181799450543846,0.4145466168041539,0.7758740280072502,0.8786028900675446,0.7026399056039234,COMPLETE,0.0,0.0,0.0,0.0,0.0,,3,2,0.0,0,2,0.0
155,0.0,kmeans,l2,heuristic,blocks.7,layer3,0.007344437580743405,8,0.8985144465709414,0.9000369609398545,0.9369967290340341,1.5433015910715697,kmeans,root-norm,heuristic,False,True,True,0.44876768896670927,0.6799421574175321,0.8490220512079595,0.5230878393964871,0.2195208958746215,COMPLETE,0.0,0.0,0.0,0.0,0.0,,3,2,0.0,0,2,0.0
140,0.0,graph,l2,heuristic,blocks.7,layer2,0.0037676714624389164,32,0.906250351011957,0.9207933439968257,0.8784175896324142,2.4377437833258386,kmeans,l2,silhouette,False,True,False,0.6017884223065734,0.6768193030717137,0.18604428486063357,0.22698648611501293,0.6065819253188554,COMPLETE,0.0,0.0,0.0,0.0,0.0,,3,2,0.0,0,2,0.0
141,0.0,kmeans,l2,silhouette,blocks.7,layer3,0.0065080239363129126,32,0.9042179087398988,0.9026243907072812,0.6784244973581219,2.5601283137737023,graph,root-norm,silhouette,False,True,True,0.5535871574325908,0.5658929682718603,0.5427737320299819,0.4867670923130318,0.9120708543031208,COMPLETE,0.0,0.0,0.0,0.0,0.0,,3,2,0.0,0,2,0.0
142,0.0,kmeans,l2,silhouette,blocks.7,layer3,0.0059767406076848845,32,0.8940166985522309,0.9305630217398074,1.1537605565197477,2.4753749630715522,graph,root-norm,silhouette,False,True,True,0.5916658702300124,0.4402905046326603,0.4834057461707605,0.3844388617094692,0.9624139354920964,COMPLETE,0.0,0.0,0.0,0.0,0.0,,3,2,0.0,0,2,0.0
143,0.0,kmeans,l2,silhouette,blocks.7,layer3,0.003444683614658184,32,0.8501961646147848,0.9010367454237483,1.126809222395547,2.627170937768373,graph,root-norm,silhouette,False,True,True,0.4569235809246307,0.5296205049273459,0.5930067213478492,0.5693753340229598,0.9266911901310908,COMPLETE,0.0,0.0,0.0,0.0,0.0,,3,2,0.0,0,2,0.0
144,0.0,kmeans,l2,silhouette,blocks.7,layer3,0.006721410751548043,32,0.8679153965784616,0.9756345413118722,0.7749488375616626,2.398663033529374,graph,root-norm,silhouette,False,True,True,0.5411274551220123,0.596990782307682,0.5172543806143873,0.4521818120171453,0.4659558928514932,COMPLETE,0.0,0.0,0.0,0.0,0.0,,3,2,0.0,0,2,0.0
145,0.0,kmeans,root-norm,heuristic,blocks.7,layer1,0.006405489565590104,8,0.9029083833125585,0.9115199928227538,0.9158467188772346,2.9656918193415347,graph,root-norm,silhouette,False,True,True,0.731579519850322,0.4279434742219139,0.41629256652474805,0.4153965860447055,0.8855085617986149,COMPLETE,0.0,0.0,0.0,0.0,0.0,,3,2,0.0,0,2,0.0
146,0.0,kmeans,l2,silhouette,blocks.11,layer3,0.006179748517106728,16,0.9309922079240618,0.938438313460126,1.0803176124263083,2.5203766926715763,graph,root-norm,heuristic,True,False,True,0.6266549412308281,0.4684934115884243,0.8413438131993248,0.7036427006357491,0.9617945791974398,COMPLETE,0.0,0.0,0.0,0.0,0.0,,3,2,0.0,0,2,0.0
147,0.0,graph,root-norm,heuristic,blocks.7,layer1,0.007012192826235446,32,0.9587254638498041,0.9059049193861686,1.1008385187316434,2.1542091848145226,kmeans,l2,silhouette,False,True,False,0.5658946173119322,0.4911303784596729,0.7750241865032392,0.791042912506676,0.7689433687489943,COMPLETE,0.0,0.0,0.0,0.0,0.0,,3,2,0.0,0,2,0.0
196,0.0,kmeans,l2,heuristic,blocks.11,layer2,0.009994694824074,32,0.8576101652072465,0.9170851587616536,0.7559752289278473,2.1977176399448175,graph,root-norm,silhouette,False,True,True,0.7242451541642995,0.43794819204585783,0.9992324448711642,0.778344687447575,0.7831275307480043,COMPLETE,0.0,0.0,0.0,0.0,0.0,,3,2,0.0,0,2,0.0
197,0.0,graph,l2,heuristic,blocks.7,layer1,0.00849471261117213,16,0.9557374037801611,0.9272227234148267,1.116493737694771,2.913091216767301,kmeans,l2,silhouette,True,False,False,0.5156317833604729,0.6873956662466805,0.4302658062252617,0.29961967225472763,0.8093120384256633,COMPLETE,0.0,0.0,0.0,0.0,0.0,,3,2,0.0,0,2,0.0
198,0.0,kmeans,root-norm,heuristic,blocks.7,layer1,0.005530404793040067,8,0.9050204070053209,0.912903977679404,1.1628195351046302,1.9433599168581275,graph,root-norm,heuristic,False,True,True,0.6860585648790368,0.640786457028679,0.9552047824669299,0.5735941556840716,0.7045014234994603,COMPLETE,0.0,0.0,0.0,0.0,0.0,,3,2,0.0,0,2,0.0
199,0.0,kmeans,l2,silhouette,blocks.11,layer2,0.006622272451307191,32,0.8745594382753883,0.9293786056021506,0.9317454631454883,1.8799718735065434,kmeans,root-norm,silhouette,False,False,True,0.7102540212003104,0.4052303161080911,0.9083401586750696,0.02561560937764203,0.954281233924965,COMPLETE,0.0,0.0,0.0,0.0,0.0,,3,2,0.0,0,2,0.0
200,0.0,kmeans,l2,heuristic,blocks.7,layer1,0.006178009017995058,8,0.9633084265849173,0.9766072851498321,0.8991619290586998,2.1627429836456824,graph,l2,silhouette,False,True,False,0.5098964845600233,0.5701939869870192,0.3574862853656401,0.6505690991590352,0.3132510716390279,COMPLETE,0.0,0.0,0.0,0.0,0.0,,3,2,0.0,0,2,0.0
201,0.0,kmeans,l2,heuristic,blocks.7,layer1,0.005819650346152276,32,0.8537603586335076,0.9707549089440373,0.5214686778494875,2.1200521386313094,graph,root-norm,silhouette,False,False,True,0.44516342949026944,0.5295065469603304,0.5128950871695951,0.20875982400489557,0.10311902489859201,COMPLETE,0.0,0.0,0.0,0.0,0.0,,3,2,0.0,0,2,0.0
202,0.0,kmeans,l2,heuristic,blocks.7,layer1,0.0071349593122205695,32,0.9324329570651126,0.9688264222520169,0.6124234280433065,2.376907509727499,graph,root-norm,silhouette,False,False,True,0.7497357483834771,0.5157322403890092,0.5508351232082486,0.24602823723760875,0.0553950974374,COMPLETE,0.0,0.0,0.0,0.0,0.0,,3,2,0.0,0,2,0.0
203,0.0,kmeans,l2,heuristic,blocks.7,layer1,0.007420603953078489,32,0.8626954412354829,0.9431334818773732,0.5441968853694249,2.0107947629378047,graph,root-norm,silhouette,False,False,True,0.45190304626324707,0.4570639338156225,0.4859235027588624,0.18054898519069681,0.08494514931298858,COMPLETE,0.0,0.0,0.0,0.0,0.0,,3,2,0.0,0,2,0.0
188,0.0,kmeans,root-norm,heuristic,blocks.7,layer1,0.0028946436725261274,16,0.876332415165965,0.9248395133393186,0.780081328606279,2.5095565044825374,graph,root-norm,silhouette,False,True,True,0.4379077704462296,0.5905010818778476,0.7454978194197711,0.019220352895000355,0.27647334796488776,COMPLETE,0.0,0.0,0.0,0.0,0.0,,3,2,0.0,0,2,0.0
