number,value,params_dino_pipeline_clustering_clusterer_method,params_dino_pipeline_clustering_feature_processing_normalizer_method,params_dino_pipeline_clustering_k_selection_method,params_extractors_dino_v2_layer_name,params_extractors_resnet_layer_name,params_heuristic_settings_filter_params_filter_min_area_perc,params_heuristic_settings_generator_params_points_per_side,params_heuristic_settings_generator_params_pred_iou_thresh,params_heuristic_settings_generator_params_stability_score_thresh,params_heuristic_settings_k_heuristic_formulas_semantic_scale_factor,params_heuristic_settings_k_heuristic_formulas_structural_multiplier,params_resnet_pipeline_clustering_clusterer_method,params_resnet_pipeline_clustering_feature_processing_normalizer_method,params_resnet_pipeline_clustering_k_selection_method,params_resnet_pipeline_image_preprocessing_use_gaussian_blur,params_run_dino_pipeline,params_run_resnet_pipeline,params_validator_settings_semantic_threshold,params_validator_settings_structural_threshold,params_validator_settings_weights_clip_confidence,params_validator_settings_weights_dino_iou,params_validator_settings_weights_resnet_iou,state,user_attrs_avg_dino_iou,user_attrs_avg_resnet_iou,user_attrs_best_clip_confidence_any,user_attrs_best_dino_iou,user_attrs_best_resnet_iou,user_attrs_error,user_attrs_k_semantic_used,user_attrs_k_structural_used,user_attrs_max_clip_confidence,user_attrs_num_correct_segments,user_attrs_num_sam_masks,user_attrs_value
299,0.0,kmeans,root-norm,heuristic,blocks.11,layer3,0.007918537607722072,8,0.9798199543926184,0.9544431514177428,0.7487790489697631,2.5587871447334187,kmeans,root-norm,heuristic,False,True,False,0.6711273963815858,0.4788628056059244,0.40248847662968174,0.0792133773374499,0.5314339673842978,COMPLETE,0.0,0.0,0.0,0.0,0.0,,3,2,0.0,0,2,0.0
0,0.0,kmeans,l2,heuristic,blocks.7,layer1,0.007658127778298977,8,0.8768000208079056,0.9668185585485507,0.8916294541401604,2.116131449318574,graph,root-norm,silhouette,False,False,True,0.47476051122541624,0.43168048369742734,0.4313028983565078,0.3723715029696981,0.07402181780231698,COMPLETE,0.0,0.0,0.0,0.0,0.0,,3,2,0.0,0,2,0.0
1,0.0,kmeans,l2,heuristic,blocks.11,layer1,0.0059217044413298146,32,0.879605346275729,0.9001671358192144,0.7506273702173037,2.835904898282649,kmeans,root-norm,silhouette,False,True,True,0.7325326095187387,0.6002498297570699,0.8491614915540618,0.7539452606713295,0.6769668242874126,COMPLETE,0.0,0.0,0.0,0.0,0.0,,3,2,0.0,0,2,0.0
2,0.0,kmeans,root-norm,heuristic,blocks.11,layer1,0.005022788240987078,8,0.8704670875765878,0.9616491567210709,0.803234381733156,2.8978428323080467,graph,root-norm,heuristic,False,True,True,0.4384916768645996,0.49722434822704514,0.6119163498951785,0.24386803673234914,0.2904532452485231,COMPLETE,0.0,0.0,0.0,0.0,0.0,,3,2,0.0,0,2,0.0
3,0.0,graph,root-norm,heuristic,blocks.7,layer3,0.0027139746558052973,8,0.877554626948159,0.915592112090055,0.7140855874523364,1.5505913325170115,graph,root-norm,heuristic,False,True,False,0.6864742989286717,0.6547498774026529,0.12831215449008215,0.33337459591212837,0.5164516405993785,COMPLETE,0.0,0.0,0.0,0.0,0.0,,3,2,0.0,0,2,0.0
4,0.0,kmeans,root-norm,heuristic,blocks.11,layer2,0.0036986149999062665,32,0.8564846759286748,0.9769089622596199,0.7320129201184243,1.915622366430352,kmeans,l2,heuristic,False,True,False,0.7242537896731498,0.44156934555984506,0.3921313863322484,0.9245508692796119,0.7977722484187082,COMPLETE,0.0,0.0,0.0,0.0,0.0,,3,2,0.0,0,2,0.0
5,0.0,kmeans,root-norm,silhouette,blocks.7,layer3,0.007472375679936031,32,0.9363291080568733,0.9280608435624202,0.9680325688403164,2.797328571921359,kmeans,l2,heuristic,False,False,True,0.5394885787555622,0.7153630571992796,0.5905651850444268,0.006640365559523742,0.5705334919451955,COMPLETE,0.0,0.0,0.0,0.0,0.0,,3,2,0.0,0,2,0.0
6,0.0,graph,root-norm,heuristic,blocks.11,layer2,0.008763848333700273,16,0.9541229465003088,0.9267484225005391,0.7300659183758273,2.5044935246830375,kmeans,root-norm,silhouette,True,True,True,0.5938892616719932,0.4654355930032141,0.3705203318913818,0.7764493107952349,0.3429044135484307,COMPLETE,0.0,0.0,0.0,0.0,0.0,,3,2,0.0,0,2,0.0
7,0.0,kmeans,l2,heuristic,blocks.7,layer1,0.006854957455697321,16,0.9267717759123961,0.9457739609825911,0.7463845383914345,1.9476410511471447,graph,l2,silhouette,True,True,True,0.6777010422806748,0.44129858936558747,0.7351667895692481,0.1070999105274929,0.9787621088063403,COMPLETE,0.0,0.0,0.0,0.0,0.0,,3,2,0.0,0,2,0.0
8,0.0,graph,root-norm,heuristic,blocks.7,layer1,0.008657400023304618,16,0.9244946160553695,0.945481574511615,0.7867205489827708,2.983336907311189,kmeans,root-norm,silhouette,False,False,True,0.6062849672333521,0.6546774839185951,0.12174597014373834,0.042622252438372144,0.17810752673123098,COMPLETE,0.0,0.0,0.0,0.0,0.0,,3,2,0.0,0,2,0.0
9,0.0,kmeans,l2,silhouette,blocks.7,layer2,0.007799493022442126,8,0.8849511366797638,0.9512660126713266,1.1986313666079538,2.907775145647773,graph,root-norm,heuristic,True,True,False,0.4572138544023708,0.4588588195870842,0.391069199939697,0.8707015852142497,0.11166923327664835,COMPLETE,0.0,0.0,0.0,0.0,0.0,,3,2,0.0,0,2,0.0
10,0.0,graph,l2,silhouette,blocks.7,layer1,0.0010529700053106758,8,0.9772757989781041,0.9731568259840758,0.5800517058251362,2.272775025980832,graph,l2,silhouette,True,False,False,0.5073863083748893,0.5309279562358367,0.9997256963743797,0.5594340731261148,0.0018598841161681506,COMPLETE,0.0,0.0,0.0,0.0,0.0,,3,2,0.0,0,2,0.0
260,0.0,kmeans,root-norm,silhouette,blocks.7,layer3,0.009117106860835332,8,0.9596339787834948,0.9048497939001798,1.1755974794588897,2.68371493360199,kmeans,root-norm,silhouette,False,False,True,0.5187430653347951,0.5127834341688837,0.07880197692532744,0.33922688613826857,0.15761776629530588,COMPLETE,0.0,0.0,0.0,0.0,0.0,,3,2,0.0,0,2,0.0
261,0.0,kmeans,l2,heuristic,blocks.11,layer2,0.004847280233164523,32,0.8957910290377057,0.9643636236659965,0.6955865571533265,2.2469984927221125,graph,l2,heuristic,True,True,False,0.53409716175023,0.5908964744050144,0.36113818137393977,0.9388047048346403,0.5901446885656614,COMPLETE,0.0,0.0,0.0,0.0,0.0,,3,2,0.0,0,2,0.0
262,0.0,graph,root-norm,heuristic,blocks.11,layer1,0.0075917965646495646,8,0.8815852518262308,0.9199605328517161,0.7509806422441888,2.3748926886294894,kmeans,root-norm,silhouette,False,False,True,0.6416484425215734,0.42006934046225947,0.26254495897034835,0.02834400129820545,0.004267083423770985,COMPLETE,0.0,0.0,0.0,0.0,0.0,,3,2,0.0,0,2,0.0
263,0.0,kmeans,l2,heuristic,blocks.7,layer1,0.0024999541841026554,16,0.8642831357661207,0.9328565128613898,0.9326552766188909,2.7759008709880164,graph,root-norm,silhouette,False,True,True,0.5460666701210318,0.4378004520954245,0.465129187089204,0.0006049271866709911,0.6689213153364221,COMPLETE,0.0,0.0,0.0,0.0,0.0,,3,2,0.0,0,2,0.0
264,0.0,kmeans,l2,silhouette,blocks.11,layer1,0.009574255153013831,32,0.878199526644485,0.9489729052298612,0.8923669002753258,2.975370017721997,graph,root-norm,heuristic,False,False,True,0.4562995883792605,0.5620264944127483,0.22390260856986488,0.7168172039388577,0.30770624313227646,COMPLETE,0.0,0.0,0.0,0.0,0.0,,3,2,0.0,0,2,0.0
265,0.0,kmeans,root-norm,heuristic,blocks.7,layer3,0.00990167660751803,8,0.8504463053427171,0.9606967133427861,0.6037318209707943,2.0173689982304897,kmeans,l2,silhouette,False,True,False,0.4239334946089569,0.4924860171164585,0.9234245709735679,0.5689978329275787,0.5384756298540068,COMPLETE,0.0,0.0,0.0,0.0,0.0,,3,2,0.0,0,2,0.0
266,0.0,graph,l2,heuristic,blocks.11,layer2,0.004279980887816487,32,0.9206554024510951,0.938009610505583,0.8331236517273204,2.7074174911148745,graph,root-norm,silhouette,True,True,True,0.465307338684197,0.4717815404843583,0.7210683033488089,0.48396106911540016,0.42165853313653756,COMPLETE,0.0,0.0,0.0,0.0,0.0,,3,2,0.0,0,2,0.0
267,0.0,kmeans,root-norm,heuristic,blocks.7,layer1,0.008376913134121772,8,0.9304572030639686,0.9405496428566797,1.1428674783490982,2.2110460393551614,kmeans,root-norm,heuristic,False,False,True,0.43574315743111525,0.5036684309847109,0.7409109636089127,0.8381312049129056,0.49554153644920695,COMPLETE,0.0,0.0,0.0,0.0,0.0,,3,2,0.0,0,2,0.0
252,0.0,kmeans,root-norm,heuristic,blocks.7,layer1,0.006199085250706409,16,0.8765126824820271,0.9288909312418651,0.6555695916423785,2.1228407730397056,graph,l2,silhouette,False,True,False,0.4978729127535572,0.6374794739352815,0.79985295266953,0.7486118726095252,0.6431689987313439,COMPLETE,0.0,0.0,0.0,0.0,0.0,,3,2,0.0,0,2,0.0
253,0.0,graph,l2,heuristic,blocks.11,layer1,0.00438173150330486,32,0.8608170581637266,0.9752094446224393,0.7644278052726035,2.930888505558649,kmeans,root-norm,heuristic,True,False,True,0.4791338046499297,0.4983279213809664,0.18134273943131615,0.3964504957764611,0.6943447268964523,COMPLETE,0.0,0.0,0.0,0.0,0.0,,3,2,0.0,0,2,0.0
254,0.0,kmeans,root-norm,heuristic,blocks.7,layer1,0.006581493163493094,8,0.892013072008635,0.9023492666236667,0.501995775550326,2.85578493138572,graph,root-norm,silhouette,False,True,True,0.7423892193444934,0.4425656256580413,0.3873907887915485,0.31588053979062175,0.34915705526505875,COMPLETE,0.0,0.0,0.0,0.0,0.0,,3,2,0.0,0,2,0.0
255,0.0,kmeans,l2,silhouette,blocks.11,layer2,0.0037048031272085753,32,0.934284338607667,0.9684295643837852,1.049638625217534,2.317598528865668,kmeans,root-norm,silhouette,False,True,True,0.6579385735752958,0.599583441229796,0.5211284216103799,0.3638567462554101,0.7659788516003222,COMPLETE,0.0,0.0,0.0,0.0,0.0,,3,2,0.0,0,2,0.0
256,0.0,kmeans,l2,heuristic,blocks.7,layer3,0.007057381230936865,8,0.8673432721921807,0.9122637729956217,0.8769498851130241,2.1921558470987303,graph,root-norm,heuristic,False,False,False,0.6049316653432928,0.7217128842796818,0.830188001900181,0.24891228692185186,0.22635051678069612,COMPLETE,0.0,0.0,0.0,0.0,0.0,,3,2,0.0,0,2,0.0
257,0.0,graph,root-norm,heuristic,blocks.11,layer1,0.008630266584917664,16,0.8565998097143949,0.9005732371941035,0.8046615896710659,2.7427044406991326,graph,l2,silhouette,True,True,True,0.6921400153788945,0.5783796400844984,0.49678367522935823,0.187949692110503,0.9095228788567529,COMPLETE,0.0,0.0,0.0,0.0,0.0,,3,2,0.0,0,2,0.0
258,0.0,kmeans,l2,heuristic,blocks.7,layer1,0.007808670636752521,32,0.901370900807517,0.917589763337749,0.725156850017257,1.5021227893216293,kmeans,root-norm,heuristic,False,False,True,0.40718241723617166,0.548152426321414,0.5796167777117393,0.6269589632175182,0.18278660333162228,COMPLETE,0.0,0.0,0.0,0.0,0.0,,3,2,0.0,0,2,0.0
259,0.0,kmeans,l2,heuristic,blocks.11,layer1,0.005132636380577873,8,0.884741806008806,0.9627333047248916,0.5872172368096299,2.816079606306882,graph,root-norm,silhouette,False,True,True,0.401993531947484,0.46031371086084155,0.6140386198343808,0.7846040339720309,0.04967002619142935,COMPLETE,0.0,0.0,0.0,0.0,0.0,,3,2,0.0,0,2,0.0
244,0.0,kmeans,root-norm,heuristic,blocks.11,layer1,0.005737567093520093,8,0.864764305046185,0.9773446997529838,0.6902933977030157,2.971239209262092,graph,root-norm,heuristic,False,True,True,0.5053594095767593,0.5949965848437306,0.479190018486867,0.2844832884281704,0.13772703242181517,COMPLETE,0.0,0.0,0.0,0.0,0.0,,3,2,0.0,0,2,0.0
245,0.0,graph,root-norm,heuristic,blocks.7,layer3,0.005911159883362758,8,0.8589518714334461,0.9371059459560291,0.7327173153724443,1.7133284319774964,graph,root-norm,heuristic,True,False,True,0.5263823509736887,0.5724831388451952,0.647090300241306,0.2203246095947723,0.2502297179243259,COMPLETE,0.0,0.0,0.0,0.0,0.0,,3,2,0.0,0,2,0.0
246,0.0,kmeans,l2,heuristic,blocks.11,layer1,0.005619583553455527,8,0.9081131721658837,0.9268530614380422,0.9091001984729864,2.046141548352646,kmeans,root-norm,silhouette,False,True,True,0.6309536813866623,0.616737245673636,0.4615979821148288,0.552628728348128,0.023612356131969343,COMPLETE,0.0,0.0,0.0,0.0,0.0,,3,2,0.0,0,2,0.0
247,0.0,kmeans,root-norm,silhouette,blocks.7,layer1,0.0063668415348188635,32,0.8833758685720557,0.9448502953124585,0.7092733414933069,1.7697705572485256,graph,root-norm,heuristic,False,False,True,0.48982390312378454,0.4100768521208704,0.4196713086828742,0.461398592054521,0.08177211317772645,COMPLETE,0.0,0.0,0.0,0.0,0.0,,3,2,0.0,0,2,0.0
248,0.0,kmeans,l2,heuristic,blocks.11,layer1,0.005965871929350416,16,0.8742203963055227,0.9573141896423751,0.5510248599399287,2.533095858901212,kmeans,l2,silhouette,False,True,False,0.7156371929792489,0.6270851189827666,0.9747369164765716,0.43389903497114823,0.10390081360379878,COMPLETE,0.0,0.0,0.0,0.0,0.0,,3,2,0.0,0,2,0.0
249,0.0,graph,root-norm,heuristic,blocks.11,layer2,0.0031197197751022913,8,0.9258152361137891,0.9651294180338592,0.8414091308168464,2.892670556820867,graph,root-norm,silhouette,True,False,True,0.5615523708702451,0.4513044902833052,0.8949105930610721,0.00835380615812253,0.5592085978846679,COMPLETE,0.0,0.0,0.0,0.0,0.0,,3,2,0.0,0,2,0.0
250,0.0,kmeans,l2,heuristic,blocks.7,layer3,0.007478638134740147,32,0.8710190679537083,0.972442987692947,1.0229759835122931,2.1668422341294202,graph,root-norm,heuristic,False,True,True,0.5134471218879638,0.5361347247001352,0.9464337929445297,0.5911287652186732,0.46881411754132896,COMPLETE,0.0,0.0,0.0,0.0,0.0,,3,2,0.0,0,2,0.0
251,0.0,kmeans,l2,silhouette,blocks.11,layer1,0.005730851395799235,8,0.9041996128738826,0.9142325298588974,0.788245010524028,2.411290095539438,kmeans,root-norm,silhouette,False,False,True,0.6493537060029066,0.48580869342728367,0.43680649111363534,0.26997199556049883,0.8031870690885439,COMPLETE,0.0,0.0,0.0,0.0,0.0,,3,2,0.0,0,2,0.0
236,0.0,kmeans,l2,heuristic,blocks.11,layer2,0.008224697781972993,8,0.9185648585930525,0.9217773524874225,0.9434369886087051,2.95251834618756,graph,l2,silhouette,False,False,False,0.44085628213353273,0.5271928439994868,0.8741223154451424,0.5183126072113933,0.06999383562281503,COMPLETE,0.0,0.0,0.0,0.0,0.0,,3,2,0.0,0,2,0.0
237,0.0,graph,l2,heuristic,blocks.7,layer1,0.007923730461356937,32,0.9146104313227695,0.9552587283641149,0.6152086566736522,2.343478361778451,kmeans,root-norm,heuristic,True,True,True,0.46174856555912586,0.4300803221971069,0.43455159598052007,0.41635481488625264,0.17368902308761738,COMPLETE,0.0,0.0,0.0,0.0,0.0,,3,2,0.0,0,2,0.0
238,0.0,kmeans,root-norm,heuristic,blocks.11,layer1,0.003935574987101141,8,0.8722565048662551,0.947490710930967,0.6322566769669914,2.779493834273134,graph,root-norm,silhouette,False,False,True,0.47287170682717994,0.7098355678435188,0.4060009246055368,0.2905985054932805,0.7171919482404823,COMPLETE,0.0,0.0,0.0,0.0,0.0,,3,2,0.0,0,2,0.0
239,0.0,kmeans,l2,silhouette,blocks.7,layer1,0.003489705583660058,16,0.8533455833562833,0.9347143517046484,0.8589034524234102,2.500714650780335,kmeans,root-norm,silhouette,False,True,True,0.7311203467596499,0.5648333570747178,0.7286968734901432,0.154545252131623,0.6051617915683909,COMPLETE,0.0,0.0,0.0,0.0,0.0,,3,2,0.0,0,2,0.0
240,0.0,kmeans,l2,heuristic,blocks.11,layer2,0.009799695577111422,32,0.9765041132172843,0.9706262527375547,0.9203246310495155,2.567544113907045,graph,l2,silhouette,False,True,False,0.6793068347376288,0.464121830136101,0.5593819266237595,0.8783578419775688,0.12261471781666998,COMPLETE,0.0,0.0,0.0,0.0,0.0,,3,2,0.0,0,2,0.0
241,0.0,kmeans,root-norm,heuristic,blocks.11,layer1,0.006099477271692156,8,0.8671396905466026,0.9761584598539434,0.6608290279208797,2.9477122232925406,graph,root-norm,heuristic,False,True,True,0.5252252933400489,0.6256167996857206,0.4758805127970085,0.35707669745131976,0.10868944725122122,COMPLETE,0.0,0.0,0.0,0.0,0.0,,3,2,0.0,0,2,0.0
242,0.0,kmeans,root-norm,heuristic,blocks.11,layer1,0.005420759519763787,8,0.8624811773241365,0.9787535841641852,0.674524772764639,2.99259992537351,graph,root-norm,heuristic,False,True,True,0.5375441458294034,0.614800263012152,0.4489865887385859,0.3165304069667044,0.940256057576019,COMPLETE,0.0,0.0,0.0,0.0,0.0,,3,2,0.0,0,2,0.0
243,0.0,kmeans,root-norm,heuristic,blocks.11,layer1,0.005185473763973675,8,0.8695200026311031,0.9742631585596432,0.6414317611233094,1.8538206879630756,graph,root-norm,heuristic,False,True,True,0.5501185665001842,0.6073620604701532,0.4997299142073048,0.3337696163261443,0.3194929372590671,COMPLETE,0.0,0.0,0.0,0.0,0.0,,3,2,0.0,0,2,0.0
68,0.0,kmeans,root-norm,heuristic,blocks.7,layer3,0.005156239549485445,8,0.8699938548277525,0.9209290241364099,0.7527292149495872,1.5700846198010343,kmeans,root-norm,heuristic,False,True,True,0.43308533204183763,0.7036316981099301,0.7885536557558844,0.6027192078626249,0.45546534460806276,COMPLETE,0.0,0.0,0.0,0.0,0.0,,3,2,0.0,0,2,0.0
69,0.0,kmeans,root-norm,heuristic,blocks.11,layer1,0.008387708664031763,16,0.8510421087964019,0.9165401039794612,0.6878158464936277,2.554184127705802,graph,root-norm,silhouette,False,True,False,0.5321594513498801,0.6345980027268452,0.8605020275130102,0.24908128819022257,0.817815680656548,COMPLETE,0.0,0.0,0.0,0.0,0.0,,3,2,0.0,0,2,0.0
70,0.0,graph,l2,heuristic,blocks.7,layer1,0.009337031478356182,32,0.9602503743047814,0.964584175600557,0.6387748730788211,2.299598855133509,kmeans,l2,heuristic,False,False,True,0.48600735581093557,0.5879140522413049,0.6687693995707698,0.8660685853227047,0.944082492713034,COMPLETE,0.0,0.0,0.0,0.0,0.0,,3,2,0.0,0,2,0.0
71,0.0,kmeans,l2,heuristic,blocks.7,layer1,0.005807708180848921,16,0.9249358430417223,0.9344175400659542,0.8479322159211119,2.096051758102583,graph,l2,silhouette,True,True,True,0.679383862881089,0.4465019037532488,0.7345383950498149,0.11424324359367045,0.9789215445186887,COMPLETE,0.0,0.0,0.0,0.0,0.0,,3,2,0.0,0,2,0.0
72,0.0,kmeans,l2,heuristic,blocks.7,layer1,0.006570280844577054,16,0.9419515103632735,0.9424074695212246,0.7417428510767288,1.9208491826394845,graph,l2,silhouette,True,True,True,0.6593058273232875,0.46625840627342374,0.6189355305884567,0.077736987663239,0.7388571222877861,COMPLETE,0.0,0.0,0.0,0.0,0.0,,3,2,0.0,0,2,0.0
73,0.0,kmeans,l2,heuristic,blocks.7,layer1,0.00705346334044616,16,0.9182613614056138,0.9465801215684051,0.794218481127703,1.7824186968112152,graph,l2,silhouette,True,True,True,0.7058302837809024,0.4187003232198812,0.933566008411849,0.20620478393552613,0.07601275825083365,COMPLETE,0.0,0.0,0.0,0.0,0.0,,3,2,0.0,0,2,0.0
74,0.0,kmeans,l2,heuristic,blocks.7,layer1,0.007413307953377472,8,0.9081888970342702,0.9555151697838118,0.7150347449074312,2.1799043748245506,graph,l2,silhouette,True,True,True,0.6334001104235161,0.42905113027652564,0.6900493874279597,0.03053117361776994,0.6067194076855901,COMPLETE,0.0,0.0,0.0,0.0,0.0,,3,2,0.0,0,2,0.0
75,0.0,kmeans,root-norm,heuristic,blocks.11,layer2,0.006781089264665605,16,0.9275989825428193,0.9528825470274928,0.7796942142666938,2.084141770736003,graph,root-norm,silhouette,True,True,False,0.7189641359344762,0.4015469516986103,0.8204786282811954,0.12898936403741434,0.48145341697579075,COMPLETE,0.0,0.0,0.0,0.0,0.0,,3,2,0.0,0,2,0.0
60,0.0,kmeans,l2,heuristic,blocks.7,layer1,0.004818241394292215,16,0.8643233161340874,0.9085201786473894,0.7564612580100745,2.9703267835259264,graph,root-norm,heuristic,False,True,False,0.6918901028223503,0.5020694414527659,0.24961819673656752,0.9577622408822919,0.5317633377047093,COMPLETE,0.0,0.0,0.0,0.0,0.0,,3,2,0.0,0,2,0.0
61,0.0,graph,root-norm,heuristic,blocks.11,layer2,0.009712344239821655,16,0.97827832822257,0.9285950058173229,0.6550635278816774,2.505515671553212,kmeans,root-norm,silhouette,True,True,True,0.5830824193125195,0.46271537520622025,0.49978730301034957,0.8162999957934087,0.33280071478619677,COMPLETE,0.0,0.0,0.0,0.0,0.0,,3,2,0.0,0,2,0.0
62,0.0,graph,root-norm,heuristic,blocks.11,layer2,0.008003003545752358,16,0.9543854881603558,0.9304993700001277,0.7191856183606278,2.8826600261476685,kmeans,root-norm,silhouette,True,True,True,0.5940228813206014,0.4493987750020879,0.3054123094452267,0.7477481977337452,0.4976479041661463,COMPLETE,0.0,0.0,0.0,0.0,0.0,,3,2,0.0,0,2,0.0
63,0.0,graph,root-norm,heuristic,blocks.11,layer2,0.00891670661675205,16,0.9679898781867208,0.9481903824682082,0.8180565609256528,2.6493236959823703,kmeans,root-norm,silhouette,True,True,True,0.5483385963596531,0.4257359735697631,0.42959291373195574,0.5519055050957065,0.2098187274776635,COMPLETE,0.0,0.0,0.0,0.0,0.0,,3,2,0.0,0,2,0.0
64,0.0,graph,root-norm,heuristic,blocks.11,layer2,0.0026066345840612066,16,0.8776556107924777,0.9390632282860953,0.9124824580028401,2.3592259162495917,kmeans,root-norm,silhouette,True,True,True,0.5673243617777155,0.4729117193196415,0.3821967570667952,0.44043860962119413,0.2801328377614425,COMPLETE,0.0,0.0,0.0,0.0,0.0,,3,2,0.0,0,2,0.0
