number,value,params_dino_pipeline_clustering_clusterer_method,params_dino_pipeline_clustering_feature_processing_normalizer_method,params_dino_pipeline_clustering_k_selection_method,params_extractors_dino_v2_layer_name,params_extractors_resnet_layer_name,params_heuristic_settings_filter_params_filter_min_area_perc,params_heuristic_settings_generator_params_points_per_side,params_heuristic_settings_generator_params_pred_iou_thresh,params_heuristic_settings_generator_params_stability_score_thresh,params_heuristic_settings_k_heuristic_formulas_semantic_scale_factor,params_heuristic_settings_k_heuristic_formulas_structural_multiplier,params_resnet_pipeline_clustering_k_selection_method,params_resnet_pipeline_image_preprocessing_use_gaussian_blur,params_run_dino_pipeline,params_run_resnet_pipeline,params_validator_settings_semantic_threshold,params_validator_settings_structural_threshold,params_validator_settings_weights_clip_confidence,params_validator_settings_weights_dino_iou,params_validator_settings_weights_resnet_iou,state,user_attrs_avg_dino_iou,user_attrs_avg_resnet_iou,user_attrs_best_clip_confidence_any,user_attrs_best_dino_iou,user_attrs_best_resnet_iou,user_attrs_error,user_attrs_k_semantic_used,user_attrs_k_structural_used,user_attrs_max_clip_confidence,user_attrs_num_correct_segments,user_attrs_num_sam_masks,user_attrs_value
175,0.0,graph,root-norm,heuristic,blocks.7,layer2,0.005783871174748836,16,0.8539860658380086,0.9689366226764059,0.6449751510664963,1.5333245757127607,silhouette,False,True,False,0.6672417595007439,0.4015446630702751,0.24829428586870714,0.36388389027317575,0.2647839527575305,COMPLETE,0.2923339713382514,0.0,0.0,0.4840804208216349,0.0,,3,2,0.0,0,2,0.0
176,0.0,kmeans,l2,silhouette,blocks.11,layer1,0.007948136556573488,8,0.9070042343418737,0.9556471930653347,0.8253988900594617,2.378579495187922,silhouette,False,True,True,0.4075341518726444,0.6364783148495592,0.8036170502974267,0.015873010521584532,0.9034876311738638,COMPLETE,0.502182083109282,0.1909017556588136,0.0,0.7905732297317108,0.30664233115379325,,3,2,0.0,0,2,0.0
177,0.0,graph,l2,heuristic,blocks.7,layer3,0.003494643420041132,16,0.8818599861096753,0.9240248660406758,0.5250035661757622,1.6498572973526036,heuristic,True,False,False,0.5487470224003406,0.6285182519492993,0.7278197411607624,0.06563227064527608,0.2861631993836884,COMPLETE,0.0,0.0,0.0,0.0,0.0,,3,2,0.0,0,2,0.0
178,0.0,graph,root-norm,silhouette,blocks.7,layer1,0.008054716324126727,16,0.9681214686552967,0.9497973291343932,1.0601917986429439,2.0031314036469907,silhouette,False,True,True,0.6115325734527973,0.6181760699299569,0.17936736601152398,0.40820026143583493,0.3262353680807604,COMPLETE,0.39658741815219783,0.4763218569145985,0.0,0.7040756487318575,0.8467036678655542,,3,2,0.0,0,2,0.0
179,0.0,kmeans,l2,heuristic,blocks.7,layer2,0.004867632009876931,32,0.9052552883758247,0.9587665129753246,1.0319672355807177,1.7031277601770582,heuristic,True,False,False,0.4410572468313016,0.70034322144586,0.20626344811640554,0.33130314961491153,0.05163501761427855,COMPLETE,0.0,0.0,0.0,0.0,0.0,,3,2,0.0,0,2,0.0
180,0.0,graph,l2,silhouette,blocks.11,layer3,0.0045691876363510835,16,0.8984313126034662,0.9122480967703531,0.6909085483317643,1.5733041115315607,silhouette,False,True,False,0.7411715179757165,0.5001426717039851,0.76866915779304,0.20433918558993358,0.4481406197533042,COMPLETE,0.502182083109282,0.0,0.0,0.7905732297317108,0.0,,3,2,0.0,0,2,0.0
181,0.0,kmeans,root-norm,silhouette,blocks.11,layer3,0.0016121665876737308,8,0.871145853544446,0.9292307908802484,0.9691606573987265,2.074401588650466,heuristic,True,True,False,0.5347221401625262,0.5614435462355821,0.47669989598032136,0.5957189273640782,0.6802215797110688,COMPLETE,0.2880692942229474,0.0,0.0,0.48059609613460896,0.0,,3,2,0.0,0,2,0.0
182,0.0,kmeans,root-norm,silhouette,blocks.11,layer3,0.0036977132604801544,8,0.8753552447430601,0.9361705983657305,0.9487550021446088,2.143685101237113,heuristic,True,True,False,0.556003479245613,0.5683051300043508,0.3935251983008134,0.6322689010002839,0.8596612381883925,COMPLETE,0.38944028924099494,0.0,0.0,0.6850168596979915,0.0,,3,2,0.0,0,2,0.0
183,0.0,kmeans,root-norm,silhouette,blocks.11,layer3,0.0011448806581719172,8,0.9712588631543507,0.9003084304336504,1.0095257284837635,2.6092513627034952,heuristic,True,True,False,0.5083380951304243,0.5385218494834556,0.44159625627237575,0.8216272139544769,0.9986471141318135,COMPLETE,0.36268476458234006,0.0,0.0,0.6362703415921419,0.0,,3,2,0.0,0,2,0.0
184,0.0,kmeans,root-norm,silhouette,blocks.11,layer3,0.009203676048513916,8,0.8675963808704523,0.9311248830061578,0.9056708658397434,2.1158855707247812,heuristic,True,True,False,0.5456951739845682,0.5551488524915016,0.6790704260762962,0.5389266430023985,0.8279679535086205,COMPLETE,0.502182083109282,0.0,0.0,0.7905732297317108,0.0,,3,2,0.0,0,2,0.0
185,0.0,kmeans,root-norm,heuristic,blocks.7,layer3,0.008499923554278484,8,0.8728249221706205,0.9345841599459644,0.977746965391932,2.5524926205854097,heuristic,True,False,True,0.428545758610383,0.4334559269142343,0.02092724876892357,0.22908714290710536,0.8076254290134527,COMPLETE,0.0,0.4763218569145985,0.0,0.0,0.8467036678655542,,3,2,0.0,0,2,0.0
186,0.0,graph,l2,silhouette,blocks.11,layer1,0.002099249487761465,16,0.9550455019726323,0.9458967014076528,0.7588652287942335,2.199915495557132,silhouette,True,True,False,0.5789593265750531,0.5748260640391939,0.8428830380814687,0.5699641182982831,0.7497519399773784,COMPLETE,0.43430111292539053,0.0,0.0,0.6850168596979915,0.0,,3,2,0.0,0,2,0.0
187,0.0,graph,l2,heuristic,blocks.7,layer3,0.0014053329038769674,32,0.8614225952524471,0.9271797901892135,1.1787098766779305,2.3333077801775906,heuristic,False,True,True,0.561680767506525,0.5449249560765004,0.41891846758193935,0.353508527983735,0.5026331189323294,COMPLETE,0.39281446585575375,0.1909017556588136,0.0,0.6751209500073303,0.30664233115379325,,3,2,0.0,0,2,0.0
188,0.0,graph,root-norm,silhouette,blocks.7,layer2,0.006260942298939838,16,0.8941430985651154,0.9432156766470108,0.9972970353145796,2.1622578006575353,silhouette,True,False,False,0.5710129484453971,0.42005443644524604,0.3463104197143995,0.2538970945046218,0.5617811967186159,COMPLETE,0.0,0.0,0.0,0.0,0.0,,3,2,0.0,0,2,0.0
189,0.0,kmeans,l2,heuristic,blocks.7,layer1,0.0033627860491515513,8,0.9655035576549753,0.9385056482239453,0.8855239888097107,2.449747841574498,heuristic,False,True,False,0.5402578981088773,0.44840032738681884,0.3635066981589415,0.5830436452414003,0.7786888450215302,COMPLETE,0.28717980791171704,0.0,0.0,0.4770224414365547,0.0,,3,2,0.0,0,2,0.0
190,0.0,graph,l2,silhouette,blocks.11,layer3,0.008877093115567267,16,0.8778001979364977,0.9537867476850581,1.1425042087104051,2.0363495519466643,heuristic,True,False,True,0.728364989091718,0.5179401581432092,0.5037140551840897,0.6046536895283571,0.926881800085509,COMPLETE,0.0,0.4763218569145985,0.0,0.0,0.8467036678655542,,3,2,0.0,0,2,0.0
191,0.0,graph,l2,heuristic,blocks.7,layer2,0.005499363162562454,32,0.927469321423528,0.965409687175991,0.7165922974853196,1.7789170126625027,silhouette,False,True,False,0.6926093673418265,0.6543041321809021,0.1582762224958286,0.4767226391128126,0.38845502301533147,COMPLETE,0.28028562295545156,0.0,0.0,0.4628517893024001,0.0,,3,2,0.0,0,2,0.0
192,0.0,graph,l2,heuristic,blocks.7,layer2,0.003906727450790293,32,0.9188845635908973,0.9211249361568702,0.6988305571004769,1.8636237027390212,silhouette,False,True,False,0.6808858590080729,0.6814068721032761,0.11708623039714458,0.1940876742633019,0.3443348848649389,COMPLETE,0.36826567469631694,0.0,0.0,0.6267409470752089,0.0,,3,2,0.0,0,2,0.0
193,0.0,graph,l2,heuristic,blocks.7,layer2,0.0059519443924073824,32,0.9306352969897,0.9103781657567986,0.6611882048386012,1.900630729569694,silhouette,False,True,False,0.7167750848058639,0.6943592938360567,0.2893874033307676,0.03528851519159972,0.42219395680938804,COMPLETE,0.39281446585575375,0.0,0.0,0.6751209500073303,0.0,,3,2,0.0,0,2,0.0
194,0.0,graph,l2,heuristic,blocks.7,layer2,0.004178851174011154,32,0.9139778137551477,0.9065783002105483,0.7403615526111043,1.8449198650170155,silhouette,False,True,False,0.6713811473935901,0.6684501759551046,0.06466547000844151,0.1329441726191796,0.715871838496603,COMPLETE,0.3781389039611153,0.0,0.0,0.6457997361090749,0.0,,3,2,0.0,0,2,0.0
195,0.0,graph,l2,heuristic,blocks.7,layer2,0.002562761170316393,32,0.9235141708189262,0.9195704151908518,1.0849958373677395,1.7564711174089342,silhouette,False,True,False,0.6884529017990333,0.43773236333799875,0.2675263323520198,0.16092840641241596,0.5216133936740086,COMPLETE,0.502182083109282,0.0,0.0,0.7905732297317108,0.0,,3,2,0.0,0,2,0.0
196,0.0,graph,root-norm,silhouette,blocks.7,layer1,0.0044226368879856336,16,0.9402137912300663,0.9140832213506863,0.7809995001284998,2.3984135918561904,silhouette,False,True,True,0.42076062639671274,0.7077592091758351,0.9649869046554376,0.18362923046323898,0.9718387276091972,COMPLETE,0.5005582859630888,0.4763218569145985,0.0,0.7905732297317108,0.8467036678655542,,3,2,0.0,0,2,0.0
197,0.0,kmeans,l2,heuristic,blocks.7,layer3,0.00308061221272044,16,0.8577207074895469,0.9029903609862775,1.0424635182616466,1.8164237977559554,heuristic,True,False,False,0.47577729340481284,0.6899715717051005,0.9352067011942385,0.39018185116762427,0.37708933363184605,COMPLETE,0.0,0.0,0.0,0.0,0.0,,3,2,0.0,0,2,0.0
198,0.0,graph,l2,silhouette,blocks.11,layer1,0.0036346096629623842,8,0.9171303065023851,0.9224924669381952,0.9235781246464311,2.086589841076539,silhouette,False,True,False,0.7040984246864591,0.5289914816718351,0.14271527107853804,0.6666226651422282,0.6107290261988022,COMPLETE,0.38735545181671827,0.0,0.0,0.6850168596979915,0.0,,3,2,0.0,0,2,0.0
199,0.0,graph,l2,heuristic,blocks.7,layer3,0.009499603316448016,16,0.9209989621836061,0.9185371402851829,0.9590032424097525,2.9167126879160996,heuristic,True,False,True,0.6225904887197307,0.6050361755868987,0.46336009107581294,0.3105262272423477,0.31154802326467623,COMPLETE,0.0,0.19996715152318406,0.0,0.0,0.3278747423557665,,3,2,0.0,0,2,0.0
