number,value,params_dino_pipeline_clustering_clusterer_method,params_dino_pipeline_clustering_feature_processing_normalizer_method,params_dino_pipeline_clustering_k_selection_method,params_extractors_dino_v2_layer_name,params_extractors_resnet_layer_name,params_heuristic_settings_filter_params_filter_min_area_perc,params_heuristic_settings_generator_params_points_per_side,params_heuristic_settings_generator_params_pred_iou_thresh,params_heuristic_settings_generator_params_stability_score_thresh,params_heuristic_settings_k_heuristic_formulas_semantic_scale_factor,params_heuristic_settings_k_heuristic_formulas_structural_multiplier,params_resnet_pipeline_clustering_k_selection_method,params_resnet_pipeline_image_preprocessing_use_gaussian_blur,params_run_dino_pipeline,params_run_resnet_pipeline,params_validator_settings_semantic_threshold,params_validator_settings_structural_threshold,params_validator_settings_weights_clip_confidence,params_validator_settings_weights_dino_iou,params_validator_settings_weights_resnet_iou,state,user_attrs_avg_dino_iou,user_attrs_avg_resnet_iou,user_attrs_best_clip_confidence_any,user_attrs_best_dino_iou,user_attrs_best_resnet_iou,user_attrs_error,user_attrs_k_semantic_used,user_attrs_k_structural_used,user_attrs_max_clip_confidence,user_attrs_num_correct_segments,user_attrs_num_sam_masks,user_attrs_value
115,0.0,graph,l2,heuristic,blocks.7,layer1,0.0018123084480802757,16,0.9139933744130067,0.9327075375332144,0.8530752922866094,2.0506069470072137,silhouette,True,True,True,0.6131037993804244,0.5774352645301501,0.04512053079815347,0.376056014512513,0.7464638997545203,COMPLETE,0.3733742067026488,0.19996715152318406,0.0,0.6362703415921419,0.3278747423557665,,3,2,0.0,0,2,0.0
116,0.0,graph,root-norm,silhouette,blocks.7,layer3,0.006169364087331161,32,0.9033884674697628,0.9090105831589459,1.0383289564295999,2.5935341627336497,silhouette,False,False,False,0.7197071467337605,0.6016618936536496,0.08266039912322912,0.26846139334252384,0.18396422360745784,COMPLETE,0.0,0.0,0.0,0.0,0.0,,3,2,0.0,0,2,0.0
117,0.0,graph,l2,heuristic,blocks.7,layer2,0.0038299406507841635,16,0.8727564484824217,0.9531520803421532,0.984394141698781,2.418771977767574,silhouette,True,False,True,0.7495929582590241,0.7436676254703758,0.8718339297770874,0.2991877210332884,0.12287927367474952,COMPLETE,0.0,0.4763218569145985,0.0,0.0,0.8467036678655542,,3,2,0.0,0,2,0.0
118,0.0,kmeans,l2,silhouette,blocks.11,layer1,0.008826854253348905,16,0.8797001716515414,0.9656365347694041,0.6296966018607331,1.7546136519188151,heuristic,False,True,False,0.6819737654510231,0.6666015391746739,0.06331560103937336,0.05230139387788717,0.4654585234033615,COMPLETE,0.4146504271965682,0.0,0.0,0.7330303474563847,0.0,,3,2,0.0,0,2,0.0
119,0.0,graph,root-norm,heuristic,blocks.7,layer3,0.008438008732265582,32,0.9277541895804725,0.9634989543321207,0.8764198747712924,1.6106904488617013,silhouette,True,False,True,0.43026986866367506,0.4073923582696893,0.12306530204173256,0.8306984987347743,0.8649951952548675,COMPLETE,0.0,0.4763218569145985,0.0,0.0,0.8467036678655542,,3,2,0.0,0,2,0.0
120,0.0,graph,l2,silhouette,blocks.11,layer1,0.009098143463746905,16,0.9638667663233148,0.9268776642617952,1.000384587228779,1.941142177107709,heuristic,False,True,True,0.4207024037169884,0.6141329821725874,0.0031917172695582986,0.0916840954112399,0.4307409995356199,COMPLETE,0.3686095094441823,0.1909017556588136,0.0,0.6267409470752089,0.30664233115379325,,3,2,0.0,0,2,0.0
121,0.0,graph,l2,heuristic,blocks.7,layer3,0.006686590521435718,16,0.9246621617057329,0.9116727537279741,1.1313205568927518,2.289888803261266,heuristic,False,True,False,0.5040002659080919,0.6433769487500587,0.2944481789303995,0.313735426976232,0.2716162991064755,COMPLETE,0.3722141590992731,0.0,0.0,0.655329130626008,0.0,,3,2,0.0,0,2,0.0
122,0.0,graph,l2,heuristic,blocks.7,layer3,0.008219424593283717,16,0.9477081722060657,0.9590706285155002,0.8164920157329896,2.1566851870105452,heuristic,False,True,False,0.5392151825714725,0.6308160346653221,0.23645584229192945,0.2391478678270909,0.5537669432644082,COMPLETE,0.3873626842443031,0.0,0.0,0.6850168596979915,0.0,,3,2,0.0,0,2,0.0
123,0.0,graph,l2,heuristic,blocks.7,layer3,0.006935997660044105,16,0.930607805358798,0.9420424708921636,1.116732702532963,2.5889880719372482,heuristic,False,True,False,0.5266018894582162,0.4269437251739458,0.2126298947492842,0.16181413690632557,0.36280441956953724,COMPLETE,0.38705802363526487,0.0,0.0,0.6850168596979915,0.0,,3,2,0.0,0,2,0.0
124,0.0,graph,l2,heuristic,blocks.7,layer3,0.007482559806277945,16,0.9354005646421673,0.948492145710545,1.170523116350164,2.0950982565437233,heuristic,False,True,False,0.5134343752200228,0.639584702516941,0.4072366614804167,0.11751412703526673,0.2981127050220409,COMPLETE,0.368624464389693,0.0,0.0,0.6267409470752089,0.0,,3,2,0.0,0,2,0.0
125,0.0,graph,l2,heuristic,blocks.7,layer3,0.004197963673649886,8,0.9414319557693052,0.9055942845011089,1.1886499002900275,2.7998692167889003,heuristic,False,False,False,0.5513978189550295,0.4418263011554377,0.36342275104000216,0.2019487707112483,0.3349522367400246,COMPLETE,0.0,0.0,0.0,0.0,0.0,,3,2,0.0,0,2,0.0
126,0.0,graph,root-norm,silhouette,blocks.7,layer2,0.006015207929015301,16,0.9181379736580633,0.9368579920586897,1.154261422434951,2.370088698551981,silhouette,True,False,True,0.4557181464808791,0.7088283293923207,0.5561177334615387,0.022875095701682092,0.2179825399005524,COMPLETE,0.0,0.4763218569145985,0.0,0.0,0.8467036678655542,,3,2,0.0,0,2,0.0
127,0.0,kmeans,l2,heuristic,blocks.7,layer3,0.006501430317946459,32,0.9219299621516706,0.9564832737901132,0.892473174165437,1.5309463643089491,heuristic,False,True,False,0.6446801797217924,0.5081748521830112,0.8284118060868322,0.4032336483732219,0.5820112286957413,COMPLETE,0.39763926362231294,0.0,0.0,0.7040756487318575,0.0,,3,2,0.0,0,2,0.0
128,0.0,graph,l2,silhouette,blocks.11,layer1,0.007809676880928203,16,0.9682070290557965,0.9627219663828154,1.0237989516260664,1.906163107847901,silhouette,True,False,True,0.5209092578443892,0.5624600323924178,0.6743699296863974,0.00013056967117035245,0.4995821802391863,COMPLETE,0.0,0.4763218569145985,0.0,0.0,0.8467036678655542,,3,2,0.0,0,2,0.0
129,0.0,graph,root-norm,heuristic,blocks.7,layer3,0.00930492128094764,16,0.9547533503714318,0.9147716394657567,0.7089186113848995,2.0005744668263943,heuristic,False,True,True,0.49210573127383284,0.6216796332466636,0.271136262641062,0.5686586947979526,0.9224111008003377,COMPLETE,0.5005666338501933,0.4763218569145985,0.0,0.7905732297317108,0.8467036678655542,,3,2,0.0,0,2,0.0
130,0.0,graph,l2,silhouette,blocks.7,layer2,0.003310327796298973,32,0.8509502273616744,0.9308636379207381,1.0849094652228912,1.5882459945138179,silhouette,True,False,False,0.46883696605161385,0.5239773140721428,0.9768111878419948,0.5988666674314836,0.39767359961685395,COMPLETE,0.0,0.0,0.0,0.0,0.0,,3,2,0.0,0,2,0.0
131,0.0,graph,l2,silhouette,blocks.7,layer1,0.0036272697864160918,16,0.8884030735622381,0.9207457517286023,1.0462805633445513,2.929792912983361,silhouette,True,True,False,0.6081887647851134,0.460009702632763,0.9371199121691173,0.1796404141644619,0.9678641478771278,COMPLETE,0.3691704855272933,0.0,0.0,0.6267409470752089,0.0,,3,2,0.0,0,2,0.0
132,0.0,graph,l2,silhouette,blocks.7,layer1,0.00315760751273797,16,0.9446255385724259,0.92711904168544,0.9745233552524366,2.420848405084403,silhouette,True,True,False,0.5780553261272023,0.4757795157404191,0.9594573973646016,0.23257894384328393,0.6755695826922955,COMPLETE,0.2873862436971086,0.0,0.0,0.47418496553934925,0.0,,3,2,0.0,0,2,0.0
133,0.0,graph,l2,silhouette,blocks.7,layer1,0.002523052912247452,16,0.8833965866501016,0.9712175862056553,0.8372775986424656,2.328583633587535,silhouette,True,True,False,0.5417463378025462,0.4982896318401787,0.9102451767768849,0.270948583051942,0.690353038625365,COMPLETE,0.5005166907671836,0.0,0.0,0.7905732297317108,0.0,,3,2,0.0,0,2,0.0
134,0.0,graph,l2,silhouette,blocks.7,layer1,0.004323609270067267,16,0.8915321860558758,0.9233214925680073,1.060780291879754,2.850376131128688,silhouette,True,True,False,0.6252874663444096,0.41950217596376943,0.7196627058535129,0.2089832583352605,0.6057345703848646,COMPLETE,0.38676451458552447,0.0,0.0,0.6850168596979915,0.0,,3,2,0.0,0,2,0.0
135,0.0,kmeans,l2,silhouette,blocks.11,layer1,0.002804288449083045,8,0.9578866702258755,0.9074385669529679,1.00658386148563,2.764031357485647,heuristic,False,True,True,0.4371763800497853,0.5149841588891046,0.9955113483740362,0.14984434912576725,0.7366199247331615,COMPLETE,0.5046677785739422,0.4763218569145985,0.0,0.7905732297317108,0.8467036678655542,,3,2,0.0,0,2,0.0
136,0.0,graph,root-norm,heuristic,blocks.7,layer3,0.004022254706422467,16,0.858279960130156,0.9673691449360016,0.7486811862359704,1.5534050199298706,silhouette,True,False,False,0.44907207474008515,0.5323226997471937,0.16642959294569742,0.47676892226322953,0.25477742474853826,COMPLETE,0.0,0.0,0.0,0.0,0.0,,3,2,0.0,0,2,0.0
137,0.0,graph,l2,silhouette,blocks.11,layer1,0.004637785973586603,16,0.8985859464378281,0.9501526581025704,1.1041982118535323,2.8790193500733716,heuristic,False,False,True,0.5931257194578328,0.4864496501184529,0.4586784073378689,0.24827417917023353,0.7083948555918043,COMPLETE,0.0,0.4763218569145985,0.0,0.0,0.8467036678655542,,3,2,0.0,0,2,0.0
138,0.0,kmeans,l2,heuristic,blocks.7,layer3,0.0015610633844910901,32,0.9115337257591705,0.9038262702861123,0.9321203360697691,2.2052583169751427,silhouette,True,True,False,0.6005653835877157,0.4522529548553708,0.6277905715706197,0.4964433415164501,0.6259251804541127,COMPLETE,0.40407333373263027,0.0,0.0,0.7136050432487905,0.0,,3,2,0.0,0,2,0.0
139,0.0,graph,root-norm,silhouette,blocks.7,layer2,0.007358841494600657,8,0.8677709381247503,0.9064073235607634,1.1862710487497512,1.6362803355150501,heuristic,False,False,True,0.4133082836413313,0.5452822894272245,0.8841266776116474,0.8827833018419932,0.8377094726937188,COMPLETE,0.0,0.4763218569145985,0.0,0.0,0.8467036678655542,,3,2,0.0,0,2,0.0
140,0.0,graph,l2,heuristic,blocks.11,layer1,0.00861658643571781,16,0.9798428823883575,0.9745967049885537,0.8601576390268201,1.6813893572124623,silhouette,True,True,False,0.5720015322736939,0.6919134541121142,0.2525026843704169,0.07608934765365594,0.07235347493662311,COMPLETE,0.38211006878993425,0.0,0.0,0.6751209500073303,0.0,,3,2,0.0,0,2,0.0
141,0.0,kmeans,l2,heuristic,blocks.7,layer2,0.009847908347288197,16,0.9339117680536346,0.9458856247933074,0.7692910065103923,1.8541675424796518,silhouette,False,True,False,0.6638744834590671,0.7431514725941049,0.7909450135758161,0.31774418668129634,0.3244406316763112,COMPLETE,0.502182083109282,0.0,0.0,0.7905732297317108,0.0,,3,2,0.0,0,2,0.0
142,0.0,kmeans,l2,heuristic,blocks.7,layer2,0.009617479842150034,16,0.9395398016980457,0.9435594335070774,0.788019190089489,1.9799219408564597,silhouette,False,True,False,0.711617530586388,0.736894885374796,0.750770974510642,0.33933049166342116,0.2712755962593306,COMPLETE,0.5046677785739422,0.0,0.0,0.7905732297317108,0.0,,3,2,0.0,0,2,0.0
143,0.0,kmeans,l2,heuristic,blocks.7,layer2,0.005857008380814375,16,0.9710994501862741,0.9400463238489539,0.9150311899180985,2.024988307671069,silhouette,False,True,False,0.5252658991599508,0.7319130425952141,0.526929131380025,0.29035375535624997,0.7891539524883805,COMPLETE,0.36744946184080657,0.0,0.0,0.6457997361090749,0.0,,3,2,0.0,0,2,0.0
144,0.0,kmeans,l2,heuristic,blocks.7,layer2,0.009404567372464697,16,0.9354375301191415,0.909396430301496,0.9958638434960334,1.928168611576608,silhouette,False,True,False,0.6409222015981496,0.6571219604911384,0.8336190240854174,0.37471850846273796,0.18743228791072286,COMPLETE,0.2896961237563545,0.0,0.0,0.4795907253285153,0.0,,3,2,0.0,0,2,0.0
145,0.0,kmeans,l2,heuristic,blocks.7,layer3,0.003456235418809662,16,0.9754902282491652,0.9113123202017669,1.1446083892380143,1.8013005880760264,heuristic,False,False,True,0.6975017400170247,0.6329461301457859,0.8500053746128917,0.2608459728386049,0.34766239305804536,COMPLETE,0.0,0.1909017556588136,0.0,0.0,0.30664233115379325,,3,2,0.0,0,2,0.0
146,0.0,graph,root-norm,silhouette,blocks.7,layer2,0.005342675343832884,32,0.8853214268048951,0.9519108894840542,0.672301010752723,1.712553025549557,silhouette,False,True,False,0.6757266818402271,0.7224591627325979,0.13237835023032712,0.36130519219640966,0.30217730884485705,COMPLETE,0.35792006732387355,0.0,0.0,0.6267409470752089,0.0,,3,2,0.0,0,2,0.0
147,0.0,kmeans,l2,heuristic,blocks.11,layer1,0.008838124784166915,16,0.9515950888259203,0.9547677814767915,1.0283526748690284,1.876831590477995,silhouette,True,False,True,0.7384447614975537,0.43604498873589076,0.22015305425314802,0.727883124402167,0.8893910470568559,COMPLETE,0.0,0.4763218569145985,0.0,0.0,0.8467036678655542,,3,2,0.0,0,2,0.0
148,0.0,graph,l2,silhouette,blocks.7,layer3,0.0037582703137641407,8,0.9249559144911748,0.902172393785026,0.7320447905303283,2.1140174330768144,heuristic,False,True,False,0.7211183177663046,0.5386380448225251,0.5716039019638238,0.6546944050245198,0.02417975256286896,COMPLETE,0.39281446585575375,0.0,0.0,0.6751209500073303,0.0,,3,2,0.0,0,2,0.0
149,0.0,graph,root-norm,heuristic,blocks.7,layer1,0.005603605878730823,16,0.9431823993876273,0.9287353765056124,0.9467265642861007,1.8356146274166854,silhouette,True,False,True,0.40015761682734474,0.4104067899274192,0.9814282382343579,0.5227470975218172,0.1401389555934769,COMPLETE,0.0,0.4763218569145985,0.0,0.0,0.8467036678655542,,3,2,0.0,0,2,0.0
150,0.0,graph,l2,silhouette,blocks.11,layer3,0.009988836448987811,32,0.9613841716184651,0.9587491589864673,0.7608539880045821,1.9625630037463921,heuristic,False,True,False,0.7040531725140579,0.5974744343620008,0.9498491330197854,0.03955039206589464,0.9422263086382712,COMPLETE,0.39658741815219783,0.0,0.0,0.7040756487318575,0.0,,3,2,0.0,0,2,0.0
151,0.0,graph,l2,silhouette,blocks.7,layer3,0.0061194744990382185,8,0.9061248841799106,0.9473999653012237,0.8983490323081047,1.529223770282441,heuristic,True,True,False,0.49799778970338576,0.5676118139260461,0.324637193289954,0.5533264131030444,0.3875008669837766,COMPLETE,0.39629390910245743,0.0,0.0,0.7040756487318575,0.0,,3,2,0.0,0,2,0.0
152,0.0,graph,l2,silhouette,blocks.7,layer3,0.002073839590954139,8,0.8800698499292412,0.9447767590946176,0.9232047894181739,1.5033302168933247,heuristic,True,True,False,0.7318072150963786,0.5860456672699931,0.49737378110241315,0.68188527237327,0.3524816695845508,COMPLETE,0.28773357458920995,0.0,0.0,0.47452469077219955,0.0,,3,2,0.0,0,2,0.0
153,0.0,graph,l2,silhouette,blocks.7,layer3,0.009066668343614137,8,0.8771522315531373,0.9386953373494977,0.8883427908366656,1.583151052855913,heuristic,True,True,False,0.5027303728890623,0.5811563296986432,0.3707736070418788,0.33351560850940115,0.31298439953816054,COMPLETE,0.3686095094441823,0.0,0.0,0.6267409470752089,0.0,,3,2,0.0,0,2,0.0
154,0.0,graph,l2,silhouette,blocks.7,layer3,0.004995184113732814,8,0.8950294209435863,0.9416197555335758,0.959614206295452,1.5569410120260192,heuristic,True,True,False,0.5118896979691281,0.6146824954683329,0.9000749000889746,0.6442081806342368,0.0013534161278569296,COMPLETE,0.27978363297380043,0.0,0.0,0.4612283643957852,0.0,,3,2,0.0,0,2,0.0
155,0.0,graph,l2,heuristic,blocks.7,layer2,0.006355064230122387,16,0.9028105219827136,0.9358599127798486,0.9374115498969975,2.056593559043664,heuristic,True,False,True,0.5298304160135545,0.43062757683149033,0.2789658395733178,0.7689634579375555,0.4308695013343901,COMPLETE,0.0,0.4763218569145985,0.0,0.0,0.8467036678655542,,3,2,0.0,0,2,0.0
156,0.0,kmeans,root-norm,silhouette,blocks.7,layer3,0.0069305802160651835,8,0.8718318748355682,0.9135409240215376,0.5417261003446686,1.6089154834282011,silhouette,True,True,False,0.48697908122293404,0.6062557369925499,0.4340784765619554,0.19438699084709193,0.7581407649994779,COMPLETE,0.5018820016991087,0.0,0.0,0.7905732297317108,0.0,,3,2,0.0,0,2,0.0
157,0.0,graph,l2,heuristic,blocks.7,layer1,0.009697326540008626,16,0.9279132397282974,0.9424329579411642,1.0120867190476939,1.6630696079960885,heuristic,False,False,True,0.47973106772733476,0.5738639190398539,0.3380671255286713,0.22050664129531558,0.4774896988751281,COMPLETE,0.0,0.4763218569145985,0.0,0.0,0.8467036678655542,,3,2,0.0,0,2,0.0
158,0.0,graph,l2,silhouette,blocks.11,layer3,0.0066708656678868645,32,0.9658238814641844,0.9531454322344267,0.7120703023919356,1.761990530476571,silhouette,True,True,False,0.6471454549427545,0.5524776197434867,0.30979161482368606,0.6269774213638303,0.6611608256675051,COMPLETE,0.4958528491130816,0.0,0.0,0.7810438352147779,0.0,,3,2,0.0,0,2,0.0
159,0.0,kmeans,l2,heuristic,blocks.7,layer1,0.008173280812649474,16,0.8873064474862424,0.9062008936559756,0.5712139362928983,1.6155128528067038,heuristic,False,True,True,0.633930684555238,0.5045990525164953,0.6500532369374804,0.30445269564132954,0.5405009260485678,COMPLETE,0.5018820016991087,0.4763218569145985,0.0,0.7905732297317108,0.8467036678655542,,3,2,0.0,0,2,0.0
160,0.0,graph,root-norm,silhouette,blocks.7,layer3,0.003025170080672755,16,0.8631997614884638,0.9318469688404287,0.9110767253268597,1.7347437570139765,silhouette,True,False,False,0.6842498465059061,0.6705120599612163,0.9240465894965044,0.7165643013641316,0.41295363170594235,COMPLETE,0.0,0.0,0.0,0.0,0.0,,3,2,0.0,0,2,0.0
161,0.0,graph,l2,heuristic,blocks.7,layer1,0.008294552487830814,16,0.9153164879829642,0.921781362467175,0.8344952514785982,1.9055963392990027,heuristic,True,True,False,0.6162477666698958,0.42457763583568153,0.07565840476852857,0.13960192248030934,0.103799532945481,COMPLETE,0.39763926362231294,0.0,0.0,0.7040756487318575,0.0,,3,2,0.0,0,2,0.0
162,0.0,graph,l2,heuristic,blocks.7,layer1,0.008476697634167887,16,0.9472243252258041,0.9258306294960291,0.983938674169264,1.7980549107680426,heuristic,True,True,False,0.5596536409750269,0.4444673959217601,0.04388561961185966,0.173720531755765,0.690987346386214,COMPLETE,0.5018820016991087,0.0,0.0,0.7905732297317108,0.0,,3,2,0.0,0,2,0.0
163,0.0,graph,l2,heuristic,blocks.7,layer1,0.007154571091896325,16,0.8916629660702292,0.9188548340075191,0.7817230349607037,1.9414799642093266,heuristic,True,True,False,0.60007796396032,0.46711167931464553,0.0006151003994268097,0.12372201850824252,0.28798780583989037,COMPLETE,0.502182083109282,0.0,0.0,0.7905732297317108,0.0,,3,2,0.0,0,2,0.0
164,0.0,graph,l2,heuristic,blocks.7,layer1,0.002725485035494901,16,0.9491927329222313,0.9079724869879147,1.199619377698447,1.8747412475431666,heuristic,True,True,False,0.5675974860227518,0.6469217315338835,0.047039590402301296,0.9722640241939037,0.6586981215269564,COMPLETE,0.40135211541066435,0.0,0.0,0.7136050432487905,0.0,,3,2,0.0,0,2,0.0
165,0.0,graph,l2,heuristic,blocks.11,layer1,0.008685190182038352,32,0.9327938356079012,0.9405090126786568,1.0743423126943297,2.6570075864228095,heuristic,False,True,True,0.5868467294150813,0.4922804883272972,0.539151559121867,0.05239670243196417,0.22287795809312513,COMPLETE,0.36500650318225913,0.4763218569145985,0.0,0.6362703415921419,0.8467036678655542,,3,2,0.0,0,2,0.0
166,0.0,graph,l2,silhouette,blocks.7,layer2,0.007749098119175827,16,0.9370518255142155,0.961424182557239,0.8725487349177029,2.486305529902254,heuristic,True,False,False,0.5833553537184941,0.523321773698425,0.026904220936249185,0.391567282423344,0.6340433958434792,COMPLETE,0.0,0.0,0.0,0.0,0.0,,3,2,0.0,0,2,0.0
167,0.0,graph,root-norm,heuristic,blocks.7,layer3,0.00754610854050884,8,0.9734156069467023,0.9156459434848561,1.0424633691174932,1.8204856041286646,silhouette,False,True,True,0.43477254805547,0.47850227020829933,0.09682503299842612,0.42091346840326604,0.7013543543002722,COMPLETE,0.35803224215650986,0.4763218569145985,0.0,0.5427082541415845,0.8467036678655542,,3,2,0.0,0,2,0.0
168,0.0,kmeans,l2,silhouette,blocks.7,layer1,0.003937517918983391,16,0.9697694232565254,0.917341898323813,0.7419428711920575,2.7517969379492615,heuristic,True,False,False,0.42203750656749256,0.41673354638034477,0.7815722698195289,0.15791530831918713,0.7261230849229107,COMPLETE,0.0,0.0,0.0,0.0,0.0,,3,2,0.0,0,2,0.0
169,0.0,graph,l2,heuristic,blocks.11,layer3,0.0023614972993708256,16,0.9455714600483328,0.9334832964149732,0.8056695488455604,2.4379622232770277,silhouette,False,True,False,0.5201095693696711,0.6842164865769862,0.39871583947523354,0.9077224326585518,0.5864248431350496,COMPLETE,0.3824190158489526,0.0,0.0,0.6751209500073303,0.0,,3,2,0.0,0,2,0.0
170,0.0,graph,l2,silhouette,blocks.7,layer1,0.001854534690196849,32,0.97686926327495,0.9377184270892887,0.8607855285557819,2.3274078324581913,heuristic,True,False,True,0.46157716845728597,0.5120145741532415,0.6113686277412795,0.0976796390236889,0.36169041016953646,COMPLETE,0.0,0.1909017556588136,0.0,0.0,0.30664233115379325,,3,2,0.0,0,2,0.0
171,0.0,graph,l2,silhouette,blocks.7,layer1,0.005172529311798631,16,0.9204176150602337,0.905114290715909,1.1602848768874652,2.5253136482132894,silhouette,False,True,False,0.6269249912518953,0.6225975829600671,0.749243261666268,0.4649356233608219,0.24606171221575465,COMPLETE,0.36977120044072564,0.0,0.0,0.6457997361090749,0.0,,3,2,0.0,0,2,0.0
172,0.0,graph,l2,silhouette,blocks.7,layer1,0.005578711281192808,16,0.942168417163697,0.9091910328892848,0.5984630606372455,2.260501498786047,silhouette,False,True,False,0.6527745223436984,0.5920534624251892,0.814236544371671,0.4408653907675132,0.17293364465820793,COMPLETE,0.39763926362231294,0.0,0.0,0.7040756487318575,0.0,,3,2,0.0,0,2,0.0
173,0.0,graph,l2,silhouette,blocks.7,layer1,0.005340860284837657,16,0.9000239084854196,0.9568928927488327,1.0974768823127843,2.3009308893448,silhouette,False,True,False,0.6392584381433084,0.611010105778277,0.6963546146916001,0.2791920312014622,0.20613369983192473,COMPLETE,0.3844923343956643,0.0,0.0,0.6751209500073303,0.0,,3,2,0.0,0,2,0.0
174,0.0,graph,l2,silhouette,blocks.7,layer1,0.003233779382188661,16,0.911613920085069,0.9601844260473179,1.125684308559908,2.2318331076517963,silhouette,False,True,False,0.659117542868953,0.6019054336985412,0.8735464748312187,0.49930742092760455,0.15961093756449438,COMPLETE,0.502182083109282,0.0,0.0,0.7905732297317108,0.0,,3,2,0.0,0,2,0.0
