number,value,params_dino_pipeline.clustering.clusterer.method,params_dino_pipeline.clustering.clusterer.n_neighbors,params_dino_pipeline.clustering.feature_processing.normalizer.method,params_dino_pipeline.clustering.feature_processing.reducer.method,params_dino_pipeline.clustering.feature_processing.reducer.n_components,params_dino_pipeline.clustering.feature_processing.run_normalization,params_dino_pipeline.clustering.feature_processing.run_reduction,params_dino_pipeline.clustering.k_selection.method,params_extractors.clip.layer_name,params_extractors.clip.model_name,params_extractors.dino_v2.layer_name,params_extractors.dino_v2.model_name,params_extractors.resnet.layer_name,params_extractors.resnet.model_name,params_fusion_pipeline.clustering.k_selection.k_source,params_heuristic_settings.filter_params.filter_min_area_perc,params_heuristic_settings.filter_params.nms_iou_threshold,params_heuristic_settings.filter_params.use_nms,params_heuristic_settings.generator_params.min_mask_region_area,params_heuristic_settings.generator_params.points_per_side,params_heuristic_settings.generator_params.pred_iou_thresh,params_heuristic_settings.generator_params.stability_score_thresh,params_heuristic_settings.k_heuristic_formulas.max_k,params_heuristic_settings.k_heuristic_formulas.semantic_base,params_heuristic_settings.k_heuristic_formulas.semantic_scale_factor,params_heuristic_settings.k_heuristic_formulas.structural_multiplier,params_heuristic_settings.sam_model,params_labeler.aggregation_method,params_labeler.aggregation_top_k_perc,params_labeler.top_n_labels,params_resnet_pipeline.clustering.clusterer.method,params_resnet_pipeline.clustering.clusterer.n_neighbors,params_resnet_pipeline.clustering.feature_processing.normalizer.method,params_resnet_pipeline.clustering.feature_processing.reducer.method,params_resnet_pipeline.clustering.feature_processing.reducer.n_components,params_resnet_pipeline.clustering.feature_processing.run_normalization,params_resnet_pipeline.clustering.feature_processing.run_reduction,params_resnet_pipeline.clustering.k_selection.method,params_resnet_pipeline.image_preprocessing.blur_kernel_size,params_resnet_pipeline.image_preprocessing.clahe_clip_limit,params_resnet_pipeline.image_preprocessing.sobel_kernel_size,params_resnet_pipeline.image_preprocessing.use_clahe,params_resnet_pipeline.image_preprocessing.use_gaussian_blur,params_resnet_pipeline.image_preprocessing.use_grayscale,params_resnet_pipeline.image_preprocessing.use_sobel_edges,params_run_dino_pipeline,params_run_fusion_pipeline,params_run_resnet_pipeline,params_validator_settings.final_threshold,params_validator_settings.semantic_threshold,params_validator_settings.structural_threshold,params_validator_settings.weights.clip_confidence,params_validator_settings.weights.dino_iou,params_validator_settings.weights.resnet_iou,state,user_attrs_error,user_attrs_max_clip_confidence,user_attrs_num_correct_segments
127,0.0,kmeans,40,root-norm,svd,36,True,False,heuristic,transformer.resblocks.9,ViT-B/32,blocks.4,dinov2_vitb14,layer1,resnet50,structural,0.008816401710322254,0.7640185940961235,False,50,32,0.8311714264737141,0.9140649562836598,23,3,1.1731029373724435,1.7641149925862574,facebook/sam2-hiera-large,median,0.2844891954141133,5,kmeans,15,root-norm,svd,35,False,True,heuristic,3.0,3.615780474893972,3,True,True,True,True,False,True,True,0.768892534550143,0.618590456397626,0.7173288699008599,0.7138945852156189,0.316631976283004,0.9495992170295087,COMPLETE,,0.0,0.0
128,0.0,graph,37,z-score,pca,42,False,True,silhouette,transformer.resblocks.9,ViT-B/32,blocks.11,dinov2_vitb14,layer2,resnet50,semantic,0.001350181803631863,0.7043941006593981,True,100,8,0.8952033393398381,0.936536046575601,24,2,1.1273357831136208,1.7046518326858369,facebook/sam2-hiera-large,mean,0.32250544355435684,3,graph,24,z-score,pca,33,True,False,silhouette,5.0,2.4470834331299964,5,False,True,False,True,True,False,False,0.72652606720354,0.6375975351001767,0.545520715329074,0.2872000271030684,0.09919329725787998,0.3976343337390216,COMPLETE,,0.0,0.0
129,0.0,spectral,35,l2,svd,50,True,False,heuristic,transformer.resblocks.10,ViT-B/32,blocks.4,dinov2_vitb14,layer1,resnet50,semantic,0.005961202431795378,0.6360377045385003,True,50,16,0.9533148989426395,0.964991429046705,25,3,0.7560478413614379,2.1617715625686698,facebook/sam2-hiera-large,top_k_mean,0.20803787307691538,5,spectral,10,l2,umap,20,False,True,heuristic,,2.7554015356731867,3,True,False,True,False,False,True,True,0.5435997317681863,0.6874193296400757,0.6151895979669529,0.5244416629253343,0.4321210585245777,0.8266332091344677,COMPLETE,,0.0,0.0
130,0.0,graph,39,z-score,pca,58,False,True,silhouette,transformer.resblocks.11,ViT-B/32,blocks.7,dinov2_vitb14,conv1,resnet50,structural,0.009731001010486625,0.7890319864574459,False,50,8,0.9123440481851165,0.9576305813241146,16,4,0.941004082545846,2.8772032616911503,facebook/sam2-hiera-large,median,0.473320318100481,3,kmeans,11,root-norm,svd,30,True,False,heuristic,7.0,4.108652593282816,5,True,True,False,True,True,False,False,0.6888781781926259,0.696152271087395,0.7034785137854275,0.5656345406378673,0.7322964578583063,0.4669106749504764,COMPLETE,,0.0,0.0
131,0.0,kmeans,25,root-norm,svd,34,True,False,heuristic,transformer.resblocks.9,ViT-B/32,blocks.11,dinov2_vitb14,layer3,resnet50,semantic,0.007957486627799834,0.7100427875763411,True,200,32,0.9798711244266827,0.9017955108828564,17,3,1.0298054954324132,2.4177862469508256,facebook/sam2-hiera-large,top_k_mean,0.1984180787830823,5,graph,39,z-score,pca,61,False,True,silhouette,3.0,2.900102879781294,3,False,True,False,True,False,True,True,0.7449076797857151,0.5824310921864864,0.6760844663574693,0.6947426376179813,0.5621498323405837,0.9854492657331053,COMPLETE,,0.0,0.0
132,0.0,graph,33,z-score,pca,50,False,True,heuristic,transformer.resblocks.9,ViT-B/32,blocks.11,dinov2_vitb14,layer3,resnet50,semantic,0.007347530930244564,0.8422501805486028,False,50,32,0.8880892009712393,0.9170265286724183,26,4,0.5014838767548048,2.578277972679058,facebook/sam2-hiera-large,median,0.1323682308361171,5,kmeans,34,z-score,pca,37,False,False,heuristic,3.0,4.945451067103121,3,True,True,True,True,True,False,False,0.6094093324650875,0.5071166149257671,0.5347293055019716,0.34435878816098797,0.36098067415643453,0.5809116679616468,COMPLETE,,0.0,0.0
133,0.0,graph,31,z-score,pca,48,False,True,heuristic,transformer.resblocks.9,ViT-B/32,blocks.11,dinov2_vitb14,layer4,resnet50,semantic,0.006984824272304061,0.826496630564768,False,50,32,0.8705804034240273,0.9227806291601234,25,4,0.8695429545780404,2.6555338745756,facebook/sam2-hiera-large,median,0.10948125132529303,5,kmeans,31,z-score,pca,43,False,False,heuristic,3.0,4.821270016576253,3,True,True,True,True,True,False,False,0.6289326509193588,0.421468270386184,0.6274871118293661,0.30776020229769563,0.29603267475454215,0.6987545365016107,COMPLETE,,0.0,0.0
134,0.0,graph,35,z-score,pca,53,False,True,heuristic,transformer.resblocks.9,ViT-B/32,blocks.11,dinov2_vitb14,layer3,resnet50,semantic,0.006197945402065682,0.8336074427456764,False,50,32,0.8799022982624096,0.933930312481381,15,4,0.9891900811945349,2.508004828832994,facebook/sam2-hiera-large,median,0.27215272128474777,5,kmeans,30,z-score,pca,47,False,False,heuristic,3.0,4.538576204651149,3,True,True,True,True,True,False,False,0.6462418666437478,0.5697402796959379,0.521449747144681,0.4825356857825924,0.33793483504500305,0.6588618090001737,COMPLETE,,0.0,0.0
135,0.0,graph,34,z-score,pca,21,False,True,heuristic,transformer.resblocks.9,ViT-B/32,blocks.11,dinov2_vitb14,layer3,resnet50,semantic,0.006555207484119934,0.7557375572480645,False,50,32,0.9708677130945962,0.9110088084573682,25,4,0.8432182427545754,2.2523637684467226,facebook/sam2-hiera-large,median,0.12029020800458681,5,kmeans,29,z-score,pca,56,False,False,heuristic,3.0,4.497052609895589,3,True,True,True,True,True,False,False,0.6013000120000028,0.6569491776260088,0.4886391325900034,0.2712281392806623,0.8275464726189795,0.6167795880835905,COMPLETE,,0.0,0.0
136,0.0,graph,38,z-score,umap,46,False,True,heuristic,transformer.resblocks.9,ViT-B/32,blocks.4,dinov2_vitb14,layer3,resnet50,semantic,0.007736048305144396,0.8047538835235021,False,50,8,0.9310242354381437,0.9305980541803076,24,4,0.6858991364398711,2.6270438404174943,facebook/sam2-hiera-large,median,0.40888413987218036,3,kmeans,27,l2,umap,39,False,False,heuristic,,4.707869393695896,3,True,False,True,True,True,False,False,0.6746433209208915,0.5371557422458858,0.7395475504744439,0.6481655876370065,0.2857136445291384,0.5969055131243199,COMPLETE,,0.0,0.0
137,0.0,spectral,32,l2,pca,23,True,False,silhouette,transformer.resblocks.11,ViT-B/32,blocks.4,dinov2_vitb14,layer1,resnet50,structural,0.008251122226665552,0.7464568972353094,True,100,32,0.8996183147318566,0.9247820709779394,26,2,0.7740333001751805,2.7159417543230497,facebook/sam2-hiera-large,mean,0.10129594521111644,5,graph,28,root-norm,svd,54,True,True,silhouette,3.0,2.151462595633555,5,True,True,False,False,False,True,False,0.7005885360953287,0.43068933709830703,0.4072239231911156,0.42198675730608753,0.3792007573986707,0.5224406362214191,COMPLETE,,0.0,0.0
138,0.0,graph,12,z-score,svd,47,False,True,heuristic,transformer.resblocks.10,ViT-B/32,blocks.11,dinov2_vitb14,layer2,resnet50,semantic,0.006379361456344256,0.8446370418766979,False,50,8,0.8661006478241572,0.9767535222385816,22,4,0.9023691119345012,1.5065810375231217,facebook/sam2-hiera-large,top_k_mean,0.14483376969103695,3,graph,31,z-score,umap,45,False,False,heuristic,,1.061618887025729,3,False,False,True,True,True,False,True,0.6240804150635498,0.6313056640227478,0.5241730309469469,0.04236056280179353,0.4147453046274967,0.5623384964950505,COMPLETE,,0.0,0.0
139,0.0,kmeans,20,z-score,pca,26,True,False,silhouette,transformer.resblocks.9,ViT-B/32,blocks.7,dinov2_vitb14,conv1,resnet50,semantic,0.007294444943005781,0.6894187970460326,True,50,32,0.9198794942345999,0.9543562016967311,27,4,0.5573237032704326,2.485250728990725,facebook/sam2-hiera-large,mean,0.17712350342565314,5,kmeans,35,root-norm,pca,51,True,True,silhouette,5.0,4.650520283670491,3,True,True,False,True,False,True,False,0.5712225591501079,0.49277289519465517,0.5631089697949397,0.320583810370639,0.03831621003207192,0.49789846328343257,COMPLETE,,0.0,0.0
140,0.0,graph,10,root-norm,umap,49,False,True,heuristic,transformer.resblocks.9,ViT-B/32,blocks.4,dinov2_vitb14,layer1,resnet50,structural,0.007562404414381601,0.8383215689588774,False,50,16,0.9033321986749304,0.9196806630413744,30,2,0.9228757932148082,2.6765526281166547,facebook/sam2-hiera-large,median,0.31746611936281266,3,spectral,33,z-score,svd,53,False,False,heuristic,7.0,4.3445034751816225,5,True,True,True,False,False,False,True,0.615533778895462,0.5291431833598438,0.5974316960054472,0.1009516404769347,0.2589070271700966,0.17411386910868604,COMPLETE,,0.0,0.0
141,0.0,graph,19,l2,svd,44,True,False,silhouette,transformer.resblocks.11,ViT-B/32,blocks.11,dinov2_vitb14,layer2,resnet50,semantic,0.009363283718268885,0.6968924038291054,True,100,8,0.9166915742837967,0.9268353494933251,23,4,0.7128645675752995,2.1255894144736853,facebook/sam2-hiera-large,top_k_mean,0.2992750325715628,5,graph,13,l2,umap,16,True,True,heuristic,,2.608646396539091,3,False,False,False,True,True,True,False,0.6364698243432697,0.6465225671494161,0.43210509083340276,0.6731803753004678,0.9417223941403966,0.6313604945296786,COMPLETE,,0.0,0.0
142,0.0,graph,28,z-score,pca,63,True,True,heuristic,transformer.resblocks.9,ViT-B/32,blocks.7,dinov2_vitb14,layer4,resnet50,semantic,0.005760270886086733,0.8489953346594772,True,200,16,0.9428946084915357,0.9498269024706987,18,3,0.650123411420613,2.437334339570276,facebook/sam2-hiera-large,top_k_mean,0.4901478897797153,5,spectral,14,root-norm,umap,60,True,False,heuristic,3.0,1.2523804738752922,3,True,True,False,False,False,True,False,0.773507943034783,0.47787665687771697,0.6515524231677118,0.600505705795163,0.4635766625387355,0.4191625511224033,COMPLETE,,0.0,0.0
143,0.0,graph,36,z-score,pca,64,True,True,heuristic,transformer.resblocks.9,ViT-B/32,blocks.7,dinov2_vitb14,layer4,resnet50,semantic,0.004888840436649035,0.800200999437451,True,200,16,0.834981744921302,0.9517712924963252,21,3,0.6318548014464178,2.5393284712701454,facebook/sam2-hiera-large,top_k_mean,0.47967976239716975,5,spectral,12,root-norm,umap,63,True,False,heuristic,3.0,1.395231016657822,3,True,True,False,False,False,True,False,0.7138004553282554,0.6689955531630751,0.6872462651212325,0.6309117763654067,0.39798803800774574,0.3380171393850916,COMPLETE,,0.0,0.0
144,0.0,graph,29,z-score,pca,60,True,True,heuristic,transformer.resblocks.9,ViT-B/32,blocks.7,dinov2_vitb14,layer4,resnet50,semantic,0.0053569323408014825,0.7975850758877553,True,200,16,0.962655372213903,0.9455024034597452,20,2,0.6054689799432633,2.6339904695957763,facebook/sam2-hiera-large,top_k_mean,0.4623617481896325,5,spectral,15,root-norm,umap,61,True,False,heuristic,3.0,4.001633424584753,3,True,True,False,False,False,True,False,0.6821567408502941,0.6212851270963723,0.4729941194630023,0.058379157839458906,0.4994765240179524,0.3657242423065326,COMPLETE,,0.0,0.0
145,0.0,graph,34,z-score,pca,39,True,True,heuristic,transformer.resblocks.9,ViT-B/32,blocks.7,dinov2_vitb14,layer4,resnet50,semantic,0.005594416502662508,0.8115590591979488,True,200,16,0.8731845414165614,0.9486338470378985,19,4,0.6735147939680779,2.473621662908588,facebook/sam2-hiera-large,top_k_mean,0.4925939392869973,5,spectral,37,root-norm,umap,35,True,False,heuristic,3.0,1.5090571003668725,3,True,True,False,False,False,True,False,0.7624017136153888,0.6010333826804262,0.6666843324320886,0.21961496223046248,0.32288219365848686,0.45875890004530145,COMPLETE,,0.0,0.0
146,0.0,kmeans,30,z-score,pca,19,False,True,heuristic,transformer.resblocks.9,ViT-B/32,blocks.4,dinov2_vitb14,layer3,resnet50,semantic,0.006780468017174231,0.7749190040414351,True,200,32,0.9508200179035481,0.915711640887239,20,2,1.1863701963263626,1.8840629786764487,facebook/sam2-hiera-large,median,0.10016348140781131,3,kmeans,13,root-norm,umap,58,True,False,silhouette,3.0,1.0081717876577867,3,True,True,False,False,False,True,False,0.7902724448864844,0.5638159371220096,0.6731667973219686,0.36784578707232674,0.35053254033245373,0.7482027599385553,COMPLETE,,0.0,0.0
147,0.0,spectral,14,z-score,pca,24,True,False,heuristic,transformer.resblocks.10,ViT-B/32,blocks.7,dinov2_vitb14,conv1,resnet50,structural,0.009212012194868944,0.8211801947520393,True,50,8,0.9465104734330669,0.9410864139029075,19,4,0.5859700204347724,1.6211932009330325,facebook/sam2-hiera-large,top_k_mean,0.49987643483869043,5,graph,11,z-score,pca,63,False,True,heuristic,7.0,3.156407043695127,5,True,True,True,True,False,False,True,0.7821249267514223,0.5487941238423624,0.5816964234927826,0.5540748959706602,0.3788250555562801,0.38268088855899407,COMPLETE,,0.0,0.0
148,0.0,graph,39,l2,svd,51,True,True,silhouette,transformer.resblocks.9,ViT-B/32,blocks.11,dinov2_vitb14,layer1,resnet50,semantic,0.005063093831300782,0.8288237690992244,False,50,16,0.9393249176294138,0.9595865667513379,24,3,0.8878538908068162,2.6017162843847306,facebook/sam2-hiera-large,mean,0.25716836315427216,3,spectral,36,l2,svd,19,True,False,heuristic,,1.647679734230526,3,False,False,False,True,True,True,False,0.7365332513633348,0.724274416165425,0.5510780350056173,0.9327092436314994,0.8014466770039933,0.9047114822850257,COMPLETE,,0.0,0.0
149,0.0,graph,31,z-score,pca,62,False,True,heuristic,transformer.resblocks.11,ViT-B/32,blocks.4,dinov2_vitb14,layer4,resnet50,semantic,0.008531634576201553,0.7859466346598701,True,200,8,0.9593886947062417,0.9443703955977212,22,4,0.6387195920110605,2.369596208332753,facebook/sam2-hiera-large,median,0.3643936951521085,5,kmeans,21,root-norm,umap,27,False,False,silhouette,5.0,4.223178281492135,3,True,True,True,True,False,False,True,0.5457470632114727,0.5161700867763216,0.6246170915293044,0.13202470864487867,0.12436801638704947,0.3231846756372925,COMPLETE,,0.0,0.0
150,0.0,kmeans,38,root-norm,umap,31,True,False,silhouette,transformer.resblocks.9,ViT-B/32,blocks.11,dinov2_vitb14,layer2,resnet50,structural,0.0044497738800904595,0.7212228155562841,False,50,32,0.8541494310062956,0.9224880085446442,15,2,0.9589025460259658,1.7326538129050204,facebook/sam2-hiera-large,top_k_mean,0.16285929552340414,5,graph,16,z-score,pca,48,True,True,heuristic,3.0,1.2051454043645136,5,True,True,False,False,True,True,False,0.7492237814135239,0.7033587410939094,0.5029381538014748,0.49299840291980446,0.44089794480118033,0.4391276832224795,COMPLETE,,0.0,0.0
151,0.0,graph,40,z-score,svd,41,False,True,heuristic,transformer.resblocks.9,ViT-B/32,blocks.4,dinov2_vitb14,layer1,resnet50,semantic,0.008946178533494168,0.6122608738357693,True,100,8,0.973509250723364,0.947581242569027,16,4,0.8040915131699913,2.3083673493887993,facebook/sam2-hiera-large,mean,0.1540648154948232,3,kmeans,32,z-score,svd,64,False,False,silhouette,,3.463518738123648,3,False,False,True,True,False,False,False,0.6936971576635217,0.6421486647542168,0.6440390139505772,0.6568950454884416,0.5908362611855851,0.9623862852302951,COMPLETE,,0.0,0.0
152,0.0,spectral,40,root-norm,pca,60,False,True,silhouette,transformer.resblocks.10,ViT-B/32,blocks.4,dinov2_vitb14,layer1,resnet50,semantic,0.007943176999612438,0.7355758899205809,False,100,8,0.8259579700840627,0.9290789849881794,28,3,0.7291133070709116,2.96543305856414,facebook/sam2-hiera-large,median,0.42044942286679005,5,graph,20,z-score,pca,42,False,False,heuristic,3.0,3.3920410246700725,3,True,True,True,True,True,False,False,0.6710398483713871,0.47291468296533185,0.6057748183006422,0.5891780517867413,0.9213930872398842,0.6639489931970114,COMPLETE,,0.0,0.0
153,0.0,spectral,38,root-norm,pca,56,False,True,silhouette,transformer.resblocks.10,ViT-B/32,blocks.4,dinov2_vitb14,layer1,resnet50,semantic,0.007027607090606634,0.7267188577251629,False,100,8,0.8471783436867535,0.917994380804604,30,3,0.8304909534971113,2.913656638229647,facebook/sam2-hiera-large,median,0.1844102719471576,5,graph,22,z-score,pca,40,False,False,heuristic,3.0,3.533259154830751,3,True,True,True,True,True,False,False,0.6639969671502975,0.6122170652969958,0.6352605682376886,0.015196372424290047,0.8015458345976036,0.7362491896959911,COMPLETE,,0.0,0.0
154,0.0,spectral,39,root-norm,pca,22,False,True,silhouette,transformer.resblocks.10,ViT-B/32,blocks.4,dinov2_vitb14,layer1,resnet50,semantic,0.007809229438752198,0.6053631480538323,False,100,8,0.838353541244427,0.9730958618140843,27,4,0.6194415791830897,2.9648187158037094,facebook/sam2-hiera-large,median,0.4112754850577039,5,graph,23,z-score,pca,43,False,False,heuristic,3.0,3.750781800988049,3,True,True,True,True,True,False,False,0.6491467979474739,0.48603667497555997,0.6288042196366255,0.02217076769476021,0.1796610964454743,0.7179235640813335,COMPLETE,,0.0,0.0
155,0.0,spectral,25,root-norm,pca,55,False,True,silhouette,transformer.resblocks.10,ViT-B/32,blocks.4,dinov2_vitb14,conv1,resnet50,semantic,0.0030842326040570094,0.714092926370856,False,100,8,0.9274573295331875,0.9698184544951688,21,4,0.9782843756118385,2.8442742966747536,facebook/sam2-hiera-large,median,0.39407300520831506,5,graph,24,z-score,pca,45,False,False,heuristic,3.0,1.0941950221415997,3,True,True,True,True,True,False,False,0.6576988843717991,0.5026080039635714,0.44961523653204943,0.44506310908805147,0.6790621733846324,0.6951887016269483,COMPLETE,,0.0,0.0
156,0.0,spectral,23,l2,pca,57,False,False,silhouette,transformer.resblocks.10,ViT-B/32,blocks.7,dinov2_vitb14,layer1,resnet50,semantic,0.008200843136155255,0.7620809487727335,False,50,32,0.9239171737614661,0.9083616812694105,29,3,1.156766181466278,1.9585153917332048,facebook/sam2-hiera-large,median,0.43352683521008717,5,graph,18,l2,umap,41,True,True,heuristic,7.0,3.2727820325006425,3,True,True,False,True,True,False,True,0.679557531173136,0.4612817594517047,0.6109126086949865,0.7563944877827379,0.8414361711615641,0.11957777694989705,COMPLETE,,0.0,0.0
157,0.0,graph,26,z-score,svd,53,True,True,silhouette,transformer.resblocks.11,ViT-B/32,blocks.4,dinov2_vitb14,layer2,resnet50,structural,0.005253979795856914,0.7461596082252369,False,50,16,0.8604690532403628,0.9256470963862228,26,4,0.8489094889118328,1.8200404588358317,facebook/sam2-hiera-large,top_k_mean,0.3793583387242624,3,spectral,38,root-norm,pca,57,False,False,heuristic,5.0,3.0894201325158974,5,True,True,True,True,False,True,False,0.5367387435905563,0.51198086003503,0.7300666790951075,0.0007929132105373299,0.7321240084466172,0.4129540075420319,COMPLETE,,0.0,0.0
158,0.0,kmeans,40,root-norm,pca,20,False,False,heuristic,transformer.resblocks.9,ViT-B/32,blocks.11,dinov2_vitb14,conv1,resnet50,semantic,0.002535863218066154,0.6434356265033945,True,100,8,0.9658925886054863,0.9123948107957719,27,4,0.745303457570688,2.0575403167245585,facebook/sam2-hiera-large,median,0.4718084393208357,5,graph,19,z-score,svd,39,True,True,silhouette,3.0,1.93475879420639,3,False,True,False,False,True,True,False,0.6895091345901916,0.499941760570313,0.6550292687164843,0.06561406720457626,0.6445343459036287,0.9870473560889863,COMPLETE,,0.0,0.0
159,0.0,graph,32,z-score,umap,48,True,True,silhouette,transformer.resblocks.9,ViT-B/32,blocks.4,dinov2_vitb14,layer1,resnet50,semantic,0.008692423914489125,0.7077116434264918,False,200,32,0.8820246577446298,0.9364109652441139,30,3,1.1994199852608654,2.9954968009051486,facebook/sam2-hiera-large,top_k_mean,0.4536614781629757,3,kmeans,20,root-norm,umap,54,False,False,heuristic,,3.8365482675295253,3,True,False,True,True,False,False,True,0.7061701498546202,0.7123816918347647,0.4636308921720985,0.2532397807806027,0.8758468817174934,0.9279576849385317,COMPLETE,,0.0,0.0
