number,value,params_dino_pipeline.clustering.clusterer.method,params_dino_pipeline.clustering.clusterer.n_neighbors,params_dino_pipeline.clustering.feature_processing.normalizer.method,params_dino_pipeline.clustering.feature_processing.reducer.method,params_dino_pipeline.clustering.feature_processing.reducer.n_components,params_dino_pipeline.clustering.feature_processing.run_normalization,params_dino_pipeline.clustering.feature_processing.run_reduction,params_dino_pipeline.clustering.k_selection.method,params_extractors.clip.layer_name,params_extractors.clip.model_name,params_extractors.dino_v2.layer_name,params_extractors.dino_v2.model_name,params_extractors.resnet.layer_name,params_extractors.resnet.model_name,params_fusion_pipeline.clustering.k_selection.k_source,params_heuristic_settings.filter_params.filter_min_area_perc,params_heuristic_settings.filter_params.nms_iou_threshold,params_heuristic_settings.filter_params.use_nms,params_heuristic_settings.generator_params.min_mask_region_area,params_heuristic_settings.generator_params.points_per_side,params_heuristic_settings.generator_params.pred_iou_thresh,params_heuristic_settings.generator_params.stability_score_thresh,params_heuristic_settings.k_heuristic_formulas.max_k,params_heuristic_settings.k_heuristic_formulas.semantic_base,params_heuristic_settings.k_heuristic_formulas.semantic_scale_factor,params_heuristic_settings.k_heuristic_formulas.structural_multiplier,params_heuristic_settings.sam_model,params_labeler.aggregation_method,params_labeler.aggregation_top_k_perc,params_labeler.top_n_labels,params_resnet_pipeline.clustering.clusterer.method,params_resnet_pipeline.clustering.clusterer.n_neighbors,params_resnet_pipeline.clustering.feature_processing.normalizer.method,params_resnet_pipeline.clustering.feature_processing.reducer.method,params_resnet_pipeline.clustering.feature_processing.reducer.n_components,params_resnet_pipeline.clustering.feature_processing.run_normalization,params_resnet_pipeline.clustering.feature_processing.run_reduction,params_resnet_pipeline.clustering.k_selection.method,params_resnet_pipeline.image_preprocessing.blur_kernel_size,params_resnet_pipeline.image_preprocessing.clahe_clip_limit,params_resnet_pipeline.image_preprocessing.sobel_kernel_size,params_resnet_pipeline.image_preprocessing.use_clahe,params_resnet_pipeline.image_preprocessing.use_gaussian_blur,params_resnet_pipeline.image_preprocessing.use_grayscale,params_resnet_pipeline.image_preprocessing.use_sobel_edges,params_run_dino_pipeline,params_run_fusion_pipeline,params_run_resnet_pipeline,params_validator_settings.final_threshold,params_validator_settings.semantic_threshold,params_validator_settings.structural_threshold,params_validator_settings.weights.clip_confidence,params_validator_settings.weights.dino_iou,params_validator_settings.weights.resnet_iou,state,user_attrs_error,user_attrs_max_clip_confidence,user_attrs_num_correct_segments
61,0.0,kmeans,28,z-score,pca,59,True,True,heuristic,transformer.resblocks.11,ViT-B/32,blocks.4,dinov2_vitb14,layer1,resnet50,semantic,0.007775696045108335,0.6821272193127691,True,50,8,0.9030208777127243,0.9283942474255297,22,2,0.5968646887294558,2.627377695292021,facebook/sam2-hiera-large,median,0.3350383241092413,3,graph,24,l2,svd,24,True,True,silhouette,3.0,3.0780157903965955,5,False,True,False,True,False,False,False,0.5578469878957097,0.40651046313251776,0.5831311053999169,0.28403323439432443,0.9393984030998037,0.9980504290125972,COMPLETE,,0.0,0.0
62,0.0,graph,36,l2,pca,34,False,False,silhouette,transformer.resblocks.10,ViT-B/32,blocks.4,dinov2_vitb14,layer1,resnet50,semantic,0.0010463404715586261,0.7054731241622972,False,50,8,0.9099636591592456,0.9038033702110565,25,4,1.1791083565574365,1.667399176281913,facebook/sam2-hiera-large,mean,0.3868474111047089,3,graph,22,l2,svd,16,True,True,heuristic,3.0,1.2380723139049667,5,False,True,True,True,False,True,True,0.5203765792624804,0.6270242033232105,0.7131540913531484,0.5803884150831051,0.26991553269861646,0.6845694033232822,COMPLETE,,0.0,0.0
63,0.0,graph,33,l2,pca,38,False,False,silhouette,transformer.resblocks.10,ViT-B/32,blocks.4,dinov2_vitb14,layer1,resnet50,semantic,0.0024773395762138243,0.6663281175185752,False,50,8,0.9011925712853568,0.9105220335315397,29,4,1.1484703495670816,1.5419616435280792,facebook/sam2-hiera-large,mean,0.4136434063414041,3,graph,26,l2,svd,19,True,True,heuristic,3.0,4.321624999976802,5,False,True,True,True,False,True,True,0.5781084284736435,0.6509845895987697,0.7482175504001002,0.7541717470189807,0.4781087403148189,0.7694725407250689,COMPLETE,,0.0,0.0
64,0.0,graph,38,l2,pca,30,False,False,silhouette,transformer.resblocks.10,ViT-B/32,blocks.4,dinov2_vitb14,layer1,resnet50,semantic,0.0027636672460221645,0.6495167018682177,False,50,8,0.8903151688785825,0.9661513931651079,26,4,1.1076124996506822,2.2237509873328225,facebook/sam2-hiera-large,mean,0.3541863410933299,3,graph,21,l2,svd,20,True,True,heuristic,3.0,1.8800706154945521,5,False,True,True,True,False,True,True,0.6373895066279921,0.6161173262243298,0.4426020775606141,0.48623722002281694,0.3348194650634208,0.873896866744486,COMPLETE,,0.0,0.0
65,0.0,graph,40,l2,pca,26,False,False,silhouette,transformer.resblocks.10,ViT-B/32,blocks.4,dinov2_vitb14,layer4,resnet50,semantic,0.0018203003321244674,0.6962951399070845,False,100,32,0.8079342369135039,0.9050696220356531,27,4,0.9872531642387214,1.704972481363268,facebook/sam2-hiera-large,mean,0.19328430254063672,3,graph,39,l2,svd,18,True,False,heuristic,3.0,3.4279578505540624,5,False,True,True,True,False,True,True,0.5649034308114744,0.6686590572796444,0.726720491881845,0.5310672432909749,0.08089094784067152,0.038648553450639354,COMPLETE,,0.0,0.0
66,0.0,graph,34,root-norm,svd,18,True,False,silhouette,transformer.resblocks.9,ViT-B/32,blocks.11,dinov2_vitb14,conv1,resnet50,structural,0.009457312494654566,0.8487838438205232,False,50,8,0.9195944555615547,0.9001162566243166,28,4,0.7689139474960991,1.640469995779297,facebook/sam2-hiera-large,top_k_mean,0.15481553818048402,3,kmeans,30,z-score,umap,22,True,True,heuristic,,2.3388704337663118,5,True,False,False,True,True,True,True,0.6030267351627591,0.5904273125318992,0.6806849377995428,0.08446378776745368,0.15723038305756037,0.6196361884520523,COMPLETE,,0.0,0.0
67,0.0,kmeans,21,z-score,pca,16,False,True,silhouette,transformer.resblocks.9,ViT-B/32,blocks.4,dinov2_vitb14,layer1,resnet50,semantic,0.0071059342705292955,0.818353037412934,True,50,32,0.8564682414745662,0.9146339390394936,23,4,1.1594835332565552,1.7608642104765755,facebook/sam2-hiera-large,top_k_mean,0.4414870469416154,5,spectral,27,l2,pca,40,False,False,heuristic,3.0,3.6480037698198657,3,False,True,True,True,False,True,True,0.5403226701942277,0.6354351132496653,0.6629982716879805,0.6521582514479327,0.8977505622641023,0.5709345493126226,COMPLETE,,0.0,0.0
68,0.0,graph,37,l2,umap,55,True,False,heuristic,transformer.resblocks.11,ViT-B/32,blocks.4,dinov2_vitb14,layer2,resnet50,structural,0.0038129492158450384,0.7505170194762698,False,200,16,0.9716632081007146,0.9240549240349011,30,4,1.1991802169325103,1.6085664286780643,facebook/sam2-hiera-large,mean,0.23009856529074882,3,graph,36,root-norm,umap,25,True,True,heuristic,7.0,4.58898321363943,3,True,True,False,False,True,False,False,0.6918591158976681,0.5400829514687269,0.7064840524571732,0.23396191836995772,0.21739382202887583,0.6868212370914432,COMPLETE,,0.0,0.0
69,0.0,kmeans,30,root-norm,pca,42,False,True,silhouette,transformer.resblocks.9,ViT-B/32,blocks.7,dinov2_vitb14,layer4,resnet50,structural,0.005141334202902763,0.684071804562501,True,100,32,0.8636566079662582,0.9765134535786726,15,4,0.6273662320959049,2.551371739027072,facebook/sam2-hiera-large,median,0.20418105396148484,5,kmeans,24,l2,svd,33,True,False,silhouette,,1.0109489790784272,5,False,False,True,True,False,True,True,0.5321719152275833,0.5582961030400264,0.6134679176586854,0.39951807389714966,0.40219868235934436,0.9175488449930422,COMPLETE,,0.0,0.0
70,0.0,graph,35,z-score,svd,46,True,False,heuristic,transformer.resblocks.10,ViT-B/32,blocks.4,dinov2_vitb14,layer1,resnet50,semantic,0.006466140943434452,0.7174750741192981,True,50,8,0.8365150673701055,0.9797216357258767,24,3,0.6964599949766043,1.8383649261700745,facebook/sam2-hiera-large,top_k_mean,0.3129095824269239,3,graph,34,z-score,umap,36,False,True,heuristic,3.0,3.861389602498839,3,True,True,False,True,False,False,False,0.5837980567511355,0.4300252259952623,0.47032651004499104,0.5855213386516442,0.26990144908173974,0.10541486543017745,COMPLETE,,0.0,0.0
71,0.0,spectral,26,l2,pca,51,False,True,silhouette,transformer.resblocks.9,ViT-B/32,blocks.11,dinov2_vitb14,conv1,resnet50,structural,0.006187730206299781,0.6560638042650779,False,100,32,0.8779947669402595,0.9611334093435158,21,4,0.5420392316828941,1.7281882048398314,facebook/sam2-hiera-large,top_k_mean,0.37290244907680287,5,graph,13,l2,svd,17,True,True,silhouette,3.0,1.564109963750668,5,False,True,False,True,True,True,False,0.619921928953748,0.6111368822938514,0.6038086132586378,0.16254796216391132,0.8615895586238465,0.4486134631216242,COMPLETE,,0.0,0.0
72,0.0,graph,14,l2,svd,23,True,False,heuristic,transformer.resblocks.9,ViT-B/32,blocks.11,dinov2_vitb14,layer2,resnet50,semantic,0.00943659383422717,0.8029877634114198,False,50,16,0.936102083592459,0.9732950431614434,21,2,0.8678855902304631,1.5281592619751718,facebook/sam2-hiera-large,median,0.41385728251423165,3,spectral,16,root-norm,umap,55,False,False,silhouette,5.0,3.8444775204453365,5,True,True,False,False,True,False,True,0.6622562390547575,0.42246290156960165,0.4191904172188944,0.06507838164138036,0.5292126634276465,0.9737155042497011,COMPLETE,,0.0,0.0
73,0.0,graph,12,l2,svd,48,True,False,heuristic,transformer.resblocks.9,ViT-B/32,blocks.11,dinov2_vitb14,layer2,resnet50,semantic,0.008599451176946575,0.8346724850008167,False,50,16,0.9285321837953865,0.9775298489974339,19,2,0.5237848410732449,1.627199027301571,facebook/sam2-hiera-large,median,0.49866846238039214,3,spectral,14,root-norm,umap,50,False,False,silhouette,5.0,4.077578920341985,5,True,True,False,False,True,False,True,0.714164658351847,0.44870264977206165,0.41048415532399035,0.11454693774807939,0.969581335693984,0.7919010444136386,COMPLETE,,0.0,0.0
74,0.0,graph,17,l2,svd,28,True,False,heuristic,transformer.resblocks.9,ViT-B/32,blocks.11,dinov2_vitb14,layer2,resnet50,semantic,0.008924186034283191,0.8092138516039638,False,50,16,0.9133065217700033,0.9691754749318361,26,2,0.6592006376480077,1.551195159745103,facebook/sam2-hiera-large,median,0.46554446003624855,3,spectral,11,root-norm,umap,53,False,False,silhouette,5.0,3.2022165962920894,5,True,True,False,False,True,False,True,0.7304036340360341,0.46311532002186306,0.4470317891346198,0.7800623900511616,0.5734599782904521,0.9416520472355631,COMPLETE,,0.0,0.0
75,0.0,graph,12,z-score,svd,22,True,False,heuristic,transformer.resblocks.9,ViT-B/32,blocks.11,dinov2_vitb14,layer2,resnet50,semantic,0.008420682286278128,0.7929902193537607,False,50,16,0.9456433274997118,0.9443112132102051,22,2,0.917277265264465,1.7915583469814438,facebook/sam2-hiera-large,median,0.3970593611721865,3,spectral,19,root-norm,umap,59,False,False,silhouette,5.0,2.8990980713540146,5,True,True,False,False,True,False,True,0.6958110062974544,0.5719686822684013,0.4306090085711387,0.025484254198452422,0.6727556025055739,0.3252106668552629,COMPLETE,,0.0,0.0
76,0.0,kmeans,10,l2,svd,45,True,False,heuristic,transformer.resblocks.11,ViT-B/32,blocks.4,dinov2_vitb14,layer3,resnet50,semantic,0.005679245272012372,0.7308683783739871,True,50,8,0.9583705480025011,0.9526237760277305,30,2,0.609078992287682,1.5022346686629588,facebook/sam2-hiera-large,median,0.45285319058881573,3,kmeans,20,z-score,pca,57,True,False,heuristic,7.0,2.6960089343740736,3,True,True,False,False,False,False,True,0.6796220017202921,0.4814775927227689,0.46645091328897653,0.45407321336544065,0.48276510389214417,0.9787374434574546,COMPLETE,,0.0,0.0
77,0.0,graph,36,root-norm,pca,33,True,True,heuristic,transformer.resblocks.10,ViT-B/32,blocks.7,dinov2_vitb14,layer1,resnet50,structural,0.009689262072546332,0.8257326420889869,False,50,32,0.9214230664278562,0.9728525473169727,23,4,0.5601954122450262,2.032401706330533,facebook/sam2-hiera-large,top_k_mean,0.38767426003052446,5,graph,17,root-norm,umap,30,False,False,silhouette,3.0,1.3007399507369362,3,False,True,False,True,True,True,False,0.700640864075099,0.4150338496471824,0.4874453533244793,0.375376667520531,0.3553757391562739,0.23166030311643485,COMPLETE,,0.0,0.0
78,0.0,spectral,24,z-score,svd,30,False,False,silhouette,transformer.resblocks.9,ViT-B/32,blocks.11,dinov2_vitb14,layer2,resnet50,semantic,0.009060880177292329,0.6006918254230413,True,100,16,0.8462640579357731,0.9101549542849563,18,2,0.7871694117064899,1.8893077231466942,facebook/sam2-hiera-large,median,0.4292671298276817,3,spectral,13,l2,svd,21,True,True,heuristic,,4.343843685468468,5,True,False,True,True,False,True,True,0.6547821743193861,0.4373353947165357,0.7012541628588365,0.29747049729219105,0.1719962082835842,0.9008748428381401,COMPLETE,,0.0,0.0
79,0.0,kmeans,18,l2,pca,19,True,True,heuristic,transformer.resblocks.9,ViT-B/32,blocks.4,dinov2_vitb14,conv1,resnet50,structural,0.009337542623690437,0.7723562433528247,True,50,8,0.952567682080097,0.964287094687458,21,4,1.0080135939144295,2.0977215867923698,facebook/sam2-hiera-large,mean,0.28265182537042977,5,kmeans,23,z-score,umap,51,True,False,silhouette,7.0,1.7217829941266305,3,False,True,False,True,True,False,False,0.6673894923838765,0.644572625765953,0.6355641384729271,0.3302504211753601,0.11124796803925452,0.8404456315518269,COMPLETE,,0.0,0.0
80,0.0,graph,38,root-norm,umap,36,False,False,silhouette,transformer.resblocks.10,ViT-B/32,blocks.7,dinov2_vitb14,layer4,resnet50,semantic,0.0047145171169345555,0.7846373321325639,False,200,32,0.9659990431702282,0.958279944039123,29,4,0.6806878826419152,2.335112220446183,facebook/sam2-hiera-large,top_k_mean,0.26215172047152413,3,graph,37,root-norm,svd,53,False,True,heuristic,5.0,3.63767881009119,5,True,True,True,False,False,True,False,0.5657160337950402,0.4007683732365171,0.7393418081652469,0.8784055623930893,0.7107504320697088,0.3996074478428368,COMPLETE,,0.0,0.0
81,0.0,kmeans,32,z-score,svd,40,True,True,heuristic,transformer.resblocks.9,ViT-B/32,blocks.4,dinov2_vitb14,layer1,resnet50,structural,0.004105680400308246,0.6699288123935447,True,100,8,0.8295182917144414,0.905371627763652,17,3,0.5076892097881305,2.1731576794619882,facebook/sam2-hiera-large,median,0.4838103118026709,5,graph,26,l2,pca,62,True,False,silhouette,,3.4705555975727944,3,True,False,False,True,False,False,True,0.6276741703214478,0.5960118469997991,0.42401718141301026,0.1270656616640994,0.9214834625748286,0.8580641378975729,COMPLETE,,0.0,0.0
82,0.0,graph,39,z-score,umap,25,True,True,heuristic,transformer.resblocks.11,ViT-B/32,blocks.4,dinov2_vitb14,layer2,resnet50,semantic,0.0010029063680566865,0.7573718013343701,False,50,8,0.9328233800432681,0.9382145760739378,25,2,0.9566326664846118,2.6521823570911236,facebook/sam2-hiera-large,top_k_mean,0.17001441675557116,3,kmeans,39,root-norm,svd,34,False,True,silhouette,,4.171931834058847,3,True,False,False,True,True,False,True,0.5158527476619563,0.5803364444345606,0.5204232052267258,0.21901717223347494,0.04690013288573834,0.15739555292297264,COMPLETE,,0.0,0.0
83,0.0,graph,40,z-score,umap,22,True,True,heuristic,transformer.resblocks.11,ViT-B/32,blocks.4,dinov2_vitb14,layer2,resnet50,semantic,0.0014671680907541072,0.692701853046085,False,50,8,0.9239884146033914,0.9464320764755713,24,2,0.9162814137543234,2.7744886454122764,facebook/sam2-hiera-large,top_k_mean,0.15427532317663367,3,kmeans,37,root-norm,svd,38,False,True,silhouette,,2.012515553584646,3,True,False,False,True,True,False,True,0.5499400231803703,0.6079333616572293,0.4587061942968003,0.9331720614223753,0.20422558381360917,0.36216288640228256,COMPLETE,,0.0,0.0
84,0.0,graph,37,z-score,umap,20,True,True,heuristic,transformer.resblocks.11,ViT-B/32,blocks.4,dinov2_vitb14,layer2,resnet50,semantic,0.0022687365642888703,0.6783618820555637,False,50,8,0.9077323084617888,0.9186157638406737,23,2,1.0438615258892712,2.834491067870873,facebook/sam2-hiera-large,top_k_mean,0.180828591549843,3,kmeans,35,root-norm,svd,42,False,True,silhouette,,4.043630668083911,3,True,False,False,True,True,False,True,0.6865083571133669,0.5169606789809857,0.40031753130570136,0.9924475353173657,0.3039116190661704,0.7409071650389093,COMPLETE,,0.0,0.0
85,0.0,graph,38,z-score,umap,53,True,True,heuristic,transformer.resblocks.11,ViT-B/32,blocks.4,dinov2_vitb14,layer2,resnet50,semantic,0.0032570562714511137,0.7101462609689302,False,50,8,0.8969184420143149,0.9489308958456972,25,2,0.7179449008660487,2.887696453536742,facebook/sam2-hiera-large,top_k_mean,0.12988264872165162,3,kmeans,39,root-norm,svd,55,False,True,silhouette,,3.3100156224706647,3,True,False,False,True,True,False,False,0.5377083998250648,0.5528222871885471,0.44487515572567654,0.5451889519099867,0.41685679027166767,0.46784144239041847,COMPLETE,,0.0,0.0
86,0.0,spectral,40,z-score,pca,24,False,True,silhouette,transformer.resblocks.11,ViT-B/32,blocks.11,dinov2_vitb14,conv1,resnet50,semantic,0.0017364621103908588,0.7394280640930242,True,50,8,0.8013186613277865,0.9351941361143088,27,2,0.9712359312438245,2.51686469029261,facebook/sam2-hiera-large,top_k_mean,0.20131589891333826,3,kmeans,32,z-score,umap,26,False,True,silhouette,,3.939978614525696,3,True,False,False,True,True,True,True,0.5565019940794129,0.6598500652383437,0.5914966213480698,0.9596031562318291,0.1184934111367698,0.19640585062826754,COMPLETE,,0.0,0.0
87,0.0,graph,11,l2,svd,49,True,False,heuristic,transformer.resblocks.9,ViT-B/32,blocks.7,dinov2_vitb14,layer1,resnet50,structural,0.0034932273368999513,0.8069888897493784,False,50,32,0.9167494623613962,0.9527803553651154,24,3,1.0075368080402511,2.444120084256475,facebook/sam2-hiera-large,mean,0.21334155862864912,5,graph,12,root-norm,svd,46,True,True,heuristic,3.0,1.1203469563648758,3,False,True,True,True,False,False,False,0.7983197295064759,0.5332042190177082,0.5546230554115668,0.1946467263366834,0.2469960262492908,0.4191511173561888,COMPLETE,,0.0,0.0
88,0.0,kmeans,25,root-norm,pca,43,False,True,silhouette,transformer.resblocks.11,ViT-B/32,blocks.4,dinov2_vitb14,layer2,resnet50,semantic,0.007379050825094345,0.70036800637141,True,100,8,0.931214018938779,0.9435225868253799,26,4,0.9312399547025121,2.685058254174235,facebook/sam2-hiera-large,median,0.24981790237892007,3,kmeans,10,z-score,umap,29,False,False,silhouette,7.0,4.545509022287603,5,True,True,False,False,True,True,False,0.7368702767443239,0.6289468610445529,0.5411895910885598,0.43425938941225933,0.5775121864657606,0.5311047326072726,COMPLETE,,0.0,0.0
89,0.0,graph,22,z-score,svd,38,True,False,heuristic,transformer.resblocks.9,ViT-B/32,blocks.4,dinov2_vitb14,layer3,resnet50,structural,0.0014235964593907566,0.60930039663841,True,50,32,0.9403777293659737,0.9758354123668699,20,2,0.8832012701279185,1.5816884606744437,facebook/sam2-hiera-large,top_k_mean,0.3623711328456587,3,graph,37,root-norm,pca,36,True,True,heuristic,,3.6960438921687837,3,False,False,False,True,False,True,True,0.7762251175358088,0.6786004348352703,0.5654731864290301,0.08444138741747569,0.056052716129276314,0.2804410970947818,COMPLETE,,0.0,0.0
90,0.0,kmeans,39,l2,umap,21,False,False,silhouette,transformer.resblocks.10,ViT-B/32,blocks.7,dinov2_vitb14,layer4,resnet50,semantic,0.0022762441276725632,0.6151666480564294,False,50,16,0.979937367471396,0.9569722885838206,22,4,0.81546815754936,1.64863736950403,facebook/sam2-hiera-large,median,0.44262383400510374,5,spectral,22,l2,svd,49,False,False,silhouette,5.0,3.8423018988659003,5,True,True,True,True,True,False,False,0.6458192396246278,0.5681392890557386,0.685286716928222,0.8614780564170887,0.08806846954493652,0.9588264421504095,COMPLETE,,0.0,0.0
91,0.0,spectral,28,root-norm,pca,27,True,True,heuristic,transformer.resblocks.9,ViT-B/32,blocks.11,dinov2_vitb14,conv1,resnet50,structural,0.002973009026703839,0.724765880266289,True,50,8,0.9442787191087134,0.9131092544262562,15,4,0.7576831822070069,2.618565635990016,facebook/sam2-hiera-large,mean,0.14614870569160088,3,graph,28,root-norm,umap,57,True,True,heuristic,3.0,2.219888814267477,3,True,True,False,False,False,True,True,0.7560884257194201,0.5867675820334923,0.7207747601801167,0.33685157368854424,0.9871524180046296,0.30890100415580524,COMPLETE,,0.0,0.0
92,0.0,graph,20,z-score,svd,39,False,False,heuristic,transformer.resblocks.11,ViT-B/32,blocks.11,dinov2_vitb14,layer1,resnet50,semantic,0.009136830931771076,0.6908873890312771,True,50,8,0.9079393371338118,0.978048897903781,26,2,1.0199620928250448,2.275686331626225,facebook/sam2-hiera-large,mean,0.2730390241434345,5,graph,24,z-score,pca,23,False,True,heuristic,7.0,1.5492155364033757,3,False,True,False,True,False,False,True,0.714170271366021,0.6365457365082714,0.6009601527895001,0.03094794016736451,0.555377179304845,0.9189684791862779,COMPLETE,,0.0,0.0
93,0.0,graph,23,z-score,svd,41,False,False,heuristic,transformer.resblocks.11,ViT-B/32,blocks.11,dinov2_vitb14,layer1,resnet50,semantic,0.009863565943895173,0.6505014178651959,True,50,8,0.8861353061481441,0.9206292780446772,28,2,1.1382458763250736,2.2428355636204356,facebook/sam2-hiera-large,mean,0.2908576950772995,5,graph,22,z-score,pca,18,False,True,heuristic,7.0,1.4573422885669445,3,False,True,False,True,False,False,True,0.673738226688093,0.6461902128464659,0.5747408756890049,0.2440713127936498,0.6287673096629015,0.9770923813378699,COMPLETE,,0.0,0.0
