number,value,params_dino_pipeline.clustering.clusterer.method,params_dino_pipeline.clustering.clusterer.n_neighbors,params_dino_pipeline.clustering.feature_processing.normalizer.method,params_dino_pipeline.clustering.feature_processing.reducer.method,params_dino_pipeline.clustering.feature_processing.reducer.n_components,params_dino_pipeline.clustering.feature_processing.run_normalization,params_dino_pipeline.clustering.feature_processing.run_reduction,params_dino_pipeline.clustering.k_selection.method,params_extractors.clip.layer_name,params_extractors.clip.model_name,params_extractors.dino_v2.layer_name,params_extractors.dino_v2.model_name,params_extractors.resnet.layer_name,params_extractors.resnet.model_name,params_fusion_pipeline.clustering.k_selection.k_source,params_heuristic_settings.filter_params.filter_min_area_perc,params_heuristic_settings.filter_params.nms_iou_threshold,params_heuristic_settings.filter_params.use_nms,params_heuristic_settings.generator_params.min_mask_region_area,params_heuristic_settings.generator_params.points_per_side,params_heuristic_settings.generator_params.pred_iou_thresh,params_heuristic_settings.generator_params.stability_score_thresh,params_heuristic_settings.k_heuristic_formulas.max_k,params_heuristic_settings.k_heuristic_formulas.semantic_base,params_heuristic_settings.k_heuristic_formulas.semantic_scale_factor,params_heuristic_settings.k_heuristic_formulas.structural_multiplier,params_heuristic_settings.sam_model,params_labeler.aggregation_method,params_labeler.aggregation_top_k_perc,params_labeler.top_n_labels,params_resnet_pipeline.clustering.clusterer.method,params_resnet_pipeline.clustering.clusterer.n_neighbors,params_resnet_pipeline.clustering.feature_processing.normalizer.method,params_resnet_pipeline.clustering.feature_processing.reducer.method,params_resnet_pipeline.clustering.feature_processing.reducer.n_components,params_resnet_pipeline.clustering.feature_processing.run_normalization,params_resnet_pipeline.clustering.feature_processing.run_reduction,params_resnet_pipeline.clustering.k_selection.method,params_resnet_pipeline.image_preprocessing.blur_kernel_size,params_resnet_pipeline.image_preprocessing.clahe_clip_limit,params_resnet_pipeline.image_preprocessing.sobel_kernel_size,params_resnet_pipeline.image_preprocessing.use_clahe,params_resnet_pipeline.image_preprocessing.use_gaussian_blur,params_resnet_pipeline.image_preprocessing.use_grayscale,params_resnet_pipeline.image_preprocessing.use_sobel_edges,params_run_dino_pipeline,params_run_fusion_pipeline,params_run_resnet_pipeline,params_validator_settings.final_threshold,params_validator_settings.semantic_threshold,params_validator_settings.structural_threshold,params_validator_settings.weights.clip_confidence,params_validator_settings.weights.dino_iou,params_validator_settings.weights.resnet_iou,state,user_attrs_error,user_attrs_max_clip_confidence,user_attrs_num_correct_segments
193,0.0,kmeans,31,root-norm,pca,48,False,True,heuristic,transformer.resblocks.10,ViT-B/32,blocks.7,dinov2_vitb14,layer3,resnet50,semantic,0.0027177415964905875,0.6691402780664972,True,100,16,0.9568902043651063,0.9004209439998877,18,4,0.9244953314671226,1.5949077382954475,facebook/sam2-hiera-large,mean,0.1487968912946578,5,spectral,11,l2,pca,28,False,False,heuristic,7.0,2.4020049704108892,3,True,True,True,True,False,True,False,0.6258164594514404,0.43202373362247504,0.6884936635132435,0.3400224884404896,0.18522222262705915,0.49307852383467554,COMPLETE,,0.0,0.0
194,0.0,kmeans,30,root-norm,pca,45,False,True,heuristic,transformer.resblocks.10,ViT-B/32,blocks.7,dinov2_vitb14,layer3,resnet50,semantic,0.003879945881275388,0.7184652582665133,True,100,16,0.8157603017595078,0.9455608452645032,19,4,1.1780493726475036,1.6927395907813902,facebook/sam2-hiera-large,mean,0.18806409698777354,5,spectral,11,l2,pca,23,False,False,heuristic,7.0,2.6704822990046386,3,True,True,True,True,False,True,False,0.6117474938574784,0.4554745217040308,0.6615559593179732,0.36464054876830176,0.7884576013981448,0.42920135278626764,COMPLETE,,0.0,0.0
195,0.0,kmeans,32,root-norm,pca,50,False,True,heuristic,transformer.resblocks.10,ViT-B/32,blocks.7,dinov2_vitb14,layer3,resnet50,semantic,0.007462509583393636,0.7338387316494797,True,100,16,0.9221166229634589,0.977601228524631,17,4,0.9647572424756655,1.750532728028302,facebook/sam2-hiera-large,mean,0.16996595158318736,5,spectral,10,l2,pca,26,False,False,heuristic,7.0,2.5309002987229743,3,True,True,True,True,False,True,False,0.5858622000041072,0.4785937628677654,0.7096151853469083,0.4728358680274611,0.15355485825030124,0.3695288112066618,COMPLETE,,0.0,0.0
196,0.0,kmeans,32,z-score,pca,48,True,True,heuristic,transformer.resblocks.10,ViT-B/32,blocks.7,dinov2_vitb14,layer3,resnet50,semantic,0.0033415047686344663,0.7382620943950523,True,50,8,0.966846412858823,0.9155075828935968,21,2,0.6454942199549273,2.986960957821272,facebook/sam2-hiera-large,top_k_mean,0.16216160379675965,5,graph,27,root-norm,pca,29,False,False,heuristic,3.0,2.774873192025731,3,True,True,True,True,False,True,False,0.7385302357880126,0.423495161895281,0.6702423642595197,0.3257754826515913,0.23004508626230036,0.39779377520549736,COMPLETE,,0.0,0.0
197,0.0,graph,33,z-score,pca,55,False,True,silhouette,transformer.resblocks.9,ViT-B/32,blocks.11,dinov2_vitb14,layer4,resnet50,semantic,0.0036802983089048477,0.7469421566949098,True,50,16,0.8346682659689681,0.9036985330976143,27,4,0.7863667136051442,2.173448321277232,facebook/sam2-hiera-large,median,0.1539915400162599,3,spectral,12,z-score,svd,42,False,False,heuristic,7.0,2.307637489374211,5,True,True,False,True,False,False,True,0.6195712019840287,0.6753664988682925,0.6964672718059106,0.42836941420593,0.27138585336717813,0.24452052799766247,COMPLETE,,0.0,0.0
198,0.0,graph,24,root-norm,svd,33,True,False,heuristic,transformer.resblocks.9,ViT-B/32,blocks.4,dinov2_vitb14,layer1,resnet50,semantic,0.004216407403571823,0.6148950991256529,False,100,32,0.8012842475415661,0.9014888754098191,16,4,0.5652810169115773,1.7203901917739026,facebook/sam2-hiera-large,mean,0.46766754850163983,5,kmeans,22,l2,pca,19,True,True,silhouette,,1.406278372507915,3,False,False,True,True,True,True,False,0.5610186810300957,0.50503762207616,0.5262881314365676,0.66201743772026,0.9993737741875011,0.4090084767726277,COMPLETE,,0.0,0.0
199,0.0,graph,26,l2,umap,29,False,True,silhouette,transformer.resblocks.11,ViT-B/32,blocks.11,dinov2_vitb14,conv1,resnet50,structural,0.005161062219996115,0.7148538742541998,True,50,8,0.8995695750001321,0.9358272900072643,30,2,0.6300093810398577,2.604861474420056,facebook/sam2-hiera-large,top_k_mean,0.4226367678894647,3,graph,33,root-norm,umap,22,False,False,heuristic,5.0,3.2239266369371102,3,True,True,False,False,False,False,False,0.5526094954421703,0.44178354956353827,0.7387564167316392,0.40727308810979357,0.09657422646973107,0.4693409871116114,COMPLETE,,0.0,0.0
200,0.0,kmeans,39,z-score,pca,46,True,True,heuristic,transformer.resblocks.9,ViT-B/32,blocks.4,dinov2_vitb14,layer2,resnet50,semantic,0.002238717685931482,0.6086189471642574,False,200,32,0.9297983947334199,0.9239855934678416,17,4,0.5177155082806706,1.643352534857525,facebook/sam2-hiera-large,median,0.11462306676784567,5,kmeans,30,z-score,pca,17,True,False,heuristic,3.0,3.6493418212521513,5,True,True,True,True,True,True,True,0.6842746729109371,0.6634558015853225,0.4761035976469438,0.4680174099549526,0.8165469842404165,0.31997247492680303,COMPLETE,,0.0,0.0
201,0.0,spectral,34,z-score,pca,41,False,False,silhouette,transformer.resblocks.10,ViT-B/32,blocks.7,dinov2_vitb14,layer1,resnet50,semantic,0.0068431292906754445,0.8018173699544784,True,50,8,0.9104223705582422,0.9059545261237555,24,3,0.9920370496239787,1.5153093465338254,facebook/sam2-hiera-large,top_k_mean,0.28006677955179554,5,graph,38,root-norm,svd,24,False,True,heuristic,3.0,1.7137668464663223,3,False,True,False,True,False,False,False,0.5686524509356525,0.4951228418679836,0.5060117659978199,0.11638130842798138,0.9728812709198549,0.8119278055948039,COMPLETE,,0.0,0.0
202,0.0,graph,37,z-score,umap,49,False,True,heuristic,transformer.resblocks.9,ViT-B/32,blocks.11,dinov2_vitb14,layer4,resnet50,semantic,0.008010820935345596,0.7584703687481936,True,50,32,0.9348313361162497,0.9688347584175604,23,3,1.0841970580649747,2.5179285145338235,facebook/sam2-hiera-large,top_k_mean,0.2261397599786587,5,graph,25,root-norm,pca,60,True,False,heuristic,5.0,4.2505540736174545,3,True,True,False,True,False,False,False,0.6435011822624858,0.6264370755495087,0.6781795583971855,0.07906566029700962,0.40071140305839015,0.7380566785721971,COMPLETE,,0.0,0.0
203,0.0,graph,35,z-score,umap,40,False,True,heuristic,transformer.resblocks.9,ViT-B/32,blocks.11,dinov2_vitb14,layer4,resnet50,semantic,0.007734888428186973,0.7748858652009852,True,50,32,0.8056144074085819,0.9650660900340123,24,3,1.075382194890925,2.3883654998551838,facebook/sam2-hiera-large,top_k_mean,0.24585016908102092,5,graph,25,root-norm,pca,62,True,False,heuristic,5.0,4.509754291456311,3,True,True,False,True,False,False,False,0.6381494822195869,0.4095007199642835,0.4121817445132444,0.21394859569047026,0.43393988766591185,0.8291620333394442,COMPLETE,,0.0,0.0
204,0.0,graph,17,z-score,umap,39,False,True,heuristic,transformer.resblocks.9,ViT-B/32,blocks.11,dinov2_vitb14,layer4,resnet50,semantic,0.00830803901194425,0.6875045965703396,True,50,32,0.9383296198451581,0.9603973392149792,24,3,0.7321986148072894,2.4288952341667254,facebook/sam2-hiera-large,top_k_mean,0.2109680841961607,5,graph,37,root-norm,pca,58,True,False,heuristic,5.0,4.457815436438469,3,True,True,False,True,False,False,False,0.6515291361630295,0.6487116747786681,0.4059073426698041,0.1795528587620966,0.4595052265943854,0.8829725925499995,COMPLETE,,0.0,0.0
205,0.0,graph,36,z-score,umap,24,False,True,heuristic,transformer.resblocks.9,ViT-B/32,blocks.11,dinov2_vitb14,layer4,resnet50,semantic,0.00971505734213899,0.7426855999086317,True,50,32,0.9427730050051015,0.9716335479178042,26,3,0.8943732974433145,2.7337100192754167,facebook/sam2-hiera-large,top_k_mean,0.23580918470773882,5,graph,21,root-norm,pca,53,True,False,heuristic,5.0,3.863597340221501,3,True,True,False,True,False,False,False,0.6351674955656027,0.6551217333199344,0.4058319097056785,0.12781584766850107,0.5983278257245038,0.9077222477899198,COMPLETE,,0.0,0.0
206,0.0,graph,29,z-score,svd,37,False,True,heuristic,transformer.resblocks.9,ViT-B/32,blocks.11,dinov2_vitb14,conv1,resnet50,semantic,0.008860734993249535,0.7495985255203497,True,50,32,0.927064410773318,0.9796583517327844,28,3,1.1224883097455176,1.5705028634158684,facebook/sam2-hiera-large,median,0.3886191422116563,3,spectral,24,z-score,umap,61,True,False,silhouette,3.0,2.9367460633301983,3,True,True,True,True,True,False,False,0.6286002332997792,0.6677064999074669,0.5618208799213082,0.8737834353447735,0.5080539632568885,0.9552620410249809,COMPLETE,,0.0,0.0
207,0.0,graph,40,root-norm,umap,43,True,True,heuristic,transformer.resblocks.9,ViT-B/32,blocks.4,dinov2_vitb14,layer3,resnet50,structural,0.009213989229270051,0.754225230491426,False,100,16,0.9316724023166947,0.9625849556821165,25,4,1.166074209853761,2.206993357054687,facebook/sam2-hiera-large,top_k_mean,0.3596097151272054,5,kmeans,26,l2,pca,56,False,False,heuristic,,4.130031120833672,3,True,False,False,True,False,True,False,0.7014131073646597,0.6873455976912359,0.46472053083946996,0.9197462420405471,0.11545934780924573,0.5172227582232151,COMPLETE,,0.0,0.0
208,0.0,graph,37,z-score,pca,38,False,False,silhouette,transformer.resblocks.9,ViT-B/32,blocks.11,dinov2_vitb14,layer1,resnet50,semantic,0.005553073530499697,0.7228549827210496,True,50,8,0.8421949059820165,0.9679550223080915,24,2,1.0235367443087449,1.6787075321731133,facebook/sam2-hiera-large,mean,0.21822634405485847,5,graph,23,root-norm,umap,57,True,True,heuristic,7.0,4.581522717403356,3,True,True,True,False,True,False,True,0.5285586124416646,0.6396420223702148,0.45201059891777995,0.9500940919870737,0.36961289953327525,0.7681623329684909,COMPLETE,,0.0,0.0
209,0.0,kmeans,23,l2,pca,40,True,True,heuristic,transformer.resblocks.11,ViT-B/32,blocks.4,dinov2_vitb14,layer4,resnet50,semantic,0.0029007371270752132,0.8374445069228407,False,200,32,0.9170511632817702,0.9000002470679596,15,4,1.1485246946480918,2.635871495588239,facebook/sam2-hiera-large,median,0.1828940775075756,3,kmeans,32,z-score,svd,27,True,False,silhouette,5.0,4.635967557671539,5,True,True,False,True,False,True,False,0.5744547360495703,0.7317967177560091,0.4972888991718897,0.503635381325338,0.17073550172715898,0.7922001282954918,COMPLETE,,0.0,0.0
210,0.0,graph,35,z-score,svd,20,False,True,silhouette,transformer.resblocks.10,ViT-B/32,blocks.7,dinov2_vitb14,layer2,resnet50,semantic,0.008094914574614292,0.7016242880746738,True,50,8,0.9472896646777021,0.9373352418415589,20,4,1.189245259028315,2.685032450167383,facebook/sam2-hiera-large,top_k_mean,0.3479408843541316,5,graph,14,root-norm,pca,40,False,False,heuristic,,3.2941986431952426,3,False,False,True,True,True,False,False,0.6222889119013225,0.6816333230535019,0.7317998354713715,0.8447236207553557,0.8547427530157299,0.4402731329754457,COMPLETE,,0.0,0.0
211,0.0,spectral,14,z-score,pca,35,True,False,heuristic,transformer.resblocks.9,ViT-B/32,blocks.11,dinov2_vitb14,conv1,resnet50,structural,0.007216645748238177,0.8151996549433863,False,50,32,0.8499566766534669,0.9118080427446628,25,3,0.5323934883508994,2.953848458207973,facebook/sam2-hiera-large,median,0.19548509724473537,5,spectral,34,z-score,umap,59,True,True,heuristic,3.0,3.4287469257204783,3,True,True,False,False,False,True,True,0.6059313180883353,0.5121021885671728,0.4159596461004775,0.1653203935865165,0.44050824433409635,0.6276370182343197,COMPLETE,,0.0,0.0
212,0.0,kmeans,38,z-score,svd,17,True,False,heuristic,transformer.resblocks.11,ViT-B/32,blocks.4,dinov2_vitb14,layer4,resnet50,structural,0.008668607437364195,0.6452013509928142,True,100,32,0.8392625423594677,0.9142477600209217,20,2,0.6185091942461376,2.267518268210159,facebook/sam2-hiera-large,top_k_mean,0.27610737503676686,3,graph,31,l2,svd,55,True,False,silhouette,,1.2142597318047579,3,True,False,False,True,True,False,False,0.7300518450080513,0.41941545340530223,0.5687621778342159,0.31339723444008144,0.05009208928770039,0.08200307534210013,COMPLETE,,0.0,0.0
213,0.0,kmeans,19,z-score,svd,17,True,False,heuristic,transformer.resblocks.11,ViT-B/32,blocks.4,dinov2_vitb14,layer4,resnet50,structural,0.008917400223942747,0.6269389002714865,True,100,32,0.9395905823414202,0.9166088422794006,19,2,0.6024627833834,2.227824731906991,facebook/sam2-hiera-large,top_k_mean,0.2665005663222473,3,graph,30,l2,svd,54,True,False,silhouette,,1.0580935039566643,3,True,False,False,True,True,False,False,0.7191388050626757,0.7173760661429041,0.7305766815547123,0.2091843009832198,0.06646435715382347,0.6955583264814509,COMPLETE,,0.0,0.0
214,0.0,kmeans,39,z-score,svd,21,True,False,heuristic,transformer.resblocks.11,ViT-B/32,blocks.4,dinov2_vitb14,layer4,resnet50,structural,0.008414871550891847,0.6346223565333836,True,100,32,0.9518833953389129,0.9080741376594786,21,2,0.6578607469118993,2.3461456871606616,facebook/sam2-hiera-large,top_k_mean,0.28931087691246327,3,graph,28,l2,svd,51,True,False,silhouette,,3.128665281035048,3,True,False,False,True,True,False,False,0.6910962968798966,0.4022846628406319,0.7219560765443813,0.27169917340447225,0.01414760847207095,0.058963640222390375,COMPLETE,,0.0,0.0
215,0.0,kmeans,38,z-score,svd,42,True,False,heuristic,transformer.resblocks.11,ViT-B/32,blocks.4,dinov2_vitb14,layer4,resnet50,structural,0.008617892792138013,0.8052039063134733,True,100,32,0.823755680525188,0.9190668148134932,20,2,0.8637803172489606,2.4450993304585715,facebook/sam2-hiera-large,top_k_mean,0.43567433454890764,3,graph,13,l2,svd,34,True,False,silhouette,,1.3569981674672105,3,True,False,False,True,True,False,False,0.7026320626643578,0.4256924412158887,0.43678889588579767,0.2444456797791051,0.025800986504840126,0.21185343019557823,COMPLETE,,0.0,0.0
216,0.0,graph,12,root-norm,umap,51,True,True,silhouette,transformer.resblocks.11,ViT-B/32,blocks.4,dinov2_vitb14,layer1,resnet50,semantic,0.0090976176507164,0.6970156965333376,True,100,16,0.8485808588739323,0.9757402980491235,30,2,0.8427623796192506,2.495603959250409,facebook/sam2-hiera-large,top_k_mean,0.30303893912192165,3,kmeans,31,l2,svd,56,False,False,silhouette,,1.1425246196920558,5,True,False,False,True,True,False,False,0.5213494570123607,0.41185142192806656,0.7072079327176397,0.2849655837082237,0.5376755649160395,0.0433231067863285,COMPLETE,,0.0,0.0
217,0.0,kmeans,33,z-score,svd,27,False,False,heuristic,transformer.resblocks.9,ViT-B/32,blocks.4,dinov2_vitb14,conv1,resnet50,structural,0.008762193063361404,0.6183084386764318,False,50,32,0.8771657348510505,0.9211940800542853,18,4,1.0677090863290923,2.143330878369604,facebook/sam2-hiera-large,mean,0.10221052552707499,5,graph,29,root-norm,pca,38,True,False,heuristic,3.0,1.2823427019643705,3,False,True,True,True,False,True,False,0.7088943544577,0.5440852690267766,0.5872428539492468,0.0538539809982936,0.42074401452636934,0.7174684996817007,COMPLETE,,0.0,0.0
218,0.0,graph,37,l2,pca,44,True,True,silhouette,transformer.resblocks.9,ViT-B/32,blocks.11,dinov2_vitb14,layer3,resnet50,semantic,0.007067296662539907,0.6621842793361842,True,200,8,0.8288517806200953,0.9129776216221382,26,2,1.1020823699124758,2.2898552029022237,facebook/sam2-hiera-large,median,0.2532812715899012,3,graph,18,z-score,umap,55,False,False,heuristic,3.0,3.7084275659600374,3,True,True,False,True,True,False,False,0.769995777838053,0.6068720367265031,0.5405394639071992,0.2528375599948984,0.129175324770965,0.016999043130063847,COMPLETE,,0.0,0.0
219,0.0,spectral,13,z-score,pca,23,False,True,heuristic,transformer.resblocks.10,ViT-B/32,blocks.7,dinov2_vitb14,layer2,resnet50,semantic,0.0019328792772226096,0.768066017301707,False,50,32,0.9621973386927821,0.947697849394222,21,3,0.9819234008711978,2.92032463019622,facebook/sam2-hiera-large,top_k_mean,0.33901393243291855,5,kmeans,21,root-norm,pca,45,True,True,silhouette,7.0,4.838369956674335,3,True,True,True,False,False,False,True,0.6817953316154718,0.6201727757736337,0.6907741465761498,0.6292171713688428,0.3922734949789734,0.2693865316768093,COMPLETE,,0.0,0.0
220,0.0,graph,34,z-score,svd,19,True,False,silhouette,transformer.resblocks.9,ViT-B/32,blocks.4,dinov2_vitb14,layer1,resnet50,structural,0.002673249384430589,0.8494696929939163,True,100,8,0.8699471000342621,0.9544592737295731,29,4,0.6399781479796921,1.6116197947806392,facebook/sam2-hiera-large,median,0.40180202532400877,5,graph,26,l2,svd,53,False,False,heuristic,,3.0424359511908445,5,True,False,False,True,True,True,False,0.6724024126004319,0.4351851638741852,0.6372516469807387,0.38746454520800766,0.33630355331966266,0.971744296106728,COMPLETE,,0.0,0.0
221,0.0,graph,40,l2,pca,64,False,True,heuristic,transformer.resblocks.11,ViT-B/32,blocks.11,dinov2_vitb14,layer4,resnet50,semantic,0.00481796333922364,0.7318791336235575,False,50,16,0.9576346496429806,0.9586716745883456,19,4,0.6783314174320617,2.787483836040761,facebook/sam2-hiera-large,top_k_mean,0.49985042010851466,3,kmeans,23,z-score,umap,30,True,False,heuristic,5.0,1.0089396576144154,3,False,True,True,True,False,False,False,0.5004663794596106,0.7075517024527628,0.40095488936655216,0.743697064002606,0.953826949101071,0.5716152019910422,COMPLETE,,0.0,0.0
222,0.0,kmeans,39,z-score,svd,28,True,False,heuristic,transformer.resblocks.11,ViT-B/32,blocks.4,dinov2_vitb14,layer4,resnet50,structural,0.009818721189740462,0.6028252190459117,True,100,32,0.8588869404254197,0.9099909593121756,23,3,0.6976682043063301,2.0750918845848245,facebook/sam2-hiera-large,top_k_mean,0.26783868556893903,3,graph,32,l2,svd,55,True,False,silhouette,,1.4920982219359507,3,True,False,False,True,True,False,False,0.695883841334404,0.7472774234479742,0.7358626975970717,0.02322373418870654,0.20270969425664342,0.028671589199026775,COMPLETE,,0.0,0.0
223,0.0,kmeans,40,z-score,svd,30,True,False,heuristic,transformer.resblocks.11,ViT-B/32,blocks.4,dinov2_vitb14,layer4,resnet50,structural,0.009991723607894068,0.7601704120850363,True,100,32,0.8681053151610032,0.9117655474996339,22,3,0.6642185623599398,2.0664485885431048,facebook/sam2-hiera-large,top_k_mean,0.41510519848868627,3,graph,34,l2,svd,57,True,False,silhouette,,1.8547691697069593,3,True,False,False,True,True,False,False,0.6867648678231636,0.48526297581461086,0.7433741295324242,0.005265175217801715,0.24949524610233126,0.01041368487057982,COMPLETE,,0.0,0.0
224,0.0,kmeans,39,z-score,svd,26,True,False,heuristic,transformer.resblocks.11,ViT-B/32,blocks.4,dinov2_vitb14,layer4,resnet50,structural,0.009471789002395065,0.618744906824517,True,100,32,0.8437236881314627,0.9149656023108678,22,3,0.7210222253828791,2.098051115700762,facebook/sam2-hiera-large,top_k_mean,0.29936276391445404,3,graph,32,l2,svd,54,True,False,silhouette,,1.593176852830353,3,True,False,False,True,True,False,False,0.7024113297222192,0.4680860549686522,0.6256519893957256,0.02983932581962145,0.24238469720249142,0.028522863922528605,COMPLETE,,0.0,0.0
225,0.0,kmeans,38,z-score,svd,56,True,False,heuristic,transformer.resblocks.11,ViT-B/32,blocks.4,dinov2_vitb14,layer4,resnet50,structural,0.009663443654515365,0.6104412448437012,True,100,32,0.8736017695630454,0.9439073627756962,21,3,0.6828798828687482,2.0389893237486136,facebook/sam2-hiera-large,top_k_mean,0.28894726601740933,3,graph,16,l2,svd,37,True,False,silhouette,,1.7354969041130461,3,True,False,False,True,True,False,False,0.7803087329758207,0.579458230029126,0.7251872940080726,0.09323001234810255,0.485346004152072,0.9351733881968238,COMPLETE,,0.0,0.0
