number,value,params_dino_pipeline.clustering.clusterer.method,params_dino_pipeline.clustering.clusterer.n_neighbors,params_dino_pipeline.clustering.feature_processing.normalizer.method,params_dino_pipeline.clustering.feature_processing.reducer.method,params_dino_pipeline.clustering.feature_processing.reducer.n_components,params_dino_pipeline.clustering.feature_processing.run_normalization,params_dino_pipeline.clustering.feature_processing.run_reduction,params_dino_pipeline.clustering.k_selection.method,params_extractors.clip.layer_name,params_extractors.clip.model_name,params_extractors.dino_v2.layer_name,params_extractors.dino_v2.model_name,params_extractors.resnet.layer_name,params_extractors.resnet.model_name,params_fusion_pipeline.clustering.k_selection.k_source,params_heuristic_settings.filter_params.filter_min_area_perc,params_heuristic_settings.filter_params.nms_iou_threshold,params_heuristic_settings.filter_params.use_nms,params_heuristic_settings.generator_params.min_mask_region_area,params_heuristic_settings.generator_params.points_per_side,params_heuristic_settings.generator_params.pred_iou_thresh,params_heuristic_settings.generator_params.stability_score_thresh,params_heuristic_settings.k_heuristic_formulas.max_k,params_heuristic_settings.k_heuristic_formulas.semantic_base,params_heuristic_settings.k_heuristic_formulas.semantic_scale_factor,params_heuristic_settings.k_heuristic_formulas.structural_multiplier,params_heuristic_settings.sam_model,params_labeler.aggregation_method,params_labeler.aggregation_top_k_perc,params_labeler.top_n_labels,params_resnet_pipeline.clustering.clusterer.method,params_resnet_pipeline.clustering.clusterer.n_neighbors,params_resnet_pipeline.clustering.feature_processing.normalizer.method,params_resnet_pipeline.clustering.feature_processing.reducer.method,params_resnet_pipeline.clustering.feature_processing.reducer.n_components,params_resnet_pipeline.clustering.feature_processing.run_normalization,params_resnet_pipeline.clustering.feature_processing.run_reduction,params_resnet_pipeline.clustering.k_selection.method,params_resnet_pipeline.image_preprocessing.blur_kernel_size,params_resnet_pipeline.image_preprocessing.clahe_clip_limit,params_resnet_pipeline.image_preprocessing.sobel_kernel_size,params_resnet_pipeline.image_preprocessing.use_clahe,params_resnet_pipeline.image_preprocessing.use_gaussian_blur,params_resnet_pipeline.image_preprocessing.use_grayscale,params_resnet_pipeline.image_preprocessing.use_sobel_edges,params_run_dino_pipeline,params_run_fusion_pipeline,params_run_resnet_pipeline,params_validator_settings.final_threshold,params_validator_settings.semantic_threshold,params_validator_settings.structural_threshold,params_validator_settings.weights.clip_confidence,params_validator_settings.weights.dino_iou,params_validator_settings.weights.resnet_iou,state,user_attrs_error,user_attrs_max_clip_confidence,user_attrs_num_correct_segments
28,,spectral,31,l2,umap,60,False,False,silhouette,transformer.resblocks.10,ViT-B/32,blocks.7,dinov2_vitb14,conv1,resnet50,structural,0.009300298418988438,0.8283448201484969,False,200,16,0.8484244381757214,0.9076596309646091,21,4,0.895139504994362,2.576224954341648,facebook/sam2-hiera-large,mean,0.3024223803699875,3,spectral,14,z-score,umap,39,False,False,silhouette,,1.144099515803861,3,True,False,True,True,False,True,False,0.6635614784374142,0.6603502830712733,0.4444556667470319,0.7245962565747216,0.6038147475058515,0.09901315120662035,FAIL,,,
29,0.0,spectral,35,l2,umap,61,False,False,silhouette,transformer.resblocks.10,ViT-B/32,blocks.7,dinov2_vitb14,layer1,resnet50,structural,0.009366849431902217,0.8333651503964468,False,200,16,0.8538777330373875,0.9042624049597142,21,4,0.8933854511162075,2.8203639187388885,facebook/sam2-hiera-large,mean,0.301306247976861,3,spectral,19,z-score,svd,38,False,False,silhouette,,1.024192986620513,3,True,False,True,True,False,True,False,0.6620511883066512,0.7495795541033929,0.5685900943512542,0.7396682624391145,0.6124740201546597,0.10729500782075538,COMPLETE,,0.0,0.0
30,0.0,kmeans,21,root-norm,svd,42,True,True,silhouette,transformer.resblocks.11,ViT-B/32,blocks.11,dinov2_vitb14,layer2,resnet50,structural,0.0058492958858839495,0.7111410974204178,True,100,8,0.8037242992008969,0.9715825748070633,23,4,0.7497728140532092,2.5950398645197943,facebook/sam2-hiera-large,median,0.46070570611031947,3,kmeans,15,root-norm,umap,21,True,True,heuristic,3.0,4.9871904146338055,5,False,True,False,True,False,True,True,0.7104918611228036,0.6584685136408706,0.45382145978566274,0.14847251126962324,0.932573962412473,0.47833762850274686,COMPLETE,,0.0,0.0
31,0.0,kmeans,40,root-norm,pca,28,True,True,heuristic,transformer.resblocks.9,ViT-B/32,blocks.4,dinov2_vitb14,conv1,resnet50,semantic,0.008548836719027952,0.6600746685516361,True,50,32,0.8251823176413686,0.9419109658777967,29,2,0.6288946248795686,1.9800270536794682,facebook/sam2-hiera-large,top_k_mean,0.40237377000450203,5,kmeans,36,l2,umap,52,True,False,heuristic,5.0,2.667710881354134,3,True,True,False,True,True,False,False,0.684671491581769,0.7170172043387797,0.6206293163822674,0.2642947983973114,0.09807167788326243,0.07201591604570297,COMPLETE,,0.0,0.0
32,0.0,kmeans,18,root-norm,pca,48,True,True,silhouette,transformer.resblocks.9,ViT-B/32,blocks.4,dinov2_vitb14,layer2,resnet50,structural,0.0046749171649529955,0.687522606251529,True,100,32,0.8163087139115406,0.9789960176597176,15,4,0.7227619605734059,2.2915565280739907,facebook/sam2-hiera-large,top_k_mean,0.2261854854123776,3,kmeans,38,l2,umap,31,True,True,heuristic,7.0,4.435977583508828,5,False,True,False,True,False,True,True,0.5256911027854343,0.5482497884054706,0.45200758925753526,0.048021101005210926,0.8634239457256453,0.5409472982840089,COMPLETE,,0.0,0.0
33,0.0,kmeans,24,root-norm,pca,45,True,True,silhouette,transformer.resblocks.9,ViT-B/32,blocks.4,dinov2_vitb14,layer2,resnet50,structural,0.005505257525895426,0.6955073326740967,True,100,32,0.8190607277600792,0.9591471187314863,17,4,0.7690285407529087,2.084691698517075,facebook/sam2-hiera-large,top_k_mean,0.1662888117822987,3,kmeans,32,l2,umap,19,True,True,heuristic,7.0,3.5479604132983265,5,False,True,False,True,False,True,True,0.5719592281628592,0.6045695494230255,0.4312291849521999,0.08323799615139685,0.9565408822124977,0.2193661250449848,COMPLETE,,0.0,0.0
34,0.0,kmeans,27,root-norm,pca,38,False,False,silhouette,transformer.resblocks.9,ViT-B/32,blocks.7,dinov2_vitb14,layer2,resnet50,structural,0.006062319417689642,0.6213799519639001,True,100,8,0.8396769313553186,0.9665927538885526,16,4,0.7076450546129094,1.676610807614752,facebook/sam2-hiera-large,top_k_mean,0.1878795160742632,3,kmeans,40,l2,umap,48,True,True,heuristic,7.0,4.421075514337885,5,False,True,False,True,False,True,True,0.7973548013433276,0.5661444617952209,0.4807933704986341,0.43944695012707163,0.8545745204379276,0.3448066531522,COMPLETE,,0.0,0.0
35,0.0,kmeans,19,l2,svd,52,True,True,silhouette,transformer.resblocks.10,ViT-B/32,blocks.4,dinov2_vitb14,layer1,resnet50,structural,0.00760295468857345,0.676393778213182,True,100,32,0.893766501687332,0.9745430572721807,21,4,0.9925044675705808,1.7753286358209548,facebook/sam2-hiera-large,mean,0.2412113389635339,3,graph,31,l2,umap,16,True,True,silhouette,7.0,3.256767663388504,5,False,True,False,False,False,True,True,0.5756233882057258,0.6165616399034776,0.48026367269612474,0.5026705448619133,0.8089944060134147,0.7649247355622322,COMPLETE,,0.0,0.0
36,0.0,graph,15,root-norm,pca,17,True,False,silhouette,transformer.resblocks.9,ViT-B/32,blocks.4,dinov2_vitb14,layer2,resnet50,structural,0.008204460568928712,0.7048033209315672,True,50,8,0.8451025402602538,0.961287203368152,15,4,0.5980259375368249,1.9843925320688074,facebook/sam2-hiera-large,median,0.19623611387062492,3,graph,36,root-norm,svd,23,True,True,heuristic,7.0,4.205471915924214,5,False,True,False,True,False,True,True,0.5429607039319408,0.6390248016991725,0.42991287854816423,0.21208377333736658,0.8971471453529747,0.6522205221118069,COMPLETE,,0.0,0.0
37,0.0,spectral,10,l2,svd,31,False,True,heuristic,transformer.resblocks.9,ViT-B/32,blocks.4,dinov2_vitb14,conv1,resnet50,structural,0.005104632220313111,0.7488577552569454,False,50,32,0.9229970764777661,0.9075242446920675,26,4,0.8026850447537925,2.143106451468015,facebook/sam2-hiera-large,top_k_mean,0.2648912931456903,3,kmeans,12,z-score,umap,27,False,True,silhouette,3.0,3.7213075815429044,5,False,True,True,True,False,True,True,0.741270781622484,0.520130210184107,0.5897842727876186,0.11208151842635843,0.18307174659244513,0.426123343517627,COMPLETE,,0.0,0.0
38,0.0,graph,31,z-score,pca,25,True,False,silhouette,transformer.resblocks.11,ViT-B/32,blocks.11,dinov2_vitb14,layer2,resnet50,semantic,0.009347400993099973,0.6421320957194611,True,100,8,0.863981616529689,0.9557459949230181,25,2,0.6758841003345242,1.5949654756208143,facebook/sam2-hiera-large,mean,0.138210154423557,3,graph,35,root-norm,svd,32,False,True,heuristic,,4.116284313945239,5,True,False,False,True,False,True,False,0.7650844243029136,0.4810562770439097,0.5063980879105696,0.5660444748884612,0.980836386817934,0.841403798693191,COMPLETE,,0.0,0.0
39,0.0,kmeans,24,root-norm,svd,43,False,True,heuristic,transformer.resblocks.9,ViT-B/32,blocks.7,dinov2_vitb14,layer1,resnet50,semantic,0.0018642556835989327,0.6006521133176259,False,50,16,0.9792646562476023,0.9175238845392041,17,3,1.1319909951037812,2.3581261186786273,facebook/sam2-hiera-large,median,0.18113832057484391,5,kmeans,38,l2,umap,40,True,True,silhouette,7.0,1.5691516626273543,3,False,True,True,False,True,False,True,0.5506118885507096,0.5868166509164232,0.4538017714569734,0.058006394583298086,0.715589340206888,0.5101714406273715,COMPLETE,,0.0,0.0
40,0.0,graph,37,z-score,umap,58,True,False,silhouette,transformer.resblocks.10,ViT-B/32,blocks.4,dinov2_vitb14,conv1,resnet50,semantic,0.0038476105560915114,0.7782370623934926,True,50,32,0.8130055549430035,0.9348616090156773,27,4,0.6593733067275839,1.7216317892667923,facebook/sam2-hiera-large,top_k_mean,0.2905367757902208,5,spectral,27,z-score,pca,48,False,False,heuristic,,3.9200573513889503,3,True,False,False,True,False,True,False,0.6831342621905668,0.548251754678098,0.7190257655403559,0.22805396551109186,0.6114598957204722,0.3140777283366947,COMPLETE,,0.0,0.0
41,0.0,graph,22,z-score,pca,54,False,True,heuristic,transformer.resblocks.9,ViT-B/32,blocks.11,dinov2_vitb14,layer3,resnet50,structural,0.006765292727733643,0.6739410682676529,False,200,8,0.9384516614732655,0.9636409521354873,19,3,0.8828409871757186,2.2044494233932497,facebook/sam2-hiera-large,median,0.443824807729935,3,kmeans,23,root-norm,svd,58,True,True,heuristic,3.0,4.6864947782564395,3,True,True,True,True,True,False,True,0.6263717548442913,0.43603038974717107,0.5327358522810137,0.6933653176475292,0.24530910718242596,0.1982552833207437,COMPLETE,,0.0,0.0
42,0.0,spectral,13,l2,svd,21,False,False,heuristic,transformer.resblocks.10,ViT-B/32,blocks.7,dinov2_vitb14,layer1,resnet50,structural,0.005055303270377462,0.7429034626183707,True,50,8,0.9638779307761264,0.9742826152133236,22,4,0.9532131711519818,1.8780461846039864,facebook/sam2-hiera-large,median,0.49197244035642307,5,graph,13,z-score,svd,52,True,True,silhouette,5.0,3.0387736169814614,3,False,True,False,True,False,True,False,0.7858400348224714,0.5464788899351001,0.4207336105732838,0.4566084393489631,0.5100407558824825,0.888580013883986,COMPLETE,,0.0,0.0
43,0.0,spectral,15,l2,svd,21,False,False,heuristic,transformer.resblocks.10,ViT-B/32,blocks.7,dinov2_vitb14,layer1,resnet50,structural,0.004311283958920116,0.7234352394497549,True,50,8,0.9782251885392867,0.9445959109816863,25,4,1.163299110460939,1.8209639281935148,facebook/sam2-hiera-large,median,0.4756355738550758,5,graph,17,z-score,svd,56,True,True,silhouette,5.0,3.3136490815723465,3,False,True,False,True,False,True,False,0.590387238087807,0.5074958859399201,0.46111964224106106,0.3174220390801975,0.918099048195967,0.9473245523534556,COMPLETE,,0.0,0.0
44,0.0,spectral,13,l2,svd,24,False,False,heuristic,transformer.resblocks.10,ViT-B/32,blocks.7,dinov2_vitb14,layer1,resnet50,semantic,0.003307681930105733,0.6950911650554449,True,50,8,0.9483184077703952,0.9508165615068612,22,4,1.0410022781413673,1.9403782369143028,facebook/sam2-hiera-large,median,0.4309607936596608,5,graph,11,z-score,svd,45,True,True,silhouette,5.0,2.382025141804728,3,False,True,False,True,False,True,False,0.6453292221867978,0.6424499354745745,0.5018044195838092,0.8251175209966335,0.8160289129796594,0.9990122258840618,COMPLETE,,0.0,0.0
45,0.0,spectral,11,l2,svd,32,False,False,heuristic,transformer.resblocks.10,ViT-B/32,blocks.7,dinov2_vitb14,layer1,resnet50,structural,0.005592016890586878,0.6186444924345544,True,50,8,0.9693298933272443,0.9546093539758396,20,4,0.9562682831083391,1.574480888906368,facebook/sam2-hiera-large,median,0.3975125743755916,5,graph,14,z-score,pca,60,False,True,silhouette,5.0,3.1570408726882495,3,False,True,False,True,False,True,False,0.5000760477390045,0.5717316288751817,0.43667360858799503,0.47590644606115695,0.36914780574976014,0.7164424954532826,COMPLETE,,0.0,0.0
46,0.0,graph,28,z-score,pca,50,False,True,silhouette,transformer.resblocks.9,ViT-B/32,blocks.11,dinov2_vitb14,layer3,resnet50,semantic,0.00964861941432021,0.7226591906916089,False,50,32,0.9263202684504201,0.9760473733710324,30,4,0.8612261980922512,2.482651672202347,facebook/sam2-hiera-large,top_k_mean,0.37387065959777294,5,graph,12,z-score,umap,50,True,False,heuristic,5.0,3.5361005118623456,3,True,True,True,False,False,True,False,0.7483679449099585,0.4796649033091057,0.41293362660001476,0.13557802050008186,0.3062594977401304,0.6018179537071084,COMPLETE,,0.0,0.0
47,0.0,spectral,20,l2,pca,19,True,True,heuristic,transformer.resblocks.9,ViT-B/32,blocks.4,dinov2_vitb14,layer2,resnet50,semantic,0.00719933562068707,0.6620088409460185,True,50,16,0.9091654470478674,0.9623494456668854,23,4,1.0253276814228238,2.7237360388660967,facebook/sam2-hiera-large,median,0.3456033020006248,5,spectral,18,root-norm,pca,55,True,False,heuristic,3.0,3.769748867303871,3,False,True,False,True,True,False,False,0.7244840588176761,0.6012520277273002,0.664405439549409,0.4024133009490693,0.5766193250565187,0.929239654916638,COMPLETE,,0.0,0.0
48,0.0,graph,34,z-score,umap,25,False,False,silhouette,transformer.resblocks.11,ViT-B/32,blocks.11,dinov2_vitb14,conv1,resnet50,structural,0.009091861234092814,0.6879414616955026,False,200,8,0.8760222767037263,0.9678084639810801,24,3,1.189293241539306,1.6826684317583434,facebook/sam2-hiera-large,mean,0.1201246571279955,5,kmeans,16,z-score,svd,42,False,False,silhouette,5.0,2.8941787293501826,3,True,True,False,True,False,True,False,0.6722302750995413,0.6800767999502741,0.6014903243425074,0.9033462683357609,0.747421141765209,0.3925846866470285,COMPLETE,,0.0,0.0
49,0.0,graph,30,root-norm,svd,46,True,True,heuristic,transformer.resblocks.9,ViT-B/32,blocks.7,dinov2_vitb14,layer1,resnet50,semantic,0.004704799801273628,0.7945369713070256,True,100,32,0.963168764473707,0.9483174352588132,29,4,0.7439885759830929,1.9072294948885553,facebook/sam2-hiera-large,top_k_mean,0.3132914351934821,5,graph,21,z-score,umap,61,True,True,heuristic,7.0,2.118945603682152,5,True,True,True,True,True,False,False,0.6918377979647027,0.7203394906718756,0.46981702972905554,0.700457342180605,0.38125403731655205,0.4775421422147104,COMPLETE,,0.0,0.0
50,0.0,kmeans,39,z-score,pca,40,False,True,heuristic,transformer.resblocks.10,ViT-B/32,blocks.4,dinov2_vitb14,layer4,resnet50,structural,0.00687640456834616,0.7687650477592833,True,50,8,0.9484270038164632,0.9702423447552838,21,4,0.5735921317353857,2.0251879158099473,facebook/sam2-hiera-large,median,0.4260214592587037,5,kmeans,10,root-norm,pca,64,False,False,heuristic,,2.5118701101609906,3,True,False,False,False,False,False,False,0.7801497499837968,0.6218720551460319,0.5504772518351047,0.5704418712396636,0.002911100456936544,0.7651353098637615,COMPLETE,,0.0,0.0
51,0.0,spectral,36,z-score,pca,50,True,False,silhouette,transformer.resblocks.9,ViT-B/32,blocks.11,dinov2_vitb14,layer1,resnet50,semantic,0.006436272773958641,0.7407307973709826,False,100,32,0.958210994195673,0.9410053195629243,28,2,1.1233193464756757,1.808983611718439,facebook/sam2-hiera-large,top_k_mean,0.21954501006572505,3,graph,28,l2,svd,28,True,False,silhouette,3.0,1.1867940318161094,3,False,True,True,True,True,True,False,0.6568061822075572,0.5001930475339067,0.513419750308021,0.26771837853655084,0.6525915925662,0.7162919844118278,COMPLETE,,0.0,0.0
52,0.0,kmeans,25,root-norm,svd,35,False,False,silhouette,transformer.resblocks.9,ViT-B/32,blocks.7,dinov2_vitb14,conv1,resnet50,structural,0.008447887690171352,0.6105948907009195,True,50,8,0.8981664032114002,0.9647120516573869,16,3,0.9348047170320541,2.55140913354588,facebook/sam2-hiera-large,mean,0.1671338071920576,3,graph,33,root-norm,umap,46,False,True,silhouette,,4.089753408329676,5,True,False,True,False,False,True,False,0.6345160257369948,0.6514922958229561,0.6236634325220957,0.35572964953725383,0.882610921527358,0.8803886158971703,COMPLETE,,0.0,0.0
53,0.0,kmeans,23,root-norm,svd,41,False,False,silhouette,transformer.resblocks.9,ViT-B/32,blocks.7,dinov2_vitb14,conv1,resnet50,structural,0.007461628215650844,0.6450526541648222,True,50,8,0.9163342667995347,0.9124879253540841,16,2,0.9867257569372032,2.9200986017902073,facebook/sam2-hiera-large,mean,0.2766726610298438,3,graph,38,root-norm,umap,53,False,True,silhouette,,4.259546323491571,5,True,False,True,False,False,True,False,0.675621526276336,0.6788358217355739,0.5783071079882355,0.42279217124282537,0.9566476493959004,0.9103550816127166,COMPLETE,,0.0,0.0
54,0.0,kmeans,26,root-norm,svd,23,False,False,silhouette,transformer.resblocks.9,ViT-B/32,blocks.7,dinov2_vitb14,conv1,resnet50,structural,0.009981430701331548,0.6234305324169266,True,50,8,0.9412940357209839,0.9592948492135543,18,3,0.812951221379968,2.728432455429306,facebook/sam2-hiera-large,mean,0.21259047244604373,3,graph,31,root-norm,umap,49,False,True,silhouette,,3.423007371539393,5,True,False,True,False,False,True,False,0.6100399159770539,0.580326193188106,0.4935974027532246,0.5113915498504709,0.9941796942338063,0.8102366356601542,COMPLETE,,0.0,0.0
55,0.0,kmeans,32,root-norm,svd,27,False,False,silhouette,transformer.resblocks.11,ViT-B/32,blocks.7,dinov2_vitb14,layer4,resnet50,structural,0.008094540410044456,0.6405013488142911,True,50,8,0.8854184104291521,0.9714830615506947,15,4,1.0797420455157944,2.703516953465901,facebook/sam2-hiera-large,mean,0.24029411376250298,3,graph,35,root-norm,umap,47,False,True,silhouette,,3.9793834640333348,5,True,False,True,False,False,False,False,0.5963177511272699,0.599800904792577,0.6943406538098931,0.6188731868818019,0.453199358298713,0.9539086569861119,COMPLETE,,0.0,0.0
56,0.0,graph,16,z-score,svd,32,True,True,heuristic,transformer.resblocks.9,ViT-B/32,blocks.4,dinov2_vitb14,conv1,resnet50,semantic,0.00910509745309122,0.7317973322450566,True,50,32,0.9290035762067721,0.9557982257081394,18,2,0.6452303735434727,2.926379664409279,facebook/sam2-hiera-large,top_k_mean,0.134603077062154,5,spectral,29,l2,pca,38,False,False,heuristic,,3.751599226233735,3,True,False,False,True,True,True,False,0.6195945132858558,0.5336544758567454,0.6361507168280851,0.03855539152442271,0.8322319117881347,0.8558133312034937,COMPLETE,,0.0,0.0
57,0.0,kmeans,37,z-score,umap,37,False,False,silhouette,transformer.resblocks.11,ViT-B/32,blocks.4,dinov2_vitb14,layer3,resnet50,structural,0.005904964774887167,0.703472958085037,True,200,16,0.9330690540170117,0.9007749002940075,27,3,0.8383091959124294,2.7916230940922078,facebook/sam2-hiera-large,median,0.4752199495907024,3,graph,25,root-norm,umap,57,True,False,silhouette,,4.596461649441327,5,True,False,True,True,False,False,False,0.7072731161580549,0.6242125046528487,0.7312468075586852,0.001634392399659991,0.7477518714236304,0.8090856884233344,COMPLETE,,0.0,0.0
58,0.0,graph,35,l2,pca,48,True,True,heuristic,transformer.resblocks.9,ViT-B/32,blocks.11,dinov2_vitb14,layer4,resnet50,structural,0.00824856113312116,0.6105902619414203,False,100,32,0.9138807739746851,0.9191494248727324,24,4,1.059958813781785,2.131836263495985,facebook/sam2-hiera-large,top_k_mean,0.2558643595122112,5,kmeans,33,z-score,svd,44,True,False,heuristic,3.0,1.6899932728403757,3,True,True,False,False,True,True,True,0.7533074695028821,0.5182849758542193,0.5654816940623351,0.3542709750432349,0.14257662565368842,0.611089440243102,COMPLETE,,0.0,0.0
59,0.0,kmeans,39,z-score,svd,20,False,True,silhouette,transformer.resblocks.9,ViT-B/32,blocks.7,dinov2_vitb14,conv1,resnet50,semantic,0.00969678757732634,0.7161683532105483,True,50,8,0.9751510020249918,0.9317422328046868,16,4,1.108930517663586,2.425133416740124,facebook/sam2-hiera-large,mean,0.17829682879038883,3,graph,15,l2,pca,54,False,True,silhouette,,1.4099603044853246,3,True,False,False,True,False,False,False,0.6481887671985366,0.5592794637167575,0.5423155694679508,0.19149443768293667,0.7843867785844513,0.5213500821873592,COMPLETE,,0.0,0.0
60,0.0,spectral,39,root-norm,pca,44,True,False,heuristic,transformer.resblocks.10,ViT-B/32,blocks.4,dinov2_vitb14,layer2,resnet50,structural,0.008836552762123048,0.6292230134501695,True,100,32,0.8256892142344251,0.9078050281892904,20,3,0.7201117342908517,2.2915266398055145,facebook/sam2-hiera-large,top_k_mean,0.10758938904441442,5,kmeans,19,root-norm,umap,51,True,False,heuristic,5.0,4.87245926602478,3,True,True,True,True,True,True,False,0.7236743136871248,0.7032848458365908,0.402099627603933,0.6594291178071809,0.22211236399080647,0.27351461343821093,COMPLETE,,0.0,0.0
