number,value,params_dino_pipeline.clustering.clusterer.method,params_dino_pipeline.clustering.clusterer.n_neighbors,params_dino_pipeline.clustering.feature_processing.normalizer.method,params_dino_pipeline.clustering.feature_processing.reducer.method,params_dino_pipeline.clustering.feature_processing.reducer.n_components,params_dino_pipeline.clustering.feature_processing.run_normalization,params_dino_pipeline.clustering.feature_processing.run_reduction,params_dino_pipeline.clustering.k_selection.method,params_extractors.clip.layer_name,params_extractors.clip.model_name,params_extractors.dino_v2.layer_name,params_extractors.dino_v2.model_name,params_extractors.resnet.layer_name,params_extractors.resnet.model_name,params_fusion_pipeline.clustering.k_selection.k_source,params_heuristic_settings.filter_params.filter_min_area_perc,params_heuristic_settings.filter_params.nms_iou_threshold,params_heuristic_settings.filter_params.use_nms,params_heuristic_settings.generator_params.min_mask_region_area,params_heuristic_settings.generator_params.points_per_side,params_heuristic_settings.generator_params.pred_iou_thresh,params_heuristic_settings.generator_params.stability_score_thresh,params_heuristic_settings.k_heuristic_formulas.max_k,params_heuristic_settings.k_heuristic_formulas.semantic_base,params_heuristic_settings.k_heuristic_formulas.semantic_scale_factor,params_heuristic_settings.k_heuristic_formulas.structural_multiplier,params_heuristic_settings.sam_model,params_labeler.aggregation_method,params_labeler.aggregation_top_k_perc,params_labeler.top_n_labels,params_resnet_pipeline.clustering.clusterer.method,params_resnet_pipeline.clustering.clusterer.n_neighbors,params_resnet_pipeline.clustering.feature_processing.normalizer.method,params_resnet_pipeline.clustering.feature_processing.reducer.method,params_resnet_pipeline.clustering.feature_processing.reducer.n_components,params_resnet_pipeline.clustering.feature_processing.run_normalization,params_resnet_pipeline.clustering.feature_processing.run_reduction,params_resnet_pipeline.clustering.k_selection.method,params_resnet_pipeline.image_preprocessing.blur_kernel_size,params_resnet_pipeline.image_preprocessing.clahe_clip_limit,params_resnet_pipeline.image_preprocessing.sobel_kernel_size,params_resnet_pipeline.image_preprocessing.use_clahe,params_resnet_pipeline.image_preprocessing.use_gaussian_blur,params_resnet_pipeline.image_preprocessing.use_grayscale,params_resnet_pipeline.image_preprocessing.use_sobel_edges,params_run_dino_pipeline,params_run_fusion_pipeline,params_run_resnet_pipeline,params_validator_settings.final_threshold,params_validator_settings.semantic_threshold,params_validator_settings.structural_threshold,params_validator_settings.weights.clip_confidence,params_validator_settings.weights.dino_iou,params_validator_settings.weights.resnet_iou,state,user_attrs_error,user_attrs_max_clip_confidence,user_attrs_num_correct_segments
160,0.0,spectral,37,z-score,pca,64,False,True,heuristic,transformer.resblocks.10,ViT-B/32,blocks.11,dinov2_vitb14,layer4,resnet50,structural,0.007581235305071408,0.67469658156345,True,50,8,0.8494444451008337,0.978719004673173,28,4,0.6989717333971394,2.2305059507548903,facebook/sam2-hiera-large,mean,0.34583037639340086,5,graph,22,l2,pca,29,True,False,heuristic,3.0,2.3338218388077587,3,True,True,False,True,True,True,False,0.554740552675152,0.6237268229518809,0.4834475875039347,0.039646811998287346,0.0003145749963801162,0.6415747202346394,COMPLETE,,0.0,0.0
161,0.0,graph,33,l2,svd,52,True,False,silhouette,transformer.resblocks.11,ViT-B/32,blocks.7,dinov2_vitb14,layer3,resnet50,semantic,0.0011878074394787682,0.7005019004683155,False,50,32,0.955534299429262,0.9534466284769664,21,4,0.8798388768665057,1.8552821864223572,facebook/sam2-hiera-large,median,0.28483032901741107,5,kmeans,33,z-score,svd,24,False,True,silhouette,7.0,1.333600957069648,5,False,True,True,False,False,False,False,0.6698750171077166,0.558238266978349,0.5929263009370772,0.845129530349181,0.5207968906418889,0.5401394160291915,COMPLETE,,0.0,0.0
162,0.0,graph,27,z-score,pca,46,False,True,heuristic,transformer.resblocks.9,ViT-B/32,blocks.11,dinov2_vitb14,conv1,resnet50,semantic,0.00978477203675111,0.7792524723812304,True,50,32,0.9692618059502026,0.9583135231109264,24,3,1.079140415859285,2.471360396556822,facebook/sam2-hiera-large,top_k_mean,0.32943836243782265,5,kmeans,17,root-norm,pca,29,False,False,heuristic,3.0,3.2062146060350365,3,True,True,False,True,True,False,False,0.564242257885015,0.591961186034781,0.5705337706231304,0.9635448472356509,0.9573277642460388,0.0011660932723751155,COMPLETE,,0.0,0.0
163,0.0,graph,30,z-score,pca,45,False,True,heuristic,transformer.resblocks.9,ViT-B/32,blocks.11,dinov2_vitb14,conv1,resnet50,semantic,0.009601926409706677,0.7700390524949821,True,50,32,0.9336174787470336,0.9552890678939563,24,3,1.0324129530347488,2.4015079872201306,facebook/sam2-hiera-large,top_k_mean,0.4871868803243115,5,kmeans,29,root-norm,pca,32,False,False,heuristic,3.0,2.451065933839685,3,True,True,False,True,True,False,False,0.5251793720731445,0.6355345857435842,0.6981898699749713,0.9760869201620185,0.9969825783609007,0.22771573306235793,COMPLETE,,0.0,0.0
164,0.0,graph,29,z-score,pca,43,False,True,heuristic,transformer.resblocks.9,ViT-B/32,blocks.11,dinov2_vitb14,conv1,resnet50,semantic,0.009880246710016279,0.7527509411568085,True,50,32,0.8128670824787397,0.9601988416965498,25,2,0.6632788085325004,2.5437939054199856,facebook/sam2-hiera-large,top_k_mean,0.3512262206767672,5,kmeans,27,root-norm,pca,33,False,False,heuristic,3.0,2.5864129692738467,3,True,True,False,True,True,False,False,0.5119701618259361,0.5847323190772631,0.5441463194316657,0.9050290494659996,0.9708535330341823,0.2474581108317763,COMPLETE,,0.0,0.0
165,0.0,graph,28,z-score,pca,50,False,True,heuristic,transformer.resblocks.9,ViT-B/32,blocks.11,dinov2_vitb14,conv1,resnet50,semantic,0.009505810403753197,0.6836214448587897,True,50,32,0.9549556839683255,0.9512971293492026,25,4,1.001100255983969,1.5828512887461057,facebook/sam2-hiera-large,top_k_mean,0.3341918325893643,5,kmeans,26,root-norm,pca,30,False,False,heuristic,3.0,3.671136448437806,3,True,True,False,True,True,False,False,0.6850707180809757,0.5747899764230749,0.5578009162923911,0.9416105165810763,0.9130777456602516,0.3486131401301156,COMPLETE,,0.0,0.0
166,0.0,kmeans,39,z-score,pca,47,False,True,heuristic,transformer.resblocks.9,ViT-B/32,blocks.4,dinov2_vitb14,conv1,resnet50,semantic,0.009324687947127252,0.789723372368275,True,50,8,0.8421756466158479,0.9329358229643722,26,3,1.1776631762393899,2.201260751911917,facebook/sam2-hiera-large,top_k_mean,0.3981848821073957,3,spectral,29,root-norm,umap,27,False,False,heuristic,,4.137880717780767,3,True,False,False,True,True,False,True,0.5113721762903134,0.6097961130582249,0.41727990221263733,0.39568941865793683,0.7732206144031023,0.2650091324727565,COMPLETE,,0.0,0.0
167,0.0,graph,33,root-norm,svd,37,True,False,silhouette,transformer.resblocks.9,ViT-B/32,blocks.11,dinov2_vitb14,layer2,resnet50,structural,0.007202816185885968,0.8080419918619186,True,100,16,0.9086552153576476,0.9145317285672476,23,2,1.0972210258488027,2.269344544929837,facebook/sam2-hiera-large,median,0.3064183867078799,5,graph,21,z-score,pca,18,True,True,heuristic,5.0,2.835084406192408,3,True,True,True,True,True,True,False,0.6979071430295261,0.5995124090978302,0.4588361314374689,0.0975310403619118,0.22002389936696015,0.7579494694238583,COMPLETE,,0.0,0.0
168,0.0,graph,36,z-score,pca,25,False,True,heuristic,transformer.resblocks.9,ViT-B/32,blocks.4,dinov2_vitb14,layer1,resnet50,semantic,0.009068427663290484,0.7406326071815436,False,50,32,0.8209526443109955,0.9560415980005904,30,4,0.5248855730067,2.345421757399824,facebook/sam2-hiera-large,mean,0.17028128249853783,3,kmeans,14,root-norm,pca,41,False,False,silhouette,3.0,2.3943586651390283,5,True,True,False,True,False,False,False,0.7980702730805466,0.6278145611174605,0.5132766461757339,0.9906259198283298,0.30376553605573875,0.2960285221360971,COMPLETE,,0.0,0.0
169,0.0,spectral,35,l2,umap,39,True,True,silhouette,transformer.resblocks.10,ViT-B/32,blocks.11,dinov2_vitb14,layer3,resnet50,semantic,0.002029953282571513,0.7613952468756611,True,200,8,0.961620530365666,0.9636035869417093,26,3,1.016417351740432,2.6943420141783534,facebook/sam2-hiera-large,top_k_mean,0.11103075541816397,5,graph,23,l2,svd,59,True,False,heuristic,,1.168816162636599,3,False,False,False,True,True,True,True,0.504651074596352,0.5326706733326642,0.5356610510832925,0.7010785464079838,0.9546021221326634,0.785496558258626,COMPLETE,,0.0,0.0
170,0.0,graph,17,z-score,pca,22,False,False,heuristic,transformer.resblocks.11,ViT-B/32,blocks.4,dinov2_vitb14,conv1,resnet50,semantic,0.004252990476329274,0.8149496495928175,False,50,32,0.9149879380839139,0.9301276113265681,16,4,1.0571121315687417,2.754793946406135,facebook/sam2-hiera-large,median,0.3701476646028712,5,kmeans,25,z-score,umap,46,False,True,heuristic,3.0,4.785305094919822,3,True,True,True,False,False,False,False,0.6421310789884133,0.7385139415040106,0.6409583426045775,0.8952710707715352,0.14340986396991598,0.5103066827680365,COMPLETE,,0.0,0.0
171,0.0,kmeans,29,z-score,svd,44,True,True,silhouette,transformer.resblocks.9,ViT-B/32,blocks.7,dinov2_vitb14,layer1,resnet50,structural,0.009951885917032872,0.7311688960244588,True,50,8,0.9767830740194753,0.9276349147740526,17,2,1.13836073952462,2.9397867125512698,facebook/sam2-hiera-large,top_k_mean,0.21792395944580475,3,spectral,10,root-norm,pca,31,True,False,silhouette,3.0,2.070645018967857,5,True,True,False,True,True,True,False,0.7206271588972827,0.4032425004234897,0.6191608235724643,0.5222395695083406,0.9842034632475933,0.7203751375815411,COMPLETE,,0.0,0.0
172,0.0,graph,38,z-score,umap,33,True,True,silhouette,transformer.resblocks.9,ViT-B/32,blocks.4,dinov2_vitb14,layer1,resnet50,semantic,0.006569110999035721,0.6498165991980699,False,50,32,0.8954410189397863,0.9368586279426393,29,4,0.7644328244793921,2.109860821956712,facebook/sam2-hiera-large,median,0.22557139356236408,5,kmeans,16,z-score,umap,38,True,False,heuristic,3.0,3.00404761706281,3,True,True,True,True,False,True,False,0.7263018051605702,0.697360891801869,0.49000806346144704,0.7917811102149166,0.5329237326810046,0.9987179021653709,COMPLETE,,0.0,0.0
173,0.0,graph,37,z-score,umap,36,True,True,silhouette,transformer.resblocks.9,ViT-B/32,blocks.4,dinov2_vitb14,layer1,resnet50,semantic,0.006883522393440957,0.6287555466385568,False,50,32,0.8915781884843863,0.9616693575776192,28,4,0.7897369680322567,1.7891208425033842,facebook/sam2-hiera-large,median,0.2710821066928828,5,kmeans,15,z-score,umap,37,True,False,heuristic,3.0,2.2729863496168523,3,True,True,True,True,False,True,False,0.7319785791553387,0.6814996255531146,0.46914872819284126,0.737446179274014,0.49098922803805106,0.596133796432669,COMPLETE,,0.0,0.0
174,0.0,graph,24,z-score,umap,34,True,True,silhouette,transformer.resblocks.9,ViT-B/32,blocks.4,dinov2_vitb14,layer1,resnet50,semantic,0.0015577851678682943,0.664769044585098,False,50,32,0.9121017764706917,0.9389338989281969,29,4,0.8165634288461558,1.9753124510574664,facebook/sam2-hiera-large,median,0.24020709893615677,5,kmeans,14,z-score,umap,34,True,False,heuristic,3.0,1.6045664358157976,3,True,True,True,True,False,True,False,0.7502459743395932,0.6521139620788627,0.442460338061509,0.8641272837582638,0.0712295752411898,0.9450094972229494,COMPLETE,,0.0,0.0
175,0.0,graph,28,z-score,umap,42,True,True,silhouette,transformer.resblocks.9,ViT-B/32,blocks.4,dinov2_vitb14,layer1,resnet50,semantic,0.006224230411816259,0.6921946428680638,False,50,32,0.9201406621360951,0.9063075479008655,30,4,0.7472989130526227,2.1509755469109897,facebook/sam2-hiera-large,median,0.2495454245259174,5,kmeans,13,z-score,umap,36,True,False,heuristic,7.0,1.7695355363604037,3,True,True,True,True,False,True,False,0.5786818542519467,0.4151377083026563,0.4946958510261901,0.7761793643419388,0.5507883643875652,0.05839694966381488,COMPLETE,,0.0,0.0
176,0.0,graph,13,root-norm,pca,62,True,False,heuristic,transformer.resblocks.9,ViT-B/32,blocks.11,dinov2_vitb14,layer4,resnet50,semantic,0.006719795707522684,0.6581791789723523,False,50,16,0.9043969393066277,0.9205208375948247,28,4,0.7762801941738613,2.0183528955320096,facebook/sam2-hiera-large,median,0.19703199991893033,5,kmeans,28,z-score,umap,35,True,True,heuristic,5.0,1.435497501525082,3,False,True,True,True,False,True,True,0.7415900043821313,0.6683606333842229,0.4566351076993337,0.8082635905740088,0.8970903966606962,0.14977782068325285,COMPLETE,,0.0,0.0
177,0.0,graph,39,z-score,svd,35,False,True,silhouette,transformer.resblocks.9,ViT-B/32,blocks.4,dinov2_vitb14,layer2,resnet50,semantic,0.006454103845163734,0.6212057114334513,True,100,32,0.9737146938943512,0.9228457980440272,22,4,0.7184062340026997,2.0741407197627977,facebook/sam2-hiera-large,mean,0.12566752301437162,5,graph,17,l2,svd,43,False,False,heuristic,,2.1624088455903734,3,True,False,True,True,False,False,False,0.7074180210912469,0.6587874321881211,0.7234822497512486,0.6356207062057028,0.9361892466149022,0.4786054852145724,COMPLETE,,0.0,0.0
178,0.0,graph,18,l2,umap,49,True,True,heuristic,transformer.resblocks.11,ViT-B/32,blocks.11,dinov2_vitb14,conv1,resnet50,structural,0.005857177351314077,0.679946673843242,False,200,32,0.8748517310873007,0.9424896432093437,29,3,0.8343463415423614,1.664095194288813,facebook/sam2-hiera-large,top_k_mean,0.31790606492513984,3,kmeans,12,root-norm,umap,52,True,False,silhouette,3.0,3.9701370072485758,3,True,True,False,False,True,True,False,0.6769218624142946,0.6466714002372645,0.48146161566678825,0.6164620712402299,0.4142047155519448,0.2833138743458935,COMPLETE,,0.0,0.0
179,0.0,kmeans,36,z-score,pca,23,False,False,silhouette,transformer.resblocks.9,ViT-B/32,blocks.4,dinov2_vitb14,layer1,resnet50,semantic,0.007328386984815986,0.7834715689553022,True,50,8,0.8871524570494125,0.9318600598005332,27,2,1.1621913198080254,2.5731724335545314,facebook/sam2-hiera-large,median,0.20732648483199884,5,graph,15,z-score,pca,62,False,True,heuristic,3.0,3.353284554969962,5,True,True,True,True,False,False,True,0.6062128406856396,0.5225604386127911,0.7150834437988918,0.18805307541454497,0.4704594210677711,0.10238937998822584,COMPLETE,,0.0,0.0
180,0.0,spectral,16,z-score,pca,52,True,True,heuristic,transformer.resblocks.9,ViT-B/32,blocks.7,dinov2_vitb14,layer3,resnet50,semantic,0.0070801274607001415,0.6011518734757997,False,50,16,0.944628211976143,0.9749427669745505,30,4,0.8057683919320018,2.812614729942398,facebook/sam2-hiera-large,top_k_mean,0.40712017489122837,3,spectral,18,root-norm,umap,56,True,False,heuristic,3.0,3.57518769006288,3,False,True,False,True,True,True,False,0.6341143148047752,0.6164954256598584,0.5865717898153626,0.06528564833979068,0.5763096133221641,0.5543570277064241,COMPLETE,,0.0,0.0
181,0.0,graph,12,root-norm,svd,58,False,True,silhouette,transformer.resblocks.10,ViT-B/32,blocks.11,dinov2_vitb14,layer2,resnet50,semantic,0.0054709264288749235,0.7938726538039882,True,50,8,0.8680449473618546,0.9404353429152085,23,4,1.0427376202958794,2.456806689559946,facebook/sam2-hiera-large,median,0.4272389249637478,5,kmeans,24,z-score,svd,49,False,False,silhouette,,4.052877804819395,3,True,False,True,False,False,False,False,0.6969605176685751,0.5432348362854623,0.7444409374846545,0.23551610695016592,0.34397089060972735,0.8560345959262419,COMPLETE,,0.0,0.0
182,0.0,spectral,15,l2,pca,56,True,True,silhouette,transformer.resblocks.11,ViT-B/32,blocks.11,dinov2_vitb14,conv1,resnet50,structural,0.004737129024161203,0.8094781275722116,False,200,8,0.8827358495331874,0.9164395432452546,28,4,0.547133528444854,2.779444781220243,facebook/sam2-hiera-large,top_k_mean,0.41600830831254565,5,graph,21,root-norm,umap,47,True,False,heuristic,,3.4734563021706113,5,False,False,False,False,True,False,False,0.6446733623433538,0.55503145041723,0.6151854960207185,0.6766216717900407,0.6876830295793119,0.3065220403766352,COMPLETE,,0.0,0.0
183,0.0,spectral,22,l2,pca,54,True,True,silhouette,transformer.resblocks.11,ViT-B/32,blocks.11,dinov2_vitb14,conv1,resnet50,structural,0.004009714514733643,0.8044279156933472,False,200,8,0.9498577715474827,0.9037770474169254,27,4,0.6826035082064947,2.8563570286042554,facebook/sam2-hiera-large,top_k_mean,0.23539317339488694,5,graph,19,root-norm,umap,48,True,False,heuristic,,3.913596036536177,5,False,False,False,False,True,False,False,0.6494265009861393,0.5372739813007859,0.5773843906395865,0.5789474874742316,0.7105701812611653,0.3505552043863572,COMPLETE,,0.0,0.0
184,0.0,spectral,11,l2,pca,31,True,True,silhouette,transformer.resblocks.11,ViT-B/32,blocks.11,dinov2_vitb14,conv1,resnet50,structural,0.004550144376091771,0.848596193885145,False,200,8,0.8557945426927642,0.9102433247601999,29,4,0.9477517292926984,1.9110206488173045,facebook/sam2-hiera-large,top_k_mean,0.4473312387399191,5,graph,20,root-norm,umap,21,True,False,heuristic,,1.8768184955186935,5,False,False,False,False,True,False,False,0.6595152913196431,0.5489748788955361,0.5964366211446888,0.649269290879106,0.6256203373788001,0.3264764535082261,COMPLETE,,0.0,0.0
185,0.0,spectral,20,l2,pca,60,True,True,silhouette,transformer.resblocks.11,ViT-B/32,blocks.11,dinov2_vitb14,conv1,resnet50,structural,0.00608162013854466,0.7976024579282812,False,200,8,0.8582398172417026,0.9178274475027526,29,4,0.65892953429781,2.6575244668863367,facebook/sam2-hiera-large,top_k_mean,0.2586508653454593,5,graph,39,root-norm,umap,46,True,False,heuristic,,3.7816984125033923,5,False,False,False,False,True,False,False,0.7577170050627884,0.6331986903007264,0.6225516437848748,0.03634387280733298,0.7581681153491209,0.2883212074001325,COMPLETE,,0.0,0.0
186,-1.0,graph,34,l2,pca,63,True,False,heuristic,transformer.resblocks.11,ViT-B/32,blocks.4,dinov2_vitb14,layer4,resnet50,structural,0.004974362100696185,0.6534752190348682,False,200,32,0.8529952643747897,0.9660851411802488,15,4,0.6891587217682225,2.7175360227528147,facebook/sam2-hiera-large,mean,0.4948192150168869,5,graph,16,l2,pca,50,True,True,heuristic,7.0,4.9475868475877025,5,False,True,False,True,True,True,True,0.691046188853462,0.48975237580171815,0.6116801704998548,0.6181474311069074,0.2885410962270133,0.3869152320633788,COMPLETE,"ValueError: n_components=50 must be between 0 and min(n_samples, n_features)=49 with svd_solver='full'",0.0,0.0
187,0.0,spectral,27,z-score,svd,53,False,True,silhouette,transformer.resblocks.9,ViT-B/32,blocks.11,dinov2_vitb14,layer1,resnet50,semantic,0.0034910930231880333,0.7240575972248471,True,100,8,0.8039107253242064,0.9570209977437091,28,2,0.7057461357197881,2.886530816598654,facebook/sam2-hiera-large,top_k_mean,0.1382730462935367,3,graph,19,root-norm,umap,32,True,False,heuristic,,2.5246611280744675,3,True,False,False,False,False,False,False,0.6670819300155759,0.5266928617284657,0.6020130742667931,0.7062162948780293,0.5170962736076394,0.6699927246689327,COMPLETE,,0.0,0.0
188,0.0,kmeans,21,z-score,pca,59,True,False,heuristic,transformer.resblocks.10,ViT-B/32,blocks.7,dinov2_vitb14,conv1,resnet50,structural,0.009626160519499154,0.6374789495163377,False,50,32,0.863103272343313,0.9528451172924838,18,3,0.8723870384812049,2.9136215425740835,facebook/sam2-hiera-large,median,0.4620012372582433,5,kmeans,17,z-score,svd,55,False,False,silhouette,5.0,1.5166028912445368,3,True,True,True,True,True,False,False,0.6154582227067038,0.697088251071292,0.42571125695771683,0.15117576273751449,0.6579649474549593,0.9718530623922632,COMPLETE,,0.0,0.0
189,0.0,graph,40,z-score,umap,57,False,True,silhouette,transformer.resblocks.9,ViT-B/32,blocks.4,dinov2_vitb14,layer1,resnet50,semantic,0.009414508735255548,0.7663155113019012,True,50,8,0.9788545595912745,0.9135009736292623,20,4,0.8539053104790146,2.3755419398729107,facebook/sam2-hiera-large,top_k_mean,0.4418157141545295,5,spectral,22,root-norm,pca,44,True,True,heuristic,3.0,1.2810390638347349,5,True,True,False,True,True,True,True,0.6551895469758182,0.6408807783394411,0.6323793834710282,0.6858953108849539,0.7237716120061972,0.7026432703855193,COMPLETE,,0.0,0.0
190,0.0,graph,38,l2,pca,51,True,True,heuristic,transformer.resblocks.11,ViT-B/32,blocks.11,dinov2_vitb14,layer2,resnet50,semantic,0.00849823898838188,0.8304793252599644,False,200,16,0.8454719912677618,0.9500517971142758,25,4,0.6712458991253236,2.3017256593313005,facebook/sam2-hiera-large,median,0.2938098313139177,3,graph,40,z-score,umap,48,False,False,heuristic,,4.37574150395317,3,False,False,True,True,False,False,False,0.7141276602217239,0.5641816499420816,0.645674221859064,0.6052288482441757,0.3683468961383049,0.1938627416555958,COMPLETE,,0.0,0.0
191,0.0,spectral,30,root-norm,svd,21,False,False,silhouette,transformer.resblocks.9,ViT-B/32,blocks.4,dinov2_vitb14,conv1,resnet50,structural,0.0016676545666361024,0.8219268422557869,False,100,32,0.9708622150910748,0.9338360104706986,30,3,0.578356062484874,1.6362859364134454,facebook/sam2-hiera-large,mean,0.4837034326793908,5,kmeans,13,l2,umap,31,True,True,silhouette,3.0,2.913219363898581,3,True,True,False,False,True,True,False,0.5948384953326942,0.5172233116707147,0.5505360671363774,0.2760183808832654,0.3196657083003047,0.0229458122472346,COMPLETE,,0.0,0.0
192,0.0,kmeans,31,root-norm,pca,47,False,True,heuristic,transformer.resblocks.10,ViT-B/32,blocks.7,dinov2_vitb14,layer3,resnet50,semantic,0.00308181089083127,0.7287919555788362,True,100,16,0.8089666137142374,0.9017377453552369,22,4,0.9080002948221848,1.5446218024130582,facebook/sam2-hiera-large,mean,0.1773859169407148,5,spectral,10,l2,pca,25,False,False,heuristic,7.0,3.082152888842652,3,True,True,True,True,False,True,False,0.6017665889421789,0.44793629445611965,0.6831968460824001,0.29902836289344104,0.20702097676585532,0.45136497795191305,COMPLETE,,0.0,0.0
